,text_surronding,Gender
Sand-George_Monsieur-Sylvestre_<une femme-3663>_103654,"pleurent à volonté , et vous êtes trop franche et",Female
Sand-George_Monsieur-Sylvestre_<une femme-3663>_103671,". - Écoutez ! dit - elle , ne me",Female
Sand-George_Monsieur-Sylvestre_<une femme-3663>_103675,"dit - elle , ne me jugez pas sur les",Female
Sand-George_Monsieur-Sylvestre_<une femme-3663>_103690,du vrai dans ce que vous avez dit ; mais,Female
Sand-George_Monsieur-Sylvestre_<une femme-3663>_103695,vous avez dit ; mais vous ne savez pas ce,Female
Sand-George_Monsieur-Sylvestre_<une femme-3663>_103701,ne savez pas ce que je pense . Si je,Female
Sand-George_Monsieur-Sylvestre_<une femme-3663>_103705,que je pense . Si je me suis prêtée à,Female
Sand-George_Monsieur-Sylvestre_<une femme-3663>_103713,prêtée à une comédie dont vous n' avez pas été,Female
Sand-George_Monsieur-Sylvestre_<une femme-3663>_103720,"avez pas été dupe , mes motifs ne sont pas",Female
Sand-George_Monsieur-Sylvestre_<une femme-3663>_103727,ne sont pas ceux que vous supposez . Il est,Female
Sand-George_Monsieur-Sylvestre_<une femme-3663>_103734,. Il est certain que je ne vous aime pas,Female
Sand-George_Monsieur-Sylvestre_<une femme-3663>_103736,est certain que je ne vous aime pas ; mais,Female
Sand-George_Monsieur-Sylvestre_<une femme-3663>_103744,; mais on a voulu me faire croire que vous,Female
Sand-George_Monsieur-Sylvestre_<une femme-3663>_103748,"voulu me faire croire que vous m' aimiez , et",Female
Sand-George_Monsieur-Sylvestre_<une femme-3663>_103749,"me faire croire que vous m' aimiez , et pendant",Female
Sand-George_Monsieur-Sylvestre_<une femme-3663>_103756,", et pendant quelques jours je l' ai cru .",Female
Sand-George_Monsieur-Sylvestre_<une femme-3663>_103761,"je l' ai cru . Mon grand - père ,",Female
Sand-George_Monsieur-Sylvestre_<une femme-3663>_103779,"Duport , tous ceux qui m' entouraient s' efforçaient de",Female
Sand-George_Monsieur-Sylvestre_<une femme-3663>_103793,de l' autre . Il me semblait voir que vous,Female
Sand-George_Monsieur-Sylvestre_<une femme-3663>_103797,Il me semblait voir que vous n' aviez pour moi,Female
Sand-George_Monsieur-Sylvestre_<une femme-3663>_103801,que vous n' aviez pour moi que de l' antipathie,Female
Sand-George_Monsieur-Sylvestre_<une femme-3663>_103807,"que de l' antipathie ; je le disais , on",Female
Sand-George_Monsieur-Sylvestre_<une femme-3663>_103812,"je le disais , on me répondait que vous étiez",Female
Sand-George_Monsieur-Sylvestre_<une femme-3663>_103815,", on me répondait que vous étiez furieux de m'",Female
Sand-George_Monsieur-Sylvestre_<une femme-3663>_103819,que vous étiez furieux de m' aimer et que vous,Female
Sand-George_Monsieur-Sylvestre_<une femme-3663>_103823,de m' aimer et que vous m' aimiez d' autant,Female
Sand-George_Monsieur-Sylvestre_<une femme-3663>_103824,m' aimer et que vous m' aimiez d' autant plus,Female
Sand-George_Monsieur-Sylvestre_<une femme-3663>_103831,d' autant plus . Cela m' a peut - être,Female
Sand-George_Monsieur-Sylvestre_<une femme-3663>_103849,", un peu curieuse ; vous pouvez bien me le",Female
Sand-George_Monsieur-Sylvestre_<une femme-3663>_103852,"curieuse ; vous pouvez bien me le pardonner , on",Female
Sand-George_Monsieur-Sylvestre_<une femme-3663>_103857,"me le pardonner , on me faisait perdre la tête",Female
Sand-George_Monsieur-Sylvestre_<une femme-3663>_103863,faisait perdre la tête ; je sentais qu' on me,Female
Sand-George_Monsieur-Sylvestre_<une femme-3663>_103867,; je sentais qu' on me poussait peut - être,Female
Sand-George_Monsieur-Sylvestre_<une femme-3663>_103880,rôle ridicule et déplacé ; j' avais des moments de,Female
Sand-George_Monsieur-Sylvestre_<une femme-3663>_103896,. Enfin tout à coup j' ai cru voir que,Female
Sand-George_Monsieur-Sylvestre_<une femme-3663>_103901,"j' ai cru voir que vous aimiez mademoiselle Vallier ,",Female
Sand-George_Monsieur-Sylvestre_<une femme-3663>_103906,"vous aimiez mademoiselle Vallier , je le lui ai dit",Female
Sand-George_Monsieur-Sylvestre_<une femme-3663>_103917,elle l' a nié ; je lui ai reproché de,Female
Sand-George_Monsieur-Sylvestre_<une femme-3663>_103922,"je lui ai reproché de me tromper , nous nous",Female
Sand-George_Monsieur-Sylvestre_<une femme-3663>_103930,nous nous sommes fâchées . J' ai quitté la Tilleraie,Female
Sand-George_Monsieur-Sylvestre_<une femme-3663>_103944,tout le monde et de moi un peu ; j',Female
Sand-George_Monsieur-Sylvestre_<une femme-3663>_103948,de moi un peu ; j' y reviens aujourd' hui,Female
Sand-George_Monsieur-Sylvestre_<une femme-3663>_103972,"M . Nunez , on me propose l' équipée que",Female
Sand-George_Monsieur-Sylvestre_<une femme-3663>_103977,"me propose l' équipée que je viens de faire ,",Female
Sand-George_Monsieur-Sylvestre_<une femme-3663>_103983,"viens de faire , en me promettant qu' on ne",Female
Sand-George_Monsieur-Sylvestre_<une femme-3663>_103988,me promettant qu' on ne me perdra pas de vue,Female
Sand-George_Monsieur-Sylvestre_<une femme-3663>_103999,". . - Permettez , lui dis - je en",Female
Sand-George_Monsieur-Sylvestre_<une femme-3663>_104001,"- Permettez , lui dis - je en l' interrompant",Female
Sand-George_Monsieur-Sylvestre_<une femme-3663>_104004,lui dis - je en l' interrompant ; est -,Female
Sand-George_Monsieur-Sylvestre_<une femme-3663>_104020,entend - on ce que vous me dites ? -,Female
Sand-George_Monsieur-Sylvestre_<une femme-3663>_104021,- on ce que vous me dites ? - Je,Female
Sand-George_Monsieur-Sylvestre_<une femme-3663>_104025,vous me dites ? - Je n' en sais rien,Female
Sand-George_Monsieur-Sylvestre_<une femme-3663>_104035,", mais peu importe , je suis résolue à tout",Female
Sand-George_Monsieur-Sylvestre_<une femme-3663>_104042,"résolue à tout braver , je veux savoir la vérité",Female
Sand-George_Monsieur-Sylvestre_<une femme-3663>_104053,C' est pour cela que je me suis prêtée à,Female
Sand-George_Monsieur-Sylvestre_<une femme-3663>_104061,prêtée à leur fantaisie ; j' ai cru deviner que,Female
Sand-George_Monsieur-Sylvestre_<une femme-3663>_104073,Nunez était affreusement jaloux de vous et qu' il voulait,Female
Sand-George_Monsieur-Sylvestre_<une femme-3663>_104078,vous et qu' il voulait me compromettre pour vous engager,Female
Sand-George_Monsieur-Sylvestre_<une femme-3663>_104081,il voulait me compromettre pour vous engager avec moi .,Female
Sand-George_Monsieur-Sylvestre_<une femme-3663>_104084,compromettre pour vous engager avec moi . Je me suis,Female
Sand-George_Monsieur-Sylvestre_<une femme-3663>_104086,vous engager avec moi . Je me suis dit :,Female
Sand-George_Monsieur-Sylvestre_<une femme-3663>_104102,clair dans une intrigue où je sers de jouet à,Female
Sand-George_Monsieur-Sylvestre_<une femme-3663>_104111,à ceux qui se disent mes meilleurs amis . Je,Female
Sand-George_Monsieur-Sylvestre_<une femme-3663>_104115,disent mes meilleurs amis . Je verrai M . Sorède,Female
Sand-George_Monsieur-Sylvestre_<une femme-3663>_104121,"verrai M . Sorède , je lui parlerai sans qu'",Female
Sand-George_Monsieur-Sylvestre_<une femme-3663>_104128,"parlerai sans qu' on ose m' interrompre , je lui",Female
Sand-George_Monsieur-Sylvestre_<une femme-3663>_104131,"on ose m' interrompre , je lui demanderai une franchise",Female
Sand-George_Monsieur-Sylvestre_<une femme-3663>_104143,» Parlez donc ; aimez - vous mademoiselle Vallier ?,Female
Sand-George_Monsieur-Sylvestre_<une femme-3663>_104145,donc ; aimez - vous mademoiselle Vallier ? - Je,Female
Sand-George_Monsieur-Sylvestre_<une femme-3663>_104149,vous mademoiselle Vallier ? - Je n' ai pas à,Female
Sand-George_Monsieur-Sylvestre_<une femme-3663>_104159,répondre à une question que je ne vous ai pas,Female
Sand-George_Monsieur-Sylvestre_<une femme-3663>_104161,une question que je ne vous ai pas donné le,Female
Sand-George_Monsieur-Sylvestre_<une femme-3663>_104168,pas donné le droit de me faire . - Vous,Female
Sand-George_Monsieur-Sylvestre_<une femme-3663>_104172,de me faire . - Vous craignez d' être entendu,Female
Sand-George_Monsieur-Sylvestre_<une femme-3663>_104182,"? - Non , dis - je en élevant la",Female
Sand-George_Monsieur-Sylvestre_<une femme-3663>_104189,en élevant la voix ; je n' ai pas de,Female
Sand-George_Monsieur-Sylvestre_<une femme-3663>_104210,- Gédéon peut disposer de mes confidences . - Vous,Female
Sand-George_Monsieur-Sylvestre_<une femme-3663>_104214,de mes confidences . - Vous lui avez confié votre,Female
Sand-George_Monsieur-Sylvestre_<une femme-3663>_104218,"- Vous lui avez confié votre amour pour Aldine ,",Female
Sand-George_Monsieur-Sylvestre_<une femme-3663>_104240,"! - Alors , vous me le confiez , à",Female
Sand-George_Monsieur-Sylvestre_<une femme-3663>_104245,"me le confiez , à moi aussi ? - Oui",Female
Sand-George_Monsieur-Sylvestre_<une femme-3663>_104252,"? - Oui , puisque vous me dites que cela",Female
Sand-George_Monsieur-Sylvestre_<une femme-3663>_104253,"- Oui , puisque vous me dites que cela est",Female
Sand-George_Monsieur-Sylvestre_<une femme-3663>_104270,. - Aldine sait que vous l' aimez ? -,Female
Sand-George_Monsieur-Sylvestre_<une femme-3663>_104271,- Aldine sait que vous l' aimez ? - Non,Female
Sand-George_Monsieur-Sylvestre_<une femme-3663>_104286,doute seulement pas . - Vous me le jurez ?,Female
Sand-George_Monsieur-Sylvestre_<une femme-3663>_104287,seulement pas . - Vous me le jurez ? -,Female
Sand-George_Monsieur-Sylvestre_<une femme-3663>_104301,"- Alors , elle ne m' a pas trompée .",Female
Sand-George_Monsieur-Sylvestre_<une femme-3663>_104306,m' a pas trompée . J' ai été injuste envers,Female
Sand-George_Monsieur-Sylvestre_<une femme-3663>_104313,été injuste envers elle . Je vais lui en demander,Female
Sand-George_Monsieur-Sylvestre_<une femme-3663>_104321,en demander pardon . - Vous ferez bien . -,Female
Sand-George_Monsieur-Sylvestre_<une femme-3663>_104327,ferez bien . - Voulez - vous que je lui,Female
Sand-George_Monsieur-Sylvestre_<une femme-3663>_104330,- Voulez - vous que je lui dise que vous,Female
Sand-George_Monsieur-Sylvestre_<une femme-3663>_104334,que je lui dise que vous l' aimez ? -,Female
Sand-George_Monsieur-Sylvestre_<une femme-3663>_104339,vous l' aimez ? - J' y consens de tout,Female
Sand-George_Monsieur-Sylvestre_<une femme-3663>_104344,J' y consens de tout mon coeur ! - Ah,Female
Sand-George_Monsieur-Sylvestre_<une femme-3663>_104355,". . . Vraiment ? Jeanne , qui s' était",Female
Sand-George_Monsieur-Sylvestre_<une femme-3663>_104357,". Vraiment ? Jeanne , qui s' était rassise ,",Female
Sand-George_Monsieur-Sylvestre_<une femme-3663>_104370,"sans rien dire ; puis elle se leva , et",Female
Sand-George_Monsieur-Sylvestre_<une femme-3663>_104386,dans la voix : - Vous êtes un brave et,Female
Sand-George_Monsieur-Sylvestre_<une femme-3663>_104388,voix : - Vous êtes un brave et honnête garçon,Female
Sand-George_Monsieur-Sylvestre_<une femme-3663>_104396,honnête garçon ! Aldine est ma véritable amie . Elle,Female
Sand-George_Monsieur-Sylvestre_<une femme-3663>_104404,". Elle se sacrifiait pour moi , car je suis",Female
Sand-George_Monsieur-Sylvestre_<une femme-3663>_104407,"sacrifiait pour moi , car je suis sûre qu' elle",Female
Sand-George_Monsieur-Sylvestre_<une femme-3663>_104412,je suis sûre qu' elle vous aime . Eh bien,Female
Sand-George_Monsieur-Sylvestre_<une femme-3663>_104418,"aime . Eh bien , je lui dirai tout ce",Female
Sand-George_Monsieur-Sylvestre_<une femme-3663>_104432,nous dire . - On vous en empêchera . -,Female
Sand-George_Monsieur-Sylvestre_<une femme-3663>_104437,"vous en empêchera . - M' empêcher , moi ,",Female
Sand-George_Monsieur-Sylvestre_<une femme-3663>_104440,". - M' empêcher , moi , de faire ce",Female
Sand-George_Monsieur-Sylvestre_<une femme-3663>_104446,", de faire ce que je veux ? J' en",Female
Sand-George_Monsieur-Sylvestre_<une femme-3663>_104449,ce que je veux ? J' en défie l' univers,Female
Sand-George_Monsieur-Sylvestre_<une femme-3663>_104457,"l' univers ! Oh ! j' ai une volonté ,",Female
Sand-George_Monsieur-Sylvestre_<une femme-3663>_104466,", allez ! On ne me connaît pas . Je",Female
Sand-George_Monsieur-Sylvestre_<une femme-3663>_104470,ne me connaît pas . Je ne me connaissais pas,Female
Sand-George_Monsieur-Sylvestre_<une femme-3663>_104475,Je ne me connaissais pas moi - même avant ces,Female
Sand-George_Monsieur-Sylvestre_<une femme-3663>_104484,"ces derniers événements , qui m' ont prouvé que ma",Female
Sand-George_Monsieur-Sylvestre_<une femme-3663>_104488,qui m' ont prouvé que ma destinée dépendait de mon,Female
Sand-George_Monsieur-Sylvestre_<une femme-3663>_104492,que ma destinée dépendait de mon énergie . Elle est,Female
Sand-George_Monsieur-Sylvestre_<une femme-3663>_104499,". Elle est terrible , ma destinée ; mais je",Female
Sand-George_Monsieur-Sylvestre_<une femme-3663>_104503,", ma destinée ; mais je serai aussi terrible qu'",Female
Sand-George_Monsieur-Sylvestre_<une femme-3663>_104511,terrible qu' elle . Ne me croyez pas mauvaise pour,Female
Sand-George_Monsieur-Sylvestre_<une femme-3663>_104518,pas mauvaise pour cela . J' ai rompu en apparence,Female
Sand-George_Monsieur-Sylvestre_<une femme-3663>_104524,"ai rompu en apparence avec ma mère , mais nous",Female
Sand-George_Monsieur-Sylvestre_<une femme-3663>_104541,"- bien ; dès que je serai mariée , je",Female
Sand-George_Monsieur-Sylvestre_<une femme-3663>_104545,"que je serai mariée , je saurai l' imposer à",Female
Sand-George_Monsieur-Sylvestre_<une femme-3663>_104550,je saurai l' imposer à ma nouvelle famille et triompher,Female
Sand-George_Monsieur-Sylvestre_<une femme-3663>_104560,de toutes les circonstances . Je connais mon pouvoir à,Female
Sand-George_Monsieur-Sylvestre_<une femme-3663>_104562,les circonstances . Je connais mon pouvoir à présent !,Female
Sand-George_Monsieur-Sylvestre_<une femme-3663>_104567,mon pouvoir à présent ! J' ai essayé mes forces,Female
Sand-George_Monsieur-Sylvestre_<une femme-3663>_104570,présent ! J' ai essayé mes forces depuis quinze jours,Female
Sand-George_Monsieur-Sylvestre_<une femme-3663>_104578,quinze jours que l' on me promène dans le beau,Female
Sand-George_Monsieur-Sylvestre_<une femme-3663>_104585,dans le beau monde . J' ai été affreusement coquette,Female
Sand-George_Monsieur-Sylvestre_<une femme-3663>_104592,"été affreusement coquette , et je n' aurais qu' à",Female
Sand-George_Monsieur-Sylvestre_<une femme-3663>_104606,les jeunes fous à qui j' ai fait perdre la,Female
Sand-George_Monsieur-Sylvestre_<une femme-3663>_104614,perdre la tête ; mais je veux une très -,Female
Sand-George_Monsieur-Sylvestre_<une femme-3663>_104629,raisonnable . Vous voyez que je n' étais pas aussi,Female
Sand-George_Monsieur-Sylvestre_<une femme-3663>_104650,le faire croire . - Je ne l' ai jamais,Female
Sand-George_Monsieur-Sylvestre_<une femme-3663>_104670,", qu' importe ? Vous me connaissez maintenant ; je",Female
Sand-George_Monsieur-Sylvestre_<une femme-3663>_104674,"Vous me connaissez maintenant ; je suis ambitieuse , je",Female
Sand-George_Monsieur-Sylvestre_<une femme-3663>_104678,"; je suis ambitieuse , je dois l' être .",Female
Sand-George_Monsieur-Sylvestre_<une femme-3663>_104684,dois l' être . Si je ne l' étais pas,Female
Sand-George_Monsieur-Sylvestre_<une femme-3663>_104691,"l' étais pas , si je n' avais pas la",Female
Sand-George_Monsieur-Sylvestre_<une femme-3663>_104705,"de combattre le malheur de ma naissance , je serais",Female
Sand-George_Monsieur-Sylvestre_<une femme-3663>_104708,"malheur de ma naissance , je serais forcée d' être",Female
Sand-George_Monsieur-Sylvestre_<une femme-3663>_104717,être courtisane ou religieuse . Je ne serai ni l',Female
Sand-George_Monsieur-Sylvestre_<une femme-3663>_104727,une ni l' autre . Je serai riche et considérée,Female
Sand-George_Monsieur-Sylvestre_<une femme-3663>_104744,que c' est difficile . Je sais à présent que,Female
Sand-George_Monsieur-Sylvestre_<une femme-3663>_104777,"roman . On a voulu m' y jeter , je",Female
Sand-George_Monsieur-Sylvestre_<une femme-3663>_104781,"voulu m' y jeter , je m' insurge ; mais",Female
Sand-George_Monsieur-Sylvestre_<une femme-3663>_104789,; mais tout cela ne m' empêche pas d' être,Female
Sand-George_Monsieur-Sylvestre_<une femme-3663>_104797,"d' être bonne , et je veux être grande .",Female
Sand-George_Monsieur-Sylvestre_<une femme-3663>_104802,"je veux être grande . Tenez , donnez - moi",Female
Sand-George_Monsieur-Sylvestre_<une femme-3663>_104805,"grande . Tenez , donnez - moi la main ,",Female
Sand-George_Monsieur-Sylvestre_<une femme-3663>_104819,"partir de ce jour , vous avez en moi une",Female
Sand-George_Monsieur-Sylvestre_<une femme-3663>_104822,"jour , vous avez en moi une sincère amie .",Female
Sand-George_Monsieur-Sylvestre_<une femme-3663>_104823,", vous avez en moi une sincère amie . C'",Female
Sand-George_Monsieur-Sylvestre_<une femme-3663>_104827,moi une sincère amie . C' est moi qui vous,Female
Sand-George_Monsieur-Sylvestre_<une femme-3663>_104829,sincère amie . C' est moi qui vous marierai avec,Female
Sand-George_Monsieur-Sylvestre_<une femme-3663>_104830,amie . C' est moi qui vous marierai avec mademoiselle,Female
Sand-George_Monsieur-Sylvestre_<une femme-3663>_104831,. C' est moi qui vous marierai avec mademoiselle Vallier,Female
Sand-George_Monsieur-Sylvestre_<une femme-3663>_104837,"marierai avec mademoiselle Vallier , je vous en donne ma",Female
Sand-George_Monsieur-Sylvestre_<une femme-3663>_104838,"avec mademoiselle Vallier , je vous en donne ma parole",Female
Sand-George_Monsieur-Sylvestre_<une femme-3663>_104841,", je vous en donne ma parole , et ,",Female
Sand-George_Monsieur-Sylvestre_<une femme-3663>_104850,", si M . Gédéon vous cause quelque ennui ,",Female
Sand-George_Monsieur-Sylvestre_<une femme-3663>_104855,"vous cause quelque ennui , c' est moi qui vous",Female
Sand-George_Monsieur-Sylvestre_<une femme-3663>_104857,"quelque ennui , c' est moi qui vous vengerai .",Female
Sand-George_Monsieur-Sylvestre_<une femme-3663>_104858,"ennui , c' est moi qui vous vengerai . -",Female
Sand-George_Monsieur-Sylvestre_<une femme-3663>_104859,", c' est moi qui vous vengerai . - Comment",Female
Sand-George_Monsieur-Sylvestre_<une femme-3663>_104873,devenant sa femme . - Vous ? - C' est,Female
Sand-George_Monsieur-Sylvestre_<une femme-3663>_104881,C' est une résolution que j' ai prise ce matin,Female
Sand-George_Monsieur-Sylvestre_<une femme-3663>_104898,"soir . - Mais , pauvre enfant , vous ne",Female
Sand-George_Monsieur-Sylvestre_<une femme-3663>_104901,"Mais , pauvre enfant , vous ne l' aimez pas",Female
Sand-George_Monsieur-Sylvestre_<une femme-3663>_104923,"sa passion pour Aldine , je me suis dit que",Female
Sand-George_Monsieur-Sylvestre_<une femme-3663>_104937,"à elle , mais à moi , d' inspirer cette",Female
Sand-George_Monsieur-Sylvestre_<une femme-3663>_104947,passion - là . - Vous ne craignez pas qu',Female
Sand-George_Monsieur-Sylvestre_<une femme-3663>_104954,craignez pas qu' il ne vous entende ? - Non,Female
Sand-George_Monsieur-Sylvestre_<une femme-3663>_104996,"Rébecca , qui a voulu me jouer et qui me",Female
Sand-George_Monsieur-Sylvestre_<une femme-3663>_105000,voulu me jouer et qui me le payera tôt ou,Female
Sand-George_Monsieur-Sylvestre_<une femme-3663>_105015,en attendant . - Dois - je vous reconduire auprès,Female
Sand-George_Monsieur-Sylvestre_<une femme-3663>_105017,. - Dois - je vous reconduire auprès d' eux,Female
Sand-George_Monsieur-Sylvestre_<une femme-3663>_105030,". Restez là , suivez - moi des yeux .",Female
Sand-George_Monsieur-Sylvestre_<une femme-3663>_105048,", on n' a pu vous voir . Je dirai",Female
Sand-George_Monsieur-Sylvestre_<une femme-3663>_105051,a pu vous voir . Je dirai que je ne,Female
Sand-George_Monsieur-Sylvestre_<une femme-3663>_105054,voir . Je dirai que je ne vous ai pas,Female
Sand-George_Monsieur-Sylvestre_<une femme-3663>_105056,Je dirai que je ne vous ai pas vu .,Female
Sand-George_Monsieur-Sylvestre_<une femme-3663>_105064,vu . - On ne vous croira pas . -,Female
Sand-George_Monsieur-Sylvestre_<une femme-3663>_105072,. - Pourquoi donc ? Mon cheval emporté pouvait passer,Female
Sand-George_Monsieur-Sylvestre_<une femme-3663>_105081,"passer devant votre maison , je pouvais gémir , frapper",Female
Sand-George_Monsieur-Sylvestre_<une femme-3663>_105088,"gémir , frapper même à votre porte . Vous dormiez",Female
Sand-George_Monsieur-Sylvestre_<une femme-3663>_105091,"même à votre porte . Vous dormiez profondément , ou",Female
Sand-George_Monsieur-Sylvestre_<une femme-3663>_105096,"Vous dormiez profondément , ou vous n' étiez pas chez",Female
Sand-George_Monsieur-Sylvestre_<une femme-3663>_105101,vous n' étiez pas chez vous . - Mais si,Female
Sand-George_Monsieur-Sylvestre_<une femme-3663>_105108,- Mais si l' on me demande ? . .,Female
Sand-George_Monsieur-Sylvestre_<une femme-3663>_105115,? . . . - Vous mentirez . Aimez -,Female
Sand-George_Monsieur-Sylvestre_<une femme-3663>_105119,- Vous mentirez . Aimez - vous mieux me compromettre,Female
Sand-George_Monsieur-Sylvestre_<une femme-3663>_105122,. Aimez - vous mieux me compromettre ? - Je,Female
Sand-George_Monsieur-Sylvestre_<une femme-3663>_105126,mieux me compromettre ? - Je mentirai . - Que,Female
Sand-George_Monsieur-Sylvestre_<une femme-3663>_105132,mentirai . - Que pensez - vous de moi ?,Female
Sand-George_Monsieur-Sylvestre_<une femme-3663>_105135,Que pensez - vous de moi ? - Beaucoup de,Female
Sand-George_Monsieur-Sylvestre_<une femme-3663>_105147,beaucoup de bien . - Vous ne m' épouseriez pour,Female
Sand-George_Monsieur-Sylvestre_<une femme-3663>_105149,bien . - Vous ne m' épouseriez pour rien au,Female
Sand-George_Monsieur-Sylvestre_<une femme-3663>_105170,au monde . - Mais vous pouvez être mon ami,Female
Sand-George_Monsieur-Sylvestre_<une femme-3663>_105173,- Mais vous pouvez être mon ami ? - Oui,Female
Sand-George_Monsieur-Sylvestre_<une femme-3663>_105180,"? - Oui , si vous écoutez quelquefois un bon",Female
Sand-George_Monsieur-Sylvestre_<une femme-3663>_105193,Nous verrons . Adieu ! Elle rassembla vivement les plis,Female
Sand-George_Monsieur-Sylvestre_<une femme-3663>_105199,"rassembla vivement les plis de son amazone , franchit lestement",Female
Sand-George_Monsieur-Sylvestre_<une femme-3663>_105202,"plis de son amazone , franchit lestement un petit fossé",Female
Sand-George_Monsieur-Sylvestre_<une femme-3663>_105214,"séparait de la prairie , coupa en droite ligne dans",Female
Sand-George_Monsieur-Sylvestre_<une femme-3663>_105225,"herbe humide , et se perdit dans la brume qui",Female
Sand-George_Monsieur-Sylvestre_<Toi-1402>_36569,d' étranges choses . - Toi ( il s' adressait,Male
Sand-George_Monsieur-Sylvestre_<Toi-1402>_36580,"moi ) , tu es le représentant des fourmis ,",Male
Sand-George_Monsieur-Sylvestre_<Toi-1402>_36590,et tu me pries de te recommander au grand Être,Male
Sand-George_Monsieur-Sylvestre_<Toi-1402>_36630,? N' a - t - elle pas la notion,Male
Sand-George_Monsieur-Sylvestre_<Toi-1402>_36649,? N' a - t - elle pas la prévoyance,Male
Sand-George_Monsieur-Sylvestre_<Toi-1402>_36683,"le courage ? Va , la fourmi est un grand",Male
Sand-George_Monsieur-Sylvestre_<Toi-1402>_36698,les hommes s' imaginent qu' elle n' a pas la,Male
Sand-George_Monsieur-Sylvestre_<Toi-1402>_36735,"qui les entoure , et tu ne dois pas les",Male
Sand-George_Monsieur-Sylvestre_<Toi-1402>_36761,dans le merveilleux intellect d' une fourmi . Ce serait,Male
Sand-George_Monsieur-Sylvestre_<Toi-1402>_36803,un homme malade . - Tu as peur de mourir,Male
Sand-George_Monsieur-Sylvestre_<Toi-1402>_36809,as peur de mourir ? lui disait - il ;,Male
Sand-George_Monsieur-Sylvestre_<Toi-1402>_36814,lui disait - il ; tu crois que ton âme,Male
Sand-George_Monsieur-Sylvestre_<Toi-1402>_36817,il ; tu crois que ton âme sera punie des,Male
Sand-George_Monsieur-Sylvestre_<Toi-1402>_36824,sera punie des erreurs de ton intelligence ? C' est,Male
Sand-George_Monsieur-Sylvestre_<Toi-1402>_36832,C' est possible ; mais tu n' en sauras rien,Male
Sand-George_Monsieur-Sylvestre_<Toi-1402>_36839,"en sauras rien , et tu revivras quand même avec",Male
Sand-George_Monsieur-Sylvestre_<Toi-1402>_36847,même avec l' espérance . Tu crains de comparaître devant,Male
Sand-George_Monsieur-Sylvestre_<Toi-1402>_36858,grand justicier ? Insensé ! tu ne le verras jamais,Male
Sand-George_Monsieur-Sylvestre_<Toi-1402>_36867,"jamais , car tel que tu le conçois il n'",Male
Sand-George_Monsieur-Sylvestre_<Toi-1402>_36925,"Et , comme mademoiselle Vallier l' engageait à se calmer",Male
Sand-George_Monsieur-Sylvestre_<Toi-1402>_36932,"à se calmer : - Je suis calme , répondit",Male
Sand-George_Monsieur-Sylvestre_<Toi-1402>_36937,"Je suis calme , répondit - il . Où sont",Male
Sand-George_Monsieur-Sylvestre_<Toi-1402>_36944,. Où sont ceux qui m' ont fait du mal,Male
Sand-George_Monsieur-Sylvestre_<Toi-1402>_36950,ont fait du mal ? Je ne les connais plus,Male
Sand-George_Monsieur-Sylvestre_<Toi-1402>_36956,"ne les connais plus , j' ai tout oublié .",Male
Sand-George_Monsieur-Sylvestre_<Toi-1402>_36961,j' ai tout oublié . Il s' est endormi paisible,Male
Sand-George_Monsieur-Sylvestre_<Toi-1402>_36972,"et , ce matin , il est tout à fait",Male
Sand-George_Monsieur-Sylvestre_<Toi-1402>_36982,hors de danger . Nous lui avons administré le fébrifuge,Male
Sand-George_Monsieur-Sylvestre_<Toi-1402>_37004,"chez elle ; mais , moi , quoi qu' on",Male
Sand-George_Monsieur-Sylvestre_<Toi-1402>_37010,", quoi qu' on puisse me dire , je ne",Male
Sand-George_Monsieur-Sylvestre_<Toi-1402>_37013,"on puisse me dire , je ne quitterai l' ermite",Male
Sand-George_Monsieur-Sylvestre_<Toi-1402>_37016,"dire , je ne quitterai l' ermite que quand il",Male
Sand-George_Monsieur-Sylvestre_<Toi-1402>_37020,quitterai l' ermite que quand il sera debout . Cette,Male
