,text_surronding
Albalat-Antoine_L-inassouvie-roman-intime_<ma-411>_13349,", elle se levait , prenait un coussin , m'"
Albalat-Antoine_L-inassouvie-roman-intime_<ma-411>_13355,"un coussin , m' en donnait des coups . –"
Albalat-Antoine_L-inassouvie-roman-intime_<ma-411>_13380,", à la fin , elle tombait , mourante de"
Albalat-Antoine_L-inassouvie-roman-intime_<ma-411>_13393,", agenouillée levant moi , elle me regardait , sérieusement"
Albalat-Antoine_L-inassouvie-roman-intime_<ma-411>_13405,", jusqu' à ce que l' eusse embrassée . C'"
Albalat-Antoine_L-inassouvie-roman-intime_<ma-411>_13409,que l' eusse embrassée . C' était presque une enfant
Albalat-Antoine_L-inassouvie-roman-intime_<ma-411>_13429,sincère n' avaient fait frémir son sang . Le mari
Albalat-Antoine_L-inassouvie-roman-intime_<ma-411>_13439,"n' avait jamais su animer cette femme , froide dans"
Albalat-Antoine_L-inassouvie-roman-intime_<ma-411>_13444,"cette femme , froide dans ses bras omme le marbre"
Albalat-Antoine_L-inassouvie-roman-intime_<ma-411>_13452,le marbre de Pygmalion . Elle s' éveillait l' un
Albalat-Antoine_L-inassouvie-roman-intime_<ma-411>_13460,"l' un long sommeil , commençait à vivre et s'"
Albalat-Antoine_L-inassouvie-roman-intime_<ma-411>_13465,commençait à vivre et s' éton - fait de se
Albalat-Antoine_L-inassouvie-roman-intime_<ma-411>_13487,abandon du désir réalisé et son egard une sensuelle expression
Albalat-Antoine_L-inassouvie-roman-intime_<ma-411>_13496,"expression de curiosité atisfaite . Sa paupière , frangée de"
Albalat-Antoine_L-inassouvie-roman-intime_<ma-411>_13515,", dans le recueillenent de ses pensées ; et ,"
Albalat-Antoine_L-inassouvie-roman-intime_<ma-411>_13522,"; et , tandis que ses lèvres ' entr' ouvraient"
Albalat-Antoine_L-inassouvie-roman-intime_<ma-411>_13538,"de petits oubresauts nerveux secouaient son corps , penant les"
Albalat-Antoine_L-inassouvie-roman-intime_<ma-411>_13548,heures d' immobile contemplation qu' elle vait à mes genoux
Albalat-Antoine_L-inassouvie-roman-intime_<ma-411>_13556,mes genoux . – Si mon mari m' avait aimée
Albalat-Antoine_L-inassouvie-roman-intime_<ma-411>_13558,". – Si mon mari m' avait aimée ainsi ,"
Albalat-Antoine_L-inassouvie-roman-intime_<ma-411>_13565,"aimée ainsi , me dit - le , jamais je"
Albalat-Antoine_L-inassouvie-roman-intime_<ma-411>_13569,"dit - le , jamais je ne l' aurais trompé"
Albalat-Antoine_L-inassouvie-roman-intime_<ma-411>_13577,aurais trompé ; mais il m' a laissé mes aspirations
Albalat-Antoine_L-inassouvie-roman-intime_<ma-411>_13580,"mais il m' a laissé mes aspirations , et elles"
Albalat-Antoine_L-inassouvie-roman-intime_<ma-411>_13585,"mes aspirations , et elles m' ont vaincue . Nous"
Albalat-Antoine_L-inassouvie-roman-intime_<ma-411>_13623,mal à propos . – Tu n' as pas langui
Albalat-Antoine_L-inassouvie-roman-intime_<ma-411>_13644,". – Si , dit - elle . – A"
Albalat-Antoine_L-inassouvie-roman-intime_<ma-411>_13651,. – A quoi as - tu passé le temps
Albalat-Antoine_L-inassouvie-roman-intime_<ma-411>_13657,tu passé le temps ?– Je suis allée chez Louise
Albalat-Antoine_L-inassouvie-roman-intime_<ma-411>_13668,tous les jours . Immédiatement ma jalousie me reprit .
Albalat-Antoine_L-inassouvie-roman-intime_<ma-411>_13670,jours . Immédiatement ma jalousie me reprit . – Partons
Albalat-Antoine_L-inassouvie-roman-intime_<ma-411>_13684,la fin du mois ? me demanda Marthe . –
Albalat-Antoine_L-inassouvie-roman-intime_<ma-411>_13686,du mois ? me demanda Marthe . – Plus que
Albalat-Antoine_L-inassouvie-roman-intime_<ma-411>_13704,"Près de Nice , à ma campagne . L' avant"
Albalat-Antoine_L-inassouvie-roman-intime_<ma-411>_13725,Joncières vint se promener avec moi . – Mon cher
Albalat-Antoine_L-inassouvie-roman-intime_<ma-411>_13732,"– Mon cher ami , me dit - il ,"
Albalat-Antoine_L-inassouvie-roman-intime_<ma-411>_13750,à causer en ville . Je me récriai . Il
Albalat-Antoine_L-inassouvie-roman-intime_<ma-411>_13755,Je me récriai . Il m' interrompit :– Croyez que
Albalat-Antoine_L-inassouvie-roman-intime_<ma-411>_13758,. Il m' interrompit :– Croyez que cela me contrarie
Albalat-Antoine_L-inassouvie-roman-intime_<ma-411>_13766,me contrarie beaucoup . mais vous savez . les petites
Albalat-Antoine_L-inassouvie-roman-intime_<ma-411>_13781,doutait pas que c' était moi qui lui donnais congé
Albalat-Antoine_L-inassouvie-roman-intime_<ma-411>_13782,pas que c' était moi qui lui donnais congé .
Albalat-Antoine_L-inassouvie-roman-intime_<ma-411>_13790,"congé . Le lendemain , j' allai chez Louise ;"
Albalat-Antoine_L-inassouvie-roman-intime_<ma-411>_13795,j' allai chez Louise ; j' y trouvai Marthe les
Albalat-Antoine_L-inassouvie-roman-intime_<ma-411>_13809,Tu hésites ! lui dis - je . – Non
Albalat-Antoine_L-inassouvie-roman-intime_<ma-411>_13831,"ui redevint gaie subitement . J' avais , à deux"
Albalat-Antoine_L-inassouvie-roman-intime_<ma-411>_13890,"bureau , et qu' elle me rejoindrait , à pied"
Albalat-Antoine_L-inassouvie-roman-intime_<ma-411>_13930,"lendemain matin , en ouvrant ma fenêtre , le iel"
Albalat-Antoine_L-inassouvie-roman-intime_<ma-411>_13941,pur . Quelle joie ! Mon plan était tout racé
Albalat-Antoine_L-inassouvie-roman-intime_<ma-411>_13990,", à toute heure , ma maîtresse serait nenne e"
Albalat-Antoine_L-inassouvie-roman-intime_<ma-411>_13999,"e ; chaque soir , je la verrai se déshabiller"
Albalat-Antoine_L-inassouvie-roman-intime_<ma-411>_14005,la verrai se déshabiller ; i l' entendrai papoter et
Albalat-Antoine_L-inassouvie-roman-intime_<ma-411>_14023,; elle s' endormirait en me serrant sur on cœur
Albalat-Antoine_L-inassouvie-roman-intime_<ma-411>_14030,sur on cœur - et me réveillerait avec ses lèvres
Albalat-Antoine_L-inassouvie-roman-intime_<ma-411>_14042,décidé à la garder toute ma vie ; j' avais
Albalat-Antoine_L-inassouvie-roman-intime_<ma-411>_14045,garder toute ma vie ; j' avais lit le sacrifice
Albalat-Antoine_L-inassouvie-roman-intime_<ma-411>_14051,"avais lit le sacrifice de ma liberté , et ,"
Albalat-Antoine_L-inassouvie-roman-intime_<ma-411>_14057,"liberté , et , plus je connais - ais Marthe"
Albalat-Antoine_L-inassouvie-roman-intime_<ma-411>_14065,"ais Marthe , plus il me semblait que je l'"
Albalat-Antoine_L-inassouvie-roman-intime_<ma-411>_14068,plus il me semblait que je l' aimerais . Je
Albalat-Antoine_L-inassouvie-roman-intime_<ma-411>_14072,que je l' aimerais . Je partis à midi pour
Albalat-Antoine_L-inassouvie-roman-intime_<ma-411>_14095,une demi - heure après moi . Jamais je n'
Albalat-Antoine_L-inassouvie-roman-intime_<ma-411>_14098,heure après moi . Jamais je n' oublierai cette journée
Albalat-Antoine_L-inassouvie-roman-intime_<ma-411>_14105,oublierai cette journée quia décidé démon avenir ! Il me
Albalat-Antoine_L-inassouvie-roman-intime_<ma-411>_14109,"décidé démon avenir ! Il me sembla , d' abord"
Albalat-Antoine_L-inassouvie-roman-intime_<ma-411>_14134,"à coup . Cependant , mes craintes s' évanouirent quand"
Albalat-Antoine_L-inassouvie-roman-intime_<ma-411>_14139,mes craintes s' évanouirent quand je fus dans la campagne
Albalat-Antoine_L-inassouvie-roman-intime_<ma-411>_14154,", qui s' étendait devant moi , blanche jusqu' à"
Albalat-Antoine_L-inassouvie-roman-intime_<ma-411>_14257,s' épandaient au loin et m' environnaient d' un cercle
Albalat-Antoine_L-inassouvie-roman-intime_<ma-411>_14270,élargi et toujours reformé . Je mis mon mouchoir sous
Albalat-Antoine_L-inassouvie-roman-intime_<ma-411>_14272,toujours reformé . Je mis mon mouchoir sous mon chapeau
Albalat-Antoine_L-inassouvie-roman-intime_<ma-411>_14275,Je mis mon mouchoir sous mon chapeau pour avoir un
Albalat-Antoine_L-inassouvie-roman-intime_<ma-411>_14284,un peu de fraîcheur et je continuai à marcher intrépidement
Albalat-Antoine_L-inassouvie-roman-intime_<ma-411>_14326,", et l' impatience de me voir lui avait -"
Albalat-Antoine_L-inassouvie-roman-intime_<ma-411>_14345,"vivre désormais avec elle allégeait mon pas , tout en"
Albalat-Antoine_L-inassouvie-roman-intime_<ma-411>_14350,"mon pas , tout en m' inspirant cette vague appréhension"
Albalat-Antoine_L-inassouvie-roman-intime_<ma-411>_14362,"cause toujours l' inconnu . Je regardais les champs ,"
Albalat-Antoine_L-inassouvie-roman-intime_<ma-411>_14374,", la ville , et je me disais que tout"
Albalat-Antoine_L-inassouvie-roman-intime_<ma-411>_14380,me disais que tout cela m' apparaissait pour la dernière
Albalat-Antoine_L-inassouvie-roman-intime_<- vous-2307>_52315,foule . – Nous écrirez - vous souvent ? demanda
Albalat-Antoine_L-inassouvie-roman-intime_<- vous-2307>_52326,". – Oui , je vous le promets . –"
Albalat-Antoine_L-inassouvie-roman-intime_<- vous-2307>_52393,"cheminée . Oui , toujours je me souviendrai du temps"
Albalat-Antoine_L-inassouvie-roman-intime_<- vous-2307>_52401,du temps si court que j' ai passé ici .
Albalat-Antoine_L-inassouvie-roman-intime_<- vous-2307>_52406,j' ai passé ici . Je n' aime pas Paris
Albalat-Antoine_L-inassouvie-roman-intime_<- vous-2307>_52416,", vous le savez . Je donnerai tout au monde"
Albalat-Antoine_L-inassouvie-roman-intime_<- vous-2307>_52430,", et ce sera pour moi une douleur de tous"
Albalat-Antoine_L-inassouvie-roman-intime_<- vous-2307>_52474,"ne les enviez pas , mon ami . Ils vivent"
Albalat-Antoine_L-inassouvie-roman-intime_<- vous-2307>_52503,"de changer la conversation , elle parla d' autres choses"
Albalat-Antoine_L-inassouvie-roman-intime_<- vous-2307>_52528,tristesse prendrait cet appartement lorsque Marthe n' y serait plus
Albalat-Antoine_L-inassouvie-roman-intime_<- vous-2307>_52571,"s' écria Bernard , quand vous serez partie . Elle"
Albalat-Antoine_L-inassouvie-roman-intime_<- vous-2307>_52575,quand vous serez partie . Elle sourit . – Cela
Albalat-Antoine_L-inassouvie-roman-intime_<- vous-2307>_52583,"– Cela passera . A votre âge , ces ennuis"
Albalat-Antoine_L-inassouvie-roman-intime_<- vous-2307>_52599,avec élan :– Oh ! vous ne me connaissez pas
Albalat-Antoine_L-inassouvie-roman-intime_<- vous-2307>_52601,":– Oh ! vous ne me connaissez pas , Madame"
Albalat-Antoine_L-inassouvie-roman-intime_<- vous-2307>_52605,"ne me connaissez pas , Madame . Elle eut l'"
Albalat-Antoine_L-inassouvie-roman-intime_<- vous-2307>_52607,"connaissez pas , Madame . Elle eut l' air de"
Albalat-Antoine_L-inassouvie-roman-intime_<- vous-2307>_52618,avoir pas entendu et s' approcha de la fenêtre .
Albalat-Antoine_L-inassouvie-roman-intime_<- vous-2307>_52634,", s' écria - t - elle , Sont -"
Albalat-Antoine_L-inassouvie-roman-intime_<- vous-2307>_52717,promenade en zigzags . – Votre mari doit languir de
Albalat-Antoine_L-inassouvie-roman-intime_<- vous-2307>_52722,"Votre mari doit languir de vous voir , dit Bernard"
Albalat-Antoine_L-inassouvie-roman-intime_<- vous-2307>_52732,qui songeait aux calomnies dont elle était victime et qui
Albalat-Antoine_L-inassouvie-roman-intime_<- vous-2307>_52743,voulu surprendre un étonnement sur son visage . Vous allez
Albalat-Antoine_L-inassouvie-roman-intime_<- vous-2307>_52746,étonnement sur son visage . Vous allez être bien heureuse
Albalat-Antoine_L-inassouvie-roman-intime_<- vous-2307>_52756,"de le rejoindre , quand vous aurez vu Louise !–"
Albalat-Antoine_L-inassouvie-roman-intime_<- vous-2307>_52764,"Louise !– Heureuse , dit - elle ! Oh non"
Albalat-Antoine_L-inassouvie-roman-intime_<- vous-2307>_52773,non ! La vie ne me réserve plus que des
Albalat-Antoine_L-inassouvie-roman-intime_<- vous-2307>_52782,des larmes . Et pourtant je ne puis accuser personne
Albalat-Antoine_L-inassouvie-roman-intime_<- vous-2307>_52788,"ne puis accuser personne de mes malheurs . Non ,"
Albalat-Antoine_L-inassouvie-roman-intime_<- vous-2307>_52796,"Non , personne ; si je vous disais . mais"
Albalat-Antoine_L-inassouvie-roman-intime_<- vous-2307>_52797,", personne ; si je vous disais . mais vous"
Albalat-Antoine_L-inassouvie-roman-intime_<- vous-2307>_52801,je vous disais . mais vous ne pouvez pas comprendre
Albalat-Antoine_L-inassouvie-roman-intime_<- vous-2307>_52811,"ces choses - là , vous . – Si !"
Albalat-Antoine_L-inassouvie-roman-intime_<- vous-2307>_52816,vous . – Si ! j e le les comprends
Albalat-Antoine_L-inassouvie-roman-intime_<- vous-2307>_52824,"les comprends , s' écria - t - il ,"
Albalat-Antoine_L-inassouvie-roman-intime_<- vous-2307>_52826,", s' écria - t - il , parlez -"
Albalat-Antoine_L-inassouvie-roman-intime_<- vous-2307>_52830,"t - il , parlez - moi . vous verrez"
Albalat-Antoine_L-inassouvie-roman-intime_<- vous-2307>_52833,", parlez - moi . vous verrez que je les"
Albalat-Antoine_L-inassouvie-roman-intime_<- vous-2307>_52836,moi . vous verrez que je les comprends . Racontez
Albalat-Antoine_L-inassouvie-roman-intime_<- vous-2307>_52841,je les comprends . Racontez - moi vos chagrins .
Albalat-Antoine_L-inassouvie-roman-intime_<- vous-2307>_52843,comprends . Racontez - moi vos chagrins . cela vous
Albalat-Antoine_L-inassouvie-roman-intime_<- vous-2307>_52847,moi vos chagrins . cela vous consolera . – Ce
Albalat-Antoine_L-inassouvie-roman-intime_<- vous-2307>_52857,"serait trop long , reprit - elle . Laissons dormir"
Albalat-Antoine_L-inassouvie-roman-intime_<- vous-2307>_52872,a cependant des expériences dont j' aurais voulu être préservée
Albalat-Antoine_L-inassouvie-roman-intime_<- vous-2307>_52879,voulu être préservée et dont je voudrais vous sauver vous
Albalat-Antoine_L-inassouvie-roman-intime_<- vous-2307>_52881,préservée et dont je voudrais vous sauver vous - même
Albalat-Antoine_L-inassouvie-roman-intime_<- vous-2307>_52883,dont je voudrais vous sauver vous - même ; car
Albalat-Antoine_L-inassouvie-roman-intime_<- vous-2307>_52891,"; car , enfin , vous êtes jeune , Bernard"
Albalat-Antoine_L-inassouvie-roman-intime_<- vous-2307>_52895,", vous êtes jeune , Bernard ; vous avez de"
Albalat-Antoine_L-inassouvie-roman-intime_<- vous-2307>_52897,"êtes jeune , Bernard ; vous avez de grandes qualités"
Albalat-Antoine_L-inassouvie-roman-intime_<- vous-2307>_52905,grandes qualités d' âme ; votre cœur déborde d' illusions
Albalat-Antoine_L-inassouvie-roman-intime_<- vous-2307>_52911,"cœur déborde d' illusions . Vous en souffrirez beaucoup ,"
Albalat-Antoine_L-inassouvie-roman-intime_<- vous-2307>_52916,"Vous en souffrirez beaucoup , mon cher ami , et"
Albalat-Antoine_L-inassouvie-roman-intime_<- vous-2307>_52932,"en avoir beaucoup souffert , vous en débarrasserez - vous"
Albalat-Antoine_L-inassouvie-roman-intime_<- vous-2307>_52935,"souffert , vous en débarrasserez - vous et deviendrez -"
Albalat-Antoine_L-inassouvie-roman-intime_<- vous-2307>_52938,en débarrasserez - vous et deviendrez - vous comme les
Albalat-Antoine_L-inassouvie-roman-intime_<- vous-2307>_52939,débarrasserez - vous et deviendrez - vous comme les autres
Albalat-Antoine_L-inassouvie-roman-intime_<- vous-2307>_52957,"paix navrée s' exhalaient de ses lentes paroles , coupées"
Albalat-Antoine_L-inassouvie-roman-intime_<- vous-2307>_52989,", immobiles et silencieux . Marthe revint ensuite dans la"
Albalat-Antoine_L-inassouvie-roman-intime_<- vous-2307>_52999,"chambre et , accroupie dans ses jupes , tout en"
Albalat-Antoine_L-inassouvie-roman-intime_<- vous-2307>_53011,"en rangeant des paquets , elle regardait Bernard qui retenait"
Albalat-Antoine_L-inassouvie-roman-intime_<- vous-2307>_53013,"des paquets , elle regardait Bernard qui retenait à grand'"
Albalat-Antoine_L-inassouvie-roman-intime_<- vous-2307>_53014,"paquets , elle regardait Bernard qui retenait à grand' peine"
Albalat-Antoine_L-inassouvie-roman-intime_<- vous-2307>_53023,"peine , au bord de ses yeux , deux larmes"
Albalat-Antoine_L-inassouvie-roman-intime_<- vous-2307>_53035,des diamants . Ah ! elle le savait bien qu'
Albalat-Antoine_L-inassouvie-roman-intime_<- vous-2307>_53040,elle le savait bien qu' elle était aimée ! Elle
Albalat-Antoine_L-inassouvie-roman-intime_<- vous-2307>_53044,qu' elle était aimée ! Elle ne l' avait pas
Albalat-Antoine_L-inassouvie-roman-intime_<- vous-2307>_53054,"cru d' abord , tant elle ne pensait plus être"
Albalat-Antoine_L-inassouvie-roman-intime_<- vous-2307>_53066,"personne ; mais les réticences du jeune homme , ses"
Albalat-Antoine_L-inassouvie-roman-intime_<- vous-2307>_53070,"réticences du jeune homme , ses distractions , ses regards"
Albalat-Antoine_L-inassouvie-roman-intime_<- vous-2307>_53073,"homme , ses distractions , ses regards le lui avaient"
Albalat-Antoine_L-inassouvie-roman-intime_<- vous-2307>_53076,"distractions , ses regards le lui avaient crié plus haut"
Albalat-Antoine_L-inassouvie-roman-intime_<- vous-2307>_53089,des paroles ; et maintenant elle le voyait monter en
Albalat-Antoine_L-inassouvie-roman-intime_<- vous-2307>_53090,paroles ; et maintenant elle le voyait monter en rougeur
Albalat-Antoine_L-inassouvie-roman-intime_<- vous-2307>_53099,"rougeur subite aux joues de Bernard , cet amour muet"
Albalat-Antoine_L-inassouvie-roman-intime_<- vous-2307>_53107,amour muet et envahissant ; elle le voyait gonfler ses
Albalat-Antoine_L-inassouvie-roman-intime_<- vous-2307>_53111,"; elle le voyait gonfler ses veines , faire trembler"
Albalat-Antoine_L-inassouvie-roman-intime_<- vous-2307>_53116,"ses veines , faire trembler ses lèvres et sur le"
Albalat-Antoine_L-inassouvie-roman-intime_<- vous-2307>_53128,"peut - être , de lui donner la force de"
Albalat-Antoine_L-inassouvie-roman-intime_<- vous-2307>_53135,la force de parler . Elle eut peur d' entendre
Albalat-Antoine_L-inassouvie-roman-intime_<- vous-2307>_53150,", en effet , si elle serait partie après ?"
Albalat-Antoine_L-inassouvie-roman-intime_<- vous-2307>_53164,"était inévitable , fatal . Elle ne pouvait s' y"
Albalat-Antoine_L-inassouvie-roman-intime_<- vous-2307>_53190,"l' éviter . Donc , Bernard s' étant éloigné de"
Albalat-Antoine_L-inassouvie-roman-intime_<- vous-2307>_53198,"éloigné de la fenêtre , elle prit sa place et"
Albalat-Antoine_L-inassouvie-roman-intime_<- vous-2307>_53200,"la fenêtre , elle prit sa place et l' appela"
Albalat-Antoine_L-inassouvie-roman-intime_<- vous-2307>_53203,elle prit sa place et l' appela . – Voyez
Albalat-Antoine_L-inassouvie-roman-intime_<- vous-2307>_53204,prit sa place et l' appela . – Voyez !
Albalat-Antoine_L-inassouvie-roman-intime_<- vous-2307>_53321,"musique joua la Marseillaise . Bernard , que l' émotion"
Albalat-Antoine_L-inassouvie-roman-intime_<- vous-2307>_53323,"la Marseillaise . Bernard , que l' émotion gagnait ,"
Albalat-Antoine_L-inassouvie-roman-intime_<- vous-2307>_53344,"passer , balbutia - t - il . – Oui"
Albalat-Antoine_L-inassouvie-roman-intime_<- vous-2307>_53351,". – Oui , dit Marthe , ils vont faire"
Albalat-Antoine_L-inassouvie-roman-intime_<- vous-2307>_53419,cette rage d' assourdissement . Bernard sentit des sanglots lui
Albalat-Antoine_L-inassouvie-roman-intime_<- vous-2307>_53423,. Bernard sentit des sanglots lui monter dans l' âme
Albalat-Antoine_L-inassouvie-roman-intime_<- vous-2307>_53436,"désespoir et de sensibilité , son cœurhaleta , râlant tour"
Albalat-Antoine_L-inassouvie-roman-intime_<- vous-2307>_53480,". A la fin , le pauvre enfant n' y"
Albalat-Antoine_L-inassouvie-roman-intime_<- vous-2307>_53497,"le dos du canapé , il fondit en pleurs ."
Albalat-Antoine_L-inassouvie-roman-intime_<- vous-2307>_53506,. Marthe s' élança vers lui :– Qu' avez -
Albalat-Antoine_L-inassouvie-roman-intime_<- vous-2307>_53510,vers lui :– Qu' avez - vous ? pourquoi pleurez
Albalat-Antoine_L-inassouvie-roman-intime_<- vous-2307>_53515,- vous ? pourquoi pleurez - vous ?– Ne partez
Albalat-Antoine_L-inassouvie-roman-intime_<- vous-2307>_53532,"Mais c' est impossible , vous le savez bien ."
Albalat-Antoine_L-inassouvie-roman-intime_<- vous-2307>_53545,restez ! Je veux que vous restiez z !Elle eut
Albalat-Antoine_L-inassouvie-roman-intime_<- vous-2307>_53552,z !Elle eut peur de ses larmes et le força
Albalat-Antoine_L-inassouvie-roman-intime_<- vous-2307>_53555,peur de ses larmes et le força de tourner la
Albalat-Antoine_L-inassouvie-roman-intime_<- vous-2307>_53566,vers elle . – Je vous en prie . si
Albalat-Antoine_L-inassouvie-roman-intime_<- vous-2307>_53571,vous en prie . si votre mère montait . quel
Albalat-Antoine_L-inassouvie-roman-intime_<- vous-2307>_53586,donc plus . Pourquoi voulez - vous que je reste
Albalat-Antoine_L-inassouvie-roman-intime_<- vous-2307>_53594,"je reste ?– Parce que je vous aime , balbutia"
Albalat-Antoine_L-inassouvie-roman-intime_<- vous-2307>_53601,"aime , balbutia - t - il , en couvrant"
Albalat-Antoine_L-inassouvie-roman-intime_<- vous-2307>_53606,"- il , en couvrant son front des plis de"
Albalat-Antoine_L-inassouvie-roman-intime_<- vous-2307>_53611,son front des plis de sa robe . Il les
Albalat-Antoine_L-inassouvie-roman-intime_<- vous-2307>_53614,"plis de sa robe . Il les avait dits ,"
Albalat-Antoine_L-inassouvie-roman-intime_<- vous-2307>_53625,", ces trois mots qui le brûlaient , ces trois"
Albalat-Antoine_L-inassouvie-roman-intime_<- vous-2307>_53632,", ces trois mots qui l' épouvantaient ; et rien"
Albalat-Antoine_L-inassouvie-roman-intime_<- vous-2307>_53653,"un coup , descendit en lui . La musique ,"
Albalat-Antoine_L-inassouvie-roman-intime_<- vous-2307>_53684,"Sérieuse et sans parler , Marthe s' était assise à"
Albalat-Antoine_L-inassouvie-roman-intime_<- vous-2307>_53689,"Marthe s' était assise à ses côtés , lui rangeait"
Albalat-Antoine_L-inassouvie-roman-intime_<- vous-2307>_53692,"assise à ses côtés , lui rangeait les cheveux avec"
Albalat-Antoine_L-inassouvie-roman-intime_<- vous-2307>_53693,"à ses côtés , lui rangeait les cheveux avec la"
Albalat-Antoine_L-inassouvie-roman-intime_<- vous-2307>_53700,cheveux avec la main et lui essuyait les yeux avec
Albalat-Antoine_L-inassouvie-roman-intime_<- vous-2307>_53701,avec la main et lui essuyait les yeux avec son
Albalat-Antoine_L-inassouvie-roman-intime_<- vous-2307>_53705,lui essuyait les yeux avec son mouchoir parfumé . –
Albalat-Antoine_L-inassouvie-roman-intime_<- vous-2307>_53711,"mouchoir parfumé . – Ne m' aimez pas , Bernard"
Albalat-Antoine_L-inassouvie-roman-intime_<- vous-2307>_53715,"Ne m' aimez pas , Bernard , murmurait - elle"
Albalat-Antoine_L-inassouvie-roman-intime_<- vous-2307>_53718,"pas , Bernard , murmurait - elle . Vous seriez"
Albalat-Antoine_L-inassouvie-roman-intime_<- vous-2307>_53721,", murmurait - elle . Vous seriez trop malheureux ."
Albalat-Antoine_L-inassouvie-roman-intime_<- vous-2307>_53727,seriez trop malheureux . oubliez - moi . Je n'
Albalat-Antoine_L-inassouvie-roman-intime_<- vous-2307>_53730,. oubliez - moi . Je n' ai ni votre
Albalat-Antoine_L-inassouvie-roman-intime_<- vous-2307>_53734,. Je n' ai ni votre âge ni vos illusions
Albalat-Antoine_L-inassouvie-roman-intime_<- vous-2307>_53737,ai ni votre âge ni vos illusions . Je suis
Albalat-Antoine_L-inassouvie-roman-intime_<- vous-2307>_53740,âge ni vos illusions . Je suis presque vieille et
Albalat-Antoine_L-inassouvie-roman-intime_<- vous-2307>_53745,Je suis presque vieille et j' ai trop souffert .
Albalat-Antoine_L-inassouvie-roman-intime_<- vous-2307>_53750,"j' ai trop souffert . Je pars demain , d'"
Albalat-Antoine_L-inassouvie-roman-intime_<- vous-2307>_53761,", c' est irrévocable . Ses regards avaient une fixité"
Albalat-Antoine_L-inassouvie-roman-intime_<- vous-2307>_53778,voix dans l' escalier :– Bernard ! Bernard !Marthe d'
Albalat-Antoine_L-inassouvie-roman-intime_<- vous-2307>_53780,l' escalier :– Bernard ! Bernard !Marthe d' un bond
Albalat-Antoine_L-inassouvie-roman-intime_<- vous-2307>_53790,fut sur pied . – Votre mère ! . .
Albalat-Antoine_L-inassouvie-roman-intime_<- vous-2307>_53799,. . vite ! essuyez vos yeux ! . .
Albalat-Antoine_L-inassouvie-roman-intime_<- vous-2307>_53808,". . soyez raisonnable . Elle sécha ses larmes ,"
Albalat-Antoine_L-inassouvie-roman-intime_<- vous-2307>_53810,"soyez raisonnable . Elle sécha ses larmes , encore une"
Albalat-Antoine_L-inassouvie-roman-intime_<- vous-2307>_53817,", encore une fois , lui mit son chapeau et"
Albalat-Antoine_L-inassouvie-roman-intime_<- vous-2307>_53818,"encore une fois , lui mit son chapeau et noua"
Albalat-Antoine_L-inassouvie-roman-intime_<- vous-2307>_53819,"une fois , lui mit son chapeau et noua sa"
Albalat-Antoine_L-inassouvie-roman-intime_<- vous-2307>_53822,lui mit son chapeau et noua sa cravate . Mme
Albalat-Antoine_L-inassouvie-roman-intime_<- vous-2307>_53823,mit son chapeau et noua sa cravate . Mme Désarbaux
Albalat-Antoine_L-inassouvie-roman-intime_<- vous-2307>_53835,appeler . Que faisait donc Bernard ? Pourquoi ne venait
Albalat-Antoine_L-inassouvie-roman-intime_<- vous-2307>_53840,Bernard ? Pourquoi ne venait - il pas ? Elle
Albalat-Antoine_L-inassouvie-roman-intime_<- vous-2307>_53844,"venait - il pas ? Elle allait monter , lorsqu'"
Albalat-Antoine_L-inassouvie-roman-intime_<- vous-2307>_53849,"Elle allait monter , lorsqu' il sortit . Mme de"
Albalat-Antoine_L-inassouvie-roman-intime_<- vous-2307>_53852,", lorsqu' il sortit . Mme de Joncières , bouleversée"
Albalat-Antoine_L-inassouvie-roman-intime_<- vous-2307>_53878,espérances impossibles s' ouvrit devant elle et l' éblouit .
Albalat-Antoine_L-inassouvie-roman-intime_<- vous-2307>_53880,s' ouvrit devant elle et l' éblouit . Ces larmes
Albalat-Antoine_L-inassouvie-roman-intime_<- vous-2307>_53895,"chaudes , étaient tombées sur son cœur . Elles y"
Albalat-Antoine_L-inassouvie-roman-intime_<- vous-2307>_53905,"avaient éveillé , non pas ses instincts mauvais , mais"
Albalat-Antoine_L-inassouvie-roman-intime_<- vous-2307>_53910,"ses instincts mauvais , mais ses plus pudiques élans ,"
Albalat-Antoine_L-inassouvie-roman-intime_<- vous-2307>_53915,"ses plus pudiques élans , ses plus nobles générosités de"
Albalat-Antoine_L-inassouvie-roman-intime_<- vous-2307>_53924,de femme ; et irrésistiblement elle était saisie du désir
