,text_surronding
Daudet-Alphonse_La-Belle-Nivernaise_<une grosse bonne figure rougeaude-109>_2245,assistants . On poussa devant lui un gros livre .
Daudet-Alphonse_La-Belle-Nivernaise_<une grosse bonne figure rougeaude-109>_2251,un gros livre . Comme il ne savait pas écrire
Daudet-Alphonse_La-Belle-Nivernaise_<une grosse bonne figure rougeaude-109>_2257,"ne savait pas écrire , il fit une croix ,"
Daudet-Alphonse_La-Belle-Nivernaise_<une grosse bonne figure rougeaude-109>_2271,page . Puis le commissaire lui remit l' enfant trouvé
Daudet-Alphonse_La-Belle-Nivernaise_<une grosse bonne figure rougeaude-109>_2282,"« Emmenez le petit , François Louveau , et élevez"
Daudet-Alphonse_La-Belle-Nivernaise_<une grosse bonne figure rougeaude-109>_2301,"à son sujet , je vous tiendrai au courant ."
Daudet-Alphonse_La-Belle-Nivernaise_<une grosse bonne figure rougeaude-109>_2321,"réclament jamais . Quant à vous , vous m' avez"
Daudet-Alphonse_La-Belle-Nivernaise_<une grosse bonne figure rougeaude-109>_2323,". Quant à vous , vous m' avez l' air"
Daudet-Alphonse_La-Belle-Nivernaise_<une grosse bonne figure rougeaude-109>_2338,et j' ai confiance en vous . Obéissez toujours à
Daudet-Alphonse_La-Belle-Nivernaise_<une grosse bonne figure rougeaude-109>_2343,vous . Obéissez toujours à votre femme . Et au
Daudet-Alphonse_La-Belle-Nivernaise_<une grosse bonne figure rougeaude-109>_2387,est fait pour dégriser vivement un pauvre homme . À
Daudet-Alphonse_La-Belle-Nivernaise_<une grosse bonne figure rougeaude-109>_2399,"la rue , seul avec son papier timbré en poche"
Daudet-Alphonse_La-Belle-Nivernaise_<une grosse bonne figure rougeaude-109>_2405,papier timbré en poche et son protégé par la main
Daudet-Alphonse_La-Belle-Nivernaise_<une grosse bonne figure rougeaude-109>_2411,"protégé par la main , le marinier sentit tout d'"
Daudet-Alphonse_La-Belle-Nivernaise_<une grosse bonne figure rougeaude-109>_2419,tout d' un coup tomber son enthousiasme ; et l'
Daudet-Alphonse_La-Belle-Nivernaise_<une grosse bonne figure rougeaude-109>_2426,; et l' énormité de son action lui apparut .
Daudet-Alphonse_La-Belle-Nivernaise_<une grosse bonne figure rougeaude-109>_2428,l' énormité de son action lui apparut . Il serait
Daudet-Alphonse_La-Belle-Nivernaise_<une grosse bonne figure rougeaude-109>_2431,son action lui apparut . Il serait donc toujours le
Daudet-Alphonse_La-Belle-Nivernaise_<une grosse bonne figure rougeaude-109>_2444,niais ? Un glorieux ? Il ne pouvait point passer
Daudet-Alphonse_La-Belle-Nivernaise_<une grosse bonne figure rougeaude-109>_2449,Il ne pouvait point passer son chemin comme les autres
Daudet-Alphonse_La-Belle-Nivernaise_<une grosse bonne figure rougeaude-109>_2462,mêler de ce qui ne le regardait pas . Il
Daudet-Alphonse_La-Belle-Nivernaise_<une grosse bonne figure rougeaude-109>_2466,ne le regardait pas . Il voyait d' ici la
Daudet-Alphonse_La-Belle-Nivernaise_<une grosse bonne figure rougeaude-109>_2494,une femme de tête pour un pauvre homme qui a
Daudet-Alphonse_La-Belle-Nivernaise_<une grosse bonne figure rougeaude-109>_2497,tête pour un pauvre homme qui a le cœur sur
Daudet-Alphonse_La-Belle-Nivernaise_<une grosse bonne figure rougeaude-109>_2506,sur la main . Jamais il n' oserait rentrer chez
Daudet-Alphonse_La-Belle-Nivernaise_<une grosse bonne figure rougeaude-109>_2511,il n' oserait rentrer chez lui . Il n' osait
Daudet-Alphonse_La-Belle-Nivernaise_<une grosse bonne figure rougeaude-109>_2513,oserait rentrer chez lui . Il n' osait pas non
Daudet-Alphonse_La-Belle-Nivernaise_<une grosse bonne figure rougeaude-109>_2546,", préparait un discours . Victor traînait ses souliers dans"
Daudet-Alphonse_La-Belle-Nivernaise_<une grosse bonne figure rougeaude-109>_2548,un discours . Victor traînait ses souliers dans la crotte
Daudet-Alphonse_La-Belle-Nivernaise_<une grosse bonne figure rougeaude-109>_2554,souliers dans la crotte . Il se faisait tirer comme
Daudet-Alphonse_La-Belle-Nivernaise_<une grosse bonne figure rougeaude-109>_2562,tirer comme un boulet . Il n' en pouvait plus
Daudet-Alphonse_La-Belle-Nivernaise_<une grosse bonne figure rougeaude-109>_2575,"père Louveau s' arrêta , le prit à son cou"
Daudet-Alphonse_La-Belle-Nivernaise_<une grosse bonne figure rougeaude-109>_2581,"prit à son cou , l' enveloppa dans sa vareuse"
Daudet-Alphonse_La-Belle-Nivernaise_<une grosse bonne figure rougeaude-109>_2593,étreinte des petits bras serrés lui rendit un peu de
Daudet-Alphonse_La-Belle-Nivernaise_<une grosse bonne figure rougeaude-109>_2600,un peu de courage . Il reprit son chemin .
Daudet-Alphonse_La-Belle-Nivernaise_<une grosse bonne figure rougeaude-109>_2602,de courage . Il reprit son chemin . Ma foi
Daudet-Alphonse_La-Belle-Nivernaise_<une grosse bonne figure rougeaude-109>_2611,"foi , tant pis ! il risquerait le paquet ."
Daudet-Alphonse_La-Belle-Nivernaise_<une grosse bonne figure rougeaude-109>_2626,"mettait à la porte , il serait temps de reporter"
Daudet-Alphonse_La-Belle-Nivernaise_<une grosse bonne figure rougeaude-109>_2631,il serait temps de reporter le marmot à la police
Daudet-Alphonse_La-Belle-Nivernaise_<une grosse bonne figure rougeaude-109>_2644,- être bien qu' elle le garderait pour une nuit
Daudet-Alphonse_La-Belle-Nivernaise_<une grosse bonne figure rougeaude-109>_2746,"jambes flageolantes , gêné par l' enfant qui lui étranglait"
Daudet-Alphonse_La-Belle-Nivernaise_<une grosse bonne figure rougeaude-109>_2748,", gêné par l' enfant qui lui étranglait le cou"
Daudet-Alphonse_La-Belle-Nivernaise_<un brave Maure-1048>_20476,"invasion des Français , vivait un brave Maure qui ,"
Daudet-Alphonse_La-Belle-Nivernaise_<un brave Maure-1048>_20479,", vivait un brave Maure qui , du nom de"
Daudet-Alphonse_La-Belle-Nivernaise_<un brave Maure-1048>_20484,"qui , du nom de son père , s' appelait"
Daudet-Alphonse_La-Belle-Nivernaise_<un brave Maure-1048>_20492,s' appelait Sidi Lakdar et que les gens de sa
Daudet-Alphonse_La-Belle-Nivernaise_<un brave Maure-1048>_20496,et que les gens de sa ville avaient surnommé le
Daudet-Alphonse_La-Belle-Nivernaise_<un brave Maure-1048>_20566,venait à la ceinture de Sidi Lakdar . Le digne
Daudet-Alphonse_La-Belle-Nivernaise_<un brave Maure-1048>_20569,ceinture de Sidi Lakdar . Le digne seigneur avait élevé
Daudet-Alphonse_La-Belle-Nivernaise_<un brave Maure-1048>_20574,Le digne seigneur avait élevé son vice à la hauteur
Daudet-Alphonse_La-Belle-Nivernaise_<un brave Maure-1048>_20594,", marchands d' épices . Sidi Lakdar , lui ,"
Daudet-Alphonse_La-Belle-Nivernaise_<un brave Maure-1048>_20597,"épices . Sidi Lakdar , lui , était paresseux ."
Daudet-Alphonse_La-Belle-Nivernaise_<un brave Maure-1048>_20606,". À la mort de son père , il avait"
Daudet-Alphonse_La-Belle-Nivernaise_<un brave Maure-1048>_20609,"mort de son père , il avait hérité d' un"
Daudet-Alphonse_La-Belle-Nivernaise_<un brave Maure-1048>_20660,". C' est là qu' il passait sa vie ,"
Daudet-Alphonse_La-Belle-Nivernaise_<un brave Maure-1048>_20662,"est là qu' il passait sa vie , étendu de"
Daudet-Alphonse_La-Belle-Nivernaise_<un brave Maure-1048>_20668,"vie , étendu de tout son long , silencieux ,"
Daudet-Alphonse_La-Belle-Nivernaise_<un brave Maure-1048>_20679,", des fourmis rouges plein sa barbe . Quand il"
Daudet-Alphonse_La-Belle-Nivernaise_<un brave Maure-1048>_20683,"plein sa barbe . Quand il avait faim , il"
Daudet-Alphonse_La-Belle-Nivernaise_<un brave Maure-1048>_20687,"Quand il avait faim , il allongeait le bras et"
Daudet-Alphonse_La-Belle-Nivernaise_<un brave Maure-1048>_20692,il allongeait le bras et ramassait une figue ou une
Daudet-Alphonse_La-Belle-Nivernaise_<un brave Maure-1048>_20704,dans le gazon près de lui ; mais s' il
Daudet-Alphonse_La-Belle-Nivernaise_<un brave Maure-1048>_20721,"fruit sur sa branche , il serait plutôt mort de"
Daudet-Alphonse_La-Belle-Nivernaise_<un brave Maure-1048>_20731,"faim . Aussi , dans son jardin , les figues"
Daudet-Alphonse_La-Belle-Nivernaise_<un brave Maure-1048>_20754,Cette paresse effrénée avait rendu Lakdar très populaire dans son
Daudet-Alphonse_La-Belle-Nivernaise_<un brave Maure-1048>_20758,rendu Lakdar très populaire dans son pays . On le
Daudet-Alphonse_La-Belle-Nivernaise_<un brave Maure-1048>_20762,dans son pays . On le respectait à l' égal
Daudet-Alphonse_La-Belle-Nivernaise_<un brave Maure-1048>_20774,"saint . En passant devant son petit clos , les"
Daudet-Alphonse_La-Belle-Nivernaise_<un brave Maure-1048>_20859,"cette belle paresse , appelaient Lakdar par son nom ,"
Daudet-Alphonse_La-Belle-Nivernaise_<un brave Maure-1048>_20861,"paresse , appelaient Lakdar par son nom , riaient ,"
Daudet-Alphonse_La-Belle-Nivernaise_<un brave Maure-1048>_20870,", menaient du train , lui jetaient des peaux d'"
Daudet-Alphonse_La-Belle-Nivernaise_<un brave Maure-1048>_20880,orange . Peine perdue ! Le paresseux ne bougeait pas
Daudet-Alphonse_La-Belle-Nivernaise_<un brave Maure-1048>_20891,De temps en temps on l' entendait crier du fond
Daudet-Alphonse_La-Belle-Nivernaise_<un brave Maure-1048>_20910,"à l' heure , si je me lève ! »"
Daudet-Alphonse_La-Belle-Nivernaise_<un brave Maure-1048>_20916,me lève ! » mais il ne se levait jamais
Daudet-Alphonse_La-Belle-Nivernaise_<un brave Maure-1048>_20924,"levait jamais . Or , il arriva qu' un de"
Daudet-Alphonse_La-Belle-Nivernaise_<un brave Maure-1048>_20940,"comme cela faire des niches au paresseux , fut en"
Daudet-Alphonse_La-Belle-Nivernaise_<un brave Maure-1048>_20943,"des niches au paresseux , fut en quelque sorte ,"
Daudet-Alphonse_La-Belle-Nivernaise_<un brave Maure-1048>_21021,"que le coq chantait … Toi , paresseux ? …"
Daudet-Alphonse_La-Belle-Nivernaise_<un brave Maure-1048>_21034,"invention ! — Oui , mon père , je veux"
Daudet-Alphonse_La-Belle-Nivernaise_<un brave Maure-1048>_21037,"Oui , mon père , je veux me faire paresseux"
Daudet-Alphonse_La-Belle-Nivernaise_<un brave Maure-1048>_21055,"tout , mon garçon . Tu seras tourneur comme ton"
Daudet-Alphonse_La-Belle-Nivernaise_<un brave Maure-1048>_21059,". Tu seras tourneur comme ton père , ou greffier"
Daudet-Alphonse_La-Belle-Nivernaise_<un brave Maure-1048>_21069,"au tribunal du Cadi comme ton oncle Ali , mais"
Daudet-Alphonse_La-Belle-Nivernaise_<un brave Maure-1048>_21079,jamais je ne ferai de toi un paresseux … Allons
Daudet-Alphonse_La-Belle-Nivernaise_<un brave Maure-1048>_21080,"je ne ferai de toi un paresseux … Allons ,"
Daudet-Alphonse_La-Belle-Nivernaise_<un brave Maure-1048>_21093,l' école ; ou je te casse sur les côtes
Daudet-Alphonse_La-Belle-Nivernaise_<un brave Maure-1048>_21098,te casse sur les côtes ce beau morceau de merisier
Daudet-Alphonse_La-Belle-Nivernaise_<un brave Maure-1048>_21116,"En face du merisier , l' enfant n' insista pas"
Daudet-Alphonse_La-Belle-Nivernaise_<un brave Maure-1048>_21122,enfant n' insista pas et feignit d' être convaincu ;
Daudet-Alphonse_La-Belle-Nivernaise_<un brave Maure-1048>_21137,"aller à l' école , il entra dans un bazar"
Daudet-Alphonse_La-Belle-Nivernaise_<un brave Maure-1048>_21144,"dans un bazar maure , se blottit à la devanture"
Daudet-Alphonse_La-Belle-Nivernaise_<un brave Maure-1048>_21162,"tapis de Smyrne , et resta là tout le jour"
Daudet-Alphonse_La-Belle-Nivernaise_<un brave Maure-1048>_21219,Ce fut ainsi désormais qu' il passa tout le temps
Daudet-Alphonse_La-Belle-Nivernaise_<un brave Maure-1048>_21259,Allah et frotter les reins du petit homme avec tous
Daudet-Alphonse_La-Belle-Nivernaise_<un brave Maure-1048>_21275,rien n' y fit . L' enfant s' entêtait à
Daudet-Alphonse_La-Belle-Nivernaise_<un brave Maure-1048>_21283,entêtait à dire : « Je veux être paresseux …
Daudet-Alphonse_La-Belle-Nivernaise_<un brave Maure-1048>_21288,Je veux être paresseux … je veux être paresseux »
Daudet-Alphonse_La-Belle-Nivernaise_<un brave Maure-1048>_21297,"» , et toujours on le trouvait étendu dans quelque"
Daudet-Alphonse_La-Belle-Nivernaise_<un brave Maure-1048>_21333,"à son fils , puisque tu veux être paresseux à"
Daudet-Alphonse_La-Belle-Nivernaise_<un brave Maure-1048>_21343,"toute force , je vais te conduire chez Lakdar ."
Daudet-Alphonse_La-Belle-Nivernaise_<un brave Maure-1048>_21349,"conduire chez Lakdar . Il te passera un examen ,"
Daudet-Alphonse_La-Belle-Nivernaise_<un brave Maure-1048>_21357,"examen , et , si tu as réellement des dispositions"
Daudet-Alphonse_La-Belle-Nivernaise_<un brave Maure-1048>_21370,", je le prierai de te garder chez lui ,"
Daudet-Alphonse_La-Belle-Nivernaise_<un brave Maure-1048>_21380,"en apprentissage . — Ceci me va » , répondit"
Daudet-Alphonse_La-Belle-Nivernaise_<un brave Maure-1048>_21385,"me va » , répondit l' enfant . Et ,"
Daudet-Alphonse_La-Belle-Nivernaise_<un brave Maure-1048>_21416,"rasée de frais , trouver le paresseux dans son petit"
Daudet-Alphonse_La-Belle-Nivernaise_<un brave Maure-1048>_21419,", trouver le paresseux dans son petit jardin . La"
Daudet-Alphonse_La-Belle-Nivernaise_<un brave Maure-1048>_21520,poitrine . Voici mon fils qui veut absolument se faire
Daudet-Alphonse_La-Belle-Nivernaise_<un brave Maure-1048>_21529,faire paresseux . Je te l' amène pour que tu
Daudet-Alphonse_La-Belle-Nivernaise_<un brave Maure-1048>_21534,"l' amène pour que tu l' examines , et que"
Daudet-Alphonse_La-Belle-Nivernaise_<un brave Maure-1048>_21542,et que tu voies s' il a la vocation .
Daudet-Alphonse_La-Belle-Nivernaise_<un brave Maure-1048>_21555,", je te prie de le prendre chez toi comme"
Daudet-Alphonse_La-Belle-Nivernaise_<un brave Maure-1048>_21595,"Le père s' assit , l' enfant se coucha ,"
Daudet-Alphonse_La-Belle-Nivernaise_<un brave Maure-1048>_21725,"jusqu' à sa bouche . L' enfant , lui ,"
Daudet-Alphonse_La-Belle-Nivernaise_<un brave Maure-1048>_21728,"bouche . L' enfant , lui , ne prenait pas"
Daudet-Alphonse_La-Belle-Nivernaise_<un brave Maure-1048>_21743,plus belles figues tombaient à ses côtés sans qu' il
Daudet-Alphonse_La-Belle-Nivernaise_<un brave Maure-1048>_21747,à ses côtés sans qu' il tournât seulement la tête
Daudet-Alphonse_La-Belle-Nivernaise_<un brave Maure-1048>_21871,aplatir sur la joue de l' enfant . Belle figue
Daudet-Alphonse_La-Belle-Nivernaise_<un brave Maure-1048>_21896,"Pour la faire entrer dans sa bouche , l' enfant"
Daudet-Alphonse_La-Belle-Nivernaise_<un brave Maure-1048>_21899,"entrer dans sa bouche , l' enfant n' avait qu'"
Daudet-Alphonse_La-Belle-Nivernaise_<un brave Maure-1048>_21911,pousser du doigt ; mais il trouvait cela encore trop
Daudet-Alphonse_La-Belle-Nivernaise_<un brave Maure-1048>_21919,"encore trop fatigant , et il restait ainsi , sans"
Daudet-Alphonse_La-Belle-Nivernaise_<un brave Maure-1048>_21930,", avec ce fruit qui lui embaumait la joue ."
Daudet-Alphonse_La-Belle-Nivernaise_<un brave Maure-1048>_21945,tentation devint trop forte ; il cligna de l' œil
Daudet-Alphonse_La-Belle-Nivernaise_<un brave Maure-1048>_21951,cligna de l' œil vers son père et l' appela
Daudet-Alphonse_La-Belle-Nivernaise_<un brave Maure-1048>_21955,vers son père et l' appela d' une voix dolente
Daudet-Alphonse_La-Belle-Nivernaise_<un brave Maure-1048>_21965,": « Papa , dit - il , papa …"
Daudet-Alphonse_La-Belle-Nivernaise_<un brave Maure-1048>_21973,papa … mets - la - moi dans la bouche
Daudet-Alphonse_La-Belle-Nivernaise_<un brave Maure-1048>_21984,"» À ces mots , Sidi Lakdar qui tenait une"
Daudet-Alphonse_La-Belle-Nivernaise_<un brave Maure-1048>_21986,"ces mots , Sidi Lakdar qui tenait une figue à"
Daudet-Alphonse_La-Belle-Nivernaise_<un brave Maure-1048>_22014,l' enfant que tu viens m' offrir pour apprenti !
Daudet-Alphonse_La-Belle-Nivernaise_<un brave Maure-1048>_22025,c' est lui qui est mon maître ! C' est
Daudet-Alphonse_La-Belle-Nivernaise_<un brave Maure-1048>_22033,C' est lui qui doit me donner des leçons !
Daudet-Alphonse_La-Belle-Nivernaise_<un brave Maure-1048>_22057,"enfant toujours couché : « Je te salue , dit"
Daudet-Alphonse_La-Belle-Nivernaise_<un brave Maure-1048>_22062,"Je te salue , dit - il , ô père"
Daudet-Alphonse_La-Belle-Nivernaise_<la mère Louveau-151>_2473,d' ici la colère de la mère Louveau ! Quel
Daudet-Alphonse_La-Belle-Nivernaise_<la mère Louveau-151>_2536,"cheminaient dans le brouillard . Louveau gesticulait , parlait seul"
Daudet-Alphonse_La-Belle-Nivernaise_<la mère Louveau-151>_2539,"brouillard . Louveau gesticulait , parlait seul , préparait un"
Daudet-Alphonse_La-Belle-Nivernaise_<la mère Louveau-151>_2542,"gesticulait , parlait seul , préparait un discours . Victor"
Daudet-Alphonse_La-Belle-Nivernaise_<la mère Louveau-151>_2569,en pouvait plus . Alors le père Louveau s' arrêta
Daudet-Alphonse_La-Belle-Nivernaise_<la mère Louveau-151>_2576,"Louveau s' arrêta , le prit à son cou ,"
Daudet-Alphonse_La-Belle-Nivernaise_<la mère Louveau-151>_2578,"arrêta , le prit à son cou , l' enveloppa"
Daudet-Alphonse_La-Belle-Nivernaise_<la mère Louveau-151>_2582,"à son cou , l' enveloppa dans sa vareuse ."
Daudet-Alphonse_La-Belle-Nivernaise_<la mère Louveau-151>_2584,"cou , l' enveloppa dans sa vareuse . L' étreinte"
Daudet-Alphonse_La-Belle-Nivernaise_<la mère Louveau-151>_2617,risquerait le paquet . Si la mère Louveau les mettait
Daudet-Alphonse_La-Belle-Nivernaise_<la mère Louveau-151>_2643,peut - être bien qu' elle le garderait pour une
Daudet-Alphonse_La-Belle-Nivernaise_<la mère Louveau-151>_2718,"chaînes entrecroisées . Pour rejoindre son bateau , le père"
Daudet-Alphonse_La-Belle-Nivernaise_<la mère Louveau-151>_2721,"Pour rejoindre son bateau , le père Louveau avait à"
Daudet-Alphonse_La-Belle-Nivernaise_<la mère Louveau-151>_2734,reliés par des passerelles . Il avançait à pas craintifs
Daudet-Alphonse_La-Belle-Nivernaise_<la mère Louveau-151>_2749,gêné par l' enfant qui lui étranglait le cou .
Daudet-Alphonse_La-Belle-Nivernaise_<la mère Louveau-151>_2810,sa cuisine . « Veux - tu finir Clara ?
Daudet-Alphonse_La-Belle-Nivernaise_<la mère Louveau-151>_2824,plus temps de reculer . Le marinier poussa la porte
Daudet-Alphonse_La-Belle-Nivernaise_<la mère Louveau-151>_2833,"porte . La mère Louveau lui tournait le dos ,"
Daudet-Alphonse_La-Belle-Nivernaise_<la mère Louveau-151>_2847,", mais elle avait reconnu son pas et dit sans"
Daudet-Alphonse_La-Belle-Nivernaise_<la mère Louveau-151>_2858,"déranger : « C' est toi , François ? Comme"
Daudet-Alphonse_La-Belle-Nivernaise_<la mère Louveau-151>_2860,"« C' est toi , François ? Comme tu rentres"
Daudet-Alphonse_La-Belle-Nivernaise_<la mère Louveau-151>_2863,"toi , François ? Comme tu rentres tard ! »"
Daudet-Alphonse_La-Belle-Nivernaise_<la mère Louveau-151>_2897,vitres de la cabine . François avait posé le marmot
Daudet-Alphonse_La-Belle-Nivernaise_<la mère Louveau-151>_3008,! une surprise ! » Le marinier riait jusqu' aux
Daudet-Alphonse_La-Belle-Nivernaise_<la mère Louveau-151>_3021,donner une contenance ; mais il aurait bien voulu être
Daudet-Alphonse_La-Belle-Nivernaise_<la mère Louveau-151>_3033,"la rue . Et comme sa femme , attendant une"
Daudet-Alphonse_La-Belle-Nivernaise_<la mère Louveau-151>_3040,", attendant une explication , le regardait d' un air"
Daudet-Alphonse_La-Belle-Nivernaise_<la mère Louveau-151>_3047,"d' un air terrible , il bégaya l' histoire tout"
Daudet-Alphonse_La-Belle-Nivernaise_<la mère Louveau-151>_3065,chien qu' on menace . Ses parents l' avaient abandonné
Daudet-Alphonse_La-Belle-Nivernaise_<la mère Louveau-151>_3067,"on menace . Ses parents l' avaient abandonné , il"
Daudet-Alphonse_La-Belle-Nivernaise_<la mère Louveau-151>_3071,"parents l' avaient abandonné , il l' avait trouvé pleurant"
Daudet-Alphonse_La-Belle-Nivernaise_<la mère Louveau-151>_3072,"l' avaient abandonné , il l' avait trouvé pleurant sur"
Daudet-Alphonse_La-Belle-Nivernaise_<la mère Louveau-151>_3094,qui en veut ? » Il avait répondu : «
Daudet-Alphonse_La-Belle-Nivernaise_<la mère Louveau-151>_3099,Il avait répondu : « Moi . » Et le
Daudet-Alphonse_La-Belle-Nivernaise_<la mère Louveau-151>_3105,. » Et le commissaire lui avait dit : «
Daudet-Alphonse_La-Belle-Nivernaise_<la mère Louveau-151>_3111,avait dit : « Emportez - le . — Pas
Daudet-Alphonse_La-Belle-Nivernaise_<la mère Louveau-151>_3118,". — Pas vrai , petit ? » Alors la"
Daudet-Alphonse_La-Belle-Nivernaise_<la mère Louveau-151>_3128,"mère Louveau éclata : « Tu es fou , ou"
Daudet-Alphonse_La-Belle-Nivernaise_<la mère Louveau-151>_3133,"Tu es fou , ou tu as trop bu !"
Daudet-Alphonse_La-Belle-Nivernaise_<la mère Louveau-151>_3151,d' une bêtise pareille ? Tu veux donc nous faire
Daudet-Alphonse_La-Belle-Nivernaise_<la mère Louveau-151>_3161,mourir dans la misère ? Tu trouves que nous sommes
Daudet-Alphonse_La-Belle-Nivernaise_<la mère Louveau-151>_3185,place pour coucher ? » François considérait ses souliers sans
Daudet-Alphonse_La-Belle-Nivernaise_<la mère Louveau-151>_3187,coucher ? » François considérait ses souliers sans répondre .
Daudet-Alphonse_La-Belle-Nivernaise_<la mère Louveau-151>_3198,"Mais , malheureux , regarde - toi , regarde nous"
Daudet-Alphonse_La-Belle-Nivernaise_<la mère Louveau-151>_3204,"toi , regarde nous ! Ton bateau est percé comme"
Daudet-Alphonse_La-Belle-Nivernaise_<la mère Louveau-151>_3217,Et il faut encore que tu t' amuses à ramasser
Daudet-Alphonse_La-Belle-Nivernaise_<la mère Louveau-151>_3231,dans les ruisseaux . » Il s' était déjà dit
Daudet-Alphonse_La-Belle-Nivernaise_<la mère Louveau-151>_3239,"déjà dit tout cela , le pauvre homme . Il"
Daudet-Alphonse_La-Belle-Nivernaise_<la mère Louveau-151>_3243,", le pauvre homme . Il ne songeait pas à"
Daudet-Alphonse_La-Belle-Nivernaise_<la mère Louveau-151>_3250,songeait pas à protester . Il baissait la tête comme
Daudet-Alphonse_La-Belle-Nivernaise_<la mère Louveau-151>_3263,entend le réquisitoire . « Tu vas me faire le
Daudet-Alphonse_La-Belle-Nivernaise_<la mère Louveau-151>_3289,"façons pour le reprendre , tu lui diras que ta"
Daudet-Alphonse_La-Belle-Nivernaise_<la mère Louveau-151>_3293,", tu lui diras que ta femme ne veut pas"
Daudet-Alphonse_La-Belle-Nivernaise_<la mère Louveau-151>_3305,"- ce compris ? » Elle marchait sur lui ,"
Daudet-Alphonse_La-Belle-Nivernaise_<la mère Louveau-151>_3308,"? » Elle marchait sur lui , son poêlon à"
Daudet-Alphonse_La-Belle-Nivernaise_<la mère Louveau-151>_3310,"Elle marchait sur lui , son poêlon à la main"
Daudet-Alphonse_La-Belle-Nivernaise_<la mère Louveau-151>_3321,avec un geste menaçant . Le marinier promit tout ce
Daudet-Alphonse_La-Belle-Nivernaise_<la mère Louveau-151>_3327,marinier promit tout ce qu' elle voulut . « Voyons
Daudet-Alphonse_La-Belle-Nivernaise_<la mère Louveau-151>_3338,ne te fâche pas . J' avais cru bien faire
Daudet-Alphonse_La-Belle-Nivernaise_<la mère Louveau-151>_3344,avais cru bien faire . Je me suis trompé .
Daudet-Alphonse_La-Belle-Nivernaise_<la mère Louveau-151>_3364,suite ? » La soumission du bonhomme adoucit la mère
Daudet-Alphonse_La-Belle-Nivernaise_<la mère Louveau-151>_3367,La soumission du bonhomme adoucit la mère Louveau . Peut
Daudet-Alphonse_La-Belle-Nivernaise_<la mère Louveau-151>_3376,Peut - être aussi eut - elle la vision d'
Daudet-Alphonse_La-Belle-Nivernaise_<la mère Louveau-151>_3383,la vision d' un de ses enfants à elle perdu
Daudet-Alphonse_La-Belle-Nivernaise_<la mère Louveau-151>_3386,un de ses enfants à elle perdu tout seul dans
Daudet-Alphonse_La-Belle-Nivernaise_<la mère Louveau-151>_3401,tendue vers les passants . Elle se détourna pour mettre
Daudet-Alphonse_La-Belle-Nivernaise_<la mère Louveau-151>_3406,Elle se détourna pour mettre son poêlon sur le feu
Daudet-Alphonse_La-Belle-Nivernaise_<la mère Louveau-151>_3412,poêlon sur le feu et dit d' un ton bourru
Daudet-Alphonse_La-Belle-Nivernaise_<la mère Louveau-151>_3435,"fermé . Et maintenant que tu l' as pris ,"
Daudet-Alphonse_La-Belle-Nivernaise_<la mère Louveau-151>_3440,"tu l' as pris , tu ne peux pas le"
Daudet-Alphonse_La-Belle-Nivernaise_<la mère Louveau-151>_3462,demain matin … » Et la mère Louveau était si
Daudet-Alphonse_La-Belle-Nivernaise_<la mère Louveau-151>_3470,était si en colère qu' elle tisonnait le feu à
Daudet-Alphonse_La-Belle-Nivernaise_<la mère Louveau-151>_3484,"« Mais demain matin , je te jure bien que"
Daudet-Alphonse_La-Belle-Nivernaise_<la mère Louveau-151>_3485,"Mais demain matin , je te jure bien que tu"
Daudet-Alphonse_La-Belle-Nivernaise_<la mère Louveau-151>_3489,je te jure bien que tu m' en débarrasseras !
Daudet-Alphonse_La-Belle-Nivernaise_<la mère Louveau-151>_3490,te jure bien que tu m' en débarrasseras ! »
Daudet-Alphonse_La-Belle-Nivernaise_<la mère Louveau-151>_3501,y eut un silence . La ménagère mettait le couvert
Daudet-Alphonse_La-Belle-Nivernaise_<la mère Louveau-151>_3609,un jour de neige . La mère Louveau le servait
Daudet-Alphonse_La-Belle-Nivernaise_<la mère Louveau-151>_3655,". La table desservie , ses enfants couchés , la"
Daudet-Alphonse_La-Belle-Nivernaise_<la mère Louveau-151>_3659,", ses enfants couchés , la mère Louveau s' assit"
Daudet-Alphonse_La-Belle-Nivernaise_<la mère Louveau-151>_3695,sale comme il est . Je parie qu' il n'
Daudet-Alphonse_La-Belle-Nivernaise_<la mère Louveau-151>_3759,des pommes d' api . La mère Louveau considérait son
Daudet-Alphonse_La-Belle-Nivernaise_<la mère Louveau-151>_3763,. La mère Louveau considérait son œuvre avec une nuance
Daudet-Alphonse_La-Belle-Nivernaise_<la mère Louveau-151>_3861,les arbres de Clamecy . La mère Louveau le regardait
Daudet-Alphonse_La-Belle-Nivernaise_<la mère Louveau-151>_3880,"tu fais donc ? — Je prends la mesure ,"
Daudet-Alphonse_La-Belle-Nivernaise_<la mère Louveau-151>_3888,"mesure , bédame ! » Elle lui arracha la corde"
Daudet-Alphonse_La-Belle-Nivernaise_<la mère Louveau-151>_3898,"des mains , et la jeta à l' autre bout"
