,text_surronding
Delly_Les-deux-crimes-de-Thecle_<du docteur Martoux-1152>_26269,"gentille , fillette ! À ma prochaine visite , tu"
Delly_Les-deux-crimes-de-Thecle_<du docteur Martoux-1152>_26279,auras de bonnes choses ; je te le promets .
Delly_Les-deux-crimes-de-Thecle_<du docteur Martoux-1152>_26299,"Quand viendras - tu , tonton Anatole ?– Bientôt ,"
Delly_Les-deux-crimes-de-Thecle_<du docteur Martoux-1152>_26317,- frère . . . le docteur le trouve bien
Delly_Les-deux-crimes-de-Thecle_<du docteur Martoux-1152>_26332,"de la faiblesse , dit le médecin . Il a"
Delly_Les-deux-crimes-de-Thecle_<du docteur Martoux-1152>_26344,réagi à la piqûre que je lui ai faite .
Delly_Les-deux-crimes-de-Thecle_<du docteur Martoux-1152>_26349,je lui ai faite . Je ne pense pas qu'
Delly_Les-deux-crimes-de-Thecle_<du docteur Martoux-1152>_26388,". . . Ne pensez - vous pas , docteur"
Delly_Les-deux-crimes-de-Thecle_<du docteur Martoux-1152>_26392,"pensez - vous pas , docteur , que ce voyage"
Delly_Les-deux-crimes-de-Thecle_<du docteur Martoux-1152>_26486,le voici chez lui ! Je pourrai du moins l'
Delly_Les-deux-crimes-de-Thecle_<du docteur Martoux-1152>_26501,sa fin . – Que votre dévouement saura lui adoucir
Delly_Les-deux-crimes-de-Thecle_<du docteur Martoux-1152>_26514,". . . Maintenant , je vous quitte . Je"
Delly_Les-deux-crimes-de-Thecle_<du docteur Martoux-1152>_26518,", je vous quitte . Je crois inutile de revenir"
Delly_Les-deux-crimes-de-Thecle_<du docteur Martoux-1152>_26525,"inutile de revenir , car je ne puis malheureusement faire"
Delly_Les-deux-crimes-de-Thecle_<du docteur Martoux-1152>_26553,"charger ?– Très volontiers , docteur , dis - je"
Delly_Les-deux-crimes-de-Thecle_<du docteur Martoux-1152>_26556,"volontiers , docteur , dis - je . – Je"
Delly_Les-deux-crimes-de-Thecle_<du docteur Martoux-1152>_26560,dis - je . – Je vais vous laisser de
Delly_Les-deux-crimes-de-Thecle_<du docteur Martoux-1152>_26570,la morphine . . . Il prit une boîte d'
Delly_Les-deux-crimes-de-Thecle_<du docteur Martoux-1152>_26577,une boîte d' ampoules dans son sac et me la
Delly_Les-deux-crimes-de-Thecle_<du docteur Martoux-1152>_26580,ampoules dans son sac et me la tendit . –
Delly_Les-deux-crimes-de-Thecle_<du docteur Martoux-1152>_26587,tendit . – Oh ! je ne dérangerai pas Mlle
Delly_Les-deux-crimes-de-Thecle_<du docteur Martoux-1152>_26599,dans ce cas ! dit Mme de Grisolles . Elle
Delly_Les-deux-crimes-de-Thecle_<du docteur Martoux-1152>_26610,déjà affaire avec Fernande et ma belle - fille qui
Delly_Les-deux-crimes-de-Thecle_<du docteur Martoux-1152>_26619,qui est malade aussi . Je puis très bien faire
Delly_Les-deux-crimes-de-Thecle_<du docteur Martoux-1152>_26631,". Mieux vaut donc que vous me donniez cela ,"
Delly_Les-deux-crimes-de-Thecle_<du docteur Martoux-1152>_26632,"Mieux vaut donc que vous me donniez cela , chère"
Delly_Les-deux-crimes-de-Thecle_<du docteur Martoux-1152>_26636,"vous me donniez cela , chère Mademoiselle . Elle tendait"
Delly_Les-deux-crimes-de-Thecle_<du docteur Martoux-1152>_26648,pour prendre la boîte . J' interrogeai du regard le
Delly_Les-deux-crimes-de-Thecle_<du docteur Martoux-1152>_26652,. J' interrogeai du regard le docteur . – Mais
Delly_Les-deux-crimes-de-Thecle_<du docteur Martoux-1152>_26661,"Mais oui , donnez , Mademoiselle . C' est en"
Delly_Les-deux-crimes-de-Thecle_<du docteur Martoux-1152>_26671,effet beaucoup plus simple . J' oubliais que Mme de
Delly_Les-deux-crimes-de-Thecle_<du docteur Martoux-1152>_26674,"simple . J' oubliais que Mme de Grisolles sait ,"
Delly_Les-deux-crimes-de-Thecle_<du docteur Martoux-1152>_26728,"la chambre de Fernande , je me rendis près de"
Delly_Les-deux-crimes-de-Thecle_<du docteur Martoux-1152>_26735,rendis près de Sylvine que je trouvai fiévreuse . Aussi
Delly_Les-deux-crimes-de-Thecle_<du docteur Martoux-1152>_26741,trouvai fiévreuse . Aussi décidai - je qu' elle ne
Delly_Les-deux-crimes-de-Thecle_<du docteur Martoux-1152>_26762,était maussade et froid . J' allai donc seule faire
Delly_Les-deux-crimes-de-Thecle_<du docteur Martoux-1152>_26774,dans le parc . Mais je n' utilisai pas l'
Delly_Les-deux-crimes-de-Thecle_<du docteur Martoux-1152>_26785,"dérobé , craignant de rencontrer Mme de Grisolles ou Saturnin"
Delly_Les-deux-crimes-de-Thecle_<du docteur Martoux-1152>_26813,"étage . En revenant , je passai près du donjon"
Delly_Les-deux-crimes-de-Thecle_<du docteur Martoux-1152>_26882,"de femme , évidemment . Je les suivis et constatai"
Delly_Les-deux-crimes-de-Thecle_<du docteur Martoux-1152>_26904,"des portes - fenêtres . Mme de Grisolles , M"
Delly_Les-deux-crimes-de-Thecle_<du docteur Martoux-1152>_26945,". Déjà , une chose m' avait intriguée . Dans"
Delly_Les-deux-crimes-de-Thecle_<du docteur Martoux-1152>_26968,être amené en ambulance . Mme de Grisolles m' avait
Delly_Les-deux-crimes-de-Thecle_<du docteur Martoux-1152>_26971,ambulance . Mme de Grisolles m' avait dit d' ailleurs
Delly_Les-deux-crimes-de-Thecle_<du docteur Martoux-1152>_27009,"nuit ? Du reste , j' allais bien le savoir"
Delly_Les-deux-crimes-de-Thecle_<du docteur Martoux-1152>_27017,le savoir . . . Je redescendis et gagnai la
Delly_Les-deux-crimes-de-Thecle_<du docteur Martoux-1152>_27032,"humide de l' avenue , je vis des traces de"
Delly_Les-deux-crimes-de-Thecle_<du docteur Martoux-1152>_27119,alors ? . . . Je fus effrayée de la
Delly_Les-deux-crimes-de-Thecle_<du docteur Martoux-1152>_27129,"conclusion qui se présentait à mon esprit . Cependant ,"
Delly_Les-deux-crimes-de-Thecle_<du docteur Martoux-1152>_27134,"mon esprit . Cependant , je ne pouvais trouver d'"
Delly_Les-deux-crimes-de-Thecle_<du docteur Martoux-1152>_27205,"cachaient derrière tout cela ?Comme je rentrais , fort troublée"
Delly_Les-deux-crimes-de-Thecle_<du docteur Martoux-1152>_27211,"rentrais , fort troublée , je songeai , en passant"
Delly_Les-deux-crimes-de-Thecle_<du docteur Martoux-1152>_27294,qu' à l' ordinaire . Je me gardai de dire
Delly_Les-deux-crimes-de-Thecle_<du docteur Martoux-1152>_27303,dire mot à Sylvine de mes soupçons . Mais l'
Delly_Les-deux-crimes-de-Thecle_<du docteur Martoux-1152>_27314,de cette demeure devenait pour moi de plus en plus
Delly_Les-deux-crimes-de-Thecle_<du docteur Martoux-1152>_27321,plus en plus lourde . J' aspirais à confier à
Delly_Les-deux-crimes-de-Thecle_<du docteur Martoux-1152>_27326,J' aspirais à confier à mes amis Paviers ce que
Delly_Les-deux-crimes-de-Thecle_<du docteur Martoux-1152>_27331,mes amis Paviers ce que je venais de découvrir .
Delly_Les-deux-crimes-de-Thecle_<du docteur Martoux-1152>_27354,Thècle et de Sylvine . Je dus faire effort pour
Delly_Les-deux-crimes-de-Thecle_<du docteur Martoux-1152>_27364,ne rien laisser voir de mes sentiments quand je me
Delly_Les-deux-crimes-de-Thecle_<du docteur Martoux-1152>_27367,voir de mes sentiments quand je me retrouvai en présence
Delly_Les-deux-crimes-de-Thecle_<du docteur Martoux-1152>_27385,l' après - midi . Je la rencontrai sur le
Delly_Les-deux-crimes-de-Thecle_<du docteur Martoux-1152>_27443,Je croyais que c' était vous qui l' aviez prévenu
Delly_Les-deux-crimes-de-Thecle_<du docteur Martoux-1152>_27449,qui l' aviez prévenu ?Elle me jeta un rapide regard
Delly_Les-deux-crimes-de-Thecle_<du docteur Martoux-1152>_27456,"un rapide regard , où je vis luire la méfiance"
Delly_Les-deux-crimes-de-Thecle_<du docteur Martoux-1152>_27469,"non ! Comment l' aurais - je pu , puisque"
Delly_Les-deux-crimes-de-Thecle_<du docteur Martoux-1152>_27474,"- je pu , puisque j' ignorais le jour où"
Delly_Les-deux-crimes-de-Thecle_<du docteur Martoux-1152>_27479,j' ignorais le jour où mon mari arriverait ? C'
Delly_Les-deux-crimes-de-Thecle_<du docteur Martoux-1152>_27500,faire cette petite visite . Je me gardai de relever
Delly_Les-deux-crimes-de-Thecle_<du docteur Martoux-1152>_27512,. Mais il était pour moi une preuve de plus
Delly_Les-deux-crimes-de-Thecle_<du docteur Martoux-1152>_27519,"preuve de plus . Dominant ma répulsion , je lui"
Delly_Les-deux-crimes-de-Thecle_<du docteur Martoux-1152>_27522,". Dominant ma répulsion , je lui fis part du"
Delly_Les-deux-crimes-de-Thecle_<du docteur Martoux-1152>_27539,. – Mais certainement ! Je la conduirai près de
Delly_Les-deux-crimes-de-Thecle_<du docteur Martoux-1152>_27575,l' a bien recommandé . J' allai rapporter ces paroles
Delly_Les-deux-crimes-de-Thecle_<du docteur Martoux-1152>_27625,faire du mal . – Je pense que c' est
Delly_Les-deux-crimes-de-Thecle_<du docteur Martoux-1152>_27634,"est un prétexte , déclarai - je franchement . Je"
Delly_Les-deux-crimes-de-Thecle_<du docteur Martoux-1152>_27638,déclarai - je franchement . Je crains qu' elle en
Delly_Les-deux-crimes-de-Thecle_<du docteur Martoux-1152>_27731,sa place . Mais il me serait facile de voir
Delly_Les-deux-crimes-de-Thecle_<du docteur Martoux-1152>_27822,dans la cuisine . Quand j' eus monté nos plateaux
Delly_Les-deux-crimes-de-Thecle_<du docteur Martoux-1152>_27849,"l' escalier dérobé , dont j' avais eu soin d'"
Delly_Les-deux-crimes-de-Thecle_<du docteur Martoux-1152>_27882,"frissonnante , s' appuyait à mon bras . Traversant les"
Delly_Les-deux-crimes-de-Thecle_<du docteur Martoux-1152>_27956,dirigées à l' aide de ma lampe de poche .
Delly_Les-deux-crimes-de-Thecle_<du docteur Martoux-1152>_27970,"ce couloir sombre , elle me servit pour éclairer Sylvine"
Delly_Les-deux-crimes-de-Thecle_<du docteur Martoux-1152>_28111,du malade se crispa . Je vis dans son regard
Delly_Les-deux-crimes-de-Thecle_<du docteur Martoux-1152>_28122,"souffrance , un désespoir qui me bouleversèrent . – Mes"
Delly_Les-deux-crimes-de-Thecle_<du docteur Martoux-1152>_28171,Grisolles prononça un mot que je ne compris pas .
Delly_Les-deux-crimes-de-Thecle_<du docteur Martoux-1152>_28185,en levant la tête vers moi :– Il demande un
Delly_Les-deux-crimes-de-Thecle_<du docteur Martoux-1152>_28197,– Comment faire ? murmurai - je . On ne
Delly_Les-deux-crimes-de-Thecle_<du docteur Martoux-1152>_28239,"faut le laisser maintenant , ma petite Sylvine , dis"
Delly_Les-deux-crimes-de-Thecle_<du docteur Martoux-1152>_28244,"ma petite Sylvine , dis - je . Nous risquerions"
Delly_Les-deux-crimes-de-Thecle_<du docteur Martoux-1152>_28278,":– Je reviendrai demain , papa . Les longues mains"
Delly_Les-deux-crimes-de-Thecle_<du docteur Martoux-1152>_28312,le chemin du retour . Je soutenais la pauvre enfant
Delly_Les-deux-crimes-de-Thecle_<du docteur Martoux-1152>_28329,un soupir de soulagement que je me retrouvai dans sa
Delly_Les-deux-crimes-de-Thecle_<du docteur Martoux-1152>_28336,retrouvai dans sa chambre . Je l' étendis sur son
Delly_Les-deux-crimes-de-Thecle_<du docteur Martoux-1152>_28354,. Elle sanglotait doucement . Je m' assis près d'
Delly_Les-deux-crimes-de-Thecle_<du docteur Martoux-1152>_28385,étant donné l' émotion que j' éprouvais moi - même
Delly_Les-deux-crimes-de-Thecle_<du docteur Martoux-1152>_28387,l' émotion que j' éprouvais moi - même et tout
Delly_Les-deux-crimes-de-Thecle_<du docteur Martoux-1152>_28394,"même et tout ce que je soupçonnais de trouble ,"
Delly_Les-deux-crimes-de-Thecle_<du docteur Martoux-1152>_28415,"est d' elle qu' il me parlait , mon pauvre"
Delly_Les-deux-crimes-de-Thecle_<du docteur Martoux-1152>_28418,"qu' il me parlait , mon pauvre papa , quand"
Delly_Les-deux-crimes-de-Thecle_<du docteur Martoux-1152>_28500,"ne pouvons le savoir , mon enfant . Peut -"
Delly_Les-deux-crimes-de-Thecle_<du docteur Martoux-1152>_28523,qu' elle cache . Mais je me doutais bien que
Delly_Les-deux-crimes-de-Thecle_<du docteur Martoux-1152>_28539,à sa séquestration . Quand je vis Sylvine un peu
Delly_Les-deux-crimes-de-Thecle_<du docteur Martoux-1152>_28546,"Sylvine un peu calme , je me rendis près de"
Delly_Les-deux-crimes-de-Thecle_<du docteur Martoux-1152>_28556,Fernande pour le massage que je lui faisais depuis quelque
Delly_Les-deux-crimes-de-Thecle_<du docteur Martoux-1152>_28576,pas et ce fut pour moi un grand soulagement .
Delly_Les-deux-crimes-de-Thecle_<du docteur Martoux-1152>_28581,moi un grand soulagement . J' aimais encore mieux entendre
Delly_Les-deux-crimes-de-Thecle_<du docteur Martoux-1152>_28599,"sa mère . Toutefois , je ne pouvais songer sans"
Delly_Les-deux-crimes-de-Thecle_<du docteur Martoux-1152>_28684,"demandait ?En quittant Fernande , je retournai chez Sylvine pour"
Delly_Les-deux-crimes-de-Thecle_<du docteur Martoux-1152>_28714,. Elle se tourna vers moi et me dit sans
Delly_Les-deux-crimes-de-Thecle_<du docteur Martoux-1152>_28716,se tourna vers moi et me dit sans préambule :–
Delly_Les-deux-crimes-de-Thecle_<du docteur Martoux-1152>_28723,"sans préambule :– Alors , vous savez maintenant de quoi"
Delly_Les-deux-crimes-de-Thecle_<M . Pontet-1811>_42693,de quoi la réchauffer . M . Pontet est parti
Delly_Les-deux-crimes-de-Thecle_<M . Pontet-1811>_42785,gouttes sur son visage . M . Pontet et Saturnin
Delly_Les-deux-crimes-de-Thecle_<M . Pontet-1811>_42810,Des crispations tiraient la figure du premier . L' autre
Delly_Les-deux-crimes-de-Thecle_<M . Pontet-1811>_42818,L' autre demeurait impassible . M . Pontet s' avança
Delly_Les-deux-crimes-de-Thecle_<M . Pontet-1811>_42824,. Pontet s' avança . Il dit d' une voix
Delly_Les-deux-crimes-de-Thecle_<M . Pontet-1811>_42878,: « Comment le saurais - je ? »– C'
Delly_Les-deux-crimes-de-Thecle_<M . Pontet-1811>_42887,"C' est épouvantable ! Après ma sœur , ma nièce"
Delly_Les-deux-crimes-de-Thecle_<M . Pontet-1811>_42890,"! Après ma sœur , ma nièce . . ."
Delly_Les-deux-crimes-de-Thecle_<M . Pontet-1811>_42923,profiter de ces morts . M . Pontet se tourna
Delly_Les-deux-crimes-de-Thecle_<M . Pontet-1811>_42930,"Pontet se tourna brusquement vers lui . – Oui ,"
Delly_Les-deux-crimes-de-Thecle_<M . Pontet-1811>_42942,profiter ! . . . Je comprends maintenant !– Vous
Delly_Les-deux-crimes-de-Thecle_<M . Pontet-1811>_42946,. Je comprends maintenant !– Vous comprenez quoi ?M .
Delly_Les-deux-crimes-de-Thecle_<M . Pontet-1811>_42966,pas besoin d' explications . Vous savez ce que je
Delly_Les-deux-crimes-de-Thecle_<M . Pontet-1811>_42970,. Vous savez ce que je veux dire . J'
Delly_Les-deux-crimes-de-Thecle_<M . Pontet-1811>_42974,que je veux dire . J' intervins avec indignation .
Delly_Les-deux-crimes-de-Thecle_<M . Pontet-1811>_42980,intervins avec indignation . – Je vous prie d' aller
Delly_Les-deux-crimes-de-Thecle_<M . Pontet-1811>_42981,avec indignation . – Je vous prie d' aller discuter
Delly_Les-deux-crimes-de-Thecle_<M . Pontet-1811>_42997,de mort !M . Pontet me jeta un regard noir
Delly_Les-deux-crimes-de-Thecle_<M . Pontet-1811>_43006,noir . – C' est mon droit de chercher à
Delly_Les-deux-crimes-de-Thecle_<M . Pontet-1811>_43038,ici de la belladone . J' en avais prescrit à
Delly_Les-deux-crimes-de-Thecle_<M . Pontet-1811>_43054,". Tout en parlant , le docteur se levait péniblement"
Delly_Les-deux-crimes-de-Thecle_<M . Pontet-1811>_43069,. . . Mlle Marsollier me dit que la fiole
Delly_Les-deux-crimes-de-Thecle_<M . Pontet-1811>_43099,– Ah ! voilà donc l' explication ! Quelqu' un
Delly_Les-deux-crimes-de-Thecle_<M . Pontet-1811>_43112,poison se trouvait là . M . Pontet glissait un
Delly_Les-deux-crimes-de-Thecle_<M . Pontet-1811>_43136,"apercevoir , se tourna vers moi . – Avez -"
Delly_Les-deux-crimes-de-Thecle_<M . Pontet-1811>_43144,"Avez - vous besoin de mes services , Mademoiselle ?Je"
Delly_Les-deux-crimes-de-Thecle_<M . Pontet-1811>_43159,négatif . Il sortit et M . Pontet se décida
Delly_Les-deux-crimes-de-Thecle_<M . Pontet-1811>_43169,à en faire autant . J' avais envoyé Denise près
Delly_Les-deux-crimes-de-Thecle_<M . Pontet-1811>_43185,s' était encore aggravé . Le docteur descendit pour la
Delly_Les-deux-crimes-de-Thecle_<M . Pontet-1811>_43192,descendit pour la voir et je commençai la toilette de
Delly_Les-deux-crimes-de-Thecle_<M . Pontet-1811>_43202,la jeune morte . Comme j' ouvrais un tiroir pour
Delly_Les-deux-crimes-de-Thecle_<M . Pontet-1811>_43212,"y prendre du linge , je trouvai là un grand"
Delly_Les-deux-crimes-de-Thecle_<M . Pontet-1811>_43240,. Il était entrouvert et j' aperçus une boîte portant
Delly_Les-deux-crimes-de-Thecle_<M . Pontet-1811>_43253,un confiseur de Brive . Je l' ouvris . Sur
Delly_Les-deux-crimes-de-Thecle_<M . Pontet-1811>_43270,était vide . Sans doute M . Pontet l' avait
Delly_Les-deux-crimes-de-Thecle_<M . Pontet-1811>_43275,M . Pontet l' avait - il donnée la veille
Delly_Les-deux-crimes-de-Thecle_<M . Pontet-1811>_43281,il donnée la veille à sa nièce . Voici pourquoi
Delly_Les-deux-crimes-de-Thecle_<M . Pontet-1811>_43300,souffrances à l' estomac . J' allais remettre la boîte
Delly_Les-deux-crimes-de-Thecle_<M . Pontet-1811>_43310,"dans le sac , quand je me ravisai . L'"
Delly_Les-deux-crimes-de-Thecle_<M . Pontet-1811>_43331,veille et il fallait que je puisse lui présenter ces
Delly_Les-deux-crimes-de-Thecle_<M . Pontet-1811>_43344,", en premier lieu , je devais les mettre en"
Delly_Les-deux-crimes-de-Thecle_<M . Pontet-1811>_43352,mettre en lieu sûr . J' allai les enfermer dans
Delly_Les-deux-crimes-de-Thecle_<M . Pontet-1811>_43357,J' allai les enfermer dans mon armoire et revins à
Delly_Les-deux-crimes-de-Thecle_<M . Pontet-1811>_43360,enfermer dans mon armoire et revins à la chambre de
Delly_Les-deux-crimes-de-Thecle_<M . Pontet-1811>_43368,chambre de Fernande . Denise me rejoignit peu après et
Delly_Les-deux-crimes-de-Thecle_<M . Pontet-1811>_43381,tâche presque en silence . J' étais à demi abrutie
Delly_Les-deux-crimes-de-Thecle_<M . Pontet-1811>_43401,d' événements dramatiques . Il me fallut prendre un peu
Delly_Les-deux-crimes-de-Thecle_<M . Pontet-1811>_43433,"quand Mélanie arriva , elle lui confia la garde de"
Delly_Les-deux-crimes-de-Thecle_<M . Pontet-1811>_43452,par téléphone l' inspecteur . Je descendis un peu plus
Delly_Les-deux-crimes-de-Thecle_<M . Pontet-1811>_43459,un peu plus tard et trouvai dans la cuisine M
Delly_Les-deux-crimes-de-Thecle_<M . Pontet-1811>_43470,Pontet qui se leva pour me saluer . – Je
Delly_Les-deux-crimes-de-Thecle_<M . Pontet-1811>_43507,vue de ce misérable Saturnin m' avait mis hors de
Delly_Les-deux-crimes-de-Thecle_<M . Pontet-1811>_43512,m' avait mis hors de moi . Car c' est
Delly_Les-deux-crimes-de-Thecle_<M . Pontet-1811>_43535,s' approprier les économies de ma sœur !Je le regardai
Delly_Les-deux-crimes-de-Thecle_<M . Pontet-1811>_43543,le regardai en face et répliquai froidement :– Voilà une
Delly_Les-deux-crimes-de-Thecle_<M . Pontet-1811>_43554,"bien grave , Monsieur !– Je ne me gênerai pas"
Delly_Les-deux-crimes-de-Thecle_<M . Pontet-1811>_43566,"répéter devant l' inspecteur ! Ma pauvre sœur , si"
Delly_Les-deux-crimes-de-Thecle_<M . Pontet-1811>_43593,ce qu' elle possédait . Je voyais qu' il contenait
Delly_Les-deux-crimes-de-Thecle_<M . Pontet-1811>_43622,il le prétendait . Mais je n' avais pas à
Delly_Les-deux-crimes-de-Thecle_<M . Pontet-1811>_43632,me mêler de cela . Je lui répondis par un
Delly_Les-deux-crimes-de-Thecle_<M . Pontet-1811>_43640,"par un geste évasif et me rendis chez Thècle ,"
Delly_Les-deux-crimes-de-Thecle_<M . Pontet-1811>_43685,"de celle - ci , je lui donnai quelques soins"
Delly_Les-deux-crimes-de-Thecle_<M . Pontet-1811>_43716,murmura :– Merci . Sylvine m' emmena dans la cour
Delly_Les-deux-crimes-de-Thecle_<M . Pontet-1811>_43808,. . . Mlle Paviers m' a dit que Fernande
Delly_Les-deux-crimes-de-Thecle_<M . Pontet-1811>_43822,C' est pour cela que j' ai entendu du va
Delly_Les-deux-crimes-de-Thecle_<M . Pontet-1811>_43841,morte . – Morte ?Sylvine me regardait avec des yeux
Delly_Les-deux-crimes-de-Thecle_<M . Pontet-1811>_43848,avec des yeux stupéfaits . Je lui pris la main
Delly_Les-deux-crimes-de-Thecle_<M . Pontet-1811>_43889,"Retournez près d' elle , ma chérie , car j'"
Delly_Les-deux-crimes-de-Thecle_<M . Pontet-1811>_43893,", ma chérie , car j' ai affaire là -"
Delly_Les-deux-crimes-de-Thecle_<M . Pontet-1811>_43906,Oui . Mais je voulais vous demander . . .
Delly_Les-deux-crimes-de-Thecle_<M . Pontet-1811>_43917,"à l' heure , elle m' a dit : «"
Delly_Les-deux-crimes-de-Thecle_<M . Pontet-1811>_43966,regrette . . . Si tu crois que je dois
Delly_Les-deux-crimes-de-Thecle_<M . Pontet-1811>_43981,? . . . »– Vous pensez qu' elle voudrait
Delly_Les-deux-crimes-de-Thecle_<M . Pontet-1811>_43990,"voudrait voir un prêtre , Sylvine ?– Oui , Mademoiselle"
Delly_Les-deux-crimes-de-Thecle_<M . Pontet-1811>_43994,", Sylvine ?– Oui , Mademoiselle . Ma pauvre Thècle"
Delly_Les-deux-crimes-de-Thecle_<M . Pontet-1811>_43996,"?– Oui , Mademoiselle . Ma pauvre Thècle ! Son"
Delly_Les-deux-crimes-de-Thecle_<M . Pontet-1811>_44017,"quand Mlle Denise reviendra , je lui demanderai de faire"
Delly_Les-deux-crimes-de-Thecle_<M . Pontet-1811>_44032,". Là - dessus , je remontai chez moi ."
Delly_Les-deux-crimes-de-Thecle_<M . Pontet-1811>_44035,"dessus , je remontai chez moi . J' avais des"
Delly_Les-deux-crimes-de-Thecle_<M . Pontet-1811>_44037,je remontai chez moi . J' avais des pantoufles et
Delly_Les-deux-crimes-de-Thecle_<M . Pontet-1811>_44042,J' avais des pantoufles et je montai sans bruit .
Delly_Les-deux-crimes-de-Thecle_<M . Pontet-1811>_44053,"arrivant sur le palier , mon ouïe très fine perçut"
Delly_Les-deux-crimes-de-Thecle_<M . Pontet-1811>_44065,"d' une serrure . Comme j' atteignais le couloir ,"
Delly_Les-deux-crimes-de-Thecle_<M . Pontet-1811>_44070,"j' atteignais le couloir , je vis M . Pontet"
Delly_Les-deux-crimes-de-Thecle_<M . Pontet-1811>_44106,", instinctivement , y pénétrai - je à mon tour"
Delly_Les-deux-crimes-de-Thecle_<M . Pontet-1811>_44109,y pénétrai - je à mon tour et jetai -
Delly_Les-deux-crimes-de-Thecle_<M . Pontet-1811>_44112,je à mon tour et jetai - je un coup
Delly_Les-deux-crimes-de-Thecle_<M . Pontet-1811>_44113,à mon tour et jetai - je un coup d'
Delly_Les-deux-crimes-de-Thecle_<M . Pontet-1811>_44121,coup d' œil autour de moi ?Rien ne semblait déplacé
Delly_Les-deux-crimes-de-Thecle_<M . Pontet-1811>_44134,"était fermée , telle que je l' avais laissée en"
Delly_Les-deux-crimes-de-Thecle_<M . Pontet-1811>_44149,la petite commode aussi . Je tirai l' un d'
Delly_Les-deux-crimes-de-Thecle_<M . Pontet-1811>_44172,"le devant , alors que je l' avais mis dans"
Delly_Les-deux-crimes-de-Thecle_<M . Pontet-1811>_44180,mis dans le fond . Je me retirai dans ma
Delly_Les-deux-crimes-de-Thecle_<M . Pontet-1811>_44184,. Je me retirai dans ma chambre fort troublée .
Delly_Les-deux-crimes-de-Thecle_<M . Pontet-1811>_44262,"Après qu' il eût entendu mon récit , il demanda"
Delly_Les-deux-crimes-de-Thecle_<M . Pontet-1811>_44305,souffrir de l' estomac . J' ai pensé que cela
Delly_Les-deux-crimes-de-Thecle_<M . Pontet-1811>_44354,apportés le jour même . J' ai mis la boîte
Delly_Les-deux-crimes-de-Thecle_<M . Pontet-1811>_44373,fait . Remettez - les - moi tout à l'
Delly_Les-deux-crimes-de-Thecle_<M . Pontet-1811>_44431,"Préparée par qui ?– Par moi , comme tous les"
Delly_Les-deux-crimes-de-Thecle_<M . Pontet-1811>_44438,comme tous les soirs . Je faisais bouillir de l'
Delly_Les-deux-crimes-de-Thecle_<M . Pontet-1811>_44446,"de l' eau , la versais sur les feuilles dans"
Delly_Les-deux-crimes-de-Thecle_<M . Pontet-1811>_44455,dans un petit pot et apportais celui - ci dans
Delly_Les-deux-crimes-de-Thecle_<M . Pontet-1811>_44486,"le temps , non . Je suis allée un moment"
Delly_Les-deux-crimes-de-Thecle_<M . Pontet-1811>_44505,"quelqu' un d' autre que vous à la cuisine ,"
Delly_Les-deux-crimes-de-Thecle_<M . Pontet-1811>_44516,ce moment - là ?– Je ne crois pas .
Delly_Les-deux-crimes-de-Thecle_<M . Pontet-1811>_44523,crois pas . . . Je ne me souviens pas
Delly_Les-deux-crimes-de-Thecle_<M . Pontet-1811>_44533,"très bien , mais il me semble que non ."
Delly_Les-deux-crimes-de-Thecle_<M . Pontet-1811>_44552,"meurtrier , s' il guettait votre absence , ait pu"
Delly_Les-deux-crimes-de-Thecle_<M . Pontet-1811>_44570,", évidemment . – Avez - vous remarqué quelque chose"
Delly_Les-deux-crimes-de-Thecle_<M . Pontet-1811>_44581,"présente quelque intérêt , pour mon enquête ?Je lui rapportai"
Delly_Les-deux-crimes-de-Thecle_<M . Pontet-1811>_44584,", pour mon enquête ?Je lui rapportai les propos échangés"
Delly_Les-deux-crimes-de-Thecle_<M . Pontet-1811>_44631,". De la pointe de son stylo - mine ,"
Delly_Les-deux-crimes-de-Thecle_<M . Pontet-1811>_44636,"son stylo - mine , il tapotait le carnet qu'"
Delly_Les-deux-crimes-de-Thecle_<M . Pontet-1811>_44641,il tapotait le carnet qu' il tenait à la main
Delly_Les-deux-crimes-de-Thecle_<M . Pontet-1811>_44653,"un instant de réflexion , il fit observer :– Ces"
Delly_Les-deux-crimes-de-Thecle_<M . Pontet-1811>_44700,à penser cette séquestration . Saturnin sait où elle se
Delly_Les-deux-crimes-de-Thecle_<M . Pontet-1811>_44710,"trouve , parce qu' elle en avait fait son complice"
Delly_Les-deux-crimes-de-Thecle_<M . Pontet-1811>_44716,avait fait son complice . M . Pontet se doute
Delly_Les-deux-crimes-de-Thecle_<M . Pontet-1811>_44722,. Pontet se doute qu' il sera frustré . De
Delly_Les-deux-crimes-de-Thecle_<M . Pontet-1811>_44728,sera frustré . De là sa fureur . – Saturnin
Delly_Les-deux-crimes-de-Thecle_<M . Pontet-1811>_44732,là sa fureur . – Saturnin aurait donc vraiment tué
Delly_Les-deux-crimes-de-Thecle_<M . Pontet-1811>_44778,été « préparés » par M . Pontet . J'
Delly_Les-deux-crimes-de-Thecle_<M . Pontet-1811>_44795,? Vous voulez dire qu' il l' aurait fait à
Delly_Les-deux-crimes-de-Thecle_<M . Pontet-1811>_44800,il l' aurait fait à son dernier séjour avant .
Delly_Les-deux-crimes-de-Thecle_<M . Pontet-1811>_44876,"venait de sortir , je l' ai vu quittant sa"
Delly_Les-deux-crimes-de-Thecle_<Thècle-2020>_47491,"aussitôt terminées les obsèques de Thècle , Sylvine et moi"
