,text_surronding
Delly_Les-deux-crimes-de-Thecle_<une jeune fille blonde-189>_4729,", la faim , car j' avais un excellent appétit"
Delly_Les-deux-crimes-de-Thecle_<une jeune fille blonde-189>_4748,avait été fort succinct . Je me levai donc en
Delly_Les-deux-crimes-de-Thecle_<une jeune fille blonde-189>_4784,"Déjà , la veille , je n' avais pu continuer"
Delly_Les-deux-crimes-de-Thecle_<une jeune fille blonde-189>_4804,"il l' aurait fallu . Ma toilette terminée , je"
Delly_Les-deux-crimes-de-Thecle_<une jeune fille blonde-189>_4808,". Ma toilette terminée , je décidai d' aller chercher"
Delly_Les-deux-crimes-de-Thecle_<une jeune fille blonde-189>_4822,". En même temps , je m' informerais pour mon"
Delly_Les-deux-crimes-de-Thecle_<une jeune fille blonde-189>_4826,", je m' informerais pour mon petit déjeuner . Fernande"
Delly_Les-deux-crimes-de-Thecle_<une jeune fille blonde-189>_4837,jusqu' à neuf heures ; je n' avais donc pas
Delly_Les-deux-crimes-de-Thecle_<une jeune fille blonde-189>_4858,"sortant dans le couloir , je retrouvai facilement l' escalier"
Delly_Les-deux-crimes-de-Thecle_<une jeune fille blonde-189>_4873,"la salle d' entrée , j' hésitai entre quatre portes"
Delly_Les-deux-crimes-de-Thecle_<une jeune fille blonde-189>_4882,"portes . Au hasard , je frappai à l' une"
Delly_Les-deux-crimes-de-Thecle_<une jeune fille blonde-189>_4894,". Personne ne répondant , je tournai la poignée ,"
Delly_Les-deux-crimes-de-Thecle_<une jeune fille blonde-189>_4899,"je tournai la poignée , poussai le battant qui grinça"
Delly_Les-deux-crimes-de-Thecle_<une jeune fille blonde-189>_4905,le battant qui grinça . J' avais devant moi une
Delly_Les-deux-crimes-de-Thecle_<une jeune fille blonde-189>_4908,grinça . J' avais devant moi une grande salle lambrissée
Delly_Les-deux-crimes-de-Thecle_<une jeune fille blonde-189>_4925,. Une autre porte ouverte me révéla le dénuement d'
Delly_Les-deux-crimes-de-Thecle_<une jeune fille blonde-189>_4971,en plus s' affirmait chez moi la sensation de la
Delly_Les-deux-crimes-de-Thecle_<une jeune fille blonde-189>_4985,famille . Une troisième porte me mit enfin sur le
Delly_Les-deux-crimes-de-Thecle_<une jeune fille blonde-189>_5049,dans la pièce . « J' arrive bien ! pensai
Delly_Les-deux-crimes-de-Thecle_<une jeune fille blonde-189>_5054,J' arrive bien ! pensai - je . Le déjeuner
Delly_Les-deux-crimes-de-Thecle_<une jeune fille blonde-189>_5070,"Thècle ne bougeait pas , je m' avançai . Alors"
Delly_Les-deux-crimes-de-Thecle_<une jeune fille blonde-189>_5080,elle tourna la tête et je revis ses clairs yeux
Delly_Les-deux-crimes-de-Thecle_<une jeune fille blonde-189>_5088,"clairs yeux froids , qui me considérèrent sans surprise et"
Delly_Les-deux-crimes-de-Thecle_<une jeune fille blonde-189>_5098,sans bienveillance . – Pourrais - je avoir du bois
Delly_Les-deux-crimes-de-Thecle_<une jeune fille blonde-189>_5106,"du bois , Mademoiselle ? Je voudrais allumer du feu"
Delly_Les-deux-crimes-de-Thecle_<une jeune fille blonde-189>_5143,– . . . Je vous en porterai quand elle
Delly_Les-deux-crimes-de-Thecle_<une jeune fille blonde-189>_5154,le dira . – Mais je le porterai moi -
Delly_Les-deux-crimes-de-Thecle_<une jeune fille blonde-189>_5157,– Mais je le porterai moi - même . Il
Delly_Les-deux-crimes-de-Thecle_<une jeune fille blonde-189>_5165,. Il est inutile que vous vous dérangiez . –
Delly_Les-deux-crimes-de-Thecle_<une jeune fille blonde-189>_5206,"Thècle , du geste , m' indiqua un pot de"
Delly_Les-deux-crimes-de-Thecle_<une jeune fille blonde-189>_5227,lait est bouilli . Si vous voulez attendre deux minutes
Delly_Les-deux-crimes-de-Thecle_<une jeune fille blonde-189>_5234,"attendre deux minutes , je vous le servirai . Je"
Delly_Les-deux-crimes-de-Thecle_<une jeune fille blonde-189>_5238,je vous le servirai . Je m' assis devant la
Delly_Les-deux-crimes-de-Thecle_<une jeune fille blonde-189>_5255,très luisante . Bien que je fusse enveloppée dans ma
Delly_Les-deux-crimes-de-Thecle_<une jeune fille blonde-189>_5259,"que je fusse enveloppée dans ma mante , je grelottais"
Delly_Les-deux-crimes-de-Thecle_<une jeune fille blonde-189>_5262,"enveloppée dans ma mante , je grelottais dans cette grande"
Delly_Les-deux-crimes-de-Thecle_<une jeune fille blonde-189>_5271,grande pièce sans feu . Je remarquai la minceur de
Delly_Les-deux-crimes-de-Thecle_<une jeune fille blonde-189>_5288,de la jeune fille et je pensai avec pitié :
Delly_Les-deux-crimes-de-Thecle_<une jeune fille blonde-189>_5304,avoir encore plus froid que moi ! »Ayant mis sa
Delly_Les-deux-crimes-de-Thecle_<une jeune fille blonde-189>_5343,qu' elle vint poser devant moi . Puis elle apporta
Delly_Les-deux-crimes-de-Thecle_<une jeune fille blonde-189>_5375,ébréchée . – N' avez - vous pas de café
Delly_Les-deux-crimes-de-Thecle_<une jeune fille blonde-189>_5382,pas de café ? demandai - je . – «
Delly_Les-deux-crimes-de-Thecle_<une jeune fille blonde-189>_5390,– « Elle » ne m' a pas dit de
Delly_Les-deux-crimes-de-Thecle_<une jeune fille blonde-189>_5403,". Décidément , il faudrait m' habituer ici à la"
Delly_Les-deux-crimes-de-Thecle_<une jeune fille blonde-189>_5420,"était dans la gêne , je devais faire mon possible"
Delly_Les-deux-crimes-de-Thecle_<une jeune fille blonde-189>_5423,"gêne , je devais faire mon possible pour ne pas"
Delly_Les-deux-crimes-de-Thecle_<une jeune fille blonde-189>_5432,pas augmenter ses embarras . J' en serais quitte pour
Delly_Les-deux-crimes-de-Thecle_<une jeune fille blonde-189>_5548,fille brune apparut . Elle m' adressa une sorte de
Delly_Les-deux-crimes-de-Thecle_<une jeune fille blonde-189>_5580,de sa fille ? demandai - je . Thècle fit
Delly_Les-deux-crimes-de-Thecle_<une jeune fille blonde-189>_5589,"fit un geste affirmatif . Je crus voir , dans"
Delly_Les-deux-crimes-de-Thecle_<une jeune fille blonde-189>_5625,"mit à la fourbir . Je me levai , ayant"
Delly_Les-deux-crimes-de-Thecle_<une jeune fille blonde-189>_5667,un poulet sur une planche me fit espérer que le
Delly_Les-deux-crimes-de-Thecle_<une jeune fille blonde-189>_5675,que le repas de midi me dédommagerait . Mais je
Delly_Les-deux-crimes-de-Thecle_<une jeune fille blonde-189>_5679,"midi me dédommagerait . Mais je me sentais perplexe ,"
Delly_Les-deux-crimes-de-Thecle_<une jeune fille blonde-189>_5701,Grisolles et à sa fille m' incitait à réserver mon
Delly_Les-deux-crimes-de-Thecle_<une jeune fille blonde-189>_5705,fille m' incitait à réserver mon jugement au sujet de
Delly_Les-deux-crimes-de-Thecle_<une jeune fille blonde-189>_5714,de leurs moyens pécuniaires . Je commençai ce matin -
Delly_Les-deux-crimes-de-Thecle_<une jeune fille blonde-189>_5743,l' occasion de simagrées qui m' agacèrent d' autant plus
Delly_Les-deux-crimes-de-Thecle_<une jeune fille blonde-189>_5782,choses de ce genre . Je suis loin d' être
Delly_Les-deux-crimes-de-Thecle_<une jeune fille blonde-189>_5792,"endurcie devant la souffrance de mes malades , mais j'"
Delly_Les-deux-crimes-de-Thecle_<une jeune fille blonde-189>_5796,"de mes malades , mais j' avais ici l' impression"
Delly_Les-deux-crimes-de-Thecle_<une jeune fille blonde-189>_5819,rendre intéressante . Aussi déclarai - je à Mme de
Delly_Les-deux-crimes-de-Thecle_<une jeune fille blonde-189>_5826,à Mme de Grisolles que je jugeais préférable qu' elle
Delly_Les-deux-crimes-de-Thecle_<une jeune fille blonde-189>_5831,je jugeais préférable qu' elle me laissât seule une autre
Delly_Les-deux-crimes-de-Thecle_<une jeune fille blonde-189>_5851,"motif d' ailleurs , ajoutai - je . Et Fernande"
Delly_Les-deux-crimes-de-Thecle_<une jeune fille blonde-189>_5862,"plus raisonnable si elle ne vous voit pas là ,"
Delly_Les-deux-crimes-de-Thecle_<une jeune fille blonde-189>_5966,"à sa mère ni à moi . Décidément , mon"
Delly_Les-deux-crimes-de-Thecle_<une jeune fille blonde-189>_5970,"à moi . Décidément , mon séjour dans cette maison"
Delly_Les-deux-crimes-de-Thecle_<une jeune fille blonde-189>_5984,plaisir ! À ce moment me revint à l' esprit
Delly_Les-deux-crimes-de-Thecle_<une jeune fille blonde-189>_6002,sœur lui avait annoncé que je me rendais à Mieulles
Delly_Les-deux-crimes-de-Thecle_<une jeune fille blonde-189>_6021,"pauvre fille ! »Enfin , j' accomplirais mon devoir professionnel"
Delly_Les-deux-crimes-de-Thecle_<une jeune fille blonde-189>_6023,"! »Enfin , j' accomplirais mon devoir professionnel , le"
Delly_Les-deux-crimes-de-Thecle_<une jeune fille blonde-189>_6032,le mieux possible . Mais je voyais déjà qu' il
Delly_Les-deux-crimes-de-Thecle_<une jeune fille blonde-189>_6037,je voyais déjà qu' il me faudrait pour cela beaucoup
Delly_Les-deux-crimes-de-Thecle_<une jeune fille blonde-189>_6049,et de patience . Quand j' en eus terminé avec
Delly_Les-deux-crimes-de-Thecle_<une jeune fille blonde-189>_6060,"soins à donner , que j' eus fait faire à"
Delly_Les-deux-crimes-de-Thecle_<une jeune fille blonde-189>_6070,"la malade sa toilette , je fis part à Mme"
Delly_Les-deux-crimes-de-Thecle_<une jeune fille blonde-189>_6078,à Mme de Grisolles de mon désir d' allumer du
Delly_Les-deux-crimes-de-Thecle_<une jeune fille blonde-189>_6085,d' allumer du feu dans ma chambre et d' avoir
Delly_Les-deux-crimes-de-Thecle_<une jeune fille blonde-189>_6105,soir . – Mlle Thècle m' a dit qu' il
Delly_Les-deux-crimes-de-Thecle_<une jeune fille blonde-189>_6113,"qu' il fallait pour cela m' adresser à vous ,"
Delly_Les-deux-crimes-de-Thecle_<une jeune fille blonde-189>_6123,qu' elle ne pouvait rien me donner d' elle -
Delly_Les-deux-crimes-de-Thecle_<une jeune fille blonde-189>_6131,"elle - même , ajoutai - je . – Mais"
Delly_Les-deux-crimes-de-Thecle_<une jeune fille blonde-189>_6139,– Mais naturellement ! Si je laissais tout au gré
Delly_Les-deux-crimes-de-Thecle_<une jeune fille blonde-189>_6162,bout de trois mois ! Je vais dire à Thècle
Delly_Les-deux-crimes-de-Thecle_<une jeune fille blonde-189>_6182,"allumer votre feu . – Je m' en charge ,"
Delly_Les-deux-crimes-de-Thecle_<une jeune fille blonde-189>_6191,", et si vous voulez m' indiquer où se trouve"
Delly_Les-deux-crimes-de-Thecle_<une jeune fille blonde-189>_6199,"se trouve le bois , je le monterai fort bien"
Delly_Les-deux-crimes-de-Thecle_<une jeune fille blonde-189>_6230,tout le temps nécessaire . Vous aurez votre bois dans
Delly_Les-deux-crimes-de-Thecle_<une jeune fille blonde-189>_6232,temps nécessaire . Vous aurez votre bois dans un moment
Delly_Les-deux-crimes-de-Thecle_<une jeune fille blonde-189>_6238,"bois dans un moment , chère Mademoiselle . En rentrant"
Delly_Les-deux-crimes-de-Thecle_<une jeune fille blonde-189>_6244,"Mademoiselle . En rentrant dans ma chambre je décidai ,"
Delly_Les-deux-crimes-de-Thecle_<une jeune fille blonde-189>_6246,"En rentrant dans ma chambre je décidai , puisque je"
Delly_Les-deux-crimes-de-Thecle_<une jeune fille blonde-189>_6250,"chambre je décidai , puisque je n' avais pas encore"
Delly_Les-deux-crimes-de-Thecle_<une jeune fille blonde-189>_6263,de faire une promenade pour me réchauffer . La neige
Delly_Les-deux-crimes-de-Thecle_<une jeune fille blonde-189>_6289,"sol . Bien couverte , je descendis et me dirigeai"
Delly_Les-deux-crimes-de-Thecle_<une jeune fille blonde-189>_6292,"couverte , je descendis et me dirigeai vers la cuisine"
Delly_Les-deux-crimes-de-Thecle_<une jeune fille blonde-189>_6293,", je descendis et me dirigeai vers la cuisine ."
Delly_Les-deux-crimes-de-Thecle_<une jeune fille blonde-189>_6344,. – Voulez - vous me dire s' il y
Delly_Les-deux-crimes-de-Thecle_<une jeune fille blonde-189>_6364,la porte principale ? demandai - je . Je voudrais
Delly_Les-deux-crimes-de-Thecle_<une jeune fille blonde-189>_6367,? demandai - je . Je voudrais bien ne pas
Delly_Les-deux-crimes-de-Thecle_<une jeune fille blonde-189>_6376,pas déranger quelqu' un pour m' ouvrir chaque fois que
Delly_Les-deux-crimes-de-Thecle_<une jeune fille blonde-189>_6381,m' ouvrir chaque fois que je sors . Il tourna
Delly_Les-deux-crimes-de-Thecle_<une jeune fille blonde-189>_6387,sors . Il tourna vers moi un long visage blême
Delly_Les-deux-crimes-de-Thecle_<une jeune fille blonde-189>_6404,"gelée . – Je vais vous montrer , dit -"
Delly_Les-deux-crimes-de-Thecle_<une jeune fille blonde-189>_6415,". À sa suite , je sortis dans un couloir"
Delly_Les-deux-crimes-de-Thecle_<une jeune fille blonde-189>_6442,ouvrit une petite porte et me montra qu' il suffisait
Delly_Les-deux-crimes-de-Thecle_<une jeune fille blonde-189>_6454,"le loquet pour entrer . Je le remerciai , à"
Delly_Les-deux-crimes-de-Thecle_<une jeune fille blonde-189>_6465,il répondit : « À votre service . » Puis
Delly_Les-deux-crimes-de-Thecle_<une jeune fille blonde-189>_6476,retourna à son travail et je sortis dans la cour
Delly_Les-deux-crimes-de-Thecle_<une jeune fille blonde-189>_6486,". À ce moment , je vis Thècle qui arrivait"
Delly_Les-deux-crimes-de-Thecle_<une jeune fille blonde-189>_6529,"Au passage , elle ne m' adressa pas la parole"
Delly_Les-deux-crimes-de-Thecle_<une jeune fille blonde-189>_6541,à peine l' air de me reconnaître . Je la
Delly_Les-deux-crimes-de-Thecle_<une jeune fille blonde-189>_6544,air de me reconnaître . Je la vis disparaître par
Delly_Les-deux-crimes-de-Thecle_<une jeune fille blonde-189>_6552,disparaître par la porte que je venais de franchir .
Delly_Les-deux-crimes-de-Thecle_<une jeune fille blonde-189>_6558,venais de franchir . Quand j' eus traversé la cour
Delly_Les-deux-crimes-de-Thecle_<une jeune fille blonde-189>_6564,"eus traversé la cour , je me retournai pour voir"
Delly_Les-deux-crimes-de-Thecle_<une jeune fille blonde-189>_6628,"la gauche , par où je venais de sortir ,"
Delly_Les-deux-crimes-de-Thecle_<une jeune fille blonde-189>_6662,gauche de la cour . Je m' engageai dans l'
Delly_Les-deux-crimes-de-Thecle_<une jeune fille blonde-189>_6676,sol neigeux qui craquait sous mes pas . L' air
Delly_Les-deux-crimes-de-Thecle_<une jeune fille blonde-189>_6684,"L' air sec et pur me vivifiait , chassait les"
Delly_Les-deux-crimes-de-Thecle_<une jeune fille blonde-189>_6692,chassait les impressions désagréables . Je m' efforçai d' oublier
Delly_Les-deux-crimes-de-Thecle_<une jeune fille blonde-189>_6729,"bout de l' allée , je me trouvai sur une"
Delly_Les-deux-crimes-de-Thecle_<une jeune fille blonde-189>_6743,"un moment d' hésitation , je pris à gauche ."
Delly_Les-deux-crimes-de-Thecle_<une jeune fille blonde-189>_6748,je pris à gauche . Je me souvenais qu' hier
Delly_Les-deux-crimes-de-Thecle_<une jeune fille blonde-189>_6767,Des bois s' étendaient à ma droite . Depuis un
Delly_Les-deux-crimes-de-Thecle_<une jeune fille blonde-189>_6774,". Depuis un moment , j' entendais un bruit de"
Delly_Les-deux-crimes-de-Thecle_<une jeune fille blonde-189>_6783,"de moteur , et comme j' allais dépasser un chemin"
Delly_Les-deux-crimes-de-Thecle_<une jeune fille blonde-189>_6790,"dépasser un chemin transversal , je vis une voiture qui"
Delly_Les-deux-crimes-de-Thecle_<une jeune fille blonde-189>_6801,. Au volant se trouvait ma voisine de la veille
Delly_Les-deux-crimes-de-Thecle_<une jeune fille blonde-189>_6808,"de la veille . En me voyant , elle stoppa"
Delly_Les-deux-crimes-de-Thecle_<une jeune fille blonde-189>_6824,Déjà en promenade ? Alliez - vous au bourg ?
Delly_Les-deux-crimes-de-Thecle_<une jeune fille blonde-189>_6831,"au bourg ? Je puis vous y mener , en"
Delly_Les-deux-crimes-de-Thecle_<une jeune fille blonde-189>_6912,"Sans plus de cérémonie , je m' assis près d'"
Delly_Les-deux-crimes-de-Thecle_<une jeune fille blonde-189>_6929,"marche , elle tourna vers moi son visage souriant ."
Delly_Les-deux-crimes-de-Thecle_<une jeune fille blonde-189>_6938,. – Ne vous ressentez - vous pas de votre
Delly_Les-deux-crimes-de-Thecle_<une jeune fille blonde-189>_6959,de vue fatigue . Mais je n' ai pas pu
Delly_Les-deux-crimes-de-Thecle_<une jeune fille blonde-189>_7029,"bout d' un moment , je repris la parole ."
Delly_Les-deux-crimes-de-Thecle_<une jeune fille blonde-189>_7059,sont - elles ruinées ?– Je ne puis vous donner
Delly_Les-deux-crimes-de-Thecle_<une jeune fille blonde-189>_7143,. – Pourquoi ? demandai - je . – Elle
Delly_Les-deux-crimes-de-Thecle_<Thècle-895>_19222,"la cuisine de Mieulles , Thècle , penchée vers le"
Delly_Les-deux-crimes-de-Thecle_<Thècle-895>_19237,. Je m' approchai d' elle . – Mademoiselle Thècle
Delly_Les-deux-crimes-de-Thecle_<Thècle-895>_19240,"approchai d' elle . – Mademoiselle Thècle , votre sœur"
Delly_Les-deux-crimes-de-Thecle_<Thècle-895>_19243,". – Mademoiselle Thècle , votre sœur s' est trouvée"
Delly_Les-deux-crimes-de-Thecle_<Thècle-895>_19254,sur la route . Je l' ai fait transporter au
Delly_Les-deux-crimes-de-Thecle_<Thècle-895>_19267,", chez Mlle Paviers . Elle se détourna en un"
Delly_Les-deux-crimes-de-Thecle_<Thècle-895>_19287,"vis de l' émotion dans ses yeux , d' un"
Delly_Les-deux-crimes-de-Thecle_<Thècle-895>_19298,bleu - vert . – Sylvine ? . . .
Delly_Les-deux-crimes-de-Thecle_<Thècle-895>_19319,"faiblesse , seulement . Je lui ai fait une piqûre"
Delly_Les-deux-crimes-de-Thecle_<Thècle-895>_19331,camphrée . Mlle Paviers va lui donner le nécessaire pour
Delly_Les-deux-crimes-de-Thecle_<Thècle-895>_19336,lui donner le nécessaire pour la réconforter et la ramènera
Delly_Les-deux-crimes-de-Thecle_<Thècle-895>_19339,nécessaire pour la réconforter et la ramènera en voiture dans
Delly_Les-deux-crimes-de-Thecle_<Thècle-895>_19350,heure ou deux . Mais elle est très anémique et
Delly_Les-deux-crimes-de-Thecle_<Thècle-895>_19359,et il est indispensable qu' elle reçoive les soins nécessaires
Delly_Les-deux-crimes-de-Thecle_<Thècle-895>_19390,! Et qui donc les lui donnerait ?– Mme de
Delly_Les-deux-crimes-de-Thecle_<Thècle-895>_19405,Je vais l' avertir de son état . . .
Delly_Les-deux-crimes-de-Thecle_<Thècle-895>_19411,état . . . – Elle ? Elle ?Quelle haine
Delly_Les-deux-crimes-de-Thecle_<Thècle-895>_19413,. . – Elle ? Elle ?Quelle haine dans ce
Delly_Les-deux-crimes-de-Thecle_<Thècle-895>_19433,"ne comprenez donc pas qu' elle la tue , volontairement"
Delly_Les-deux-crimes-de-Thecle_<Thècle-895>_19434,"comprenez donc pas qu' elle la tue , volontairement ?"
Delly_Les-deux-crimes-de-Thecle_<Thècle-895>_19443,? . . . Qu' elle nous tue ?La raideur
Delly_Les-deux-crimes-de-Thecle_<Thècle-895>_19452,"raideur , l' impassibilité qu' elle affectait à l' ordinaire"
Delly_Les-deux-crimes-de-Thecle_<Thècle-895>_19466,". J' avais devant moi un être vibrant , tout"
Delly_Les-deux-crimes-de-Thecle_<Thècle-895>_19493,"alors , la beauté de cette jeune fille , ce"
Delly_Les-deux-crimes-de-Thecle_<Thècle-895>_19499,"jeune fille , ce qu' elle eût été surtout sans"
Delly_Les-deux-crimes-de-Thecle_<Thècle-895>_19537,cuisine . Il attachait sur Thècle ses yeux glacés .
Delly_Les-deux-crimes-de-Thecle_<Thècle-895>_19542,Thècle ses yeux glacés . Elle l' aperçut aussi et
Delly_Les-deux-crimes-de-Thecle_<Thècle-895>_19548,l' aperçut aussi et lui jeta un regard de défi
Delly_Les-deux-crimes-de-Thecle_<Thècle-895>_19560,", tournant le dos , elle se remit à tourner"
Delly_Les-deux-crimes-de-Thecle_<Thècle-895>_19565,elle se remit à tourner sa sauce . – Madame
Delly_Les-deux-crimes-de-Thecle_<Thècle-895>_19569,tourner sa sauce . – Madame va encore se plaindre
Delly_Les-deux-crimes-de-Thecle_<Thècle-895>_19597,pas une raison parce que Sylvine a eu un petit
Delly_Les-deux-crimes-de-Thecle_<Thècle-895>_19611,sauce en plein feu . Elle ne parut même pas
Delly_Les-deux-crimes-de-Thecle_<Thècle-895>_19707,"– En ce cas , Mme de Grisolles fera le"
Delly_Les-deux-crimes-de-Thecle_<Thècle-895>_19714,"Grisolles fera le nécessaire , Mademoiselle , soyez - en"
Delly_Les-deux-crimes-de-Thecle_<Thècle-895>_19746,frapper à la porte de la châtelaine . Je la
Delly_Les-deux-crimes-de-Thecle_<Thècle-895>_19750,de la châtelaine . Je la trouvai juchée sur un
Delly_Les-deux-crimes-de-Thecle_<Thècle-895>_19764,la place du lit qu' elle avait repoussé . À
Delly_Les-deux-crimes-de-Thecle_<Thècle-895>_19776,"d' un plumeau léger , elle enlevait la poussière sur"
Delly_Les-deux-crimes-de-Thecle_<Thècle-895>_19799,"– Ah ! c' est vous , Mademoiselle ! Vous"
Delly_Les-deux-crimes-de-Thecle_<Thècle-895>_19801,"! c' est vous , Mademoiselle ! Vous me trouvez"
Delly_Les-deux-crimes-de-Thecle_<Thècle-895>_19803,"est vous , Mademoiselle ! Vous me trouvez en train"
Delly_Les-deux-crimes-de-Thecle_<Thècle-895>_19861,mois . . . Je l' interrompis en disant :–
Delly_Les-deux-crimes-de-Thecle_<Thècle-895>_19868,"en disant :– Je venais vous prévenir , Madame ,"
Delly_Les-deux-crimes-de-Thecle_<Thècle-895>_19871,"Je venais vous prévenir , Madame , que j' ai"
Delly_Les-deux-crimes-de-Thecle_<Thècle-895>_19927,une sorte de colère dans sa voix . – Parce
Delly_Les-deux-crimes-de-Thecle_<Thècle-895>_19969,"lèvres un peu serrées , Mme de Grisolles descendit les"
Delly_Les-deux-crimes-de-Thecle_<Thècle-895>_19978,les degrés du marchepied . Elle grommela :– Qu' est
Delly_Les-deux-crimes-de-Thecle_<Thècle-895>_20014,"d' être soignée immédiatement , Madame . Ses lèvres se"
Delly_Les-deux-crimes-de-Thecle_<Thècle-895>_20016,"soignée immédiatement , Madame . Ses lèvres se pincèrent plus"
Delly_Les-deux-crimes-de-Thecle_<Thècle-895>_20034,"assez aigrement :– C' est vous qui le dites ,"
Delly_Les-deux-crimes-de-Thecle_<Thècle-895>_20035,"aigrement :– C' est vous qui le dites , Mademoiselle"
Delly_Les-deux-crimes-de-Thecle_<Thècle-895>_20039,"vous qui le dites , Mademoiselle . Mais un peu"
Delly_Les-deux-crimes-de-Thecle_<Thècle-895>_20095,"un état très sérieux et vous seriez grandement responsable ,"
Delly_Les-deux-crimes-de-Thecle_<Thècle-895>_20100,"vous seriez grandement responsable , Madame , si vous persistiez"
Delly_Les-deux-crimes-de-Thecle_<Thècle-895>_20103,"responsable , Madame , si vous persistiez à ne pas"
Delly_Les-deux-crimes-de-Thecle_<Thècle-895>_20113,"vous en rendre compte . J' avais parlé fermement ,"
Delly_Les-deux-crimes-de-Thecle_<Thècle-895>_20127,mot « responsable » . Je vis sa bouche se
Delly_Les-deux-crimes-de-Thecle_<Thècle-895>_20129,"responsable » . Je vis sa bouche se contracter ,"
Delly_Les-deux-crimes-de-Thecle_<Thècle-895>_20140,regard mauvais se glisser vers moi . Mais sa voix
Delly_Les-deux-crimes-de-Thecle_<Thècle-895>_20143,glisser vers moi . Mais sa voix avait repris l'
Delly_Les-deux-crimes-de-Thecle_<Thècle-895>_20154,"intonation doucereuse , tandis qu' elle répondait :– Où prenez"
Delly_Les-deux-crimes-de-Thecle_<Thècle-895>_20159,"elle répondait :– Où prenez - vous donc , chère"
Delly_Les-deux-crimes-de-Thecle_<Thècle-895>_20163,"prenez - vous donc , chère Mademoiselle , que je"
Delly_Les-deux-crimes-de-Thecle_<Thècle-895>_20167,", chère Mademoiselle , que je ne veux pas la"
Delly_Les-deux-crimes-de-Thecle_<Thècle-895>_20181,vraiment il en est comme vous le dites – et
Delly_Les-deux-crimes-de-Thecle_<Thècle-895>_20192,le saurons par Martoux que j' appellerai ces jours -
Delly_Les-deux-crimes-de-Thecle_<Thècle-895>_20199,ces jours - ci – je ferai naturellement le nécessaire
Delly_Les-deux-crimes-de-Thecle_<Thècle-895>_20205,ferai naturellement le nécessaire . Vous dites que Mlle Paviers
Delly_Les-deux-crimes-de-Thecle_<Thècle-895>_20211,"dites que Mlle Paviers doit la ramener ?– Oui ,"
Delly_Les-deux-crimes-de-Thecle_<Thècle-895>_20218,"?– Oui , après qu' elle sera un peu reposée"
Delly_Les-deux-crimes-de-Thecle_<Thècle-895>_20229,remontée . Il faudra qu' elle se couche en arrivant
Delly_Les-deux-crimes-de-Thecle_<Thècle-895>_20237,"en arrivant , car , je le répète , elle"
Delly_Les-deux-crimes-de-Thecle_<Thècle-895>_20241,", je le répète , elle est très faible ."
Delly_Les-deux-crimes-de-Thecle_<Thècle-895>_20251,"– Eh ! bien , elle se couchera , et"
Delly_Les-deux-crimes-de-Thecle_<Thècle-895>_20260,et Thècle s' occupera d' elle . – Mlle Thècle
Delly_Les-deux-crimes-de-Thecle_<Thècle-895>_20271,"déjà beaucoup à faire . Je pourrais , si vous"
Delly_Les-deux-crimes-de-Thecle_<Thècle-895>_20275,". Je pourrais , si vous le voulez bien ,"
Delly_Les-deux-crimes-de-Thecle_<Thècle-895>_20282,"voulez bien , donner à la malade les soins indispensables"
Delly_Les-deux-crimes-de-Thecle_<Thècle-895>_20297,"assez peu de chose , je crois , car il"
Delly_Les-deux-crimes-de-Thecle_<Thècle-895>_20302,"je crois , car il lui faut surtout du repos"
Delly_Les-deux-crimes-de-Thecle_<Thècle-895>_20312,et une bonne nourriture . Je vis bien à sa
Delly_Les-deux-crimes-de-Thecle_<Thècle-895>_20316,. Je vis bien à sa physionomie qu' elle aurait
Delly_Les-deux-crimes-de-Thecle_<Thècle-895>_20319,bien à sa physionomie qu' elle aurait voulu m' opposer
Delly_Les-deux-crimes-de-Thecle_<Thècle-895>_20322,physionomie qu' elle aurait voulu m' opposer un refus .
Delly_Les-deux-crimes-de-Thecle_<Thècle-895>_20328,opposer un refus . Mais elle ne l' osa pas
Delly_Les-deux-crimes-de-Thecle_<Thècle-895>_20344,"d' assez mauvaise grâce qu' elle répondit :– Bien ,"
Delly_Les-deux-crimes-de-Thecle_<Thècle-895>_20353,", c' est entendu , Mademoiselle . Denise m' avait"
Delly_Les-deux-crimes-de-Thecle_<Thècle-895>_20355,"est entendu , Mademoiselle . Denise m' avait dit l'"
Delly_Les-deux-crimes-de-Thecle_<Thècle-895>_20356,"entendu , Mademoiselle . Denise m' avait dit l' heure"
Delly_Les-deux-crimes-de-Thecle_<Thècle-895>_20366,à laquelle devait être ramenée Sylvine . Il était convenu
Delly_Les-deux-crimes-de-Thecle_<Thècle-895>_20372,. Il était convenu que je ferais en sorte de
Delly_Les-deux-crimes-de-Thecle_<Thècle-895>_20393,", afin de conduire aussitôt la malade à sa chambre"
Delly_Les-deux-crimes-de-Thecle_<Thècle-895>_20396,conduire aussitôt la malade à sa chambre . Comme j'
