,text_surronding
Gozlan-Leon_Les-Vendanges_<un fils unique-2851>_54632,". Ervasy , qui laissa un fils unique au berceau"
Gozlan-Leon_Les-Vendanges_<un fils unique-2851>_54714,"idolâtrât son fils , elle le prenait souvent par le"
Gozlan-Leon_Les-Vendanges_<un fils unique-2851>_54721,"souvent par le menton après l' avoir tendrement embrassé ,"
Gozlan-Leon_Les-Vendanges_<un fils unique-2851>_54728,"tendrement embrassé , et elle lui disait : « Mon"
Gozlan-Leon_Les-Vendanges_<un fils unique-2851>_54737,"Mon pauvre enfant , je t' ai fait beau ,"
Gozlan-Leon_Les-Vendanges_<un fils unique-2851>_54742,"t' ai fait beau , ton père t' a fait"
Gozlan-Leon_Les-Vendanges_<un fils unique-2851>_54744,"fait beau , ton père t' a fait riche ;"
Gozlan-Leon_Les-Vendanges_<un fils unique-2851>_54750,a fait riche ; mais le diable ne te ferait
Gozlan-Leon_Les-Vendanges_<un fils unique-2851>_54753,; mais le diable ne te ferait pas gentilhomme .
Gozlan-Leon_Les-Vendanges_<un fils unique-2851>_54779,elle ne songea jamais à le marier avec une personne
Gozlan-Leon_Les-Vendanges_<un fils unique-2851>_54806,elle . Pourquoi cela ? Ce : sera un beau
Gozlan-Leon_Les-Vendanges_<un fils unique-2851>_54814,"un beau garçon , qu' il s' amuse ! Il"
Gozlan-Leon_Les-Vendanges_<un fils unique-2851>_54818,"qu' il s' amuse ! Il est déjà riche ,"
Gozlan-Leon_Les-Vendanges_<un fils unique-2851>_54824,"est déjà riche , qu' il le soit davantage ;"
Gozlan-Leon_Les-Vendanges_<un fils unique-2851>_54832,davantage ; nous tâcherons de l' aider en cela .
Gozlan-Leon_Les-Vendanges_<un fils unique-2851>_54846,amis sous la restauration : Rendez - moi ce jeune
Gozlan-Leon_Les-Vendanges_<un fils unique-2851>_54849,restauration : Rendez - moi ce jeune homme - là
Gozlan-Leon_Les-Vendanges_<un fils unique-2851>_54868,. Les familiers du château le prenaient sous le bras
Gozlan-Leon_Les-Vendanges_<un fils unique-2851>_54877,bras dans les salons de sa mère et lui disaient
Gozlan-Leon_Les-Vendanges_<un fils unique-2851>_54880,salons de sa mère et lui disaient quatre mots tout
Gozlan-Leon_Les-Vendanges_<un fils unique-2851>_54920,", ou insurrection grecque . Le jeune Ervasy profitait de"
Gozlan-Leon_Les-Vendanges_<un fils unique-2851>_54928,profitait de ces confidences . Il ne fut pas seulement
Gozlan-Leon_Les-Vendanges_<un fils unique-2851>_54933,"Il ne fut pas seulement un joueur , il devint"
Gozlan-Leon_Les-Vendanges_<un fils unique-2851>_54936,"pas seulement un joueur , il devint un calculateur patient"
Gozlan-Leon_Les-Vendanges_<un fils unique-2851>_54944,"calculateur patient , pénétrant ; il montra du génie ,"
Gozlan-Leon_Les-Vendanges_<un fils unique-2851>_54986,utile que l' astronomie : M . Ouvrard en fut
Gozlan-Leon_Les-Vendanges_<un fils unique-2851>_54995,fut le Napoléon . Enfin il devint le caissier des
Gozlan-Leon_Les-Vendanges_<un fils unique-2851>_55026,"sceptre . Comme eux , il eut des courriers sur"
Gozlan-Leon_Les-Vendanges_<un fils unique-2851>_55045,"moins de quatre ans , il enferma dans son écrin"
Gozlan-Leon_Les-Vendanges_<un fils unique-2851>_55048,"ans , il enferma dans son écrin de velours les"
Gozlan-Leon_Les-Vendanges_<un fils unique-2851>_55070,C' est fort bien ! lui disait toujours sa mère
Gozlan-Leon_Les-Vendanges_<un fils unique-2851>_55073,"bien ! lui disait toujours sa mère , en lui"
Gozlan-Leon_Les-Vendanges_<un fils unique-2851>_55077,"toujours sa mère , en lui prenant le menton ,"
Gozlan-Leon_Les-Vendanges_<un fils unique-2851>_55083,"prenant le menton , mais tu n' es pas gentilhomme"
Gozlan-Leon_Les-Vendanges_<un fils unique-2851>_55100,distinctions sur la tête d' Ervasy lui firent commettre la
Gozlan-Leon_Les-Vendanges_<un fils unique-2851>_55101,sur la tête d' Ervasy lui firent commettre la faute
Gozlan-Leon_Les-Vendanges_<un fils unique-2851>_55118,"une femme aussi riche que lui , se privant par"
Gozlan-Leon_Les-Vendanges_<un fils unique-2851>_55134,"surprendre , du plaisir de l' étonner ; il épousa"
Gozlan-Leon_Les-Vendanges_<un fils unique-2851>_55137,plaisir de l' étonner ; il épousa en 1834 la
Gozlan-Leon_Les-Vendanges_<un fils unique-2851>_55154,première guerre d' Espagne . Il avait quarante - un
Gozlan-Leon_Les-Vendanges_<un fils unique-2851>_55164,"ans à l' époque de son mariage , sa femme"
Gozlan-Leon_Les-Vendanges_<un fils unique-2851>_55167,"époque de son mariage , sa femme en avait vingt"
Gozlan-Leon_Les-Vendanges_<un fils unique-2851>_55197,l' acide des contrastes ? Ervasy donna des fêtes pour
Gozlan-Leon_Les-Vendanges_<un fils unique-2851>_55204,des fêtes pour plaire à sa femme ; mais sa
Gozlan-Leon_Les-Vendanges_<un fils unique-2851>_55208,à sa femme ; mais sa femme connaissait tout ce
Gozlan-Leon_Les-Vendanges_<un fils unique-2851>_55278,des affaires depuis 1827 . Ervasy la conduisit en Italie
Gozlan-Leon_Les-Vendanges_<un fils unique-2851>_55308,Rome ; au retour elle lui avoua en riant qu'
Gozlan-Leon_Les-Vendanges_<un fils unique-2851>_55379,presque Italienne en Italie ! il baissa la tête et
Gozlan-Leon_Les-Vendanges_<un fils unique-2851>_55384,"il baissa la tête et fit secrètement , pour se"
Gozlan-Leon_Les-Vendanges_<un fils unique-2851>_55391,", pour se venger de sa méprise , diriger sa"
Gozlan-Leon_Les-Vendanges_<un fils unique-2851>_55395,"de sa méprise , diriger sa chaise de poste du"
Gozlan-Leon_Les-Vendanges_<un fils unique-2851>_55404,du côté de Vienne . Sa femme respecta tout le
Gozlan-Leon_Les-Vendanges_<un fils unique-2851>_55431,mari tenait à ce qu' il se crût toujours le
Gozlan-Leon_Les-Vendanges_<un fils unique-2851>_55447,plaisir nouveau . Elle voulait lui laisser une illusion qui
Gozlan-Leon_Les-Vendanges_<un fils unique-2851>_55456,"qui , après avoir flatté son orgueil de mari ,"
Gozlan-Leon_Les-Vendanges_<un fils unique-2851>_55459,"avoir flatté son orgueil de mari , avait fini ,"
Gozlan-Leon_Les-Vendanges_<un fils unique-2851>_55568,"épreuve par son mari , qui se contentait d' avoir"
Gozlan-Leon_Les-Vendanges_<un fils unique-2851>_55579,lithographie d' un bonheur dont sa femme avait la réelle
Gozlan-Leon_Les-Vendanges_<un fils unique-2851>_55586,avait la réelle peinture . Il Voyagea pour ainsi dire
Gozlan-Leon_Les-Vendanges_<un fils unique-2851>_55595,dire dans les yeux de sa femme . Ils arrivent
Gozlan-Leon_Les-Vendanges_<un fils unique-2851>_55674,garde dans la poitrine d' Ervasy . Sa femme avait
Gozlan-Leon_Les-Vendanges_<un fils unique-2851>_55676,la poitrine d' Ervasy . Sa femme avait habité Vienne
Gozlan-Leon_Les-Vendanges_<un fils unique-2851>_55686,! elle connaissait Vienne ! Il fut pris d' une
Gozlan-Leon_Les-Vendanges_<un fils unique-2851>_55707,"dans trois jours , dit - il ; la température"
Gozlan-Leon_Les-Vendanges_<un fils unique-2851>_55719,"Allemagne est trop froide pour moi . Parlons , répondit"
Gozlan-Leon_Les-Vendanges_<un fils unique-2851>_55745,mari . II . Quand l' homme s' est ôté
Gozlan-Leon_Les-Vendanges_<un fils unique-2851>_55762,"de l' ambition , s' il ne prend pas un"
Gozlan-Leon_Les-Vendanges_<un fils unique-2851>_55771,un vice à la gorge il est perdu . Il
Gozlan-Leon_Les-Vendanges_<un fils unique-2851>_55781,vaudrait mieux sans doute qu' il tournât ses pensées vers
Gozlan-Leon_Les-Vendanges_<un fils unique-2851>_55783,sans doute qu' il tournât ses pensées vers les célestes
Gozlan-Leon_Les-Vendanges_<un fils unique-2851>_55809,pour remplir l' âme où il s' est fait du
Gozlan-Leon_Les-Vendanges_<un fils unique-2851>_55817,"fait du vide , qu' il s' inclinât sur l'"
Gozlan-Leon_Les-Vendanges_<un fils unique-2851>_55833,avait pas encore voulu visiter Ervasy . Son teint jaunit
Gozlan-Leon_Les-Vendanges_<un fils unique-2851>_55835,"encore voulu visiter Ervasy . Son teint jaunit , son"
Gozlan-Leon_Les-Vendanges_<un fils unique-2851>_55839,". Son teint jaunit , son front se dégarnit au"
Gozlan-Leon_Les-Vendanges_<un fils unique-2851>_55851,et çà et là sur sa tête les camélias de
Gozlan-Leon_Les-Vendanges_<un fils unique-2851>_55862,commencèrent à fleurir ; et il possédait plus de quarante
Gozlan-Leon_Les-Vendanges_<un fils unique-2851>_55873,! Ennui en barre ! Sa femme et lui étaient
Gozlan-Leon_Les-Vendanges_<un fils unique-2851>_55876,barre ! Sa femme et lui étaient d' une beauté
Gozlan-Leon_Les-Vendanges_<un fils unique-2851>_55949,", pétries par Chevet . Ervasy aurait été remarqué malgré"
Gozlan-Leon_Les-Vendanges_<un fils unique-2851>_55954,Ervasy aurait été remarqué malgré ses quarante - cinq ans
Gozlan-Leon_Les-Vendanges_<un fils unique-2851>_55960,quarante - cinq ans si sa langueur n' avait assombri
Gozlan-Leon_Les-Vendanges_<un fils unique-2851>_55965,sa langueur n' avait assombri son regard noir et doux
Gozlan-Leon_Les-Vendanges_<un fils unique-2851>_55973,"et doux , courbé sur ses épaules , parfaitement prises"
Gozlan-Leon_Les-Vendanges_<un fils unique-2851>_55978,"ses épaules , parfaitement prises sa tête chargée d' ennuis"
Gozlan-Leon_Les-Vendanges_<un fils unique-2851>_55987,ennuis et de découragements . Il avait les mains fort
Gozlan-Leon_Les-Vendanges_<un fils unique-2851>_55996,fort belles et rien ne lui seyait comme la toilette
Gozlan-Leon_Les-Vendanges_<un fils unique-2851>_56055,qui les ont découvertes . Ervasy pouvait marcher en tête
Gozlan-Leon_Les-Vendanges_<un fils unique-2851>_56173,"marquât une notable différence entre Ervasy et sa femme ,"
Gozlan-Leon_Les-Vendanges_<un fils unique-2851>_56175,"notable différence entre Ervasy et sa femme , celle -"
Gozlan-Leon_Les-Vendanges_<un fils unique-2851>_56233,qu' elle avait remarqué en lui depuis deux ou trois
Gozlan-Leon_Les-Vendanges_<un fils unique-2851>_56251,apercevoir de la sortie d' Ervasy le soir que se
Gozlan-Leon_Les-Vendanges_<un fils unique-2851>_56288,". Où va - t - il , pensa -"
Gozlan-Leon_Les-Vendanges_<un fils unique-2851>_56318,"- t - elle , Ervasy est attaqué du foie"
Gozlan-Leon_Les-Vendanges_<un fils unique-2851>_56324,"est attaqué du foie , Il a le spleen ."
Gozlan-Leon_Les-Vendanges_<un fils unique-2851>_56338,"chambre de Reine Linon , Ervasy devina à certain avertissement"
Gozlan-Leon_Les-Vendanges_<un fils unique-2851>_56396,une voix brève aux politesses du nouveau venu . Pendant
Gozlan-Leon_Les-Vendanges_<un fils unique-2851>_56408,"elle se contint assez pour lui laisser débiter , sans"
Gozlan-Leon_Les-Vendanges_<un fils unique-2851>_56413,"lui laisser débiter , sans l' interrompre , toutes les"
Gozlan-Leon_Les-Vendanges_<un fils unique-2851>_56421,toutes les excuses justificatives de sa longue absence . Il
Gozlan-Leon_Les-Vendanges_<un fils unique-2851>_56425,de sa longue absence . Il avait été forcé de
Gozlan-Leon_Les-Vendanges_<un fils unique-2851>_56466,au dessert . — Reculez votre chaise ! — Allons
Gozlan-Leon_Les-Vendanges_<un fils unique-2851>_56483,"Moi , me fâcher ! Vous vous trompez ! Cela"
Gozlan-Leon_Les-Vendanges_<un fils unique-2851>_56497,". J' ai dîné sans vous , voilà tout ."
Gozlan-Leon_Les-Vendanges_<un fils unique-2851>_56503,", voilà tout . — Tu as bien fait ,"
Gozlan-Leon_Les-Vendanges_<un fils unique-2851>_56510,"bien fait , Reine ; je suis content que tu"
Gozlan-Leon_Les-Vendanges_<un fils unique-2851>_56514,; je suis content que tu ne m' aies pas
Gozlan-Leon_Les-Vendanges_<un fils unique-2851>_56516,suis content que tu ne m' aies pas attendu .
Gozlan-Leon_Les-Vendanges_<un fils unique-2851>_56521,"m' aies pas attendu . Moi , j' ai fort"
Gozlan-Leon_Les-Vendanges_<un fils unique-2851>_56523,"pas attendu . Moi , j' ai fort mal dîné"
Gozlan-Leon_Les-Vendanges_<un fils unique-2851>_56529,"ai fort mal dîné , je te dirai . —"
Gozlan-Leon_Les-Vendanges_<un fils unique-2851>_56607,des haricots verts ? — Tu l' as deviné .
Gozlan-Leon_Les-Vendanges_<un fils unique-2851>_56621,mangé des asperges . Comme tu sais cela ! —
Gozlan-Leon_Les-Vendanges_<un fils unique-2851>_56666,"botte , chez Chevet . J' étais sûre que vous"
Gozlan-Leon_Les-Vendanges_<un fils unique-2851>_56670,. J' étais sûre que vous m' apporteriez ici quelque
Gozlan-Leon_Les-Vendanges_<un fils unique-2851>_56671,J' étais sûre que vous m' apporteriez ici quelque beau
Gozlan-Leon_Les-Vendanges_<un fils unique-2851>_56679,quelque beau mensonge ; mais je n' en suis pas
Gozlan-Leon_Les-Vendanges_<un fils unique-2851>_56689,"étonnée , après ce que j' ai appris sur votre"
Gozlan-Leon_Les-Vendanges_<un fils unique-2851>_56693,que j' ai appris sur votre compte ; L' homme
Gozlan-Leon_Les-Vendanges_<un fils unique-2851>_56727,"même pour les anges , il suppose tout de suite"
Gozlan-Leon_Les-Vendanges_<un fils unique-2851>_56742,tache sur une page de sa vie . A quarante
Gozlan-Leon_Les-Vendanges_<un fils unique-2851>_56756,"a beaucoup de pages . Ervasy , tout en cherchant"
Gozlan-Leon_Les-Vendanges_<un fils unique-2851>_56786,Reine Linon : Et que vous a - t -
Gozlan-Leon_Les-Vendanges_<un fils unique-2851>_56794,t - on appris sur mon compte ? — Vous
Gozlan-Leon_Les-Vendanges_<un fils unique-2851>_56798,sur mon compte ? — Vous osez me le demander
Gozlan-Leon_Les-Vendanges_<un fils unique-2851>_56800,compte ? — Vous osez me le demander ? —
Gozlan-Leon_Les-Vendanges_<un fils unique-2851>_56815,"tous les deux . — Vous le savez bien ,"
Gozlan-Leon_Les-Vendanges_<un fils unique-2851>_56826,"c' est un tort . Tenez , c' est une"
Gozlan-Leon_Les-Vendanges_<un fils unique-2851>_56833,c' est une infamie de me l' avoir caché !
Gozlan-Leon_Les-Vendanges_<un fils unique-2851>_56866,cela des passions . On vous a peut être cité
Gozlan-Leon_Les-Vendanges_<un fils unique-2851>_56871,vous a peut être cité ma vieille faiblesse pour mademoiselle
Gozlan-Leon_Les-Vendanges_<un fils unique-2851>_56882,", la danseuse , quand j' étais caissier chez les"
Gozlan-Leon_Les-Vendanges_<un fils unique-2851>_56901,"d' une danseuse , dit Reine , en frappant sur"
Gozlan-Leon_Les-Vendanges_<un fils unique-2851>_56922,"Quant à madame Thorin , je ne l' ai jamais"
Gozlan-Leon_Les-Vendanges_<un fils unique-2851>_56942,être de madame Thorin que tu veux parler ? —
Gozlan-Leon_Les-Vendanges_<un fils unique-2851>_56964,"la fée Caboche . A votre âge , on ne"
Gozlan-Leon_Les-Vendanges_<un fils unique-2851>_56969,"votre âge , on ne m' a pas attendue ,"
Gozlan-Leon_Les-Vendanges_<un fils unique-2851>_56975,"a pas attendue , reprit Reine , je le sais"
Gozlan-Leon_Les-Vendanges_<un fils unique-2851>_56977,"attendue , reprit Reine , je le sais fort bien"
Gozlan-Leon_Les-Vendanges_<un fils unique-2851>_56985,"fort bien , sans que vous me dressiez l' inventaire"
Gozlan-Leon_Les-Vendanges_<un fils unique-2851>_56986,"bien , sans que vous me dressiez l' inventaire de"
Gozlan-Leon_Les-Vendanges_<un fils unique-2851>_56991,me dressiez l' inventaire de vos Vénus . Pour avoir
Gozlan-Leon_Les-Vendanges_<un fils unique-2851>_57004,"abord les mauvaises dispositions de Reine , Ervasy recevait entre"
Gozlan-Leon_Les-Vendanges_<un fils unique-2851>_57044,"d' une duchesse , fût - il planté comme Apollon"
Gozlan-Leon_Les-Vendanges_<un fils unique-2851>_57115,et ceci les ruine . Ervasy se tut pendant quelques
Gozlan-Leon_Les-Vendanges_<un fils unique-2851>_57127,"— Après tout , dit - il ensuite , je"
Gozlan-Leon_Les-Vendanges_<un fils unique-2851>_57131,"dit - il ensuite , je n' ai tué personne"
Gozlan-Leon_Les-Vendanges_<un fils unique-2851>_57138,"ai tué personne . Et tu ferais mieux , ma"
Gozlan-Leon_Les-Vendanges_<un fils unique-2851>_57142,"Et tu ferais mieux , ma chère Reine , de"
Gozlan-Leon_Les-Vendanges_<un fils unique-2851>_57147,"ma chère Reine , de me pardonner , quoique j'"
Gozlan-Leon_Les-Vendanges_<un fils unique-2851>_57151,"de me pardonner , quoique j' ignore quelle est ma"
Gozlan-Leon_Les-Vendanges_<un fils unique-2851>_57155,"quoique j' ignore quelle est ma faute , si ce"
Gozlan-Leon_Les-Vendanges_<un fils unique-2851>_57171,aujourd' hui trop tard chez toi . — En ce
Gozlan-Leon_Les-Vendanges_<un fils unique-2851>_57178,"— En ce cas , monsieur , faites - moi"
Gozlan-Leon_Les-Vendanges_<un fils unique-2851>_57181,"cas , monsieur , faites - moi l' amitié de"
Gozlan-Leon_Les-Vendanges_<un fils unique-2851>_57186,"- moi l' amitié de vous retirer , dit Reine"
Gozlan-Leon_Les-Vendanges_<un fils unique-2851>_57190,"de vous retirer , dit Reine , après avoir ployé"
Gozlan-Leon_Les-Vendanges_<un fils unique-2851>_57195,"Reine , après avoir ployé sa broderie et posé son"
Gozlan-Leon_Les-Vendanges_<un fils unique-2851>_57199,ployé sa broderie et posé son dé sur une épingle
Gozlan-Leon_Les-Vendanges_<un fils unique-2851>_57205,"dé sur une épingle de sa pelotte , j' ai"
Gozlan-Leon_Les-Vendanges_<un fils unique-2851>_57208,"épingle de sa pelotte , j' ai sommeil . —"
Gozlan-Leon_Les-Vendanges_<un fils unique-2851>_57213,"j' ai sommeil . — Je l' en prie ,"
Gozlan-Leon_Les-Vendanges_<un fils unique-2851>_57214,"ai sommeil . — Je l' en prie , ma"
Gozlan-Leon_Les-Vendanges_<un fils unique-2851>_57218,"Je l' en prie , ma chère enfant , ne"
Gozlan-Leon_Les-Vendanges_<un fils unique-2851>_57223,"ma chère enfant , ne t' aigris pas ainsi à"
Gozlan-Leon_Les-Vendanges_<un fils unique-2851>_57233,"plaisir le caractère . — Vous trouvez mauvais , peut"
Gozlan-Leon_Les-Vendanges_<un fils unique-2851>_57242,"peut - être , que j' aie sommeil ? Les"
Gozlan-Leon_Les-Vendanges_<un fils unique-2851>_57262,dix heures et demie . Tu as cassé le verre
Gozlan-Leon_Les-Vendanges_<un fils unique-2851>_57268,as cassé le verre de ta pendule ? — Apparemment
Gozlan-Leon_Les-Vendanges_<un fils unique-2851>_57282,plaisir ! ajouta - t - elle en dénouant son
Gozlan-Leon_Les-Vendanges_<un fils unique-2851>_57286,"t - elle en dénouant son tablier de foulard ,"
Gozlan-Leon_Les-Vendanges_<un fils unique-2851>_57294,"foulard , et en jetant son bonnet sur le fauteuil"
Gozlan-Leon_Les-Vendanges_<un fils unique-2851>_57302,le fauteuil . — Mais tu ne veux donc pas
Gozlan-Leon_Les-Vendanges_<un fils unique-2851>_57307,tu ne veux donc pas m' entendre ? — Allez
Gozlan-Leon_Les-Vendanges_<un fils unique-2851>_57318,vous en ! Le portier vous a remarqué . Je
Gozlan-Leon_Les-Vendanges_<un fils unique-2851>_57322,portier vous a remarqué . Je n' aime pas les
Gozlan-Leon_Les-Vendanges_<un fils unique-2851>_57329,"aime pas les suppositions . Ervasy eut beau parler ,"
Gozlan-Leon_Les-Vendanges_<un fils unique-2851>_57334,"Ervasy eut beau parler , Reine , sans faire attention"
Gozlan-Leon_Les-Vendanges_<un fils unique-2851>_57340,", sans faire attention à lui , se débarrassa de"
Gozlan-Leon_Les-Vendanges_<un fils unique-2851>_57345,"lui , se débarrassa de son fichu et alla devant"
Gozlan-Leon_Les-Vendanges_<un fils unique-2851>_57348,débarrassa de son fichu et alla devant sa petite glace
Gozlan-Leon_Les-Vendanges_<un fils unique-2851>_57350,"son fichu et alla devant sa petite glace , achever"
Gozlan-Leon_Les-Vendanges_<un fils unique-2851>_57355,"sa petite glace , achever sa toilette de nuit ."
Gozlan-Leon_Les-Vendanges_<un fils unique-2851>_57366,petit bonnet d' alsacienne qu' elle plaça sur sa tête
Gozlan-Leon_Les-Vendanges_<un fils unique-2851>_57369,alsacienne qu' elle plaça sur sa tête changea le caractère
Gozlan-Leon_Les-Vendanges_<un fils unique-2851>_57375,tête changea le caractère de son joli visage . La
Gozlan-Leon_Les-Vendanges_<un fils unique-2851>_57401,avec autant d' onction . C' était la Fornarina plus
Gozlan-Leon_Les-Vendanges_<un fils unique-2851>_57411,"jeunes , moins nonchalante , la Fornarina française . Les"
Gozlan-Leon_Les-Vendanges_<un fils unique-2851>_57418,française . Les coins de sa bouche formaient deux de
Gozlan-Leon_Les-Vendanges_<un fils unique-2851>_57452,"grâce s' engouffraient , affilaient son profil , que ramenaient"
Gozlan-Leon_Les-Vendanges_<un fils unique-2851>_57476,duvet de fuit mûr . Elle parut si séduisante à
Gozlan-Leon_Les-Vendanges_<un fils unique-2851>_57498,", il s' approcha de Reine et voulut , en"
Gozlan-Leon_Les-Vendanges_<un fils unique-2851>_57505,"voulut , en riant , l' étreindre par la taille"
Gozlan-Leon_Les-Vendanges_<un fils unique-2851>_57511,"étreindre par la taille . Elle , sans s' émouvoir"
Gozlan-Leon_Les-Vendanges_<un fils unique-2851>_57526,"la cheminée , et la vida , par dessus son"
Gozlan-Leon_Les-Vendanges_<un fils unique-2851>_57530,"la vida , par dessus son épaule , dans le"
Gozlan-Leon_Les-Vendanges_<un fils unique-2851>_57551,"pas , ajouta - t - elle , je vais"
Gozlan-Leon_Les-Vendanges_<un fils unique-2851>_57554,"- t - elle , je vais appeler le portier"
Gozlan-Leon_Les-Vendanges_<un fils unique-2851>_57565,vous faire mettre dehors : je suis chez moi .
Gozlan-Leon_Les-Vendanges_<un fils unique-2851>_57568,dehors : je suis chez moi . Quand une grisette
Gozlan-Leon_Les-Vendanges_<un fils unique-2851>_57579,"prononcé le je suis chez moi , il est peu"
Gozlan-Leon_Les-Vendanges_<un fils unique-2851>_57597,"obéir , se mettre à sa discrétion , et ne"
Gozlan-Leon_Les-Vendanges_<un fils unique-2851>_57607,"plus rien attendre que de sa pitié . Résister ,"
Gozlan-Leon_Les-Vendanges_<un fils unique-2851>_57738,plus dans l' appartement de la grisette . — Maintenant
Gozlan-Leon_Les-Vendanges_<un fils unique-2851>_57750,"voilà presque sec , reprit - elle en lui ouvrant"
Gozlan-Leon_Les-Vendanges_<un fils unique-2851>_57824,"en est ainsi , répliqua Reine , restez ici ;"
Gozlan-Leon_Les-Vendanges_<un fils unique-2851>_57829,"Reine , restez ici ; moi j' irai coucher chez"
Gozlan-Leon_Les-Vendanges_<un fils unique-2851>_57830,", restez ici ; moi j' irai coucher chez une"
Gozlan-Leon_Les-Vendanges_<un fils unique-2851>_57837,coucher chez une amie . Je ne veux pas de
Gozlan-Leon_Les-Vendanges_<un fils unique-2851>_57844,veux pas de scène . Elle entre comme un éclair
Gozlan-Leon_Les-Vendanges_<un fils unique-2851>_57850,"entre comme un éclair , dénoue son bonnet de huit"
Gozlan-Leon_Les-Vendanges_<un fils unique-2851>_57851,"comme un éclair , dénoue son bonnet de huit ,"
Gozlan-Leon_Les-Vendanges_<un fils unique-2851>_57856,"son bonnet de huit , passe , croise en un"
Gozlan-Leon_Les-Vendanges_<un fils unique-2851>_57858,"de huit , passe , croise en un clin d'"
Gozlan-Leon_Les-Vendanges_<un fils unique-2851>_57873,"une sorte de peignoir , fourre sa tête sous un"
Gozlan-Leon_Les-Vendanges_<un fils unique-2851>_57874,"sorte de peignoir , fourre sa tête sous un petit"
Gozlan-Leon_Les-Vendanges_<un fils unique-2851>_57882,"un petit chapeau , et se dispose à sortir ."
Gozlan-Leon_Les-Vendanges_<un fils unique-2851>_57912,. — Tenez ! dit - elle en mettant son
Gozlan-Leon_Les-Vendanges_<un fils unique-2851>_57916,dit - elle en mettant son passe - partout sous
Gozlan-Leon_Les-Vendanges_<un fils unique-2851>_57953,"Papa , ajouta - t - elle , en aiguisant"
Gozlan-Leon_Les-Vendanges_<un fils unique-2851>_57958,"- elle , en aiguisant ses paroles d' un terrible"
Gozlan-Leon_Les-Vendanges_<un fils unique-2851>_57981,"écarter la clef , que Reine n' avait cessé de"
Gozlan-Leon_Les-Vendanges_<un fils unique-2851>_57991,"tenir en garde , Ervasy lui toucha involontairement le visage"
Gozlan-Leon_Les-Vendanges_<un fils unique-2851>_57997,"toucha involontairement le visage . Celle - ci , égarée"
Gozlan-Leon_Les-Vendanges_<un fils unique-2851>_58007,"par le dépit , lui lança un soufflet , et"
Gozlan-Leon_Les-Vendanges_<un fils unique-2851>_58053,et croit être battue . Reine arracha la cravate à
Gozlan-Leon_Les-Vendanges_<un fils unique-2851>_58060,"la cravate à Ervasy , défit son gilet et l'"
Gozlan-Leon_Les-Vendanges_<un fils unique-2851>_58061,"cravate à Ervasy , défit son gilet et l' égratigna"
Gozlan-Leon_Les-Vendanges_<un fils unique-2851>_58065,défit son gilet et l' égratigna jusqu' à ce que
Gozlan-Leon_Les-Vendanges_<un fils unique-2851>_58072,à ce que les forces lui manquèrent . Alors elle
Gozlan-Leon_Les-Vendanges_<un fils unique-2851>_58076,"forces lui manquèrent . Alors elle tomba , elle eut"
Gozlan-Leon_Les-Vendanges_<un fils unique-2851>_58079,". Alors elle tomba , elle eut une attaque de"
Gozlan-Leon_Les-Vendanges_<un fils unique-2851>_58087,"attaque de nerfs . Quand ses sens furent revenus ,"
Gozlan-Leon_Les-Vendanges_<un fils unique-2851>_58092,"ses sens furent revenus , elle se vit avec une"
Gozlan-Leon_Les-Vendanges_<un fils unique-2851>_58114,autour des poignets . Qu' elle était charmante ainsi pâle
Gozlan-Leon_Les-Vendanges_<un fils unique-2851>_58133,"d' Ervasy , occupé à la consoler . — Cela"
Gozlan-Leon_Les-Vendanges_<un fils unique-2851>_58138,"la consoler . — Cela te plaît - il ,"
Gozlan-Leon_Les-Vendanges_<un fils unique-2851>_58140,". — Cela te plaît - il , lui demanda"
Gozlan-Leon_Les-Vendanges_<un fils unique-2851>_58143,"te plaît - il , lui demanda Ervasy ? Cette"
Gozlan-Leon_Les-Vendanges_<un fils unique-2851>_58153,chaîne est - elle de ton goût ? je te
Gozlan-Leon_Les-Vendanges_<un fils unique-2851>_58157,de ton goût ? je te t' ai achetée sur
Gozlan-Leon_Les-Vendanges_<un fils unique-2851>_58168,"économies . — Pourquoi mentez - vous , dit Reine"
Gozlan-Leon_Les-Vendanges_<un fils unique-2851>_58172,"mentez - vous , dit Reine avec une moue délicieuse"
Gozlan-Leon_Les-Vendanges_<un fils unique-2851>_58190,"de la chaîne ? — Moi , je mens ?"
Gozlan-Leon_Les-Vendanges_<un fils unique-2851>_58192,"chaîne ? — Moi , je mens ? — A"
Gozlan-Leon_Les-Vendanges_<un fils unique-2851>_58204,même ; et cela va me faire mettre encore en
Gozlan-Leon_Les-Vendanges_<un fils unique-2851>_58219,vous pas de honte de me l' avoir caché ?
Gozlan-Leon_Les-Vendanges_<un fils unique-2851>_58226,avoir caché ? — Que t' ai - je caché
Gozlan-Leon_Les-Vendanges_<un fils unique-2851>_58233,- je caché ? — Vous êtes millionnaire ; oui
Gozlan-Leon_Les-Vendanges_<un fils unique-2851>_58252,le roi . Le portier me l' a dit .
Gozlan-Leon_Les-Vendanges_<un fils unique-2851>_58258,"l' a dit . — Moi , millionnaire ! Ce"
