,text_surronding
Gozlan-Leon_Les-Vendanges_<L' aîné-4932>_97216,sa faveur entre lui et moi ? — Votre affection
Gozlan-Leon_Les-Vendanges_<L' aîné-4932>_97219,lui et moi ? — Votre affection m' est connue
Gozlan-Leon_Les-Vendanges_<L' aîné-4932>_97221,"moi ? — Votre affection m' est connue , Ulrich"
Gozlan-Leon_Les-Vendanges_<L' aîné-4932>_97225,"affection m' est connue , Ulrich , je n' ai"
Gozlan-Leon_Les-Vendanges_<L' aîné-4932>_97227,"est connue , Ulrich , je n' ai à vous"
Gozlan-Leon_Les-Vendanges_<L' aîné-4932>_97231,", je n' ai à vous parler que de votre"
Gozlan-Leon_Les-Vendanges_<L' aîné-4932>_97235,à vous parler que de votre avenir . Vous avez
Gozlan-Leon_Les-Vendanges_<L' aîné-4932>_97238,que de votre avenir . Vous avez vingt - deux
Gozlan-Leon_Les-Vendanges_<L' aîné-4932>_97246,"- deux ans . — J' aurais désiré , mon"
Gozlan-Leon_Les-Vendanges_<L' aîné-4932>_97250,"— J' aurais désiré , mon père , qu' ils"
Gozlan-Leon_Les-Vendanges_<L' aîné-4932>_97260,eussent été mieux employés pour votre gloire . — La
Gozlan-Leon_Les-Vendanges_<L' aîné-4932>_97275,entre de dignes mains . Eberstein regarda son fils aîné
Gozlan-Leon_Les-Vendanges_<L' aîné-4932>_97277,"dignes mains . Eberstein regarda son fils aîné , qui"
Gozlan-Leon_Les-Vendanges_<L' aîné-4932>_97281,"regarda son fils aîné , qui détourna un instant son"
Gozlan-Leon_Les-Vendanges_<L' aîné-4932>_97285,", qui détourna un instant son attention des enluminures chevaleresques"
Gozlan-Leon_Les-Vendanges_<L' aîné-4932>_97291,attention des enluminures chevaleresques dont il se délectait pour s'
Gozlan-Leon_Les-Vendanges_<L' aîné-4932>_97306,à l' allusion . — Votre renommée ne saurait donc
Gozlan-Leon_Les-Vendanges_<L' aîné-4932>_97313,"ne saurait donc dépendre , Ulrich , ni d' un"
Gozlan-Leon_Les-Vendanges_<L' aîné-4932>_97322,"un nom de famille dont vous ne pouvez , par"
Gozlan-Leon_Les-Vendanges_<L' aîné-4932>_97327,"vous ne pouvez , par votre naissance , perpétuer l'"
Gozlan-Leon_Les-Vendanges_<L' aîné-4932>_97341,la carrière des armes où j' ai des raisons pour
Gozlan-Leon_Les-Vendanges_<L' aîné-4932>_97346,j' ai des raisons pour vous défendre d' entrer .
Gozlan-Leon_Les-Vendanges_<L' aîné-4932>_97368,jaloux ; le rang que vous y obtiendrez par les
Gozlan-Leon_Les-Vendanges_<L' aîné-4932>_97375,obtiendrez par les droits de votre nom est assez beau
Gozlan-Leon_Les-Vendanges_<L' aîné-4932>_97383,assez beau pour ne point vous faire regretter de n'
Gozlan-Leon_Les-Vendanges_<L' aîné-4932>_97390,regretter de n' être que le second héritier de ma
Gozlan-Leon_Les-Vendanges_<L' aîné-4932>_97394,que le second héritier de ma race . Sanctifiée en
Gozlan-Leon_Les-Vendanges_<L' aîné-4932>_97399,"ma race . Sanctifiée en vous , elle se prolongera"
Gozlan-Leon_Les-Vendanges_<L' aîné-4932>_97405,", elle se prolongera par votre frère dans une voie"
Gozlan-Leon_Les-Vendanges_<L' aîné-4932>_97415,d' illustration . Cette fois le fils aîné du graf
Gozlan-Leon_Les-Vendanges_<L' aîné-4932>_97418,Cette fois le fils aîné du graf laissa passer l'
Gozlan-Leon_Les-Vendanges_<L' aîné-4932>_97425,laissa passer l' éloge ; son attention était concentrée sur
Gozlan-Leon_Les-Vendanges_<L' aîné-4932>_97435,"un endroit du livre qu' il tenait , où le"
Gozlan-Leon_Les-Vendanges_<L' aîné-4932>_97508,"milieu de sa distraction , tu as écrit là un"
Gozlan-Leon_Les-Vendanges_<L' aîné-4932>_97517,un beau livre . — Je m' étais fait depuis
Gozlan-Leon_Les-Vendanges_<L' aîné-4932>_97526,"depuis longtemps ce raisonnement , mon père , poursuivit Ulrich"
Gozlan-Leon_Les-Vendanges_<L' aîné-4932>_97530,", mon père , poursuivit Ulrich en baissant les yeux"
Gozlan-Leon_Les-Vendanges_<L' aîné-4932>_97536,"en baissant les yeux , ma fierté , mon orgueil"
Gozlan-Leon_Les-Vendanges_<L' aîné-4932>_97539,"yeux , ma fierté , mon orgueil sans doute déplacé"
Gozlan-Leon_Les-Vendanges_<L' aîné-4932>_97545,"orgueil sans doute déplacé , m' ont toujours empêché de"
Gozlan-Leon_Les-Vendanges_<L' aîné-4932>_97554,de l' admettre . — Vos répugnances ne changeront pourtant
Gozlan-Leon_Les-Vendanges_<L' aîné-4932>_97561,"ne changeront pourtant rien à votre devoir , je l'"
Gozlan-Leon_Les-Vendanges_<L' aîné-4932>_97568,", je l' espère , Ulrich . — Je crains"
Gozlan-Leon_Les-Vendanges_<L' aîné-4932>_97571,"espère , Ulrich . — Je crains le contraire ,"
Gozlan-Leon_Les-Vendanges_<L' aîné-4932>_97577,"crains le contraire , excusez ma franchise . Trop pénétré"
Gozlan-Leon_Les-Vendanges_<L' aîné-4932>_97622,"n' eut qu' à regarder Ulrich , dont la figure"
Gozlan-Leon_Les-Vendanges_<L' aîné-4932>_97624,"qu' à regarder Ulrich , dont la figure respirait la"
Gozlan-Leon_Les-Vendanges_<L' aîné-4932>_97635,d' un ange . — Vous êtes allé à Rome
Gozlan-Leon_Les-Vendanges_<L' aîné-4932>_97642,allé à Rome : je vous y avais envoyé pour
Gozlan-Leon_Les-Vendanges_<L' aîné-4932>_97648,y avais envoyé pour que vous vous décidassiez à embrasser
Gozlan-Leon_Les-Vendanges_<L' aîné-4932>_97670,"princes , plus zélés que vous sans doute à obéir"
Gozlan-Leon_Les-Vendanges_<L' aîné-4932>_97683,"de leurs pères . Je vous citerais , s' il"
Gozlan-Leon_Les-Vendanges_<L' aîné-4932>_97691,"s' il est nécessaire , votre bon cousin , l'"
Gozlan-Leon_Les-Vendanges_<L' aîné-4932>_97720,revenant de Rome à Wittenberg vous ne l' ayez pas
Gozlan-Leon_Les-Vendanges_<L' aîné-4932>_97736,"à ce propos , que votre retour a été bien"
Gozlan-Leon_Les-Vendanges_<L' aîné-4932>_97746,"prompt . — Oui , mon père . — Et"
Gozlan-Leon_Les-Vendanges_<L' aîné-4932>_97753,. — Et comment êtes - vous revenu de Rome
Gozlan-Leon_Les-Vendanges_<L' aîné-4932>_97760,revenu de Rome ? — J' en suis revenu chrétien
Gozlan-Leon_Les-Vendanges_<L' aîné-4932>_97770,". A cette réponse , Johann rît comme un fou"
Gozlan-Leon_Les-Vendanges_<L' aîné-4932>_97776,rît comme un fou . Il jugeait son frère extrêmement
Gozlan-Leon_Les-Vendanges_<L' aîné-4932>_97778,un fou . Il jugeait son frère extrêmement naïf .
Gozlan-Leon_Les-Vendanges_<L' aîné-4932>_97790,- folio faillit glisser de ses genoux à terre ;
Gozlan-Leon_Les-Vendanges_<L' aîné-4932>_97796,genoux à terre ; dans son hilarité il passa au
Gozlan-Leon_Les-Vendanges_<L' aîné-4932>_97798,terre ; dans son hilarité il passa au moins deux
Gozlan-Leon_Les-Vendanges_<L' aîné-4932>_97807,deux imagés . Eberstein considéra Ulrich d' une façon peu
Gozlan-Leon_Les-Vendanges_<L' aîné-4932>_97816,"peu indulgente , et qui lui ôta au moins dix"
Gozlan-Leon_Les-Vendanges_<L' aîné-4932>_97823,au moins dix ans dans son estime personnelle e n'
Gozlan-Leon_Les-Vendanges_<L' aîné-4932>_97834,"point de l' ironie comme Johann , mais de la"
Gozlan-Leon_Les-Vendanges_<L' aîné-4932>_97852,"d' un père est pour le fils un soufflet ,"
Gozlan-Leon_Les-Vendanges_<L' aîné-4932>_97872,rougeur aussi . — Voudriez - vous bien m' apprendre
Gozlan-Leon_Les-Vendanges_<L' aîné-4932>_97880,"m' apprendre alors quelle profession vous avez choisie , afin"
Gozlan-Leon_Les-Vendanges_<L' aîné-4932>_97891,", moi étant mort , vous ne soyez point obligé"
Gozlan-Leon_Les-Vendanges_<L' aîné-4932>_97920,détrousser les passants ? Compteriez - vous sur votre frère
Gozlan-Leon_Les-Vendanges_<L' aîné-4932>_97923,? Compteriez - vous sur votre frère Johann ? Ulrich
Gozlan-Leon_Les-Vendanges_<L' aîné-4932>_97927,sur votre frère Johann ? Ulrich exprima par un froncement
Gozlan-Leon_Les-Vendanges_<L' aîné-4932>_97941,de négation bien formel . Johann n' eut pas l'
Gozlan-Leon_Les-Vendanges_<L' aîné-4932>_97958,cas qu' on faisait de sa générosité . — Vous
Gozlan-Leon_Les-Vendanges_<L' aîné-4932>_97965,". — Vous mort , mon père , je prierai"
Gozlan-Leon_Les-Vendanges_<L' aîné-4932>_97968,"mort , mon père , je prierai Dieu pour que"
Gozlan-Leon_Les-Vendanges_<L' aîné-4932>_97975,"Dieu pour que votre ombre me protège , et je"
Gozlan-Leon_Les-Vendanges_<L' aîné-4932>_97979,"ombre me protège , et je sortirai de cette maison"
Gozlan-Leon_Les-Vendanges_<L' aîné-4932>_97995,l' exigez ; maintenant si mon seigneur l' ordonne .
Gozlan-Leon_Les-Vendanges_<L' aîné-4932>_98012,levé . — Où iriez - vous ? La terre
Gozlan-Leon_Les-Vendanges_<L' aîné-4932>_98037,rampent les serfs . Êtes - vous de la montagne
Gozlan-Leon_Les-Vendanges_<L' aîné-4932>_98055,a encore des mers . J' irai dans nos hanses
Gozlan-Leon_Les-Vendanges_<L' aîné-4932>_98080,ce pas ? y vendre votre noblesse au poids des
Gozlan-Leon_Les-Vendanges_<L' aîné-4932>_98136,"Il fut un temps , Ulrich , où j' aurais"
Gozlan-Leon_Les-Vendanges_<L' aîné-4932>_98139,"temps , Ulrich , où j' aurais eu le droit"
Gozlan-Leon_Les-Vendanges_<L' aîné-4932>_98145,aurais eu le droit de vous enfermer dans un cloîtré
Gozlan-Leon_Les-Vendanges_<L' aîné-4932>_98152,dans un cloîtré et de vous forcer à y attendre
Gozlan-Leon_Les-Vendanges_<L' aîné-4932>_98160,y attendre que la grâce vous visitât . Non -
Gozlan-Leon_Les-Vendanges_<L' aîné-4932>_98166,visitât . Non - seulement je n' ai plus ce
Gozlan-Leon_Les-Vendanges_<L' aîné-4932>_98176,"droit , mais l' aurais - je , que je"
Gozlan-Leon_Les-Vendanges_<L' aîné-4932>_98180,"aurais - je , que je n' en userais pas"
Gozlan-Leon_Les-Vendanges_<L' aîné-4932>_98186,n' en userais pas contre vous . La noble figure
Gozlan-Leon_Les-Vendanges_<L' aîné-4932>_98191,vous . La noble figure du graf était diversement affectée
Gozlan-Leon_Les-Vendanges_<L' aîné-4932>_98216,"se montrer faible . — Vous ne luttez pas ,"
Gozlan-Leon_Les-Vendanges_<L' aîné-4932>_98221,"Vous ne luttez pas , Ulrich , contre le caprice"
Gozlan-Leon_Les-Vendanges_<L' aîné-4932>_98268,"est notre force . — Vous vous trompez , reprit"
Gozlan-Leon_Les-Vendanges_<L' aîné-4932>_98274,"vous trompez , reprit respectueusement Ulrich , je ne lutté"
Gozlan-Leon_Les-Vendanges_<L' aîné-4932>_98276,", reprit respectueusement Ulrich , je ne lutté pas ,"
Gozlan-Leon_Les-Vendanges_<L' aîné-4932>_98281,"je ne lutté pas , je me soumets . Né"
Gozlan-Leon_Les-Vendanges_<L' aîné-4932>_98289,". Né le second dans ma famille , ma famille"
Gozlan-Leon_Les-Vendanges_<L' aîné-4932>_98292,"second dans ma famille , ma famille ne me doit"
Gozlan-Leon_Les-Vendanges_<L' aîné-4932>_98295,"famille , ma famille ne me doit rien ; je"
Gozlan-Leon_Les-Vendanges_<L' aîné-4932>_98299,ne me doit rien ; je m' en retire .
Gozlan-Leon_Les-Vendanges_<L' aîné-4932>_98310,Que pourrait - elle pour vous ? Si je partage
Gozlan-Leon_Les-Vendanges_<L' aîné-4932>_98313,"elle pour vous ? Si je partage , dit sans"
Gozlan-Leon_Les-Vendanges_<L' aîné-4932>_98322,"sans emphase mais avec dignité le graf Eberstein , mes"
Gozlan-Leon_Les-Vendanges_<L' aîné-4932>_98326,"dignité le graf Eberstein , mes propriétés en deux ,"
Gozlan-Leon_Les-Vendanges_<L' aîné-4932>_98331,"mes propriétés en deux , mon écusson en deux ,"
Gozlan-Leon_Les-Vendanges_<L' aîné-4932>_98336,"mon écusson en deux , mon nom en deux ,"
Gozlan-Leon_Les-Vendanges_<L' aîné-4932>_98350,"vos enfants et ceux de votre frère , par le"
Gozlan-Leon_Les-Vendanges_<L' aîné-4932>_98450,"est point là ce que je souhaite , mon père"
Gozlan-Leon_Les-Vendanges_<L' aîné-4932>_98453,"ce que je souhaite , mon père . Gardez votre"
Gozlan-Leon_Les-Vendanges_<L' aîné-4932>_98457,", mon père . Gardez votre héritage pur et intact"
Gozlan-Leon_Les-Vendanges_<L' aîné-4932>_98463,"héritage pur et intact comme vous , l' avez reçu"
Gozlan-Leon_Les-Vendanges_<L' aîné-4932>_98469,", l' avez reçu . Je compte assez , j'"
Gozlan-Leon_Les-Vendanges_<L' aîné-4932>_98473,". Je compte assez , j' ose vous le répéter"
Gozlan-Leon_Les-Vendanges_<L' aîné-4932>_98475,"compte assez , j' ose vous le répéter , sur"
Gozlan-Leon_Les-Vendanges_<L' aîné-4932>_98480,"vous le répéter , sur mon épée pour me faire"
Gozlan-Leon_Les-Vendanges_<L' aîné-4932>_98483,", sur mon épée pour me faire une place dans"
Gozlan-Leon_Les-Vendanges_<L' aîné-4932>_98496,"— Oui , allez mettre votre épée au service des"
Gozlan-Leon_Les-Vendanges_<L' aîné-4932>_98504,"service des rois , et vous apprendrez de quel côté"
Gozlan-Leon_Les-Vendanges_<L' aîné-4932>_98527,"d' amertume coulait des lèvres du graf , qui était"
Gozlan-Leon_Les-Vendanges_<L' aîné-4932>_98530,"des lèvres du graf , qui était puissant de raison"
Gozlan-Leon_Les-Vendanges_<L' aîné-4932>_98536,était puissant de raison quand il portait sa pensée devant
Gozlan-Leon_Les-Vendanges_<L' aîné-4932>_98538,de raison quand il portait sa pensée devant l' institution
Gozlan-Leon_Les-Vendanges_<L' aîné-4932>_98546,"l' institution féodale , lorsqu' il s' y plaçait à"
Gozlan-Leon_Les-Vendanges_<L' aîné-4932>_98558,"comme une bannière ; redevenu père , il se sentait"
Gozlan-Leon_Les-Vendanges_<L' aîné-4932>_98560,"bannière ; redevenu père , il se sentait désarmé et"
Gozlan-Leon_Les-Vendanges_<L' aîné-4932>_98575,"veuille , continua - t - il , que vous"
Gozlan-Leon_Les-Vendanges_<L' aîné-4932>_98579,"t - il , que vous , n' ayez pas"
Gozlan-Leon_Les-Vendanges_<L' aîné-4932>_98588,"pas à vous repentir , Ulrich , du mépris que"
Gozlan-Leon_Les-Vendanges_<L' aîné-4932>_98593,"Ulrich , du mépris que vous affectez pour la vocation"
Gozlan-Leon_Les-Vendanges_<L' aîné-4932>_98608,plus libre de toutes ! Vous y réfléchirez . —
Gozlan-Leon_Les-Vendanges_<L' aîné-4932>_98615,"réfléchirez . — Oui , mon père . — C'"
Gozlan-Leon_Les-Vendanges_<L' aîné-4932>_98628,! interrompit tout à coup Johann en frappant des mains
Gozlan-Leon_Les-Vendanges_<L' aîné-4932>_98721,respecter les éperons d' or du chevalier ; et pourtant
Gozlan-Leon_Les-Vendanges_<L' aîné-4932>_98747,wahrlich ein grausam Thier . Vous n' aimez donc pas
Gozlan-Leon_Les-Vendanges_<L' aîné-4932>_98754,aimez donc pas Tewerdanck ? vous ne le connaissez donc
Gozlan-Leon_Les-Vendanges_<L' aîné-4932>_98764,"pas ? Mais que connaissez - vous alors , Ulrich"
Gozlan-Leon_Les-Vendanges_<L' aîné-4932>_98768,"connaissez - vous alors , Ulrich ? — Je connais"
Gozlan-Leon_Les-Vendanges_<L' aîné-4932>_98771,"alors , Ulrich ? — Je connais Tewerdanck , mon"
Gozlan-Leon_Les-Vendanges_<L' aîné-4932>_98775,"— Je connais Tewerdanck , mon frère , répondit avec"
Gozlan-Leon_Les-Vendanges_<L' aîné-4932>_98789,"était pas sans malice , Ulrich , en posant le"
Gozlan-Leon_Les-Vendanges_<L' aîné-4932>_98802,livre de Johann ; et je l' aime parce qu'
Gozlan-Leon_Les-Vendanges_<L' aîné-4932>_98808,l' aime parce qu' il m' apprend quelque chose .
Gozlan-Leon_Les-Vendanges_<L' aîné-4932>_98942,"honneur ; du moins , je le crois ainsi ,"
Gozlan-Leon_Les-Vendanges_<L' aîné-4932>_98947,"je le crois ainsi , mon frère . — Bah"
Gozlan-Leon_Les-Vendanges_<L' aîné-4932>_98953,frère . — Bah ! vous voudriez me persuader qu'
Gozlan-Leon_Les-Vendanges_<L' aîné-4932>_98955,— Bah ! vous voudriez me persuader qu' il y
Gozlan-Leon_Les-Vendanges_<L' aîné-4932>_98972,"marchant sur des épées , Ulrich ! — Voudriez -"
Gozlan-Leon_Les-Vendanges_<L' aîné-4932>_98976,", Ulrich ! — Voudriez - vous , Johann ,"
Gozlan-Leon_Les-Vendanges_<L' aîné-4932>_98979,"— Voudriez - vous , Johann , me dire quelle"
Gozlan-Leon_Les-Vendanges_<L' aîné-4932>_98981,"- vous , Johann , me dire quelle si grande"
Gozlan-Leon_Les-Vendanges_<L' aîné-4932>_98988,quelle si grande valeur déploierait le chevalier à marcher sur
Gozlan-Leon_Les-Vendanges_<L' aîné-4932>_99000,"d' épées qui ne peuvent le blesser , lui qui"
Gozlan-Leon_Les-Vendanges_<L' aîné-4932>_99003,"ne peuvent le blesser , lui qui a arraché la"
Gozlan-Leon_Les-Vendanges_<L' aîné-4932>_99004,"peuvent le blesser , lui qui a arraché la langue"
Gozlan-Leon_Les-Vendanges_<L' aîné-4932>_99032,"a qu' un instant , Ulrich , que vous souteniez"
Gozlan-Leon_Les-Vendanges_<L' aîné-4932>_99035,"instant , Ulrich , que vous souteniez que le vice"
Gozlan-Leon_Les-Vendanges_<L' aîné-4932>_99047,"l' ours ; maintenant , vous me dites que ce"
Gozlan-Leon_Les-Vendanges_<L' aîné-4932>_99048,"ours ; maintenant , vous me dites que ce sont"
Gozlan-Leon_Les-Vendanges_<L' aîné-4932>_99056,"ce sont les épées : vous raillez , mon frère"
Gozlan-Leon_Les-Vendanges_<L' aîné-4932>_99059,"épées : vous raillez , mon frère . Pendant cette"
Gozlan-Leon_Les-Vendanges_<L' aîné-4932>_99071,les deux têtes blondes d' Ulrich et de Johann se
Gozlan-Leon_Les-Vendanges_<L' aîné-4932>_99074,blondes d' Ulrich et de Johann se touchaient et se
Gozlan-Leon_Les-Vendanges_<L' aîné-4932>_99084,"trouvaient au niveau des genoux du graf , qui ,"
Gozlan-Leon_Les-Vendanges_<L' aîné-4932>_99087,"des genoux du graf , qui , courbé et appuyé"
Gozlan-Leon_Les-Vendanges_<L' aîné-4932>_99142,"chant en , chant , le graf et Ulrich furent"
Gozlan-Leon_Les-Vendanges_<L' aîné-4932>_99145,"chant , le graf et Ulrich furent entraînés par Johann"
Gozlan-Leon_Les-Vendanges_<L' aîné-4932>_99149,"et Ulrich furent entraînés par Johann , et l' un"
Gozlan-Leon_Les-Vendanges_<L' aîné-4932>_99152,"entraînés par Johann , et l' un et l' autre"
Gozlan-Leon_Les-Vendanges_<L' aîné-4932>_99155,", et l' un et l' autre , le grave"
Gozlan-Leon_Les-Vendanges_<L' aîné-4932>_99158,"un et l' autre , le grave père et le"
Gozlan-Leon_Les-Vendanges_<L' aîné-4932>_99162,", le grave père et le fils moraliste , oublièrent"
Gozlan-Leon_Les-Vendanges_<L' aîné-4932>_99208,", qui avait à parler au graf , pouvait entrer"
Gozlan-Leon_Les-Vendanges_<L' aîné-4932>_99214,"graf , pouvait entrer . Le graf fit un signe"
Gozlan-Leon_Les-Vendanges_<du père Richomme-1623>_30676,l' esprit ; la condition du père Richomme avait à
Gozlan-Leon_Les-Vendanges_<du père Richomme-1623>_30767,il était fort lard lorsque M . Richomme et sa
Gozlan-Leon_Les-Vendanges_<du père Richomme-1623>_30771,lorsque M . Richomme et sa femme mirent pied à
Gozlan-Leon_Les-Vendanges_<du père Richomme-1623>_30817,"est tout naturel ; pensa M . Richomme , les"
Gozlan-Leon_Les-Vendanges_<du père Richomme-1623>_30857,"locataires . En frissonnant , il mil du bois dans"
Gozlan-Leon_Les-Vendanges_<du père Richomme-1623>_30899,; on y étouffait . Je n' avais pas prévu
Gozlan-Leon_Les-Vendanges_<du père Richomme-1623>_30910,"léger inconvénient , pensa encore l' heureux propriétaire qui toussait"
Gozlan-Leon_Les-Vendanges_<du père Richomme-1623>_30913,pensa encore l' heureux propriétaire qui toussait à tous les
Gozlan-Leon_Les-Vendanges_<du père Richomme-1623>_30971,"de dissiper la fumée , Richomme ouvrit toutes les croisées"
Gozlan-Leon_Les-Vendanges_<du père Richomme-1623>_30978,"toutes les croisées , et il jouit aussitôt d' un"
Gozlan-Leon_Les-Vendanges_<du père Richomme-1623>_30987,"un air parfaitement glacial ; sa pauvre femme grelottait ,"
Gozlan-Leon_Les-Vendanges_<du père Richomme-1623>_30998,avoir autant de philosophie que lui . Quand le bois
Gozlan-Leon_Les-Vendanges_<du père Richomme-1623>_31045,"doit pas s' effaroucher , Richomme proposa à sa femme"
Gozlan-Leon_Les-Vendanges_<du père Richomme-1623>_31048,"effaroucher , Richomme proposa à sa femme de visiter en"
Gozlan-Leon_Les-Vendanges_<du père Richomme-1623>_31205,", pour nous , murmura Richomme ; toi qui aimes"
Gozlan-Leon_Les-Vendanges_<du père Richomme-1623>_31217,", madame Richomme , et moi le ponceau . Assurément"
Gozlan-Leon_Les-Vendanges_<du père Richomme-1623>_31234,"goût , ajouta - t - il . Par malheur"
Gozlan-Leon_Les-Vendanges_<du père Richomme-1623>_31252,en vendant sa propriété à M . Richomme . —
Gozlan-Leon_Les-Vendanges_<du père Richomme-1623>_31263,"l' autre pièce , dit M . Richomme ; tout"
Gozlan-Leon_Les-Vendanges_<du père Richomme-1623>_31316,de beaux meubles . Cependant M . Richomme recula sur
Gozlan-Leon_Les-Vendanges_<du père Richomme-1623>_31321,M . Richomme recula sur sa femme qui le suivait
Gozlan-Leon_Les-Vendanges_<du père Richomme-1623>_31324,recula sur sa femme qui le suivait pas à pas
Gozlan-Leon_Les-Vendanges_<du père Richomme-1623>_31371,"maison était fou , dit Richomme . — Peut -"
Gozlan-Leon_Les-Vendanges_<du père Richomme-1623>_31378,"— Peut - être , mon bon ami , était"
Gozlan-Leon_Les-Vendanges_<du père Richomme-1623>_31392,"deuil , répliqua plus sagement sa femme . On verra"
Gozlan-Leon_Les-Vendanges_<du père Richomme-1623>_31410,". — Fleuriot aurait dû m' avertir , pensa Richomme"
Gozlan-Leon_Les-Vendanges_<du père Richomme-1623>_31414,"dû m' avertir , pensa Richomme ; je n' aurais"
Gozlan-Leon_Les-Vendanges_<du père Richomme-1623>_31416,"avertir , pensa Richomme ; je n' aurais pas acheté"
Gozlan-Leon_Les-Vendanges_<du père Richomme-1623>_31444,"- ce - pas , ma femme ? Résigné pourtant"
Gozlan-Leon_Les-Vendanges_<du père Richomme-1623>_31454,"à ce funèbre mobilier , il poursuivit son inspection ,"
Gozlan-Leon_Les-Vendanges_<du père Richomme-1623>_31456,"funèbre mobilier , il poursuivit son inspection , et il"
Gozlan-Leon_Les-Vendanges_<du père Richomme-1623>_31460,"poursuivit son inspection , et il ouvrit la porte de"
Gozlan-Leon_Les-Vendanges_<du père Richomme-1623>_31524,pour égayer l' âme . Richomme frémit en lisant de
Gozlan-Leon_Les-Vendanges_<du père Richomme-1623>_31560,des meilleurs morceaux élégiaques . Il n' alla pas plus
Gozlan-Leon_Les-Vendanges_<du père Richomme-1623>_31569,"plus loin , le cœur lui faillit ; en tournant"
Gozlan-Leon_Les-Vendanges_<du père Richomme-1623>_31581,"dos à ces épitaphes , il se promit de renouveler"
Gozlan-Leon_Les-Vendanges_<du père Richomme-1623>_31603,"contrariétés locales , dont pourtant il ne s' exagérait pas"
Gozlan-Leon_Les-Vendanges_<du père Richomme-1623>_31611,"exagérait pas l' importance , il alla se coucher plein"
Gozlan-Leon_Les-Vendanges_<du père Richomme-1623>_31668,"trop froids , soit qu' il n' eût pas l'"
Gozlan-Leon_Les-Vendanges_<du père Richomme-1623>_31678,"habitude du nouveau lit , Richomme , glacé , perdu"
Gozlan-Leon_Les-Vendanges_<du père Richomme-1623>_31688,", dépaysé dans celui où il s' étendit , ne"
Gozlan-Leon_Les-Vendanges_<du père Richomme-1623>_31726,"l' hiver , les heures lui furent , d' une"
Gozlan-Leon_Les-Vendanges_<du père Richomme-1623>_31741,"moins , pensa - t - il sans oser ,"
Gozlan-Leon_Les-Vendanges_<du père Richomme-1623>_31749,"oser , le confier à sa femme qui ne dormait"
Gozlan-Leon_Les-Vendanges_<du père Richomme-1623>_31757,"ne dormait pas plus que lui , on entend toujours"
Gozlan-Leon_Les-Vendanges_<du père Richomme-1623>_31804,", cette bibliothèque sinistre , lui revenaient à la mémoire"
Gozlan-Leon_Les-Vendanges_<du père Richomme-1623>_31815,souvenir - désagréable . Cependant sa raison lui conseillait de
Gozlan-Leon_Les-Vendanges_<du père Richomme-1623>_31817,désagréable . Cependant sa raison lui conseillait de ne pas
Gozlan-Leon_Les-Vendanges_<du père Richomme-1623>_31837,la campagne par celle dont il désirait la fin .
Gozlan-Leon_Les-Vendanges_<du père Richomme-1623>_31851,"surprises . Le lendemain , il dormirait mieux ; le"
Gozlan-Leon_Les-Vendanges_<du père Richomme-1623>_31864,"à ces légers ennuis , il verrait , dans tout"
Gozlan-Leon_Les-Vendanges_<du père Richomme-1623>_31872,"dans tout son éclat , sa belle propriété des Petits"
Gozlan-Leon_Les-Vendanges_<du père Richomme-1623>_31887,"jour fut venu et que Richomme , un peu brisé"
Gozlan-Leon_Les-Vendanges_<du père Richomme-1623>_31902,approcha de la croisée ; il aperçut la campagne couverte
Gozlan-Leon_Les-Vendanges_<du père Richomme-1623>_31918,teignait cette couche monotone . Il frissonna . Mais la
Gozlan-Leon_Les-Vendanges_<du père Richomme-1623>_31924,frissonna . Mais la réflexion lui ayant aussitôt démontré qu'
Gozlan-Leon_Les-Vendanges_<du père Richomme-1623>_31942,"et leurs mauvais jours , il dit à sa femme"
Gozlan-Leon_Les-Vendanges_<du père Richomme-1623>_31945,"jours , il dit à sa femme , dont il"
Gozlan-Leon_Les-Vendanges_<du père Richomme-1623>_31949,"à sa femme , dont il redoutait le découragement à"
Gozlan-Leon_Les-Vendanges_<du père Richomme-1623>_31983,"la neige ; Allons ! mes guêtres , ma carnassière"
Gozlan-Leon_Les-Vendanges_<du père Richomme-1623>_31986,"Allons ! mes guêtres , ma carnassière et mon fusil"
Gozlan-Leon_Les-Vendanges_<du père Richomme-1623>_31989,"guêtres , ma carnassière et mon fusil . La châsse"
Gozlan-Leon_Les-Vendanges_<du père Richomme-1623>_32000,la chasse ! — Mais tu vas gagner un gros
Gozlan-Leon_Les-Vendanges_<du père Richomme-1623>_32007,"gagner un gros rhume , monsieur Richomme , y songes"
Gozlan-Leon_Les-Vendanges_<du père Richomme-1623>_32012,"monsieur Richomme , y songes - tu ? — Bah"
Gozlan-Leon_Les-Vendanges_<du père Richomme-1623>_32026,L' exercice est bon : je ne suis pas venu
Gozlan-Leon_Les-Vendanges_<du père Richomme-1623>_32038,dormir . . . — Tu dis - plus vrai
Gozlan-Leon_Les-Vendanges_<du père Richomme-1623>_32044,"dis - plus vrai que tu ne le supposes ,"
Gozlan-Leon_Les-Vendanges_<du père Richomme-1623>_32049,"tu ne le supposes , Richomme , si toutes les"
Gozlan-Leon_Les-Vendanges_<du père Richomme-1623>_32078,N' en parlons plus . Je donnerais volontiers cent francs
Gozlan-Leon_Les-Vendanges_<du père Richomme-1623>_32091,"Fleuriot un lièvre tué de ma main , dans mon"
Gozlan-Leon_Les-Vendanges_<du père Richomme-1623>_32095,"de ma main , dans mon parc ; un lièvre"
Gozlan-Leon_Les-Vendanges_<du père Richomme-1623>_32109,"— C' est imprudent à toi , Richomme , de"
Gozlan-Leon_Les-Vendanges_<du père Richomme-1623>_32111,"est imprudent à toi , Richomme , de sortir si"
Gozlan-Leon_Les-Vendanges_<du père Richomme-1623>_32119,sortir si matin sans prendre ton café à la crème
