,text_surronding
Kundera-Milan_L-insoutenable-legerete-de-l-etre_<Tereza-2171>_53357,put repousser la tentation . Elle rentra dans la pièce
Kundera-Milan_L-insoutenable-legerete-de-l-etre_<Tereza-2171>_53363,"rentra dans la pièce , ramassa ses vêtements épars ,"
Kundera-Milan_L-insoutenable-legerete-de-l-etre_<Tereza-2171>_53364,"dans la pièce , ramassa ses vêtements épars , se"
Kundera-Milan_L-insoutenable-legerete-de-l-etre_<Tereza-2171>_53368,"ramassa ses vêtements épars , se rhabilla et sortit ."
Kundera-Milan_L-insoutenable-legerete-de-l-etre_<Tereza-2171>_53369,"ses vêtements épars , se rhabilla et sortit . 20"
Kundera-Milan_L-insoutenable-legerete-de-l-etre_<Tereza-2171>_53371,"épars , se rhabilla et sortit . 20 Elle revenait"
Kundera-Milan_L-insoutenable-legerete-de-l-etre_<Tereza-2171>_53374,rhabilla et sortit . 20 Elle revenait des courses avec
Kundera-Milan_L-insoutenable-legerete-de-l-etre_<Tereza-2171>_53399,il gelait un peu . Elle longeait un lotissement où
Kundera-Milan_L-insoutenable-legerete-de-l-etre_<Tereza-2171>_53424,et de petits jardins . Karénine s' arrêta net ;
Kundera-Milan_L-insoutenable-legerete-de-l-etre_<Tereza-2171>_53436,"par là , fixement . Elle regarda aussi de ce"
Kundera-Milan_L-insoutenable-legerete-de-l-etre_<Tereza-2171>_53453,remarquer de particulier . Karénine la tirait et elle se
Kundera-Milan_L-insoutenable-legerete-de-l-etre_<Tereza-2171>_53456,. Karénine la tirait et elle se laissa conduire .
Kundera-Milan_L-insoutenable-legerete-de-l-etre_<Tereza-2171>_53477,"plate - bande déserte , elle aperçut la petite tête"
Kundera-Milan_L-insoutenable-legerete-de-l-etre_<Tereza-2171>_53513,son triste et rauque . Karénine était tellement agité qu'
Kundera-Milan_L-insoutenable-legerete-de-l-etre_<Tereza-2171>_53523,il lâcha le croissant . Tereza dut l' attacher à
Kundera-Milan_L-insoutenable-legerete-de-l-etre_<Tereza-2171>_53543,à la corneille . Puis elle s' agenouilla et tenta
Kundera-Milan_L-insoutenable-legerete-de-l-etre_<Tereza-2171>_53547,Puis elle s' agenouilla et tenta de creuser le sol
Kundera-Milan_L-insoutenable-legerete-de-l-etre_<Tereza-2171>_53568,n' était pas facile . Elle se cassa un ongle
Kundera-Milan_L-insoutenable-legerete-de-l-etre_<Tereza-2171>_53574,se cassa un ongle ; elle saignait . À ce
Kundera-Milan_L-insoutenable-legerete-de-l-etre_<Tereza-2171>_53587,pierre s' abattit près d' elle . Elle leva les
Kundera-Milan_L-insoutenable-legerete-de-l-etre_<Tereza-2171>_53589,abattit près d' elle . Elle leva les yeux et
Kundera-Milan_L-insoutenable-legerete-de-l-etre_<Tereza-2171>_53594,Elle leva les yeux et aperçut deux gamins d' une
Kundera-Milan_L-insoutenable-legerete-de-l-etre_<Tereza-2171>_53611,encoignure d' une maison . Elle se leva . Voyant
Kundera-Milan_L-insoutenable-legerete-de-l-etre_<Tereza-2171>_53616,Elle se leva . Voyant sa réaction et le chien
Kundera-Milan_L-insoutenable-legerete-de-l-etre_<Tereza-2171>_53631,ils prirent la fuite . Elle se remit à genoux
Kundera-Milan_L-insoutenable-legerete-de-l-etre_<Tereza-2171>_53645,creuser la terre glaise et réussit enfin à libérer la
Kundera-Milan_L-insoutenable-legerete-de-l-etre_<Tereza-2171>_53668,ni marcher ni voler . Elle l' enveloppa dans l'
Kundera-Milan_L-insoutenable-legerete-de-l-etre_<Tereza-2171>_53676,dans l' écharpe rouge qu' elle portait autour du cou
Kundera-Milan_L-insoutenable-legerete-de-l-etre_<Tereza-2171>_53683,autour du cou et la serra dans sa main gauche
Kundera-Milan_L-insoutenable-legerete-de-l-etre_<Tereza-2171>_53685,cou et la serra dans sa main gauche contre son
Kundera-Milan_L-insoutenable-legerete-de-l-etre_<Tereza-2171>_53689,dans sa main gauche contre son corps . De la
Kundera-Milan_L-insoutenable-legerete-de-l-etre_<Tereza-2171>_53697,"De la main droite , elle détacha Karénine de l'"
Kundera-Milan_L-insoutenable-legerete-de-l-etre_<Tereza-2171>_53705,"de l' arbre , et elle eut besoin de toute"
Kundera-Milan_L-insoutenable-legerete-de-l-etre_<Tereza-2171>_53710,elle eut besoin de toute sa force pour le maîtriser
Kundera-Milan_L-insoutenable-legerete-de-l-etre_<Tereza-2171>_53719,maîtriser et le maintenir contre sa jambe . Elle sonna
Kundera-Milan_L-insoutenable-legerete-de-l-etre_<Tereza-2171>_53722,"maintenir contre sa jambe . Elle sonna , n' ayant"
Kundera-Milan_L-insoutenable-legerete-de-l-etre_<Tereza-2171>_53736,pour chercher la clé dans sa poche . Tomas lui
Kundera-Milan_L-insoutenable-legerete-de-l-etre_<Tereza-2171>_53740,dans sa poche . Tomas lui ouvrit . Elle lui
Kundera-Milan_L-insoutenable-legerete-de-l-etre_<Tereza-2171>_53743,. Tomas lui ouvrit . Elle lui tendit la laisse
Kundera-Milan_L-insoutenable-legerete-de-l-etre_<Tereza-2171>_53760,"! » ordonna - t - elle , et elle"
Kundera-Milan_L-insoutenable-legerete-de-l-etre_<Tereza-2171>_53764,"t - elle , et elle porta la corneille dans"
Kundera-Milan_L-insoutenable-legerete-de-l-etre_<Tereza-2171>_53774,la salle de bains . Elle la posa par terre
Kundera-Milan_L-insoutenable-legerete-de-l-etre_<Tereza-2171>_53802,coulait de son corps . Tereza lui fit une litière
Kundera-Milan_L-insoutenable-legerete-de-l-etre_<Tereza-2171>_53841,comme un reproche . 21 Elle était assise sur le
Kundera-Milan_L-insoutenable-legerete-de-l-etre_<Tereza-2171>_53852,de la baignoire et ne pouvait détacher son regard de
Kundera-Milan_L-insoutenable-legerete-de-l-etre_<Tereza-2171>_53854,baignoire et ne pouvait détacher son regard de la corneille
Kundera-Milan_L-insoutenable-legerete-de-l-etre_<Tereza-2171>_53861,de la corneille agonisante . Elle voyait dans sa pitoyable
Kundera-Milan_L-insoutenable-legerete-de-l-etre_<Tereza-2171>_53864,agonisante . Elle voyait dans sa pitoyable solitude l' image
Kundera-Milan_L-insoutenable-legerete-de-l-etre_<Tereza-2171>_53870,pitoyable solitude l' image de son propre sort et se
Kundera-Milan_L-insoutenable-legerete-de-l-etre_<Tereza-2171>_53874,de son propre sort et se répétait : « Je
Kundera-Milan_L-insoutenable-legerete-de-l-etre_<Tereza-2171>_53878,et se répétait : « Je n' ai personne au
Kundera-Milan_L-insoutenable-legerete-de-l-etre_<Tereza-2171>_53897,L' épisode de l' ingénieur lui avait - il appris
Kundera-Milan_L-insoutenable-legerete-de-l-etre_<Tereza-2171>_53925,ne pèsent rien ? Était - elle plus calme ?
Kundera-Milan_L-insoutenable-legerete-de-l-etre_<Tereza-2171>_53934,? Nullement . Une scène la hantait : elle vient
Kundera-Milan_L-insoutenable-legerete-de-l-etre_<Tereza-2171>_53937,Une scène la hantait : elle vient de sortir des
Kundera-Milan_L-insoutenable-legerete-de-l-etre_<Tereza-2171>_53944,de sortir des waters et son corps est cloué dans
Kundera-Milan_L-insoutenable-legerete-de-l-etre_<Tereza-2171>_53963,", épouvantée , tremble dans ses entrailles . À ce"
Kundera-Milan_L-insoutenable-legerete-de-l-etre_<Tereza-2171>_53986,", s' était adressé à son âme , peut -"
Kundera-Milan_L-insoutenable-legerete-de-l-etre_<Tereza-2171>_53993,", peut - être aurait - elle éclaté en sanglots"
Kundera-Milan_L-insoutenable-legerete-de-l-etre_<Tereza-2171>_54003,", peut - être serait - elle tombée dans ses"
Kundera-Milan_L-insoutenable-legerete-de-l-etre_<Tereza-2171>_54007,serait - elle tombée dans ses bras . Elle imaginait
Kundera-Milan_L-insoutenable-legerete-de-l-etre_<Tereza-2171>_54010,tombée dans ses bras . Elle imaginait qu' une amie
Kundera-Milan_L-insoutenable-legerete-de-l-etre_<Tereza-2171>_54021,Tomas se fût trouvée à sa place dans l' entrée
Kundera-Milan_L-insoutenable-legerete-de-l-etre_<Tereza-2171>_54049,"dit qu' un mot à la jeune femme , rien"
Kundera-Milan_L-insoutenable-legerete-de-l-etre_<Tereza-2171>_54059,"qu' un mot , et elle l' aurait enlacé en"
Kundera-Milan_L-insoutenable-legerete-de-l-etre_<Tereza-2171>_54073,"à cela que ressemble , Tereza le sait , l'"
Kundera-Milan_L-insoutenable-legerete-de-l-etre_<Tereza-2171>_54084,où naît l' amour : la femme ne résiste pas
Kundera-Milan_L-insoutenable-legerete-de-l-etre_<Tereza-2171>_54094,à la voix qui appelle son âme épouvantée ; l'
Kundera-Milan_L-insoutenable-legerete-de-l-etre_<Tereza-2171>_54104,homme ne résiste pas à la femme dont l' âme
Kundera-Milan_L-insoutenable-legerete-de-l-etre_<Tereza-2171>_54106,résiste pas à la femme dont l' âme devient attentive
Kundera-Milan_L-insoutenable-legerete-de-l-etre_<Tereza-2171>_54112,l' âme devient attentive à sa voix . Tomas n'
Kundera-Milan_L-insoutenable-legerete-de-l-etre_<Tereza-2171>_54128,piège de l' amour et Tereza ne peut que trembler
Kundera-Milan_L-insoutenable-legerete-de-l-etre_<Tereza-2171>_54146,minute . Quelle arme peut - elle avoir ? Rien
Kundera-Milan_L-insoutenable-legerete-de-l-etre_<Tereza-2171>_54152,elle avoir ? Rien que sa fidélité . Sa fidélité
Kundera-Milan_L-insoutenable-legerete-de-l-etre_<Tereza-2171>_54155,Rien que sa fidélité . Sa fidélité qu' elle lui
Kundera-Milan_L-insoutenable-legerete-de-l-etre_<Tereza-2171>_54158,fidélité . Sa fidélité qu' elle lui a offerte dès
Kundera-Milan_L-insoutenable-legerete-de-l-etre_<Tereza-2171>_54173,"premier jour , comme si elle avait tout de suite"
Kundera-Milan_L-insoutenable-legerete-de-l-etre_<Tereza-2171>_54180,tout de suite su qu' elle n' avait rien d'
Kundera-Milan_L-insoutenable-legerete-de-l-etre_<Tereza-2171>_54208,absolue de la fidélité de Tereza comme un palais gigantesque
Kundera-Milan_L-insoutenable-legerete-de-l-etre_<Tereza-2171>_54240,"patte meurtrie , brisée . Tereza ne voulait pas la"
Kundera-Milan_L-insoutenable-legerete-de-l-etre_<Tereza-2171>_54259,d' une sœur mourante . Elle finit quand même par
Kundera-Milan_L-insoutenable-legerete-de-l-etre_<Tereza-2171>_54275,"à la hâte . Quand elle revint , la corneille"
Kundera-Milan_L-insoutenable-legerete-de-l-etre_<Tereza-2171>_54292,"année de leur liaison , Tereza criait pendant l' amour"
Kundera-Milan_L-insoutenable-legerete-de-l-etre_<Tereza-2171>_54318,"les sens . Ensuite , elle criait moins , mais"
Kundera-Milan_L-insoutenable-legerete-de-l-etre_<Tereza-2171>_54323,"elle criait moins , mais son âme était toujours aveuglée"
Kundera-Milan_L-insoutenable-legerete-de-l-etre_<Tereza-2171>_54333,par l' amour et ne voyait rien . Quand elle
Kundera-Milan_L-insoutenable-legerete-de-l-etre_<Tereza-2171>_54337,ne voyait rien . Quand elle avait couché avec l'
Kundera-Milan_L-insoutenable-legerete-de-l-etre_<Tereza-2171>_54344,"couché avec l' ingénieur , son âme , à cause"
Kundera-Milan_L-insoutenable-legerete-de-l-etre_<Tereza-2171>_54360,avait enfin vu clair . Elle était retournée au sauna
Kundera-Milan_L-insoutenable-legerete-de-l-etre_<Tereza-2171>_54366,était retournée au sauna et elle était de nouveau devant
Kundera-Milan_L-insoutenable-legerete-de-l-etre_<Tereza-2171>_54374,nouveau devant le miroir . Elle se regardait et revoyait
Kundera-Milan_L-insoutenable-legerete-de-l-etre_<Tereza-2171>_54378,. Elle se regardait et revoyait en pensée la scène
Kundera-Milan_L-insoutenable-legerete-de-l-etre_<Tereza-2171>_54389,amour chez l' ingénieur . Elle se rappelait cette scène
Kundera-Milan_L-insoutenable-legerete-de-l-etre_<Tereza-2171>_54397,"cette scène , mais pas son amant . À vrai"
Kundera-Milan_L-insoutenable-legerete-de-l-etre_<Tereza-2171>_54404,". À vrai dire , elle n' aurait même pas"
Kundera-Milan_L-insoutenable-legerete-de-l-etre_<Tereza-2171>_54418,peut - être n' avait - elle même pas remarqué
Kundera-Milan_L-insoutenable-legerete-de-l-etre_<Tereza-2171>_54419,- être n' avait - elle même pas remarqué de
Kundera-Milan_L-insoutenable-legerete-de-l-etre_<Tereza-2171>_54435,nu . Tout ce dont elle se souvenait ( et
Kundera-Milan_L-insoutenable-legerete-de-l-etre_<Tereza-2171>_54442,souvenait ( et ce qu' elle regardait maintenant avec excitation
Kundera-Milan_L-insoutenable-legerete-de-l-etre_<Tereza-2171>_54453,le miroir ) c' était son propre corps ; sa
Kundera-Milan_L-insoutenable-legerete-de-l-etre_<Tereza-2171>_54457,était son propre corps ; sa toison et la tache
Kundera-Milan_L-insoutenable-legerete-de-l-etre_<Tereza-2171>_54478,avait été jusqu' ici pour elle qu' un simple défaut
Kundera-Milan_L-insoutenable-legerete-de-l-etre_<Tereza-2171>_54489,", s' était gravée dans sa mémoire . Elle voulait"
Kundera-Milan_L-insoutenable-legerete-de-l-etre_<Tereza-2171>_54492,gravée dans sa mémoire . Elle voulait la voir et
Kundera-Milan_L-insoutenable-legerete-de-l-etre_<Tereza-2171>_54494,sa mémoire . Elle voulait la voir et la revoir
Kundera-Milan_L-insoutenable-legerete-de-l-etre_<Tereza-2171>_54497,Elle voulait la voir et la revoir dans l' incroyable
Kundera-Milan_L-insoutenable-legerete-de-l-etre_<Tereza-2171>_54519,souligner encore une fois : elle n' avait pas envie
Kundera-Milan_L-insoutenable-legerete-de-l-etre_<Tereza-2171>_54532,sexe de l' inconnu . Elle voulait voir son propre
Kundera-Milan_L-insoutenable-legerete-de-l-etre_<Tereza-2171>_54535,inconnu . Elle voulait voir son propre pubis à proximité
Kundera-Milan_L-insoutenable-legerete-de-l-etre_<Tereza-2171>_54544,proximité du membre étranger . Elle ne désirait pas le
Kundera-Milan_L-insoutenable-legerete-de-l-etre_<Tereza-2171>_54554,corps de l' amant . Elle désirait son propre corps
Kundera-Milan_L-insoutenable-legerete-de-l-etre_<Tereza-2171>_54556,"l' amant . Elle désirait son propre corps , soudain"
Kundera-Milan_L-insoutenable-legerete-de-l-etre_<Tereza-2171>_54576,proche et plus étranger . Elle regarde son corps couvert
Kundera-Milan_L-insoutenable-legerete-de-l-etre_<Tereza-2171>_54578,plus étranger . Elle regarde son corps couvert des fines
Kundera-Milan_L-insoutenable-legerete-de-l-etre_<Tereza-2171>_54588,gouttelettes de la douche et songe que l' ingénieur va
Kundera-Milan_L-insoutenable-legerete-de-l-etre_<Tereza-2171>_54603,jour à l' autre . Elle a envie qu' il
Kundera-Milan_L-insoutenable-legerete-de-l-etre_<Tereza-2171>_54612,"il vienne , qu' il l' invite ! Elle en"
Kundera-Milan_L-insoutenable-legerete-de-l-etre_<Tereza-2171>_54615,qu' il l' invite ! Elle en a infiniment envie
Kundera-Milan_L-insoutenable-legerete-de-l-etre_<Tereza-2171>_54626,"23 Jour après jour , elle craignait de voir l'"
Kundera-Milan_L-insoutenable-legerete-de-l-etre_<Tereza-2171>_54687,"signe de vie . Pour Tereza , c' était inexplicable"
Kundera-Milan_L-insoutenable-legerete-de-l-etre_<Tereza-2171>_54695,"était inexplicable . Soudain , elle n' éprouvait plus aucun"
Kundera-Milan_L-insoutenable-legerete-de-l-etre_<Tereza-2171>_54702,éprouvait plus aucun désir . Elle était inquiète : pourquoi
Kundera-Milan_L-insoutenable-legerete-de-l-etre_<Tereza-2171>_54713,venait - il pas ? Elle servait des clients .
Kundera-Milan_L-insoutenable-legerete-de-l-etre_<Tereza-2171>_54728,"était revenu , celui qui lui avait reproché l' autre"
Kundera-Milan_L-insoutenable-legerete-de-l-etre_<Tereza-2171>_54756,"sale , la même qu' elle avait entendue des centaines"
Kundera-Milan_L-insoutenable-legerete-de-l-etre_<Tereza-2171>_54769,la bouche des ivrognes auxquels elle servait des demis en
Kundera-Milan_L-insoutenable-legerete-de-l-etre_<Tereza-2171>_54785,"assaillie par l' univers de sa mère , elle interrompit"
Kundera-Milan_L-insoutenable-legerete-de-l-etre_<Tereza-2171>_54788,"univers de sa mère , elle interrompit très brutalement le"
Kundera-Milan_L-insoutenable-legerete-de-l-etre_<Tereza-2171>_54807,avez pas d' ordres à me donner ! Estimez -
Kundera-Milan_L-insoutenable-legerete-de-l-etre_<Tereza-2171>_54811,à me donner ! Estimez - vous heureuse que nous
Kundera-Milan_L-insoutenable-legerete-de-l-etre_<Tereza-2171>_54816,- vous heureuse que nous vous laissions travailler dans ce
Kundera-Milan_L-insoutenable-legerete-de-l-etre_<Tereza-2171>_54846,une autre vodka . Et rappelez - vous que je
Kundera-Milan_L-insoutenable-legerete-de-l-etre_<Tereza-2171>_54847,autre vodka . Et rappelez - vous que je ne
Kundera-Milan_L-insoutenable-legerete-de-l-etre_<Tereza-2171>_54850,Et rappelez - vous que je ne vais pas me
Kundera-Milan_L-insoutenable-legerete-de-l-etre_<Tereza-2171>_54867,", montrant le cou de Tereza qui portait plusieurs rangées"
Kundera-Milan_L-insoutenable-legerete-de-l-etre_<Tereza-2171>_54868,montrant le cou de Tereza qui portait plusieurs rangées de
Kundera-Milan_L-insoutenable-legerete-de-l-etre_<Tereza-2171>_54883,"D' où elles viennent , vos perles ? Ce n'"
Kundera-Milan_L-insoutenable-legerete-de-l-etre_<Tereza-2171>_54894,sûrement pas un cadeau de votre mari qui est laveur
Kundera-Milan_L-insoutenable-legerete-de-l-etre_<Tereza-2171>_54909,est pas lui qui peut vous payer des perles avec
Kundera-Milan_L-insoutenable-legerete-de-l-etre_<Tereza-2171>_54924,C' est les clients qui vous donnent ça ? En
Kundera-Milan_L-insoutenable-legerete-de-l-etre_<Tereza-2171>_54948,suite ! » s' écria Tereza . L' homme tenta
Kundera-Milan_L-insoutenable-legerete-de-l-etre_<Tereza-2171>_54974,"interdite chez nous ! » Karénine se dressa , appuya"
Kundera-Milan_L-insoutenable-legerete-de-l-etre_<Tereza-2171>_54978,"» Karénine se dressa , appuya ses pattes de devant"
Kundera-Milan_L-insoutenable-legerete-de-l-etre_<Tereza-2171>_54979,"Karénine se dressa , appuya ses pattes de devant sur"
Kundera-Milan_L-insoutenable-legerete-de-l-etre_<Tereza-2171>_54987,devant sur la table et grogna . 24 L' ambassadeur
Kundera-Milan_L-insoutenable-legerete-de-l-etre_<Tereza-2171>_55015,"plus discret , fit observer Tereza . À quoi sert"
Kundera-Milan_L-insoutenable-legerete-de-l-etre_<Tereza-2171>_55073,"sorte de consécration . « Madame Tereza , dit -"
Kundera-Milan_L-insoutenable-legerete-de-l-etre_<Tereza-2171>_55140,C' est ce que cherchait votre pelé . « La
Kundera-Milan_L-insoutenable-legerete-de-l-etre_<Tereza-2171>_55218,pour en témoigner . » Tereza se souvint de l'
Kundera-Milan_L-insoutenable-legerete-de-l-etre_<Tereza-2171>_55286,organisation d' indicateurs . » Tereza ne pensait plus qu'
Kundera-Milan_L-insoutenable-legerete-de-l-etre_<Tereza-2171>_55298,"chose , que l' ingénieur lui avait été envoyé par"
Kundera-Milan_L-insoutenable-legerete-de-l-etre_<Tereza-2171>_55326,en face et était revenu lui faire des déclarations !
Kundera-Milan_L-insoutenable-legerete-de-l-etre_<Tereza-2171>_55342,jeune homme que le flic l' avait prise à parti
Kundera-Milan_L-insoutenable-legerete-de-l-etre_<Tereza-2171>_55351,"parti , et l' ingénieur l' avait défendue . Tous"
Kundera-Milan_L-insoutenable-legerete-de-l-etre_<Tereza-2171>_55375,; il s' agissait de lui rendre sympathique l' homme
Kundera-Milan_L-insoutenable-legerete-de-l-etre_<Tereza-2171>_55385,qui avait pour tâche de la séduire . Comment n'
Kundera-Milan_L-insoutenable-legerete-de-l-etre_<Tereza-2171>_55392,. Comment n' y avait - elle pas pensé ?
Kundera-Milan_L-insoutenable-legerete-de-l-etre_<Tereza-2171>_55495,"sous les verrous . Quand elle avait dix ans ,"
Kundera-Milan_L-insoutenable-legerete-de-l-etre_<Tereza-2171>_55503,"ans , ils avaient arrêté son père et ils avaient"
Kundera-Milan_L-insoutenable-legerete-de-l-etre_<Tereza-2171>_55531,"après ça ? Maintenant , elle voyait clairement pourquoi il"
Kundera-Milan_L-insoutenable-legerete-de-l-etre_<Tereza-2171>_55556,éméché l' avait révélé à son insu quand il avait
Kundera-Milan_L-insoutenable-legerete-de-l-etre_<Tereza-2171>_55588,qu' il avait couché avec elle et qu' elle lui
Kundera-Milan_L-insoutenable-legerete-de-l-etre_<Tereza-2171>_55591,couché avec elle et qu' elle lui avait réclamé de
Kundera-Milan_L-insoutenable-legerete-de-l-etre_<Tereza-2171>_55592,avec elle et qu' elle lui avait réclamé de l'
Kundera-Milan_L-insoutenable-legerete-de-l-etre_<Tereza-2171>_55600,de l' argent ! Il la menacerait de scandale et
Kundera-Milan_L-insoutenable-legerete-de-l-etre_<Tereza-2171>_55605,la menacerait de scandale et la ferait chanter pour qu'
Kundera-Milan_L-insoutenable-legerete-de-l-etre_<Tereza-2171>_55610,la ferait chanter pour qu' elle dénonce les gens qui
Kundera-Milan_L-insoutenable-legerete-de-l-etre_<Tereza-2171>_55625,. L' ambassadeur tentait de la tranquilliser : « Votre
Kundera-Milan_L-insoutenable-legerete-de-l-etre_<Tereza-2171>_55629,de la tranquilliser : « Votre mésaventure ne me paraît
Kundera-Milan_L-insoutenable-legerete-de-l-etre_<Tereza-2171>_55644,"se peut » , dit - elle d' une voix"
Kundera-Milan_L-insoutenable-legerete-de-l-etre_<Tereza-2171>_55652,"une voix étranglée , et elle sortit avec Karénine dans"
Kundera-Milan_L-insoutenable-legerete-de-l-etre_<Tereza-2171>_55655,", et elle sortit avec Karénine dans les rues noires"
Kundera-Milan_L-insoutenable-legerete-de-l-etre_<Tereza-2171>_55703,cessera d' exister . Mais Tereza ne voyait pas cette
Kundera-Milan_L-insoutenable-legerete-de-l-etre_<Tereza-2171>_55710,voyait pas cette ligne devant elle . Elle ne pouvait
Kundera-Milan_L-insoutenable-legerete-de-l-etre_<Tereza-2171>_55712,cette ligne devant elle . Elle ne pouvait trouver la
Kundera-Milan_L-insoutenable-legerete-de-l-etre_<Tereza-2171>_55746,"Tomas était au volant , Tereza à côté de lui"
Kundera-Milan_L-insoutenable-legerete-de-l-etre_<Tereza-2171>_55752,à côté de lui et Karénine sur la banquette arrière
Kundera-Milan_L-insoutenable-legerete-de-l-etre_<Tereza-4424>_105323,côte sur deux sièges et Tereza posa la tête sur
Kundera-Milan_L-insoutenable-legerete-de-l-etre_<Tereza-4424>_105394,on sait . Tomas et Tereza savaient ce qui les
Kundera-Milan_L-insoutenable-legerete-de-l-etre_<Tereza-4424>_105437,. À l' instant où elle avait lu la lettre
Kundera-Milan_L-insoutenable-legerete-de-l-etre_<Tereza-4424>_105443,"avait lu la lettre , Tereza n' avait pas éprouvé"
Kundera-Milan_L-insoutenable-legerete-de-l-etre_<Tereza-4424>_105453,"d' amour pour Tomas , elle avait seulement pensé qu'"
Kundera-Milan_L-insoutenable-legerete-de-l-etre_<Tereza-4424>_105458,elle avait seulement pensé qu' elle ne devait pas le
Kundera-Milan_L-insoutenable-legerete-de-l-etre_<Tereza-4424>_105482,autres sensations . Maintenant qu' elle était serrée contre lui
Kundera-Milan_L-insoutenable-legerete-de-l-etre_<Tereza-4424>_105501,l' effroi était passé et elle sentait son amour et
Kundera-Milan_L-insoutenable-legerete-de-l-etre_<Tereza-4424>_105503,était passé et elle sentait son amour et savait que
Kundera-Milan_L-insoutenable-legerete-de-l-etre_<Tereza-4424>_105506,elle sentait son amour et savait que c' était un
Kundera-Milan_L-insoutenable-legerete-de-l-etre_<Tereza-4424>_105632,"pas de détonation , mais Tereza sentit que Tomas qui"
Kundera-Milan_L-insoutenable-legerete-de-l-etre_<Tereza-4424>_105647,"avant , se pressait contre elle et lui enlaçait la"
Kundera-Milan_L-insoutenable-legerete-de-l-etre_<Tereza-4424>_105649,"se pressait contre elle et lui enlaçait la taille ,"
Kundera-Milan_L-insoutenable-legerete-de-l-etre_<Tereza-4424>_105660,affaissait sur le sol . Elle voulut le serrer contre
Kundera-Milan_L-insoutenable-legerete-de-l-etre_<Tereza-4424>_105665,Elle voulut le serrer contre elle mais ne put le
Kundera-Milan_L-insoutenable-legerete-de-l-etre_<Tereza-4424>_105668,serrer contre elle mais ne put le retenir . Il
Kundera-Milan_L-insoutenable-legerete-de-l-etre_<Tereza-4424>_105683,la piste d' atterrissage . Elle se pencha . Elle
Kundera-Milan_L-insoutenable-legerete-de-l-etre_<Tereza-4424>_105687,. Elle se pencha . Elle voulait se jeter sur
Kundera-Milan_L-insoutenable-legerete-de-l-etre_<Tereza-4424>_105697,"lui pour le couvrir de son corps , mais il"
Kundera-Milan_L-insoutenable-legerete-de-l-etre_<Tereza-4424>_105709,alors une chose étrange : son corps se mit à
Kundera-Milan_L-insoutenable-legerete-de-l-etre_<Tereza-4424>_105716,"se mit à rapetisser sous ses yeux , très vite"
Kundera-Milan_L-insoutenable-legerete-de-l-etre_<Tereza-4424>_105727,C' était si incroyable qu' elle en était pétrifiée et
Kundera-Milan_L-insoutenable-legerete-de-l-etre_<Tereza-4424>_105733,en était pétrifiée et qu' elle restait clouée au sol
Kundera-Milan_L-insoutenable-legerete-de-l-etre_<Tereza-4424>_105805,d' un air affable à Tereza . Puis il se
Kundera-Milan_L-insoutenable-legerete-de-l-etre_<Tereza-4424>_105818,lança à la poursuite de cette chose minuscule qui courait
Kundera-Milan_L-insoutenable-legerete-de-l-etre_<Tereza-4424>_105821,poursuite de cette chose minuscule qui courait ici et là
Kundera-Milan_L-insoutenable-legerete-de-l-etre_<Tereza-4424>_105829,"et là , comme si elle voulait éviter quelqu' un"
Kundera-Milan_L-insoutenable-legerete-de-l-etre_<Tereza-4424>_105836,éviter quelqu' un et qu' elle cherchât désespérément un abri
Kundera-Milan_L-insoutenable-legerete-de-l-etre_<Tereza-4424>_105872,se leva et revint à Tereza . Il lui apportait
Kundera-Milan_L-insoutenable-legerete-de-l-etre_<Tereza-4424>_105875,revint à Tereza . Il lui apportait la chose dans
Kundera-Milan_L-insoutenable-legerete-de-l-etre_<Tereza-4424>_105877,Tereza . Il lui apportait la chose dans les mains
Kundera-Milan_L-insoutenable-legerete-de-l-etre_<Tereza-4424>_105883,chose dans les mains . La chose tremblait de peur
Kundera-Milan_L-insoutenable-legerete-de-l-etre_<Tereza-4424>_105889,chose tremblait de peur . C' était un lièvre .
Kundera-Milan_L-insoutenable-legerete-de-l-etre_<Tereza-4424>_105898,". Il le tendit à Tereza . Alors , l'"
Kundera-Milan_L-insoutenable-legerete-de-l-etre_<Tereza-4424>_105909,et la tristesse disparurent et elle fut heureuse de tenir
Kundera-Milan_L-insoutenable-legerete-de-l-etre_<Tereza-4424>_105918,"tenir ce petit animal entre ses bras , un petit"
Kundera-Milan_L-insoutenable-legerete-de-l-etre_<Tereza-4424>_105924,"bras , un petit animal qui était à elle et"
Kundera-Milan_L-insoutenable-legerete-de-l-etre_<Tereza-4424>_105927,petit animal qui était à elle et qu' elle pouvait
Kundera-Milan_L-insoutenable-legerete-de-l-etre_<Tereza-4424>_105930,était à elle et qu' elle pouvait serrer contre son
Kundera-Milan_L-insoutenable-legerete-de-l-etre_<Tereza-4424>_105934,qu' elle pouvait serrer contre son corps . De bonheur
