,text_surronding
Lemaitre-Pierre_Au-revoir-la-haut_<Dupré-5666>_150818,"signe d' assentiment , les rouvrit , puis se lança"
Lemaitre-Pierre_Au-revoir-la-haut_<Dupré-5666>_150822,"les rouvrit , puis se lança : – Ton père"
Lemaitre-Pierre_Au-revoir-la-haut_<Dupré-5666>_150830,"Ton père refuse toujours de m' aider , mais …"
Lemaitre-Pierre_Au-revoir-la-haut_<Dupré-5666>_150840,"– Oui , et si je le lui demandais à"
Lemaitre-Pierre_Au-revoir-la-haut_<Dupré-5666>_150851,", il refuserait encore . Henri gardait la main de"
Lemaitre-Pierre_Au-revoir-la-haut_<Dupré-5666>_150871,retombés sur leurs genoux . Il devait la convaincre .
Lemaitre-Pierre_Au-revoir-la-haut_<Dupré-5666>_150890,"Le vieux Péricourt avait voulu l' humilier , maintenant qu'"
Lemaitre-Pierre_Au-revoir-la-haut_<Dupré-5666>_150895,"l' humilier , maintenant qu' il y était parvenu ,"
Lemaitre-Pierre_Au-revoir-la-haut_<Dupré-5666>_150900,"il y était parvenu , il avait ( Henri chercha"
Lemaitre-Pierre_Au-revoir-la-haut_<Dupré-5666>_150903,"parvenu , il avait ( Henri chercha le mot )"
Lemaitre-Pierre_Au-revoir-la-haut_<Dupré-5666>_150928,"Car enfin , qu' avait - il à gagner à"
Lemaitre-Pierre_Au-revoir-la-haut_<Dupré-5666>_150934,il à gagner à voir son nom jeté dans le
Lemaitre-Pierre_Au-revoir-la-haut_<Dupré-5666>_150970,? On pouvait comprendre qu' il ne veuille pas courir
Lemaitre-Pierre_Au-revoir-la-haut_<Dupré-5666>_150978,"pas courir au secours de son gendre , mais ça"
Lemaitre-Pierre_Au-revoir-la-haut_<Dupré-5666>_150984,"gendre , mais ça ne lui coûterait pas grand -"
Lemaitre-Pierre_Au-revoir-la-haut_<Dupré-5666>_150994,"chose de faire plaisir à sa fille , non ?"
Lemaitre-Pierre_Au-revoir-la-haut_<Dupré-5666>_150999,"sa fille , non ? Il ne cessait de s'"
Lemaitre-Pierre_Au-revoir-la-haut_<Dupré-5666>_151018,dans des affaires qui ne le touchaient pas de si
Lemaitre-Pierre_Au-revoir-la-haut_<Dupré-5666>_151035,"C' est vrai . Mais Henri percevait bien , en"
Lemaitre-Pierre_Au-revoir-la-haut_<Dupré-5666>_151047,un fond de résistance . Il se pencha . –
Lemaitre-Pierre_Au-revoir-la-haut_<Dupré-5666>_151110,légèrement écartés . Et elle lui sourit . – Je
Lemaitre-Pierre_Au-revoir-la-haut_<Dupré-5666>_151129,"intervenir . En fait , Henri , je t' écoute"
Lemaitre-Pierre_Au-revoir-la-haut_<Dupré-5666>_151132,"fait , Henri , je t' écoute mais tout cela"
Lemaitre-Pierre_Au-revoir-la-haut_<Dupré-5666>_151144,"intéresse absolument pas . – Je comprends bien , consentit"
Lemaitre-Pierre_Au-revoir-la-haut_<Dupré-5666>_151149,"Je comprends bien , consentit Henri . D' ailleurs ,"
Lemaitre-Pierre_Au-revoir-la-haut_<Dupré-5666>_151154,"Henri . D' ailleurs , je ne te demande pas"
Lemaitre-Pierre_Au-revoir-la-haut_<Dupré-5666>_151164,"de t' y intéresser , je t … – Non"
Lemaitre-Pierre_Au-revoir-la-haut_<Dupré-5666>_151170,"t … – Non , Henri , tu ne comprends"
Lemaitre-Pierre_Au-revoir-la-haut_<Dupré-5666>_151172,"– Non , Henri , tu ne comprends pas ."
Lemaitre-Pierre_Au-revoir-la-haut_<Dupré-5666>_151181,. Ce ne sont pas tes affaires qui ne m'
Lemaitre-Pierre_Au-revoir-la-haut_<Dupré-5666>_151191,"intéressent pas , c' est toi . Elle avait dit"
Lemaitre-Pierre_Au-revoir-la-haut_<Dupré-5666>_151220,douche fut si froide qu' Henri douta d' avoir bien
Lemaitre-Pierre_Au-revoir-la-haut_<Dupré-5666>_151228,avoir bien entendu . – Je ne comprends pas …
Lemaitre-Pierre_Au-revoir-la-haut_<Dupré-5666>_151244,", je suis certaine que tu as parfaitement saisi ."
Lemaitre-Pierre_Au-revoir-la-haut_<Dupré-5666>_151255,n' est pas ce que tu fais qui m' indiffère
Lemaitre-Pierre_Au-revoir-la-haut_<Dupré-5666>_151265,", c' est ce que tu es . Il aurait"
Lemaitre-Pierre_Au-revoir-la-haut_<Dupré-5666>_151268,ce que tu es . Il aurait dû se lever
Lemaitre-Pierre_Au-revoir-la-haut_<Dupré-5666>_151284,mais le regard de Madeleine le retenait . Il n'
Lemaitre-Pierre_Au-revoir-la-haut_<Dupré-5666>_151287,de Madeleine le retenait . Il n' avait pas envie
Lemaitre-Pierre_Au-revoir-la-haut_<Dupré-5666>_151298,"en entendre plus , mais il était captif de la"
Lemaitre-Pierre_Au-revoir-la-haut_<Dupré-5666>_151329,"d' illusions sur ce que tu étais , expliqua Madeleine"
Lemaitre-Pierre_Au-revoir-la-haut_<Dupré-5666>_151374,parce que j��avais besoin de toi . Je t' ai
Lemaitre-Pierre_Au-revoir-la-haut_<Dupré-5666>_151377,besoin de toi . Je t' ai épousé parce que
Lemaitre-Pierre_Au-revoir-la-haut_<Dupré-5666>_151388,"avais l' âge , que tu me l' as proposé"
Lemaitre-Pierre_Au-revoir-la-haut_<Dupré-5666>_151413,"été aussi ridicule d' être ta femme , sans cesse"
Lemaitre-Pierre_Au-revoir-la-haut_<Dupré-5666>_151420,", sans cesse humiliée par tes aventures , j' aurais"
Lemaitre-Pierre_Au-revoir-la-haut_<Dupré-5666>_151434,ainsi . Tant pis . Henri s' était levé .
Lemaitre-Pierre_Au-revoir-la-haut_<Dupré-5666>_151442,"levé . Cette fois , il ne se drapa pas"
Lemaitre-Pierre_Au-revoir-la-haut_<Dupré-5666>_151454,"honneur de circonstance , ne chercha pas à argumenter ,"
Lemaitre-Pierre_Au-revoir-la-haut_<Dupré-5666>_151483,définitif . – Ce qui t' a sauvé jusqu' ici
Lemaitre-Pierre_Au-revoir-la-haut_<Dupré-5666>_151492,"ici , c' est que tu es très beau ,"
Lemaitre-Pierre_Au-revoir-la-haut_<Dupré-5666>_151547,– Je suis certaine que tu m' as fait un
Lemaitre-Pierre_Au-revoir-la-haut_<Dupré-5666>_151563,ai jamais espéré plus de ta part . Maintenant qu'
Lemaitre-Pierre_Au-revoir-la-haut_<Dupré-5666>_151585,"un son mat ) , tu peux devenir ce que"
Lemaitre-Pierre_Au-revoir-la-haut_<Dupré-5666>_151590,"tu peux devenir ce que tu veux , et même"
Lemaitre-Pierre_Au-revoir-la-haut_<Dupré-5666>_151626,"ai ma consolation . Pour toi , si j' en"
Lemaitre-Pierre_Au-revoir-la-haut_<Dupré-5666>_151650,heure d' une catastrophe dont tu ne te relèveras pas
Lemaitre-Pierre_Au-revoir-la-haut_<Dupré-5666>_151718,". Prenant le couloir , il vit apparaître des images"
Lemaitre-Pierre_Au-revoir-la-haut_<Dupré-5666>_151728,de la Sallevière telle qu' il l' avait vue quelques
Lemaitre-Pierre_Au-revoir-la-haut_<Dupré-5666>_151793,"survenus en quelques heures , Henri faisait des efforts désespérés"
Lemaitre-Pierre_Au-revoir-la-haut_<Dupré-5666>_151806,"à ce cataclysme , mais il n' y arrivait pas"
Lemaitre-Pierre_Au-revoir-la-haut_<Dupré-5666>_151831,"ainsi , aussi vite qu' il l' avait gagné ,"
Lemaitre-Pierre_Au-revoir-la-haut_<Dupré-5666>_151836,"il l' avait gagné , il ne parvenait pas à"
Lemaitre-Pierre_Au-revoir-la-haut_<Dupré-5666>_151844,pas à le concevoir . Il y parvint enfin par
Lemaitre-Pierre_Au-revoir-la-haut_<Dupré-5666>_151861,"voix haute , alors qu' il était seul dans le"
Lemaitre-Pierre_Au-revoir-la-haut_<Dupré-5666>_151869,dans le couloir : – Je suis mort . Avec
Lemaitre-Pierre_Au-revoir-la-haut_<Dupré-5666>_151896,- seize mille francs . Albert fit un rapide calcul
Lemaitre-Pierre_Au-revoir-la-haut_<Dupré-5666>_151982,"Depuis la fin juin , Albert ne vivait plus dans"
Lemaitre-Pierre_Au-revoir-la-haut_<Dupré-5666>_151987,Albert ne vivait plus dans sa propre peau . Le
Lemaitre-Pierre_Au-revoir-la-haut_<Dupré-5666>_152011,"d' une position allemande , il se rendait au travail"
Lemaitre-Pierre_Au-revoir-la-haut_<Dupré-5666>_152024,proche de l' implosion ; il n' aurait pas été
Lemaitre-Pierre_Au-revoir-la-haut_<Dupré-5666>_152049,la nuit un échafaud pour le guillotiner sans procès devant
Lemaitre-Pierre_Au-revoir-la-haut_<Dupré-5666>_152071,". Toute la journée , il évoluait dans une torpeur"
Lemaitre-Pierre_Au-revoir-la-haut_<Dupré-5666>_152080,"torpeur brumeuse , les voix lui parvenaient avec un énorme"
Lemaitre-Pierre_Au-revoir-la-haut_<Dupré-5666>_152089,"énorme retard ; quand on lui parlait , il fallait"
Lemaitre-Pierre_Au-revoir-la-haut_<Dupré-5666>_152095,"parlait , il fallait traverser son mur d' angoisse ."
Lemaitre-Pierre_Au-revoir-la-haut_<Dupré-5666>_152100,son mur d' angoisse . Albert vous regardait comme si
Lemaitre-Pierre_Au-revoir-la-haut_<Dupré-5666>_152106,vous regardait comme si vous l' aviez percuté avec le
Lemaitre-Pierre_Au-revoir-la-haut_<Dupré-5666>_152126,"quoi ? » étaient toujours ses premiers mots , on"
Lemaitre-Pierre_Au-revoir-la-haut_<Dupré-5666>_152138,"faisait plus attention , on le connaissait . Dans le"
Lemaitre-Pierre_Au-revoir-la-haut_<Dupré-5666>_152148,"cours de la matinée , il déposait sur le compte"
Lemaitre-Pierre_Au-revoir-la-haut_<Dupré-5666>_152168,"de la vapeur bouillonnante qui lui noyait le cerveau ,"
Lemaitre-Pierre_Au-revoir-la-haut_<Dupré-5666>_152173,"lui noyait le cerveau , il tentait d' extraire le"
Lemaitre-Pierre_Au-revoir-la-haut_<Dupré-5666>_152182,le montant de ce qu' il allait prélever en espèces
Lemaitre-Pierre_Au-revoir-la-haut_<Dupré-5666>_152205,"la pause de midi , il profitait de chaque passage"
Lemaitre-Pierre_Au-revoir-la-haut_<Dupré-5666>_152215,à un guichet pour effectuer ses débits en signant d'
Lemaitre-Pierre_Au-revoir-la-haut_<Dupré-5666>_152254,"à mesure des prélèvements , il fourrait les billets dans"
Lemaitre-Pierre_Au-revoir-la-haut_<Dupré-5666>_152259,il fourrait les billets dans sa sacoche qui enflait jusqu'
Lemaitre-Pierre_Au-revoir-la-haut_<Dupré-5666>_152309,"collègue , ou parce qu' il avait cru percevoir de"
Lemaitre-Pierre_Au-revoir-la-haut_<Dupré-5666>_152323,"regard d' un client , il avait commencé à pisser"
Lemaitre-Pierre_Au-revoir-la-haut_<Dupré-5666>_152329,avait commencé à pisser dans son pantalon et avait dû
Lemaitre-Pierre_Au-revoir-la-haut_<Dupré-5666>_152332,pisser dans son pantalon et avait dû héler un taxi
Lemaitre-Pierre_Au-revoir-la-haut_<Dupré-5666>_152347,". Les autres fois , il passait la tête sur"
Lemaitre-Pierre_Au-revoir-la-haut_<Dupré-5666>_152376,"dressé dans la journée devant sa station de métro ,"
Lemaitre-Pierre_Au-revoir-la-haut_<Dupré-5666>_152387,"- on jamais . Dans son cartable , qui servait"
Lemaitre-Pierre_Au-revoir-la-haut_<Dupré-5666>_152402,"à transporter leur déjeuner , Albert rapportait ce soir -"
Lemaitre-Pierre_Au-revoir-la-haut_<Dupré-5666>_152494,"onze mille francs . Pour Albert , c' était joli"
Lemaitre-Pierre_Au-revoir-la-haut_<Dupré-5666>_152527,", c' était , pour Albert , un jour de"
Lemaitre-Pierre_Au-revoir-la-haut_<Dupré-5666>_152541,"le samedi 10 juillet , il avait sollicité de sa"
Lemaitre-Pierre_Au-revoir-la-haut_<Dupré-5666>_152545,", il avait sollicité de sa direction un congé exceptionnel"
Lemaitre-Pierre_Au-revoir-la-haut_<Dupré-5666>_152577,", le 15 juillet , il serait normalement sur le"
Lemaitre-Pierre_Au-revoir-la-haut_<Dupré-5666>_152593,ce jour - là était son dernier à la banque
Lemaitre-Pierre_Au-revoir-la-haut_<Dupré-5666>_152612,sortir vivant de cette aventure le laissait pantois . Un
Lemaitre-Pierre_Au-revoir-la-haut_<Dupré-5666>_152619,pantois . Un autre que lui se serait cru immortel
Lemaitre-Pierre_Au-revoir-la-haut_<Dupré-5666>_152626,serait cru immortel . Mais Albert n' arrivait pas à
Lemaitre-Pierre_Au-revoir-la-haut_<Dupré-5666>_152650,"colonies avait beau approcher , il n' y croyait pas"
Lemaitre-Pierre_Au-revoir-la-haut_<Dupré-5666>_152681,"Oui , bonsoir … Puisqu' il était encore vivant et"
Lemaitre-Pierre_Au-revoir-la-haut_<Dupré-5666>_152696,"atteint et même dépassé , Albert se demandait s' il"
Lemaitre-Pierre_Au-revoir-la-haut_<Dupré-5666>_152700,", Albert se demandait s' il ne serait pas judicieux"
Lemaitre-Pierre_Au-revoir-la-haut_<Dupré-5666>_152726,"Mais sur cette question , il était plus déchiré que"
Lemaitre-Pierre_Au-revoir-la-haut_<Dupré-5666>_152758,"Pauline ? Cent fois , il avait essayé de lui"
Lemaitre-Pierre_Au-revoir-la-haut_<Dupré-5666>_152768,"parler , autant de fois il avait renoncé . Pauline"
Lemaitre-Pierre_Au-revoir-la-haut_<Dupré-5666>_152837,"n' avait tenu qu' à lui , une petite vie"
Lemaitre-Pierre_Au-revoir-la-haut_<Dupré-5666>_152853,", quatre pourquoi pas , Albert aurait été d' accord"
Lemaitre-Pierre_Au-revoir-la-haut_<Dupré-5666>_152859,"aurait été d' accord , il aurait même bien aimé"
Lemaitre-Pierre_Au-revoir-la-haut_<Dupré-5666>_152865,aurait même bien aimé garder son emploi à la banque
Lemaitre-Pierre_Au-revoir-la-haut_<Dupré-5666>_152874,banque . Mais maintenant qu' il était un escroc patenté
Lemaitre-Pierre_Au-revoir-la-haut_<Dupré-5666>_152876,"Mais maintenant qu' il était un escroc patenté , et"
Lemaitre-Pierre_Au-revoir-la-haut_<Dupré-5666>_152930,"la décider à partir avec lui , dans trois jours"
Lemaitre-Pierre_Au-revoir-la-haut_<Dupré-5666>_152983,"Quant à demander conseil à Édouard , c' était parler"
Lemaitre-Pierre_Au-revoir-la-haut_<Dupré-5666>_152996,". Finalement , même s' il l' aimait infiniment ,"
Lemaitre-Pierre_Au-revoir-la-haut_<Dupré-5666>_152997,"Finalement , même s' il l' aimait infiniment , et"
Lemaitre-Pierre_Au-revoir-la-haut_<Dupré-5666>_153010,"de raisons très contradictoires , Albert trouvait Édouard assez égoïste"
Lemaitre-Pierre_Au-revoir-la-haut_<Dupré-5666>_153012,"très contradictoires , Albert trouvait Édouard assez égoïste . Il"
Lemaitre-Pierre_Au-revoir-la-haut_<Dupré-5666>_153016,trouvait Édouard assez égoïste . Il passait le voir tous
Lemaitre-Pierre_Au-revoir-la-haut_<Dupré-5666>_153018,assez égoïste . Il passait le voir tous les deux
Lemaitre-Pierre_Au-revoir-la-haut_<Dupré-5666>_153049,"Pers étant maintenant déserté , Albert n' avait pas jugé"
Lemaitre-Pierre_Au-revoir-la-haut_<Dupré-5666>_153066,laquelle leur avenir reposait . Il avait cherché une solution
Lemaitre-Pierre_Au-revoir-la-haut_<Dupré-5666>_153072,"avait cherché une solution , il aurait pu louer un"
Lemaitre-Pierre_Au-revoir-la-haut_<Dupré-5666>_153083,"dans une banque , mais il n' avait pas confiance"
Lemaitre-Pierre_Au-revoir-la-haut_<Dupré-5666>_153089,"n' avait pas confiance , il avait préféré la consigne"
Lemaitre-Pierre_Au-revoir-la-haut_<Dupré-5666>_153103,"- Lazare . Chaque soir il retirait sa valise ,"
Lemaitre-Pierre_Au-revoir-la-haut_<Dupré-5666>_153105,". Chaque soir il retirait sa valise , s' installait"
Lemaitre-Pierre_Au-revoir-la-haut_<Dupré-5666>_153108,"il retirait sa valise , s' installait dans les toilettes"
Lemaitre-Pierre_Au-revoir-la-haut_<Dupré-5666>_153125,"de la journée , puis il la rendait à l'"
Lemaitre-Pierre_Au-revoir-la-haut_<Dupré-5666>_153132,rendait à l' employé . Il passait pour un représentant
Lemaitre-Pierre_Au-revoir-la-haut_<Dupré-5666>_153146,"gaines et corsets , avait - il déclaré , il"
Lemaitre-Pierre_Au-revoir-la-haut_<Dupré-5666>_153150,"avait - il déclaré , il n' avait pas trouvé"
Lemaitre-Pierre_Au-revoir-la-haut_<Dupré-5666>_153160,autre chose . Les employés lui adressaient des œillades complices
Lemaitre-Pierre_Au-revoir-la-haut_<Dupré-5666>_153166,adressaient des œillades complices auxquelles il répondait par un petit
Lemaitre-Pierre_Au-revoir-la-haut_<Dupré-5666>_153179,", évidemment , accroissait encore sa réputation . Pour le"
Lemaitre-Pierre_Au-revoir-la-haut_<Dupré-5666>_153194,"détaler à toute vitesse , Albert avait également déposé un"
Lemaitre-Pierre_Au-revoir-la-haut_<Dupré-5666>_153217,"dessinée par Édouard , dont il n' avait jamais réparé"
Lemaitre-Pierre_Au-revoir-la-haut_<Dupré-5666>_153245,"cheval . Obligé de partir précipitamment , il savait qu'"
Lemaitre-Pierre_Au-revoir-la-haut_<Dupré-5666>_153247,"Obligé de partir précipitamment , il savait qu' il laisserait"
Lemaitre-Pierre_Au-revoir-la-haut_<Dupré-5666>_153250,"précipitamment , il savait qu' il laisserait plutôt la valise"
Lemaitre-Pierre_Au-revoir-la-haut_<Dupré-5666>_153275,"d' aller retrouver Pauline , Albert se rendait au Lutetia"
Lemaitre-Pierre_Au-revoir-la-haut_<Dupré-5666>_153283,"au Lutetia , ce qui le mettait dans un état"
Lemaitre-Pierre_Au-revoir-la-haut_<Dupré-5666>_153360,cheveux sur la tête . Albert avait d' abord compté
Lemaitre-Pierre_Au-revoir-la-haut_<M . Péricourt-3283>_87316,"café , aux alcools . M . Péricourt le fixait"
Lemaitre-Pierre_Au-revoir-la-haut_<M . Péricourt-3283>_87430,avoir fini son service . M . Péricourt se souvint
Lemaitre-Pierre_Au-revoir-la-haut_<M . Péricourt-3283>_87439,souvint alors des chaussures qu' il avait aperçues tout à
Lemaitre-Pierre_Au-revoir-la-haut_<M . Péricourt-3283>_87447,tout à l' heure . Il baissa les yeux vers
Lemaitre-Pierre_Au-revoir-la-haut_<M . Péricourt-3283>_87457,"le sol , tandis que son hôte enfilait sa vareuse"
Lemaitre-Pierre_Au-revoir-la-haut_<M . Péricourt-3283>_87460,tandis que son hôte enfilait sa vareuse reteinte . Madeleine
Lemaitre-Pierre_Au-revoir-la-haut_<M . Péricourt-3283>_87488,"brillantes , bon marché . M . Péricourt était pensif"
Lemaitre-Pierre_Au-revoir-la-haut_<M . Péricourt-3283>_87496,"était pensif . – Dites - moi , monsieur Maillard"
Lemaitre-Pierre_Au-revoir-la-haut_<M . Péricourt-3283>_87507,"vous êtes comptable , avez - vous dit … –"
Lemaitre-Pierre_Au-revoir-la-haut_<M . Péricourt-3283>_87517,Oui . Voilà ce qu' il aurait dû mieux observer
Lemaitre-Pierre_Au-revoir-la-haut_<M . Péricourt-3283>_87550,"– Eh bien , reprit - il , il se"
Lemaitre-Pierre_Au-revoir-la-haut_<M . Péricourt-3283>_87571,"est en plein essor , vous le savez , le"
Lemaitre-Pierre_Au-revoir-la-haut_<M . Péricourt-3283>_87593,"beaucoup d' opportunités . Pour Albert , c' était dommage"
Lemaitre-Pierre_Au-revoir-la-haut_<M . Péricourt-3283>_87616,de l' Union parisienne qui l' avait foutu à la
Lemaitre-Pierre_Au-revoir-la-haut_<M . Péricourt-3283>_87628,mois plus tôt . – Je ne connais pas vos
Lemaitre-Pierre_Au-revoir-la-haut_<M . Péricourt-3283>_87632,"– Je ne connais pas vos émoluments , poursuivit M"
Lemaitre-Pierre_Au-revoir-la-haut_<M . Péricourt-3283>_87636,"pas vos émoluments , poursuivit M . Péricourt , et"
Lemaitre-Pierre_Au-revoir-la-haut_<M . Péricourt-3283>_87650,important . Sachez que si vous acceptez un poste chez
Lemaitre-Pierre_Au-revoir-la-haut_<M . Péricourt-3283>_87660,"nous , les meilleures conditions vous seront proposées , je"
Lemaitre-Pierre_Au-revoir-la-haut_<M . Péricourt-3283>_87664,"conditions vous seront proposées , je m' y engage personnellement"
Lemaitre-Pierre_Au-revoir-la-haut_<M . Péricourt-3283>_87670,m' y engage personnellement . Albert serra les lèvres .
Lemaitre-Pierre_Au-revoir-la-haut_<M . Péricourt-3283>_87675,Albert serra les lèvres . Il était bombardé par les
Lemaitre-Pierre_Au-revoir-la-haut_<M . Péricourt-3283>_87687,asphyxié par la proposition . M . Péricourt le fixait
Lemaitre-Pierre_Au-revoir-la-haut_<M . Péricourt-3283>_87690,proposition . M . Péricourt le fixait avec bienveillance .
Lemaitre-Pierre_Au-revoir-la-haut_<M . Péricourt-3283>_87698,"bienveillance . À côté de lui , Madeleine souriait gentiment"
Lemaitre-Pierre_Au-revoir-la-haut_<M . Péricourt-3283>_87724,"est que … , balbutia Albert . – Nous avons"
Lemaitre-Pierre_Au-revoir-la-haut_<M . Péricourt-3283>_87742,Ces qualificatifs achevèrent d' effrayer Albert . M . Péricourt
Lemaitre-Pierre_Au-revoir-la-haut_<M . Péricourt-3283>_87744,achevèrent d' effrayer Albert . M . Péricourt lui parlait
Lemaitre-Pierre_Au-revoir-la-haut_<M . Péricourt-3283>_87747,Albert . M . Péricourt lui parlait comme s' il
Lemaitre-Pierre_Au-revoir-la-haut_<M . Péricourt-3283>_87751,Péricourt lui parlait comme s' il avait fait les Hautes
Lemaitre-Pierre_Au-revoir-la-haut_<M . Péricourt-3283>_87769,"y avait visiblement erreur sur la personne , Albert sentait"
Lemaitre-Pierre_Au-revoir-la-haut_<M . Péricourt-3283>_87772,"erreur sur la personne , Albert sentait que sortir vivant"
Lemaitre-Pierre_Au-revoir-la-haut_<M . Péricourt-3283>_87814,"… – Merci beaucoup , monsieur , dit Albert ,"
Lemaitre-Pierre_Au-revoir-la-haut_<M . Péricourt-3283>_87817,"beaucoup , monsieur , dit Albert , mais j' ai"
Lemaitre-Pierre_Au-revoir-la-haut_<M . Péricourt-3283>_87820,", dit Albert , mais j' ai une très bonne"
Lemaitre-Pierre_Au-revoir-la-haut_<M . Péricourt-3283>_87827,une très bonne place . M . Péricourt leva les
Lemaitre-Pierre_Au-revoir-la-haut_<M . Péricourt-3283>_87834,"Péricourt leva les mains , je comprends , pas de"
Lemaitre-Pierre_Au-revoir-la-haut_<M . Péricourt-3283>_87847,"la porte fut refermée , il resta un instant immobile"
Lemaitre-Pierre_Au-revoir-la-haut_<M . Péricourt-3283>_87857,", pensif . – Bonsoir ma chérie , dit -"
Lemaitre-Pierre_Au-revoir-la-haut_<M . Péricourt-3283>_87861,"Bonsoir ma chérie , dit - il enfin . –"
Lemaitre-Pierre_Au-revoir-la-haut_<M . Péricourt-3283>_87869,. – Bonsoir papa . Il posa un baiser sur
Lemaitre-Pierre_Au-revoir-la-haut_<M . Péricourt-3283>_87877,baiser sur le front de sa fille . Tous les
Lemaitre-Pierre_Au-revoir-la-haut_<M . Péricourt-3283>_87889,comme ça avec elle . Édouard vit immédiatement qu' Albert
Lemaitre-Pierre_Au-revoir-la-haut_<M . Péricourt-3283>_87893,. Édouard vit immédiatement qu' Albert était déçu . Il
Lemaitre-Pierre_Au-revoir-la-haut_<M . Péricourt-3283>_87897,qu' Albert était déçu . Il rentrait morose de sa
Lemaitre-Pierre_Au-revoir-la-haut_<M . Péricourt-3283>_87901,. Il rentrait morose de sa sortie ; avec sa
Lemaitre-Pierre_Au-revoir-la-haut_<M . Péricourt-3283>_87905,"de sa sortie ; avec sa bonne amie , les"
Lemaitre-Pierre_Au-revoir-la-haut_<M . Péricourt-3283>_87931,"cause d' elles , pensa Édouard , qui savait ce"
Lemaitre-Pierre_Au-revoir-la-haut_<M . Péricourt-3283>_87933,"elles , pensa Édouard , qui savait ce que c'"
Lemaitre-Pierre_Au-revoir-la-haut_<M . Péricourt-3283>_87944,que la véritable élégance et qui n' avait pas donné
Lemaitre-Pierre_Au-revoir-la-haut_<M . Péricourt-3283>_87953,donné cher des chances d' Albert en découvrant ce qu'
Lemaitre-Pierre_Au-revoir-la-haut_<M . Péricourt-3283>_87958,Albert en découvrant ce qu' il portait aux pieds .
Lemaitre-Pierre_Au-revoir-la-haut_<M . Péricourt-3283>_87966,"pieds . En arrivant , Albert avait détourné les yeux"
Lemaitre-Pierre_Au-revoir-la-haut_<M . Péricourt-3283>_87985,"Ordinairement , au contraire , il le fixait intensément –"
Lemaitre-Pierre_Au-revoir-la-haut_<M . Péricourt-3283>_87986,", au contraire , il le fixait intensément – ça"
Lemaitre-Pierre_Au-revoir-la-haut_<M . Péricourt-3283>_88003,"excessif , qui disait qu' il ne craignait pas de"
Lemaitre-Pierre_Au-revoir-la-haut_<M . Péricourt-3283>_88009,ne craignait pas de regarder son camarade en face lorsqu'
Lemaitre-Pierre_Au-revoir-la-haut_<M . Péricourt-3283>_88014,son camarade en face lorsqu' il ne portait pas de
Lemaitre-Pierre_Au-revoir-la-haut_<M . Péricourt-3283>_88032,"Au lieu de quoi , Albert rangea ses chaussures dans"
Lemaitre-Pierre_Au-revoir-la-haut_<M . Péricourt-3283>_88034,"de quoi , Albert rangea ses chaussures dans leur boîte"
Lemaitre-Pierre_Au-revoir-la-haut_<M . Péricourt-3283>_88056,"le trésor était décevant , il s' en voulait d'"
Lemaitre-Pierre_Au-revoir-la-haut_<M . Péricourt-3283>_88097,"bonne s' était marrée . Il ne bougeait pas ,"
Lemaitre-Pierre_Au-revoir-la-haut_<M . Péricourt-3283>_88102,"Il ne bougeait pas , Édouard ne voyait que son"
Lemaitre-Pierre_Au-revoir-la-haut_<M . Péricourt-3283>_88106,", Édouard ne voyait que son dos , immobile ,"
Lemaitre-Pierre_Au-revoir-la-haut_<M . Péricourt-3283>_88117,. C' est ce qui le décida à se lancer
Lemaitre-Pierre_Au-revoir-la-haut_<M . Péricourt-3283>_88123,décida à se lancer . Il s' était pourtant promis
Lemaitre-Pierre_Au-revoir-la-haut_<M . Péricourt-3283>_88143,serait pas entièrement bouclé et il en était loin .
Lemaitre-Pierre_Au-revoir-la-haut_<M . Péricourt-3283>_88151,"loin . De plus , il n' était pas encore"
Lemaitre-Pierre_Au-revoir-la-haut_<M . Péricourt-3283>_88163,fait content de ce qu' il avait produit et Albert
Lemaitre-Pierre_Au-revoir-la-haut_<M . Péricourt-3283>_88167,qu' il avait produit et Albert n' avait pas un
Lemaitre-Pierre_Au-revoir-la-haut_<M . Péricourt-3283>_88187,raisons d' en rester à sa décision initiale de se
Lemaitre-Pierre_Au-revoir-la-haut_<M . Péricourt-3283>_88199,plus tard possible . S' il se résolut malgré tout
Lemaitre-Pierre_Au-revoir-la-haut_<M . Péricourt-3283>_88217,cause de la tristesse de son camarade . En réalité
Lemaitre-Pierre_Au-revoir-la-haut_<M . Péricourt-3283>_88229,argument ne faisait que masquer sa raison véritable : il
Lemaitre-Pierre_Au-revoir-la-haut_<M . Péricourt-3283>_88233,masquer sa raison véritable : il avait hâte ; depuis
Lemaitre-Pierre_Au-revoir-la-haut_<M . Péricourt-3283>_88243,l' après - midi où il avait achevé le dessin
Lemaitre-Pierre_Au-revoir-la-haut_<M . Péricourt-3283>_88254,"l' enfant de profil , il grillait d' impatience ."
Lemaitre-Pierre_Au-revoir-la-haut_<M . Péricourt-3283>_88271,". – Au moins , j' ai bien dîné ,"
Lemaitre-Pierre_Au-revoir-la-haut_<M . Péricourt-3283>_88277,"ai bien dîné , dit Albert sans se relever ."
Lemaitre-Pierre_Au-revoir-la-haut_<M . Péricourt-3283>_88282,"Albert sans se relever . Il se moucha , il"
Lemaitre-Pierre_Au-revoir-la-haut_<M . Péricourt-3283>_88286,". Il se moucha , il ne voulait pas se"
Lemaitre-Pierre_Au-revoir-la-haut_<M . Péricourt-3283>_88298,se donner en spectacle . Édouard vécut là un moment
Lemaitre-Pierre_Au-revoir-la-haut_<M . Péricourt-3283>_88312,"de victoire . Pas sur Albert , non , mais"
Lemaitre-Pierre_Au-revoir-la-haut_<M . Péricourt-3283>_88326,"fois depuis la faillite de sa vie , la victoire"
Lemaitre-Pierre_Au-revoir-la-haut_<M . Péricourt-3283>_88344,l' avenir allait dépendre de lui . Albert eut beau
Lemaitre-Pierre_Au-revoir-la-haut_<M . Péricourt-3283>_88346,allait dépendre de lui . Albert eut beau se lever
Lemaitre-Pierre_Au-revoir-la-haut_<M . Péricourt-3283>_88356,"en baissant les yeux , je vais au charbon ,"
