,text_surronding
Lemaitre-Pierre_Au-revoir-la-haut_<- il-759>_23444,d' Édouard ? se demandait - il avec angoisse .
Lemaitre-Pierre_Au-revoir-la-haut_<- il-759>_23589,passa pas trop mal . Albert avait bien estimé la
Lemaitre-Pierre_Au-revoir-la-haut_<- il-759>_23644,"Même pendant son sommeil , Albert continua de lui parler"
Lemaitre-Pierre_Au-revoir-la-haut_<- il-759>_23661,de ce transfert fantôme . Il arriva à la conclusion
Lemaitre-Pierre_Au-revoir-la-haut_<- il-759>_23690,"tranquille , expliqua - t - il , ça m'"
Lemaitre-Pierre_Au-revoir-la-haut_<- il-759>_23694,"t - il , ça m' embête , tu sais"
Lemaitre-Pierre_Au-revoir-la-haut_<- il-759>_23702,tu sais . Mais comme je ne suis pas sûr
Lemaitre-Pierre_Au-revoir-la-haut_<- il-759>_23716,"raisonnable … À regret , il attacha Édouard à son"
Lemaitre-Pierre_Au-revoir-la-haut_<- il-759>_23723,Édouard à son lit et sortit . Dès qu' il
Lemaitre-Pierre_Au-revoir-la-haut_<- il-759>_23732,"il quittait la chambre , il surveillait ses arrières et"
Lemaitre-Pierre_Au-revoir-la-haut_<- il-759>_23734,"la chambre , il surveillait ses arrières et rasait les"
Lemaitre-Pierre_Au-revoir-la-haut_<- il-759>_23737,"il surveillait ses arrières et rasait les murs , mais"
Lemaitre-Pierre_Au-revoir-la-haut_<- il-759>_23765,de l' année ! dit le type . Il s'
Lemaitre-Pierre_Au-revoir-la-haut_<- il-759>_23768,! dit le type . Il s' appelait Grosjean .
Lemaitre-Pierre_Au-revoir-la-haut_<- il-759>_23814,"listes , les rapports , le caporal Grosjean avait l'"
Lemaitre-Pierre_Au-revoir-la-haut_<- il-759>_23822,avait l' air accablé . Il ouvrit un large registre
Lemaitre-Pierre_Au-revoir-la-haut_<- il-759>_23828,"ouvrit un large registre , suivit les colonnes d' un"
Lemaitre-Pierre_Au-revoir-la-haut_<- il-759>_23852,"eu des blessés ici , tu peux pas savoir …"
Lemaitre-Pierre_Au-revoir-la-haut_<- il-759>_23868,"quoi ? – Si , je peux savoir . Grosjean"
Lemaitre-Pierre_Au-revoir-la-haut_<- il-759>_23872,", je peux savoir . Grosjean leva la tête de"
Lemaitre-Pierre_Au-revoir-la-haut_<- il-759>_23877,Grosjean leva la tête de son registre et le regarda
Lemaitre-Pierre_Au-revoir-la-haut_<- il-759>_23881,de son registre et le regarda fixement . Albert mesura
Lemaitre-Pierre_Au-revoir-la-haut_<- il-759>_23884,"et le regarda fixement . Albert mesura son erreur ,"
Lemaitre-Pierre_Au-revoir-la-haut_<- il-759>_23886,"regarda fixement . Albert mesura son erreur , comment se"
Lemaitre-Pierre_Au-revoir-la-haut_<- il-759>_23894,"comment se rattraper , mais Grosjean avait déjà replongé ,"
Lemaitre-Pierre_Au-revoir-la-haut_<- il-759>_23901,"déjà replongé , absorbé dans sa recherche . – Merde"
Lemaitre-Pierre_Au-revoir-la-haut_<- il-759>_23907,"recherche . – Merde , je le connais ce nom"
Lemaitre-Pierre_Au-revoir-la-haut_<- il-759>_23919,"… – Forcément , dit Albert . – Bah oui"
Lemaitre-Pierre_Au-revoir-la-haut_<- il-759>_23939,"b … ? Soudain , il hurla : – Là"
Lemaitre-Pierre_Au-revoir-la-haut_<- il-759>_23945,hurla : – Là ! Il venait de remporter une
Lemaitre-Pierre_Au-revoir-la-haut_<- il-759>_23962,"suite . – Péricourt , Édouard ! Je le savais"
Lemaitre-Pierre_Au-revoir-la-haut_<- il-759>_23964,"– Péricourt , Édouard ! Je le savais ! Là"
Lemaitre-Pierre_Au-revoir-la-haut_<- il-759>_23972,"! Là ! Ah , je le savais ! Il"
Lemaitre-Pierre_Au-revoir-la-haut_<- il-759>_23976,", je le savais ! Il renversa le registre vers"
Lemaitre-Pierre_Au-revoir-la-haut_<- il-759>_23981,"Il renversa le registre vers Albert , son gros index"
Lemaitre-Pierre_Au-revoir-la-haut_<- il-759>_23983,"le registre vers Albert , son gros index soulignant le"
Lemaitre-Pierre_Au-revoir-la-haut_<- il-759>_23993,bas d' une page . Il tenait à prouver à
Lemaitre-Pierre_Au-revoir-la-haut_<- il-759>_24000,à prouver à quel point il avait raison . –
Lemaitre-Pierre_Au-revoir-la-haut_<- il-759>_24009,– Et alors ? demanda Albert . – Eh bien
Lemaitre-Pierre_Au-revoir-la-haut_<- il-759>_24015,". – Eh bien , ton pote , il est"
Lemaitre-Pierre_Au-revoir-la-haut_<- il-759>_24022,", il est enregistré . Il appuya sur ce mot"
Lemaitre-Pierre_Au-revoir-la-haut_<- il-759>_24033,"« enregistré » . Dans sa bouche , il prenait"
Lemaitre-Pierre_Au-revoir-la-haut_<- il-759>_24047,– C' est ce que je te disais ! Je
Lemaitre-Pierre_Au-revoir-la-haut_<- il-759>_24048,C' est ce que je te disais ! Je m'
Lemaitre-Pierre_Au-revoir-la-haut_<- il-759>_24051,"que je te disais ! Je m' en souvenais ,"
Lemaitre-Pierre_Au-revoir-la-haut_<- il-759>_24056,"Je m' en souvenais , je ne suis pas encore"
Lemaitre-Pierre_Au-revoir-la-haut_<- il-759>_24073,! – Et alors ? Le type en ferma les
Lemaitre-Pierre_Au-revoir-la-haut_<- il-759>_24082,les yeux de bonheur . Il les rouvrit . –
Lemaitre-Pierre_Au-revoir-la-haut_<- il-759>_24087,Il les rouvrit . – Il est enregistré ici (
Lemaitre-Pierre_Au-revoir-la-haut_<- il-759>_24092,Il est enregistré ici ( il tapait de l' index
Lemaitre-Pierre_Au-revoir-la-haut_<- il-759>_24113,"de transfert . – Et il va où , ce"
Lemaitre-Pierre_Au-revoir-la-haut_<- il-759>_24138,", pour les véhicules … Albert allait devoir retourner au"
Lemaitre-Pierre_Au-revoir-la-haut_<- il-759>_24148,bureau de la logistique . Il s' y était rendu
Lemaitre-Pierre_Au-revoir-la-haut_<- il-759>_24180,était à devenir dingue . Il regarda l' heure .
Lemaitre-Pierre_Au-revoir-la-haut_<- il-759>_24213,avait recommandé le toubib . Il fit demi - tour
Lemaitre-Pierre_Au-revoir-la-haut_<- il-759>_24220,"demi - tour , se ravisa . Merde , se"
Lemaitre-Pierre_Au-revoir-la-haut_<- il-759>_24226,". Merde , se dit - il . Et si"
Lemaitre-Pierre_Au-revoir-la-haut_<- il-759>_24235,si … – C' est toi qui apportes les bons
Lemaitre-Pierre_Au-revoir-la-haut_<- il-759>_24248,"? – Oui , affirma Grosjean . Ou quelqu' un"
Lemaitre-Pierre_Au-revoir-la-haut_<- il-759>_24270,"au nom de Péricourt , tu te souviens qui l'"
Lemaitre-Pierre_Au-revoir-la-haut_<- il-759>_24279,l' a emporté ? Mais il connaissait déjà la réponse
Lemaitre-Pierre_Au-revoir-la-haut_<- il-759>_24291,"Affirmatif . Un lieutenant , je ne connais pas son"
Lemaitre-Pierre_Au-revoir-la-haut_<- il-759>_24327,"enculé … – Ça , je peux pas te dire"
Lemaitre-Pierre_Au-revoir-la-haut_<- il-759>_24330,"Ça , je peux pas te dire … – Et"
Lemaitre-Pierre_Au-revoir-la-haut_<- il-759>_24368,est long à établir ? Grosjean était vraiment dans son
Lemaitre-Pierre_Au-revoir-la-haut_<- il-759>_24372,? Grosjean était vraiment dans son élément . Il tira
Lemaitre-Pierre_Au-revoir-la-haut_<- il-759>_24375,"vraiment dans son élément . Il tira son encrier ,"
Lemaitre-Pierre_Au-revoir-la-haut_<- il-759>_24377,"son élément . Il tira son encrier , attrapa un"
Lemaitre-Pierre_Au-revoir-la-haut_<- il-759>_24380,"Il tira son encrier , attrapa un porte - plume"
Lemaitre-Pierre_Au-revoir-la-haut_<- il-759>_24387,"porte - plume , le dressa vers le ciel ."
Lemaitre-Pierre_Au-revoir-la-haut_<- il-759>_24408,empestait la chair pourrie . Édouard devait vraiment être transféré
Lemaitre-Pierre_Au-revoir-la-haut_<- il-759>_24448,"loin , mais , pour Édouard , le cimetière se"
Lemaitre-Pierre_Au-revoir-la-haut_<- il-759>_24460,. Encore quelques heures et il aurait pourri sur pied
Lemaitre-Pierre_Au-revoir-la-haut_<- il-759>_24481,ait trop de témoins de son héroïsme . Albert déposa
Lemaitre-Pierre_Au-revoir-la-haut_<- il-759>_24525,ne savait pas encore qui le remplacerait . Il y
Lemaitre-Pierre_Au-revoir-la-haut_<- il-759>_24571,la peine . – On le transfère quand ? demanda
Lemaitre-Pierre_Au-revoir-la-haut_<- il-759>_24599,"transfert . En fait , il est bien porté sur"
Lemaitre-Pierre_Au-revoir-la-haut_<- il-759>_24733,"à empêcher le transfert d' Édouard , il était capable"
Lemaitre-Pierre_Au-revoir-la-haut_<- il-759>_24758,qui comptait . Et qu' Édouard parte aussi vite que
Lemaitre-Pierre_Au-revoir-la-haut_<- il-759>_24793,s' occupe comme ça d' un camarade . On en
Lemaitre-Pierre_Au-revoir-la-haut_<- il-759>_24930,D' avoir tant traîné . Édouard aurait déjà été transféré
Lemaitre-Pierre_Au-revoir-la-haut_<- il-759>_24937,"déjà été transféré , s' il était tombé sur un"
Lemaitre-Pierre_Au-revoir-la-haut_<- il-759>_24948,moins con . Demain . Édouard ne dormait plus .
Lemaitre-Pierre_Au-revoir-la-haut_<- il-759>_24955,"dormait plus . Assis dans son lit , calé par"
Lemaitre-Pierre_Au-revoir-la-haut_<- il-759>_24972,"toutes les autres chambres , il se balançait des heures"
Lemaitre-Pierre_Au-revoir-la-haut_<- il-759>_24985,"des gémissements lancinants . – T' as mal , hein"
Lemaitre-Pierre_Au-revoir-la-haut_<- il-759>_24995,? demandait Albert . Mais Édouard ne répondait jamais .
Lemaitre-Pierre_Au-revoir-la-haut_<- il-759>_25036,"pour rester éveillé et surveiller Édouard , mais aussi pour"
Lemaitre-Pierre_Au-revoir-la-haut_<- il-759>_25046,couvrir l' odeur . – T' as plus d' odorat
Lemaitre-Pierre_Au-revoir-la-haut_<- il-759>_25052,"as plus d' odorat , toi , t' es un"
Lemaitre-Pierre_Au-revoir-la-haut_<- il-759>_25054,"d' odorat , toi , t' es un veinard …"
Lemaitre-Pierre_Au-revoir-la-haut_<- il-759>_25062,"veinard … Merde , comment il ferait s' il voulait"
Lemaitre-Pierre_Au-revoir-la-haut_<- il-759>_25065,", comment il ferait s' il voulait rire ? Un"
Lemaitre-Pierre_Au-revoir-la-haut_<- il-759>_25069,s' il voulait rire ? Un type qui n' a
Lemaitre-Pierre_Au-revoir-la-haut_<- il-759>_25071,voulait rire ? Un type qui n' a plus de
Lemaitre-Pierre_Au-revoir-la-haut_<- il-759>_25136,"là - bas , on vous pose des prothèses …"
Lemaitre-Pierre_Au-revoir-la-haut_<- il-759>_25179,Mais cette proposition sembla réveiller Édouard . Il dodelina de
Lemaitre-Pierre_Au-revoir-la-haut_<- il-759>_25181,proposition sembla réveiller Édouard . Il dodelina de la tête
Lemaitre-Pierre_Au-revoir-la-haut_<- il-759>_25187,"dodelina de la tête , poussa des cris qui étaient"
Lemaitre-Pierre_Au-revoir-la-haut_<- il-759>_25200,", sortes de gargouillements . Il fit signe , Albert"
Lemaitre-Pierre_Au-revoir-la-haut_<- il-759>_25211,s' était jamais aperçu qu' il était gaucher . En
Lemaitre-Pierre_Au-revoir-la-haut_<- il-759>_25227,il se demanda naïvement comment il avait pu réaliser de
Lemaitre-Pierre_Au-revoir-la-haut_<- il-759>_25245,"ce qu' il aurait dû lui proposer plus tôt ,"
Lemaitre-Pierre_Au-revoir-la-haut_<- il-759>_25254,", de dessiner . – Tu veux ton carnet ?"
Lemaitre-Pierre_Au-revoir-la-haut_<- il-759>_25256,dessiner . – Tu veux ton carnet ? Édouard le
Lemaitre-Pierre_Au-revoir-la-haut_<- il-759>_25259,"Tu veux ton carnet ? Édouard le regarda , oui"
Lemaitre-Pierre_Au-revoir-la-haut_<- il-759>_25265,"le regarda , oui , il voulait ce carnet ,"
Lemaitre-Pierre_Au-revoir-la-haut_<- il-759>_25291,"nuit . Le regard d' Édouard , si plein ,"
Lemaitre-Pierre_Au-revoir-la-haut_<- il-759>_25332,"équilibre sur le lit , Édouard trace de grands caractères"
Lemaitre-Pierre_Au-revoir-la-haut_<- il-759>_25339,"de grands caractères maladroits , il est si faible ,"
Lemaitre-Pierre_Au-revoir-la-haut_<- il-759>_25347,"faible , on dirait qu' il ne sait plus écrire"
Lemaitre-Pierre_Au-revoir-la-haut_<- il-759>_25358,le crayon semble animé de sa volonté propre . Albert
Lemaitre-Pierre_Au-revoir-la-haut_<- il-759>_25384,c' est très long . Édouard écrit une lettre ou
Lemaitre-Pierre_Au-revoir-la-haut_<- il-759>_25447,"prend un temps fou et Édouard , vite épuisé ,"
Lemaitre-Pierre_Au-revoir-la-haut_<- il-759>_25463,"une heure plus tard , il se redresse , reprend"
Lemaitre-Pierre_Au-revoir-la-haut_<- il-759>_25467,", il se redresse , reprend le carnet , comme"
Lemaitre-Pierre_Au-revoir-la-haut_<- il-759>_25475,", comme si une urgence le secouait malgré lui ."
Lemaitre-Pierre_Au-revoir-la-haut_<- il-759>_25478,une urgence le secouait malgré lui . Albert s' ébroue
Lemaitre-Pierre_Au-revoir-la-haut_<- il-759>_25529,"là : – Donc , tu ne veux pas rentrer"
Lemaitre-Pierre_Au-revoir-la-haut_<- il-759>_25540,Paris ? Mais où vas - tu aller ? On
Lemaitre-Pierre_Au-revoir-la-haut_<- il-759>_25547,"aller ? On reprend . Édouard devient fiévreux , il"
Lemaitre-Pierre_Au-revoir-la-haut_<- il-759>_25551,". Édouard devient fiévreux , il s' énerve sur son"
Lemaitre-Pierre_Au-revoir-la-haut_<- il-759>_25555,", il s' énerve sur son carnet . Les lettres"
Lemaitre-Pierre_Au-revoir-la-haut_<- il-759>_25575,"sont méconnaissables . – Calme - toi , dit Albert"
Lemaitre-Pierre_Au-revoir-la-haut_<- il-759>_25581,"toi , dit Albert , t' inquiète pas , on"
Lemaitre-Pierre_Au-revoir-la-haut_<- il-759>_25623,il a la confirmation qu' Édouard ne veut plus rentrer
Lemaitre-Pierre_Au-revoir-la-haut_<- il-759>_25629,ne veut plus rentrer chez lui . C' est ça
Lemaitre-Pierre_Au-revoir-la-haut_<- il-759>_25635,. C' est ça ? Édouard écrit « oui »
Lemaitre-Pierre_Au-revoir-la-haut_<- il-759>_25685,". Tiens , rien que moi , sans parler de"
Lemaitre-Pierre_Au-revoir-la-haut_<- il-759>_25690,"moi , sans parler de moi , eh bien ,"
Lemaitre-Pierre_Au-revoir-la-haut_<- il-759>_25696,", eh bien , quand j' ai reçu cette balle"
Lemaitre-Pierre_Au-revoir-la-haut_<- il-759>_25705,"balle dans la Somme , j' ai pensé un moment"
Lemaitre-Pierre_Au-revoir-la-haut_<- il-759>_25711,ai pensé un moment que ma Cécile allait se détourner
Lemaitre-Pierre_Au-revoir-la-haut_<- il-759>_25717,"Cécile allait se détourner , je te jure ! Mais"
Lemaitre-Pierre_Au-revoir-la-haut_<- il-759>_25722,"je te jure ! Mais tes parents t' aiment ,"
Lemaitre-Pierre_Au-revoir-la-haut_<- il-759>_25724,"jure ! Mais tes parents t' aiment , ils ne"
Lemaitre-Pierre_Au-revoir-la-haut_<- il-759>_25733,ne vont pas arrêter de t' aimer parce que tu
Lemaitre-Pierre_Au-revoir-la-haut_<- il-759>_25737,de t' aimer parce que tu as été blessé à
Lemaitre-Pierre_Au-revoir-la-haut_<- il-759>_25747,"la guerre , faut pas t' inquiéter ! Au lieu"
Lemaitre-Pierre_Au-revoir-la-haut_<- il-759>_25753,"inquiéter ! Au lieu de le tranquilliser , ce petit"
Lemaitre-Pierre_Au-revoir-la-haut_<- il-759>_25763,"discours radoteur achève d' énerver Édouard , ses éclats de"
Lemaitre-Pierre_Au-revoir-la-haut_<- il-759>_25765,"achève d' énerver Édouard , ses éclats de gorge montent"
Lemaitre-Pierre_Au-revoir-la-haut_<- il-759>_25774,"montent en cascade bouillonnante , il remue tant et si"
Lemaitre-Pierre_Au-revoir-la-haut_<- il-759>_25783,si bien qu' Albert doit le menacer de le rattacher
Lemaitre-Pierre_Au-revoir-la-haut_<- il-759>_25786,Albert doit le menacer de le rattacher . Édouard prend
Lemaitre-Pierre_Au-revoir-la-haut_<- il-759>_25789,"menacer de le rattacher . Édouard prend sur lui ,"
Lemaitre-Pierre_Au-revoir-la-haut_<- il-759>_25792,"rattacher . Édouard prend sur lui , mais il reste"
Lemaitre-Pierre_Au-revoir-la-haut_<- il-759>_25795,"prend sur lui , mais il reste excité , fâché"
Lemaitre-Pierre_Au-revoir-la-haut_<- il-759>_25802,"excité , fâché même . Il arrache violemment le carnet"
Lemaitre-Pierre_Au-revoir-la-haut_<- il-759>_25822,table pendant une dispute . Il reprend ses tentatives de
Lemaitre-Pierre_Au-revoir-la-haut_<- il-759>_25824,"une dispute . Il reprend ses tentatives de calligraphie ,"
Lemaitre-Pierre_Au-revoir-la-haut_<- il-759>_25847,à la demande . Si Édouard ne veut pas que
Lemaitre-Pierre_Au-revoir-la-haut_<- il-759>_25852,Édouard ne veut pas que ses proches le voient dans
Lemaitre-Pierre_Au-revoir-la-haut_<- il-759>_25854,veut pas que ses proches le voient dans cet état
Lemaitre-Pierre_Au-revoir-la-haut_<- il-759>_25894,"l' argument , prudemment . Édouard , concentré sur son"
Lemaitre-Pierre_Au-revoir-la-haut_<- il-759>_25898,". Édouard , concentré sur son papier , le balaye"
Lemaitre-Pierre_Au-revoir-la-haut_<- il-759>_25917,. Mais il y a sa sœur . Il faut
Lemaitre-Pierre_Au-revoir-la-haut_<- il-759>_25977,"que soit le motif d' Édouard , il faut tenter"
Lemaitre-Pierre_Au-revoir-la-haut_<- il-759>_25983,", il faut tenter de le raisonner . – Je"
Lemaitre-Pierre_Au-revoir-la-haut_<- il-759>_25988,"le raisonner . – Je te comprends , reprend Albert"
Lemaitre-Pierre_Au-revoir-la-haut_<- il-759>_25995,", reprend Albert . Mais tu verras , avec la"
Lemaitre-Pierre_Au-revoir-la-haut_<- il-759>_26007,"ce sera très différent … Édouard s' énerve , ses"
Lemaitre-Pierre_Au-revoir-la-haut_<- il-759>_26011,"… Édouard s' énerve , ses douleurs remontent à la"
Lemaitre-Pierre_Au-revoir-la-haut_<- il-759>_26018,"remontent à la surface , il abandonne la tentative de"
Lemaitre-Pierre_Au-revoir-la-haut_<- il-759>_26053,forces . Il cède et lui administre une nouvelle injection
Lemaitre-Pierre_Au-revoir-la-haut_<- il-759>_26061,nouvelle injection de morphine . Édouard se met à somnoler
Lemaitre-Pierre_Au-revoir-la-haut_<- il-759>_26067,"se met à somnoler , il en aura ingurgité beaucoup"
Lemaitre-Pierre_Au-revoir-la-haut_<- il-759>_26077,"en quelques jours . S' il en réchappe , c'"
Lemaitre-Pierre_Au-revoir-la-haut_<- il-759>_26084,"réchappe , c' est qu' il est en acier ."
Lemaitre-Pierre_Au-revoir-la-haut_<- il-759>_26101,être changé et nourri ( Albert fait comme on le
Lemaitre-Pierre_Au-revoir-la-haut_<- il-759>_26106,"Albert fait comme on le lui a montré , avec"
Lemaitre-Pierre_Au-revoir-la-haut_<- il-759>_26137,"se rebelle pas ) , Édouard s' énerve de nouveau"
Lemaitre-Pierre_Au-revoir-la-haut_<- il-759>_26143,"s' énerve de nouveau , il veut se lever ,"
Lemaitre-Pierre_Au-revoir-la-haut_<- il-759>_26148,"il veut se lever , il ne tient pas en"
Lemaitre-Pierre_Au-revoir-la-haut_<- il-759>_26155,"tient pas en place , Albert ne sait plus à"
Lemaitre-Pierre_Au-revoir-la-haut_<- il-759>_26165,quel saint se vouer . Le jeune homme a saisi
Lemaitre-Pierre_Au-revoir-la-haut_<- il-759>_26173,"a saisi le carnet , esquisse de nouveau quelques caractères"
Lemaitre-Pierre_Au-revoir-la-haut_<- il-759>_26185,"que la veille , puis tape avec le crayon sur"
Lemaitre-Pierre_Au-revoir-la-haut_<- il-759>_26193,"crayon sur la page . Albert tente de déchiffrer ,"
Lemaitre-Pierre_Au-revoir-la-haut_<- il-759>_26198,"Albert tente de déchiffrer , il n' y parvient pas"
Lemaitre-Pierre_Au-revoir-la-haut_<- il-759>_26204,"n' y parvient pas . Il fronce les sourcils ,"
Lemaitre-Pierre_Au-revoir-la-haut_<- il-759>_26226,"» ? Et brusquement , il n' en peut plus"
Lemaitre-Pierre_Au-revoir-la-haut_<- il-759>_26232,n' en peut plus . Il explose : – Écoute
Lemaitre-Pierre_Au-revoir-la-haut_<- il-759>_26238,"explose : – Écoute , j' y peux rien ,"
Lemaitre-Pierre_Au-revoir-la-haut_<- il-759>_26243,"j' y peux rien , mon grand ! Tu ne"
Lemaitre-Pierre_Au-revoir-la-haut_<- il-759>_26246,"rien , mon grand ! Tu ne veux pas rentrer"
Lemaitre-Pierre_Au-revoir-la-haut_<- il-759>_26252,"ne veux pas rentrer chez toi , je ne comprends"
Lemaitre-Pierre_Au-revoir-la-haut_<- il-759>_26254,"pas rentrer chez toi , je ne comprends pas pourquoi"
Lemaitre-Pierre_Au-revoir-la-haut_<- il-759>_26269,", c' est pas de mon ressort . C' est"
Lemaitre-Pierre_Au-revoir-la-haut_<- il-759>_26278,"est vraiment désolant sauf que moi , je ne peux"
Lemaitre-Pierre_Au-revoir-la-haut_<- il-759>_26280,"désolant sauf que moi , je ne peux rien y"
Lemaitre-Pierre_Au-revoir-la-haut_<- il-759>_26290,"faire , voilà ! Alors Édouard lui attrape le bras"
Lemaitre-Pierre_Au-revoir-la-haut_<- il-759>_26291,", voilà ! Alors Édouard lui attrape le bras et"
Lemaitre-Pierre_Au-revoir-la-haut_<- il-759>_26296,lui attrape le bras et le presse incroyablement fort .
Lemaitre-Pierre_Au-revoir-la-haut_<- il-759>_26297,attrape le bras et le presse incroyablement fort . –
Lemaitre-Pierre_Au-revoir-la-haut_<- il-759>_26304,"fort . – Hé , tu me fais mal !"
Lemaitre-Pierre_Au-revoir-la-haut_<- il-759>_26305,". – Hé , tu me fais mal ! crie"
Lemaitre-Pierre_Au-revoir-la-haut_<- il-759>_26310,me fais mal ! crie Albert . Édouard a enfoncé
Lemaitre-Pierre_Au-revoir-la-haut_<- il-759>_26312,mal ! crie Albert . Édouard a enfoncé ses ongles
Lemaitre-Pierre_Au-revoir-la-haut_<- il-759>_26315,Albert . Édouard a enfoncé ses ongles . C' est
Lemaitre-Pierre_Au-revoir-la-haut_<- il-759>_26334,bientôt les deux mains d' Édouard se coulent autour des
Lemaitre-Pierre_Au-revoir-la-haut_<- il-759>_26341,"coulent autour des épaules d' Albert , il le serre"
Lemaitre-Pierre_Au-revoir-la-haut_<- il-759>_26343,"des épaules d' Albert , il le serre contre lui"
Lemaitre-Pierre_Au-revoir-la-haut_<- il-759>_26344,"épaules d' Albert , il le serre contre lui et"
Lemaitre-Pierre_Au-revoir-la-haut_<- il-759>_26347,", il le serre contre lui et pleure à gros"
Lemaitre-Pierre_Au-revoir-la-haut_<- il-759>_26349,"le serre contre lui et pleure à gros sanglots ,"
Lemaitre-Pierre_Au-revoir-la-haut_<- il-759>_26359,en poussant des cris . Albert a déjà entendu de
Lemaitre-Pierre_Au-revoir-la-haut_<- il-759>_26390,costume marin et gémissaient à vous arracher les larmes .
Lemaitre-Pierre_Au-revoir-la-haut_<- il-759>_26407,". Ce qui arrive à Édouard est tellement définitif ,"
Lemaitre-Pierre_Au-revoir-la-haut_<- il-759>_26419,"pas , tellement irréversible … Albert dit des choses simples"
Lemaitre-Pierre_Au-revoir-la-haut_<- il-759>_26425,"dit des choses simples , Pleure mon grand . Il"
Lemaitre-Pierre_Au-revoir-la-haut_<- il-759>_26426,"des choses simples , Pleure mon grand . Il n'"
Lemaitre-Pierre_Au-revoir-la-haut_<- il-759>_26447,"bêtes . Le chagrin d' Édouard est incontrôlable , irrépressible"
Lemaitre-Pierre_Au-revoir-la-haut_<- il-759>_26454,"incontrôlable , irrépressible . – Tu ne veux plus rentrer"
Lemaitre-Pierre_Au-revoir-la-haut_<- il-759>_26460,"ne veux plus rentrer chez toi , je le vois"
Lemaitre-Pierre_Au-revoir-la-haut_<- il-759>_26462,"plus rentrer chez toi , je le vois bien ,"
Lemaitre-Pierre_Au-revoir-la-haut_<- il-759>_26468,"le vois bien , dit Albert . Il sent la"
Lemaitre-Pierre_Au-revoir-la-haut_<- il-759>_26470,"bien , dit Albert . Il sent la tête d'"
Lemaitre-Pierre_Au-revoir-la-haut_<- il-759>_26475,"Il sent la tête d' Édouard qui bascule , qui"
Lemaitre-Pierre_Au-revoir-la-haut_<- il-759>_26483,", qui se niche dans son cou , non ,"
Lemaitre-Pierre_Au-revoir-la-haut_<- il-759>_26488,"son cou , non , il ne veut plus rentrer"
Lemaitre-Pierre_Au-revoir-la-haut_<- il-759>_26494,"ne veut plus rentrer . Il répète non , non"
Lemaitre-Pierre_Au-revoir-la-haut_<- il-759>_26500,"répète non , non , il ne veut pas ."
Lemaitre-Pierre_Au-revoir-la-haut_<- il-759>_26506,"ne veut pas . En le tenant contre lui ,"
Lemaitre-Pierre_Au-revoir-la-haut_<- il-759>_26509,". En le tenant contre lui , Albert se dit"
Lemaitre-Pierre_Au-revoir-la-haut_<- il-759>_26511,"le tenant contre lui , Albert se dit que pendant"
Lemaitre-Pierre_Au-revoir-la-haut_<- il-759>_26525,"comme tout le monde , Édouard n' a pensé qu'"
Lemaitre-Pierre_Au-revoir-la-haut_<- il-759>_26543,"guerre est terminée et qu' il est vivant , voilà"
Lemaitre-Pierre_Au-revoir-la-haut_<- il-759>_26549,"est vivant , voilà qu' il ne pense plus qu'"
Lemaitre-Pierre_Au-revoir-la-haut_<- il-759>_26577,"gâchis … En fait , Albert le comprend maintenant :"
Lemaitre-Pierre_Au-revoir-la-haut_<- il-759>_26582,Albert le comprend maintenant : Édouard n' aura plus la
Lemaitre-Pierre_Au-revoir-la-haut_<- il-759>_26597,C' est fini . S' il avait pu se jeter
Lemaitre-Pierre_Au-revoir-la-haut_<- il-759>_26649,"cette chance est passée , il n' aura plus jamais"
Lemaitre-Pierre_Au-revoir-la-haut_<- il-759>_26657,plus jamais le courage ; le voici condamné à vivre
Lemaitre-Pierre_Au-revoir-la-haut_<- il-759>_26666,"vivre . Et c' est sa faute à Albert ,"
Lemaitre-Pierre_Au-revoir-la-haut_<- il-759>_26669,"c' est sa faute à Albert , tout est de"
Lemaitre-Pierre_Au-revoir-la-haut_<- il-759>_26674,"Albert , tout est de sa faute , depuis le"
Lemaitre-Pierre_Au-revoir-la-haut_<- il-759>_26683,le début . Tout . Il est accablé et lui
Lemaitre-Pierre_Au-revoir-la-haut_<- il-759>_26687,". Il est accablé et lui aussi , pour un"
Lemaitre-Pierre_Au-revoir-la-haut_<- il-759>_26706,". Dans la vie d' Édouard , Albert occupe maintenant"
Lemaitre-Pierre_Au-revoir-la-haut_<- il-759>_26708,"la vie d' Édouard , Albert occupe maintenant toute la"
Lemaitre-Pierre_Au-revoir-la-haut_<- il-759>_26715,"maintenant toute la place . Il est le seul ,"
Lemaitre-Pierre_Au-revoir-la-haut_<- il-759>_26724,", l' unique recours . Le jeune homme lui a"
Lemaitre-Pierre_Au-revoir-la-haut_<- il-759>_26727,recours . Le jeune homme lui a délégué son existence
Lemaitre-Pierre_Au-revoir-la-haut_<- il-759>_26730,"jeune homme lui a délégué son existence , la lui"
Lemaitre-Pierre_Au-revoir-la-haut_<- il-759>_26734,"délégué son existence , la lui a remise parce qu'"
Lemaitre-Pierre_Au-revoir-la-haut_<- il-759>_26735,"son existence , la lui a remise parce qu' il"
Lemaitre-Pierre_Au-revoir-la-haut_<- il-759>_26739,lui a remise parce qu' il ne peut plus ni
Lemaitre-Pierre_Au-revoir-la-haut_<- il-759>_26753,"ni s' en débarrasser . Albert est atterré , bouleversé"
Lemaitre-Pierre_Au-revoir-la-haut_<- il-759>_26765,"Bon , bredouille - t - il , je vais"
Lemaitre-Pierre_Au-revoir-la-haut_<- il-759>_26768,"- t - il , je vais voir … Il"
Lemaitre-Pierre_Au-revoir-la-haut_<- il-759>_26772,", je vais voir … Il dit cela sans y"
Lemaitre-Pierre_Au-revoir-la-haut_<- il-759>_26779,cela sans y penser mais Édouard relève aussitôt la tête
Lemaitre-Pierre_Au-revoir-la-haut_<- il-759>_26786,aussitôt la tête comme s' il venait de recevoir une
Lemaitre-Pierre_Au-revoir-la-haut_<- il-759>_26825,de part en part . Albert est pris au piège
Lemaitre-Pierre_Au-revoir-la-haut_<- il-759>_26832,"pris au piège . – Je vais voir , répète"
Lemaitre-Pierre_Au-revoir-la-haut_<- il-759>_26839,"voir , répète - t - il bêtement . Je"
Lemaitre-Pierre_Au-revoir-la-haut_<- il-759>_26843,t - il bêtement . Je vais me débrouiller .
Lemaitre-Pierre_Au-revoir-la-haut_<- il-759>_26848,Je vais me débrouiller . Édouard lui serre les mains
