,text_surronding
Lemaitre-Pierre_Au-revoir-la-haut_<Albert Maillard-5014>_130983,qu' on se demanda s' il n' allait pas perdre
Lemaitre-Pierre_Au-revoir-la-haut_<Albert Maillard-5014>_131019,d' avoir l' œil sur lui . – Arrêtez -
Lemaitre-Pierre_Au-revoir-la-haut_<Albert Maillard-5014>_131023,sur lui . – Arrêtez - moi ! hurla Albert
Lemaitre-Pierre_Au-revoir-la-haut_<Albert Maillard-5014>_131027,Arrêtez - moi ! hurla Albert lorsqu' ils atteignirent le
Lemaitre-Pierre_Au-revoir-la-haut_<Albert Maillard-5014>_131047,"encore là … , risqua le chauffeur . On lui"
Lemaitre-Pierre_Au-revoir-la-haut_<Albert Maillard-5014>_131051,risqua le chauffeur . On lui avait confié une mission
Lemaitre-Pierre_Au-revoir-la-haut_<Albert Maillard-5014>_131069,"– Tant pis , cria Albert , arrêtez - vous"
Lemaitre-Pierre_Au-revoir-la-haut_<Albert Maillard-5014>_131089,"de le faire descendre , Albert descendit ; attendre qu'"
Lemaitre-Pierre_Au-revoir-la-haut_<Albert Maillard-5014>_131094,Albert descendit ; attendre qu' il s' éloigne de quelques
Lemaitre-Pierre_Au-revoir-la-haut_<Albert Maillard-5014>_131101,éloigne de quelques pas ; le chauffeur vit Albert marcher
Lemaitre-Pierre_Au-revoir-la-haut_<Albert Maillard-5014>_131104,pas ; le chauffeur vit Albert marcher d' un pas
Lemaitre-Pierre_Au-revoir-la-haut_<Albert Maillard-5014>_131118,opposé à l' adresse où il était censé se rendre
Lemaitre-Pierre_Au-revoir-la-haut_<Albert Maillard-5014>_131127,rendre ; et quand on vous a réglé d' avance
Lemaitre-Pierre_Au-revoir-la-haut_<Albert Maillard-5014>_131133,"a réglé d' avance , vous démarrez le plus vite"
Lemaitre-Pierre_Au-revoir-la-haut_<Albert Maillard-5014>_131143,"possible , légitime défense . Albert ne s' en rendit"
Lemaitre-Pierre_Au-revoir-la-haut_<Albert Maillard-5014>_131153,"pas compte , hanté qu' il était depuis son départ"
Lemaitre-Pierre_Au-revoir-la-haut_<Albert Maillard-5014>_131156,hanté qu' il était depuis son départ de la banque
Lemaitre-Pierre_Au-revoir-la-haut_<Albert Maillard-5014>_131173,à nez avec Pradelle . Il imaginait déjà la scène
Lemaitre-Pierre_Au-revoir-la-haut_<Albert Maillard-5014>_131181,"la scène , le capitaine le tenant d' une poigne"
Lemaitre-Pierre_Au-revoir-la-haut_<Albert Maillard-5014>_131194,"épaule , se penchant et lui demandant : – Tiens"
Lemaitre-Pierre_Au-revoir-la-haut_<Albert Maillard-5014>_131201,": – Tiens donc , soldat Maillard , vous rendez"
Lemaitre-Pierre_Au-revoir-la-haut_<Albert Maillard-5014>_131204,"donc , soldat Maillard , vous rendez une petite visite"
Lemaitre-Pierre_Au-revoir-la-haut_<Albert Maillard-5014>_131210,rendez une petite visite à votre bon capitaine d' Aulnay
Lemaitre-Pierre_Au-revoir-la-haut_<Albert Maillard-5014>_131234,"Et disant cela , il l' entraînait dans un couloir"
Lemaitre-Pierre_Au-revoir-la-haut_<Albert Maillard-5014>_131244,"qui devenait une cave , il fallait s' expliquer ;"
Lemaitre-Pierre_Au-revoir-la-haut_<Albert Maillard-5014>_131250,"fallait s' expliquer ; Pradelle le giflait , puis l'"
Lemaitre-Pierre_Au-revoir-la-haut_<Albert Maillard-5014>_131254,"Pradelle le giflait , puis l' attachait , le torturait"
Lemaitre-Pierre_Au-revoir-la-haut_<Albert Maillard-5014>_131257,", puis l' attachait , le torturait , et quand"
Lemaitre-Pierre_Au-revoir-la-haut_<Albert Maillard-5014>_131262,"le torturait , et quand Albert était contraint de lui"
Lemaitre-Pierre_Au-revoir-la-haut_<Albert Maillard-5014>_131266,quand Albert était contraint de lui avouer qu' il vivait
Lemaitre-Pierre_Au-revoir-la-haut_<Albert Maillard-5014>_131269,contraint de lui avouer qu' il vivait avec Édouard Péricourt
Lemaitre-Pierre_Au-revoir-la-haut_<Albert Maillard-5014>_131276,"avec Édouard Péricourt , qu' il avait volé de l'"
Lemaitre-Pierre_Au-revoir-la-haut_<Albert Maillard-5014>_131320,dieux qui aussitôt envoyaient sur Albert une quantité de terre
Lemaitre-Pierre_Au-revoir-la-haut_<Albert Maillard-5014>_131373,"au paradis des impuissants . Albert , comme la première"
Lemaitre-Pierre_Au-revoir-la-haut_<Albert Maillard-5014>_131382,"première fois , tourna , hésita , revint sur ses"
Lemaitre-Pierre_Au-revoir-la-haut_<Albert Maillard-5014>_131384,", tourna , hésita , revint sur ses pas ,"
Lemaitre-Pierre_Au-revoir-la-haut_<Albert Maillard-5014>_131386,", hésita , revint sur ses pas , tétanisé par"
Lemaitre-Pierre_Au-revoir-la-haut_<Albert Maillard-5014>_131411,M . Péricourt à qui il volait de l' argent
Lemaitre-Pierre_Au-revoir-la-haut_<Albert Maillard-5014>_131429,sœur d' Édouard à qui il pouvait révéler que son
Lemaitre-Pierre_Au-revoir-la-haut_<Albert Maillard-5014>_131433,qui il pouvait révéler que son frère était encore en
Lemaitre-Pierre_Au-revoir-la-haut_<Albert Maillard-5014>_131440,était encore en vie . Il chercha comment faire porter
Lemaitre-Pierre_Au-revoir-la-haut_<Albert Maillard-5014>_131452,. Péricourt le document qu' il serrait contre lui avec
Lemaitre-Pierre_Au-revoir-la-haut_<Albert Maillard-5014>_131455,document qu' il serrait contre lui avec une force de
Lemaitre-Pierre_Au-revoir-la-haut_<Albert Maillard-5014>_131473,". Trouver quelqu' un pour le remplacer , voilà ce"
Lemaitre-Pierre_Au-revoir-la-haut_<Albert Maillard-5014>_131482,ce qu' il fallait . Il regretta que le chauffeur
Lemaitre-Pierre_Au-revoir-la-haut_<Albert Maillard-5014>_131490,"le chauffeur fût parti , il aurait pu se garer"
Lemaitre-Pierre_Au-revoir-la-haut_<Albert Maillard-5014>_131506,"la commission et revenir , Albert aurait gardé son taxi"
Lemaitre-Pierre_Au-revoir-la-haut_<Albert Maillard-5014>_131509,"revenir , Albert aurait gardé son taxi … C' est"
Lemaitre-Pierre_Au-revoir-la-haut_<Albert Maillard-5014>_131523,là que Pauline apparut . Albert se tenait sur le
Lemaitre-Pierre_Au-revoir-la-haut_<Albert Maillard-5014>_131539,"épaule rasant le mur ; il la vit , et"
Lemaitre-Pierre_Au-revoir-la-haut_<Albert Maillard-5014>_131556,"femme était la solution de son problème , elle devint"
Lemaitre-Pierre_Au-revoir-la-haut_<Albert Maillard-5014>_131568,d' un autre souci . Il avait bien souvent pensé
Lemaitre-Pierre_Au-revoir-la-haut_<Albert Maillard-5014>_131585,qui avait tant ri de le voir avec ses chaussures
Lemaitre-Pierre_Au-revoir-la-haut_<Albert Maillard-5014>_131592,avec ses chaussures idiotes . Il se jeta aussitôt dans
Lemaitre-Pierre_Au-revoir-la-haut_<Albert Maillard-5014>_131667,"Quelques minutes plus tard , Albert sonnait à la porte"
Lemaitre-Pierre_Au-revoir-la-haut_<Albert Maillard-5014>_131676,"porte , elle ouvrit , le reconnut , il bomba"
Lemaitre-Pierre_Au-revoir-la-haut_<Albert Maillard-5014>_131679,"ouvrit , le reconnut , il bomba le torse parce"
Lemaitre-Pierre_Au-revoir-la-haut_<Albert Maillard-5014>_131690,"depuis leur première rencontre , il avait acheté de nouvelles"
Lemaitre-Pierre_Au-revoir-la-haut_<Albert Maillard-5014>_131707,", elle remarqua aussi qu' il possédait un nouveau manteau"
Lemaitre-Pierre_Au-revoir-la-haut_<Albert Maillard-5014>_131732,qu' on aurait dit qu' il venait de faire sous
Lemaitre-Pierre_Au-revoir-la-haut_<Albert Maillard-5014>_131737,il venait de faire sous lui . Allez savoir ce
Lemaitre-Pierre_Au-revoir-la-haut_<Albert Maillard-5014>_131784,"l' un en face de l' autre , comme si"
Lemaitre-Pierre_Au-revoir-la-haut_<Albert Maillard-5014>_131793,"si c' était elle qu' il était venu voir ,"
Lemaitre-Pierre_Au-revoir-la-haut_<Albert Maillard-5014>_131914,"brune . Depuis Cécile , il n' avait jamais pensé"
Lemaitre-Pierre_Au-revoir-la-haut_<Albert Maillard-5014>_131923,"pensé à une brune , il n' avait même jamais"
Lemaitre-Pierre_Au-revoir-la-haut_<Albert Maillard-5014>_131937,Pauline regarda le dossier qu' il pétrissait entre ses mains
Lemaitre-Pierre_Au-revoir-la-haut_<Albert Maillard-5014>_131943,pétrissait entre ses mains . Albert se souvint de la
Lemaitre-Pierre_Au-revoir-la-haut_<Albert Maillard-5014>_131950,souvint de la raison de sa visite mais aussi de
Lemaitre-Pierre_Au-revoir-la-haut_<Albert Maillard-5014>_131958,aussi de la crainte qu' il avait des mauvaises rencontres
Lemaitre-Pierre_Au-revoir-la-haut_<Albert Maillard-5014>_131964,"avait des mauvaises rencontres . Il était entré , l'"
Lemaitre-Pierre_Au-revoir-la-haut_<Albert Maillard-5014>_131978,"ressortir , vite . – Je viens de la banque"
Lemaitre-Pierre_Au-revoir-la-haut_<Albert Maillard-5014>_131985,"de la banque , dit - il bêtement . Elle"
Lemaitre-Pierre_Au-revoir-la-haut_<Albert Maillard-5014>_132000,". Sans le vouloir , il avait produit son petit"
Lemaitre-Pierre_Au-revoir-la-haut_<Albert Maillard-5014>_132003,"vouloir , il avait produit son petit effet : la"
Lemaitre-Pierre_Au-revoir-la-haut_<Albert Maillard-5014>_132024,"Péricourt , ajouta - t - il . Et comme"
Lemaitre-Pierre_Au-revoir-la-haut_<Albert Maillard-5014>_132029,- il . Et comme il avait perçu qu' il
Lemaitre-Pierre_Au-revoir-la-haut_<Albert Maillard-5014>_132033,comme il avait perçu qu' il prenait de l' importance
Lemaitre-Pierre_Au-revoir-la-haut_<Albert Maillard-5014>_132039,"prenait de l' importance , il ne put s' empêcher"
Lemaitre-Pierre_Au-revoir-la-haut_<Albert Maillard-5014>_132048,empêcher de préciser : – Je dois le remettre en
Lemaitre-Pierre_Au-revoir-la-haut_<Albert Maillard-5014>_132069,lui ; la jeune fille lui proposa de l' attendre
Lemaitre-Pierre_Au-revoir-la-haut_<Albert Maillard-5014>_132082,"la porte du salon , Albert retomba sur terre :"
Lemaitre-Pierre_Au-revoir-la-haut_<Albert Maillard-5014>_132104,", non , merci . Il tendit le document ."
Lemaitre-Pierre_Au-revoir-la-haut_<Albert Maillard-5014>_132114,Tous deux s' aperçurent qu' il était mouillé de transpiration
Lemaitre-Pierre_Au-revoir-la-haut_<Albert Maillard-5014>_132120,"était mouillé de transpiration , Albert voulut le sécher contre"
Lemaitre-Pierre_Au-revoir-la-haut_<Albert Maillard-5014>_132125,"Albert voulut le sécher contre sa manche , le dossier"
Lemaitre-Pierre_Au-revoir-la-haut_<Albert Maillard-5014>_132156,… C' est ainsi qu' il était entré dans la
Lemaitre-Pierre_Au-revoir-la-haut_<Albert Maillard-5014>_132203,"Pauline mentait joliment . Avec Albert , ils se touchèrent"
Lemaitre-Pierre_Au-revoir-la-haut_<Albert Maillard-5014>_132229,c' était du sérieux . Albert lui plaisait avec son
Lemaitre-Pierre_Au-revoir-la-haut_<Albert Maillard-5014>_132233,". Albert lui plaisait avec son visage naïf , émouvant"
Lemaitre-Pierre_Au-revoir-la-haut_<Albert Maillard-5014>_132239,"visage naïf , émouvant . Il provoquait chez elle des"
Lemaitre-Pierre_Au-revoir-la-haut_<Albert Maillard-5014>_132247,elle des envies maternantes et disposait d' une jolie situation
Lemaitre-Pierre_Au-revoir-la-haut_<Albert Maillard-5014>_132259,"dans une banque . Comme il connaissait les patrons ,"
Lemaitre-Pierre_Au-revoir-la-haut_<Albert Maillard-5014>_132267,"patrons , une belle carrière l' attendait sans doute ."
Lemaitre-Pierre_Au-revoir-la-haut_<Albert Maillard-5014>_132277,"Elle ne savait pas combien il gagnait , mais ce"
Lemaitre-Pierre_Au-revoir-la-haut_<Albert Maillard-5014>_132287,devait être confortable parce qu' il l' invita tout de
Lemaitre-Pierre_Au-revoir-la-haut_<Albert Maillard-5014>_132312,"et une clientèle bourgeoise . Il prenait des taxis ,"
Lemaitre-Pierre_Au-revoir-la-haut_<Albert Maillard-5014>_132323,moins pour la reconduire . Il l' emmena aussi au
Lemaitre-Pierre_Au-revoir-la-haut_<Albert Maillard-5014>_132334,", sans lui dire qu' il y mettait les pieds"
Lemaitre-Pierre_Au-revoir-la-haut_<Albert Maillard-5014>_132364,"hall . L' argent d' Albert commençait à filer ,"
Lemaitre-Pierre_Au-revoir-la-haut_<Albert Maillard-5014>_132369,"Albert commençait à filer , son salaire était loin de"
Lemaitre-Pierre_Au-revoir-la-haut_<Albert Maillard-5014>_132376,était loin de suffire et il avait déjà pas mal
Lemaitre-Pierre_Au-revoir-la-haut_<Albert Maillard-5014>_132383,déjà pas mal puisé dans sa part du maigre butin
Lemaitre-Pierre_Au-revoir-la-haut_<Albert Maillard-5014>_132405,"plus guère , s' interrogeait - il : comment sortir"
Lemaitre-Pierre_Au-revoir-la-haut_<Albert Maillard-5014>_132419,", pour le coup , il s' était jeté seul"
Lemaitre-Pierre_Au-revoir-la-haut_<Albert Maillard-5014>_132437,"continuer de courtiser Pauline , il se demanda s' il"
Lemaitre-Pierre_Au-revoir-la-haut_<Albert Maillard-5014>_132441,", il se demanda s' il ne devrait pas «"
Lemaitre-Pierre_Au-revoir-la-haut_<Albert Maillard-5014>_132461,de M . Péricourt . Henri était né dans une
Lemaitre-Pierre_Au-revoir-la-haut_<Albert Maillard-5014>_132469,"dans une famille ruinée dont il avait vu , toute"
Lemaitre-Pierre_Au-revoir-la-haut_<Albert Maillard-5014>_132474,"il avait vu , toute sa jeunesse , la déliquescence"
Lemaitre-Pierre_Au-revoir-la-haut_<Albert Maillard-5014>_132482,"la déliquescence s' aggraver , il n' avait assisté qu'"
Lemaitre-Pierre_Au-revoir-la-haut_<Albert Maillard-5014>_132493,des débâcles . Maintenant qu' il s' apprêtait à remporter
Lemaitre-Pierre_Au-revoir-la-haut_<Albert Maillard-5014>_132529,qu' il s' agissait . Il allait le renvoyer à
Lemaitre-Pierre_Au-revoir-la-haut_<Albert Maillard-5014>_132545,"! Pour qui se prenait - il , d' abord"
Lemaitre-Pierre_Au-revoir-la-haut_<Albert Maillard-5014>_132563,derrière cette assurance affichée . Henri avait besoin de croire
Lemaitre-Pierre_Au-revoir-la-haut_<Albert Maillard-5014>_132569,avait besoin de croire en son succès et n' imaginait
Lemaitre-Pierre_Au-revoir-la-haut_<Albert Maillard-5014>_132573,en son succès et n' imaginait pas une seconde que
Lemaitre-Pierre_Au-revoir-la-haut_<Albert Maillard-5014>_132592,"favorables aux grandes fortunes , il ne pût tirer avantageusement"
Lemaitre-Pierre_Au-revoir-la-haut_<Albert Maillard-5014>_132597,il ne pût tirer avantageusement son épingle du jeu .
Lemaitre-Pierre_Au-revoir-la-haut_<Albert Maillard-5014>_132606,. Toute la guerre le lui avait prouvé : il
Lemaitre-Pierre_Au-revoir-la-haut_<Albert Maillard-5014>_132610,le lui avait prouvé : il ne craignait pas l'
Lemaitre-Pierre_Au-revoir-la-haut_<Albert Maillard-5014>_132639,"la nature des obstacles qui l' inquiétait , mais leur"
Lemaitre-Pierre_Au-revoir-la-haut_<Albert Maillard-5014>_132739,était révélée moins conciliante . Henri avait aussitôt demandé à
Lemaitre-Pierre_Au-revoir-la-haut_<Albert Maillard-5014>_132769,", voyez - vous , lui avait - on expliqué"
Lemaitre-Pierre_Au-revoir-la-haut_<Albert Maillard-5014>_132780,"téléphone . Jusqu' ici , il s' agissait de petites"
Lemaitre-Pierre_Au-revoir-la-haut_<Albert Maillard-5014>_132843,au marché … – Mais je vous l' ai expliqué
Lemaitre-Pierre_Au-revoir-la-haut_<Albert Maillard-5014>_132844,marché … – Mais je vous l' ai expliqué !
Lemaitre-Pierre_Au-revoir-la-haut_<Albert Maillard-5014>_132850,"l' ai expliqué ! tonna Henri . – Oui ,"
Lemaitre-Pierre_Au-revoir-la-haut_<Albert Maillard-5014>_132855,"Henri . – Oui , je sais ! Une erreur"
Lemaitre-Pierre_Au-revoir-la-haut_<Albert Maillard-5014>_132885,"est pas pareil , comprenez - vous . Des dizaines"
Lemaitre-Pierre_Au-revoir-la-haut_<Albert Maillard-5014>_132926,là ! s' était esclaffé Henri en riant très fort
Lemaitre-Pierre_Au-revoir-la-haut_<Albert Maillard-5014>_132932,en riant très fort . Vous m' accusez de dépouiller
Lemaitre-Pierre_Au-revoir-la-haut_<Albert Maillard-5014>_132933,riant très fort . Vous m' accusez de dépouiller les
Lemaitre-Pierre_Au-revoir-la-haut_<Albert Maillard-5014>_132945,? Le silence qui suivit l' impressionna . L' affaire
Lemaitre-Pierre_Au-revoir-la-haut_<Albert Maillard-5014>_132954,affaire devenait grave parce qu' il n' était pas question
Lemaitre-Pierre_Au-revoir-la-haut_<Albert Maillard-5014>_133002,"cela s' est fait dans votre dos , bien sûr"
Lemaitre-Pierre_Au-revoir-la-haut_<Albert Maillard-5014>_133008,"dos , bien sûr , vous n' êtes pas en"
Lemaitre-Pierre_Au-revoir-la-haut_<Albert Maillard-5014>_133045,"la critique pesait lourd . Il aurait tenu Dupré ,"
Lemaitre-Pierre_Au-revoir-la-haut_<Albert Maillard-5014>_133050,"Il aurait tenu Dupré , il lui aurait fait passer"
Lemaitre-Pierre_Au-revoir-la-haut_<Albert Maillard-5014>_133064,"heure ; du reste , il ne perdait rien pour"
Lemaitre-Pierre_Au-revoir-la-haut_<Albert Maillard-5014>_133071,perdait rien pour attendre . Henri se souvint alors que
Lemaitre-Pierre_Au-revoir-la-haut_<Albert Maillard-5014>_133089,"des guerres napoléoniennes . – Vous pensez vraiment , demanda"
Lemaitre-Pierre_Au-revoir-la-haut_<Albert Maillard-5014>_133096,"vraiment , demanda - t - il , que les"
Lemaitre-Pierre_Au-revoir-la-haut_<Albert Maillard-5014>_133146,"sur le volet ? En son for intérieur , Henri"
Lemaitre-Pierre_Au-revoir-la-haut_<Albert Maillard-5014>_133150,"En son for intérieur , Henri savait qu' il s'"
Lemaitre-Pierre_Au-revoir-la-haut_<Albert Maillard-5014>_133153,"intérieur , Henri savait qu' il s' était montré un"
Lemaitre-Pierre_Au-revoir-la-haut_<Albert Maillard-5014>_133174,", mais enfin , Dupré l' avait assuré que les"
Lemaitre-Pierre_Au-revoir-la-haut_<Albert Maillard-5014>_133231,"gérer seule ce dossier , monsieur d' Aulnay - Pradelle"
Lemaitre-Pierre_Au-revoir-la-haut_<Albert Maillard-5014>_133258,bonne et due forme ! Henri raccrocha violemment le téléphone
Lemaitre-Pierre_Au-revoir-la-haut_<Albert Maillard-5014>_133264,raccrocha violemment le téléphone et entra dans une colère noire
Lemaitre-Pierre_Au-revoir-la-haut_<Albert Maillard-5014>_133270,dans une colère noire . Il saisit une porcelaine de
Lemaitre-Pierre_Au-revoir-la-haut_<Albert Maillard-5014>_133278,porcelaine de Chine et la fracassa sur une petite table
Lemaitre-Pierre_Au-revoir-la-haut_<Albert Maillard-5014>_133288,en marqueterie . Quoi ? Il n' avait pas suffisamment
Lemaitre-Pierre_Au-revoir-la-haut_<Albert Maillard-5014>_133312,"un revers du bras , il chassa un vase de"
Lemaitre-Pierre_Au-revoir-la-haut_<Albert Maillard-5014>_133327,le mur . Et s' il expliquait au ministre de
Lemaitre-Pierre_Au-revoir-la-haut_<Albert Maillard-5014>_133345,"ses largesses , hein ? Henri reprit sa respiration ."
Lemaitre-Pierre_Au-revoir-la-haut_<Albert Maillard-5014>_133347,", hein ? Henri reprit sa respiration . Sa fureur"
Lemaitre-Pierre_Au-revoir-la-haut_<Albert Maillard-5014>_133350,Henri reprit sa respiration . Sa fureur était proportionnelle à
Lemaitre-Pierre_Au-revoir-la-haut_<Albert Maillard-5014>_133367,", à ces arguments , il n' y croyait pas"
Lemaitre-Pierre_Au-revoir-la-haut_<Albert Maillard-5014>_133372,il n' y croyait pas lui - même . Il
Lemaitre-Pierre_Au-revoir-la-haut_<Albert Maillard-5014>_133450,"– Eh bien , que t' arrive - t -"
Lemaitre-Pierre_Au-revoir-la-haut_<Albert Maillard-5014>_133457,- t - il ? Henri se retourna et la
Lemaitre-Pierre_Au-revoir-la-haut_<Albert Maillard-5014>_133486,aurait dite à terme . Il la trouva laide ;
Lemaitre-Pierre_Au-revoir-la-haut_<Albert Maillard-5014>_133509,éveillait plus aucun désir chez lui . La réciproque était
Lemaitre-Pierre_Au-revoir-la-haut_<Albert Maillard-5014>_133559,"était loin et pourtant , Henri lui était plus attaché"
Lemaitre-Pierre_Au-revoir-la-haut_<Albert Maillard-5014>_133582,future mère du fils qu' il espérait . Un Aulnay
Lemaitre-Pierre_Au-revoir-la-haut_<Albert Maillard-5014>_133613,"n' aurait pas , comme lui , à batailler pour"
Lemaitre-Pierre_Au-revoir-la-haut_<Albert Maillard-5014>_133646,"C' était une qualité chez Henri , dans les situations"
Lemaitre-Pierre_Au-revoir-la-haut_<Albert Maillard-5014>_133653,"dans les situations difficiles , il pouvait prendre une décision"
Lemaitre-Pierre_Au-revoir-la-haut_<Albert Maillard-5014>_133666,". En un éclair , il passa en revue les"
Lemaitre-Pierre_Au-revoir-la-haut_<Albert Maillard-5014>_133676,solutions qui s' offraient et comprit que sa femme représentait
Lemaitre-Pierre_Au-revoir-la-haut_<Albert Maillard-5014>_133678,s' offraient et comprit que sa femme représentait sa seule
Lemaitre-Pierre_Au-revoir-la-haut_<Albert Maillard-5014>_133681,comprit que sa femme représentait sa seule planche de salut
Lemaitre-Pierre_Au-revoir-la-haut_<Albert Maillard-5014>_133687,seule planche de salut . Il adopta la mine qu'
Lemaitre-Pierre_Au-revoir-la-haut_<Albert Maillard-5014>_133692,"Il adopta la mine qu' il détestait le plus ,"
Lemaitre-Pierre_Au-revoir-la-haut_<Albert Maillard-5014>_133698,"détestait le plus , qui lui correspondait le moins ,"
Lemaitre-Pierre_Au-revoir-la-haut_<Albert Maillard-5014>_133712,"dépassé par les événements , il poussa un long soupir"
Lemaitre-Pierre_Au-revoir-la-haut_<Albert Maillard-5014>_133721,"soupir de découragement et s' effondra dans un fauteuil ,"
Lemaitre-Pierre_Au-revoir-la-haut_<Albert Maillard-5014>_133758,prise sur elle . Mais il était le père de
Lemaitre-Pierre_Au-revoir-la-haut_<Albert Maillard-5014>_133760,elle . Mais il était le père de son enfant
Lemaitre-Pierre_Au-revoir-la-haut_<Albert Maillard-5014>_133763,"il était le père de son enfant , ils étaient"
Lemaitre-Pierre_Au-revoir-la-haut_<Albert Maillard-5014>_133798,"n' avait pas besoin d' Henri , mais un mari"
Lemaitre-Pierre_Au-revoir-la-haut_<Albert Maillard-5014>_133826,"– Les affaires , répondit - il de manière évasive"
Lemaitre-Pierre_Au-revoir-la-haut_<Albert Maillard-5014>_133843,M . Péricourt . Lorsqu' il ne voulait pas expliquer
Lemaitre-Pierre_Au-revoir-la-haut_<Albert Maillard-5014>_133849,"ne voulait pas expliquer , il disait : « Ce"
Lemaitre-Pierre_Au-revoir-la-haut_<Albert Maillard-5014>_133876,"Rien de plus pratique . Henri releva la tête ,"
Lemaitre-Pierre_Au-revoir-la-haut_<Albert Maillard-5014>_133881,"Henri releva la tête , pinça les lèvres , Madeleine"
Lemaitre-Pierre_Au-revoir-la-haut_<Albert Maillard-5014>_133886,"pinça les lèvres , Madeleine le trouvait toujours très beau"
Lemaitre-Pierre_Au-revoir-la-haut_<Albert Maillard-5014>_133893,"toujours très beau . Comme il l' espérait , elle"
Lemaitre-Pierre_Au-revoir-la-haut_<Albert Maillard-5014>_133914,approchant . Mais encore ? Il se résolut à un
Lemaitre-Pierre_Au-revoir-la-haut_<Albert Maillard-5014>_133938,– J' aurais besoin de ton père … – Pour
Lemaitre-Pierre_Au-revoir-la-haut_<Albert Maillard-5014>_133950,"s' enquit - elle . Henri balaya l' air ,"
Lemaitre-Pierre_Au-revoir-la-haut_<Albert Maillard-5014>_133961,"serait trop compliqué … – Je vois , fit -"
Lemaitre-Pierre_Au-revoir-la-haut_<Albert Maillard-5014>_133973,"souriant . Trop compliqué pour m' expliquer , mais assez"
Lemaitre-Pierre_Au-revoir-la-haut_<Albert Maillard-5014>_133980,", mais assez simple pour me demander d' intervenir …"
Lemaitre-Pierre_Au-revoir-la-haut_<Albert Maillard-5014>_133985,"me demander d' intervenir … Henri , en homme écrasé"
Lemaitre-Pierre_Au-revoir-la-haut_<Albert Maillard-5014>_133999,"répondit par un regard qu' il savait émouvant , qu'"
Lemaitre-Pierre_Au-revoir-la-haut_<Albert Maillard-5014>_134004,"il savait émouvant , qu' il utilisait fréquemment pour séduire"
Lemaitre-Pierre_Au-revoir-la-haut_<Albert Maillard-5014>_134010,utilisait fréquemment pour séduire . Il lui en avait rapporté
Lemaitre-Pierre_Au-revoir-la-haut_<Albert Maillard-5014>_134029,"… Si Madeleine insistait , Henri lui mentirait de nouveau"
Lemaitre-Pierre_Au-revoir-la-haut_<Albert Maillard-5014>_134036,"mentirait de nouveau parce qu' il mentait en permanence ,"
Lemaitre-Pierre_Au-revoir-la-haut_<Albert Maillard-5014>_134050,"inutile , c' était dans sa nature . Elle posa"
Lemaitre-Pierre_Au-revoir-la-haut_<Albert Maillard-5014>_134063,"sa joue . Même quand il trichait , il était"
Lemaitre-Pierre_Au-revoir-la-haut_<Albert Maillard-5014>_134066,"Même quand il trichait , il était beau , le"
Lemaitre-Pierre_Au-revoir-la-haut_<Albert Maillard-5014>_134074,", le simulacre du désarroi le rajeunissait , soulignait la"
Lemaitre-Pierre_Au-revoir-la-haut_<Albert Maillard-5014>_134081,", soulignait la finesse de ses traits . Madeleine resta"
Lemaitre-Pierre_Au-revoir-la-haut_<Albert Maillard-5014>_134106,"les débuts , elle ne l' avait pas choisi pour"
Lemaitre-Pierre_Au-revoir-la-haut_<Albert Maillard-5014>_134111,l' avait pas choisi pour sa conversation . Mais depuis
Lemaitre-Pierre_Au-revoir-la-haut_<Albert Maillard-5014>_134121,"sa grossesse , ce qu' il disait flottait dans l'"
Lemaitre-Pierre_Au-revoir-la-haut_<Albert Maillard-5014>_134137,". Ainsi , tandis qu' il jouait ce simulacre de"
Lemaitre-Pierre_Au-revoir-la-haut_<Albert Maillard-5014>_134148,", de bouleversement – elle l' espérait plus adroit avec"
Lemaitre-Pierre_Au-revoir-la-haut_<Albert Maillard-5014>_134153,"l' espérait plus adroit avec ses maîtresses – , elle"
Lemaitre-Pierre_Au-revoir-la-haut_<Albert Maillard-5014>_134158,"ses maîtresses – , elle l' observait avec une tendresse"
Lemaitre-Pierre_Au-revoir-la-haut_<Albert Maillard-5014>_134176,les enfants des autres . Il était beau . Elle
Lemaitre-Pierre_Au-revoir-la-haut_<Albert Maillard-5014>_134187,"bien avoir un fils comme lui . Moins menteur ,"
Lemaitre-Pierre_Au-revoir-la-haut_<Édouard-5869>_153214,"tête de cheval dessinée par Édouard , dont il n'"
Lemaitre-Pierre_Au-revoir-la-haut_<Édouard-5869>_153306,inquiète pas ! avait écrit Édouard . Plus c' est
Lemaitre-Pierre_Au-revoir-la-haut_<Édouard-5869>_153340,monde lui fait confiance . Il avait éclaté de l'
Lemaitre-Pierre_Au-revoir-la-haut_<Édouard-5869>_153377,"Mais maintenant , depuis qu' Édouard , sous son vrai"
Lemaitre-Pierre_Au-revoir-la-haut_<Édouard-5869>_153380,"depuis qu' Édouard , sous son vrai - faux nom"
Lemaitre-Pierre_Au-revoir-la-haut_<Édouard-5869>_153392,"Larivière , était descendu commettre ses excentricités dans un grand"
Lemaitre-Pierre_Au-revoir-la-haut_<Édouard-5869>_153399,"dans un grand hôtel , il comptait les heures et"
Lemaitre-Pierre_Au-revoir-la-haut_<Édouard-5869>_153458,"Ce soir - là , ses dernières minutes dans le"
Lemaitre-Pierre_Au-revoir-la-haut_<Édouard-5869>_153478,"un accouchement , chaque pas lui coûta , puis ,"
