,text_surronding
Lemaitre-Pierre_Au-revoir-la-haut_<Albert-165>_6354,"il le tuera . Ça lui donne du courage ,"
Lemaitre-Pierre_Au-revoir-la-haut_<Albert-165>_6366,de buter cet enculé . Il s' arrête un instant
Lemaitre-Pierre_Au-revoir-la-haut_<Albert-165>_6393,n' ont pas réussi à le tuer et c' est
Lemaitre-Pierre_Au-revoir-la-haut_<Albert-165>_6408,le faire . Merde . Albert s' agenouille et ouvre
Lemaitre-Pierre_Au-revoir-la-haut_<Albert-165>_6412,. Albert s' agenouille et ouvre son sac . Il
Lemaitre-Pierre_Au-revoir-la-haut_<Albert-165>_6413,Albert s' agenouille et ouvre son sac . Il sort
Lemaitre-Pierre_Au-revoir-la-haut_<Albert-165>_6416,"et ouvre son sac . Il sort tout , pose"
Lemaitre-Pierre_Au-revoir-la-haut_<Albert-165>_6420,". Il sort tout , pose son quart entre ses"
Lemaitre-Pierre_Au-revoir-la-haut_<Albert-165>_6421,"Il sort tout , pose son quart entre ses jambes"
Lemaitre-Pierre_Au-revoir-la-haut_<Albert-165>_6424,", pose son quart entre ses jambes ; il va"
Lemaitre-Pierre_Au-revoir-la-haut_<Albert-165>_6427,quart entre ses jambes ; il va étendre sa capote
Lemaitre-Pierre_Au-revoir-la-haut_<Albert-165>_6430,jambes ; il va étendre sa capote contre la paroi
Lemaitre-Pierre_Au-revoir-la-haut_<Albert-165>_6444,la terre tout ce qu' il a sous la main
Lemaitre-Pierre_Au-revoir-la-haut_<Albert-165>_6454,"pour servir de crampon , il se tourne et c'"
Lemaitre-Pierre_Au-revoir-la-haut_<Albert-165>_6480,"mètres au - dessus de lui . Soudain inquiet ,"
Lemaitre-Pierre_Au-revoir-la-haut_<Albert-165>_6485,"lui . Soudain inquiet , Albert lève la tête ."
Lemaitre-Pierre_Au-revoir-la-haut_<Albert-165>_6494,". Depuis quatre ans , il a appris à distinguer"
Lemaitre-Pierre_Au-revoir-la-haut_<Albert-165>_6524,"Sur celui - là , il hésite . Ce doit"
Lemaitre-Pierre_Au-revoir-la-haut_<Albert-165>_6581,surpuissante . Le cerveau d' Albert a juste le temps
Lemaitre-Pierre_Au-revoir-la-haut_<Albert-165>_6628,"secousse , surpris aussi , Albert regarde en l' air"
Lemaitre-Pierre_Au-revoir-la-haut_<Albert-165>_6660,"mètres au - dessus de lui , il voit se"
Lemaitre-Pierre_Au-revoir-la-haut_<Albert-165>_6662,"- dessus de lui , il voit se dérouler ,"
Lemaitre-Pierre_Au-revoir-la-haut_<Albert-165>_6686,et sinueuse ploie lentement dans sa direction et s' apprête
Lemaitre-Pierre_Au-revoir-la-haut_<Albert-165>_6694,s' apprête à descendre vers lui pour l' enlacer .
Lemaitre-Pierre_Au-revoir-la-haut_<Albert-165>_6696,à descendre vers lui pour l' enlacer . Une pluie
Lemaitre-Pierre_Au-revoir-la-haut_<Albert-165>_6720,débris de toutes sortes annonce son arrivée imminente . Albert
Lemaitre-Pierre_Au-revoir-la-haut_<Albert-165>_6724,annonce son arrivée imminente . Albert se recroqueville et bloque
Lemaitre-Pierre_Au-revoir-la-haut_<Albert-165>_6728,. Albert se recroqueville et bloque sa respiration . Ce
Lemaitre-Pierre_Au-revoir-la-haut_<Albert-165>_6729,Albert se recroqueville et bloque sa respiration . Ce n'
Lemaitre-Pierre_Au-revoir-la-haut_<Albert-165>_6773,trois secondes suspendues pendant lesquelles Albert fixe le rideau de
Lemaitre-Pierre_Au-revoir-la-haut_<Albert-165>_6785,flotte dans le ciel et semble hésiter sur le moment
Lemaitre-Pierre_Au-revoir-la-haut_<Albert-165>_6807,nappe va s' écraser sur lui et le recouvrir .
Lemaitre-Pierre_Au-revoir-la-haut_<Albert-165>_6809,s' écraser sur lui et le recouvrir . En temps
Lemaitre-Pierre_Au-revoir-la-haut_<Albert-165>_6816,". En temps normal , Albert ressemble assez , pour"
Lemaitre-Pierre_Au-revoir-la-haut_<Albert-165>_6830,un portrait du Tintoret . Il a toujours eu des
Lemaitre-Pierre_Au-revoir-la-haut_<Albert-165>_6869,"à cet instant , comme il a le regard tourné"
Lemaitre-Pierre_Au-revoir-la-haut_<Albert-165>_6879,vers le ciel et qu' il voit la mort approcher
Lemaitre-Pierre_Au-revoir-la-haut_<Albert-165>_6885,"voit la mort approcher , il ressemble plutôt à un"
Lemaitre-Pierre_Au-revoir-la-haut_<Albert-165>_6893,à un saint Sébastien . Ses traits se sont brusquement
Lemaitre-Pierre_Au-revoir-la-haut_<Albert-165>_6901,"sont brusquement tirés , tout son visage est plissé par"
Lemaitre-Pierre_Au-revoir-la-haut_<Albert-165>_6924,autant plus inutile que de son vivant Albert n' a
Lemaitre-Pierre_Au-revoir-la-haut_<Albert-165>_6926,inutile que de son vivant Albert n' a jamais cru
Lemaitre-Pierre_Au-revoir-la-haut_<Albert-165>_6942,pas avec la poisse qui lui arrive qu' il va
Lemaitre-Pierre_Au-revoir-la-haut_<Albert-165>_6945,poisse qui lui arrive qu' il va se mettre à
Lemaitre-Pierre_Au-revoir-la-haut_<Albert-165>_6957,quelque chose . Même s' il en avait le temps
Lemaitre-Pierre_Au-revoir-la-haut_<Albert-165>_6973,la nappe s' abat sur lui . On aurait pu
Lemaitre-Pierre_Au-revoir-la-haut_<Albert-165>_6984,attendre à un choc qui l' aurait tué tout net
Lemaitre-Pierre_Au-revoir-la-haut_<Albert-165>_6990,"aurait tué tout net , Albert serait mort et voilà"
Lemaitre-Pierre_Au-revoir-la-haut_<Albert-165>_7011,et les pierres continuent de lui tomber dessus en grêle
Lemaitre-Pierre_Au-revoir-la-haut_<Albert-165>_7034,lourde . Le corps d' Albert est collé au sol
Lemaitre-Pierre_Au-revoir-la-haut_<Albert-165>_7053,"entasse au - dessus de lui , il est immobilisé"
Lemaitre-Pierre_Au-revoir-la-haut_<Albert-165>_7055,"- dessus de lui , il est immobilisé , compressé"
Lemaitre-Pierre_Au-revoir-la-haut_<Albert-165>_7095,". La première chose qui le frappe , juste avant"
Lemaitre-Pierre_Au-revoir-la-haut_<Albert-165>_7135,". Bien sûr , s' il y prêtait un peu"
Lemaitre-Pierre_Au-revoir-la-haut_<Albert-165>_7142,"prêtait un peu attention , il comprendrait que rien ne"
Lemaitre-Pierre_Au-revoir-la-haut_<Albert-165>_7154,"arrêté , que le son lui arrive seulement filtré ,"
Lemaitre-Pierre_Au-revoir-la-haut_<Albert-165>_7166,le volume de terre qui l' enserre et le recouvre
Lemaitre-Pierre_Au-revoir-la-haut_<Albert-165>_7169,"terre qui l' enserre et le recouvre , quasiment inaudible"
Lemaitre-Pierre_Au-revoir-la-haut_<Albert-165>_7180,"Mais pour le moment , Albert a bien d' autres"
Lemaitre-Pierre_Au-revoir-la-haut_<Albert-165>_7200,"guerre continue parce que pour lui , ce qui compte"
Lemaitre-Pierre_Au-revoir-la-haut_<Albert-165>_7225,"fracas s' est estompé , Albert est saisi . Je"
Lemaitre-Pierre_Au-revoir-la-haut_<Albert-165>_7237,"la terre , se dit - il ; ce n'"
Lemaitre-Pierre_Au-revoir-la-haut_<Albert-165>_7253,"abstraite . C' est quand il se dit , je"
Lemaitre-Pierre_Au-revoir-la-haut_<Albert-165>_7257,"quand il se dit , je suis enterré vivant ,"
Lemaitre-Pierre_Au-revoir-la-haut_<Albert-165>_7273,terriblement concret . Et lorsqu' il mesure l' étendue de
Lemaitre-Pierre_Au-revoir-la-haut_<Albert-165>_7286,"le genre de mort qui l' attend , quand il"
Lemaitre-Pierre_Au-revoir-la-haut_<Albert-165>_7290,"qui l' attend , quand il comprend qu' il va"
Lemaitre-Pierre_Au-revoir-la-haut_<Albert-165>_7293,", quand il comprend qu' il va mourir étouffé ,"
Lemaitre-Pierre_Au-revoir-la-haut_<Albert-165>_7300,"mourir étouffé , asphyxié , Albert devient fou , instantanément"
Lemaitre-Pierre_Au-revoir-la-haut_<Albert-165>_7310,", totalement fou . Dans sa tête , tout se"
Lemaitre-Pierre_Au-revoir-la-haut_<Albert-165>_7317,", tout se brouille , il hurle , et ,"
Lemaitre-Pierre_Au-revoir-la-haut_<Albert-165>_7327,"dans ce cri inutile , il gaspille le peu d'"
Lemaitre-Pierre_Au-revoir-la-haut_<Albert-165>_7334,le peu d' oxygène qui lui reste . Je suis
Lemaitre-Pierre_Au-revoir-la-haut_<Albert-165>_7337,"oxygène qui lui reste . Je suis enterré , se"
Lemaitre-Pierre_Au-revoir-la-haut_<Albert-165>_7345,", se répète - t - il en boucle ,"
Lemaitre-Pierre_Au-revoir-la-haut_<Albert-165>_7351,"il en boucle , et son esprit s' engouffre dans"
Lemaitre-Pierre_Au-revoir-la-haut_<Albert-165>_7362,effroyable évidence au point qu' il n' a même pas
Lemaitre-Pierre_Au-revoir-la-haut_<Albert-165>_7377,"yeux . Tout ce qu' il fait , c' est"
Lemaitre-Pierre_Au-revoir-la-haut_<Albert-165>_7392,"sens . Tout ce qui lui reste de force ,"
Lemaitre-Pierre_Au-revoir-la-haut_<Albert-165>_7402,"tout ce qui monte en lui de panique , se"
Lemaitre-Pierre_Au-revoir-la-haut_<Albert-165>_7412,"transforme en effort musculaire . Il dépense , à se"
Lemaitre-Pierre_Au-revoir-la-haut_<Albert-165>_7431,"vain . Et soudain , il s' arrête . Parce"
Lemaitre-Pierre_Au-revoir-la-haut_<Albert-165>_7437,s' arrête . Parce qu' il vient de comprendre qu'
Lemaitre-Pierre_Au-revoir-la-haut_<Albert-165>_7442,il vient de comprendre qu' il bouge les mains .
Lemaitre-Pierre_Au-revoir-la-haut_<Albert-165>_7451,". Très peu , mais il les bouge . Il"
Lemaitre-Pierre_Au-revoir-la-haut_<Albert-165>_7455,mais il les bouge . Il retient sa respiration .
Lemaitre-Pierre_Au-revoir-la-haut_<Albert-165>_7457,les bouge . Il retient sa respiration . En tombant
Lemaitre-Pierre_Au-revoir-la-haut_<Albert-165>_7493,. Le monde dans lequel il est comme pétrifié lui
Lemaitre-Pierre_Au-revoir-la-haut_<Albert-165>_7497,lequel il est comme pétrifié lui a concédé quelques centimètres
Lemaitre-Pierre_Au-revoir-la-haut_<Albert-165>_7509,"là . En fait , il n' y a pas"
Lemaitre-Pierre_Au-revoir-la-haut_<Albert-165>_7521,terre au - dessus de lui . Albert le sait
Lemaitre-Pierre_Au-revoir-la-haut_<Albert-165>_7523,- dessus de lui . Albert le sait . Quoi
Lemaitre-Pierre_Au-revoir-la-haut_<Albert-165>_7536,peut - être . Mais il est allongé dessous et
Lemaitre-Pierre_Au-revoir-la-haut_<Albert-165>_7546,"cette couche est suffisante pour le paralyser , empêcher tout"
Lemaitre-Pierre_Au-revoir-la-haut_<Albert-165>_7553,", empêcher tout mouvement et le condamner . Tout autour"
Lemaitre-Pierre_Au-revoir-la-haut_<Albert-165>_7559,"condamner . Tout autour de lui , la terre tremble"
Lemaitre-Pierre_Au-revoir-la-haut_<Albert-165>_7586,"ébranler la terre , de la secouer . Albert ouvre"
Lemaitre-Pierre_Au-revoir-la-haut_<Albert-165>_7589,", de la secouer . Albert ouvre les yeux ,"
Lemaitre-Pierre_Au-revoir-la-haut_<Albert-165>_7633,peine de la vie . Il se contraint à respirer
Lemaitre-Pierre_Au-revoir-la-haut_<Albert-165>_7642,respirer par petites saccades . Il écarte les coudes de
Lemaitre-Pierre_Au-revoir-la-haut_<Albert-165>_7650,"coudes de quelques centimètres , parvient à étendre un peu"
Lemaitre-Pierre_Au-revoir-la-haut_<Albert-165>_7678,"cesse contre la panique qui le gagne , il tente"
Lemaitre-Pierre_Au-revoir-la-haut_<Albert-165>_7681,"panique qui le gagne , il tente de dégager son"
Lemaitre-Pierre_Au-revoir-la-haut_<Albert-165>_7685,", il tente de dégager son visage pour respirer ."
Lemaitre-Pierre_Au-revoir-la-haut_<Albert-165>_7703,"une bulle qui éclate . Son réflexe est instantané ,"
Lemaitre-Pierre_Au-revoir-la-haut_<Albert-165>_7709,"réflexe est instantané , tous ses muscles se tendent ,"
Lemaitre-Pierre_Au-revoir-la-haut_<Albert-165>_7714,"ses muscles se tendent , son corps se recroqueville ."
Lemaitre-Pierre_Au-revoir-la-haut_<Albert-165>_7733,"de temps reste - t - il ainsi , dans"
Lemaitre-Pierre_Au-revoir-la-haut_<Albert-165>_7810,"par millimètre , tandis qu' il s' efforce de respirer"
Lemaitre-Pierre_Au-revoir-la-haut_<Albert-165>_7831,"pas se voir tel qu' il est , il avance"
Lemaitre-Pierre_Au-revoir-la-haut_<Albert-165>_7834,"tel qu' il est , il avance la main ,"
Lemaitre-Pierre_Au-revoir-la-haut_<Albert-165>_7839,"il avance la main , palpe devant lui . Il"
Lemaitre-Pierre_Au-revoir-la-haut_<Albert-165>_7841,"la main , palpe devant lui . Il sent alors"
Lemaitre-Pierre_Au-revoir-la-haut_<Albert-165>_7843,", palpe devant lui . Il sent alors quelque chose"
Lemaitre-Pierre_Au-revoir-la-haut_<Albert-165>_7849,"sent alors quelque chose sous ses doigts , la lueur"
Lemaitre-Pierre_Au-revoir-la-haut_<Albert-165>_7869,pas de distinguer ce qui l' entoure . Ses doigts
Lemaitre-Pierre_Au-revoir-la-haut_<Albert-165>_7872,ce qui l' entoure . Ses doigts touchent quelque chose
Lemaitre-Pierre_Au-revoir-la-haut_<Albert-165>_7899,", avec du grain . Il met du temps à"
Lemaitre-Pierre_Au-revoir-la-haut_<Albert-165>_7914,"agit . À mesure qu' il accommode , il discerne"
Lemaitre-Pierre_Au-revoir-la-haut_<Albert-165>_7917,"mesure qu' il accommode , il discerne ce qu' il"
Lemaitre-Pierre_Au-revoir-la-haut_<Albert-165>_7921,", il discerne ce qu' il a en face de"
Lemaitre-Pierre_Au-revoir-la-haut_<Albert-165>_7926,il a en face de lui : deux gigantesques babines
Lemaitre-Pierre_Au-revoir-la-haut_<Albert-165>_7964,"repoussante , une monstruosité . Albert ne peut réprimer un"
Lemaitre-Pierre_Au-revoir-la-haut_<Albert-165>_7974,violent mouvement de recul . Son crâne cogne contre la
Lemaitre-Pierre_Au-revoir-la-haut_<Albert-165>_7989,"s' écroule de nouveau , lui inonde le cou ,"
Lemaitre-Pierre_Au-revoir-la-haut_<Albert-165>_7994,"lui inonde le cou , il monte les épaules pour"
Lemaitre-Pierre_Au-revoir-la-haut_<Albert-165>_8002,"épaules pour se protéger , cesse de bouger , de"
Lemaitre-Pierre_Au-revoir-la-haut_<Albert-165>_8009,"bouger , de respirer . Laisse passer les secondes ."
Lemaitre-Pierre_Au-revoir-la-haut_<Albert-165>_8045,en livrer une tête à Albert . Les voici face
Lemaitre-Pierre_Au-revoir-la-haut_<Albert-165>_8053,"voici face à face , le jeune homme et le"
Lemaitre-Pierre_Au-revoir-la-haut_<Albert-165>_8071,L' effondrement a permis à Albert de dégager ses mains
Lemaitre-Pierre_Au-revoir-la-haut_<Albert-165>_8074,"permis à Albert de dégager ses mains , mais le"
Lemaitre-Pierre_Au-revoir-la-haut_<Albert-165>_8091,"très lourd , ça comprime sa cage thoracique . Il"
Lemaitre-Pierre_Au-revoir-la-haut_<Albert-165>_8095,comprime sa cage thoracique . Il reprend doucement une respiration
Lemaitre-Pierre_Au-revoir-la-haut_<Albert-165>_8102,"doucement une respiration saccadée , ses poumons n' en peuvent"
Lemaitre-Pierre_Au-revoir-la-haut_<Albert-165>_8116,larmes commencent à monter qu' il parvient à réprimer .
Lemaitre-Pierre_Au-revoir-la-haut_<Albert-165>_8121,il parvient à réprimer . Il se dit que pleurer
Lemaitre-Pierre_Au-revoir-la-haut_<Albert-165>_8133,est accepter de mourir . Il ferait mieux de se
Lemaitre-Pierre_Au-revoir-la-haut_<Albert-165>_8183,"Et de vieilles encore . Son père , dont le"
Lemaitre-Pierre_Au-revoir-la-haut_<Albert-165>_8197,", si précis , qu' il jurerait qu' il est"
Lemaitre-Pierre_Au-revoir-la-haut_<Albert-165>_8208,", sous la terre avec lui . C' est sans"
Lemaitre-Pierre_Au-revoir-la-haut_<Albert-165>_8222,"vont s' y retrouver . Il le voit jeune ,"
Lemaitre-Pierre_Au-revoir-la-haut_<Albert-165>_8231,", au même âge que lui . Trente ans et"
Lemaitre-Pierre_Au-revoir-la-haut_<Albert-165>_8248,les poussières qui comptent . Il porte son uniforme du
Lemaitre-Pierre_Au-revoir-la-haut_<Albert-165>_8250,"qui comptent . Il porte son uniforme du musée ,"
Lemaitre-Pierre_Au-revoir-la-haut_<Albert-165>_8255,"son uniforme du musée , il a ciré sa moustache"
Lemaitre-Pierre_Au-revoir-la-haut_<Albert-165>_8258,"musée , il a ciré sa moustache , il ne"
Lemaitre-Pierre_Au-revoir-la-haut_<Albert-165>_8261,"a ciré sa moustache , il ne sourit pas ,"
Lemaitre-Pierre_Au-revoir-la-haut_<Albert-165>_8273,la photographie du buffet . Albert manque d' air .
Lemaitre-Pierre_Au-revoir-la-haut_<Albert-165>_8278,Albert manque d' air . Ses poumons lui font mal
Lemaitre-Pierre_Au-revoir-la-haut_<Albert-165>_8280,"d' air . Ses poumons lui font mal , des"
Lemaitre-Pierre_Au-revoir-la-haut_<Albert-165>_8287,"mal , des mouvements convulsifs le saisissent . Il voudrait"
Lemaitre-Pierre_Au-revoir-la-haut_<Albert-165>_8290,mouvements convulsifs le saisissent . Il voudrait réfléchir . Rien
Lemaitre-Pierre_Au-revoir-la-haut_<Albert-165>_8311,terrible frayeur de la mort lui remonte des entrailles .
Lemaitre-Pierre_Au-revoir-la-haut_<Albert-165>_8320,. Les larmes coulent malgré lui . Mme Maillard le
Lemaitre-Pierre_Au-revoir-la-haut_<Albert-165>_8324,malgré lui . Mme Maillard le fixe d' un regard
Lemaitre-Pierre_Au-revoir-la-haut_<Albert-165>_8332,"un regard réprobateur , décidément Albert ne saura jamais s'"
Lemaitre-Pierre_Au-revoir-la-haut_<Albert-165>_8393,"mort ! C' est tout lui , ça , Albert"
Lemaitre-Pierre_Au-revoir-la-haut_<Albert-165>_8397,"tout lui , ça , Albert , jamais comme les"
Lemaitre-Pierre_Au-revoir-la-haut_<Albert-165>_8415,"De toute façon , s' il n' était pas mort"
Lemaitre-Pierre_Au-revoir-la-haut_<Albert-165>_8426,"la guerre , que serait - il devenu , ce"
Lemaitre-Pierre_Au-revoir-la-haut_<Albert-165>_8430,"serait - il devenu , ce garçon ? Mme Maillard"
Lemaitre-Pierre_Au-revoir-la-haut_<Albert-165>_8435,ce garçon ? Mme Maillard lui sourit enfin . Avec
Lemaitre-Pierre_Au-revoir-la-haut_<Albert-165>_8440,"lui sourit enfin . Avec Albert mort , il y"
Lemaitre-Pierre_Au-revoir-la-haut_<Albert-165>_8464,"mal . Le visage d' Albert est presque bleu ,"
Lemaitre-Pierre_Au-revoir-la-haut_<Albert-165>_8469,"Albert est presque bleu , ses tempes battent à une"
Lemaitre-Pierre_Au-revoir-la-haut_<Albert-165>_8486,"les veines vont éclater . Il appelle Cécile , il"
Lemaitre-Pierre_Au-revoir-la-haut_<Albert-165>_8490,". Il appelle Cécile , il voudrait se retrouver entre"
Lemaitre-Pierre_Au-revoir-la-haut_<Albert-165>_8495,"il voudrait se retrouver entre ses jambes , serré à"
Lemaitre-Pierre_Au-revoir-la-haut_<Albert-165>_8515,"ne remontent pas jusqu' à lui , comme si elle"
Lemaitre-Pierre_Au-revoir-la-haut_<Albert-165>_8524,elle était trop loin pour lui parvenir et c' est
Lemaitre-Pierre_Au-revoir-la-haut_<Albert-165>_8531,et c' est ça qui lui fait le plus mal
Lemaitre-Pierre_Au-revoir-la-haut_<Albert-165>_8549,"instant , qu' elle ne l' accompagne pas . Il"
Lemaitre-Pierre_Au-revoir-la-haut_<Albert-165>_8569,que le monde dans lequel il s' enfonce n' a
Lemaitre-Pierre_Au-revoir-la-haut_<Albert-165>_8582,", que des mots . Il voudrait la supplier de"
Lemaitre-Pierre_Au-revoir-la-haut_<Albert-165>_8589,"la supplier de venir avec lui , il a épouvantablement"
Lemaitre-Pierre_Au-revoir-la-haut_<Albert-165>_8591,"de venir avec lui , il a épouvantablement peur de"
Lemaitre-Pierre_Au-revoir-la-haut_<Albert-165>_8603,"Or c' est inutile , il va mourir seul ,"
Lemaitre-Pierre_Au-revoir-la-haut_<Albert-165>_8621,"revoir là - haut , ma Cécile , dans longtemps"
Lemaitre-Pierre_Au-revoir-la-haut_<Albert-165>_8652,avec son insupportable sourire . Albert gesticule en tous sens
Lemaitre-Pierre_Au-revoir-la-haut_<Albert-165>_8658,gesticule en tous sens . Ses poumons se remplissent de
Lemaitre-Pierre_Au-revoir-la-haut_<Albert-165>_8670,"moins , ça siffle quand il force . Il se"
Lemaitre-Pierre_Au-revoir-la-haut_<Albert-165>_8673,siffle quand il force . Il se met à tousser
Lemaitre-Pierre_Au-revoir-la-haut_<Albert-165>_8679,"se met à tousser , il serre le ventre ."
Lemaitre-Pierre_Au-revoir-la-haut_<Albert-165>_8688,. Plus d' air . Il agrippe la tête de
Lemaitre-Pierre_Au-revoir-la-haut_<Albert-165>_8695,"la tête de cheval , parvient à saisir les grasses"
Lemaitre-Pierre_Au-revoir-la-haut_<Albert-165>_8707,"la chair se dérobe sous ses doigts , il attrape"
Lemaitre-Pierre_Au-revoir-la-haut_<Albert-165>_8710,"dérobe sous ses doigts , il attrape les grandes dents"
Lemaitre-Pierre_Au-revoir-la-haut_<Albert-165>_8723,"dans un effort surhumain , écarte la bouche qui exhale"
Lemaitre-Pierre_Au-revoir-la-haut_<Albert-165>_8732,exhale un souffle putride qu' Albert respire à pleins poumons
Lemaitre-Pierre_Au-revoir-la-haut_<Albert-165>_8738,respire à pleins poumons . Il gagne ainsi quelques secondes
Lemaitre-Pierre_Au-revoir-la-haut_<Albert-165>_8746,"quelques secondes de survie , son estomac se révulse ,"
Lemaitre-Pierre_Au-revoir-la-haut_<Albert-165>_8751,"son estomac se révulse , il vomit , son corps"
Lemaitre-Pierre_Au-revoir-la-haut_<Albert-165>_8754,"révulse , il vomit , son corps tout entier est"
Lemaitre-Pierre_Au-revoir-la-haut_<Albert-165>_8766,"secoué de tremblements , mais tente de se retourner sur"
Lemaitre-Pierre_Au-revoir-la-haut_<Albert-165>_8771,tente de se retourner sur lui - même à la
Lemaitre-Pierre_Au-revoir-la-haut_<Albert-165>_8825,plus rien n' entre en lui . Rien . Seulement
Lemaitre-Pierre_Au-revoir-la-haut_<Albert-165>_8837,. Puis une grande paix l' envahit . Il ferme
Lemaitre-Pierre_Au-revoir-la-haut_<Albert-165>_8840,grande paix l' envahit . Il ferme les yeux .
Lemaitre-Pierre_Au-revoir-la-haut_<Albert-165>_8845,Il ferme les yeux . Il est pris d' un
Lemaitre-Pierre_Au-revoir-la-haut_<Albert-165>_8852,"pris d' un malaise , son cœur s' effondre ,"
Lemaitre-Pierre_Au-revoir-la-haut_<Albert-165>_8857,"son cœur s' effondre , sa raison s' éteint ,"
Lemaitre-Pierre_Au-revoir-la-haut_<Albert-165>_8862,"sa raison s' éteint , il sombre . Albert Maillard"
Lemaitre-Pierre_Au-revoir-la-haut_<Albert-165>_8865,"éteint , il sombre . Albert Maillard , soldat ,"
Lemaitre-Pierre_Au-revoir-la-haut_<Albert-165>_8944,"Ce n' était pas qu' il fût spécialement héroïque ,"
Lemaitre-Pierre_Au-revoir-la-haut_<Albert-165>_8950,"fût spécialement héroïque , mais il avait acquis très vite"
Lemaitre-Pierre_Au-revoir-la-haut_<Albert-165>_8958,très vite la conviction qu' il ne mourrait pas ici
Lemaitre-Pierre_Au-revoir-la-haut_<Albert-165>_8964,"ne mourrait pas ici . Il en était certain ,"
Lemaitre-Pierre_Au-revoir-la-haut_<Albert-165>_8976,"n' était pas destinée à le tuer , mais à"
Lemaitre-Pierre_Au-revoir-la-haut_<Albert-165>_8981,"le tuer , mais à lui offrir des opportunités ."
Lemaitre-Pierre_Au-revoir-la-haut_<Albert-165>_8995,"de la cote 113 , sa détermination féroce tenait ,"
Lemaitre-Pierre_Au-revoir-la-haut_<Albert-165>_9006,"sûr , à ce qu' il haïssait les Allemands au"
Lemaitre-Pierre_Au-revoir-la-haut_<Albert-165>_9036,l' issue et qu' il lui restait très peu de
Lemaitre-Pierre_Au-revoir-la-haut_<Albert-165>_9059,"exemplaire , pouvait prodiguer à un homme comme lui ."
Lemaitre-Pierre_Au-revoir-la-haut_<Albert-165>_9062,prodiguer à un homme comme lui . Albert et les
Lemaitre-Pierre_Au-revoir-la-haut_<Albert-165>_9073,soldats l' avaient pressenti : ce type avait tout du
Lemaitre-Pierre_Au-revoir-la-haut_<Albert-165>_9113,"De l' ancienne gloire de ses ancêtres , il n'"
Lemaitre-Pierre_Au-revoir-la-haut_<Albert-165>_9116,"gloire de ses ancêtres , il n' avait conservé que"
Lemaitre-Pierre_Au-revoir-la-haut_<Albert-165>_9136,"ruine , le prestige de son nom , un ou"
Lemaitre-Pierre_Au-revoir-la-haut_<Albert-165>_9164,qui frisait la fureur . Il vivait la précarité de
Lemaitre-Pierre_Au-revoir-la-haut_<Albert-165>_9169,Il vivait la précarité de sa situation comme une injustice
Lemaitre-Pierre_Au-revoir-la-haut_<Albert-165>_9175,situation comme une injustice et regagner son rang dans l'
Lemaitre-Pierre_Au-revoir-la-haut_<Albert-165>_9176,comme une injustice et regagner son rang dans l' échelle
Lemaitre-Pierre_Au-revoir-la-haut_<Albert-165>_9185,"échelle de l' aristocratie était son ambition fondamentale , une"
Lemaitre-Pierre_Au-revoir-la-haut_<Albert-165>_9194,une véritable obsession à laquelle il était prêt à tout
Lemaitre-Pierre_Au-revoir-la-haut_<Albert-165>_9201,prêt à tout sacrifier . Son père s' était tiré
Lemaitre-Pierre_Au-revoir-la-haut_<Albert-165>_9230,"légende soutenait sans fondement que sa mère , morte un"
Lemaitre-Pierre_Au-revoir-la-haut_<Albert-165>_9249,"Sans frère ni sœur , le lieutenant se trouvait être"
Lemaitre-Pierre_Au-revoir-la-haut_<Albert-165>_9254,le lieutenant se trouvait être le dernier Aulnay - Pradelle
Lemaitre-Pierre_Au-revoir-la-haut_<Albert-165>_9267,« fin de race » lui procurait un vif sentiment
Lemaitre-Pierre_Au-revoir-la-haut_<Albert-165>_9276,"sentiment d' urgence . Après lui , rien . L'"
Lemaitre-Pierre_Au-revoir-la-haut_<Albert-165>_9284,. L' interminable déchéance de son père l' avait convaincu
Lemaitre-Pierre_Au-revoir-la-haut_<Albert-165>_9286,interminable déchéance de son père l' avait convaincu très tôt
Lemaitre-Pierre_Au-revoir-la-haut_<Albert-165>_9299,de la famille reposait sur ses seules épaules et il
Lemaitre-Pierre_Au-revoir-la-haut_<Albert-165>_9303,sur ses seules épaules et il était certain de disposer
Lemaitre-Pierre_Au-revoir-la-haut_<Albert-165>_9323,. Ajoutez à cela qu' il était assez beau .
Lemaitre-Pierre_Au-revoir-la-haut_<Albert-165>_9347,"de même , les femmes le désiraient , les hommes"
Lemaitre-Pierre_Au-revoir-la-haut_<Albert-165>_9352,"le désiraient , les hommes le jalousaient , ce sont"
Lemaitre-Pierre_Au-revoir-la-haut_<Albert-165>_9391,. Et c' était exactement son avis et même son
Lemaitre-Pierre_Au-revoir-la-haut_<Albert-165>_9395,exactement son avis et même son unique projet . On
Lemaitre-Pierre_Au-revoir-la-haut_<Albert-165>_9403,. On comprend mieux pourquoi il s' était donné un
Lemaitre-Pierre_Au-revoir-la-haut_<Albert-165>_9469,plus fort que vous . Le lieutenant Pradelle n' était
Lemaitre-Pierre_Au-revoir-la-haut_<Albert-165>_9482,"ce genre de fixation mais lui aussi la désirait ,"
Lemaitre-Pierre_Au-revoir-la-haut_<Albert-165>_9493,"cote 113 , parce qu' il était en bas de"
Lemaitre-Pierre_Au-revoir-la-haut_<Albert-165>_9526,"se distinguer . Déjà , lieutenant en trois ans ,"
Lemaitre-Pierre_Au-revoir-la-haut_<Albert-165>_9556,capitaine à la démobilisation . Pradelle était assez content de
Lemaitre-Pierre_Au-revoir-la-haut_<Albert-165>_9561,Pradelle était assez content de lui . Pour motiver ses
Lemaitre-Pierre_Au-revoir-la-haut_<Albert-165>_9565,de lui . Pour motiver ses hommes à se lancer
Lemaitre-Pierre_Au-revoir-la-haut_<Albert-165>_9622,"avoir lancé l' attaque , il avait confié à un"
Lemaitre-Pierre_Au-revoir-la-haut_<Albert-165>_9636,conduire la première charge . Lui était resté légèrement en
Lemaitre-Pierre_Au-revoir-la-haut_<Albert-165>_9658,l' unité . Après quoi il pourrait remonter vers les
Lemaitre-Pierre_Au-revoir-la-haut_<Albert-165>_9671,dépasser tout le monde de sa grande foulée sportive et
Lemaitre-Pierre_Au-revoir-la-haut_<Albert-165>_9698,lui en offrir . Dès son premier coup de sifflet
