,text_surronding
Marceau-Felicien_Creezy_<ma Creezy-1405>_40025,pas dû aller loin . Je reprends ma voiture .
Marceau-Felicien_Creezy_<ma Creezy-1405>_40027,aller loin . Je reprends ma voiture . Le mieux
Marceau-Felicien_Creezy_<ma Creezy-1405>_40040,", serait d' attendre . Je ne peux pas attendre"
Marceau-Felicien_Creezy_<ma Creezy-1405>_40049,"attendre . Cette colère en moi , il me faut"
Marceau-Felicien_Creezy_<ma Creezy-1405>_40052,"colère en moi , il me faut la passer sur"
Marceau-Felicien_Creezy_<ma Creezy-1405>_40060,passer sur quelqu' un . Je ne peux la passer
Marceau-Felicien_Creezy_<ma Creezy-1405>_40072,"Creezy . En rentrant , j' annonce à Betty que"
Marceau-Felicien_Creezy_<ma Creezy-1405>_40077,j' annonce à Betty que je dois avancer mon départ
Marceau-Felicien_Creezy_<ma Creezy-1405>_40080,Betty que je dois avancer mon départ pour Rome .
Marceau-Felicien_Creezy_<ma Creezy-1405>_40096,"où , dix fois , je me suis levé ,"
Marceau-Felicien_Creezy_<ma Creezy-1405>_40101,"je me suis levé , je fonce vers Nice ."
Marceau-Felicien_Creezy_<ma Creezy-1405>_40117,"d' Avignon , l' idée m' effleure que Creezy a"
Marceau-Felicien_Creezy_<ma Creezy-1405>_40153,"emmenée ailleurs , bref que je vais peut - être"
Marceau-Felicien_Creezy_<ma Creezy-1405>_40174,. Tant mieux . Cela m' arrange que Creezy ait
Marceau-Felicien_Creezy_<ma Creezy-1405>_40188,"autoroute de l' Esterel , ma voiture lancée à cent"
Marceau-Felicien_Creezy_<ma Creezy-1405>_40195,"lancée à cent soixante , ma fureur un peu s'"
Marceau-Felicien_Creezy_<ma Creezy-1405>_40205,"apaise . De Creezy , j' aurai au moins gardé"
Marceau-Felicien_Creezy_<ma Creezy-1405>_40223,"l' aéroport , comme il me reste une heure avant"
Marceau-Felicien_Creezy_<ma Creezy-1405>_40228,"me reste une heure avant mon avion , j' achète"
Marceau-Felicien_Creezy_<ma Creezy-1405>_40231,"heure avant mon avion , j' achète un guide Michelin"
Marceau-Felicien_Creezy_<ma Creezy-1405>_40237,achète un guide Michelin et j' entreprends de téléphoner aux
Marceau-Felicien_Creezy_<ma Creezy-1405>_40257,". Au troisième , on me répond que Miss Creezy"
Marceau-Felicien_Creezy_<ma Creezy-1405>_40265,Miss Creezy est sortie . Je laisse un message .
Marceau-Felicien_Creezy_<ma Creezy-1405>_40271,laisse un message . A mon arrivée dans le hall
Marceau-Felicien_Creezy_<ma Creezy-1405>_40292,"vaste . Elle vient vers moi de loin , avec"
Marceau-Felicien_Creezy_<ma Creezy-1405>_40326,se retourner les gens . Je dis : « Et
Marceau-Felicien_Creezy_<ma Creezy-1405>_40336,ton télégramme ? » Elle me répond : « Je
Marceau-Felicien_Creezy_<ma Creezy-1405>_40371,n' y a rien . Me ment - elle ?
Marceau-Felicien_Creezy_<ma Creezy-1405>_40379,elle ? Veut - elle me cacher quelque chose ?
Marceau-Felicien_Creezy_<ma Creezy-1405>_40404,venger de la déception que je lui ai causée en
Marceau-Felicien_Creezy_<ma Creezy-1405>_40423,"très vite et , si je me les pose ,"
Marceau-Felicien_Creezy_<ma Creezy-1405>_40437,". Brusquement , tout cela me devient indifférent . Ma"
Marceau-Felicien_Creezy_<ma Creezy-1405>_40441,cela me devient indifférent . Ma colère s' est usée
Marceau-Felicien_Creezy_<ma Creezy-1405>_40457,. Il ne reste en moi que quelque chose de
Marceau-Felicien_Creezy_<ma Creezy-1405>_40522,"gens qui se retournent , je décide de rompre ."
Marceau-Felicien_Creezy_<ma Creezy-1405>_40550,faut y aller . Creezy me dit encore : «
Marceau-Felicien_Creezy_<ma Creezy-1405>_40560,"Qu' est - ce que tu leur as dit ,"
Marceau-Felicien_Creezy_<ma Creezy-1405>_40566,"leur as dit , quand tu as téléphoné ? Ils"
Marceau-Felicien_Creezy_<ma Creezy-1405>_40592,interrompe la séance pour que tu ne sois pas seul
Marceau-Felicien_Creezy_<ma Creezy-1405>_40608,dois y retourner . » Je lui dis : «
Marceau-Felicien_Creezy_<ma Creezy-1405>_40622,À ce soir . » Je monte dans ma chambre
Marceau-Felicien_Creezy_<ma Creezy-1405>_40625,. » Je monte dans ma chambre . Je vais
Marceau-Felicien_Creezy_<ma Creezy-1405>_40628,monte dans ma chambre . Je vais rompre . Je
Marceau-Felicien_Creezy_<ma Creezy-1405>_40632,. Je vais rompre . Je ne suis même pas
Marceau-Felicien_Creezy_<ma Creezy-1405>_40662,"qui encore nous ressemble . Je veux rompre et ,"
Marceau-Felicien_Creezy_<ma Creezy-1405>_40671,", en même temps , je cède à l' éternelle"
Marceau-Felicien_Creezy_<ma Creezy-1405>_40687,on peut rompre bien . Je décide de rompre mais
Marceau-Felicien_Creezy_<ma Creezy-1405>_40692,Je décide de rompre mais je veux encore donner à
Marceau-Felicien_Creezy_<ma Creezy-1405>_40702,Creezy ces quelques jours que je lui ai promis .
Marceau-Felicien_Creezy_<ma Creezy-1405>_40720,- elle déjà ce que j' éprouve ? Nous nous
Marceau-Felicien_Creezy_<ma Creezy-1405>_40732,"deux convalescents . « Si tu veux , mon chéri"
Marceau-Felicien_Creezy_<ma Creezy-1405>_40739,", mon chéri , comme tu veux , ma chérie"
Marceau-Felicien_Creezy_<ma Creezy-1405>_40768,"le passage de Creezy , je vois dans le regard"
Marceau-Felicien_Creezy_<ma Creezy-1405>_40779,"gens la même perplexité que j' ai éprouvée , moi"
Marceau-Felicien_Creezy_<ma Creezy-1405>_40783,"que j' ai éprouvée , moi , la première fois"
Marceau-Felicien_Creezy_<ma Creezy-1405>_40789,", la première fois où je l' ai vue ,"
Marceau-Felicien_Creezy_<ma Creezy-1405>_40818,une séance de pose . Je vais l' y rejoindre
Marceau-Felicien_Creezy_<ma Creezy-1405>_40891,"la bouche . Que fais - je ici , dans"
Marceau-Felicien_Creezy_<ma Creezy-1405>_40910,"il y a , pour moi , de plus vain"
Marceau-Felicien_Creezy_<ma Creezy-1405>_40931,fontaine sont plus sérieux que moi . Un des photographes
Marceau-Felicien_Creezy_<ma Creezy-1405>_40940,"photographes , en reculant , me marche sur le pied"
Marceau-Felicien_Creezy_<ma Creezy-1405>_40955,pas à dire pardon . Je ne suis ici qu'
Marceau-Felicien_Creezy_<ma Creezy-1405>_40968,"qui gêne . Exaspéré , je vais vers Creezy et"
Marceau-Felicien_Creezy_<ma Creezy-1405>_40973,je vais vers Creezy et je lui dis : «
Marceau-Felicien_Creezy_<ma Creezy-1405>_40978,"je lui dis : « Je rentre , je t'"
Marceau-Felicien_Creezy_<ma Creezy-1405>_40981,": « Je rentre , je t' attends à l'"
Marceau-Felicien_Creezy_<ma Creezy-1405>_40998,"photographe , quand même , je vois passer un début"
Marceau-Felicien_Creezy_<ma Creezy-1405>_41007,début de considération . Mais je ne suis pas sûr
Marceau-Felicien_Creezy_<ma Creezy-1405>_41032,photographe qu' entre elle et moi . Ma Creezy .
Marceau-Felicien_Creezy_<ma Creezy-1405>_41034,entre elle et moi . Ma Creezy . C' est
Marceau-Felicien_Creezy_<ma Creezy-1405>_41039,Ma Creezy . C' est ma Creezy . Mais c'
Marceau-Felicien_Creezy_<ma Creezy-1405>_41060,"clic . En passant , j' ai un entretien avec"
Marceau-Felicien_Creezy_<ma Creezy-1405>_41077,"ce séjour avec Creezy , je voudrais un hôtel rare"
Marceau-Felicien_Creezy_<ma Creezy-1405>_41097,jardin autour . Le portier me dit qu' il va
Marceau-Felicien_Creezy_<ma Creezy-1405>_41106,va s' en occuper . Je remonte dans ma chambre
Marceau-Felicien_Creezy_<ma Creezy-1405>_41109,occuper . Je remonte dans ma chambre . Le téléphone
Marceau-Felicien_Creezy_<ma Creezy-1405>_41130,. Il vient d' apprendre mon arrivée . Mais comment
Marceau-Felicien_Creezy_<ma Creezy-1405>_41154,- il le plaisir de m' avoir à déjeuner ?
Marceau-Felicien_Creezy_<ma Creezy-1405>_41163,"? Non , merci , je ne suis ici que"
Marceau-Felicien_Creezy_<ma Creezy-1405>_41179,"une session très chargée , je voudrais aller me reposer"
Marceau-Felicien_Creezy_<ma Creezy-1405>_41207,"Il a ce qu' il me faut , une maison"
Marceau-Felicien_Creezy_<ma Creezy-1405>_41239,", il serait ravi de me la prêter . Ravi"
Marceau-Felicien_Creezy_<ma Creezy-1405>_41250,"vraiment , sans façons . J' hésite une seconde ."
Marceau-Felicien_Creezy_<ma Creezy-1405>_41264,"jour , il apprendra que j' y ai été avec"
Marceau-Felicien_Creezy_<ma Creezy-1405>_41272,été avec Creezy . Cela m' est égal . Cela
Marceau-Felicien_Creezy_<ma Creezy-1405>_41278,est égal . Cela aussi m' est devenu indifférent .
Marceau-Felicien_Creezy_<ma Creezy-1405>_41283,m' est devenu indifférent . J' accepte . Une heure
Marceau-Felicien_Creezy_<ma Creezy-1405>_41301,"téléphoné au gardien , il m' apporte un itinéraire ."
Marceau-Felicien_Creezy_<ma Creezy-1405>_41325,"élan , il veut même me prêter sa voiture ."
Marceau-Felicien_Creezy_<ma Creezy-1405>_41334,". Non , non , j' en louerai une ."
Marceau-Felicien_Creezy_<ma Creezy-1405>_41339,j' en louerai une . J' appelle le portier .
Marceau-Felicien_Creezy_<ma Creezy-1405>_41369,", dit - elle . Je dis : « Nous"
Marceau-Felicien_Creezy_<ma Creezy-1405>_41398,"allons vers le sud , j' ai l' impression que"
Marceau-Felicien_Creezy_<ma Creezy-1405>_41452,"couler sur les échangeurs , je vois descendre sur nous"
Marceau-Felicien_Creezy_<ma Creezy-1405>_41483,"il tâte l' eau , je vois descendre sur nous"
Marceau-Felicien_Creezy_<ma Creezy-1405>_41615,"elle a été , dont je n' ai pas compris"
Marceau-Felicien_Creezy_<ma Creezy-1405>_41652,pâle et grumeleux . Elle me parle longuement de ce
Marceau-Felicien_Creezy_<ma Creezy-1405>_41679,", plus quelques chaînes . Je consulte l' itinéraire que"
Marceau-Felicien_Creezy_<ma Creezy-1405>_41684,Je consulte l' itinéraire que m' a remis le président
Marceau-Felicien_Creezy_<toi-1042>_28451,"message de mort : sans toi , je ne peux"
Marceau-Felicien_Creezy_<toi-1042>_28460,"peux pas vivre ; sans toi , je ne peux"
Marceau-Felicien_Creezy_<toi-1042>_28469,"peux pas dormir ; sans toi , les fantômes reviennent"
Marceau-Felicien_Creezy_<toi-1042>_28509,que je pourrais faire pour toi et je ne peux
Marceau-Felicien_Creezy_<toi-1042>_28519,pas le faire . Entends - tu ce que je
Marceau-Felicien_Creezy_<toi-1042>_28532,ne peux pas . Je t' aime mais je ne
Marceau-Felicien_Creezy_<toi-1042>_28543,pas . Je suis à toi mais je ne suis
Marceau-Felicien_Creezy_<toi-1042>_28550,je ne suis pas à toi . Je suis à
Marceau-Felicien_Creezy_<toi-1042>_28555,toi . Je suis à toi mais je dois partir
Marceau-Felicien_Creezy_<toi-1042>_28564,"partir . Doucement , je l' embrasse . De très"
Marceau-Felicien_Creezy_<toi-1042>_28571,". De très loin , sa main , une seconde"
Marceau-Felicien_Creezy_<toi-1042>_28583,"resserre sur la mienne . Elle sent la cire ,"
Marceau-Felicien_Creezy_<toi-1042>_28630,"me dis que je dois la quitter , que je"
Marceau-Felicien_Creezy_<toi-1042>_28644,"non pour moi mais pour elle , que je n'"
Marceau-Felicien_Creezy_<toi-1042>_28659,pas le droit d' encombrer sa vie si ce n'
Marceau-Felicien_Creezy_<toi-1042>_28667,ce n' est pas pour la combler . Ce soir
Marceau-Felicien_Creezy_<toi-1042>_28713,"contre moi , même contre elle . Demain , je"
Marceau-Felicien_Creezy_<toi-1042>_28719,". Demain , je le lui dirai . Demain ,"
Marceau-Felicien_Creezy_<toi-1042>_28771,"Le lendemain , quand je lui téléphone , elle dit"
Marceau-Felicien_Creezy_<toi-1042>_28774,"quand je lui téléphone , elle dit : « Est"
Marceau-Felicien_Creezy_<toi-1042>_28782,« Est - ce que j' ai rêvé ? Est
Marceau-Felicien_Creezy_<toi-1042>_28806,disparu . Je vais chez elle . Où est le
Marceau-Felicien_Creezy_<toi-1042>_28836,"insolente , dure et à qui rien ne peut faire"
Marceau-Felicien_Creezy_<toi-1042>_28878,"les larges yeux verts de Creezy , je crois lire"
Marceau-Felicien_Creezy_<toi-1042>_28907,"non , agressivement , qu' elle me dit : «"
Marceau-Felicien_Creezy_<toi-1042>_28946,"y aurait quelqu' un chez Creezy , je sonnais encore"
Marceau-Felicien_Creezy_<toi-1042>_28952,", je sonnais encore . Creezy s' en est fâchée"
Marceau-Felicien_Creezy_<toi-1042>_28966,la femme - colonel qu' elle me dit : «
Marceau-Felicien_Creezy_<toi-1042>_28987,"Puis , comme pour voiler son sentiment : « Ce"
Marceau-Felicien_Creezy_<toi-1042>_29012,avons rendez - vous chez elle et qu' elle a
Marceau-Felicien_Creezy_<toi-1042>_29015,"vous chez elle et qu' elle a dû sortir ,"
Marceau-Felicien_Creezy_<toi-1042>_29020,"elle a dû sortir , elle met une certaine application"
Marceau-Felicien_Creezy_<toi-1042>_29036,"si alors je vais vers elle : « Non ,"
Marceau-Felicien_Creezy_<toi-1042>_29044,"Non , non , dit - elle . Attends ."
Marceau-Felicien_Creezy_<toi-1042>_29050,elle . Attends . » Elle monte dans sa chambre
Marceau-Felicien_Creezy_<toi-1042>_29053,". » Elle monte dans sa chambre , elle y"
Marceau-Felicien_Creezy_<toi-1042>_29056,"monte dans sa chambre , elle y fait je ne"
Marceau-Felicien_Creezy_<toi-1042>_29072,finis par comprendre ce qu' elle y fait : entre
Marceau-Felicien_Creezy_<toi-1042>_29077,"elle y fait : entre elle et moi , elle"
Marceau-Felicien_Creezy_<toi-1042>_29081,"entre elle et moi , elle dispose un peu de"
Marceau-Felicien_Creezy_<toi-1042>_29113,un rendez - vous . Elle rentre chez elle et
Marceau-Felicien_Creezy_<toi-1042>_29116,vous . Elle rentre chez elle et elle m' y
Marceau-Felicien_Creezy_<toi-1042>_29118,Elle rentre chez elle et elle m' y trouve .
Marceau-Felicien_Creezy_<toi-1042>_29123,elle m' y trouve . Elle m' y trouve non
Marceau-Felicien_Creezy_<toi-1042>_29138,"l' homme qui vit avec elle , qui est là"
Marceau-Felicien_Creezy_<toi-1042>_29187,", ce décor planté , elle descend l' escalier ,"
Marceau-Felicien_Creezy_<toi-1042>_29192,"elle descend l' escalier , elle court vers moi ,"
Marceau-Felicien_Creezy_<toi-1042>_29197,"elle court vers moi , elle rit , elle secoue"
Marceau-Felicien_Creezy_<toi-1042>_29200,"moi , elle rit , elle secoue ses cheveux ,"
Marceau-Felicien_Creezy_<toi-1042>_29202,"elle rit , elle secoue ses cheveux , elle me"
Marceau-Felicien_Creezy_<toi-1042>_29205,"elle secoue ses cheveux , elle me renverse sur le"
Marceau-Felicien_Creezy_<toi-1042>_29214,le divan étroit et me dit : salaud . D'
Marceau-Felicien_Creezy_<toi-1042>_29222,. D' autres disent : mon chéri . Creezy me
Marceau-Felicien_Creezy_<toi-1042>_29238,est de s' entendre . Neige apporte les assiettes .
Marceau-Felicien_Creezy_<toi-1042>_29243,Neige apporte les assiettes . Elle ne nous regarde pas
Marceau-Felicien_Creezy_<toi-1042>_29249,ne nous regarde pas mais elle sourit . Neige est
Marceau-Felicien_Creezy_<toi-1042>_29252,pas mais elle sourit . Neige est contente . Un
Marceau-Felicien_Creezy_<toi-1042>_29268,", dans mes bras , son genou sur mon ventre"
Marceau-Felicien_Creezy_<toi-1042>_29274,"genou sur mon ventre , Creezy me dit : «"
Marceau-Felicien_Creezy_<toi-1042>_29282,": « Tiens , pour mes impôts , j' ai"
Marceau-Felicien_Creezy_<toi-1042>_29285,", pour mes impôts , j' ai eu une idée"
Marceau-Felicien_Creezy_<toi-1042>_29292,eu une idée . » Elle me l' expose .
Marceau-Felicien_Creezy_<toi-1042>_29298,me l' expose . Je lui dis que cela ne
Marceau-Felicien_Creezy_<toi-1042>_29312,"« Attends , me dit - elle . Tu vas"
Marceau-Felicien_Creezy_<toi-1042>_29320,"Tu vas voir . » Elle saute du lit ,"
Marceau-Felicien_Creezy_<toi-1042>_29325,"Elle saute du lit , allume la lampe , m'"
Marceau-Felicien_Creezy_<toi-1042>_29330,"allume la lampe , m' apporte un tas de papiers"
Marceau-Felicien_Creezy_<toi-1042>_29353,", chacun nos lunettes , elle des lunettes énormes qui"
Marceau-Felicien_Creezy_<toi-1042>_29363,"me font rire . « Ma Creezy , tu gagnes"
Marceau-Felicien_Creezy_<toi-1042>_29366,". « Ma Creezy , tu gagnes tant que ça"
Marceau-Felicien_Creezy_<toi-1042>_29377,"– Mais oui , dit - elle . – Et"
Marceau-Felicien_Creezy_<toi-1042>_29382,- elle . – Et tu dépenses tout ? –
Marceau-Felicien_Creezy_<toi-1042>_29397,ce que tu crois ? J' en ai placé une
Marceau-Felicien_Creezy_<toi-1042>_29418,". En cette matière , Betty est dix fois plus"
Marceau-Felicien_Creezy_<toi-1042>_29456,- tu placé ? – J' ai une boutique .
Marceau-Felicien_Creezy_<toi-1042>_29471,. « Une boutique ? Tu as une boutique ?
Marceau-Felicien_Creezy_<toi-1042>_29482,"Oui . Avenue Montaigne . Tu sais , dans le"
Marceau-Felicien_Creezy_<toi-1042>_29503,"un bonhomme . – Qui te roule , bien entendu"
Marceau-Felicien_Creezy_<toi-1042>_29514,"– Mais non , dit - elle . Pourquoi me"
Marceau-Felicien_Creezy_<toi-1042>_29520,elle . Pourquoi me dis - tu ça ? Il
Marceau-Felicien_Creezy_<toi-1042>_29526,tu ça ? Il ne me roule pas du tout
Marceau-Felicien_Creezy_<toi-1042>_29532,roule pas du tout . Je le surveille . »
Marceau-Felicien_Creezy_<toi-1042>_29538,"le surveille . » Dans son classeur vert , elle"
Marceau-Felicien_Creezy_<toi-1042>_29542,"Dans son classeur vert , elle va chercher des dossiers"
Marceau-Felicien_Creezy_<toi-1042>_29581,", sont considérables . « Ma Creezy , pourquoi ne"
Marceau-Felicien_Creezy_<toi-1042>_29589,pourquoi ne m' en as - tu jamais parlé ?
Marceau-Felicien_Creezy_<toi-1042>_29600,De quoi ? – De ta boutique . – Tu
Marceau-Felicien_Creezy_<toi-1042>_29604,De ta boutique . – Tu trouves ça si intéressant
Marceau-Felicien_Creezy_<toi-1042>_29627,Il est étrange cependant qu' elle ne m' en ait
Marceau-Felicien_Creezy_<toi-1042>_29687,"fait qu' en rire . Ma Creezy , mon icône"
Marceau-Felicien_Creezy_<toi-1042>_29690,"rire . Ma Creezy , mon icône , mon idole"
Marceau-Felicien_Creezy_<toi-1042>_29693,"Creezy , mon icône , mon idole peintre , mon"
Marceau-Felicien_Creezy_<toi-1042>_29697,", mon idole peintre , mon oiseau de paradis ,"
Marceau-Felicien_Creezy_<toi-1042>_29702,"mon oiseau de paradis , mon bébé Creezy , ma"
Marceau-Felicien_Creezy_<toi-1042>_29706,", mon bébé Creezy , ma pharaonne , ma pharaonne"
Marceau-Felicien_Creezy_<toi-1042>_29709,"Creezy , ma pharaonne , ma pharaonne est inscrite au"
Marceau-Felicien_Creezy_<toi-1042>_29719,Registre du Commerce . « Ma Creezy … » Je
Marceau-Felicien_Creezy_<toi-1042>_29724,Ma Creezy … » Je lui montre le gadget que
Marceau-Felicien_Creezy_<toi-1042>_29730,"montre le gadget que je lui ai apporté , qui"
Marceau-Felicien_Creezy_<toi-1042>_29746,de téléphone . « Sais - tu où je l'
Marceau-Felicien_Creezy_<toi-1042>_29755,"l' ai acheté ? Chez toi ! » Elle ,"
Marceau-Felicien_Creezy_<toi-1042>_29758,"? Chez toi ! » Elle , cela ne la"
Marceau-Felicien_Creezy_<toi-1042>_29762,"» Elle , cela ne la fait pas rire ."
Marceau-Felicien_Creezy_<toi-1042>_29778,"genoux sur le lit , ses grosses lunettes , qu'"
Marceau-Felicien_Creezy_<toi-1042>_29783,"ses grosses lunettes , qu' elle me répond : «"
Marceau-Felicien_Creezy_<toi-1042>_29791,: « Bien entendu . J' en ai l' exclusivité
Marceau-Felicien_Creezy_<toi-1042>_29802,"» X Mes jours avec Creezy . Ma vie ,"
Marceau-Felicien_Creezy_<toi-1042>_29890,". Il y a bien son agent , une sorte"
Marceau-Felicien_Creezy_<toi-1042>_29952,", dans un contrat de Creezy , je lui ai"
Marceau-Felicien_Creezy_<toi-1042>_30033,", tapoter nos gouttières . Creezy m' a emmené voir"
Marceau-Felicien_Creezy_<toi-1042>_30038,Creezy m' a emmené voir sa boutique . J' y
Marceau-Felicien_Creezy_<toi-1042>_30159,l' aurais parié ! » Creezy a arrangé un nouveau
Marceau-Felicien_Creezy_<toi-1042>_30212,", il est fasciné par Creezy et , tout aussi"
Marceau-Felicien_Creezy_<toi-1042>_30238,"d' ailleurs , que si Creezy lui proposait de passer"
Marceau-Felicien_Creezy_<toi-1042>_30246,"de passer la nuit avec elle , le grand jeune"
Marceau-Felicien_Creezy_<toi-1042>_30333,Elle est l' amie de Creezy . Elle pourrait aussi
Marceau-Felicien_Creezy_<toi-1042>_30364,ai fini par demander à Creezy de l' emmener chez
Marceau-Felicien_Creezy_<toi-1042>_30449,sais déjà que c' est Creezy qu' elle va me
Marceau-Felicien_Creezy_<toi-1042>_30450,déjà que c' est Creezy qu' elle va me passer
Marceau-Felicien_Creezy_<toi-1042>_30538,persuadé que la vie de Creezy ne peut pas être
Marceau-Felicien_Creezy_<toi-1042>_30547,"être si simple , qu' elle n' a pas pu"
Marceau-Felicien_Creezy_<toi-1042>_30558,"toujours si simple , qu' elle doit bien avoir ses"
Marceau-Felicien_Creezy_<toi-1042>_30562,qu' elle doit bien avoir ses caves . Des caves
Marceau-Felicien_Creezy_<toi-1042>_30600,. Elle me disait que Creezy était une lesbienne notoire
Marceau-Felicien_Creezy_<toi-1042>_30602,"me disait que Creezy était une lesbienne notoire , une"
Marceau-Felicien_Creezy_<toi-1042>_30657,"ai même pas parlé à Creezy . Très exactement ,"
Marceau-Felicien_Creezy_<toi-1042>_30678,"où je dormais auprès d' elle , elle se réveille"
Marceau-Felicien_Creezy_<toi-1042>_30680,"dormais auprès d' elle , elle se réveille en sursaut"
Marceau-Felicien_Creezy_<toi-1042>_30686,"se réveille en sursaut , elle s' accroche à moi"
Marceau-Felicien_Creezy_<toi-1042>_30692,"s' accroche à moi , elle pleure , elle a"
Marceau-Felicien_Creezy_<toi-1042>_30695,"moi , elle pleure , elle a peur , elle"
Marceau-Felicien_Creezy_<toi-1042>_30699,", elle a peur , elle crie , il lui"
Marceau-Felicien_Creezy_<toi-1042>_30703,", elle crie , il lui faut sa maman ,"
Marceau-Felicien_Creezy_<toi-1042>_30705,"crie , il lui faut sa maman , il faut"
Marceau-Felicien_Creezy_<toi-1042>_30718,tout de suite . « Ma Creezy ! – Appelle
Marceau-Felicien_Creezy_<toi-1042>_30723,Ma Creezy ! – Appelle - la . Appelle -
Marceau-Felicien_Creezy_<toi-1042>_30727,"Appelle - la . Appelle - la , tout de"
Marceau-Felicien_Creezy_<toi-1042>_30738,. – Mais où est - elle ? – A
Marceau-Felicien_Creezy_<toi-1042>_30747,"A Los Angeles . – Ma Creezy , tu ne"
Marceau-Felicien_Creezy_<toi-1042>_30787,"Enfin , je réussis à l' apaiser . Sur le"
Marceau-Felicien_Creezy_<toi-1042>_30833,"là , l' idée que Creezy pût avoir une mère"
Marceau-Felicien_Creezy_<toi-1042>_30852,fait un grand plaisir à Creezy . C' est par
Marceau-Felicien_Creezy_<toi-1042>_30866,"- là , je vais la chercher à la fin"
Marceau-Felicien_Creezy_<toi-1042>_30874,la fin d' une de ses séances de pose .
Marceau-Felicien_Creezy_<toi-1042>_30893,idée rare : de photographier Creezy place d' Aligre .
Marceau-Felicien_Creezy_<toi-1042>_30964,", je trouve autour d' elle quelque cinquante ou quatre"
Marceau-Felicien_Creezy_<toi-1042>_30989,nous prenons la voiture de Creezy . Quand Creezy sort
Marceau-Felicien_Creezy_<toi-1042>_30992,voiture de Creezy . Quand Creezy sort d' une séance
Marceau-Felicien_Creezy_<toi-1042>_31001,"séance de pose , il lui faut , pour se"
Marceau-Felicien_Creezy_<toi-1042>_31056,nos concessions mutuelles . Je lui passe ses excès de
Marceau-Felicien_Creezy_<toi-1042>_31058,mutuelles . Je lui passe ses excès de vitesse .
Marceau-Felicien_Creezy_<toi-1042>_31063,ses excès de vitesse . Elle me passe mon goût
Marceau-Felicien_Creezy_<toi-1042>_31124,"touffu . Formidable , dit Creezy . Pour elle ,"
Marceau-Felicien_Creezy_<toi-1042>_31127,", dit Creezy . Pour elle , c' est ça"
Marceau-Felicien_Creezy_<toi-1042>_31136,"ça , la campagne . Elle saute la barrière ."
Marceau-Felicien_Creezy_<toi-1042>_31141,Elle saute la barrière . Elle a aujourd' hui un
Marceau-Felicien_Creezy_<toi-1042>_31207,tuyau en plastique vert . Creezy se jette sur elle
Marceau-Felicien_Creezy_<toi-1042>_31216,"elle . « Oh , laissez - moi arroser ."
Marceau-Felicien_Creezy_<toi-1042>_31232,", tend le tuyau . Creezy le prend , en"
Marceau-Felicien_Creezy_<toi-1042>_31237,"Creezy le prend , en pince l' extrémité entre les"
Marceau-Felicien_Creezy_<toi-1042>_31321,« Eh bien ! dit Creezy . J' arrosais !
Marceau-Felicien_Creezy_<toi-1042>_31323,bien ! dit Creezy . J' arrosais ! » )
Marceau-Felicien_Creezy_<toi-1042>_31356,. « Quoi ? dit Creezy . Elle est vraiment
Marceau-Felicien_Creezy_<toi-1042>_31366,"à louer ? » Sur son visage , je lis"
Marceau-Felicien_Creezy_<toi-1042>_31461,femme corpulente nous précède . Creezy m' a pris la
Marceau-Felicien_Creezy_<toi-1042>_31476,", ivre de plaisir , elle arrache une graminée ."
Marceau-Felicien_Creezy_<Je-623>_17070,", goodie la nuit . Je les chante , moi"
Marceau-Felicien_Creezy_<Je-623>_17074,". Je les chante , moi aussi : goodie ,"
Marceau-Felicien_Creezy_<Je-623>_17107,", en passant , elle m' envoie un sourire râblé"
Marceau-Felicien_Creezy_<Je-623>_17114,un sourire râblé . Neige m' aurait - elle adopté
Marceau-Felicien_Creezy_<Je-623>_17124,? On le dirait . M' aimerait - elle ?
Marceau-Felicien_Creezy_<Je-623>_17170,". D' en bas , je la vois , devant"
Marceau-Felicien_Creezy_<Je-623>_17204,descend : « Comment trouves - tu ? » J'
Marceau-Felicien_Creezy_<Je-623>_17208,trouves - tu ? » J' ouvre des fermetures éclair
Marceau-Felicien_Creezy_<Je-623>_17214,"ouvre des fermetures éclair , je ferme des fermetures éclair"
Marceau-Felicien_Creezy_<Je-623>_17271,est qu' en perles . Je la prends dans mes
Marceau-Felicien_Creezy_<Je-623>_17275,. Je la prends dans mes bras . Cela crisse
Marceau-Felicien_Creezy_<Je-623>_17284,"crisse , cela fuit sous mes mains . Creezy ,"
Marceau-Felicien_Creezy_<Je-623>_17313,"elle les a décommandées . Moi , mon travail ,"
Marceau-Felicien_Creezy_<Je-623>_17315,"a décommandées . Moi , mon travail , je l'"
Marceau-Felicien_Creezy_<Je-623>_17318,"Moi , mon travail , je l' ai renvoyé très"
Marceau-Felicien_Creezy_<Je-623>_17336,"jours . En partant , j' ai pris avec moi"
Marceau-Felicien_Creezy_<Je-623>_17340,", j' ai pris avec moi un rapport de la"
Marceau-Felicien_Creezy_<Je-623>_17371,"un soir . Pourtant , je me souviens qu' un"
Marceau-Felicien_Creezy_<Je-623>_17382,"ces jours - là , j' ai une déclaration qui"
Marceau-Felicien_Creezy_<Je-623>_17401,"A l' heure dite , j' ouvre l' appareil ."
Marceau-Felicien_Creezy_<Je-623>_17427,"coussins de son lit . J' arrive , c' est"
Marceau-Felicien_Creezy_<Je-623>_17433,"arrive , c' est bien mon nom qu' on vient"
Marceau-Felicien_Creezy_<Je-623>_17441,"on vient d' annoncer . Je suis là , devant"
Marceau-Felicien_Creezy_<Je-623>_17457,Mais Creezy se coule contre moi . Creezy me mord
Marceau-Felicien_Creezy_<Je-623>_17460,coule contre moi . Creezy me mord la bouche .
Marceau-Felicien_Creezy_<Je-623>_17465,me mord la bouche . Je la prends dans mes
Marceau-Felicien_Creezy_<Je-623>_17469,". Je la prends dans mes bras . Lentement ,"
