,text_surronding
Marceau-Felicien_Creezy_<Je-623>_17486,"Sur le petit écran , je parle toujours . Je"
Marceau-Felicien_Creezy_<Je-623>_17490,", je parle toujours . Je dis des choses comme"
Marceau-Felicien_Creezy_<Je-623>_17500,: l' impasse budgétaire . Je dis : La France
Marceau-Felicien_Creezy_<Je-623>_17510,est à un virage . Ma voix passe sur nous
Marceau-Felicien_Creezy_<Je-623>_17517,passe sur nous . Mais ma bouche est dans la
Marceau-Felicien_Creezy_<Je-623>_17526,"la bouche de Creezy , je suis couché sur Creezy"
Marceau-Felicien_Creezy_<Je-623>_17551,"Bahamas . Son corps , ma voix , sa bouche"
Marceau-Felicien_Creezy_<Je-623>_17557,"voix , sa bouche . J' ai mis le son"
Marceau-Felicien_Creezy_<Je-623>_17565,"le son trop fort . Ma voix est partout ,"
Marceau-Felicien_Creezy_<Je-623>_17580,le vide devant elle . Je hurle comme je hurlais
Marceau-Felicien_Creezy_<Je-623>_17583,elle . Je hurle comme je hurlais le jour du
Marceau-Felicien_Creezy_<Je-623>_17600,C' est Colette Dubois qui m' avait conseillé . «
Marceau-Felicien_Creezy_<Je-623>_17605,m' avait conseillé . « Tu attaques très en dessous
Marceau-Felicien_Creezy_<Je-623>_17622,", puis , brusquement , tu gueules . » Et"
Marceau-Felicien_Creezy_<Je-623>_17627,tu gueules . » Et j' ai gueulé . Au
Marceau-Felicien_Creezy_<Je-623>_17636,"Au banc du gouvernement , je voyais le Premier ministre"
Marceau-Felicien_Creezy_<Je-623>_17642,"voyais le Premier ministre qui me regardait , sous ses"
Marceau-Felicien_Creezy_<Je-623>_17672,"hui ? Un moment , je lève les yeux ."
Marceau-Felicien_Creezy_<Je-623>_17701,"à col officier , Neige me regarde . Me regarde"
Marceau-Felicien_Creezy_<Je-623>_17704,", Neige me regarde . Me regarde mais sur l'"
Marceau-Felicien_Creezy_<Je-623>_17732,"la moquette ardoise , elle me voit , moi ,"
Marceau-Felicien_Creezy_<Je-623>_17735,", elle me voit , moi , moi sérieux ,"
Marceau-Felicien_Creezy_<Je-623>_17737,"me voit , moi , moi sérieux , moi avec"
Marceau-Felicien_Creezy_<Je-623>_17740,"moi , moi sérieux , moi avec ma cravate ,"
Marceau-Felicien_Creezy_<Je-623>_17742,"moi sérieux , moi avec ma cravate , non moi"
Marceau-Felicien_Creezy_<Je-623>_17746,"avec ma cravate , non moi épars au milieu de"
Marceau-Felicien_Creezy_<Je-623>_17759,olive et vert laitue . Ma voix s' arrête .
Marceau-Felicien_Creezy_<Je-623>_17774,regard de Neige descend sur moi . Elle a l'
Marceau-Felicien_Creezy_<Je-623>_17801,contente . « Je voulais te voir ! – Eh
Marceau-Felicien_Creezy_<Je-623>_17826,dix minutes . » Elle me prend par les oreilles
Marceau-Felicien_Creezy_<Je-623>_17832,prend par les oreilles . Je la prends par les
Marceau-Felicien_Creezy_<Je-623>_17855,"temps , en Creezy , je vois monter une sorte"
Marceau-Felicien_Creezy_<Je-623>_17863,une sorte de rage . Je vois devant moi une
Marceau-Felicien_Creezy_<Je-623>_17866,rage . Je vois devant moi une ennemie . Elle
Marceau-Felicien_Creezy_<Je-623>_17874,. Elle se jette sur moi mais comme pour me
Marceau-Felicien_Creezy_<Je-623>_17878,sur moi mais comme pour me détruire . Comme si
Marceau-Felicien_Creezy_<Je-623>_17884,"détruire . Comme si elle m' en voulait , comme"
Marceau-Felicien_Creezy_<Je-623>_17896,"s' en voulait , de m' aimer , de l'"
Marceau-Felicien_Creezy_<Je-623>_17932,"défi , où même parfois je me demande s' il"
Marceau-Felicien_Creezy_<Je-623>_17983,"avec un ange . Pour moi , l' ange ,"
Marceau-Felicien_Creezy_<Je-623>_17993,"c' est Creezy . Et je sais , je sais"
Marceau-Felicien_Creezy_<Je-623>_17996,". Et je sais , je sais déjà à cet"
Marceau-Felicien_Creezy_<Je-623>_18017,", de cette lutte , je sortirai la hanche démise"
Marceau-Felicien_Creezy_<Je-623>_18033,", ce brusque saut en moi de mon âme qui"
Marceau-Felicien_Creezy_<Je-623>_18035,brusque saut en moi de mon âme qui bondit vers
Marceau-Felicien_Creezy_<Je-623>_18047,cette femme qui tantôt est moi et qui tantôt m'
Marceau-Felicien_Creezy_<Je-623>_18051,"est moi et qui tantôt m' échappe , qui devient"
Marceau-Felicien_Creezy_<Je-623>_18065,", acier , aérolithe , je sais déjà que j'"
Marceau-Felicien_Creezy_<Je-623>_18069,", je sais déjà que j' aborde à un monde"
Marceau-Felicien_Creezy_<Je-623>_18075,"aborde à un monde pour moi inconnu , dans une"
Marceau-Felicien_Creezy_<Je-623>_18085,"lumière de miroir , qui m' aveugle . De mes"
Marceau-Felicien_Creezy_<Je-623>_18089,"qui m' aveugle . De mes autres liaisons , je"
Marceau-Felicien_Creezy_<Je-623>_18093,"De mes autres liaisons , je n' ai jamais parlé"
Marceau-Felicien_Creezy_<Je-623>_18104,Celle - ci sort de moi comme une fumée et
Marceau-Felicien_Creezy_<Je-623>_18117,"le reste qui , pour moi , devient apparence ,"
Marceau-Felicien_Creezy_<Je-623>_18131,Que sais - tu de moi si tu ne sais
Marceau-Felicien_Creezy_<Je-623>_18138,tu ne sais pas que j' ai couché avec Creezy
Marceau-Felicien_Creezy_<Je-623>_18145,"couché avec Creezy , que j' ai eu mon ventre"
Marceau-Felicien_Creezy_<Je-623>_18148,", que j' ai eu mon ventre dans le ventre"
Marceau-Felicien_Creezy_<Je-623>_18170,"? VI Le vendredi , je rentre chez moi ."
Marceau-Felicien_Creezy_<Je-623>_18173,"vendredi , je rentre chez moi . « Ton voyage"
Marceau-Felicien_Creezy_<Je-623>_18176,rentre chez moi . « Ton voyage s' est bien
Marceau-Felicien_Creezy_<Je-623>_18218,"apparaît . En général , mes liaisons , chaque fois"
Marceau-Felicien_Creezy_<Je-623>_18226,"chaque fois , c' est ma part obscure , ma"
Marceau-Felicien_Creezy_<Je-623>_18230,"est ma part obscure , ma part dérobée , le"
Marceau-Felicien_Creezy_<Je-623>_18242,"la pénombre , d' où j' émerge pour me retrouver"
Marceau-Felicien_Creezy_<Je-623>_18268,le droit d' être . J' éprouve cette fois exactement
Marceau-Felicien_Creezy_<Je-623>_18279,"contraire . C' est Creezy ma clarté , avec elle"
Marceau-Felicien_Creezy_<Je-623>_18285,"clarté , avec elle que je me trouvais dans la"
Marceau-Felicien_Creezy_<Je-623>_18313,"Bahamas . Creezy quittée , je regagne les couloirs ,"
Marceau-Felicien_Creezy_<Je-623>_18329,"fantôme qui est rentré chez moi , un homme de"
Marceau-Felicien_Creezy_<Je-623>_18340,. Et ce papier donne mon signalement : époux de
Marceau-Felicien_Creezy_<Je-623>_18382,cela est devenu ombre . Je reviens non d' un
Marceau-Felicien_Creezy_<Je-623>_18434,on défait ses valises . Je vais dans mon bureau
Marceau-Felicien_Creezy_<Je-623>_18437,valises . Je vais dans mon bureau . Il y
Marceau-Felicien_Creezy_<Je-623>_18453,"On dirait que chacune va me sauter dessus , me"
Marceau-Felicien_Creezy_<Je-623>_18457,"va me sauter dessus , me happer , me réengluer"
Marceau-Felicien_Creezy_<Je-623>_18460,"dessus , me happer , me réengluer . Mes devoirs"
Marceau-Felicien_Creezy_<Je-623>_18463,"happer , me réengluer . Mes devoirs , mes principes"
Marceau-Felicien_Creezy_<Je-623>_18466,"réengluer . Mes devoirs , mes principes , mes obligations"
Marceau-Felicien_Creezy_<Je-623>_18469,"devoirs , mes principes , mes obligations , mes rendez"
Marceau-Felicien_Creezy_<Je-623>_18472,"principes , mes obligations , mes rendez - vous ."
Marceau-Felicien_Creezy_<Je-623>_18477,mes rendez - vous . Je finis par les ouvrir
Marceau-Felicien_Creezy_<Je-623>_18542,"de compte . Laborieusement , j' entreprends d' y répondre"
Marceau-Felicien_Creezy_<Je-623>_18548,entreprends d' y répondre . Ma secrétaire n' est pas
Marceau-Felicien_Creezy_<Je-623>_18555,n' est pas là . Je pourrais dicter au magnétophone
Marceau-Felicien_Creezy_<Je-623>_18568,tout cela à lundi . Je ne le fais pas
Marceau-Felicien_Creezy_<Je-623>_18574,ne le fais pas . Je réponds moi - même
Marceau-Felicien_Creezy_<Je-623>_18576,fais pas . Je réponds moi - même . En
Marceau-Felicien_Creezy_<Je-623>_18586,tapant avec deux doigts . J' ai besoin de ce
Marceau-Felicien_Creezy_<Je-623>_18594,"de ce pensum . Entre moi et moi , j'"
Marceau-Felicien_Creezy_<Je-623>_18596,"pensum . Entre moi et moi , j' interpose ce"
Marceau-Felicien_Creezy_<Je-623>_18598,"Entre moi et moi , j' interpose ce pensum ."
Marceau-Felicien_Creezy_<Je-623>_18625,", à la campagne . Je reprends l' autoroute ."
Marceau-Felicien_Creezy_<Je-623>_18638,même qu' avec Creezy . Je ne reconnais rien .
Marceau-Felicien_Creezy_<Je-623>_18649,"moment , tout aboli , je fonce . Je fonce"
Marceau-Felicien_Creezy_<Je-623>_18652,"aboli , je fonce . Je fonce comme si c'"
Marceau-Felicien_Creezy_<Je-623>_18663,Creezy qui conduisait . Betty me dit : « Tu
Marceau-Felicien_Creezy_<Je-623>_18667,"Betty me dit : « Tu es fou , non"
Marceau-Felicien_Creezy_<Je-623>_18685,", avec elle , en moi , quelque chose s'"
Marceau-Felicien_Creezy_<Je-623>_18700,et Coralie se disputent . Je n' entends rien .
Marceau-Felicien_Creezy_<Je-623>_18712,"calme , dit Betty , vous allez distraire papa ."
Marceau-Felicien_Creezy_<Je-623>_18723,"Distraire ? Heureusement , Antoine me pose des questions sur"
Marceau-Felicien_Creezy_<Je-623>_18752,question qui lui échappent . J' explique . Danton et
Marceau-Felicien_Creezy_<Je-623>_18779,n' est pas eux . Je dors dans une chambre
Marceau-Felicien_Creezy_<Je-623>_18818,enfants jouent au croquet . Je suis dans un fauteuil
Marceau-Felicien_Creezy_<Je-623>_18841,. Le mari de Colette m' apporte un verre .
Marceau-Felicien_Creezy_<Je-623>_18868,sur un ton rancuneux . Je lui parle de la
Marceau-Felicien_Creezy_<Je-623>_19007,"Mais les mots sont devant moi comme une fumée ,"
Marceau-Felicien_Creezy_<Je-623>_19019,"bulles des bandes dessinées , je les vois , je"
Marceau-Felicien_Creezy_<Je-623>_19023,", je les vois , je vois les bouches qui"
Marceau-Felicien_Creezy_<Je-623>_19030,"les bouches qui articulent , je n' entends rien ou"
Marceau-Felicien_Creezy_<Je-623>_19037,entends rien ou ce que j' entends ne veut rien
Marceau-Felicien_Creezy_<Je-623>_19072,"deux considérations syndicales , elle me regarde , perplexe ."
Marceau-Felicien_Creezy_<Je-623>_19100,y a longtemps déjà … J' essaie de me raccrocher
Marceau-Felicien_Creezy_<Je-623>_19202,"lierre autour , tout cela me donne l' impression que"
Marceau-Felicien_Creezy_<Je-623>_19207,me donne l' impression que je ne suis qu' un
Marceau-Felicien_Creezy_<Je-623>_19232,en donner l' échelle . J' entends Colette : «
Marceau-Felicien_Creezy_<Je-623>_19306,"fraîcheur , tout cela pour moi reste froid , glacé"
Marceau-Felicien_Creezy_<Je-623>_19315,glacé . Et faux . J' entends Betty . Elle
Marceau-Felicien_Creezy_<Je-623>_19343,vieille maison de Morlan . Je regarde le mari de
Marceau-Felicien_Creezy_<Je-623>_19376,son être aspire . Et moi . Moi le pire
Marceau-Felicien_Creezy_<Je-623>_19378,aspire . Et moi . Moi le pire . Moi
Marceau-Felicien_Creezy_<Je-623>_19382,. Moi le pire . Moi dans mon fauteuil de
Marceau-Felicien_Creezy_<Je-623>_19384,le pire . Moi dans mon fauteuil de jardin rose
Marceau-Felicien_Creezy_<Je-623>_19392,jardin rose et noir . Moi à peine posé au
Marceau-Felicien_Creezy_<Creezy-323>_8537,faire . J' arrive chez Creezy . Neige n' est
Marceau-Felicien_Creezy_<Creezy-323>_8555,à l' église espagnole puis elle reste avec des amis
Marceau-Felicien_Creezy_<Creezy-323>_8563,des amis . J' emmène Creezy déjeuner à la campagne
Marceau-Felicien_Creezy_<Creezy-323>_8569,déjeuner à la campagne . Elle a voulu prendre sa
Marceau-Felicien_Creezy_<Creezy-323>_8573,. Elle a voulu prendre sa voiture . Un autre
Marceau-Felicien_Creezy_<Creezy-323>_8582,"autre qui conduit , ça l' exaspère , elle ne"
Marceau-Felicien_Creezy_<Creezy-323>_8585,", ça l' exaspère , elle ne supporte pas ."
Marceau-Felicien_Creezy_<Creezy-323>_8590,"elle ne supporte pas . Elle , elle conduit comme"
Marceau-Felicien_Creezy_<Creezy-323>_8592,"supporte pas . Elle , elle conduit comme une dingue"
Marceau-Felicien_Creezy_<Creezy-323>_8608,"jaguar . Cent mètres devant elle , elle prend son"
Marceau-Felicien_Creezy_<Creezy-323>_8610,"Cent mètres devant elle , elle prend son élan comme"
Marceau-Felicien_Creezy_<Creezy-323>_8612,"devant elle , elle prend son élan comme sur une"
Marceau-Felicien_Creezy_<Creezy-323>_8619,comme sur une autoroute . Sa voiture s' y prête
Marceau-Felicien_Creezy_<Creezy-323>_8650,"long . Aux feux , Creezy freine sur un mètre"
Marceau-Felicien_Creezy_<Creezy-323>_8661,", chaque fois , ça la fait rire ou ,"
Marceau-Felicien_Creezy_<Creezy-323>_8669,"ou , au moins , elle a un plissement des"
Marceau-Felicien_Creezy_<Creezy-323>_8688,"le grondement du moteur , elle se penche vers moi"
Marceau-Felicien_Creezy_<Creezy-323>_8694,"se penche vers moi , secoue ses cheveux contre moi"
Marceau-Felicien_Creezy_<Creezy-323>_8695,"penche vers moi , secoue ses cheveux contre moi et"
Marceau-Felicien_Creezy_<Creezy-323>_8700,"ses cheveux contre moi et sa joue , une seconde"
Marceau-Felicien_Creezy_<Creezy-323>_8735,de nous arrêter . — Vous n' allez pas me
Marceau-Felicien_Creezy_<Creezy-323>_8742,allez pas me dire que vous aimez la campagne ?
Marceau-Felicien_Creezy_<Creezy-323>_8751,? Il y a dans sa voix un insondable mépris
Marceau-Felicien_Creezy_<Creezy-323>_8803,"cathédrale . A regret , Creezy sort de sa voiture"
Marceau-Felicien_Creezy_<Creezy-323>_8806,"regret , Creezy sort de sa voiture . Au bout"
Marceau-Felicien_Creezy_<Creezy-323>_8824,"s' arrange . Finalement , elle aussi aime la campagne"
Marceau-Felicien_Creezy_<Creezy-323>_8843,du tout . Comme je lui mets dans le dos
Marceau-Felicien_Creezy_<Creezy-323>_8858,"s' attachent aux vêtements , elle devient folle . Elle"
Marceau-Felicien_Creezy_<Creezy-323>_8862,", elle devient folle . Elle ignorait que cela existât"
Marceau-Felicien_Creezy_<Creezy-323>_8868,ignorait que cela existât . Elle m' en met partout
Marceau-Felicien_Creezy_<Creezy-323>_8898,un buisson en marche . Elle se jette dans mes
Marceau-Felicien_Creezy_<Creezy-323>_8916,graminées qui collent . Je lui apprends la différence entre
Marceau-Felicien_Creezy_<Creezy-323>_8933,ne piquent pas . Je lui montre ces petites feuilles
Marceau-Felicien_Creezy_<Creezy-323>_8951,en tournoyant . Tout ça la transporte . Quels gadgets
Marceau-Felicien_Creezy_<Creezy-323>_8958,. Quels gadgets ! dit - elle . Elle est
Marceau-Felicien_Creezy_<Creezy-323>_8961,! dit - elle . Elle est aujourd' hui habillée
Marceau-Felicien_Creezy_<Creezy-323>_8996,des ricochets . J' espère l' éblouir . Je ne
Marceau-Felicien_Creezy_<Creezy-323>_9001,l' éblouir . Je ne l' éblouis pas du tout
Marceau-Felicien_Creezy_<Creezy-323>_9012,Mais on dirait que ça l' amuse que je m'
Marceau-Felicien_Creezy_<Creezy-323>_9027,"quinze ans , me dit - elle . Malgré tout"
Marceau-Felicien_Creezy_<Creezy-323>_9057,Cela nous sert maintenant . Creezy n' est plus ni
Marceau-Felicien_Creezy_<Creezy-323>_9076,sans cesser de parler qu' elle monte son escalier d'
Marceau-Felicien_Creezy_<Creezy-323>_9078,de parler qu' elle monte son escalier d' acier .
Marceau-Felicien_Creezy_<Creezy-323>_9086,acier . En riant qu' elle me jette les coussins
Marceau-Felicien_Creezy_<Creezy-323>_9092,me jette les coussins de son lit . Je fais
Marceau-Felicien_Creezy_<Creezy-323>_9125,"embrassons , très doucement . Elle retire mon slip ."
Marceau-Felicien_Creezy_<Creezy-323>_9232,". Dans mon eau , Creezy ajoute un produit violet"
Marceau-Felicien_Creezy_<Creezy-323>_9243,fait de la mousse . Creezy rit . Elle vide
Marceau-Felicien_Creezy_<Creezy-323>_9246,mousse . Creezy rit . Elle vide tout le flacon
Marceau-Felicien_Creezy_<Creezy-323>_9301,"loin , il y a Creezy qui rit , Creezy"
Marceau-Felicien_Creezy_<Creezy-323>_9302,", il y a Creezy qui rit , Creezy qui"
Marceau-Felicien_Creezy_<Creezy-323>_9305,"a Creezy qui rit , Creezy qui est nue ,"
Marceau-Felicien_Creezy_<Creezy-323>_9306,"Creezy qui rit , Creezy qui est nue , Creezy"
Marceau-Felicien_Creezy_<Creezy-323>_9310,"Creezy qui est nue , Creezy qui me ramène des"
Marceau-Felicien_Creezy_<Creezy-323>_9311,"qui est nue , Creezy qui me ramène des paquets"
Marceau-Felicien_Creezy_<Creezy-323>_9322,"mousse sur la tête , Creezy qui s' en va"
Marceau-Felicien_Creezy_<Creezy-323>_9323,"sur la tête , Creezy qui s' en va ,"
Marceau-Felicien_Creezy_<Creezy-323>_9329,"s' en va , de son pas de mannequin ,"
Marceau-Felicien_Creezy_<Creezy-323>_9334,"son pas de mannequin , qui revient , j' émerge"
Marceau-Felicien_Creezy_<Creezy-323>_9349,"en ai encore partout , Creezy me passe un peignoir"
Marceau-Felicien_Creezy_<Creezy-323>_9360,"bain , un peignoir à elle , vert laitue ,"
Marceau-Felicien_Creezy_<Creezy-323>_9374,. On pourrait penser que Creezy est frêle . Elle
Marceau-Felicien_Creezy_<Creezy-323>_9378,que Creezy est frêle . Elle ne l' est pas
Marceau-Felicien_Creezy_<Creezy-323>_9384,ne l' est pas . Elle a des épaules de
Marceau-Felicien_Creezy_<Creezy-323>_9399,"jour , en luttant avec elle , je m' en"
Marceau-Felicien_Creezy_<Creezy-323>_9408,en suis rendu compte : elle est forte comme un
Marceau-Felicien_Creezy_<Creezy-323>_9416,comme un Turc . Je la rejoins dans le living
Marceau-Felicien_Creezy_<Creezy-323>_9422,rejoins dans le living . Elle a passé un peignoir
Marceau-Felicien_Creezy_<Creezy-323>_9428,"a passé un peignoir , elle aussi , vert olive"
Marceau-Felicien_Creezy_<Creezy-323>_9437,"olive , très court . Elle est assise par terre"
Marceau-Felicien_Creezy_<Creezy-323>_9448,sur la moquette ardoise . Elle regarde la télévision .
Marceau-Felicien_Creezy_<Creezy-323>_9456,"télévision . Moi , je la regarde , elle ."
Marceau-Felicien_Creezy_<Creezy-323>_9459,", je la regarde , elle . Couché par terre"
Marceau-Felicien_Creezy_<Creezy-323>_9468,"terre , la nuque sur sa cuisse , je la"
Marceau-Felicien_Creezy_<Creezy-323>_9472,"sur sa cuisse , je la regarde de bas en"
Marceau-Felicien_Creezy_<Creezy-323>_9479,de bas en haut . Elle a des yeux très
Marceau-Felicien_Creezy_<Creezy-323>_9610,rose de cinquante contraventions . Elle m' apporte ses disques
Marceau-Felicien_Creezy_<Creezy-323>_9613,"contraventions . Elle m' apporte ses disques et moi ,"
Marceau-Felicien_Creezy_<Creezy-323>_9635,"genres . Un moment , elle debout , moi à"
Marceau-Felicien_Creezy_<Creezy-323>_9642,", moi à genoux , elle me tendant les disques"
Marceau-Felicien_Creezy_<Creezy-323>_9711,qui foncent sur moi . Elle se met à genoux
Marceau-Felicien_Creezy_<Creezy-323>_9725,"en face de moi , ses genoux nus sous le"
Marceau-Felicien_Creezy_<Creezy-323>_9739,"puis près de moi , elle se coule près de"
Marceau-Felicien_Creezy_<Creezy-323>_9757,il y a maintenant dans son regard . Elle a
Marceau-Felicien_Creezy_<Creezy-323>_9760,maintenant dans son regard . Elle a l' air de
Marceau-Felicien_Creezy_<Creezy-323>_9774,"je fais là , dans sa vie , au milieu"
Marceau-Felicien_Creezy_<Creezy-323>_9780,"vie , au milieu de ses disques , quel rôle"
Marceau-Felicien_Creezy_<Creezy-323>_9834,? Qui a - t - elle pu rencontrer avant
Marceau-Felicien_Creezy_<Creezy-323>_9848,songe même pas à le lui demander . Dans l'
Marceau-Felicien_Creezy_<Creezy-323>_9870,"et aboli avec lui . Elle et moi , elle"
Marceau-Felicien_Creezy_<Creezy-323>_9874,". Elle et moi , elle pour moi et ,"
Marceau-Felicien_Creezy_<Creezy-323>_9884,"plus encore , moi pour elle , nous sommes nés"
Marceau-Felicien_Creezy_<Creezy-323>_9989,", il y a eu Creezy , c' est tout"
Marceau-Felicien_Creezy_<Creezy-323>_9997,"est tout , née de ses affiches , surgie des"
Marceau-Felicien_Creezy_<Creezy-323>_10011,"de l' aéroport , déjà son âge , déjà son"
Marceau-Felicien_Creezy_<Creezy-323>_10015,"déjà son âge , déjà son profil de pharaonne ,"
Marceau-Felicien_Creezy_<Creezy-323>_10021,"profil de pharaonne , déjà sa démarche de mannequin et"
Marceau-Felicien_Creezy_<Creezy-323>_10026,sa démarche de mannequin et son cou dressé comme celui
Marceau-Felicien_Creezy_<Creezy-323>_10037,l' oiseau à aigrette . Elle penche la tête .
Marceau-Felicien_Creezy_<Creezy-323>_10042,Elle penche la tête . Son épaule est contre la
Marceau-Felicien_Creezy_<Creezy-323>_10049,est contre la mienne . Sa bouche s' accroche à
Marceau-Felicien_Creezy_<Creezy-323>_10057,"accroche à ma bouche , sa bouche est dans ma"
Marceau-Felicien_Creezy_<Creezy-323>_10079,"ardoise . J' entre en elle , je suis en"
Marceau-Felicien_Creezy_<Creezy-323>_10084,"elle , je suis en elle , elle bat la"
Marceau-Felicien_Creezy_<Creezy-323>_10086,"je suis en elle , elle bat la tête ,"
Marceau-Felicien_Creezy_<Creezy-323>_10105,"puis , un moment , elle garde la tête immobile"
Marceau-Felicien_Creezy_<Creezy-323>_10121,"moquette ardoise , comme si elle écoutait , comme si"
Marceau-Felicien_Creezy_<Creezy-323>_10126,"elle écoutait , comme si son corps écoutait le mien"
Marceau-Felicien_Creezy_<Creezy-323>_10133,"écoutait le mien , puis sa bouche est encore dans"
Marceau-Felicien_Creezy_<Creezy-323>_10167,"vert olive , et je la soulève et son corps"
Marceau-Felicien_Creezy_<Creezy-323>_10170,et je la soulève et son corps est arqué contre
Marceau-Felicien_Creezy_<Creezy-323>_10181,"mien et je suis en elle et elle tangue ,"
Marceau-Felicien_Creezy_<Creezy-323>_10183,"je suis en elle et elle tangue , son corps"
Marceau-Felicien_Creezy_<Creezy-323>_10186,"elle et elle tangue , son corps sous le mien"
Marceau-Felicien_Creezy_<Creezy-323>_10196,"est comme une houle , ses talons battent sur la"
Marceau-Felicien_Creezy_<Creezy-323>_10206,"moquette , je suis dans son ventre , tous ses"
Marceau-Felicien_Creezy_<Creezy-323>_10210,"dans son ventre , tous ses muscles autour de moi"
Marceau-Felicien_Creezy_<Creezy-323>_10234,"vers les profondeurs , et ses mains , ses mains"
Marceau-Felicien_Creezy_<Creezy-323>_10237,", et ses mains , ses mains sont crispées sur"
Marceau-Felicien_Creezy_<Creezy-323>_10266,"mes reins , je sauve une petite noyée , mon"
Marceau-Felicien_Creezy_<Creezy-323>_10278,"ma Creezy , je mords son cou , il y"
Marceau-Felicien_Creezy_<Creezy-323>_10289,"une petite vie rapide , elle est tendue , cabrée"
Marceau-Felicien_Creezy_<Creezy-323>_10295,"est tendue , cabrée , son corps arc - bouté"
Marceau-Felicien_Creezy_<Creezy-323>_10301,"corps arc - bouté , ses muscles durs , sa"
Marceau-Felicien_Creezy_<Creezy-323>_10305,", ses muscles durs , sa bouche dans ma bouche"
Marceau-Felicien_Creezy_<Creezy-323>_10311,"bouche dans ma bouche , son ventre devenu mon ventre"
Marceau-Felicien_Creezy_<Creezy-323>_10317,"ventre devenu mon ventre , elle geint , elle gémit"
Marceau-Felicien_Creezy_<Creezy-323>_10320,"ventre , elle geint , elle gémit , un gémissement"
Marceau-Felicien_Creezy_<Creezy-323>_10329,"gémissement bref , saccadé , son corps qui s' ouvre"
Marceau-Felicien_Creezy_<Creezy-323>_10343,"encore , je suis dans son corps et elle dit"
Marceau-Felicien_Creezy_<Creezy-323>_10346,"suis dans son corps et elle dit : Viens ,"
Marceau-Felicien_Creezy_<Creezy-323>_10385,", je m' abats sur sa bouche et , dans"
Marceau-Felicien_Creezy_<Creezy-323>_10409,"un soupir , nous , toi , moi dans toi"
Marceau-Felicien_Creezy_<Creezy-323>_10413,", toi , moi dans toi , ma Creezy ,"
Marceau-Felicien_Creezy_<Creezy-323>_10541,Quel avion ? » dit Creezy . Nous décidons d'
Marceau-Felicien_Creezy_<Creezy-323>_10582,cinéma finit par disparaître . Creezy met un disque puis
Marceau-Felicien_Creezy_<Creezy-323>_10587,Creezy met un disque puis elle l' arrête . Nous
Marceau-Felicien_Creezy_<Creezy-323>_10623,"ça . Un moment , Creezy est montée dans sa"
Marceau-Felicien_Creezy_<Creezy-323>_10627,", Creezy est montée dans sa chambre . Je l'"
Marceau-Felicien_Creezy_<Creezy-323>_10631,dans sa chambre . Je l' y rejoins . Elle
Marceau-Felicien_Creezy_<Creezy-323>_10635,Je l' y rejoins . Elle s' étend sur le
Marceau-Felicien_Creezy_<Creezy-323>_10647,"Je m' étends près d' elle , même pas très"
Marceau-Felicien_Creezy_<Creezy-323>_10654,"même pas très près , elle sur le dos ,"
Marceau-Felicien_Creezy_<Creezy-323>_10670,bouche sur la saignée de son coude . Puis nous
Marceau-Felicien_Creezy_<Creezy-323>_10683,"moi sur le dos , elle blottie dans mes bras"
Marceau-Felicien_Creezy_<Creezy-323>_10689,"blottie dans mes bras , son visage sur ma poitrine"
Marceau-Felicien_Creezy_<Creezy-323>_10784,long de la nuit . Elle s' est endormie .
Marceau-Felicien_Creezy_<Creezy-323>_10796,", j' ai veillé sur elle . Puis , je"
Marceau-Felicien_Creezy_<Je-316>_8346,jette n' importe où . Je les ramasse . Je
Marceau-Felicien_Creezy_<Je-316>_8350,. Je les ramasse . Je les empile . Cela
Marceau-Felicien_Creezy_<Je-316>_8379,. Son regard passe sur moi mais sans s' arrêter
Marceau-Felicien_Creezy_<Je-316>_8392,lumière d' un phare . J' ai enlevé mon veston
Marceau-Felicien_Creezy_<Je-316>_8395,phare . J' ai enlevé mon veston . Je vais
Marceau-Felicien_Creezy_<Je-316>_8398,ai enlevé mon veston . Je vais vers elle pour
Marceau-Felicien_Creezy_<Je-316>_8421,les yeux . Elle regarde ma main sur la fermeture
Marceau-Felicien_Creezy_<Je-316>_8438,", étroit et long , moi avec mon slip court"
Marceau-Felicien_Creezy_<Je-316>_8440,"et long , moi avec mon slip court , c��est"
Marceau-Felicien_Creezy_<Je-316>_8516,"vendredi . Le dimanche , je suis revenu . A"
Marceau-Felicien_Creezy_<Je-316>_8523,"revenu . A Betty , j' ai dit que j'"
Marceau-Felicien_Creezy_<Je-316>_8527,", j' ai dit que j' avais un voyage à"
Marceau-Felicien_Creezy_<Je-316>_8534,un voyage à faire . J' arrive chez Creezy .
Marceau-Felicien_Creezy_<Je-316>_8561,reste avec des amis . J' emmène Creezy déjeuner à
Marceau-Felicien_Creezy_<Je-316>_8692,", elle se penche vers moi , secoue ses cheveux"
Marceau-Felicien_Creezy_<Je-316>_8698,", secoue ses cheveux contre moi et sa joue ,"
Marceau-Felicien_Creezy_<Je-316>_8728,va entre les arbres . Je propose de nous arrêter
Marceau-Felicien_Creezy_<Je-316>_8739,— Vous n' allez pas me dire que vous aimez
Marceau-Felicien_Creezy_<Je-316>_8757,voix un insondable mépris . Je reste ferme : j'
Marceau-Felicien_Creezy_<Je-316>_8761,. Je reste ferme : j' aime la campagne .
Marceau-Felicien_Creezy_<Je-316>_8766,j' aime la campagne . Je pars dans un discours
Marceau-Felicien_Creezy_<Je-316>_8842,pas du tout . Comme je lui mets dans le
