,text_surronding
Mauriac-François_Le-baiser-au-lepreux_<M . Jérôme-710>_13295,plus comme naguère soutenir avec M . Jérôme des colloques
Mauriac-François_Le-baiser-au-lepreux_<M . Jérôme-710>_13422,ailleurs . . . » M . Jérôme assurait qu'
Mauriac-François_Le-baiser-au-lepreux_<M . Jérôme-710>_13427,M . Jérôme assurait qu' il n' avait vu le
Mauriac-François_Le-baiser-au-lepreux_<M . Jérôme-710>_13461,funèbre de la fabrique . Le curé aurait voulu que
Mauriac-François_Le-baiser-au-lepreux_<M . Jérôme-710>_13557,". Un soir , comme M . Jérôme s' était"
Mauriac-François_Le-baiser-au-lepreux_<M . Jérôme-710>_13564,"Jérôme s' était retiré , le curé revint avec obstination"
Mauriac-François_Le-baiser-au-lepreux_<M . Jérôme-710>_13610,". . «Et pourquoi , mon cher enfant , ne"
Mauriac-François_Le-baiser-au-lepreux_<M . Jérôme-710>_13620,le feriez - vous pas?» Le curé posa à mi
Mauriac-François_Le-baiser-au-lepreux_<M . Jérôme-710>_13629,mi - voix cette question; il jouait avec la frange
Mauriac-François_Le-baiser-au-lepreux_<M . Jérôme-710>_13635,"jouait avec la frange de sa ceinture , et ne"
Mauriac-François_Le-baiser-au-lepreux_<M . Jérôme-710>_13642,", et ne détournait pas ses yeux du feu ."
Mauriac-François_Le-baiser-au-lepreux_<M . Jérôme-710>_13657,ne veux pas que Jean me quitte . » Mais
Mauriac-François_Le-baiser-au-lepreux_<M . Jérôme-710>_13662,me quitte . » Mais le curé insista: c' est
Mauriac-François_Le-baiser-au-lepreux_<M . Jérôme-710>_13705,ouvrier inutile . . . Le saint homme développait ce
Mauriac-François_Le-baiser-au-lepreux_<M . Jérôme-710>_13729,"Jean s' en va , je partirai avec lui ."
Mauriac-François_Le-baiser-au-lepreux_<M . Jérôme-710>_13737,lui . . . » Le curé secoua la tête:
Mauriac-François_Le-baiser-au-lepreux_<M . Jérôme-710>_13770,quelques mois . . . Noémi ne trouva plus la
Mauriac-François_Le-baiser-au-lepreux_<M . Jérôme-710>_13789,prononcée jusqu' à ce que le curé eût remis sa
Mauriac-François_Le-baiser-au-lepreux_<M . Jérôme-710>_13793,que le curé eût remis sa douillette et chaussé des
Mauriac-François_Le-baiser-au-lepreux_<M . Jérôme-710>_13800,et chaussé des sabots . Jean Péloueyre s' enveloppa d'
Mauriac-François_Le-baiser-au-lepreux_<M . Jérôme-710>_13808,"enveloppa d' une pélerine , alluma la lanterne et précéda"
Mauriac-François_Le-baiser-au-lepreux_<M . Jérôme-710>_13812,", alluma la lanterne et précéda son hôte . Le"
Mauriac-François_Le-baiser-au-lepreux_<M . Jérôme-710>_13813,alluma la lanterne et précéda son hôte . Le pluvieux
Mauriac-François_Le-baiser-au-lepreux_<M . Jérôme-710>_13832,époux de se fuir—sauf lorsque Jean Péloueyre chassait la bécasse;
Mauriac-François_Le-baiser-au-lepreux_<M . Jérôme-710>_13889,gauche et geignait . Mais Noémi allait mieux . Elle
Mauriac-François_Le-baiser-au-lepreux_<M . Jérôme-710>_13893,Mais Noémi allait mieux . Elle s' obligeait à un
Mauriac-François_Le-baiser-au-lepreux_<M . Jérôme-710>_13902,un effort quotidien pour détourner Jean de ses projets de
Mauriac-François_Le-baiser-au-lepreux_<M . Jérôme-710>_13904,quotidien pour détourner Jean de ses projets de voyage; elle
Mauriac-François_Le-baiser-au-lepreux_<M . Jérôme-710>_13908,de ses projets de voyage; elle avait promis au ciel
Mauriac-François_Le-baiser-au-lepreux_<M . Jérôme-710>_13919,tenter l' impossible pour qu' il demeurât près d' elle
Mauriac-François_Le-baiser-au-lepreux_<M . Jérôme-710>_13923,qu' il demeurât près d' elle . Cette supplication empêchait
Mauriac-François_Le-baiser-au-lepreux_<M . Jérôme-710>_13928,elle . Cette supplication empêchait le malheureux de rester indécis
Mauriac-François_Le-baiser-au-lepreux_<M . Jérôme-710>_13945,"en ayant l' air de le retenir , le forçait"
Mauriac-François_Le-baiser-au-lepreux_<M . Jérôme-710>_13948,"air de le retenir , le forçait à prendre parti"
Mauriac-François_Le-baiser-au-lepreux_<M . Jérôme-710>_13954,forçait à prendre parti . Il levait vers la jeune
Mauriac-François_Le-baiser-au-lepreux_<M . Jérôme-710>_13957,parti . Il levait vers la jeune femme ses yeux
Mauriac-François_Le-baiser-au-lepreux_<M . Jérôme-710>_13960,levait vers la jeune femme ses yeux de chien battu:
Mauriac-François_Le-baiser-au-lepreux_<M . Jérôme-710>_13968,"chien battu: «Il faut que je m' en aille ,"
Mauriac-François_Le-baiser-au-lepreux_<M . Jérôme-710>_13973,"je m' en aille , Noémi» . Elle protestait ,"
Mauriac-François_Le-baiser-au-lepreux_<M . Jérôme-710>_13975,"en aille , Noémi» . Elle protestait , mais s'"
Mauriac-François_Le-baiser-au-lepreux_<M . Jérôme-710>_13980,"Elle protestait , mais s' il faisait semblant de fléchir"
Mauriac-François_Le-baiser-au-lepreux_<M . Jérôme-710>_13989,"fléchir , loin de poursuivre son avantage elle n' insistait"
Mauriac-François_Le-baiser-au-lepreux_<M . Jérôme-710>_13991,loin de poursuivre son avantage elle n' insistait plus .
Mauriac-François_Le-baiser-au-lepreux_<M . Jérôme-710>_14041,"en toutes rencontres , harcelait Jean Péloueyre . Que pouvait"
Mauriac-François_Le-baiser-au-lepreux_<M . Jérôme-710>_14046,Jean Péloueyre . Que pouvait le triste garçon contre cette
Mauriac-François_Le-baiser-au-lepreux_<M . Jérôme-710>_14054,contre cette complicité? D' ailleurs il approuvait dans son cœur
Mauriac-François_Le-baiser-au-lepreux_<M . Jérôme-710>_14057,D' ailleurs il approuvait dans son cœur ce verdict de
Mauriac-François_Le-baiser-au-lepreux_<M . Jérôme-710>_14070,un pèlerinage à Lourdes et ses nuits d' amour à
Mauriac-François_Le-baiser-au-lepreux_<M . Jérôme-710>_14077,"d' amour à Arcachon , il n' avait jamais quitté"
Mauriac-François_Le-baiser-au-lepreux_<M . Jérôme-710>_14082,il n' avait jamais quitté son trou . S' enfoncer
Mauriac-François_Le-baiser-au-lepreux_<M . Jérôme-710>_14097,de Paris! C' était pour lui sombrer à jamais au
Mauriac-François_Le-baiser-au-lepreux_<M . Jérôme-710>_14117,. Mais trop de cœurs le poussaient vers le gouffre
Mauriac-François_Le-baiser-au-lepreux_<M . Jérôme-710>_14139,". Longtemps en avance , Noémi s' inquiéta de la"
Mauriac-François_Le-baiser-au-lepreux_<M . Jérôme-710>_14149,malle et du trousseau . Jean Péloueyre était là encore
Mauriac-François_Le-baiser-au-lepreux_<M . Jérôme-710>_14155,Péloueyre était là encore qu' elle avait déjà retrouvé quelque
Mauriac-François_Le-baiser-au-lepreux_<M . Jérôme-710>_14162,déjà retrouvé quelque appétit . Ses joues se colorèrent .
Mauriac-François_Le-baiser-au-lepreux_<M . Jérôme-710>_14174,"- midi de neige , elle en fit des pelotes"
Mauriac-François_Le-baiser-au-lepreux_<M . Jérôme-710>_14181,fit des pelotes et les jeta à la figure du
Mauriac-François_Le-baiser-au-lepreux_<M . Jérôme-710>_14185,les jeta à la figure du petit - fils de
Mauriac-François_Le-baiser-au-lepreux_<M . Jérôme-710>_14193,"fils de Cadette , et Jean Péloueyre , derrière une"
Mauriac-François_Le-baiser-au-lepreux_<M . Jérôme-710>_14208,"les regardait . Lucide , il assistait à cette résurrection"
Mauriac-François_Le-baiser-au-lepreux_<M . Jérôme-710>_14223,"délivre de l' hiver , cette femme se délivrait de"
Mauriac-François_Le-baiser-au-lepreux_<M . Jérôme-710>_14228,cette femme se délivrait de lui: il la fuyait pour
Mauriac-François_Le-baiser-au-lepreux_<M . Jérôme-710>_14229,femme se délivrait de lui: il la fuyait pour qu'
Mauriac-François_Le-baiser-au-lepreux_<M . Jérôme-710>_14230,se délivrait de lui: il la fuyait pour qu' elle
Mauriac-François_Le-baiser-au-lepreux_<M . Jérôme-710>_14234,il la fuyait pour qu' elle refleurît . Jean Péloueyre
Mauriac-François_Le-baiser-au-lepreux_<M . Jérôme-710>_14237,"pour qu' elle refleurît . Jean Péloueyre , ayant baissé"
Mauriac-François_Le-baiser-au-lepreux_<M . Jérôme-710>_14258,s' agiter le mouchoir de Noémi . Comme il flottait
Mauriac-François_Le-baiser-au-lepreux_<M . Jérôme-710>_14276,"Pendant cette dernière semaine , elle avait saoûlé le voyageur"
Mauriac-François_Le-baiser-au-lepreux_<M . Jérôme-710>_14279,"semaine , elle avait saoûlé le voyageur d' une feinte"
Mauriac-François_Le-baiser-au-lepreux_<M . Jérôme-710>_14288,"feinte tendresse , et ardente l' avait provoqué jusqu' à"
Mauriac-François_Le-baiser-au-lepreux_<M . Jérôme-710>_14293,"l' avait provoqué jusqu' à lui faire murmurer , une"
Mauriac-François_Le-baiser-au-lepreux_<M . Jérôme-710>_14300,"murmurer , une nuit où il avait cru la sentir"
Mauriac-François_Le-baiser-au-lepreux_<M . Jérôme-710>_14303,nuit où il avait cru la sentir vivre sous son
Mauriac-François_Le-baiser-au-lepreux_<M . Jérôme-710>_14307,cru la sentir vivre sous son souffle: «Et si je
Mauriac-François_Le-baiser-au-lepreux_<M . Jérôme-710>_14311,"sous son souffle: «Et si je ne partais pas ,"
Mauriac-François_Le-baiser-au-lepreux_<M . Jérôme-710>_14316,"je ne partais pas , Noémi?» Ah! bien que ce"
Mauriac-François_Le-baiser-au-lepreux_<M . Jérôme-710>_14327,dans les ténèbres et qu' elle n' eût répondu que
Mauriac-François_Le-baiser-au-lepreux_<M . Jérôme-710>_14337,"par une exclamation étouffée , il devina cette terreur ,"
Mauriac-François_Le-baiser-au-lepreux_<M . Jérôme-710>_14347,"cette horreur , et ne put se défendre d' ajouter:"
Mauriac-François_Le-baiser-au-lepreux_<M . Jérôme-710>_14353,"se défendre d' ajouter: «Rassure - toi , je m'"
Mauriac-François_Le-baiser-au-lepreux_<M . Jérôme-710>_14356,"ajouter: «Rassure - toi , je m' en irai ."
Mauriac-François_Le-baiser-au-lepreux_<M . Jérôme-710>_14369,le seul mot par quoi il manifesta qu' il n'
Mauriac-François_Le-baiser-au-lepreux_<M . Jérôme-710>_14372,par quoi il manifesta qu' il n' était pas dupe
Mauriac-François_Le-baiser-au-lepreux_<M . Jérôme-710>_14378,n' était pas dupe . Elle se tourna vers le
Mauriac-François_Le-baiser-au-lepreux_<M . Jérôme-710>_14385,tourna vers le mur et il l' entendit pleurer .
Mauriac-François_Le-baiser-au-lepreux_<M . Jérôme-710>_14386,vers le mur et il l' entendit pleurer . Jean
Mauriac-François_Le-baiser-au-lepreux_<M . Jérôme-710>_14390,il l' entendit pleurer . Jean Péloueyre regarda défiler les
Mauriac-François_Le-baiser-au-lepreux_<M . Jérôme-710>_14402,que traversait le petit train; il reconnut ce fourré où
Mauriac-François_Le-baiser-au-lepreux_<M . Jérôme-710>_14407,il reconnut ce fourré où il avait manqué une bécasse
Mauriac-François_Le-baiser-au-lepreux_<M . Jérôme-710>_14419,voie longeait la route qu' il avait si souvent parcourue
Mauriac-François_Le-baiser-au-lepreux_<M . Jérôme-710>_14459,"étable , le puits , il la salua par son"
Mauriac-François_Le-baiser-au-lepreux_<M . Jérôme-710>_14466,"salua par son nom , il en connaissait le propriétaire"
Mauriac-François_Le-baiser-au-lepreux_<M . Jérôme-710>_14476,. Puis un nouveau train l' emporta à travers des
Mauriac-François_Le-baiser-au-lepreux_<M . Jérôme-710>_14483,à travers des landes où il n' avait jamais chassé
Mauriac-François_Le-baiser-au-lepreux_<M . Jérôme-710>_14492,"chassé . A Langon , il dit adieu aux derniers"
Mauriac-François_Le-baiser-au-lepreux_<M . Jérôme-710>_14503,comme à des amis qui l' eussent accompagné le plus
Mauriac-François_Le-baiser-au-lepreux_<M . Jérôme-710>_14520,et de leurs branches étendues le bénissaient . Il se
Mauriac-François_Le-baiser-au-lepreux_<M . Jérôme-710>_14523,branches étendues le bénissaient . Il se logea dans le
Mauriac-François_Le-baiser-au-lepreux_<M . Jérôme-710>_14531,dans le premier hôtel qu' il rencontra quai Voltaire .
Mauriac-François_Le-baiser-au-lepreux_<M . Jérôme-710>_14539,"Voltaire . Le matin , il regardait pleuvoir sur la"
Mauriac-François_Le-baiser-au-lepreux_<M . Jérôme-710>_14546,pleuvoir sur la Seine qu' il n' avait encore osé
Mauriac-François_Le-baiser-au-lepreux_<M . Jérôme-710>_14569,"la gare d' Orléans où il somnolait , dans le"
Mauriac-François_Le-baiser-au-lepreux_<M . Jérôme-710>_14593,"N' osant s' attarder , son repas fini , sans"
Mauriac-François_Le-baiser-au-lepreux_<M . Jérôme-710>_14600,"fini , sans consommer , il buvait après sa bouteille"
Mauriac-François_Le-baiser-au-lepreux_<M . Jérôme-710>_14603,"consommer , il buvait après sa bouteille de vin blanc"
Mauriac-François_Le-baiser-au-lepreux_<M . Jérôme-710>_14615,"verres de liqueur , et son agile esprit se mouvait"
Mauriac-François_Le-baiser-au-lepreux_<M . Jérôme-710>_14624,"mouvait dans l' absolu . Ses tics , des mots"
Mauriac-François_Le-baiser-au-lepreux_<M . Jérôme-710>_14651,"porte et une colonne , il demeurait le plus souvent"
Mauriac-François_Le-baiser-au-lepreux_<M . Jérôme-710>_14662,". Jusqu' aux réclames , il lisait les journaux: meurtres"
Mauriac-François_Le-baiser-au-lepreux_<M . Jérôme-710>_14683,", tout était bon à Jean Péloueyre qui se repaissait"
Mauriac-François_Le-baiser-au-lepreux_<M . Jérôme-710>_14685,était bon à Jean Péloueyre qui se repaissait du mal
Mauriac-François_Le-baiser-au-lepreux_<M . Jérôme-710>_14701,un ticket de deux sous lui donnait accès aux quais:
Mauriac-François_Le-baiser-au-lepreux_<M . Jérôme-710>_14706,lui donnait accès aux quais: il cherchait le wagon où
Mauriac-François_Le-baiser-au-lepreux_<M . Jérôme-710>_14732,refléteraient les landes monotones . Il avait calculé que ce
Mauriac-François_Le-baiser-au-lepreux_<M . Jérôme-710>_14755,de la maison Péloueyre . Il posait sa main sur
Mauriac-François_Le-baiser-au-lepreux_<M . Jérôme-710>_14757,maison Péloueyre . Il posait sa main sur la paroi
Mauriac-François_Le-baiser-au-lepreux_<M . Jérôme-710>_14794,"café , où de nouveau il s' attablait , c'"
Mauriac-François_Le-baiser-au-lepreux_<M . Jérôme-710>_14806,heure d' un orchestre et Jean Péloueyre subissait jusqu' au
Mauriac-François_Le-baiser-au-lepreux_<M . Jérôme-710>_14820,puissance de la musique sur son cœur . Elle le
Mauriac-François_Le-baiser-au-lepreux_<M . Jérôme-710>_14824,sur son cœur . Elle le livrait sans recours au
Mauriac-François_Le-baiser-au-lepreux_<M . Jérôme-710>_14833,au fantôme de Noémi . Il voyageait par la pensée
Mauriac-François_Le-baiser-au-lepreux_<M . Jérôme-710>_14843,sur ce corps que jamais il n' avait contemplé qu'
Mauriac-François_Le-baiser-au-lepreux_<M . Jérôme-710>_14871,"coulait sur le lit , le triste faune avait mieux"
Mauriac-François_Le-baiser-au-lepreux_<M . Jérôme-710>_14887,"si , amant heureux , il l' eût possédé dans"
Mauriac-François_Le-baiser-au-lepreux_<M . Jérôme-710>_14896,dans un mutuel délire . Il n' avait jamais tenu
Mauriac-François_Le-baiser-au-lepreux_<M . Jérôme-710>_14902,n' avait jamais tenu entre ses bras qu' un cadavre
Mauriac-François_Le-baiser-au-lepreux_<M . Jérôme-710>_14908,bras qu' un cadavre mais il l' avait réellement pénétré
Mauriac-François_Le-baiser-au-lepreux_<M . Jérôme-710>_14914,l' avait réellement pénétré avec ses yeux . Peut -
Mauriac-François_Le-baiser-au-lepreux_<M . Jérôme-710>_14972,"A travers l' espace , il sentait la joie de"
Mauriac-François_Le-baiser-au-lepreux_<M . Jérôme-710>_14977,"il sentait la joie de sa bien - aimée ,"
Mauriac-François_Le-baiser-au-lepreux_<M . Jérôme-710>_14982,"sa bien - aimée , sa joie parce qu' il"
Mauriac-François_Le-baiser-au-lepreux_<M . Jérôme-710>_14986,", sa joie parce qu' il n' était plus contre"
Mauriac-François_Le-baiser-au-lepreux_<M . Jérôme-710>_15000,"tête entre les mains , Jean Péloueyre s' excitait à"
Mauriac-François_Le-baiser-au-lepreux_<M . Jérôme-710>_15007,"s' excitait à la colère: il reviendrait au pays ,"
Mauriac-François_Le-baiser-au-lepreux_<M . Jérôme-710>_15018,"imposerait à cette femme , jouirait d' elle , dût"
Mauriac-François_Le-baiser-au-lepreux_<M . Jérôme-710>_15027,dût - elle en crever! Il en ferait un objet
Mauriac-François_Le-baiser-au-lepreux_<M . Jérôme-710>_15033,en ferait un objet à son usage . . .
Mauriac-François_Le-baiser-au-lepreux_<M . Jérôme-710>_15041,". . Alors , en lui , elle surgissait muette"
Mauriac-François_Le-baiser-au-lepreux_<M . Jérôme-710>_15063,qui tend son fruit . Il se rappelait ses consentements
Mauriac-François_Le-baiser-au-lepreux_<M . Jérôme-710>_15079,un cri . . . Jean Péloueyre payait les consommations
Mauriac-François_Le-baiser-au-lepreux_<M . Jérôme-710>_15085,"Péloueyre payait les consommations , suivait le quai jusqu' à"
Mauriac-François_Le-baiser-au-lepreux_<M . Jérôme-710>_15112,"les trois jours , on lui portait avec son chocolat"
Mauriac-François_Le-baiser-au-lepreux_<M . Jérôme-710>_15115,", on lui portait avec son chocolat une enveloppe qu'"
Mauriac-François_Le-baiser-au-lepreux_<M . Jérôme-710>_15120,son chocolat une enveloppe qu' il n' ouvrait quelquefois que
Mauriac-François_Le-baiser-au-lepreux_<M . Jérôme-710>_15130,le soir . Ah! que lui importaient ces hypocrites vœux
Mauriac-François_Le-baiser-au-lepreux_<M . Jérôme-710>_15136,importaient ces hypocrites vœux pour son retour! Le seul plaisir
Mauriac-François_Le-baiser-au-lepreux_<M . Jérôme-710>_15142,retour! Le seul plaisir de Jean Péloueyre était de penser
Mauriac-François_Le-baiser-au-lepreux_<M . Jérôme-710>_15179,"la fin de mars , il crut sentir quelque sincérité"
Mauriac-François_Le-baiser-au-lepreux_<M . Jérôme-710>_15197,. Je suis sûre que vous ne croyez pas à
Mauriac-François_Le-baiser-au-lepreux_<M . Jérôme-710>_15205,pas à mon désir de vous revoir . C' est
Mauriac-François_Le-baiser-au-lepreux_<M . Jérôme-710>_15212,. C' est mal connaître votre femme . . .
Mauriac-François_Le-baiser-au-lepreux_<M . Jérôme-710>_15225,encore: «Je m' ennuie de toi . » Jean Péloueyre
Mauriac-François_Le-baiser-au-lepreux_<M . Jérôme-710>_15228,ennuie de toi . » Jean Péloueyre froissait la lettre
Mauriac-François_Le-baiser-au-lepreux_<M . Jérôme-710>_15234,Péloueyre froissait la lettre et relisait celle que son père
Mauriac-François_Le-baiser-au-lepreux_<M . Jérôme-710>_15237,lettre et relisait celle que son père lui avait adressée
Mauriac-François_Le-baiser-au-lepreux_<M . Jérôme-710>_15239,relisait celle que son père lui avait adressée par le
Mauriac-François_Le-baiser-au-lepreux_<M . Jérôme-710>_15250,courrier: « . . . Tu trouveras Noémi changée à
Mauriac-François_Le-baiser-au-lepreux_<M . Jérôme-710>_15268,", elle est superbe; elle me soigne et me dorlotte"
Mauriac-François_Le-baiser-au-lepreux_<M . Jérôme-710>_15271,superbe; elle me soigne et me dorlotte avec tant de
Mauriac-François_Le-baiser-au-lepreux_<M . Jérôme-710>_15279,tant de bonne humeur que j' oublie de la remercier
Mauriac-François_Le-baiser-au-lepreux_<M . Jérôme-710>_15293,"paraissent plus céans , mais je sais qu' ils imaginent"
Mauriac-François_Le-baiser-au-lepreux_<M . Jérôme-710>_15308,laissons - les dire . Je reprends du poil de
Mauriac-François_Le-baiser-au-lepreux_<M . Jérôme-710>_15377,"les premiers beaux jours , Jean Péloueyre osa enfin passer"
Mauriac-François_Le-baiser-au-lepreux_<M . Jérôme-710>_15391,"un crépuscule d' or , il regarda la Seine et"
Mauriac-François_Le-baiser-au-lepreux_<M . Jérôme-710>_15396,il regarda la Seine et ses mains touchaient le parapet
Mauriac-François_Le-baiser-au-lepreux_<M . Jérôme-710>_15403,"touchaient le parapet tiède , le caressaient comme un être"
Mauriac-François_Le-baiser-au-lepreux_<M . Jérôme-710>_15414,. Alors une voix derrière lui chuchota; elle l' appelait:
Mauriac-François_Le-baiser-au-lepreux_<M . Jérôme-710>_15417,voix derrière lui chuchota; elle l' appelait: chéri; elle lui
Mauriac-François_Le-baiser-au-lepreux_<M . Jérôme-710>_15419,lui chuchota; elle l' appelait: chéri; elle lui disait: viens
Mauriac-François_Le-baiser-au-lepreux_<M . Jérôme-710>_15421,elle l' appelait: chéri; elle lui disait: viens . Tout
Mauriac-François_Le-baiser-au-lepreux_<M . Jérôme-710>_15446,gonflée et sans ongles cherchait sa main . Il prit
Mauriac-François_Le-baiser-au-lepreux_<M . Jérôme-710>_15449,"ongles cherchait sa main . Il prit la fuite ,"
Mauriac-François_Le-baiser-au-lepreux_<M . Jérôme-710>_15456,"la fuite , ne s' arrêta qu' aux guichets du"
Mauriac-François_Le-baiser-au-lepreux_<M . Jérôme-710>_15473,"de telles créatures , aurait - il jamais osé attendre"
Mauriac-François_Le-baiser-au-lepreux_<M . Jérôme-710>_15488,"que Noémi? . . . Il voulut , pour la"
Mauriac-François_Le-baiser-au-lepreux_<M . Jérôme-710>_15518,mais un si pauvre bonheur lui demeurait inconcevable; il reçut
Mauriac-François_Le-baiser-au-lepreux_<M . Jérôme-710>_15521,pauvre bonheur lui demeurait inconcevable; il reçut l' âcre connaissance
Mauriac-François_Le-baiser-au-lepreux_<M . Jérôme-710>_15533,"comble d' infortune , en éprouva un retour de colère"
Mauriac-François_Le-baiser-au-lepreux_<M . Jérôme-710>_15573,", ces dispensatrices de caresses? Il vit trembler le ciel"
Mauriac-François_Le-baiser-au-lepreux_<M . Jérôme-710>_15593,s' attroupaient à cause de ses gestes . Il fila
Mauriac-François_Le-baiser-au-lepreux_<M . Jérôme-710>_15596,"cause de ses gestes . Il fila , le dos"
Mauriac-François_Le-baiser-au-lepreux_<M . Jérôme-710>_15607,", contourna la place , atteignit la rue Royale et"
Mauriac-François_Le-baiser-au-lepreux_<M . Jérôme-710>_15621,"l' heure de dîner , osa franchir le seuil d'"
Mauriac-François_Le-baiser-au-lepreux_<M . Jérôme-710>_15654,"à aigrettes s' accrochent , il éprouvait avec délices que"
Mauriac-François_Le-baiser-au-lepreux_<M . Jérôme-710>_15659,il éprouvait avec délices que son aspect ici n' étonnait
Mauriac-François_Le-baiser-au-lepreux_<M . Jérôme-710>_15712,Péloueyre . Le Vouvray colorait ses pommettes et il souriait
Mauriac-François_Le-baiser-au-lepreux_<M . Jérôme-710>_15715,Vouvray colorait ses pommettes et il souriait au bétail qu'
Mauriac-François_Le-baiser-au-lepreux_<M . Jérôme-710>_15734,"glissa de son tabouret , lui demanda du feu ,"
Mauriac-François_Le-baiser-au-lepreux_<M . Jérôme-710>_15795,"font des prix avantageux» , Jean Péloueyre paya l' addition"
Mauriac-François_Le-baiser-au-lepreux_<M . Jérôme-710>_15804,addition et sur le trottoir fut rejoint par la dame
Mauriac-François_Le-baiser-au-lepreux_<M . Jérôme-710>_15817,un taxi et fit descendre le client derrière la Madeleine
Mauriac-François_Le-baiser-au-lepreux_<M . Jérôme-710>_15854,"sur du marbre , éveilla Jean de sa léthargie ."
Mauriac-François_Le-baiser-au-lepreux_<M . Jérôme-710>_15856,"marbre , éveilla Jean de sa léthargie . Il vit"
Mauriac-François_Le-baiser-au-lepreux_<M . Jérôme-710>_15859,Jean de sa léthargie . Il vit des bras démesurément
Mauriac-François_Le-baiser-au-lepreux_<M . Jérôme-710>_15884,cette chair tremblante . Elle l' appela son loup tandis
Mauriac-François_Le-baiser-au-lepreux_<M . Jérôme-710>_15917,"cette soumission sans dégoût , Jean Péloueyre en éprouvait une"
Mauriac-François_Le-baiser-au-lepreux_<M . Jérôme-710>_15929,"que lorsque , de toute sa chair , Noémi lui"
Mauriac-François_Le-baiser-au-lepreux_<M . Jérôme-710>_15933,"toute sa chair , Noémi lui criait: Non! Stupide ,"
Mauriac-François_Le-baiser-au-lepreux_<M . Jérôme-710>_15940,"Non! Stupide , la fille le vit jeter un billet"
Mauriac-François_Le-baiser-au-lepreux_<M . Jérôme-710>_15959,"pu faire un geste , il était déjà dehors ,"
Mauriac-François_Le-baiser-au-lepreux_<M . Jérôme-710>_15964,"il était déjà dehors , enfilait une rue comme un"
Mauriac-François_Le-baiser-au-lepreux_<M . Jérôme-710>_15971,"rue comme un voleur . Il goûta , dans la"
Mauriac-François_Le-baiser-au-lepreux_<M . Jérôme-710>_15995,nus des Champs - Elysées l' attirèrent . Un banc
Mauriac-François_Le-baiser-au-lepreux_<M . Jérôme-710>_16002,". Un banc était libre; il s' y reposa ,"
Mauriac-François_Le-baiser-au-lepreux_<M . Jérôme-710>_16022,"les lampes à arc , il songea qu' elle épandait"
Mauriac-François_Le-baiser-au-lepreux_<M . Jérôme-710>_16025,"arc , il songea qu' elle épandait sa lueur calme"
Mauriac-François_Le-baiser-au-lepreux_<M . Jérôme-710>_16043,"Pyrénées et l' Océan . Il ne souffrait plus ,"
Mauriac-François_Le-baiser-au-lepreux_<M . Jérôme-710>_16052,", tout était pur en lui . Il se délectait"
Mauriac-François_Le-baiser-au-lepreux_<M . Jérôme-710>_16054,était pur en lui . Il se délectait de sa
Mauriac-François_Le-baiser-au-lepreux_<M . Jérôme-710>_16058,. Il se délectait de sa misère sans souillure .
Mauriac-François_Le-baiser-au-lepreux_<M . Jérôme-710>_16078,sans déclin . D' avance il goûta l' accord de
Mauriac-François_Le-baiser-au-lepreux_<M . Jérôme-710>_16121,"nous devenons vos affranchis , Seigneur . » Un sergent"
Mauriac-François_Le-baiser-au-lepreux_<M . Jérôme-710>_16132,"ville s' étant approché , le considéra un instant ,"
Mauriac-François_Le-baiser-au-lepreux_<M . Jérôme-710>_16146,"soulevées , s' éloigna . Jean s' installa , chaque"
Mauriac-François_Le-baiser-au-lepreux_<M . Jérôme-710>_16186,"stupéfiants , avaient repétri à il ne savait quelle immonde"
Mauriac-François_Le-baiser-au-lepreux_<M . Jérôme-710>_16204,des figures d' enfants . Jean Péloueyre s' intéressait à
Mauriac-François_Le-baiser-au-lepreux_<M . Jérôme-710>_16214,"la quête des prostituées , dénombrait ce troupeau de maigres"
Mauriac-François_Le-baiser-au-lepreux_<M . Jérôme-710>_16221,troupeau de maigres louves . Il jouait à deviner pour
Mauriac-François_Le-baiser-au-lepreux_<M . Jérôme-710>_16244,"pendante , chassait . Avidement Jean Péloueyre cherchait une seule"
Mauriac-François_Le-baiser-au-lepreux_<M . Jérôme-710>_16263,"maîtres , une seule et il eût suivi cet être"
