,text_surronding
Mauriac-François_Le-baiser-au-lepreux_<Jean Péloueyre-99>_5095,pris entre sa cheville et sa pantoufle . Son chapeau
Mauriac-François_Le-baiser-au-lepreux_<Jean Péloueyre-99>_5098,cheville et sa pantoufle . Son chapeau de paille déformé
Mauriac-François_Le-baiser-au-lepreux_<Jean Péloueyre-99>_5108,était bordé de moire . Il avait sur les épaules
Mauriac-François_Le-baiser-au-lepreux_<Jean Péloueyre-99>_5120,pèlerine de tricot oubliée par sa sœur . Jean reconnut
Mauriac-François_Le-baiser-au-lepreux_<Jean Péloueyre-99>_5123,"oubliée par sa sœur . Jean reconnut , entre les"
Mauriac-François_Le-baiser-au-lepreux_<Jean Péloueyre-99>_5143,", comme sa religion , le fournissaient de subterfuges pour"
Mauriac-François_Le-baiser-au-lepreux_<Jean Péloueyre-99>_5153,parer du nom de sagesse son renoncement à toute conquête?
Mauriac-François_Le-baiser-au-lepreux_<Jean Péloueyre-99>_5167,"se répétait Jean Péloueyre , ce pauvre homme appelait tantôt"
Mauriac-François_Le-baiser-au-lepreux_<Jean Péloueyre-99>_5182,", l' immense défaite de sa vie . Ah! que"
Mauriac-François_Le-baiser-au-lepreux_<Jean Péloueyre-99>_5187,sa vie . Ah! que Jean se sentait donc lucide!
Mauriac-François_Le-baiser-au-lepreux_<Jean Péloueyre-99>_5195,"donc lucide! Aimant et plaignant son père , comme à"
Mauriac-François_Le-baiser-au-lepreux_<Jean Péloueyre-99>_5203,"comme à cette heure , il le méprisait! Le malade"
Mauriac-François_Le-baiser-au-lepreux_<Jean Péloueyre-99>_5206,"heure , il le méprisait! Le malade se lamenta: des"
Mauriac-François_Le-baiser-au-lepreux_<Jean Péloueyre-99>_5230,". Un métayer avait forcé sa porte , Duberne d'"
Mauriac-François_Le-baiser-au-lepreux_<Jean Péloueyre-99>_5251,sa fille mariée! Où pourrait - il souffrir tranquille? Où
Mauriac-François_Le-baiser-au-lepreux_<Jean Péloueyre-99>_5257,il souffrir tranquille? Où pourrait - il mourir en paix?
Mauriac-François_Le-baiser-au-lepreux_<Jean Péloueyre-99>_5283,"et aussi jour d' invasion: sa sœur Félicité Cazenave ,"
Mauriac-François_Le-baiser-au-lepreux_<Jean Péloueyre-99>_5288,"sa sœur Félicité Cazenave , son neveu régneraient céans; dès"
Mauriac-François_Le-baiser-au-lepreux_<Jean Péloueyre-99>_5303,bestiaux sur le foirail réveilleraient le malade; l' auto des
Mauriac-François_Le-baiser-au-lepreux_<Jean Péloueyre-99>_5353,", le couple laisserait derrière lui Cadette en larmes et"
Mauriac-François_Le-baiser-au-lepreux_<Jean Péloueyre-280>_5395,"de sa chienne» , que Jean Péloueyre , ce jour"
Mauriac-François_Le-baiser-au-lepreux_<Jean Péloueyre-280>_5410,nulle attention à ce que lui glissait son père: «Nous
Mauriac-François_Le-baiser-au-lepreux_<Jean Péloueyre-280>_5412,à ce que lui glissait son père: «Nous allons leur
Mauriac-François_Le-baiser-au-lepreux_<Jean Péloueyre-280>_5421,"leur jouer un tour , Jean , pour peu que"
Mauriac-François_Le-baiser-au-lepreux_<Jean Péloueyre-280>_5426,"Jean , pour peu que tu veuilles t' y prêter"
Mauriac-François_Le-baiser-au-lepreux_<Jean Péloueyre-280>_5435,prêter . . . Mais le voudras - tu?» Jean
Mauriac-François_Le-baiser-au-lepreux_<Jean Péloueyre-280>_5437,". . Mais le voudras - tu?» Jean , à"
Mauriac-François_Le-baiser-au-lepreux_<Jean Péloueyre-280>_5439,"Mais le voudras - tu?» Jean , à mille lieues"
Mauriac-François_Le-baiser-au-lepreux_<Jean Péloueyre-280>_5450,"Cazenave , sourit . Cependant son père l' observait et"
Mauriac-François_Le-baiser-au-lepreux_<Jean Péloueyre-280>_5452,sourit . Cependant son père l' observait et lui disait:
Mauriac-François_Le-baiser-au-lepreux_<Jean Péloueyre-280>_5455,son père l' observait et lui disait: «Tu devrais être
Mauriac-François_Le-baiser-au-lepreux_<Jean Péloueyre-280>_5463,devrais être plus coquet à ton âge; comme tu es
Mauriac-François_Le-baiser-au-lepreux_<Jean Péloueyre-280>_5466,"coquet à ton âge; comme tu es mal «dringué» ,"
Mauriac-François_Le-baiser-au-lepreux_<Jean Péloueyre-280>_5480,que M . Jérôme ne lui eût jamais montré qu'
Mauriac-François_Le-baiser-au-lepreux_<Jean Péloueyre-280>_5489,"qu' il se souciât de sa tenue , Jean Péloueyre"
Mauriac-François_Le-baiser-au-lepreux_<Jean Péloueyre-280>_5492,"souciât de sa tenue , Jean Péloueyre ne posa aucune"
Mauriac-François_Le-baiser-au-lepreux_<Jean Péloueyre-280>_5498,Péloueyre ne posa aucune question; il ne pressentit rien de
Mauriac-François_Le-baiser-au-lepreux_<Jean Péloueyre-280>_5511,préparait à ce tournant de son destin; il avait pris
Mauriac-François_Le-baiser-au-lepreux_<Jean Péloueyre-280>_5513,ce tournant de son destin; il avait pris le Montaigne
Mauriac-François_Le-baiser-au-lepreux_<Jean Péloueyre-280>_5522,Montaigne des mains paternelles et lisait cette phrase: «Pour moi
Mauriac-François_Le-baiser-au-lepreux_<Jean Péloueyre-280>_5526,"et lisait cette phrase: «Pour moi , je loue une"
Mauriac-François_Le-baiser-au-lepreux_<Jean Péloueyre-280>_5528,"cette phrase: «Pour moi , je loue une vie glissante"
Mauriac-François_Le-baiser-au-lepreux_<Jean Péloueyre-280>_5591,"la maison . Désœuvré , Jean , au fond du"
Mauriac-François_Le-baiser-au-lepreux_<Jean Péloueyre-280>_5613,"sur la ruelle . A sa vue , le petit"
Mauriac-François_Le-baiser-au-lepreux_<Jean Péloueyre-280>_5616,". A sa vue , le petit - fils de"
Mauriac-François_Le-baiser-au-lepreux_<Jean Péloueyre-280>_5623,"- fils de Cadette , qui tenait pressée contre lui"
Mauriac-François_Le-baiser-au-lepreux_<Jean Péloueyre-280>_5627,", qui tenait pressée contre lui une fille , la"
Mauriac-François_Le-baiser-au-lepreux_<Jean Péloueyre-280>_5632,"lui une fille , la lâcha , comme on laisse"
Mauriac-François_Le-baiser-au-lepreux_<Jean Péloueyre-280>_5641,laisse tomber un fruit . Jean Péloueyre ne dormit guère
Mauriac-François_Le-baiser-au-lepreux_<Jean Péloueyre-280>_5651,cette nuit - là . Ses fenêtres étaient ouvertes sur
Mauriac-François_Le-baiser-au-lepreux_<Jean Péloueyre-280>_5724,"sentinelles . . . » Jean veillait , se berçant"
Mauriac-François_Le-baiser-au-lepreux_<Jean Péloueyre-280>_5749,azur dévoré d' astres . Jean se levait pieds nus
Mauriac-François_Le-baiser-au-lepreux_<Jean Péloueyre-280>_5755,"se levait pieds nus , regardait les mondes et les"
Mauriac-François_Le-baiser-au-lepreux_<Jean Péloueyre-280>_5760,"regardait les mondes et les appelait par leurs noms ,"
Mauriac-François_Le-baiser-au-lepreux_<Jean Péloueyre-280>_5775,problème posé la veille: avait - il adhéré à une
Mauriac-François_Le-baiser-au-lepreux_<Jean Péloueyre-280>_5798,les Maîtres régnaient . Mais Chateaubriand hésita - t -
Mauriac-François_Le-baiser-au-lepreux_<Jean Péloueyre-280>_5802,Mais Chateaubriand hésita - t - il jamais à jouer
Mauriac-François_Le-baiser-au-lepreux_<Jean Péloueyre-280>_5807,- il jamais à jouer son éternité contre une caresse?
Mauriac-François_Le-baiser-au-lepreux_<Jean Péloueyre-280>_5853,déchirantes plaintes des porcelets éveillèrent Jean . Comme chaque jeudi
Mauriac-François_Le-baiser-au-lepreux_<Jean Péloueyre-280>_5859,". Comme chaque jeudi , il évita de pousser les"
Mauriac-François_Le-baiser-au-lepreux_<Jean Péloueyre-280>_5871,afin que le marché ne le vît pas . Sur
Mauriac-François_Le-baiser-au-lepreux_<Jean Péloueyre-280>_5933,un corps si ramassé; mais Jean adorait le contraste d'
Mauriac-François_Le-baiser-au-lepreux_<Jean Péloueyre-280>_5976,"ragote , elle émouvait chez Jean le meilleur et le"
Mauriac-François_Le-baiser-au-lepreux_<Jean Péloueyre-280>_5983,"meilleur et le pire , l' incitait aux hautes pensées"
Mauriac-François_Le-baiser-au-lepreux_<Jean Péloueyre-280>_6050,il fallait bien appeler chevilles! Jean Péloueyre regardait sournoisement cet
Mauriac-François_Le-baiser-au-lepreux_<Jean Péloueyre-280>_6063,"- fils de Cadette , lui , la pouvait regarder"
Mauriac-François_Le-baiser-au-lepreux_<Jean Péloueyre-280>_6109,"et frôlé la chaise de Jean Péloueyre , s' il"
Mauriac-François_Le-baiser-au-lepreux_<Jean Péloueyre-280>_6113,"de Jean Péloueyre , s' il osait renifler l' air"
Mauriac-François_Le-baiser-au-lepreux_<Jean Péloueyre-280>_6134,"et de linge propre . Jean Péloueyre soupira , mit"
Mauriac-François_Le-baiser-au-lepreux_<Jean Péloueyre-280>_6138,". Jean Péloueyre soupira , mit sa chemise de la"
Mauriac-François_Le-baiser-au-lepreux_<Jean Péloueyre-280>_6139,"Jean Péloueyre soupira , mit sa chemise de la veille"
Mauriac-François_Le-baiser-au-lepreux_<Jean Péloueyre-280>_6153,l' avant - veille . Son corps ne méritait aucun
Mauriac-François_Le-baiser-au-lepreux_<Jean Péloueyre-280>_6159,corps ne méritait aucun soin; il usait d' un pot
Mauriac-François_Le-baiser-au-lepreux_<Jean Péloueyre-280>_6193,"le tilleul du jardin , il ne récita pas sa"
Mauriac-François_Le-baiser-au-lepreux_<Jean Péloueyre-280>_6197,", il ne récita pas sa prière mais lut le"
Mauriac-François_Le-baiser-au-lepreux_<Jean Péloueyre-280>_6200,récita pas sa prière mais lut le journal de façon
Mauriac-François_Le-baiser-au-lepreux_<Jean Péloueyre-280>_6209,façon que le papier cachât sa figure au petit -
Mauriac-François_Le-baiser-au-lepreux_<Jean Péloueyre-280>_6218,"- fils de Cadette . Il sifflotait , ce misérable!"
Mauriac-François_Le-baiser-au-lepreux_<Jean Péloueyre-280>_6221,"Cadette . Il sifflotait , ce misérable! Un œillet rouge"
Mauriac-François_Le-baiser-au-lepreux_<Jean Péloueyre-280>_6230,"rouge à l' oreille , il était brillant et vernissé"
Mauriac-François_Le-baiser-au-lepreux_<Jean Péloueyre-280>_6246,ceinture serrait à la taille son pantalon indigo . Jean
Mauriac-François_Le-baiser-au-lepreux_<Jean Péloueyre-280>_6250,taille son pantalon indigo . Jean Péloueyre le haïssait bassement
Mauriac-François_Le-baiser-au-lepreux_<Jean Péloueyre-280>_6252,pantalon indigo . Jean Péloueyre le haïssait bassement et se
Mauriac-François_Le-baiser-au-lepreux_<Jean Péloueyre-280>_6256,Péloueyre le haïssait bassement et se faisait horreur de le
Mauriac-François_Le-baiser-au-lepreux_<Jean Péloueyre-280>_6260,et se faisait horreur de le haïr . La pensée
Mauriac-François_Le-baiser-au-lepreux_<Jean Péloueyre-280>_6266,haïr . La pensée ne le consolait pas que ce
Mauriac-François_Le-baiser-au-lepreux_<Jean Péloueyre-280>_6270,ne le consolait pas que ce garçon deviendrait un paysan
Mauriac-François_Le-baiser-au-lepreux_<Jean Péloueyre-280>_6306,"de cette matinée . «O mon âme , se dit"
Mauriac-François_Le-baiser-au-lepreux_<Jean Péloueyre-280>_6311,"mon âme , se dit Jean Péloueyre , mon âme"
Mauriac-François_Le-baiser-au-lepreux_<Jean Péloueyre-280>_6314,"se dit Jean Péloueyre , mon âme , dans ce"
Mauriac-François_Le-baiser-au-lepreux_<Jean Péloueyre-280>_6326,été plus laide encore que mon visage!» Il reconnut dans
Mauriac-François_Le-baiser-au-lepreux_<Jean Péloueyre-280>_6328,laide encore que mon visage!» Il reconnut dans la maison
Mauriac-François_Le-baiser-au-lepreux_<Jean Péloueyre-280>_6342,du curé . Que venait - il manigancer à cette
Mauriac-François_Le-baiser-au-lepreux_<Jean Péloueyre-280>_6354,n' était pas celle de sa visite quotidienne? Ce jour
Mauriac-François_Le-baiser-au-lepreux_<Jean Péloueyre-280>_6365,"là surtout , comment osait - il risquer une rencontre"
Mauriac-François_Le-baiser-au-lepreux_<Jean Péloueyre-280>_6386,"Dissimulé derrière le tilleul , Jean Péloueyre vit passer Fernand"
Mauriac-François_Le-baiser-au-lepreux_<Jean Péloueyre-280>_6446,"usée , obéissait aux injonctions du fils bien - aimé"
Mauriac-François_Le-baiser-au-lepreux_<Jean Péloueyre-280>_6468,en branle un mécanisme . Le conseiller voulut bien s'
Mauriac-François_Le-baiser-au-lepreux_<Jean Péloueyre-280>_6477,s' arrêter pour l' attendre; il essuya avec son mouchoir
Mauriac-François_Le-baiser-au-lepreux_<Jean Péloueyre-280>_6480,l' attendre; il essuya avec son mouchoir un front ruisselant
Mauriac-François_Le-baiser-au-lepreux_<Jean Péloueyre-280>_6490,et le cuir intérieur de son canotier . Divinité renfrognée
Mauriac-François_Le-baiser-au-lepreux_<Jean Péloueyre-280>_6592,chaleur . Jean Péloueyre entendit le conseiller gronder: «Salopes de
Mauriac-François_Le-baiser-au-lepreux_<Jean Péloueyre-280>_6727,"gémissant , —inutile vacarme puisque le conseiller finit tout de"
Mauriac-François_Le-baiser-au-lepreux_<Jean Péloueyre-280>_6740,"sur la viande trop cuite sa fringale . Repu ,"
Mauriac-François_Le-baiser-au-lepreux_<Jean Péloueyre-280>_6745,"sa fringale . Repu , il s' excusa de n'"
Mauriac-François_Le-baiser-au-lepreux_<Jean Péloueyre-280>_6756,pas allé d' abord saluer son oncle Péloueyre; mais il
Mauriac-François_Le-baiser-au-lepreux_<Jean Péloueyre-280>_6760,saluer son oncle Péloueyre; mais il avait vu dans le
Mauriac-François_Le-baiser-au-lepreux_<Jean Péloueyre-280>_6775,Péloueyre savaient qu' un prêtre lui faisait physiquement horreur .
Mauriac-François_Le-baiser-au-lepreux_<Jean Péloueyre-280>_6800,"était pour me parler de toi , Jean , qu'"
Mauriac-François_Le-baiser-au-lepreux_<Jean Péloueyre-280>_6802,"me parler de toi , Jean , qu' est venu"
Mauriac-François_Le-baiser-au-lepreux_<Jean Péloueyre-280>_6813,. le curé . Crois - tu qu' il veut
Mauriac-François_Le-baiser-au-lepreux_<Jean Péloueyre-280>_6818,- tu qu' il veut te marier?» Fernand ricana et
Mauriac-François_Le-baiser-au-lepreux_<Jean Péloueyre-280>_6820,qu' il veut te marier?» Fernand ricana et dit que
Mauriac-François_Le-baiser-au-lepreux_<Jean Péloueyre-280>_6823,te marier?» Fernand ricana et dit que ce n' était
Mauriac-François_Le-baiser-au-lepreux_<Jean Péloueyre-280>_6831,n' était pas sérieux: «Pourquoi? Jean va sur ses vingt
Mauriac-François_Le-baiser-au-lepreux_<Jean Péloueyre-280>_6834,sérieux: «Pourquoi? Jean va sur ses vingt - trois ans
Mauriac-François_Le-baiser-au-lepreux_<Jean Péloueyre-280>_6842,trois ans . » Alors Fernand Cazenave éclata: de quoi
Mauriac-François_Le-baiser-au-lepreux_<Jean Péloueyre-280>_6855,ensoutané? de quel droit mettait - il le nez dans
Mauriac-François_Le-baiser-au-lepreux_<Jean Péloueyre-280>_6869,"famille? Perdant toute mesure , il osa demander à mi"
Mauriac-François_Le-baiser-au-lepreux_<Jean Péloueyre-280>_6877,à mi - voix si Jean était seulement «mariable» .
Mauriac-François_Le-baiser-au-lepreux_<Jean Péloueyre-280>_6888,"un clin d' œil , sa mère rappela à l'"
Mauriac-François_Le-baiser-au-lepreux_<Jean Péloueyre-280>_6894,mère rappela à l' ordre le malotru . «Ce serait
Mauriac-François_Le-baiser-au-lepreux_<Jean Péloueyre-280>_6902,"«Ce serait très heureux que Jean se mariât , disait"
Mauriac-François_Le-baiser-au-lepreux_<Jean Péloueyre-280>_6909,"mariât , disait - elle: il manquait à cette maison"
Mauriac-François_Le-baiser-au-lepreux_<Jean Péloueyre-280>_6937,"subirait quelque bouleversement . » Fernand , calmé , l'"
Mauriac-François_Le-baiser-au-lepreux_<Jean Péloueyre-280>_6943,", calmé , l' approuva: Jean , certes , pouvait"
Mauriac-François_Le-baiser-au-lepreux_<Jean Péloueyre-280>_6955,famille . Mais ne ferait - il pas son malheur?
Mauriac-François_Le-baiser-au-lepreux_<Jean Péloueyre-280>_6958,ne ferait - il pas son malheur? Le cher enfant
Mauriac-François_Le-baiser-au-lepreux_<Jean Péloueyre-280>_6960,- il pas son malheur? Le cher enfant avait déjà
Mauriac-François_Le-baiser-au-lepreux_<Jean Péloueyre-280>_6980,". Tante Félicité insinua que son frère aurait raison ,"
Mauriac-François_Le-baiser-au-lepreux_<Jean Péloueyre-280>_7036,"voiture devant la porte , son père , à la"
Mauriac-François_Le-baiser-au-lepreux_<Jean Péloueyre-280>_7044,"à la dernière seconde , le retenait . Inquiet ,"
Mauriac-François_Le-baiser-au-lepreux_<Jean Péloueyre-280>_7069,"de M . Jérôme , Jean , isolé en esprit"
Mauriac-François_Le-baiser-au-lepreux_<Jean Péloueyre-280>_7098,l' antique landau qui devait le conduire à travers le
Mauriac-François_Le-baiser-au-lepreux_<Jean Péloueyre-280>_7134,fleurs étaient collés encore à sa malle qui avait été
Mauriac-François_Le-baiser-au-lepreux_<Jean Péloueyre-280>_7195,cette petite vie souffrante de Jean à ses côtés .
Mauriac-François_Le-baiser-au-lepreux_<Jean Péloueyre-280>_7201,à ses côtés . Ainsi Jean Péloueyre avait travaillé avec
Mauriac-François_Le-baiser-au-lepreux_<Jean Péloueyre-280>_7214,à quinze ans et ne fut au collège que pour
Mauriac-François_Le-baiser-au-lepreux_<Jean Péloueyre-280>_7232,soudaine fantaisie de le marier? Jean se souvint des paroles
Mauriac-François_Le-baiser-au-lepreux_<Jean Péloueyre-280>_7239,"souvint des paroles étranges de son père , la veille"
Mauriac-François_Le-baiser-au-lepreux_<Jean Péloueyre-280>_7256,mais de quoi se troublait - il? Il se répétait
Mauriac-François_Le-baiser-au-lepreux_<Jean Péloueyre-280>_7258,quoi se troublait - il? Il se répétait qu' un
Mauriac-François_Le-baiser-au-lepreux_<Jean Péloueyre-280>_7326,"jardin et , angoissé , Jean , du corridor ,"
Mauriac-François_Le-baiser-au-lepreux_<Jean Péloueyre-280>_7344,"qui signalait leur départ , le malade s' éveilla ,"
Mauriac-François_Le-baiser-au-lepreux_<Jean Péloueyre-280>_7352,"éveilla , et dès que Jean eut reconnu le traînement"
Mauriac-François_Le-baiser-au-lepreux_<Jean Péloueyre-280>_7361,"traînement des pantoufles paternelles , il entra dans l' odeur"
Mauriac-François_Le-baiser-au-lepreux_<Jean Péloueyre-280>_7379,"cette méphitique officine , il lui fut révélé que l'"
Mauriac-François_Le-baiser-au-lepreux_<Jean Péloueyre-280>_7389,"on songeait sans rire à lui donner une femme ,"
Mauriac-François_Le-baiser-au-lepreux_<Jean Péloueyre-280>_7408,"psyché reflète le corps de Jean , plus sec que"
Mauriac-François_Le-baiser-au-lepreux_<Jean Péloueyre-280>_7419,brandes des landes incendiées . Il balbutie: «Elle ne voudra
Mauriac-François_Le-baiser-au-lepreux_<Jean Péloueyre-280>_7426,"«Elle ne voudra pas de moi» , —et frémit d'"
Mauriac-François_Le-baiser-au-lepreux_<Jean Péloueyre-280>_7429,"pas de moi» , —et frémit d' entendre ces paroles"
Mauriac-François_Le-baiser-au-lepreux_<Jean Péloueyre-280>_7464,à leur bonheur . Mais Jean secoue la tête et
Mauriac-François_Le-baiser-au-lepreux_<Jean Péloueyre-280>_7469,"Jean secoue la tête et semble , de ses mains"
Mauriac-François_Le-baiser-au-lepreux_<Jean Péloueyre-280>_7472,"tête et semble , de ses mains tendues , se"
Mauriac-François_Le-baiser-au-lepreux_<Jean Péloueyre-280>_7486,". Une jeune fille dans ses bras , consentante? Noémi"
Mauriac-François_Le-baiser-au-lepreux_<Jean Péloueyre-280>_7499,"messe , Noémi dont jamais il ne put regarder en"
Mauriac-François_Le-baiser-au-lepreux_<Jean Péloueyre-280>_7525,"elle traversait la nef , Jean Péloueyre l' accueillait sur"
Mauriac-François_Le-baiser-au-lepreux_<Jean Péloueyre-280>_7530,Jean Péloueyre l' accueillait sur sa chair comme le seul
Mauriac-François_Le-baiser-au-lepreux_<Jean Péloueyre-280>_7537,comme le seul baiser qu' il ait jamais connu .
Mauriac-François_Le-baiser-au-lepreux_<Jean Péloueyre-280>_7543,ait jamais connu . Cependant son père lui découvre ses
Mauriac-François_Le-baiser-au-lepreux_<Jean Péloueyre-280>_7545,connu . Cependant son père lui découvre ses vues qui
Mauriac-François_Le-baiser-au-lepreux_<Jean Péloueyre-280>_7547,Cependant son père lui découvre ses vues qui sont celles
Mauriac-François_Le-baiser-au-lepreux_<Jean Péloueyre-280>_7597,"le veut bien . » Jean sourit , grimace; le"
Mauriac-François_Le-baiser-au-lepreux_<Jean Péloueyre-280>_7600,". » Jean sourit , grimace; le coin de sa"
Mauriac-François_Le-baiser-au-lepreux_<Jean Péloueyre-280>_7604,", grimace; le coin de sa lèvre frémit et il"
Mauriac-François_Le-baiser-au-lepreux_<Jean Péloueyre-280>_7608,de sa lèvre frémit et il dit: «Je lui ferai
Mauriac-François_Le-baiser-au-lepreux_<Noémi-906>_16752,M . Jérôme et de Noémi les meilleures nouvelles .
Mauriac-François_Le-baiser-au-lepreux_<Noémi-906>_16826,résolu après une confession où Noémi n' avait accusé que
Mauriac-François_Le-baiser-au-lepreux_<Noémi-906>_16831,Noémi n' avait accusé que ses vénielles fautes de chaque
Mauriac-François_Le-baiser-au-lepreux_<Noémi-906>_16839,de chaque samedi . Mais elle avait requis l' aide
Mauriac-François_Le-baiser-au-lepreux_<Noémi-906>_16846,requis l' aide spirituelle de son directeur contre des tentations
Mauriac-François_Le-baiser-au-lepreux_<Noémi-906>_16855,"tentations , des troubles dont elle ne précisa pas la"
Mauriac-François_Le-baiser-au-lepreux_<Noémi-906>_16869,"éloignement de Jean Péloueyre , elle avait dû d' abord"
Mauriac-François_Le-baiser-au-lepreux_<Noémi-906>_16885,des convalescences . La solitude lui était une volupté continue;
Mauriac-François_Le-baiser-au-lepreux_<Noémi-906>_16892,"une volupté continue; alanguie , elle se complaisait en soi"
Mauriac-François_Le-baiser-au-lepreux_<Noémi-906>_16896,", elle se complaisait en soi - même . Bien"
Mauriac-François_Le-baiser-au-lepreux_<Noémi-906>_16902,- même . Bien qu' elle fût incapable d' aucune
Mauriac-François_Le-baiser-au-lepreux_<Noémi-906>_16909,"incapable d' aucune analyse , elle se sentait autre et"
Mauriac-François_Le-baiser-au-lepreux_<Noémi-906>_16923,"vie de jeune fille , connaissait dans sa chair qu'"
Mauriac-François_Le-baiser-au-lepreux_<Noémi-906>_16925,"jeune fille , connaissait dans sa chair qu' elle n'"
Mauriac-François_Le-baiser-au-lepreux_<Noémi-906>_16928,connaissait dans sa chair qu' elle n' était plus une
Mauriac-François_Le-baiser-au-lepreux_<Noémi-906>_16938,jeune fille . Le dégoût l' avait détournée d' assister
Mauriac-François_Le-baiser-au-lepreux_<Noémi-906>_16947,assister à l' éclosion en elle d' une femme; mais
Mauriac-François_Le-baiser-au-lepreux_<Noémi-906>_16956,mais cette étrangère exigeait d' elle une satisfaction mystérieuse .
Mauriac-François_Le-baiser-au-lepreux_<Noémi-906>_16973,"d' avant que cet homme la possédât , comment eût"
Mauriac-François_Le-baiser-au-lepreux_<Noémi-906>_16978,"la possédât , comment eût - elle discerné ce désaccord"
Mauriac-François_Le-baiser-au-lepreux_<Noémi-906>_16984,elle discerné ce désaccord entre son cœur toujours endormi et
Mauriac-François_Le-baiser-au-lepreux_<Noémi-906>_16989,son cœur toujours endormi et sa chair à demi éveillée?
Mauriac-François_Le-baiser-au-lepreux_<Noémi-906>_16994,sa chair à demi éveillée? Elle avait ressenti le déchirement
Mauriac-François_Le-baiser-au-lepreux_<Noémi-906>_17000,"avait ressenti le déchirement de son être , avec horreur"
Mauriac-François_Le-baiser-au-lepreux_<Noémi-906>_17024,qu' elle subit . Comme la jeune femme n' ouvrait
Mauriac-François_Le-baiser-au-lepreux_<Noémi-906>_17033,ouvrait d' autre livre que son paroissien et que son
Mauriac-François_Le-baiser-au-lepreux_<Noémi-906>_17037,que son paroissien et que son état de jeune fille
Mauriac-François_Le-baiser-au-lepreux_<Noémi-906>_17046,fille bien née et pauvre l' avait tenue à l'
Mauriac-François_Le-baiser-au-lepreux_<Noémi-906>_17063,"fiction , nulle confidence ne l' aurait éclairée sur cette"
Mauriac-François_Le-baiser-au-lepreux_<Noémi-906>_17071,sur cette secrète exigence en elle . Alors le destin
Mauriac-François_Le-baiser-au-lepreux_<Noémi-906>_17076,elle . Alors le destin lui fournit un visage .
Mauriac-François_Le-baiser-au-lepreux_<Noémi-906>_17118,"les femmes du bourg , Noémi cousait au rez -"
Mauriac-François_Le-baiser-au-lepreux_<Noémi-906>_17153,linge à repriser coulait . Elle entendit un bruit de
Mauriac-François_Le-baiser-au-lepreux_<Noémi-906>_17160,"un bruit de roues , vit s' arrêter à quelques"
Mauriac-François_Le-baiser-au-lepreux_<Noémi-906>_17197,"place était déserte . Comme Noémi , curieuse , poussait"
Mauriac-François_Le-baiser-au-lepreux_<Noémi-906>_17223,docteur Pieuchon . Après que Noémi lui eût indiqué la
Mauriac-François_Le-baiser-au-lepreux_<Noémi-906>_17244,son cheval et disparut . Noémi recommença de coudre et
Mauriac-François_Le-baiser-au-lepreux_<Noémi-906>_17265,inconsciente de ce visage dont elle avait reçu l' empreinte
Mauriac-François_Le-baiser-au-lepreux_<Noémi-906>_17306,cheval et ses regards cherchaient la jeune femme entre les
Mauriac-François_Le-baiser-au-lepreux_<Noémi-906>_17423,"Péloueyre , sans que jamais Noémi poussât les volets ."
Mauriac-François_Le-baiser-au-lepreux_<Noémi-906>_17438,raie d' ombre où respirait une jeunesse invisible . Le
Mauriac-François_Le-baiser-au-lepreux_<Noémi-906>_17485,"monde . Un soir , Noémi put se déshabiller la"
Mauriac-François_Le-baiser-au-lepreux_<Noémi-906>_17493,"déshabiller la fenêtre ouverte . Elle s' y accouda ,"
Mauriac-François_Le-baiser-au-lepreux_<Noémi-906>_17508,sans désir de sommeil . Elle était devant la nuit
Mauriac-François_Le-baiser-au-lepreux_<Noémi-906>_17526,ce visage d' homme dont elle avait subi l' impression
Mauriac-François_Le-baiser-au-lepreux_<Noémi-906>_17537,"Pour la première fois , elle y arrêta , de"
Mauriac-François_Le-baiser-au-lepreux_<Noémi-906>_17545,", de propos délibéré , sa pensée: puisque l' étranger"
Mauriac-François_Le-baiser-au-lepreux_<Noémi-906>_17550,sa pensée: puisque l' étranger la saluait chaque jour sans
Mauriac-François_Le-baiser-au-lepreux_<Noémi-906>_17584,"décidé d' agir ainsi , elle en éprouva une émotion"
Mauriac-François_Le-baiser-au-lepreux_<Noémi-906>_17592,une émotion si douce qu' elle retarda l' instant de
Mauriac-François_Le-baiser-au-lepreux_<Noémi-906>_17600,instant de s' étendre sur son lit . En elle
Mauriac-François_Le-baiser-au-lepreux_<Noémi-906>_17604,"sur son lit . En elle , des traits un"
