,text_surronding
Ohnet-Georges_Le-Maitre-de-forges_<un homme-2843>_65897,", et vivre liée à un homme qui allait venir"
Ohnet-Georges_Le-Maitre-de-forges_<un homme-2843>_65899,vivre liée à un homme qui allait venir armé de
Ohnet-Georges_Le-Maitre-de-forges_<un homme-2843>_65904,"qui allait venir armé de ses droits , et pouvant"
Ohnet-Georges_Le-Maitre-de-forges_<un homme-2843>_65912,et pouvant dire : « Je veux ! » à
Ohnet-Georges_Le-Maitre-de-forges_<un homme-2843>_65971,obtenir de son mari qu' il lui rendît sa liberté
Ohnet-Georges_Le-Maitre-de-forges_<un homme-2843>_65999,"de sa destinée . Que Philippe fût fidèle , elle"
Ohnet-Georges_Le-Maitre-de-forges_<un homme-2843>_66011,"souciait peu , pourvu qu' il fût respectueux et soumis"
Ohnet-Georges_Le-Maitre-de-forges_<un homme-2843>_66018,respectueux et soumis . Qu' il fit ce que bon
Ohnet-Georges_Le-Maitre-de-forges_<un homme-2843>_66023,"il fit ce que bon lui semblerait , à la"
Ohnet-Georges_Le-Maitre-de-forges_<un homme-2843>_66039,elle - même . Serait - il donc si difficile
Ohnet-Georges_Le-Maitre-de-forges_<un homme-2843>_66046,"donc si difficile d' obtenir du maître de forges ,"
Ohnet-Georges_Le-Maitre-de-forges_<un homme-2843>_66057,"ambitieux sans doute , qu' il eût quelques complaisances pour"
Ohnet-Georges_Le-Maitre-de-forges_<un homme-2843>_66068,femme qui allait apporter dans sa maison une fortune considérable
Ohnet-Georges_Le-Maitre-de-forges_<un homme-2843>_66074,maison une fortune considérable et le faire bénéficier de sérieuses
Ohnet-Georges_Le-Maitre-de-forges_<un homme-2843>_66083,"sérieuses influences de famille . Il l' aimait cependant ,"
Ohnet-Georges_Le-Maitre-de-forges_<un homme-2843>_66084,"influences de famille . Il l' aimait cependant , elle"
Ohnet-Georges_Le-Maitre-de-forges_<un homme-2843>_66130,", et résolut , si Philippe se montrait exigeant ,"
Ohnet-Georges_Le-Maitre-de-forges_<un homme-2843>_66136,"se montrait exigeant , de lui tenir tête . Elle"
Ohnet-Georges_Le-Maitre-de-forges_<un homme-2843>_66191,allait faire au cœur de cet homme qui l' adorait
Ohnet-Georges_Le-Maitre-de-forges_<un homme-2843>_66193,au cœur de cet homme qui l' adorait . Un
Ohnet-Georges_Le-Maitre-de-forges_<un homme-2843>_66248,"elle murmura : C' est lui ! Philippe , ayant"
Ohnet-Georges_Le-Maitre-de-forges_<un homme-2843>_66250,": C' est lui ! Philippe , ayant fait les"
Ohnet-Georges_Le-Maitre-de-forges_<un homme-2843>_66260,honneurs de la maison à ses parents et à ses
Ohnet-Georges_Le-Maitre-de-forges_<un homme-2843>_66264,"à ses parents et à ses amis , et les"
Ohnet-Georges_Le-Maitre-de-forges_<un homme-2843>_66279,"uns après les autres , était resté seul . Il"
Ohnet-Georges_Le-Maitre-de-forges_<un homme-2843>_66283,", était resté seul . Il s' était dirigé presque"
Ohnet-Georges_Le-Maitre-de-forges_<un homme-2843>_66290,était dirigé presque machinalement vers sa chambre de garçon .
Ohnet-Georges_Le-Maitre-de-forges_<un homme-2843>_66297,de garçon . Celle qu' il devait habiter avec sa
Ohnet-Georges_Le-Maitre-de-forges_<un homme-2843>_66301,qu' il devait habiter avec sa femme était l' ancienne
Ohnet-Georges_Le-Maitre-de-forges_<un homme-2843>_66308,était l' ancienne chambre de son père et de sa
Ohnet-Georges_Le-Maitre-de-forges_<un homme-2843>_66312,de son père et de sa mère . Il pensa
Ohnet-Georges_Le-Maitre-de-forges_<un homme-2843>_66315,et de sa mère . Il pensa avec un trouble
Ohnet-Georges_Le-Maitre-de-forges_<un homme-2843>_66336,", plus émue encore que lui , dans sa blanche"
Ohnet-Georges_Le-Maitre-de-forges_<un homme-2843>_66345,"blanche toilette , celle qu' il aimait attendait sa venue"
Ohnet-Georges_Le-Maitre-de-forges_<un homme-2843>_66348,celle qu' il aimait attendait sa venue . Il avait
Ohnet-Georges_Le-Maitre-de-forges_<un homme-2843>_66351,aimait attendait sa venue . Il avait souvent pensé à
Ohnet-Georges_Le-Maitre-de-forges_<un homme-2843>_66362,heure adorable qui mettrait dans ses bras cette jeune fille
Ohnet-Georges_Le-Maitre-de-forges_<un homme-2843>_66371,"fille si belle , et il avait frissonné de volupté"
Ohnet-Georges_Le-Maitre-de-forges_<un homme-2843>_66377,avait frissonné de volupté . Il s' étonna de trouver
Ohnet-Georges_Le-Maitre-de-forges_<un homme-2843>_66382,Il s' étonna de trouver ses sens engourdis . Aucun
Ohnet-Georges_Le-Maitre-de-forges_<un homme-2843>_66389,engourdis . Aucun désir ne l' entraînait . Il était
Ohnet-Georges_Le-Maitre-de-forges_<un homme-2843>_66392,"désir ne l' entraînait . Il était grave , préoccupé"
Ohnet-Georges_Le-Maitre-de-forges_<un homme-2843>_66401,préoccupé et très attendri . Son amour pour Claire s'
Ohnet-Georges_Le-Maitre-de-forges_<un homme-2843>_66415,sorte de tendresse protectrice . Il se jugeait appelé à
Ohnet-Georges_Le-Maitre-de-forges_<un homme-2843>_66426,ce cœur faible . Et il se sentit repris de
Ohnet-Georges_Le-Maitre-de-forges_<un homme-2843>_66434,repris de cette affection qu' il avait eue pour sa
Ohnet-Georges_Le-Maitre-de-forges_<un homme-2843>_66438,qu' il avait eue pour sa sœur quand elle était
Ohnet-Georges_Le-Maitre-de-forges_<un homme-2843>_66446,"elle était enfant . En lui - même , il"
Ohnet-Georges_Le-Maitre-de-forges_<un homme-2843>_66450,"En lui - même , il remercia la Providence qui"
Ohnet-Georges_Le-Maitre-de-forges_<un homme-2843>_66455,il remercia la Providence qui lui avait accordé la possession
Ohnet-Georges_Le-Maitre-de-forges_<un homme-2843>_66467,si ardemment convoité . Et il se promit d' être
Ohnet-Georges_Le-Maitre-de-forges_<un homme-2843>_66477,"digne de la faveur qui lui était faite , en"
Ohnet-Georges_Le-Maitre-de-forges_<un homme-2843>_66488,le bonheur de Claire . Il se surprit ainsi dans
Ohnet-Georges_Le-Maitre-de-forges_<un homme-2843>_66493,"Il se surprit ainsi dans sa chambre , assis dans"
Ohnet-Georges_Le-Maitre-de-forges_<un homme-2843>_66514,heure après le départ de ses derniers invités . Il
Ohnet-Georges_Le-Maitre-de-forges_<un homme-2843>_66518,de ses derniers invités . Il sourit et se trouva
Ohnet-Georges_Le-Maitre-de-forges_<un homme-2843>_66522,. Il sourit et se trouva un peu sot .
Ohnet-Georges_Le-Maitre-de-forges_<un homme-2843>_66533,", se levant vivement , il passa dans son cabinet"
Ohnet-Georges_Le-Maitre-de-forges_<un homme-2843>_66536,"vivement , il passa dans son cabinet de toilette ."
Ohnet-Georges_Le-Maitre-de-forges_<un homme-2843>_66545,. La grande glace de son armoire lui renvoya son
Ohnet-Georges_Le-Maitre-de-forges_<un homme-2843>_66547,grande glace de son armoire lui renvoya son image et
Ohnet-Georges_Le-Maitre-de-forges_<un homme-2843>_66549,"de son armoire lui renvoya son image et , se"
Ohnet-Georges_Le-Maitre-de-forges_<un homme-2843>_66557,", se voyant vêtu de son costume de marié ,"
Ohnet-Georges_Le-Maitre-de-forges_<un homme-2843>_66562,"son costume de marié , il pensa qu' il serait"
Ohnet-Georges_Le-Maitre-de-forges_<un homme-2843>_66570,il serait souverainement ridicule à lui de se présenter devant
Ohnet-Georges_Le-Maitre-de-forges_<un homme-2843>_66575,lui de se présenter devant sa femme avec cet habit
Ohnet-Georges_Le-Maitre-de-forges_<un homme-2843>_66586,et cette cravate blanche . Il mit un costume du
Ohnet-Georges_Le-Maitre-de-forges_<un homme-2843>_66607,"par une émotion inexprimable , il se dirigea vers la"
Ohnet-Georges_Le-Maitre-de-forges_<un homme-2843>_66622,"traversé le petit salon , il frappa du bout du"
Ohnet-Georges_Le-Maitre-de-forges_<un homme-2843>_66644,". Pensant avoir suffisamment annoncé sa présence , il entra"
Ohnet-Georges_Le-Maitre-de-forges_<un homme-2843>_66647,"suffisamment annoncé sa présence , il entra . Claire ,"
Ohnet-Georges_Le-Maitre-de-forges_<un homme-2843>_66682,"tourna pas les yeux vers lui , elle baissa seulement"
Ohnet-Georges_Le-Maitre-de-forges_<un homme-2843>_66693,"peu la tête , et Philippe vit la torsade épaisse"
Ohnet-Georges_Le-Maitre-de-forges_<un homme-2843>_66708,"sur sa nuque blanche . Il s' avança lentement ,"
Ohnet-Georges_Le-Maitre-de-forges_<un homme-2843>_66723,: – Voulez - vous me permettre de m' approcher
Ohnet-Georges_Le-Maitre-de-forges_<un homme-2843>_66726,- vous me permettre de m' approcher de vous ?
Ohnet-Georges_Le-Maitre-de-forges_<un homme-2843>_66732,approcher de vous ? dit - il . De la
Ohnet-Georges_Le-Maitre-de-forges_<un homme-2843>_66751,"Profitant de l' autorisation , Philippe se glissa jusqu' à"
Ohnet-Georges_Le-Maitre-de-forges_<un homme-2843>_66760,"à la chaise longue et s' assit , courbé ,"
Ohnet-Georges_Le-Maitre-de-forges_<un homme-2843>_66773,de la jeune femme . Il la regarda attentivement .
Ohnet-Georges_Le-Maitre-de-forges_<un homme-2843>_66783,Son visage crispé et dur l' étonna . Il lui
Ohnet-Georges_Le-Maitre-de-forges_<un homme-2843>_66786,et dur l' étonna . Il lui connaissait cette expression
Ohnet-Georges_Le-Maitre-de-forges_<un homme-2843>_66795,expression farouche et menaçante : il la lui avait vue
Ohnet-Georges_Le-Maitre-de-forges_<un homme-2843>_66809,on présence du duc . Il fut inquiet de voir
Ohnet-Georges_Le-Maitre-de-forges_<un homme-2843>_66828,prête à la lutte . Il ne pouvait deviner les
Ohnet-Georges_Le-Maitre-de-forges_<un homme-2843>_66843,"; mais , instinctivement , il pressentit une résistance ."
Ohnet-Georges_Le-Maitre-de-forges_<un homme-2843>_66848,il pressentit une résistance . Il voulut pénétrer enfin dans
Ohnet-Georges_Le-Maitre-de-forges_<un homme-2843>_66869,"énigme , et , autant il était ému un instant"
Ohnet-Georges_Le-Maitre-de-forges_<un homme-2843>_66877,"un instant auparavant , autant il devint calme . Ce"
Ohnet-Georges_Le-Maitre-de-forges_<un homme-2843>_66887,changement dans l' esprit de Philippe était inquiétant pour Claire
Ohnet-Georges_Le-Maitre-de-forges_<un homme-2843>_66906,mari troublé et hésitant . Le mettant sur ses gardes
Ohnet-Georges_Le-Maitre-de-forges_<un homme-2843>_66909,"hésitant . Le mettant sur ses gardes , elle lui"
Ohnet-Georges_Le-Maitre-de-forges_<un homme-2843>_66913,"sur ses gardes , elle lui rendait toute sa clairvoyance"
Ohnet-Georges_Le-Maitre-de-forges_<un homme-2843>_66938,"nous voici seuls , dit Philippe à voix basse ,"
Ohnet-Georges_Le-Maitre-de-forges_<un homme-2843>_66944,"à voix basse , et j' ai pour vous bien"
Ohnet-Georges_Le-Maitre-de-forges_<un homme-2843>_66958,"cœur . Jusqu' ici , je n' ai pas osé"
Ohnet-Georges_Le-Maitre-de-forges_<un homme-2843>_66965,ai pas osé parler … J' aurais mal exprimé mes
Ohnet-Georges_Le-Maitre-de-forges_<un homme-2843>_66969,… J' aurais mal exprimé mes sentiments … Toute ma
Ohnet-Georges_Le-Maitre-de-forges_<un homme-2843>_66973,exprimé mes sentiments … Toute ma vie s' est passée
Ohnet-Georges_Le-Maitre-de-forges_<un homme-2843>_66983,dans le travail … Aussi je vous supplie d' être
Ohnet-Georges_Le-Maitre-de-forges_<un homme-2843>_66992,"être indulgente … Ce que je ressens , croyez -"
Ohnet-Georges_Le-Maitre-de-forges_<un homme-2843>_67005,vaut mieux que ce que je dis … Bien souvent
Ohnet-Georges_Le-Maitre-de-forges_<un homme-2843>_67010,je dis … Bien souvent vous m' avez vu venir
Ohnet-Georges_Le-Maitre-de-forges_<un homme-2843>_67011,dis … Bien souvent vous m' avez vu venir à
Ohnet-Georges_Le-Maitre-de-forges_<un homme-2843>_67027,puis garder le silence . J' avais peur de vous
Ohnet-Georges_Le-Maitre-de-forges_<un homme-2843>_67042,timide … Et cette crainte me paralysait . Alors je
Ohnet-Georges_Le-Maitre-de-forges_<un homme-2843>_67046,crainte me paralysait . Alors je me bornais à vous
Ohnet-Georges_Le-Maitre-de-forges_<un homme-2843>_67059,votre voix était douce à mon oreille comme un chant
Ohnet-Georges_Le-Maitre-de-forges_<un homme-2843>_67065,oreille comme un chant . Je me perdais dans votre
Ohnet-Georges_Le-Maitre-de-forges_<un homme-2843>_67098,êtes entrée ainsi profondément en moi : je vous ai
Ohnet-Georges_Le-Maitre-de-forges_<un homme-2843>_67100,ainsi profondément en moi : je vous ai adorée .
Ohnet-Georges_Le-Maitre-de-forges_<un homme-2843>_67108,"adorée . Vous êtes devenue ma pensée unique , mon"
Ohnet-Georges_Le-Maitre-de-forges_<un homme-2843>_67112,"devenue ma pensée unique , mon espérance , ma vie"
Ohnet-Georges_Le-Maitre-de-forges_<un homme-2843>_67115,"unique , mon espérance , ma vie … Aussi ,"
Ohnet-Georges_Le-Maitre-de-forges_<un homme-2843>_67122,"… Aussi , jugez de mon ivresse , maintenant que"
Ohnet-Georges_Le-Maitre-de-forges_<un homme-2843>_67127,"mon ivresse , maintenant que je vous vois là ,"
Ohnet-Georges_Le-Maitre-de-forges_<un homme-2843>_67134,"vois là , près de moi , tout à moi"
Ohnet-Georges_Le-Maitre-de-forges_<un homme-2843>_67138,"de moi , tout à moi ! Et , saisissant"
Ohnet-Georges_Le-Maitre-de-forges_<un homme-2843>_67151,"Claire entre les siennes , Philippe la posa passionnément sur"
Ohnet-Georges_Le-Maitre-de-forges_<un homme-2843>_67175,". – Par grâce , monsieur … murmura - t"
Ohnet-Georges_Le-Maitre-de-forges_<un homme-2843>_67185,- elle avec lassitude . Philippe releva vivement la tête
Ohnet-Georges_Le-Maitre-de-forges_<un homme-2843>_67206,avez - vous ? dit - il … Suis -
Ohnet-Georges_Le-Maitre-de-forges_<un homme-2843>_67210,dit - il … Suis - je assez malheureux pour
Ohnet-Georges_Le-Maitre-de-forges_<un homme-2843>_67216,je assez malheureux pour que mes paroles vous déplaisent ?
Ohnet-Georges_Le-Maitre-de-forges_<un homme-2843>_67237,Claire avec douceur … Je vous en prie … Vous
Ohnet-Georges_Le-Maitre-de-forges_<un homme-2843>_67241,Je vous en prie … Vous le voyez : mon
Ohnet-Georges_Le-Maitre-de-forges_<un homme-2843>_67250,mon trouble est profond … Philippe fut ému par l'
Ohnet-Georges_Le-Maitre-de-forges_<un homme-2843>_67282,… Est - ce donc moi qui en suis cause
Ohnet-Georges_Le-Maitre-de-forges_<un homme-2843>_67316,"– Oui . – Rassurez - vous , je vous"
Ohnet-Georges_Le-Maitre-de-forges_<un homme-2843>_67319,"– Rassurez - vous , je vous en supplie ,"
Ohnet-Georges_Le-Maitre-de-forges_<un homme-2843>_67320,"Rassurez - vous , je vous en supplie , reprit"
Ohnet-Georges_Le-Maitre-de-forges_<un homme-2843>_67325,"vous en supplie , reprit Philippe . Ne sentez -"
Ohnet-Georges_Le-Maitre-de-forges_<un homme-2843>_67333,sentez - vous pas que mon seul désir est de
Ohnet-Georges_Le-Maitre-de-forges_<un homme-2843>_67340,désir est de ne point vous déplaire ? Que faut
Ohnet-Georges_Le-Maitre-de-forges_<un homme-2843>_67348,Que faut - il que je fasse ? Exigez .
Ohnet-Georges_Le-Maitre-de-forges_<un homme-2843>_67354,fasse ? Exigez . Tout me sera facile . Je
Ohnet-Georges_Le-Maitre-de-forges_<un homme-2843>_67359,me sera facile . Je vous aime tant ! La
Ohnet-Georges_Le-Maitre-de-forges_<un homme-2843>_67425,"la première fois , regardant le maître de forges avec"
Ohnet-Georges_Le-Maitre-de-forges_<un homme-2843>_67436,"fin sourire : – Si vous m' aimez , dit"
Ohnet-Georges_Le-Maitre-de-forges_<un homme-2843>_67459,un geste d' autorité que Philippe comprit bien . –
Ohnet-Georges_Le-Maitre-de-forges_<un homme-2843>_67468,– Désirez - vous que je vous laisse ? dit
Ohnet-Georges_Le-Maitre-de-forges_<un homme-2843>_67473,"je vous laisse ? dit - il avec soumission ,"
Ohnet-Georges_Le-Maitre-de-forges_<un homme-2843>_67489,qu' il vous plaît de m' imposer ? Je m'
Ohnet-Georges_Le-Maitre-de-forges_<un homme-2843>_67492,"plaît de m' imposer ? Je m' y résignerai ,"
Ohnet-Georges_Le-Maitre-de-forges_<un homme-2843>_67514,se sentit maîtresse absolue de cet homme qui lui avait
Ohnet-Georges_Le-Maitre-de-forges_<un homme-2843>_67516,maîtresse absolue de cet homme qui lui avait causé une
Ohnet-Georges_Le-Maitre-de-forges_<un homme-2843>_67538,changea ; elle montra à Philippe un front rayonnant .
Ohnet-Georges_Le-Maitre-de-forges_<un homme-2843>_67554,"dit - elle , je vous en saurai gré ."
Ohnet-Georges_Le-Maitre-de-forges_<un homme-2843>_67603,"moi - même , je vous expliquerai … Philippe resta"
Ohnet-Georges_Le-Maitre-de-forges_<un homme-2843>_67606,", je vous expliquerai … Philippe resta un moment silencieux"
Ohnet-Georges_Le-Maitre-de-forges_<un homme-2843>_67616,. Dans les paroles de Claire quelques mots lui avaient
Ohnet-Georges_Le-Maitre-de-forges_<un homme-2843>_67619,paroles de Claire quelques mots lui avaient paru sonner faux
Ohnet-Georges_Le-Maitre-de-forges_<un homme-2843>_67628,faux . Cet atermoiement embarrassé lui sembla suspect . Il
Ohnet-Georges_Le-Maitre-de-forges_<un homme-2843>_67639,avait là un mystère qu' il résolut de mettre à
Ohnet-Georges_Le-Maitre-de-forges_<un homme-2843>_67648,à jour . – Que me direz - vous demain
Ohnet-Georges_Le-Maitre-de-forges_<un homme-2843>_67659,"ou plus tard , que je ne puisse entendre aujourd'"
Ohnet-Georges_Le-Maitre-de-forges_<un homme-2843>_67667,entendre aujourd' hui ? reprit - il . Ma vie
Ohnet-Georges_Le-Maitre-de-forges_<un homme-2843>_67670,? reprit - il . Ma vie et la vôtre
Ohnet-Georges_Le-Maitre-de-forges_<un homme-2843>_67698,confiante et sincère . À moi d' être dévoué et
Ohnet-Georges_Le-Maitre-de-forges_<un homme-2843>_67705,"être dévoué et patient … J' y suis prêt ,"
Ohnet-Georges_Le-Maitre-de-forges_<un homme-2843>_67710,"J' y suis prêt , je vous l' assure ."
Ohnet-Georges_Le-Maitre-de-forges_<un homme-2843>_67726,dispositions ? Le langage de Philippe était net et ferme
Ohnet-Georges_Le-Maitre-de-forges_<un homme-2843>_67732,était net et ferme . Il avait regardé sa femme
Ohnet-Georges_Le-Maitre-de-forges_<un homme-2843>_67735,ferme . Il avait regardé sa femme bien en face
Ohnet-Georges_Le-Maitre-de-forges_<un homme-2843>_67762,. – Laissez - moi vous dire que la confiance
Ohnet-Georges_Le-Maitre-de-forges_<un homme-2843>_67841,"j' en ai eu , vous le savez , on"
Ohnet-Georges_Le-Maitre-de-forges_<un homme-2843>_67894,"résigne à dissimuler auprès de vous , de grâce laissez"
Ohnet-Georges_Le-Maitre-de-forges_<un homme-2843>_67933,"se posa en victime . Philippe , en insistant ,"
Ohnet-Georges_Le-Maitre-de-forges_<un homme-2843>_67942,", eût paru cruel . Il le sentit . –"
Ohnet-Georges_Le-Maitre-de-forges_<un homme-2843>_67947,"Il le sentit . – Je vous en prie ,"
Ohnet-Georges_Le-Maitre-de-forges_<un homme-2843>_67948,"le sentit . – Je vous en prie , n'"
Ohnet-Georges_Le-Maitre-de-forges_<un homme-2843>_67962,", s' écria - t - il , allant au"
Ohnet-Georges_Le-Maitre-de-forges_<un homme-2843>_67972,- devant du sacrifice . Vous me faites injure …
Ohnet-Georges_Le-Maitre-de-forges_<un homme-2843>_67973,devant du sacrifice . Vous me faites injure … Vous
Ohnet-Georges_Le-Maitre-de-forges_<un homme-2843>_67977,"Vous me faites injure … Vous n' aurez jamais ,"
Ohnet-Georges_Le-Maitre-de-forges_<un homme-2843>_67994,tendre et plus dévoué que moi . En vous épousant
Ohnet-Georges_Le-Maitre-de-forges_<un homme-2843>_67997,"dévoué que moi . En vous épousant , j' ai"
Ohnet-Georges_Le-Maitre-de-forges_<un homme-2843>_68000,". En vous épousant , j' ai pris ma part"
Ohnet-Georges_Le-Maitre-de-forges_<un homme-2843>_68003,"épousant , j' ai pris ma part de vos peines"
Ohnet-Georges_Le-Maitre-de-forges_<un homme-2843>_68006,"ai pris ma part de vos peines , et je"
Ohnet-Georges_Le-Maitre-de-forges_<un homme-2843>_68010,"de vos peines , et je prétends vous les faire"
Ohnet-Georges_Le-Maitre-de-forges_<un homme-2843>_68021,". Fiez - vous à moi , je suis responsable"
Ohnet-Georges_Le-Maitre-de-forges_<un homme-2843>_68023,"- vous à moi , je suis responsable de votre"
Ohnet-Georges_Le-Maitre-de-forges_<un homme-2843>_68027,", je suis responsable de votre bonheur . Si le"
Ohnet-Georges_Le-Maitre-de-forges_<un homme-2843>_68045,l' avenir . Loin de moi la pensée de vous
Ohnet-Georges_Le-Maitre-de-forges_<un homme-2843>_68051,la pensée de vous imposer mon amour ! Ce que
Ohnet-Georges_Le-Maitre-de-forges_<un homme-2843>_68056,"mon amour ! Ce que je vous demande , c'"
Ohnet-Georges_Le-Maitre-de-forges_<un homme-2843>_68057,"amour ! Ce que je vous demande , c' est"
Ohnet-Georges_Le-Maitre-de-forges_<un homme-2843>_68063,"demande , c' est de me laisser essayer , à"
Ohnet-Georges_Le-Maitre-de-forges_<un homme-2843>_68076,"et de tendresses , de vous conquérir sur vous -"
Ohnet-Georges_Le-Maitre-de-forges_<un homme-2843>_68079,", de vous conquérir sur vous - même . Voilà"
Ohnet-Georges_Le-Maitre-de-forges_<un homme-2843>_68085,- même . Voilà toute mon ambition . Et puisque
Ohnet-Georges_Le-Maitre-de-forges_<un homme-2843>_68090,mon ambition . Et puisque vous avez besoin de repos
Ohnet-Georges_Le-Maitre-de-forges_<un homme-2843>_68101,"de solitude , restez chez vous , libre et rassurée"
Ohnet-Georges_Le-Maitre-de-forges_<un homme-2843>_68107,", libre et rassurée comme vous l' étiez hier ."
Ohnet-Georges_Le-Maitre-de-forges_<un homme-2843>_68112,vous l' étiez hier . Je me retire ; c'
Ohnet-Georges_Le-Maitre-de-forges_<un homme-2843>_68129,ce pas ? ce que vous souhaitez ? Qu' il
Ohnet-Georges_Le-Maitre-de-forges_<un homme-2843>_68137,Qu' il soit fait selon votre désir . La jeune
Ohnet-Georges_Le-Maitre-de-forges_<un homme-2843>_68140,"fait selon votre désir . La jeune femme , en"
Ohnet-Georges_Le-Maitre-de-forges_<un homme-2843>_68177,combinaisons préparées d' avance par elle pour conquérir sa liberté
Ohnet-Georges_Le-Maitre-de-forges_<un homme-2843>_68180,avance par elle pour conquérir sa liberté menaçaient de manquer
Ohnet-Georges_Le-Maitre-de-forges_<un homme-2843>_68187,menaçaient de manquer misérablement . Philippe venant au - devant
Ohnet-Georges_Le-Maitre-de-forges_<un homme-2843>_68193,venant au - devant de ses désirs avec une bonté
Ohnet-Georges_Le-Maitre-de-forges_<un homme-2843>_68201,"une bonté inattendue , allait - elle donc pouvoir demeurer"
Ohnet-Georges_Le-Maitre-de-forges_<un homme-2843>_68208,donc pouvoir demeurer séparée de lui ? Il l' adorait
Ohnet-Georges_Le-Maitre-de-forges_<un homme-2843>_68210,demeurer séparée de lui ? Il l' adorait et il
Ohnet-Georges_Le-Maitre-de-forges_<un homme-2843>_68211,séparée de lui ? Il l' adorait et il prétendait
Ohnet-Georges_Le-Maitre-de-forges_<un homme-2843>_68214,? Il l' adorait et il prétendait essayer de se
Ohnet-Georges_Le-Maitre-de-forges_<un homme-2843>_68222,"de se faire aimer d' elle . Comment , sans"
Ohnet-Georges_Le-Maitre-de-forges_<un homme-2843>_68234,"sans cruauté , repousser éternellement un homme si loyal et"
Ohnet-Georges_Le-Maitre-de-forges_<un homme-2843>_68248,"douceur et la tendresse de son mari lui rendraient ,"
Ohnet-Georges_Le-Maitre-de-forges_<un homme-2843>_68250,"la tendresse de son mari lui rendraient , le lendemain"
Ohnet-Georges_Le-Maitre-de-forges_<un homme-2843>_68263,"impossible , sans brutalité . Elle comprit le danger qu'"
Ohnet-Georges_Le-Maitre-de-forges_<un homme-2843>_68268,"Elle comprit le danger qu' elle courait , et résolut"
Ohnet-Georges_Le-Maitre-de-forges_<un homme-2843>_68272,"qu' elle courait , et résolut d' y échapper en"
Ohnet-Georges_Le-Maitre-de-forges_<un homme-2843>_68283,résolument tous les liens qui l' unissaient à Philippe .
Ohnet-Georges_Le-Maitre-de-forges_<un homme-2843>_68286,liens qui l' unissaient à Philippe . Celui - ci
Ohnet-Georges_Le-Maitre-de-forges_<un homme-2843>_68288,"l' unissaient à Philippe . Celui - ci , voyant"
Ohnet-Georges_Le-Maitre-de-forges_<un homme-2843>_68293,"Celui - ci , voyant Claire rester silencieuse et immobile"
Ohnet-Georges_Le-Maitre-de-forges_<un homme-2843>_68300,"silencieuse et immobile , s' avança vers elle . Il"
Ohnet-Georges_Le-Maitre-de-forges_<un homme-2843>_68302,"immobile , s' avança vers elle . Il pencha la"
Ohnet-Georges_Le-Maitre-de-forges_<un homme-2843>_68304,"s' avança vers elle . Il pencha la tête ,"
Ohnet-Georges_Le-Maitre-de-forges_<un homme-2843>_68310,"pencha la tête , et sa bouche vint effleurer le"
Ohnet-Georges_Le-Maitre-de-forges_<un homme-2843>_68318,effleurer le front blanc de la jeune femme : –
Ohnet-Georges_Le-Maitre-de-forges_<un homme-2843>_68327,"– À demain , dit - il . Mais en"
Ohnet-Georges_Le-Maitre-de-forges_<un homme-2843>_68343,"chevelure , en sentant sur ses lèvres cette chair frémissante"
Ohnet-Georges_Le-Maitre-de-forges_<un homme-2843>_68349,"lèvres cette chair frémissante , Philippe fut étourdi par une"
Ohnet-Georges_Le-Maitre-de-forges_<un homme-2843>_68357,par une soudaine ivresse . Il cessa d' être maître
Ohnet-Georges_Le-Maitre-de-forges_<un homme-2843>_68363,cessa d' être maître de lui . Oubliant ses promesses
Ohnet-Georges_Le-Maitre-de-forges_<un homme-2843>_68366,"maître de lui . Oubliant ses promesses , il ne"
Ohnet-Georges_Le-Maitre-de-forges_<un homme-2843>_68369,". Oubliant ses promesses , il ne pensa plus aux"
Ohnet-Georges_Le-Maitre-de-forges_<un homme-2843>_68385,si près du sien . Il vit une femme adorable
Ohnet-Georges_Le-Maitre-de-forges_<un homme-2843>_68387,du sien . Il vit une femme adorable qu' il
Ohnet-Georges_Le-Maitre-de-forges_<un homme-2843>_68390,Il vit une femme adorable qu' il désirait follement et
Ohnet-Georges_Le-Maitre-de-forges_<un homme-2843>_68391,vit une femme adorable qu' il désirait follement et qui
Ohnet-Georges_Le-Maitre-de-forges_<un homme-2843>_68395,qu' il désirait follement et qui lui appartenait . Dans
Ohnet-Georges_Le-Maitre-de-forges_<un homme-2843>_68396,il désirait follement et qui lui appartenait . Dans un
Ohnet-Georges_Le-Maitre-de-forges_<un homme-2843>_68404,"Dans un transport irrésistible , il la saisit dans ses"
Ohnet-Georges_Le-Maitre-de-forges_<un homme-2843>_68405,"un transport irrésistible , il la saisit dans ses bras"
Ohnet-Georges_Le-Maitre-de-forges_<un homme-2843>_68408,", il la saisit dans ses bras , et ,"
Ohnet-Georges_Le-Maitre-de-forges_<un homme-2843>_68419,"yeux ardents : – Si vous saviez , murmura -"
Ohnet-Georges_Le-Maitre-de-forges_<un homme-2843>_68425,"saviez , murmura - t - il , comme je"
Ohnet-Georges_Le-Maitre-de-forges_<un homme-2843>_68429,"t - il , comme je vous aime ! Claire"
