,text_surronding
Ohnet-Georges_Le-Maitre-de-forges_<Octave-3902>_101927,"t' en prie , calme - toi ! dit Octave"
Ohnet-Georges_Le-Maitre-de-forges_<Octave-3902>_101946,"est sauvé maintenant , reprit - elle , pleine d'"
Ohnet-Georges_Le-Maitre-de-forges_<Octave-3902>_101953,", pleine d' exaltation . Je réparerai le mal que"
Ohnet-Georges_Le-Maitre-de-forges_<Octave-3902>_101958,"Je réparerai le mal que j' ai fait , j'"
Ohnet-Georges_Le-Maitre-de-forges_<Octave-3902>_101962,"que j' ai fait , j' assurerai ton bonheur …"
Ohnet-Georges_Le-Maitre-de-forges_<Octave-3902>_101971,… Philippe ! Oh ! je me mettrai à ses
Ohnet-Georges_Le-Maitre-de-forges_<Octave-3902>_101979,à ses genoux . Tout me sera facile et doux
Ohnet-Georges_Le-Maitre-de-forges_<Octave-3902>_101987,et doux pour réussir … J' ai encore été aujourd'
Ohnet-Georges_Le-Maitre-de-forges_<Octave-3902>_102000,adroite avec lui . Mais je n' étais pas maîtresse
Ohnet-Georges_Le-Maitre-de-forges_<Octave-3902>_102006,"n' étais pas maîtresse de moi , vois - tu"
Ohnet-Georges_Le-Maitre-de-forges_<Octave-3902>_102012,", vois - tu ! je l' aime tant !"
Ohnet-Georges_Le-Maitre-de-forges_<Octave-3902>_102021,! Un nuage passa sur son front . Le souvenir
Ohnet-Georges_Le-Maitre-de-forges_<Octave-3902>_102030,souvenir inquiétant de la duchesse lui revenait . Elle fronça
Ohnet-Georges_Le-Maitre-de-forges_<Octave-3902>_102033,"la duchesse lui revenait . Elle fronça les sourcils ,"
Ohnet-Georges_Le-Maitre-de-forges_<Octave-3902>_102044,sourdement : – Oh ! je ne veux pas qu'
Ohnet-Georges_Le-Maitre-de-forges_<Octave-3902>_102050,ne veux pas qu' on me le prenne maintenant !
Ohnet-Georges_Le-Maitre-de-forges_<Octave-3902>_102061,"faut qu' il revienne à moi , ou je mourrai"
Ohnet-Georges_Le-Maitre-de-forges_<Octave-3902>_102064,"revienne à moi , ou je mourrai ! – Claire"
Ohnet-Georges_Le-Maitre-de-forges_<Octave-3902>_102068,ou je mourrai ! – Claire ! s' écria le
Ohnet-Georges_Le-Maitre-de-forges_<Octave-3902>_102082,"avec une mobilité extrême , elle était , de la"
Ohnet-Georges_Le-Maitre-de-forges_<Octave-3902>_102101,"visage rasséréné : – N' aie donc pas peur ,"
Ohnet-Georges_Le-Maitre-de-forges_<Octave-3902>_102107,"donc pas peur , reprit - elle , en riant"
Ohnet-Georges_Le-Maitre-de-forges_<Octave-3902>_102120,"recevons demain , c' est ma fête … Tous nos"
Ohnet-Georges_Le-Maitre-de-forges_<Octave-3902>_102129,"nos amis seront là … Je veux être belle ,"
Ohnet-Georges_Le-Maitre-de-forges_<Octave-3902>_102138,", et lui plaire … Je triompherai , j' en"
Ohnet-Georges_Le-Maitre-de-forges_<Octave-3902>_102141,"plaire … Je triompherai , j' en suis sûre !"
Ohnet-Georges_Le-Maitre-de-forges_<Octave-3902>_102147,en suis sûre ! Et je le verrai de nouveau
Ohnet-Georges_Le-Maitre-de-forges_<Octave-3902>_102154,"verrai de nouveau près de moi , confiant et tendre"
Ohnet-Georges_Le-Maitre-de-forges_<Octave-3902>_102160,", confiant et tendre … Ses nerfs qui , seuls"
Ohnet-Georges_Le-Maitre-de-forges_<Octave-3902>_102166,"nerfs qui , seuls , la soutenaient , soudain se"
Ohnet-Georges_Le-Maitre-de-forges_<Octave-3902>_102173,", soudain se détendirent . Elle chancela et vint tomber"
Ohnet-Georges_Le-Maitre-de-forges_<Octave-3902>_102176,détendirent . Elle chancela et vint tomber dans les bras
Ohnet-Georges_Le-Maitre-de-forges_<Octave-3902>_102184,les bras d' Octave qui la porta sur le banc
Ohnet-Georges_Le-Maitre-de-forges_<Octave-3902>_102196,. Des sanglots déchirants soulevèrent sa poitrine . Et pendant
Ohnet-Georges_Le-Maitre-de-forges_<Octave-3902>_102202,"poitrine . Et pendant longtemps elle resta accablée , écoutant"
Ohnet-Georges_Le-Maitre-de-forges_<Octave-3902>_102217,", les affectueuses consolations de son frère . Quand elle"
Ohnet-Georges_Le-Maitre-de-forges_<Octave-3902>_102221,de son frère . Quand elle eut repris possession d'
Ohnet-Georges_Le-Maitre-de-forges_<Octave-3902>_102226,"elle eut repris possession d' elle - même , elle"
Ohnet-Georges_Le-Maitre-de-forges_<Octave-3902>_102230,"d' elle - même , elle resta grave , assise"
Ohnet-Georges_Le-Maitre-de-forges_<Octave-3902>_102246,"vallée qui s' étendait devant elle , verdoyante et recueillie"
Ohnet-Georges_Le-Maitre-de-forges_<Octave-3902>_102339,dans ce coin tranquille que Claire rêvait de vivre .
Ohnet-Georges_Le-Maitre-de-forges_<Octave-3902>_102344,Claire rêvait de vivre . Elle se rappela qu' autrefois
Ohnet-Georges_Le-Maitre-de-forges_<Octave-3902>_102349,"Elle se rappela qu' autrefois elle l' avait , de"
Ohnet-Georges_Le-Maitre-de-forges_<Octave-3902>_102367,"colère . Maintenant , pour elle , il représentait le"
Ohnet-Georges_Le-Maitre-de-forges_<Octave-3902>_102456,marié . La maladie de Claire avait pris tout l'
Ohnet-Georges_Le-Maitre-de-forges_<Octave-3902>_102464,"tout l' hiver , et sa convalescence s' était prolongée"
Ohnet-Georges_Le-Maitre-de-forges_<Octave-3902>_102502,". L' agitation morale de Claire s' étant , à"
Ohnet-Georges_Le-Maitre-de-forges_<Octave-3902>_102536,en donnant une fête en son honneur . Depuis dix
Ohnet-Georges_Le-Maitre-de-forges_<Octave-3902>_102554,"de rapprochement , faite par la jeune femme sur son"
Ohnet-Georges_Le-Maitre-de-forges_<Octave-3902>_102558,"par la jeune femme sur son mari , avait porté"
Ohnet-Georges_Le-Maitre-de-forges_<Octave-3902>_102607,compta sur l' énergie de Claire . Il savait que
Ohnet-Georges_Le-Maitre-de-forges_<Octave-3902>_102616,"que , par fierté , elle était capable de montrer"
Ohnet-Georges_Le-Maitre-de-forges_<Octave-3902>_102669,"depuis le matin , avec la baronne , dans son"
Ohnet-Georges_Le-Maitre-de-forges_<Octave-3902>_102673,"avec la baronne , dans son appartement , Claire se"
Ohnet-Georges_Le-Maitre-de-forges_<Octave-3902>_102676,", dans son appartement , Claire se prépara à la"
Ohnet-Georges_Le-Maitre-de-forges_<Octave-3902>_102683,prépara à la lutte . Elle voulait plaire . Elle
Ohnet-Georges_Le-Maitre-de-forges_<Octave-3902>_102687,. Elle voulait plaire . Elle resta étendue dans un
Ohnet-Georges_Le-Maitre-de-forges_<Octave-3902>_102704,"avoir le teint vermeil . Elle se soigna , comme"
Ohnet-Georges_Le-Maitre-de-forges_<Octave-3902>_102736,", par le charme de sa mise , son incomparable"
Ohnet-Georges_Le-Maitre-de-forges_<Octave-3902>_102739,"charme de sa mise , son incomparable beauté . Elle"
Ohnet-Georges_Le-Maitre-de-forges_<Octave-3902>_102743,", son incomparable beauté . Elle fit choix d' une"
Ohnet-Georges_Le-Maitre-de-forges_<Octave-3902>_102822,"de la jupe , entourant la jeune femme tout entière"
Ohnet-Georges_Le-Maitre-de-forges_<Octave-3902>_102828,jeune femme tout entière de ses replis embaumés . Ses
Ohnet-Georges_Le-Maitre-de-forges_<Octave-3902>_102832,de ses replis embaumés . Ses admirables cheveux blonds étaient
Ohnet-Georges_Le-Maitre-de-forges_<Octave-3902>_102842,"massés sur le haut de sa tête , découvrant hardiment"
Ohnet-Georges_Le-Maitre-de-forges_<Octave-3902>_102847,"sa tête , découvrant hardiment sa nuque de neige et"
Ohnet-Georges_Le-Maitre-de-forges_<Octave-3902>_102863,de roses du Roi . Elle était si belle ainsi
Ohnet-Georges_Le-Maitre-de-forges_<Octave-3902>_102875,"Brigitte et Suzanne , qui l' avaient habillée elles -"
Ohnet-Georges_Le-Maitre-de-forges_<Octave-3902>_102893,à battre des mains . Claire jeta dans la glace
Ohnet-Georges_Le-Maitre-de-forges_<Octave-3902>_102915,"étant venue de paraître , elle descendit . Dans le"
Ohnet-Georges_Le-Maitre-de-forges_<Octave-3902>_102959,"feu des lustres allumés . La baronne , qui entrait"
Ohnet-Georges_Le-Maitre-de-forges_<Octave-3902>_102965,"baronne , qui entrait avec Claire , poussa un cri"
Ohnet-Georges_Le-Maitre-de-forges_<Octave-3902>_102982,"ami , d' où sortez - vous , dans cet"
Ohnet-Georges_Le-Maitre-de-forges_<Octave-3902>_102998,? Et quelles mains avez - vous ? – Excusez
Ohnet-Georges_Le-Maitre-de-forges_<Octave-3902>_103006,"– Excusez - moi , chère amie , dit le"
Ohnet-Georges_Le-Maitre-de-forges_<Octave-3902>_103058,"– Légèrement ! s' écria la jeune femme , mais"
Ohnet-Georges_Le-Maitre-de-forges_<Octave-3902>_103068,"c' est une horreur , vous ne serez pas présentable"
Ohnet-Georges_Le-Maitre-de-forges_<Octave-3902>_103074,ne serez pas présentable … Vous avez l' air d'
Ohnet-Georges_Le-Maitre-de-forges_<Octave-3902>_103100,"aller très bien , je vous assure . Et il"
Ohnet-Georges_Le-Maitre-de-forges_<Octave-3902>_103115,sa femme . – Ne m' approchez pas ! dit
Ohnet-Georges_Le-Maitre-de-forges_<Octave-3902>_103120,m' approchez pas ! dit celle - ci en reculant
Ohnet-Georges_Le-Maitre-de-forges_<Octave-3902>_103128,en reculant avec effroi ; j' ai une robe neuve
Ohnet-Georges_Le-Maitre-de-forges_<Octave-3902>_103166,un sylphe . Philippe regardait Claire . Dans toute la
Ohnet-Georges_Le-Maitre-de-forges_<Octave-3902>_103173,"Dans toute la splendeur de sa beauté , elle s'"
Ohnet-Georges_Le-Maitre-de-forges_<Octave-3902>_103176,"splendeur de sa beauté , elle s' avançait vers lui"
Ohnet-Georges_Le-Maitre-de-forges_<Octave-3902>_103182,"s' avançait vers lui . Elle était rayonnante , et"
Ohnet-Georges_Le-Maitre-de-forges_<Octave-3902>_103190,", et nulle trace de ses soucis ne se voyait"
Ohnet-Georges_Le-Maitre-de-forges_<Octave-3902>_103196,soucis ne se voyait sur son visage . En lui
Ohnet-Georges_Le-Maitre-de-forges_<Octave-3902>_103214,la fermeté d' âme de la jeune femme . Il
Ohnet-Georges_Le-Maitre-de-forges_<Octave-3902>_103221,"femme . Il pensa qu' elle était vraiment vaillante ,"
Ohnet-Georges_Le-Maitre-de-forges_<Octave-3902>_103228,"vraiment vaillante , et il lui sut gré de faire"
Ohnet-Georges_Le-Maitre-de-forges_<Octave-3902>_103235,gré de faire si brillamment son devoir . Lui adressant
Ohnet-Georges_Le-Maitre-de-forges_<Octave-3902>_103238,si brillamment son devoir . Lui adressant un sourire qui
Ohnet-Georges_Le-Maitre-de-forges_<Octave-3902>_103243,Lui adressant un sourire qui la fit pâlir de joie
Ohnet-Georges_Le-Maitre-de-forges_<Octave-3902>_103253,", il s' approcha d' elle , tenant dans sa"
Ohnet-Georges_Le-Maitre-de-forges_<Octave-3902>_103275,C . D . – Vous êtes assez pauvre en
Ohnet-Georges_Le-Maitre-de-forges_<Octave-3902>_103282,"assez pauvre en bijoux , lui dit - il en"
Ohnet-Georges_Le-Maitre-de-forges_<Octave-3902>_103310,ce que je désirais pour vous . Laissez - moi
Ohnet-Georges_Le-Maitre-de-forges_<Octave-3902>_103326,"il tendait l' écrin . Claire , interdite , hésitait"
Ohnet-Georges_Le-Maitre-de-forges_<Octave-3902>_103335,hésitait à le prendre . La baronne s' en saisit
Ohnet-Georges_Le-Maitre-de-forges_<Octave-3902>_103343,"en saisit vivement , l' ouvrit , et , en"
Ohnet-Georges_Le-Maitre-de-forges_<Octave-3902>_103355,"merveilleuse rivière en diamants , elle la fit , avec"
Ohnet-Georges_Le-Maitre-de-forges_<Octave-3902>_103373,"lumière : – Oh ! ma chère , vois donc"
Ohnet-Georges_Le-Maitre-de-forges_<Octave-3902>_103388,princier ! Le front de Claire se rembrunit . C'
Ohnet-Georges_Le-Maitre-de-forges_<Octave-3902>_103400,cadeau princier en effet . La jeune femme pensa aux
Ohnet-Georges_Le-Maitre-de-forges_<Octave-3902>_103414,"or , produit prétendu de sa dot , qui dormaient"
Ohnet-Georges_Le-Maitre-de-forges_<Octave-3902>_103423,dormaient dans un tiroir de son beau meuble d' ébène
Ohnet-Georges_Le-Maitre-de-forges_<Octave-3902>_103429,beau meuble d' ébène . Elle les ajouta à la
Ohnet-Georges_Le-Maitre-de-forges_<Octave-3902>_103444,"coûter le collier , et elle se sentit humiliée au"
Ohnet-Georges_Le-Maitre-de-forges_<Octave-3902>_103452,humiliée au plus profond d' elle - même . Quelle
Ohnet-Georges_Le-Maitre-de-forges_<Octave-3902>_103461,Quelle leçon de générosité Philippe lui donnait encore ! L'
Ohnet-Georges_Le-Maitre-de-forges_<Octave-3902>_103476,"son suprême argument , à elle , il le dépensait"
Ohnet-Georges_Le-Maitre-de-forges_<Octave-3902>_103538,"puissiez faire , dit malicieusement la baronne . Puis ,"
Ohnet-Georges_Le-Maitre-de-forges_<Octave-3902>_103546,"Puis , se tournant vers son mari qui entrait ,"
Ohnet-Georges_Le-Maitre-de-forges_<Octave-3902>_103566,"toujours des petits cailloux , mon cher , tâchez donc"
Ohnet-Georges_Le-Maitre-de-forges_<Octave-3902>_103617,"peau satinée , et il la vit frissonner à son"
Ohnet-Georges_Le-Maitre-de-forges_<Octave-3902>_103630,"Allons ! allons ! reprit la baronne , un jour"
Ohnet-Georges_Le-Maitre-de-forges_<Octave-3902>_103650,on s' embrasse … Et elle poussa Claire dans les
Ohnet-Georges_Le-Maitre-de-forges_<Octave-3902>_103652,embrasse … Et elle poussa Claire dans les bras de
Ohnet-Georges_Le-Maitre-de-forges_<Octave-3902>_103735,douceur de ce rapprochement . Claire n' avait pas jusqu'
Ohnet-Georges_Le-Maitre-de-forges_<Octave-3902>_103750,importance de la position de son mari . Partout où
Ohnet-Georges_Le-Maitre-de-forges_<Octave-3902>_103758,"Partout où il allait , elle le voyait accueilli avec"
Ohnet-Georges_Le-Maitre-de-forges_<Octave-3902>_103772,Ce fut en recevant chez elle tout ce que le
Ohnet-Georges_Le-Maitre-de-forges_<Octave-3902>_103783,comptait de gens considérables qu' elle comprit de quelles influences
Ohnet-Georges_Le-Maitre-de-forges_<Octave-3902>_103898,"assis à la droite de Claire , ce vieillard souriant"
Ohnet-Georges_Le-Maitre-de-forges_<Octave-3902>_103928,"implacablement exécuté les décrets . Athénaïs , décomposée par l'"
Ohnet-Georges_Le-Maitre-de-forges_<Octave-3902>_103939,", assista au triomphe de sa rivale . Claire ,"
Ohnet-Georges_Le-Maitre-de-forges_<Octave-3902>_103942,"triomphe de sa rivale . Claire , soutenue , pour"
Ohnet-Georges_Le-Maitre-de-forges_<Octave-3902>_103955,", par le regard de son mari , retrouva sa"
Ohnet-Georges_Le-Maitre-de-forges_<Octave-3902>_103959,"de son mari , retrouva sa confiance . Elle causa"
Ohnet-Georges_Le-Maitre-de-forges_<Octave-3902>_103962,", retrouva sa confiance . Elle causa avec esprit ,"
Ohnet-Georges_Le-Maitre-de-forges_<Octave-3902>_103980,- propre de chacun de ses convives . Elle se
Ohnet-Georges_Le-Maitre-de-forges_<Octave-3902>_103983,chacun de ses convives . Elle se sentait admirée par
Ohnet-Georges_Le-Maitre-de-forges_<Octave-3902>_104000,"désir de lui plaire , elle déploya toutes les ressources"
Ohnet-Georges_Le-Maitre-de-forges_<Octave-3902>_104015,Le duc fut frappé de son rayonnant éclat . La
Ohnet-Georges_Le-Maitre-de-forges_<Octave-3902>_104019,"de son rayonnant éclat . La jeune femme , tendue"
Ohnet-Georges_Le-Maitre-de-forges_<Octave-3902>_104043,", se laissa aller à la contempler avec une admiration"
Ohnet-Georges_Le-Maitre-de-forges_<Octave-3902>_104060,". Les yeux fixés sur elle , il oublia tout"
Ohnet-Georges_Le-Maitre-de-forges_<Octave-3902>_104114,qu' il était homme à lui prendre la vie après
Ohnet-Georges_Le-Maitre-de-forges_<Octave-3902>_104119,lui prendre la vie après lui avoir pris l' honneur
Ohnet-Georges_Le-Maitre-de-forges_<Octave-3902>_104190,s' occupait beaucoup trop de Claire . Il n' attachait
Ohnet-Georges_Le-Maitre-de-forges_<Octave-3902>_104204,"général , à ces marivaudages du jeune homme . Mais"
Ohnet-Georges_Le-Maitre-de-forges_<Octave-3902>_104343,de voir le duc regarder Claire . Il lui sembla
Ohnet-Georges_Le-Maitre-de-forges_<Octave-3902>_104360,"sur les épaules nues de la jeune femme , les"
Ohnet-Georges_Le-Maitre-de-forges_<elle-3744>_91816,de délire d' orgueil auquel elle s' était trouvée en
Ohnet-Georges_Le-Maitre-de-forges_<elle-3744>_91839,", coûte que coûte , lui sembla tellement mesquine qu'"
Ohnet-Georges_Le-Maitre-de-forges_<elle-3744>_91844,lui sembla tellement mesquine qu' elle en rougit . Était
Ohnet-Georges_Le-Maitre-de-forges_<elle-3744>_91849,elle en rougit . Était - ce donc entraînée par
Ohnet-Georges_Le-Maitre-de-forges_<elle-3744>_91859,de si vulgaires motifs qu' elle avait compromis toute son
Ohnet-Georges_Le-Maitre-de-forges_<elle-3744>_91863,qu' elle avait compromis toute son existence ? Elle se
Ohnet-Georges_Le-Maitre-de-forges_<elle-3744>_91866,compromis toute son existence ? Elle se dit que Philippe
Ohnet-Georges_Le-Maitre-de-forges_<elle-3744>_91887,pas se montrer inexorable . Elle avait cependant encore devant
Ohnet-Georges_Le-Maitre-de-forges_<elle-3744>_91900,profil sévère et hautain . Elle avait encore dans les
Ohnet-Georges_Le-Maitre-de-forges_<elle-3744>_91916,quand il avait dit : Vous apprendrez un jour la
Ohnet-Georges_Le-Maitre-de-forges_<elle-3744>_91923,"un jour la vérité , vous saurez que vous venez"
Ohnet-Georges_Le-Maitre-de-forges_<elle-3744>_91926,"vérité , vous saurez que vous venez d' être encore"
Ohnet-Georges_Le-Maitre-de-forges_<elle-3744>_91936,"plus injuste que cruelle , vous pourrez alors vous traîner"
Ohnet-Georges_Le-Maitre-de-forges_<elle-3744>_91947,"mes pieds , en implorant votre pardon : je n'"
Ohnet-Georges_Le-Maitre-de-forges_<elle-3744>_91955,je n' aurai pas pour vous une parole de pitié
Ohnet-Georges_Le-Maitre-de-forges_<elle-3744>_91965,. Ces terribles engagements ne lui avaient - ils pas
Ohnet-Georges_Le-Maitre-de-forges_<elle-3744>_91990,"faiblesse et sans indulgence ? Elle le revit , le"
Ohnet-Georges_Le-Maitre-de-forges_<elle-3744>_91998,", le front penché dans ses mains , brisé par"
Ohnet-Georges_Le-Maitre-de-forges_<elle-3744>_92010,", puis se relevant et lui montrant son visage inondé"
Ohnet-Georges_Le-Maitre-de-forges_<elle-3744>_92012,se relevant et lui montrant son visage inondé de larmes
Ohnet-Georges_Le-Maitre-de-forges_<elle-3744>_92021,"larmes . Certes , il l' adorait , et ,"
Ohnet-Georges_Le-Maitre-de-forges_<elle-3744>_92061,blessure que la main de la jeune femme avait faite
Ohnet-Georges_Le-Maitre-de-forges_<elle-3744>_92078,"il parti tout entier ? Claire , du bout de"
Ohnet-Georges_Le-Maitre-de-forges_<elle-3744>_92083,"Claire , du bout de son pied , traça machinalement"
Ohnet-Georges_Le-Maitre-de-forges_<elle-3744>_92102,"a aimé profondément , dit - elle à haute voix"
Ohnet-Georges_Le-Maitre-de-forges_<elle-3744>_92110,"haute voix , comme si elle eût voulu poser la"
Ohnet-Georges_Le-Maitre-de-forges_<elle-3744>_92117,"voulu poser la question qui l' agitait au bois ,"
Ohnet-Georges_Le-Maitre-de-forges_<elle-3744>_92135,la nature tout entière qui l' entourait mystérieuse et recueillie
Ohnet-Georges_Le-Maitre-de-forges_<elle-3744>_92147,"on a aimé comme il m' aimait , peut -"
Ohnet-Georges_Le-Maitre-de-forges_<elle-3744>_92162,"on a aimé profondément , lui répondit une voix railleuse"
Ohnet-Georges_Le-Maitre-de-forges_<elle-3744>_92172,", qui semblait descendre vers elle , on n' oublie"
Ohnet-Georges_Le-Maitre-de-forges_<elle-3744>_92179,"on n' oublie jamais . Claire se dressa vivement ,"
Ohnet-Georges_Le-Maitre-de-forges_<elle-3744>_92189,"et levant la tête , elle vit le duc qui"
Ohnet-Georges_Le-Maitre-de-forges_<elle-3744>_92203,"instant dans le kiosque , la regardait en souriant ,"
Ohnet-Georges_Le-Maitre-de-forges_<elle-3744>_92221,j' arrive à point pour vous répondre ? fit -
Ohnet-Georges_Le-Maitre-de-forges_<elle-3744>_92235,- ce à moi que vous pensiez au moins ?
Ohnet-Georges_Le-Maitre-de-forges_<elle-3744>_92240,vous pensiez au moins ? Claire le regarda en fermant
Ohnet-Georges_Le-Maitre-de-forges_<elle-3744>_92260,"Ma foi non , répondit - elle . – Tant"
Ohnet-Georges_Le-Maitre-de-forges_<elle-3744>_92269,Tant pis ! – Et vous ? demanda la jeune
Ohnet-Georges_Le-Maitre-de-forges_<elle-3744>_92272,"– Et vous ? demanda la jeune femme , qu'"
Ohnet-Georges_Le-Maitre-de-forges_<elle-3744>_92281,qu' est - ce que vous venez chercher ici ?
Ohnet-Georges_Le-Maitre-de-forges_<elle-3744>_92299,", et s' approchant de Claire : – C' est"
Ohnet-Georges_Le-Maitre-de-forges_<elle-3744>_92304,"Claire : – C' est vous que je cherche ,"
Ohnet-Georges_Le-Maitre-de-forges_<elle-3744>_92331,causer à cœur ouvert . Vous m' avez assez mal
Ohnet-Georges_Le-Maitre-de-forges_<elle-3744>_92346,"une heure , quand je vous ai offert ma compagnie"
Ohnet-Georges_Le-Maitre-de-forges_<elle-3744>_92356,. J' ai pensé que vous seriez peut - être
Ohnet-Georges_Le-Maitre-de-forges_<elle-3744>_92370,Et me voilà . Êtes - vous en humeur de
Ohnet-Georges_Le-Maitre-de-forges_<elle-3744>_92382,"? – Mon Dieu , mon cher duc , je"
Ohnet-Georges_Le-Maitre-de-forges_<elle-3744>_92386,", mon cher duc , je crois bien que nous"
Ohnet-Georges_Le-Maitre-de-forges_<elle-3744>_92401,dire . – En êtes - vous sûre ? Je
Ohnet-Georges_Le-Maitre-de-forges_<elle-3744>_92410,Je constate avec douleur que vous êtes devenue extrêmement dissimulée
Ohnet-Georges_Le-Maitre-de-forges_<elle-3744>_92416,êtes devenue extrêmement dissimulée . Vous avez du chagrin et
Ohnet-Georges_Le-Maitre-de-forges_<elle-3744>_92421,Vous avez du chagrin et vous ne voulez pas en
Ohnet-Georges_Le-Maitre-de-forges_<elle-3744>_92428,voulez pas en convenir . Claire haussa dédaigneusement les épaules
Ohnet-Georges_Le-Maitre-de-forges_<elle-3744>_92436,"les épaules : – Et moi je constate , dit"
Ohnet-Georges_Le-Maitre-de-forges_<elle-3744>_92437,"épaules : – Et moi je constate , dit -"
Ohnet-Georges_Le-Maitre-de-forges_<elle-3744>_92441,"moi je constate , dit - elle , que vous"
Ohnet-Georges_Le-Maitre-de-forges_<elle-3744>_92445,"dit - elle , que vous baissez intellectuellement d' une"
Ohnet-Georges_Le-Maitre-de-forges_<elle-3744>_92453,d' une façon visible . Vous revenez sans cesse aux
Ohnet-Georges_Le-Maitre-de-forges_<elle-3744>_92473,peine à voir . Rassurez votre cœur trop sensible .
Ohnet-Georges_Le-Maitre-de-forges_<elle-3744>_92478,votre cœur trop sensible . Je n' ai pas de
Ohnet-Georges_Le-Maitre-de-forges_<elle-3744>_92487,"de chagrin , et ne suis point disposée à en"
Ohnet-Georges_Le-Maitre-de-forges_<elle-3744>_92494,disposée à en avoir pour vous faire plaisir . –
Ohnet-Georges_Le-Maitre-de-forges_<elle-3744>_92502,. – Soit ! reprit le duc avec bonhomie .
Ohnet-Georges_Le-Maitre-de-forges_<elle-3744>_92507,le duc avec bonhomie . Je ne demande qu' à
Ohnet-Georges_Le-Maitre-de-forges_<elle-3744>_92516,à m' être trompé . Je m' étais fait à
Ohnet-Georges_Le-Maitre-de-forges_<elle-3744>_92521,Je m' étais fait à votre sujet des idées qui
Ohnet-Georges_Le-Maitre-de-forges_<elle-3744>_92526,votre sujet des idées qui me paraissaient justes . Mais
Ohnet-Georges_Le-Maitre-de-forges_<elle-3744>_92536,"il faut croire , comme vous le dites si bien"
Ohnet-Georges_Le-Maitre-de-forges_<elle-3744>_92543,"dites si bien , que j' aurai perdu ma lucidité"
Ohnet-Georges_Le-Maitre-de-forges_<elle-3744>_92546,", que j' aurai perdu ma lucidité . Ce matin"
Ohnet-Georges_Le-Maitre-de-forges_<elle-3744>_92553,". Ce matin , il m' avait semblé que vous"
Ohnet-Georges_Le-Maitre-de-forges_<elle-3744>_92557,"il m' avait semblé que vous étiez nerveuse , agitée"
Ohnet-Georges_Le-Maitre-de-forges_<elle-3744>_92571,chasse était très attrayante . Vous n' avez pas voulu
Ohnet-Georges_Le-Maitre-de-forges_<elle-3744>_92580,voulu y prendre part . Vous avez passé votre temps
Ohnet-Georges_Le-Maitre-de-forges_<elle-3744>_92583,part . Vous avez passé votre temps à observer votre
Ohnet-Georges_Le-Maitre-de-forges_<elle-3744>_92587,passé votre temps à observer votre mari … – Eh
Ohnet-Georges_Le-Maitre-de-forges_<elle-3744>_92595,"– Eh bien ? dit Claire , en réprimant un"
Ohnet-Georges_Le-Maitre-de-forges_<elle-3744>_92607,"– Eh bien ! continua le duc , chose singulière"
Ohnet-Georges_Le-Maitre-de-forges_<elle-3744>_92627,air de s' occuper de vous . Il était tout
Ohnet-Georges_Le-Maitre-de-forges_<elle-3744>_92633,. Il était tout à la duchesse qui l' avait
Ohnet-Georges_Le-Maitre-de-forges_<elle-3744>_92635,était tout à la duchesse qui l' avait réclamé comme
Ohnet-Georges_Le-Maitre-de-forges_<elle-3744>_92644,"comme cavalier servant . Et vous , au lieu d'"
Ohnet-Georges_Le-Maitre-de-forges_<elle-3744>_92659,"faire galamment son devoir , vous lui lanciez des regards"
Ohnet-Georges_Le-Maitre-de-forges_<elle-3744>_92669,foudroyants . – D' où vous avez conclu ? demanda
Ohnet-Georges_Le-Maitre-de-forges_<elle-3744>_92674,vous avez conclu ? demanda Claire froidement . – Que
Ohnet-Georges_Le-Maitre-de-forges_<elle-3744>_92683,Que le bon accord que vous prétendez exister entre lui
Ohnet-Georges_Le-Maitre-de-forges_<elle-3744>_92689,prétendez exister entre lui et vous n' est pas réel
Ohnet-Georges_Le-Maitre-de-forges_<elle-3744>_92711,"le hasard , ou plutôt ma mauvaise fortune , lui"
Ohnet-Georges_Le-Maitre-de-forges_<elle-3744>_92722,"donné . Alors , que vous dirai - je ?"
Ohnet-Georges_Le-Maitre-de-forges_<elle-3744>_92724,"Alors , que vous dirai - je ? mille petits"
Ohnet-Georges_Le-Maitre-de-forges_<elle-3744>_92738,", se sont groupés dans mon esprit . Je me"
Ohnet-Georges_Le-Maitre-de-forges_<elle-3744>_92741,groupés dans mon esprit . Je me suis rappelé l'
Ohnet-Georges_Le-Maitre-de-forges_<elle-3744>_92749,rappelé l' étrange attitude que vous aviez le jour de
Ohnet-Georges_Le-Maitre-de-forges_<elle-3744>_92754,vous aviez le jour de votre mariage . J' ai
Ohnet-Georges_Le-Maitre-de-forges_<elle-3744>_92757,jour de votre mariage . J' ai commenté vos tristesses
Ohnet-Georges_Le-Maitre-de-forges_<elle-3744>_92760,"mariage . J' ai commenté vos tristesses , analysé vos"
Ohnet-Georges_Le-Maitre-de-forges_<elle-3744>_92764,"commenté vos tristesses , analysé vos colères . Et ,"
Ohnet-Georges_Le-Maitre-de-forges_<elle-3744>_92777,"pour et le contre , je suis arrivé à cette"
Ohnet-Georges_Le-Maitre-de-forges_<elle-3744>_92784,"arrivé à cette conclusion que vous n' avez pas ,"
Ohnet-Georges_Le-Maitre-de-forges_<elle-3744>_92791,"avez pas , quoi que vous en disiez , tout"
Ohnet-Georges_Le-Maitre-de-forges_<elle-3744>_92799,", tout le bonheur que vous méritez . L' attaque"
Ohnet-Georges_Le-Maitre-de-forges_<elle-3744>_92813,". En un instant , le duc avait tourné les"
Ohnet-Georges_Le-Maitre-de-forges_<elle-3744>_92823,"défenses si patiemment élevées par Claire . Audacieusement , il"
