,text_surronding
Ohnet-Georges_Le-Maitre-de-forges_<l'-4377>_115959,"Philippe , et lui nouant ses beaux bras autour du"
Ohnet-Georges_Le-Maitre-de-forges_<l'-4377>_115966,"bras autour du cou , elle roulait sa tête blonde"
Ohnet-Georges_Le-Maitre-de-forges_<l'-4377>_115968,"du cou , elle roulait sa tête blonde sur son"
Ohnet-Georges_Le-Maitre-de-forges_<l'-4377>_115972,"roulait sa tête blonde sur son épaule , l' enivrant"
Ohnet-Georges_Le-Maitre-de-forges_<l'-4377>_115975,"blonde sur son épaule , l' enivrant de son parfum"
Ohnet-Georges_Le-Maitre-de-forges_<l'-4377>_115978,"épaule , l' enivrant de son parfum , le brûlant"
Ohnet-Georges_Le-Maitre-de-forges_<l'-4377>_115981,"enivrant de son parfum , le brûlant de son regard"
Ohnet-Georges_Le-Maitre-de-forges_<l'-4377>_115984,"parfum , le brûlant de son regard . Elle parlait"
Ohnet-Georges_Le-Maitre-de-forges_<l'-4377>_115987,brûlant de son regard . Elle parlait maintenant comme en
Ohnet-Georges_Le-Maitre-de-forges_<l'-4377>_116002,ne pars pas ! Si tu savais comme je t'
Ohnet-Georges_Le-Maitre-de-forges_<l'-4377>_116005,! Si tu savais comme je t' aime ! Reste
Ohnet-Georges_Le-Maitre-de-forges_<l'-4377>_116006,Si tu savais comme je t' aime ! Reste là
Ohnet-Georges_Le-Maitre-de-forges_<l'-4377>_116014,"Reste là , près de moi , tout à moi"
Ohnet-Georges_Le-Maitre-de-forges_<l'-4377>_116018,"de moi , tout à moi . Nous sommes si"
Ohnet-Georges_Le-Maitre-de-forges_<l'-4377>_116035,à être heureux ! Que t' importent cet homme et
Ohnet-Georges_Le-Maitre-de-forges_<l'-4377>_116053,"oublierons . Partons , veux - tu , loin d'"
Ohnet-Georges_Le-Maitre-de-forges_<l'-4377>_116073,vie et l' amour . Philippe détacha doucement le bras
Ohnet-Georges_Le-Maitre-de-forges_<l'-4377>_116079,"détacha doucement le bras qui l' enlaçait et , éloignant"
Ohnet-Georges_Le-Maitre-de-forges_<l'-4377>_116084,"l' enlaçait et , éloignant Claire : – Ici ,"
Ohnet-Georges_Le-Maitre-de-forges_<l'-4377>_116090,": – Ici , dit - il simplement , c'"
Ohnet-Georges_Le-Maitre-de-forges_<l'-4377>_116102,devoir et l' honneur . La jeune femme poussa un
Ohnet-Georges_Le-Maitre-de-forges_<l'-4377>_116112,gémissement . La réalité effrayante l' avait ressaisie . Elle
Ohnet-Georges_Le-Maitre-de-forges_<l'-4377>_116116,"effrayante l' avait ressaisie . Elle revit , en un"
Ohnet-Georges_Le-Maitre-de-forges_<l'-4377>_116136,", l' air mauvais . Elle voulut s' élancer ,"
Ohnet-Georges_Le-Maitre-de-forges_<l'-4377>_116147,"un dernier effort , retenir Philippe malgré lui . Elle"
Ohnet-Georges_Le-Maitre-de-forges_<l'-4377>_116149,"effort , retenir Philippe malgré lui . Elle cria :"
Ohnet-Georges_Le-Maitre-de-forges_<l'-4377>_116151,retenir Philippe malgré lui . Elle cria : – Non
Ohnet-Georges_Le-Maitre-de-forges_<l'-4377>_116176,parut . Il adressa à Philippe un signe de tête
Ohnet-Georges_Le-Maitre-de-forges_<l'-4377>_116185,tête et se retira . Claire comprit que l' instant
Ohnet-Georges_Le-Maitre-de-forges_<l'-4377>_116203,si un voile qui obscurcissait son esprit avait été déchiré
Ohnet-Georges_Le-Maitre-de-forges_<l'-4377>_116209,esprit avait été déchiré . Elle comprit que tout était
Ohnet-Georges_Le-Maitre-de-forges_<l'-4377>_116223,"abattant sur la poitrine de son mari , elle le"
Ohnet-Georges_Le-Maitre-de-forges_<l'-4377>_116226,"poitrine de son mari , elle le serra une dernière"
Ohnet-Georges_Le-Maitre-de-forges_<l'-4377>_116227,"de son mari , elle le serra une dernière fois"
Ohnet-Georges_Le-Maitre-de-forges_<l'-4377>_116241,". – Adieu , murmura le maître de forges ."
Ohnet-Georges_Le-Maitre-de-forges_<l'-4377>_116250,. – Oh ! ne me quittez pas ainsi !
Ohnet-Georges_Le-Maitre-de-forges_<l'-4377>_116263,mot glacé ! … Dites - moi que vous m'
Ohnet-Georges_Le-Maitre-de-forges_<l'-4377>_116266,… Dites - moi que vous m' aimez ! Ne
Ohnet-Georges_Le-Maitre-de-forges_<l'-4377>_116267,Dites - moi que vous m' aimez ! Ne partez
Ohnet-Georges_Le-Maitre-de-forges_<l'-4377>_116274,! Ne partez pas sans me l' avoir dit !
Ohnet-Georges_Le-Maitre-de-forges_<l'-4377>_116279,me l' avoir dit ! Philippe demeura inébranlable . Il
Ohnet-Georges_Le-Maitre-de-forges_<l'-4377>_116283,! Philippe demeura inébranlable . Il avait avoué qu' il
Ohnet-Georges_Le-Maitre-de-forges_<l'-4377>_116287,. Il avait avoué qu' il pardonnait : il ne
Ohnet-Georges_Le-Maitre-de-forges_<l'-4377>_116290,avoué qu' il pardonnait : il ne voulut pas dire
Ohnet-Georges_Le-Maitre-de-forges_<l'-4377>_116296,ne voulut pas dire qu' il aimait . Il éloigna
Ohnet-Georges_Le-Maitre-de-forges_<l'-4377>_116299,dire qu' il aimait . Il éloigna Claire de lui
Ohnet-Georges_Le-Maitre-de-forges_<l'-4377>_116301,"il aimait . Il éloigna Claire de lui , marcha"
Ohnet-Georges_Le-Maitre-de-forges_<l'-4377>_116303,". Il éloigna Claire de lui , marcha vers la"
Ohnet-Georges_Le-Maitre-de-forges_<l'-4377>_116305,"éloigna Claire de lui , marcha vers la porte ,"
Ohnet-Georges_Le-Maitre-de-forges_<l'-4377>_116322,: – Priez Dieu que je revienne vivant ! dit
Ohnet-Georges_Le-Maitre-de-forges_<l'-4377>_116327,"je revienne vivant ! dit - il , lui jetant"
Ohnet-Georges_Le-Maitre-de-forges_<l'-4377>_116330,"! dit - il , lui jetant dans ces mots"
Ohnet-Georges_Le-Maitre-de-forges_<l'-4377>_116344,. Ce fut tout . La jeune femme poussa un
Ohnet-Georges_Le-Maitre-de-forges_<l'-4377>_116360,. La voiture qui emportait le maître de forges roula
Ohnet-Georges_Le-Maitre-de-forges_<l'-4377>_116370,"sourdement dans l' avenue . Claire , sans se préoccuper"
Ohnet-Georges_Le-Maitre-de-forges_<l'-4377>_116379,"préoccuper de la présence de la baronne , se laissa"
Ohnet-Georges_Le-Maitre-de-forges_<l'-4377>_116386,", se laissa retomber sur sa chaise longue , la"
Ohnet-Georges_Le-Maitre-de-forges_<l'-4377>_116409,"entendre , rêvant de suspendre sa vie pendant l' heure"
Ohnet-Georges_Le-Maitre-de-forges_<l'-4377>_116420,qui allait s' écouler . Elle resta ainsi quelques instants
Ohnet-Georges_Le-Maitre-de-forges_<l'-4377>_116429,instants . Une douce voix la fit se relever brusquement
Ohnet-Georges_Le-Maitre-de-forges_<l'-4377>_116449,Peut - on entrer ? Claire échangea un douloureux regard
Ohnet-Georges_Le-Maitre-de-forges_<l'-4377>_116468,", s' efforcer de tromper cette enfant ignorante de la"
Ohnet-Georges_Le-Maitre-de-forges_<l'-4377>_116493,"apparaissait . – Viens , mon enfant , dit Claire"
Ohnet-Georges_Le-Maitre-de-forges_<l'-4377>_116497,", mon enfant , dit Claire . Et , prodige"
Ohnet-Georges_Le-Maitre-de-forges_<l'-4377>_116505,", prodige de volonté , elle se fit souriante ."
Ohnet-Georges_Le-Maitre-de-forges_<l'-4377>_116513,souriante . – Comment ! vous n' êtes pas habillée
Ohnet-Georges_Le-Maitre-de-forges_<l'-4377>_116521,"pas habillée ? s' écria la jeune fille , en"
Ohnet-Georges_Le-Maitre-de-forges_<l'-4377>_116527,"jeune fille , en voyant sa belle - sœur vêtue"
Ohnet-Georges_Le-Maitre-de-forges_<l'-4377>_116536,"vêtue d' un peignoir . Moi , j' ai déjà"
Ohnet-Georges_Le-Maitre-de-forges_<l'-4377>_116538,"un peignoir . Moi , j' ai déjà fait tout"
Ohnet-Georges_Le-Maitre-de-forges_<l'-4377>_116610,", tous les trois ? Claire rougissait et pâlissait tour"
Ohnet-Georges_Le-Maitre-de-forges_<l'-4377>_116613,trois ? Claire rougissait et pâlissait tour à tour .
Ohnet-Georges_Le-Maitre-de-forges_<l'-4377>_116624,sueur d' angoisse perlait sur son front . Chaque parole
Ohnet-Georges_Le-Maitre-de-forges_<l'-4377>_116631,. Chaque parole de Suzanne la torturait . – Oh
Ohnet-Georges_Le-Maitre-de-forges_<l'-4377>_116673,dirigeaient - ils ? demanda Claire d' une voix tremblante
Ohnet-Georges_Le-Maitre-de-forges_<l'-4377>_116686,"côté des étangs , répondit la jeune fille . Peut"
Ohnet-Georges_Le-Maitre-de-forges_<l'-4377>_116724,lever avant dix heures … Claire n' entendait plus .
Ohnet-Georges_Le-Maitre-de-forges_<l'-4377>_116773,"arbres , avaient passé devant ses yeux . Ce lieu"
Ohnet-Georges_Le-Maitre-de-forges_<l'-4377>_116812,"Philippe allaient se battre . Elle en était sûre ,"
Ohnet-Georges_Le-Maitre-de-forges_<l'-4377>_116817,"Elle en était sûre , elle les voyait . Elle"
Ohnet-Georges_Le-Maitre-de-forges_<l'-4377>_116821,", elle les voyait . Elle fut reprise d' une"
Ohnet-Georges_Le-Maitre-de-forges_<l'-4377>_116836,le besoin de savoir . Elle ne put rester en
Ohnet-Georges_Le-Maitre-de-forges_<l'-4377>_116843,put rester en place ; elle prit une robe et
Ohnet-Georges_Le-Maitre-de-forges_<l'-4377>_116849,prit une robe et la passa à la hâte .
Ohnet-Georges_Le-Maitre-de-forges_<l'-4377>_116869,tendre tous les ressorts de sa volonté … – Tu
Ohnet-Georges_Le-Maitre-de-forges_<l'-4377>_116873,de sa volonté … – Tu t' es servie de
Ohnet-Georges_Le-Maitre-de-forges_<l'-4377>_116883,la petite voiture ? dit - elle à Suzanne .
Ohnet-Georges_Le-Maitre-de-forges_<l'-4377>_116891,Suzanne . Où l' as - tu laissée ? –
Ohnet-Georges_Le-Maitre-de-forges_<l'-4377>_116903,"cour des écuries , répondit la jeune fille . On"
Ohnet-Georges_Le-Maitre-de-forges_<l'-4377>_116916,en ce moment . – Je vais la prendre .
Ohnet-Georges_Le-Maitre-de-forges_<l'-4377>_116921,Je vais la prendre . J' ai une course à
Ohnet-Georges_Le-Maitre-de-forges_<l'-4377>_116935,"le pays , reprit vivement Claire . Et , sans"
Ohnet-Georges_Le-Maitre-de-forges_<l'-4377>_116948,"une écharpe de dentelle sur sa tête nue , elle"
Ohnet-Georges_Le-Maitre-de-forges_<l'-4377>_116952,"sur sa tête nue , elle s' élança au dehors"
Ohnet-Georges_Le-Maitre-de-forges_<l'-4377>_116966,"d' une main hardie , elle partit à une allure"
Ohnet-Georges_Le-Maitre-de-forges_<l'-4377>_116980,"mouvement , loin de calmer sa fièvre la surexcita ."
Ohnet-Georges_Le-Maitre-de-forges_<l'-4377>_116982,loin de calmer sa fièvre la surexcita . Elle eut
Ohnet-Georges_Le-Maitre-de-forges_<l'-4377>_116985,sa fièvre la surexcita . Elle eut la frénésie de
Ohnet-Georges_Le-Maitre-de-forges_<l'-4377>_116994,"de la vitesse , mettant sa bête au galop ,"
Ohnet-Georges_Le-Maitre-de-forges_<l'-4377>_117015,menacée de tout briser . Elle ne s' arrêta devant
Ohnet-Georges_Le-Maitre-de-forges_<l'-4377>_117026,", augmentant la violence de sa course , tous les"
Ohnet-Georges_Le-Maitre-de-forges_<l'-4377>_117055,"coupée par les battements de son cœur , si ,"
Ohnet-Georges_Le-Maitre-de-forges_<l'-4377>_117066,"le silence des bois , elle n' entendait pas une"
Ohnet-Georges_Le-Maitre-de-forges_<l'-4377>_117144,buta et s' abattit . Claire sauta à terre et
Ohnet-Georges_Le-Maitre-de-forges_<l'-4377>_117149,Claire sauta à terre et prit sa course à travers
Ohnet-Georges_Le-Maitre-de-forges_<l'-4377>_117150,sauta à terre et prit sa course à travers bois
Ohnet-Georges_Le-Maitre-de-forges_<l'-4377>_117156,course à travers bois . Son instinct l' avertit qu'
Ohnet-Georges_Le-Maitre-de-forges_<l'-4377>_117158,travers bois . Son instinct l' avertit qu' elle approchait
Ohnet-Georges_Le-Maitre-de-forges_<l'-4377>_117161,Son instinct l' avertit qu' elle approchait du but ;
Ohnet-Georges_Le-Maitre-de-forges_<l'-4377>_117166,elle approchait du but ; elle écouta et entendit qu'
Ohnet-Georges_Le-Maitre-de-forges_<l'-4377>_117169,but ; elle écouta et entendit qu' on parlait .
Ohnet-Georges_Le-Maitre-de-forges_<l'-4377>_117174,entendit qu' on parlait . Elle jeta un rapide coup
Ohnet-Georges_Le-Maitre-de-forges_<l'-4377>_117183,coup d' œil autour d' elle . À vingt pas
Ohnet-Georges_Le-Maitre-de-forges_<l'-4377>_117216,"porcelaine . De là , Claire pouvait voir sans être"
Ohnet-Georges_Le-Maitre-de-forges_<l'-4377>_117229,"comme une biche traquée , elle se glissa au travers"
Ohnet-Georges_Le-Maitre-de-forges_<l'-4377>_117249,"à la galerie circulaire , elle s' arrêta anxieuse ,"
Ohnet-Georges_Le-Maitre-de-forges_<l'-4377>_117348,"hautes tiges de digitales . Claire se rappela , avec"
Ohnet-Georges_Le-Maitre-de-forges_<l'-4377>_117404,", brillant , heureux . Elle était jalouse alors ,"
Ohnet-Georges_Le-Maitre-de-forges_<l'-4377>_117415,qu' était - ce que sa jalousie auprès de la
Ohnet-Georges_Le-Maitre-de-forges_<l'-4377>_117422,auprès de la torture qu' elle endurait en ce moment
Ohnet-Georges_Le-Maitre-de-forges_<l'-4377>_117428,endurait en ce moment ? Elle avait sous les yeux
Ohnet-Georges_Le-Maitre-de-forges_<l'-4377>_117443,chercher à se tuer pour elle . Dans un instant
Ohnet-Georges_Le-Maitre-de-forges_<l'-4377>_117464,. Un nuage passa sur ses yeux . Elle dut
Ohnet-Georges_Le-Maitre-de-forges_<l'-4377>_117467,passa sur ses yeux . Elle dut se retenir à
Ohnet-Georges_Le-Maitre-de-forges_<l'-4377>_117479,pour ne pas tomber . Sa faiblesse fut de courte
Ohnet-Georges_Le-Maitre-de-forges_<l'-4377>_117486,"fut de courte durée . Elle regarda de nouveau ,"
Ohnet-Georges_Le-Maitre-de-forges_<l'-4377>_117598,"trois , – feu ! Claire vit les deux pistolets"
Ohnet-Georges_Le-Maitre-de-forges_<l'-4377>_117612,"Dans cette seconde suprême , elle perdit la raison ."
Ohnet-Georges_Le-Maitre-de-forges_<l'-4377>_117620,"raison . Un mouvement invincible la jeta en avant ,"
Ohnet-Georges_Le-Maitre-de-forges_<l'-4377>_117625,"la jeta en avant , elle poussa un cri ,"
Ohnet-Georges_Le-Maitre-de-forges_<l'-4377>_117630,"elle poussa un cri , franchit d' un bond les"
Ohnet-Georges_Le-Maitre-de-forges_<l'-4377>_117651,"coup qui menaçait Philippe , elle boucha de sa blanche"
Ohnet-Georges_Le-Maitre-de-forges_<l'-4377>_117654,"Philippe , elle boucha de sa blanche main le canon"
Ohnet-Georges_Le-Maitre-de-forges_<l'-4377>_117668,. Une détonation éclata . Claire devint pâle comme une
Ohnet-Georges_Le-Maitre-de-forges_<l'-4377>_117679,. Et agitant avec ivresse sa main labourée et sanglante
Ohnet-Georges_Le-Maitre-de-forges_<l'-4377>_117685,"main labourée et sanglante , elle éclaboussa de larges taches"
Ohnet-Georges_Le-Maitre-de-forges_<l'-4377>_117703,"poussant un profond soupir , elle tomba évanouie . Il"
Ohnet-Georges_Le-Maitre-de-forges_<l'-4377>_117743,"un bond , avait saisi Claire , et la soulevant"
Ohnet-Georges_Le-Maitre-de-forges_<l'-4377>_117746,"avait saisi Claire , et la soulevant comme il eût"
Ohnet-Georges_Le-Maitre-de-forges_<l'-4377>_117757,"d' un enfant , il l' avait portée dans la"
Ohnet-Georges_Le-Maitre-de-forges_<l'-4377>_117774,route . Les yeux de la jeune femme étaient fermés
Ohnet-Georges_Le-Maitre-de-forges_<l'-4377>_117826,avait manié le bras de Claire . – Rien de
Ohnet-Georges_Le-Maitre-de-forges_<l'-4377>_117875,tirera en n' ôtant point ses gants . Il se
Ohnet-Georges_Le-Maitre-de-forges_<l'-4377>_117903,de la voiture pour que la jeune femme fût bien
Ohnet-Georges_Le-Maitre-de-forges_<l'-4377>_117920,"bouleversé , ne quittait pas Claire du regard … Son"
Ohnet-Georges_Le-Maitre-de-forges_<l'-4377>_117924,pas Claire du regard … Son évanouissement prolongé l' inquiétait
Ohnet-Georges_Le-Maitre-de-forges_<l'-4377>_117988,. L' accident arrivé à madame Derblay l' afflige gravement
Ohnet-Georges_Le-Maitre-de-forges_<l'-4377>_118109,"sa balle aurait pu atteindre Claire mortellement , briser son"
Ohnet-Georges_Le-Maitre-de-forges_<l'-4377>_118113,"atteindre Claire mortellement , briser son beau front , ou"
Ohnet-Georges_Le-Maitre-de-forges_<l'-4377>_118119,"beau front , ou trouer sa blanche poitrine . En"
Ohnet-Georges_Le-Maitre-de-forges_<l'-4377>_118152,"jamais de la route de celle qui , à cause"
Ohnet-Georges_Le-Maitre-de-forges_<l'-4377>_118153,"de la route de celle qui , à cause de"
Ohnet-Georges_Le-Maitre-de-forges_<l'-4377>_118268,"pendant la longue maladie de Claire , Philippe , silencieux"
Ohnet-Georges_Le-Maitre-de-forges_<l'-4377>_118281,"au pied du lit . La jeune femme , en"
Ohnet-Georges_Le-Maitre-de-forges_<l'-4377>_118305,"heure , s' agitait sur son oreiller . Elle ouvrit"
Ohnet-Georges_Le-Maitre-de-forges_<l'-4377>_118308,agitait sur son oreiller . Elle ouvrit les yeux .
Ohnet-Georges_Le-Maitre-de-forges_<l'-4377>_118313,Elle ouvrit les yeux . Son regard vague chercha Philippe
Ohnet-Georges_Le-Maitre-de-forges_<l'-4377>_118330,vivement et se pencha vers elle . Un sourire passa
Ohnet-Georges_Le-Maitre-de-forges_<l'-4377>_118339,passa sur les lèvres de Claire . De son bras
Ohnet-Georges_Le-Maitre-de-forges_<l'-4377>_118342,lèvres de Claire . De son bras nu elle entoura
Ohnet-Georges_Le-Maitre-de-forges_<l'-4377>_118345,. De son bras nu elle entoura le cou de
Ohnet-Georges_Le-Maitre-de-forges_<l'-4377>_118350,elle entoura le cou de son mari et l' attira
Ohnet-Georges_Le-Maitre-de-forges_<l'-4377>_118354,de son mari et l' attira tendrement . Dans son
Ohnet-Georges_Le-Maitre-de-forges_<l'-4377>_118358,l' attira tendrement . Dans son cerveau troublé la notion
Ohnet-Georges_Le-Maitre-de-forges_<l'-4377>_118373,pas encore revenue . Il lui semblait flotter immatérielle dans
Ohnet-Georges_Le-Maitre-de-forges_<l'-4377>_118382,dans des espaces célestes . Elle ne souffrait pas .
Ohnet-Georges_Le-Maitre-de-forges_<l'-4377>_118390,pas . Une langueur délicieuse l' avait envahie . Si
Ohnet-Georges_Le-Maitre-de-forges_<l'-4377>_118399,"Si bas , que Philippe l' entendit à peine ,"
Ohnet-Georges_Le-Maitre-de-forges_<l'-4377>_118404,"l' entendit à peine , elle murmura : – Je"
Ohnet-Georges_Le-Maitre-de-forges_<l'-4377>_118408,", elle murmura : – Je suis morte , n'"
Ohnet-Georges_Le-Maitre-de-forges_<l'-4377>_118418,"est - ce pas , mon bien - aimé ,"
Ohnet-Georges_Le-Maitre-de-forges_<l'-4377>_118429,morte pour toi ? Que je suis heureuse ! Tu
Ohnet-Georges_Le-Maitre-de-forges_<l'-4377>_118434,"je suis heureuse ! Tu me souris , tu m'"
Ohnet-Georges_Le-Maitre-de-forges_<l'-4377>_118438,"Tu me souris , tu m' aimes . Je suis"
Ohnet-Georges_Le-Maitre-de-forges_<l'-4377>_118441,", tu m' aimes . Je suis dans tes bras"
Ohnet-Georges_Le-Maitre-de-forges_<l'-4377>_118462,! Soudain le son de sa voix la réveilla .
Ohnet-Georges_Le-Maitre-de-forges_<l'-4377>_118464,le son de sa voix la réveilla . Une douleur
Ohnet-Georges_Le-Maitre-de-forges_<l'-4377>_118470,réveilla . Une douleur aiguë lui traversa la main .
Ohnet-Georges_Le-Maitre-de-forges_<l'-4377>_118475,lui traversa la main . Elle se rappela tout :
Ohnet-Georges_Le-Maitre-de-forges_<l'-4377>_118480,"Elle se rappela tout : son désespoir , ses angoisses"
Ohnet-Georges_Le-Maitre-de-forges_<l'-4377>_118483,"tout : son désespoir , ses angoisses et son sacrifice"
Ohnet-Georges_Le-Maitre-de-forges_<l'-4377>_118486,"désespoir , ses angoisses et son sacrifice . – Non"
Ohnet-Georges_Le-Maitre-de-forges_<l'-4377>_118492,sacrifice . – Non ! j' existe ! s' écria
Ohnet-Georges_Le-Maitre-de-forges_<l'-4377>_118499,! s' écria - t - elle . Elle repoussa
Ohnet-Georges_Le-Maitre-de-forges_<l'-4377>_118502,"- t - elle . Elle repoussa Philippe , et"
Ohnet-Georges_Le-Maitre-de-forges_<l'-4377>_118515,", éperdue , comme si sa vie ou sa mort"
Ohnet-Georges_Le-Maitre-de-forges_<l'-4377>_118518,comme si sa vie ou sa mort allait se décider
Ohnet-Georges_Le-Maitre-de-forges_<l'-4377>_118533,"Un seul mot , dit - elle , réponds !"
Ohnet-Georges_Le-Maitre-de-forges_<l'-4377>_118540,", réponds ! M' aimes - tu ? Philippe lui"
Ohnet-Georges_Le-Maitre-de-forges_<l'-4377>_118544,aimes - tu ? Philippe lui montra un visage rayonnant
Ohnet-Georges_Le-Maitre-de-forges_<l'-4377>_118556,": – Oui , je t' aime , répondit -"
Ohnet-Georges_Le-Maitre-de-forges_<l'-4377>_118569,y avait deux femmes en toi . Celle qui m'
Ohnet-Georges_Le-Maitre-de-forges_<l'-4377>_118582,"souffrir n' est plus . Toi , tu es celle"
Ohnet-Georges_Le-Maitre-de-forges_<l'-4377>_118584,"est plus . Toi , tu es celle que je"
Ohnet-Georges_Le-Maitre-de-forges_<l'-4377>_118586,". Toi , tu es celle que je n' ai"
Ohnet-Georges_Le-Maitre-de-forges_<l'-4377>_118587,"Toi , tu es celle que je n' ai jamais"
Ohnet-Georges_Le-Maitre-de-forges_<l'-4377>_118596,"jamais cessé d' adorer . Claire poussa un cri ,"
Ohnet-Georges_Le-Maitre-de-forges_<l'-4377>_118601,"Claire poussa un cri , ses yeux s' emplirent de"
Ohnet-Georges_Le-Maitre-de-forges_<l'-4377>_118608,"s' emplirent de larmes , elle s' attacha désespérément à"
Ohnet-Georges_Le-Maitre-de-forges_<Brigitte-2945>_72431,", fit un signe à Brigitte , et la servante"
Ohnet-Georges_Le-Maitre-de-forges_<Brigitte-2945>_72434,"signe à Brigitte , et la servante partit en courant"
Ohnet-Georges_Le-Maitre-de-forges_<Brigitte-2945>_72467,n' osant pas entrer . Elle se glissa auprès du
Ohnet-Georges_Le-Maitre-de-forges_<Brigitte-2945>_72486,"eût pas l' idée de l' éloigner , retenant son"
Ohnet-Georges_Le-Maitre-de-forges_<Brigitte-2945>_72490,"de l' éloigner , retenant son souffle et regardant avec"
Ohnet-Georges_Le-Maitre-de-forges_<Brigitte-2945>_72507,pâles de Claire . Il lui sembla qu' on étouffait
Ohnet-Georges_Le-Maitre-de-forges_<Brigitte-2945>_72539,"adorables gardes - malades , elle alla sur la pointe"
Ohnet-Georges_Le-Maitre-de-forges_<Brigitte-2945>_72552,la fenêtre . Le médecin la regarda du coin de
Ohnet-Georges_Le-Maitre-de-forges_<Brigitte-2945>_72585,"absorbé , se tourna vers elle avec des yeux attendris"
Ohnet-Georges_Le-Maitre-de-forges_<Brigitte-2945>_72599,"pouvant se retenir , il lui tendit les bras en"
Ohnet-Georges_Le-Maitre-de-forges_<Brigitte-2945>_72622,vingt - quatre heures . Suzanne mêla ses larmes à
Ohnet-Georges_Le-Maitre-de-forges_<Brigitte-2945>_72624,quatre heures . Suzanne mêla ses larmes à celles de
Ohnet-Georges_Le-Maitre-de-forges_<Brigitte-2945>_72629,ses larmes à celles de son frère . Et se
Ohnet-Georges_Le-Maitre-de-forges_<Brigitte-2945>_72649,"rien , murmura - t - elle , entre nous"
Ohnet-Georges_Le-Maitre-de-forges_<Brigitte-2945>_72660,", il ne peut rien lui arriver . Nous la"
Ohnet-Georges_Le-Maitre-de-forges_<Brigitte-2945>_72664,rien lui arriver . Nous la sauverons ! Mais si
Ohnet-Georges_Le-Maitre-de-forges_<Brigitte-2945>_72669,"la sauverons ! Mais si Claire pouvait être sauvée ,"
Ohnet-Georges_Le-Maitre-de-forges_<Brigitte-2945>_72680,ne devait pas être par Suzanne . Philippe demanda à
Ohnet-Georges_Le-Maitre-de-forges_<Brigitte-2945>_72698,de consentir à retourner à son couvent . Le maître
Ohnet-Georges_Le-Maitre-de-forges_<Brigitte-2945>_72710,se défiait du délire de la jeune femme . Elle
Ohnet-Georges_Le-Maitre-de-forges_<Brigitte-2945>_72714,de la jeune femme . Elle parlait avec une affreuse
Ohnet-Georges_Le-Maitre-de-forges_<Brigitte-2945>_72732,duc de Bligny revenait sur ses lèvres . Elle l'
Ohnet-Georges_Le-Maitre-de-forges_<Brigitte-2945>_72735,revenait sur ses lèvres . Elle l' appelait avec rage
Ohnet-Georges_Le-Maitre-de-forges_<Brigitte-2945>_72757,plaie que l' abandon de son fiancé lui avait faite
Ohnet-Georges_Le-Maitre-de-forges_<Brigitte-2945>_72759,l' abandon de son fiancé lui avait faite au cœur
Ohnet-Georges_Le-Maitre-de-forges_<Brigitte-2945>_72767,au cœur . Philippe aussi lui apparaissait dans ses hallucinations
Ohnet-Georges_Le-Maitre-de-forges_<Brigitte-2945>_72784,. Il venait armé pour la frapper après avoir tué
Ohnet-Georges_Le-Maitre-de-forges_<Brigitte-2945>_72792,avoir tué le duc . Elle lui voyait du sang
Ohnet-Georges_Le-Maitre-de-forges_<Brigitte-2945>_72801,"sang aux mains , et elle le suppliait de l'"
Ohnet-Georges_Le-Maitre-de-forges_<Brigitte-2945>_72810,l' envoyer rejoindre celui qu' elle aimait . Si Philippe
Ohnet-Georges_Le-Maitre-de-forges_<Brigitte-2945>_72832,au moins il voulut que Suzanne les ignorât . Il
Ohnet-Georges_Le-Maitre-de-forges_<Brigitte-2945>_72852,sa sœur la connaissance de son malheur . Il jugea
Ohnet-Georges_Le-Maitre-de-forges_<Brigitte-2945>_72885,d' un pénible souvenir entre Suzanne et Claire . Suzanne
Ohnet-Georges_Le-Maitre-de-forges_<Brigitte-2945>_72887,pénible souvenir entre Suzanne et Claire . Suzanne pleurant amèrement
Ohnet-Georges_Le-Maitre-de-forges_<Brigitte-2945>_72889,"entre Suzanne et Claire . Suzanne pleurant amèrement , mais"
Ohnet-Georges_Le-Maitre-de-forges_<Brigitte-2945>_72900,"comme toujours aux ordres de son frère , partit pour"
Ohnet-Georges_Le-Maitre-de-forges_<Brigitte-2945>_72927,", en possession complète de la malade adorée . La"
Ohnet-Georges_Le-Maitre-de-forges_<Brigitte-2945>_73040,"pâlissant , le sang de Claire couler goutte à goutte"
Ohnet-Georges_Le-Maitre-de-forges_<Brigitte-2945>_73049,"goutte , le long de son cou charmant , traçant"
Ohnet-Georges_Le-Maitre-de-forges_<Brigitte-2945>_73058,traçant un sillon rougeâtre sur sa peau blanche . La
Ohnet-Georges_Le-Maitre-de-forges_<Brigitte-2945>_73100,ravages . Le visage de la jeune femme s' était
Ohnet-Georges_Le-Maitre-de-forges_<Brigitte-2945>_73107,"femme s' était amaigri , ses dents faisaient saillie sous"
Ohnet-Georges_Le-Maitre-de-forges_<Brigitte-2945>_73112,ses dents faisaient saillie sous ses joues creuses . Les
Ohnet-Georges_Le-Maitre-de-forges_<Brigitte-2945>_73164,persistait dans le cerveau de Claire . Elle avait la
Ohnet-Georges_Le-Maitre-de-forges_<Brigitte-2945>_73166,le cerveau de Claire . Elle avait la conscience que
Ohnet-Georges_Le-Maitre-de-forges_<Brigitte-2945>_73174,"conscience que , pendant qu' elle était étendue là ,"
Ohnet-Georges_Le-Maitre-de-forges_<Brigitte-2945>_73194,", le jour même où sa rivale gravit triomphalement les"
Ohnet-Georges_Le-Maitre-de-forges_<Brigitte-2945>_73232,"les pas des mariés , Claire eut comme un réveil"
Ohnet-Georges_Le-Maitre-de-forges_<Brigitte-2945>_73244,"lueur de raison passa dans ses yeux , elle se"
Ohnet-Georges_Le-Maitre-de-forges_<Brigitte-2945>_73247,"passa dans ses yeux , elle se souleva et ,"
Ohnet-Georges_Le-Maitre-de-forges_<Brigitte-2945>_73258,"une voix très nette , elle dit : – C'"
Ohnet-Georges_Le-Maitre-de-forges_<Brigitte-2945>_73273,"ils se marient , et moi je vais mourir ."
Ohnet-Georges_Le-Maitre-de-forges_<Brigitte-2945>_73274,"se marient , et moi je vais mourir . La"
Ohnet-Georges_Le-Maitre-de-forges_<Brigitte-2945>_73288,"était approchée , essaya de lui parler , de la"
Ohnet-Georges_Le-Maitre-de-forges_<Brigitte-2945>_73292,"de lui parler , de la tromper ; elle ne"
