,text_surronding
Ohnet-Georges_Le-Maitre-de-forges_<Bachelin-745>_17694,", c' est vrai , vous ne m' en aviez"
Ohnet-Georges_Le-Maitre-de-forges_<Bachelin-745>_17696,"est vrai , vous ne m' en aviez pas prié"
Ohnet-Georges_Le-Maitre-de-forges_<Bachelin-745>_17703,"aviez pas prié , reprit Bachelin avec tranquillité . Mais"
Ohnet-Georges_Le-Maitre-de-forges_<Bachelin-745>_17712,"Mais , ma foi , j' ai trouvé l' occasion"
Ohnet-Georges_Le-Maitre-de-forges_<Bachelin-745>_17720,"l' occasion bonne , et je n' ai pas hésité"
Ohnet-Georges_Le-Maitre-de-forges_<Bachelin-745>_17727,ai pas hésité … Voyez - vous ! il n'
Ohnet-Georges_Le-Maitre-de-forges_<Bachelin-745>_17741,que les positions nettes . Vous auriez lanterné encore pendant
Ohnet-Georges_Le-Maitre-de-forges_<Bachelin-745>_17755,"- être des mois , vous vous seriez enfoncé plus"
Ohnet-Georges_Le-Maitre-de-forges_<Bachelin-745>_17787,. Voilà les raisons qui m' ont déterminé . Est
Ohnet-Georges_Le-Maitre-de-forges_<Bachelin-745>_17797,- ce qu' elles ne vous semblent pas être de
Ohnet-Georges_Le-Maitre-de-forges_<Bachelin-745>_17804,pas être de poids ? Philippe resta silencieux . C'
Ohnet-Georges_Le-Maitre-de-forges_<Bachelin-745>_17813,C' était à peine s' il avait entendu Bachelin .
Ohnet-Georges_Le-Maitre-de-forges_<Bachelin-745>_17816,peine s' il avait entendu Bachelin . Ses idées tournaient
Ohnet-Georges_Le-Maitre-de-forges_<Bachelin-745>_17818,il avait entendu Bachelin . Ses idées tournaient confuses dans
Ohnet-Georges_Le-Maitre-de-forges_<Bachelin-745>_17823,"Ses idées tournaient confuses dans sa tête , il avait"
Ohnet-Georges_Le-Maitre-de-forges_<Bachelin-745>_17826,"confuses dans sa tête , il avait perdu la notion"
Ohnet-Georges_Le-Maitre-de-forges_<Bachelin-745>_17832,avait perdu la notion de son existence . Il lui
Ohnet-Georges_Le-Maitre-de-forges_<Bachelin-745>_17836,de son existence . Il lui semblait qu' il était
Ohnet-Georges_Le-Maitre-de-forges_<Bachelin-745>_17839,. Il lui semblait qu' il était emporté dans d'
Ohnet-Georges_Le-Maitre-de-forges_<Bachelin-745>_17855,". L' air sifflait dans ses oreilles , et ses"
Ohnet-Georges_Le-Maitre-de-forges_<Bachelin-745>_17859,"dans ses oreilles , et ses yeux ne parvenaient point"
Ohnet-Georges_Le-Maitre-de-forges_<Bachelin-745>_17871,fixer sur un objet . Il voyait comme au travers
Ohnet-Georges_Le-Maitre-de-forges_<Bachelin-745>_17883,"brouillard . Et , dans son cerveau endolori , une"
Ohnet-Georges_Le-Maitre-de-forges_<Bachelin-745>_17892,une voix persistante et qui le fatiguait horriblement répétait comme
Ohnet-Georges_Le-Maitre-de-forges_<Bachelin-745>_17910,Si elle allait être à toi ! La voix de
Ohnet-Georges_Le-Maitre-de-forges_<Bachelin-745>_17915,toi ! La voix de Bachelin le tira de son
Ohnet-Georges_Le-Maitre-de-forges_<Bachelin-745>_17916,! La voix de Bachelin le tira de son engourdissement
Ohnet-Georges_Le-Maitre-de-forges_<Bachelin-745>_17919,de Bachelin le tira de son engourdissement . – Eh
Ohnet-Georges_Le-Maitre-de-forges_<Bachelin-745>_17927,– Eh bien ! Pourquoi me regardez - vous ainsi
Ohnet-Georges_Le-Maitre-de-forges_<Bachelin-745>_17929,bien ! Pourquoi me regardez - vous ainsi avec des
Ohnet-Georges_Le-Maitre-de-forges_<Bachelin-745>_17938,des yeux fixes ? dit le notaire . Vous avez
Ohnet-Georges_Le-Maitre-de-forges_<Bachelin-745>_17941,? dit le notaire . Vous avez l' air d'
Ohnet-Georges_Le-Maitre-de-forges_<Bachelin-745>_17951,un songe - creux . Philippe passa la main sur
Ohnet-Georges_Le-Maitre-de-forges_<Bachelin-745>_17956,Philippe passa la main sur son front comme pour effacer
Ohnet-Georges_Le-Maitre-de-forges_<Bachelin-745>_17969,"; puis , souriant à son ami : – Excusez"
Ohnet-Georges_Le-Maitre-de-forges_<Bachelin-745>_17974,son ami : – Excusez - moi . J' ai
Ohnet-Georges_Le-Maitre-de-forges_<Bachelin-745>_17977,– Excusez - moi . J' ai été troublé à
Ohnet-Georges_Le-Maitre-de-forges_<Bachelin-745>_17985,troublé à la pensée que vous aviez joué une si
Ohnet-Georges_Le-Maitre-de-forges_<Bachelin-745>_17994,si grave partie sans que j' en fusse prévenu .
Ohnet-Georges_Le-Maitre-de-forges_<Bachelin-745>_17999,j' en fusse prévenu . Je ne vous croyais pas
Ohnet-Georges_Le-Maitre-de-forges_<Bachelin-745>_18001,fusse prévenu . Je ne vous croyais pas d' humeur
Ohnet-Georges_Le-Maitre-de-forges_<Bachelin-745>_18012,le faire . Sans quoi je vous aurais prié de
Ohnet-Georges_Le-Maitre-de-forges_<Bachelin-745>_18013,faire . Sans quoi je vous aurais prié de garder
Ohnet-Georges_Le-Maitre-de-forges_<Bachelin-745>_18025,. Depuis le jour où j' ai eu la faiblesse
Ohnet-Georges_Le-Maitre-de-forges_<Bachelin-745>_18031,ai eu la faiblesse de vous avouer mon amour pour
Ohnet-Georges_Le-Maitre-de-forges_<Bachelin-745>_18033,la faiblesse de vous avouer mon amour pour mademoiselle de
Ohnet-Georges_Le-Maitre-de-forges_<Bachelin-745>_18040,"pour mademoiselle de Beaulieu , je n' ai cessé de"
Ohnet-Georges_Le-Maitre-de-forges_<Bachelin-745>_18091,ne faudrait . Les aveux vous montent aux lèvres et
Ohnet-Georges_Le-Maitre-de-forges_<Bachelin-745>_18105,les arrêter . À peine vous avais - je parlé
Ohnet-Georges_Le-Maitre-de-forges_<Bachelin-745>_18107,. À peine vous avais - je parlé que l'
Ohnet-Georges_Le-Maitre-de-forges_<Bachelin-745>_18121,", et que la vérité m' apparaissait impitoyable . Mademoiselle"
Ohnet-Georges_Le-Maitre-de-forges_<Bachelin-745>_18129,. Mademoiselle de Beaulieu ne m' a jamais fait l'
Ohnet-Georges_Le-Maitre-de-forges_<Bachelin-745>_18139,honneur de s' apercevoir que j' existe . Elle est
Ohnet-Georges_Le-Maitre-de-forges_<Bachelin-745>_18159,. Et il faut que je sois un véritable insensé
Ohnet-Georges_Le-Maitre-de-forges_<Bachelin-745>_18169,"pour l' aimer . Aussi je mérite un châtiment ,"
Ohnet-Georges_Le-Maitre-de-forges_<Bachelin-745>_18175,"mérite un châtiment , et je suis prêt à le"
Ohnet-Georges_Le-Maitre-de-forges_<Bachelin-745>_18183,"à le subir . Dites - moi tout , allez"
Ohnet-Georges_Le-Maitre-de-forges_<Bachelin-745>_18190,"tout , allez , ne me ménagez pas . –"
Ohnet-Georges_Le-Maitre-de-forges_<Bachelin-745>_18198,. – Eh bien ! je vous dirai d' abord
Ohnet-Georges_Le-Maitre-de-forges_<Bachelin-745>_18199,– Eh bien ! je vous dirai d' abord que
Ohnet-Georges_Le-Maitre-de-forges_<Bachelin-745>_18226,un honnête homme tel que vous n' a eu autant
Ohnet-Georges_Le-Maitre-de-forges_<Bachelin-745>_18247,". À ces mots , Philippe devint si pâle qu'"
Ohnet-Georges_Le-Maitre-de-forges_<Bachelin-745>_18252,Philippe devint si pâle qu' il parut près de s'
Ohnet-Georges_Le-Maitre-de-forges_<Bachelin-745>_18259,près de s' évanouir . Il poussa un cri de
Ohnet-Georges_Le-Maitre-de-forges_<Bachelin-745>_18275,"cassées par l' émotion , le jeune homme s' abattit"
Ohnet-Georges_Le-Maitre-de-forges_<Bachelin-745>_18291,! prenez garde ! Ne me donnez pas d' espoir
Ohnet-Georges_Le-Maitre-de-forges_<Bachelin-745>_18298,pas d' espoir . Il me serait trop dur après
Ohnet-Georges_Le-Maitre-de-forges_<Bachelin-745>_18311,"! – Eh oui , je vous donne de l'"
Ohnet-Georges_Le-Maitre-de-forges_<Bachelin-745>_18312,"– Eh oui , je vous donne de l' espoir"
Ohnet-Georges_Le-Maitre-de-forges_<Bachelin-745>_18319,"de l' espoir , reprit Bachelin , et en le"
Ohnet-Georges_Le-Maitre-de-forges_<Bachelin-745>_18325,", et en le faisant je trahis pour vous tous"
Ohnet-Georges_Le-Maitre-de-forges_<Bachelin-745>_18328,le faisant je trahis pour vous tous les secrets de
Ohnet-Georges_Le-Maitre-de-forges_<Bachelin-745>_18339,famille de Beaulieu . Mais vous avez tant d' intérêt
Ohnet-Georges_Le-Maitre-de-forges_<Bachelin-745>_18352,que ce n' est pas vous qui répéterez ce que
Ohnet-Georges_Le-Maitre-de-forges_<Bachelin-745>_18353,ce n' est pas vous qui répéterez ce que je
Ohnet-Georges_Le-Maitre-de-forges_<Bachelin-745>_18357,vous qui répéterez ce que je viens de vous dire
Ohnet-Georges_Le-Maitre-de-forges_<Bachelin-745>_18360,ce que je viens de vous dire . Et comme
Ohnet-Georges_Le-Maitre-de-forges_<Bachelin-745>_18365,vous dire . Et comme Philippe lui saisissait les mains
Ohnet-Georges_Le-Maitre-de-forges_<Bachelin-745>_18366,"dire . Et comme Philippe lui saisissait les mains ,"
Ohnet-Georges_Le-Maitre-de-forges_<Bachelin-745>_18396,"procès d' Angleterre , reprit Bachelin , et elle l'"
Ohnet-Georges_Le-Maitre-de-forges_<Bachelin-745>_18466,"et abandonnée ! s' écria Philippe , cette jeune fille"
Ohnet-Georges_Le-Maitre-de-forges_<Bachelin-745>_18518,aspect de pur désintéressement que je vous ai montré .
Ohnet-Georges_Le-Maitre-de-forges_<Bachelin-745>_18519,de pur désintéressement que je vous ai montré . –
Ohnet-Georges_Le-Maitre-de-forges_<Bachelin-745>_18527,. – Oh ! dites - le bien ! s'
Ohnet-Georges_Le-Maitre-de-forges_<Bachelin-745>_18533,"le bien ! s' écria Philippe avec feu , dites"
Ohnet-Georges_Le-Maitre-de-forges_<Bachelin-745>_18538,"Philippe avec feu , dites - le à madame de"
Ohnet-Georges_Le-Maitre-de-forges_<Bachelin-745>_18550,"à elle - même , je vous en supplie !"
Ohnet-Georges_Le-Maitre-de-forges_<Bachelin-745>_18551,"elle - même , je vous en supplie ! Puis"
Ohnet-Georges_Le-Maitre-de-forges_<Bachelin-745>_18571,"– Mais non , reprit - il , ne dites"
Ohnet-Georges_Le-Maitre-de-forges_<Bachelin-745>_18602,son époux l' éloignerait de moi et la déterminerait à
Ohnet-Georges_Le-Maitre-de-forges_<Bachelin-745>_18607,moi et la déterminerait à me repousser . Prévenez la
Ohnet-Georges_Le-Maitre-de-forges_<Bachelin-745>_18618,", faites - lui approuver mes scrupules et surtout engagez"
Ohnet-Georges_Le-Maitre-de-forges_<Bachelin-745>_18623,mes scrupules et surtout engagez - moi vis - à
Ohnet-Georges_Le-Maitre-de-forges_<Bachelin-745>_18635,d' elle . Oh ! je recevrai la main de
Ohnet-Georges_Le-Maitre-de-forges_<Bachelin-745>_18647,Beaulieu à genoux . Mais je veux qu' elle se
Ohnet-Georges_Le-Maitre-de-forges_<Bachelin-745>_18660,", afin qu' elle puisse m' accepter ou me refuser"
Ohnet-Georges_Le-Maitre-de-forges_<Bachelin-745>_18663,elle puisse m' accepter ou me refuser librement . Et
Ohnet-Georges_Le-Maitre-de-forges_<Bachelin-745>_18669,"refuser librement . Et dussé - je , en l'"
Ohnet-Georges_Le-Maitre-de-forges_<Bachelin-745>_18681,"lui assurer tout ce que je possède , ce sera"
Ohnet-Georges_Le-Maitre-de-forges_<Bachelin-745>_18689,ce sera encore elle qui m' aura fait une grâce
Ohnet-Georges_Le-Maitre-de-forges_<Bachelin-745>_18701,Là ! là ! fit Bachelin en interrompant Philippe par
Ohnet-Georges_Le-Maitre-de-forges_<Bachelin-745>_18704,! fit Bachelin en interrompant Philippe par un geste affectueux
Ohnet-Georges_Le-Maitre-de-forges_<Bachelin-745>_18710,par un geste affectueux . Vous courez la poste !
Ohnet-Georges_Le-Maitre-de-forges_<Bachelin-745>_18744,en ce moment que de vous présenter au château .
Ohnet-Georges_Le-Maitre-de-forges_<Bachelin-745>_18755,"défaut d' autres satisfactions , vous aurez celle de contempler"
Ohnet-Georges_Le-Maitre-de-forges_<Bachelin-745>_18763,"de contempler l' objet de vos désirs , comme on"
Ohnet-Georges_Le-Maitre-de-forges_<Bachelin-745>_18786,avec la discrétion que comporte votre situation . Et amenez
Ohnet-Georges_Le-Maitre-de-forges_<Bachelin-745>_18791,votre situation . Et amenez votre sœur . Elle vous
Ohnet-Georges_Le-Maitre-de-forges_<Bachelin-745>_18795,"amenez votre sœur . Elle vous servira de paravent ,"
Ohnet-Georges_Le-Maitre-de-forges_<Bachelin-745>_18814,"ce temps - là , vous serez tranquille . –"
Ohnet-Georges_Le-Maitre-de-forges_<Bachelin-745>_18829,aller à Beaulieu ? demanda Philippe avec un trouble visible
Ohnet-Georges_Le-Maitre-de-forges_<Bachelin-745>_18843,! Est - ce que vous avez déjà peur avant
Ohnet-Georges_Le-Maitre-de-forges_<Bachelin-745>_18864,demain . Une bonne nuit vous remettra d' aplomb ;
Ohnet-Georges_Le-Maitre-de-forges_<Bachelin-745>_18869,vous remettra d' aplomb ; vous jouirez de tous vos
Ohnet-Georges_Le-Maitre-de-forges_<Bachelin-745>_18873,; vous jouirez de tous vos moyens et de tous
Ohnet-Georges_Le-Maitre-de-forges_<Bachelin-745>_18878,"vos moyens et de tous vos avantages . Et ,"
Ohnet-Georges_Le-Maitre-de-forges_<Bachelin-745>_18917,du cabinet : – Regrettez - vous encore que j'
Ohnet-Georges_Le-Maitre-de-forges_<Bachelin-745>_18930,madame de Beaulieu sans que vous m' y ayez autorisé
Ohnet-Georges_Le-Maitre-de-forges_<Bachelin-745>_18941,demanda le notaire en regardant le maître de forges avec
Ohnet-Georges_Le-Maitre-de-forges_<Bachelin-745>_18955,Il est vrai que dans votre trouble vous ne m'
Ohnet-Georges_Le-Maitre-de-forges_<Bachelin-745>_18957,vrai que dans votre trouble vous ne m' avez pas
Ohnet-Georges_Le-Maitre-de-forges_<Bachelin-745>_18976,est vrai ! s' écria Philippe . Et par un
Ohnet-Georges_Le-Maitre-de-forges_<Bachelin-745>_18987,"soudain , de joyeux qu' il était , redevenant inquiet"
Ohnet-Georges_Le-Maitre-de-forges_<Bachelin-745>_19098,"forges , Bachelin sortit . Philippe , resté seul ,"
Ohnet-Georges_Le-Maitre-de-forges_<Bachelin-745>_19109,dans une méditation profonde . Il envisagea froidement sa situation
Ohnet-Georges_Le-Maitre-de-forges_<Bachelin-745>_19112,profonde . Il envisagea froidement sa situation et dut s'
Ohnet-Georges_Le-Maitre-de-forges_<Bachelin-745>_19115,envisagea froidement sa situation et dut s' avouer à lui
Ohnet-Georges_Le-Maitre-de-forges_<Bachelin-745>_19119,et dut s' avouer à lui - même qu' elle
Ohnet-Georges_Le-Maitre-de-forges_<Bachelin-745>_19163,"humiliante déconvenue . Là , il pourrait la voir ,"
Ohnet-Georges_Le-Maitre-de-forges_<Bachelin-745>_19189,. Suzanne serait sûrement pour lui un utile auxiliaire .
Ohnet-Georges_Le-Maitre-de-forges_<Bachelin-745>_19194,lui un utile auxiliaire . Il ne la ferait point
Ohnet-Georges_Le-Maitre-de-forges_<Bachelin-745>_19212,"vacances terminées , et la garderait près de lui ."
Ohnet-Georges_Le-Maitre-de-forges_<Bachelin-745>_19215,et la garderait près de lui . Elle deviendrait la
Ohnet-Georges_Le-Maitre-de-forges_<Bachelin-745>_19265,"apparence de la réalité . Philippe voyait marcher lentement ,"
Ohnet-Georges_Le-Maitre-de-forges_<Bachelin-745>_19312,"autre mignonne et douce . Il les regardait , et"
Ohnet-Georges_Le-Maitre-de-forges_<Bachelin-745>_19319,"regardait , et déjà il lui semblait sentir le parfum"
Ohnet-Georges_Le-Maitre-de-forges_<Bachelin-745>_19330,qui émanait d' elles . Il s' enivrait de cette
Ohnet-Georges_Le-Maitre-de-forges_<Bachelin-745>_19338,"de cette délicieuse senteur . Il allait les toucher ,"
Ohnet-Georges_Le-Maitre-de-forges_<Bachelin-745>_19352,"fraîche , se posant sur son front , l' arracha"
Ohnet-Georges_Le-Maitre-de-forges_<Bachelin-745>_19355,"posant sur son front , l' arracha à son rêve"
Ohnet-Georges_Le-Maitre-de-forges_<Bachelin-745>_19358,"front , l' arracha à son rêve . Et la"
Ohnet-Georges_Le-Maitre-de-forges_<Bachelin-745>_19369,voix de Suzanne murmura à son oreille : – À
Ohnet-Georges_Le-Maitre-de-forges_<Bachelin-745>_19376,": – À qui penses - tu , Philippe ?"
Ohnet-Georges_Le-Maitre-de-forges_<Bachelin-745>_19379,"qui penses - tu , Philippe ? Comme le maître"
Ohnet-Georges_Le-Maitre-de-forges_<Bachelin-745>_19400,et sans répondre : – Tu ne veux pas le
Ohnet-Georges_Le-Maitre-de-forges_<Bachelin-745>_19422,Eh bien ! Gageons que tu penses à une belle
Ohnet-Georges_Le-Maitre-de-forges_<Bachelin-745>_19431,"belle jeune fille blonde ! Philippe se leva brusquement ,"
Ohnet-Georges_Le-Maitre-de-forges_<Bachelin-745>_19441,et saisissant la main de sa sœur : – Suzanne
Ohnet-Georges_Le-Maitre-de-forges_<Bachelin-745>_19449,– Suzanne ! s' écria - t - il .
Ohnet-Georges_Le-Maitre-de-forges_<Bachelin-745>_19451,"! s' écria - t - il . Mais ,"
Ohnet-Georges_Le-Maitre-de-forges_<Bachelin-745>_19465,"de la jeune fille , il perdit contenance , et"
Ohnet-Georges_Le-Maitre-de-forges_<Bachelin-745>_19471,"perdit contenance , et ne put continuer . Il resta"
Ohnet-Georges_Le-Maitre-de-forges_<Bachelin-745>_19474,"et ne put continuer . Il resta debout , stupéfait"
Ohnet-Georges_Le-Maitre-de-forges_<Bachelin-745>_19498,ce qui se passait en lui . – Te voilà
Ohnet-Georges_Le-Maitre-de-forges_<Bachelin-745>_19501,"passait en lui . – Te voilà tout troublé ,"
Ohnet-Georges_Le-Maitre-de-forges_<Bachelin-745>_19511,reprit Suzanne avec tendresse . Tu croyais donc ton secret
Ohnet-Georges_Le-Maitre-de-forges_<Bachelin-745>_19514,tendresse . Tu croyais donc ton secret bien caché ?
Ohnet-Georges_Le-Maitre-de-forges_<Bachelin-745>_19523,? Mais depuis un mois tu n' es plus le
Ohnet-Georges_Le-Maitre-de-forges_<Bachelin-745>_19531,"plus le même , et il ne m' a pas"
Ohnet-Georges_Le-Maitre-de-forges_<Bachelin-745>_19544,finesse pour m' apercevoir que ton cœur n' était plus
Ohnet-Georges_Le-Maitre-de-forges_<Bachelin-745>_19564,"jalouse , va ! Je t' aime trop pour pouvoir"
Ohnet-Georges_Le-Maitre-de-forges_<Bachelin-745>_19575,être . Et quand je te vois pensif et absorbé
Ohnet-Georges_Le-Maitre-de-forges_<Bachelin-745>_19595,parce que je crains que tu m' enlèves une part
Ohnet-Georges_Le-Maitre-de-forges_<Bachelin-745>_19601,"m' enlèves une part de ton affection , pour la"
Ohnet-Georges_Le-Maitre-de-forges_<Bachelin-745>_19618,que j' ai peur que tu aies du chagrin .
Ohnet-Georges_Le-Maitre-de-forges_<Bachelin-745>_19624,"aies du chagrin . Je te dois tant , mon"
Ohnet-Georges_Le-Maitre-de-forges_<Bachelin-745>_19633,mon Philippe ! C' est toi qui m' as gardée
Ohnet-Georges_Le-Maitre-de-forges_<Bachelin-745>_19663,"que je suis non seulement ta sœur , mais ta"
Ohnet-Georges_Le-Maitre-de-forges_<Bachelin-745>_19667,"seulement ta sœur , mais ta fille , l' enfant"
Ohnet-Georges_Le-Maitre-de-forges_<Bachelin-745>_19673,"fille , l' enfant de tes soins et de tes"
Ohnet-Georges_Le-Maitre-de-forges_<Bachelin-745>_19677,"de tes soins et de tes peines . Va ,"
Ohnet-Georges_Le-Maitre-de-forges_<Bachelin-745>_19687,aime et sois aimé ! Tu ne me verras que
Ohnet-Georges_Le-Maitre-de-forges_<Bachelin-745>_19709,sur la terre pour récompenser un être aussi parfait que
Ohnet-Georges_Le-Maitre-de-forges_<Bachelin-745>_19714,un être aussi parfait que toi . Deux larmes jaillirent
Ohnet-Georges_Le-Maitre-de-forges_<Bachelin-745>_19721,Deux larmes jaillirent des yeux du maître de forges et
Ohnet-Georges_Le-Maitre-de-forges_<Bachelin-745>_19729,forges et coulèrent silencieusement sur ses joues . Les douces
Ohnet-Georges_Le-Maitre-de-forges_<Bachelin-745>_19736,. Les douces paroles de sa sœur avaient détendu ses
Ohnet-Georges_Le-Maitre-de-forges_<Bachelin-745>_19740,de sa sœur avaient détendu ses nerfs surexcités . Il
Ohnet-Georges_Le-Maitre-de-forges_<Bachelin-745>_19744,détendu ses nerfs surexcités . Il se sentait maintenant anéanti
Ohnet-Georges_Le-Maitre-de-forges_<Bachelin-745>_19758,"à la haute cheminée , il restait immobile , regardant"
Ohnet-Georges_Le-Maitre-de-forges_<Bachelin-745>_19767,regardant la jeune fille qui lui souriait . – Voilà
Ohnet-Georges_Le-Maitre-de-forges_<Bachelin-745>_19773,"souriait . – Voilà que tu pleures , à présent"
Ohnet-Georges_Le-Maitre-de-forges_<Bachelin-745>_19780,", à présent ! dit Suzanne . Mais voyons ,"
Ohnet-Georges_Le-Maitre-de-forges_<Bachelin-745>_19802,de ces folies ! interrompit Philippe d' une voix altérée
Ohnet-Georges_Le-Maitre-de-forges_<Bachelin-745>_19818,"pourquoi donc ? Quelle femme te connaissant , pourrait ne"
Ohnet-Georges_Le-Maitre-de-forges_<Bachelin-745>_19825,", pourrait ne pas désirer te plaire ? Puis ,"
Ohnet-Georges_Le-Maitre-de-forges_<Bachelin-745>_19833,"Puis , se posant devant lui , la mine hardie"
Ohnet-Georges_Le-Maitre-de-forges_<Bachelin-745>_19846,"résolu : – Va , je le lui dirai s'"
Ohnet-Georges_Le-Maitre-de-forges_<Bachelin-745>_19848,"– Va , je le lui dirai s' il le"
Ohnet-Georges_Le-Maitre-de-forges_<Bachelin-745>_19856,"il le faut , à celle que tu aimes :"
Ohnet-Georges_Le-Maitre-de-forges_<Bachelin-745>_19857,"le faut , à celle que tu aimes : Mademoiselle"
Ohnet-Georges_Le-Maitre-de-forges_<Bachelin-745>_19858,"faut , à celle que tu aimes : Mademoiselle ,"
Ohnet-Georges_Le-Maitre-de-forges_<Bachelin-745>_19861,"celle que tu aimes : Mademoiselle , vous avez tort"
Ohnet-Georges_Le-Maitre-de-forges_<Bachelin-745>_19863,"tu aimes : Mademoiselle , vous avez tort de ne"
Ohnet-Georges_Le-Maitre-de-forges_<Bachelin-745>_19870,"tort de ne pas adorer mon frère , car il"
Ohnet-Georges_Le-Maitre-de-forges_<Bachelin-745>_19890,ne soit absolument supérieur . Je puis vous l' affirmer
Ohnet-Georges_Le-Maitre-de-forges_<Bachelin-745>_19892,"absolument supérieur . Je puis vous l' affirmer , moi"
Ohnet-Georges_Le-Maitre-de-forges_<Bachelin-745>_19896,"puis vous l' affirmer , moi , car je le"
Ohnet-Georges_Le-Maitre-de-forges_<Bachelin-745>_19899,"affirmer , moi , car je le connais bien et"
Ohnet-Georges_Le-Maitre-de-forges_<Bachelin-745>_19908,et depuis longtemps . Et je serai si éloquente qu'
Ohnet-Georges_Le-Maitre-de-forges_<Bachelin-745>_19913,je serai si éloquente qu' elle viendra elle - même
Ohnet-Georges_Le-Maitre-de-forges_<Bachelin-745>_19915,si éloquente qu' elle viendra elle - même au -
Ohnet-Georges_Le-Maitre-de-forges_<Bachelin-745>_19922,même au - devant de toi te tendre la main
Ohnet-Georges_Le-Maitre-de-forges_<Bachelin-745>_19923,au - devant de toi te tendre la main avec
Ohnet-Georges_Le-Maitre-de-forges_<Bachelin-745>_19932,"avec une belle révérence et te dire : Monsieur ,"
Ohnet-Georges_Le-Maitre-de-forges_<Bachelin-745>_19935,"révérence et te dire : Monsieur , vous avez pour"
Ohnet-Georges_Le-Maitre-de-forges_<Bachelin-745>_19937,"te dire : Monsieur , vous avez pour sœur une"
Ohnet-Georges_Le-Maitre-de-forges_<Bachelin-745>_19940,"Monsieur , vous avez pour sœur une petite personne qui"
Ohnet-Georges_Le-Maitre-de-forges_<Bachelin-745>_19941,", vous avez pour sœur une petite personne qui est"
Ohnet-Georges_Le-Maitre-de-forges_<Bachelin-745>_19944,"pour sœur une petite personne qui est si extraordinaire ,"
Ohnet-Georges_Le-Maitre-de-forges_<Bachelin-745>_19950,"est si extraordinaire , que je n' ai pu méconnaître"
Ohnet-Georges_Le-Maitre-de-forges_<Bachelin-745>_19957,ai pu méconnaître plus longtemps votre mérite . Voulez -
Ohnet-Georges_Le-Maitre-de-forges_<Bachelin-745>_19961,longtemps votre mérite . Voulez - vous me faire la
Ohnet-Georges_Le-Maitre-de-forges_<Bachelin-745>_19963,mérite . Voulez - vous me faire la faveur d'
Ohnet-Georges_Le-Maitre-de-forges_<Bachelin-745>_19969,faire la faveur d' être mon époux ? Et toi
Ohnet-Georges_Le-Maitre-de-forges_<Bachelin-745>_19973,"être mon époux ? Et toi , tu t' inclineras"
Ohnet-Georges_Le-Maitre-de-forges_<Bachelin-745>_19975,"époux ? Et toi , tu t' inclineras avec grâce"
Ohnet-Georges_Le-Maitre-de-forges_<Bachelin-745>_19990,"réfléchi : Mon Dieu , mademoiselle , ce sera donc"
Ohnet-Georges_Le-Maitre-de-forges_<Bachelin-745>_19996,", ce sera donc pour vous être agréable ! Moi"
Ohnet-Georges_Le-Maitre-de-forges_<Bachelin-745>_20000,"pour vous être agréable ! Moi , je vous bénirai"
Ohnet-Georges_Le-Maitre-de-forges_<Bachelin-745>_20002,"être agréable ! Moi , je vous bénirai d' un"
Ohnet-Georges_Le-Maitre-de-forges_<Bachelin-745>_20003,"agréable ! Moi , je vous bénirai d' un air"
Ohnet-Georges_Le-Maitre-de-forges_<Bachelin-745>_20020,bien heureux ! Ah ! tu vois ? Tu ris
Ohnet-Georges_Le-Maitre-de-forges_<Bachelin-745>_20023,Ah ! tu vois ? Tu ris . Tu es
Ohnet-Georges_Le-Maitre-de-forges_<Bachelin-745>_20026,vois ? Tu ris . Tu es consolé ! Et
Ohnet-Georges_Le-Maitre-de-forges_<Bachelin-745>_20031,"Tu es consolé ! Et Suzanne , prenant tendrement par"
Ohnet-Georges_Le-Maitre-de-forges_<Bachelin-745>_20038,"prenant tendrement par le bras son frère , dont l'"
Ohnet-Georges_Le-Maitre-de-forges_<Bachelin-745>_20041,"le bras son frère , dont l' émotion n' avait"
Ohnet-Georges_Le-Maitre-de-forges_<Bachelin-745>_20056,"vive et folâtre gaîté , l' entraîna au dehors en"
Ohnet-Georges_Le-Maitre-de-forges_<Bachelin-745>_20073,"de jardin , en attendant ton mariage ! En descendant"
Ohnet-Georges_Le-Maitre-de-forges_<Bachelin-745>_20081,En descendant du train qui l' avait amené de Saint
Ohnet-Georges_Le-Maitre-de-forges_<Bachelin-745>_20095,", six semaines auparavant , le duc de Bligny ,"
Ohnet-Georges_Le-Maitre-de-forges_<Bachelin-745>_20116,un sleeping - car où il avait été fort secoué
Ohnet-Georges_Le-Maitre-de-forges_<Bachelin-745>_20122,"avait été fort secoué , s' était fait conduire au"
Ohnet-Georges_Le-Maitre-de-forges_<Bachelin-745>_20140,", et l' hôtel de sa tante étant fermé ,"
Ohnet-Georges_Le-Maitre-de-forges_<Bachelin-745>_20145,"sa tante étant fermé , Gaston avait trouvé très pratique"
Ohnet-Georges_Le-Maitre-de-forges_<Bachelin-745>_20170,disposition de leurs membres . Il comptait rester huit jours
Ohnet-Georges_Le-Maitre-de-forges_<Bachelin-745>_20185,juste le temps de finir ses affaires au ministère et
Ohnet-Georges_Le-Maitre-de-forges_<Bachelin-745>_20209,"près d' un an , il n' était pas venu"
Ohnet-Georges_Le-Maitre-de-forges_<Bachelin-745>_20217,pas venu en France . Il avait vécu dans le
Ohnet-Georges_Le-Maitre-de-forges_<Bachelin-745>_20273,s' était cependant emparée de lui . Et il avait
Ohnet-Georges_Le-Maitre-de-forges_<Bachelin-745>_20276,emparée de lui . Et il avait trouvé une grande
Ohnet-Georges_Le-Maitre-de-forges_<Bachelin-745>_20298,. Les grandes dames russes l' avaient captivé par la
Ohnet-Georges_Le-Maitre-de-forges_<Bachelin-745>_20313,énigmatique de leur beauté . Il avait voulu connaître le
Ohnet-Georges_Le-Maitre-de-forges_<Bachelin-745>_20336,"griffes pleines de menace . Joli garçon , bien élevé"
Ohnet-Georges_Le-Maitre-de-forges_<Bachelin-745>_20348,"d' un grand nom , il avait été fort recherché"
Ohnet-Georges_Le-Maitre-de-forges_<Bachelin-745>_20362,"à peu l' image de sa fiancée , si fidèlement"
Ohnet-Georges_Le-Maitre-de-forges_<Bachelin-745>_20369,", si fidèlement gravée dans son cœur , s' était"
