,text_surronding
Ponson-du-Terrail-Pierre_Les-Exploits-de-Rocambole_<le domestique-1225>_24251,"Monsieur le marquis , poursuivit Joseph , qui s' éloigna"
Ponson-du-Terrail-Pierre_Les-Exploits-de-Rocambole_<le domestique-1225>_24253,"marquis , poursuivit Joseph , qui s' éloigna un peu"
Ponson-du-Terrail-Pierre_Les-Exploits-de-Rocambole_<le domestique-1225>_24261,un peu de Fabien et parla si bas que ce
Ponson-du-Terrail-Pierre_Les-Exploits-de-Rocambole_<le domestique-1225>_24269,"que ce dernier ne put l' entendre , Monsieur le"
Ponson-du-Terrail-Pierre_Les-Exploits-de-Rocambole_<le domestique-1225>_24312,"blond et mince , continua Joseph , ce pourrait bien"
Ponson-du-Terrail-Pierre_Les-Exploits-de-Rocambole_<le domestique-1225>_24371,"à ce signalement donné par Joseph , un jeune homme"
Ponson-du-Terrail-Pierre_Les-Exploits-de-Rocambole_<le domestique-1225>_24438,", malheureux , lui dit - il , tu vas"
Ponson-du-Terrail-Pierre_Les-Exploits-de-Rocambole_<le domestique-1225>_24465,"dans l' avenue , et Joseph dit aussitôt : –"
Ponson-du-Terrail-Pierre_Les-Exploits-de-Rocambole_<le domestique-1225>_24524,"de mourir de joie en te voyant . Joseph ,"
Ponson-du-Terrail-Pierre_Les-Exploits-de-Rocambole_<le domestique-1225>_24527,"joie en te voyant . Joseph , conduisez M ."
Ponson-du-Terrail-Pierre_Les-Exploits-de-Rocambole_<le domestique-1225>_24538,"marquis dans sa chambre ; moi , je vais à"
Ponson-du-Terrail-Pierre_Les-Exploits-de-Rocambole_<le domestique-1225>_24540,"sa chambre ; moi , je vais à la rencontre"
Ponson-du-Terrail-Pierre_Les-Exploits-de-Rocambole_<le domestique-1225>_24549,"rencontre d' Antoine , et je saurai tout bientôt ."
Ponson-du-Terrail-Pierre_Les-Exploits-de-Rocambole_<le domestique-1225>_24563,"funèbres pressentiments agitaient , suivit Joseph , qui le conduisit"
Ponson-du-Terrail-Pierre_Les-Exploits-de-Rocambole_<le domestique-1225>_24565,"agitaient , suivit Joseph , qui le conduisit dans une"
Ponson-du-Terrail-Pierre_Les-Exploits-de-Rocambole_<le domestique-1225>_24566,", suivit Joseph , qui le conduisit dans une grande"
Ponson-du-Terrail-Pierre_Les-Exploits-de-Rocambole_<le domestique-1225>_24619,"maman . – Oui , Monsieur , dit Joseph ,"
Ponson-du-Terrail-Pierre_Les-Exploits-de-Rocambole_<le domestique-1225>_24622,"Oui , Monsieur , dit Joseph , et vous couchiez"
Ponson-du-Terrail-Pierre_Les-Exploits-de-Rocambole_<le domestique-1225>_24625,", dit Joseph , et vous couchiez , vous ,"
Ponson-du-Terrail-Pierre_Les-Exploits-de-Rocambole_<le domestique-1225>_24628,", et vous couchiez , vous , dans ce cabinet"
Ponson-du-Terrail-Pierre_Les-Exploits-de-Rocambole_<le domestique-1225>_24635,dans ce cabinet . – Je m' en souviens .
Ponson-du-Terrail-Pierre_Les-Exploits-de-Rocambole_<le domestique-1225>_24652,"regarda au clair de lune le vieil intendant , qui"
Ponson-du-Terrail-Pierre_Les-Exploits-de-Rocambole_<le domestique-1225>_24656,"lune le vieil intendant , qui mettait pied à terre"
Ponson-du-Terrail-Pierre_Les-Exploits-de-Rocambole_<le domestique-1225>_24662,mettait pied à terre et saluait Fabien en lui disant
Ponson-du-Terrail-Pierre_Les-Exploits-de-Rocambole_<le domestique-1225>_24683,"… il est ici , mon jeune maître ? Oh"
Ponson-du-Terrail-Pierre_Les-Exploits-de-Rocambole_<le domestique-1225>_24689,"jeune maître ? Oh ! je le sais , monsieur"
Ponson-du-Terrail-Pierre_Les-Exploits-de-Rocambole_<le domestique-1225>_24696,"sais , monsieur Fabien , je le sais . Tenez"
Ponson-du-Terrail-Pierre_Les-Exploits-de-Rocambole_<le domestique-1225>_24712,"bureau de poste , on m' a remis une lettre"
Ponson-du-Terrail-Pierre_Les-Exploits-de-Rocambole_<le domestique-1225>_24728,"est arrivée à Paris après votre départ , et qu'"
Ponson-du-Terrail-Pierre_Les-Exploits-de-Rocambole_<le domestique-1225>_24765,"Espagne . Rocambole entendit , poussa un cri de joie"
Ponson-du-Terrail-Pierre_Les-Exploits-de-Rocambole_<le domestique-1225>_24774,"joie , et dit à Joseph : – Cours me"
Ponson-du-Terrail-Pierre_Les-Exploits-de-Rocambole_<le domestique-1225>_24778,à Joseph : – Cours me chercher cette lettre .
Ponson-du-Terrail-Pierre_Les-Exploits-de-Rocambole_<le domestique-1225>_24793,"… C' était Conception qui lui écrivait , Conception qui"
Ponson-du-Terrail-Pierre_Les-Exploits-de-Rocambole_<le domestique-1225>_24798,"lui écrivait , Conception qui l' aimait toujours . Et"
Ponson-du-Terrail-Pierre_Les-Exploits-de-Rocambole_<le domestique-1225>_24806,". Et Rocambole oublia momentanément ses terreurs , ses remords"
Ponson-du-Terrail-Pierre_Les-Exploits-de-Rocambole_<le domestique-1225>_24809,"oublia momentanément ses terreurs , ses remords , le vol"
Ponson-du-Terrail-Pierre_Les-Exploits-de-Rocambole_<le domestique-1225>_24831,"de cette lettre , que Joseph lui rapporta quelques minutes"
Ponson-du-Terrail-Pierre_Les-Exploits-de-Rocambole_<le domestique-1225>_24859,"portrait . Lettre de Conception Mon ami , Voici huit"
Ponson-du-Terrail-Pierre_Les-Exploits-de-Rocambole_<le domestique-1225>_24867,Voici huit grands jours que je ne vous ai écrit
Ponson-du-Terrail-Pierre_Les-Exploits-de-Rocambole_<le domestique-1225>_24869,grands jours que je ne vous ai écrit . Bien
Ponson-du-Terrail-Pierre_Les-Exploits-de-Rocambole_<le domestique-1225>_24876,"écrit . Bien certainement , vous allez accuser votre Conception"
Ponson-du-Terrail-Pierre_Les-Exploits-de-Rocambole_<le domestique-1225>_24879,"certainement , vous allez accuser votre Conception de vous avoir"
Ponson-du-Terrail-Pierre_Les-Exploits-de-Rocambole_<le domestique-1225>_24882,"allez accuser votre Conception de vous avoir oublié , et"
Ponson-du-Terrail-Pierre_Les-Exploits-de-Rocambole_<le domestique-1225>_24891,et cependant il faut que je vous dise que depuis
Ponson-du-Terrail-Pierre_Les-Exploits-de-Rocambole_<le domestique-1225>_24892,cependant il faut que je vous dise que depuis ces
Ponson-du-Terrail-Pierre_Les-Exploits-de-Rocambole_<le domestique-1225>_24914,pas écoulé une minute de ma vie qui n' ait
Ponson-du-Terrail-Pierre_Les-Exploits-de-Rocambole_<le domestique-1225>_24921,qui n' ait été pour vous . Ma dernière lettre
Ponson-du-Terrail-Pierre_Les-Exploits-de-Rocambole_<le domestique-1225>_24923,ait été pour vous . Ma dernière lettre était datée
Ponson-du-Terrail-Pierre_Les-Exploits-de-Rocambole_<le domestique-1225>_24938,"sommes demeurées six semaines , ma mère et moi ,"
Ponson-du-Terrail-Pierre_Les-Exploits-de-Rocambole_<le domestique-1225>_24941,"semaines , ma mère et moi , pleurant ce bon"
Ponson-du-Terrail-Pierre_Les-Exploits-de-Rocambole_<le domestique-1225>_24948,"pleurant ce bon père que vous avez connu , priant"
Ponson-du-Terrail-Pierre_Les-Exploits-de-Rocambole_<le domestique-1225>_24985,"sa mort . Maintenant , mon ami , je vous"
Ponson-du-Terrail-Pierre_Les-Exploits-de-Rocambole_<le domestique-1225>_24988,"Maintenant , mon ami , je vous écris de la"
Ponson-du-Terrail-Pierre_Les-Exploits-de-Rocambole_<le domestique-1225>_24989,", mon ami , je vous écris de la Grenadière"
Ponson-du-Terrail-Pierre_Les-Exploits-de-Rocambole_<le domestique-1225>_25005,famille où s' est écoulée mon enfance et qui est
Ponson-du-Terrail-Pierre_Les-Exploits-de-Rocambole_<le domestique-1225>_25043,souvenirs heureux ou néfastes de ma jeunesse . C' est
Ponson-du-Terrail-Pierre_Les-Exploits-de-Rocambole_<le domestique-1225>_25085,"plus tard . Mais rassurez - vous , mon ami"
Ponson-du-Terrail-Pierre_Les-Exploits-de-Rocambole_<le domestique-1225>_25088,"Mais rassurez - vous , mon ami , je ne"
Ponson-du-Terrail-Pierre_Les-Exploits-de-Rocambole_<le domestique-1225>_25091,"vous , mon ami , je ne suis point venue"
Ponson-du-Terrail-Pierre_Les-Exploits-de-Rocambole_<le domestique-1225>_25106,souvenir de don Pedro . Mon cœur n' est qu'
Ponson-du-Terrail-Pierre_Les-Exploits-de-Rocambole_<le domestique-1225>_25112,"cœur n' est qu' à vous , à vous pour"
Ponson-du-Terrail-Pierre_Les-Exploits-de-Rocambole_<le domestique-1225>_25115,"qu' à vous , à vous pour toujours . Je"
Ponson-du-Terrail-Pierre_Les-Exploits-de-Rocambole_<le domestique-1225>_25119,à vous pour toujours . Je suis venue ici avec
Ponson-du-Terrail-Pierre_Les-Exploits-de-Rocambole_<le domestique-1225>_25124,"Je suis venue ici avec ma mère … devinez ,"
Ponson-du-Terrail-Pierre_Les-Exploits-de-Rocambole_<le domestique-1225>_25129,"ma mère … devinez , mon ami … dans le"
Ponson-du-Terrail-Pierre_Les-Exploits-de-Rocambole_<le domestique-1225>_25141,"de hâter notre union . Vous le savez , les"
Ponson-du-Terrail-Pierre_Les-Exploits-de-Rocambole_<le domestique-1225>_25171,"entrée dans notre maison et m' a faite orpheline ,"
Ponson-du-Terrail-Pierre_Les-Exploits-de-Rocambole_<le domestique-1225>_25176,"m' a faite orpheline , j' allais devenir votre femme"
Ponson-du-Terrail-Pierre_Les-Exploits-de-Rocambole_<le domestique-1225>_25179,"orpheline , j' allais devenir votre femme , au pied"
Ponson-du-Terrail-Pierre_Les-Exploits-de-Rocambole_<le domestique-1225>_25194,hommes . Ah ! si mon père avait été le
Ponson-du-Terrail-Pierre_Les-Exploits-de-Rocambole_<le domestique-1225>_25224,dans le but unique de me laisser un protecteur .
Ponson-du-Terrail-Pierre_Les-Exploits-de-Rocambole_<le domestique-1225>_25245,"sommes arrivées à Sallandrera , ma mère et moi ,"
Ponson-du-Terrail-Pierre_Les-Exploits-de-Rocambole_<le domestique-1225>_25248,"Sallandrera , ma mère et moi , conduisant la dépouille"
Ponson-du-Terrail-Pierre_Les-Exploits-de-Rocambole_<le domestique-1225>_25255,"conduisant la dépouille mortelle de mon père , nous avons"
Ponson-du-Terrail-Pierre_Les-Exploits-de-Rocambole_<le domestique-1225>_25263,nous avons été reçues par mon oncle au second degré
Ponson-du-Terrail-Pierre_Les-Exploits-de-Rocambole_<le domestique-1225>_25278,- dire le neveu de ma grand - mère paternelle
Ponson-du-Terrail-Pierre_Les-Exploits-de-Rocambole_<le domestique-1225>_25284,"grand - mère paternelle . Mon oncle , vous le"
Ponson-du-Terrail-Pierre_Les-Exploits-de-Rocambole_<le domestique-1225>_25287,"paternelle . Mon oncle , vous le savez , est"
Ponson-du-Terrail-Pierre_Les-Exploits-de-Rocambole_<le domestique-1225>_25362,", il a eu avec ma mère un entretien dont"
Ponson-du-Terrail-Pierre_Les-Exploits-de-Rocambole_<le domestique-1225>_25367,ma mère un entretien dont je n' ai connu le
Ponson-du-Terrail-Pierre_Les-Exploits-de-Rocambole_<le domestique-1225>_25394,"t - il dit à ma mère , la mort"
Ponson-du-Terrail-Pierre_Les-Exploits-de-Rocambole_<le domestique-1225>_25402,la mort subite du duc vous a placée dans une
Ponson-du-Terrail-Pierre_Les-Exploits-de-Rocambole_<le domestique-1225>_25418,- à - vis de votre fille . Conception allait
Ponson-du-Terrail-Pierre_Les-Exploits-de-Rocambole_<le domestique-1225>_25439,quand la mort a frappé votre époux . Elle aimait
Ponson-du-Terrail-Pierre_Les-Exploits-de-Rocambole_<le domestique-1225>_25455,ce pas ? A quoi ma mère a répondu :
Ponson-du-Terrail-Pierre_Les-Exploits-de-Rocambole_<le domestique-1225>_25470,; à ce point que je crains pour sa santé
Ponson-du-Terrail-Pierre_Les-Exploits-de-Rocambole_<le domestique-1225>_25532,"mois et demi . – Je le sais , dit"
Ponson-du-Terrail-Pierre_Les-Exploits-de-Rocambole_<le domestique-1225>_25537,"Je le sais , dit ma mère . – Mais"
Ponson-du-Terrail-Pierre_Les-Exploits-de-Rocambole_<le domestique-1225>_25577,"nomme les convenances . – Je le sais encore ,"
Ponson-du-Terrail-Pierre_Les-Exploits-de-Rocambole_<le domestique-1225>_25583,"le sais encore , répliqua ma mère . – Or"
Ponson-du-Terrail-Pierre_Les-Exploits-de-Rocambole_<le domestique-1225>_25637,"paroles de l' archevêque , ma mère soupira profondément ."
Ponson-du-Terrail-Pierre_Les-Exploits-de-Rocambole_<le domestique-1225>_25648,"archevêque reprit : – Comme vous , je me suis"
Ponson-du-Terrail-Pierre_Les-Exploits-de-Rocambole_<le domestique-1225>_25688,"mariage , et , comme vous , je suis effrayé"
Ponson-du-Terrail-Pierre_Les-Exploits-de-Rocambole_<le domestique-1225>_25697,"effrayé . Mais , ajouta mon oncle avec cette bonté"
Ponson-du-Terrail-Pierre_Les-Exploits-de-Rocambole_<le domestique-1225>_25736,capable d' en mourir ! Ma mère regardait l' archevêque
Ponson-du-Terrail-Pierre_Les-Exploits-de-Rocambole_<le domestique-1225>_25743,regardait l' archevêque et ne savait où il en voulait
Ponson-du-Terrail-Pierre_Les-Exploits-de-Rocambole_<le domestique-1225>_25757,": – Eh bien ! ma cousine , j' ai"
Ponson-du-Terrail-Pierre_Les-Exploits-de-Rocambole_<le domestique-1225>_25760,"bien ! ma cousine , j' ai peut - être"
Ponson-du-Terrail-Pierre_Les-Exploits-de-Rocambole_<le domestique-1225>_25776,. – Vraiment ! fit ma mère avec joie .
Ponson-du-Terrail-Pierre_Les-Exploits-de-Rocambole_<le domestique-1225>_25803,Comment ? … que comptez - vous donc faire ?
Ponson-du-Terrail-Pierre_Les-Exploits-de-Rocambole_<le domestique-1225>_25809,vous donc faire ? demanda ma mère avec vivacité .
Ponson-du-Terrail-Pierre_Les-Exploits-de-Rocambole_<le domestique-1225>_25816,avec vivacité . – Ecoutez - moi bien … vous
Ponson-du-Terrail-Pierre_Les-Exploits-de-Rocambole_<le domestique-1225>_25820,Ecoutez - moi bien … vous allez voir ; mais
Ponson-du-Terrail-Pierre_Les-Exploits-de-Rocambole_<le domestique-1225>_25827,voir ; mais d' abord répondez - moi bien clairement
Ponson-du-Terrail-Pierre_Les-Exploits-de-Rocambole_<le domestique-1225>_25828,; mais d' abord répondez - moi bien clairement sur
Ponson-du-Terrail-Pierre_Les-Exploits-de-Rocambole_<le domestique-1225>_25837,sur de certains détails que je ne possède que vaguement
Ponson-du-Terrail-Pierre_Les-Exploits-de-Rocambole_<le domestique-1225>_25918,"de sa mort , répondit ma mère , il écrivit"
Ponson-du-Terrail-Pierre_Les-Exploits-de-Rocambole_<le domestique-1225>_25946,"– Voilà précisément , dit l' archevêque , ce que"
Ponson-du-Terrail-Pierre_Les-Exploits-de-Rocambole_<le domestique-1225>_25951,"l' archevêque , ce que je voulais savoir . –"
Ponson-du-Terrail-Pierre_Les-Exploits-de-Rocambole_<le domestique-1225>_25972,"dire à coup sûr , me permettra de tout concilier"
Ponson-du-Terrail-Pierre_Les-Exploits-de-Rocambole_<le domestique-1225>_25980,"tout concilier . – Expliquez - vous , monseigneur …"
Ponson-du-Terrail-Pierre_Les-Exploits-de-Rocambole_<le domestique-1225>_25983,"– Expliquez - vous , monseigneur … – Sa Majesté"
Ponson-du-Terrail-Pierre_Les-Exploits-de-Rocambole_<le domestique-1225>_25990,"– Sa Majesté , poursuivit l' archevêque , a daigné"
Ponson-du-Terrail-Pierre_Les-Exploits-de-Rocambole_<le domestique-1225>_26000,plusieurs fois prendre en considération mon grand âge et le
Ponson-du-Terrail-Pierre_Les-Exploits-de-Rocambole_<le domestique-1225>_26008,et le zèle avec lequel j' ai toujours rempli ma
Ponson-du-Terrail-Pierre_Les-Exploits-de-Rocambole_<le domestique-1225>_26012,lequel j' ai toujours rempli ma mission évangélique . –
Ponson-du-Terrail-Pierre_Les-Exploits-de-Rocambole_<le domestique-1225>_26024,"je le sais , dit ma mère . – Je"
Ponson-du-Terrail-Pierre_Les-Exploits-de-Rocambole_<le domestique-1225>_26028,dit ma mère . – Je vais aller à Madrid
Ponson-du-Terrail-Pierre_Les-Exploits-de-Rocambole_<le domestique-1225>_26034,"vais aller à Madrid , je verrai Sa Majesté ;"
Ponson-du-Terrail-Pierre_Les-Exploits-de-Rocambole_<le domestique-1225>_26039,je verrai Sa Majesté ; je lui exposerai notre situation
Ponson-du-Terrail-Pierre_Les-Exploits-de-Rocambole_<le domestique-1225>_26045,lui exposerai notre situation et je la supplierai de se
Ponson-du-Terrail-Pierre_Les-Exploits-de-Rocambole_<le domestique-1225>_26068,"? – La reine , je l' espère , accordera"
Ponson-du-Terrail-Pierre_Les-Exploits-de-Rocambole_<le domestique-1225>_26082,"patentes . Ensuite , sur ma demande , elle nommera"
Ponson-du-Terrail-Pierre_Les-Exploits-de-Rocambole_<le domestique-1225>_26103,", en ce moment , je sais qu' il est"
Ponson-du-Terrail-Pierre_Les-Exploits-de-Rocambole_<le domestique-1225>_26134,encore été désigné ; mais je sais qu' il était
Ponson-du-Terrail-Pierre_Les-Exploits-de-Rocambole_<le domestique-1225>_26203,"pas bien encore , murmura ma mère . – La"
Ponson-du-Terrail-Pierre_Les-Exploits-de-Rocambole_<le domestique-1225>_26211,– La dernière fois que j' ai obtenu la faveur
Ponson-du-Terrail-Pierre_Les-Exploits-de-Rocambole_<le domestique-1225>_26237,"peine , la reine daigna me parler du duc ."
Ponson-du-Terrail-Pierre_Les-Exploits-de-Rocambole_<le domestique-1225>_26242,me parler du duc . Je me suis permis de
Ponson-du-Terrail-Pierre_Les-Exploits-de-Rocambole_<le domestique-1225>_26277,. A quoi la reine me répondit : « Si
Ponson-du-Terrail-Pierre_Les-Exploits-de-Rocambole_<le domestique-1225>_26309,"écrire au duc , acheva l' archevêque , quand la"
Ponson-du-Terrail-Pierre_Les-Exploits-de-Rocambole_<le domestique-1225>_26353,Vous allez le voir . Je vais partir pour Madrid
Ponson-du-Terrail-Pierre_Les-Exploits-de-Rocambole_<le domestique-1225>_26369,"services du feu duc , je puis obtenir de Sa"
Ponson-du-Terrail-Pierre_Les-Exploits-de-Rocambole_<le domestique-1225>_26398,"et de sa grandesse , j' obtiendrai également qu' on"
Ponson-du-Terrail-Pierre_Les-Exploits-de-Rocambole_<le domestique-1225>_26494,". – Alors , acheva l' archevêque , cette raison"
Ponson-du-Terrail-Pierre_Les-Exploits-de-Rocambole_<le domestique-1225>_26553,"s' écria ma mère , vous êtes un saint homme"
Ponson-du-Terrail-Pierre_Les-Exploits-de-Rocambole_<le domestique-1225>_26559,"êtes un saint homme et le meilleur des parents ,"
Ponson-du-Terrail-Pierre_Les-Exploits-de-Rocambole_<le domestique-1225>_26567,"parents , mon cousin . L' archevêque ajouta : –"
Ponson-du-Terrail-Pierre_Les-Exploits-de-Rocambole_<le domestique-1225>_26581,tout cela à Conception . Je puis ne pas réussir
Ponson-du-Terrail-Pierre_Les-Exploits-de-Rocambole_<le domestique-1225>_26600,mal affreux . Attendez que je vous écrive de Madrid
Ponson-du-Terrail-Pierre_Les-Exploits-de-Rocambole_<le domestique-1225>_26612,mère le lui promit et l' archevêque partit le lendemain
Ponson-du-Terrail-Pierre_Les-Exploits-de-Rocambole_<le domestique-1225>_26783,ma mère avait reçu de l' archevêque ce billet laconique
Ponson-du-Terrail-Pierre_Les-Exploits-de-Rocambole_<le domestique-1225>_26802,"en bonne voie , et j' espère parvenir à mon"
Ponson-du-Terrail-Pierre_Les-Exploits-de-Rocambole_<le domestique-1225>_26806,et j' espère parvenir à mon but . Quittez Sallandrera
Ponson-du-Terrail-Pierre_Les-Exploits-de-Rocambole_<le domestique-1225>_26840,"trouvé une seconde lettre de l' archevêque , et alors"
Ponson-du-Terrail-Pierre_Les-Exploits-de-Rocambole_<le domestique-1225>_26868,"oncle l' archevêque : « Ma chère cousine , «"
Ponson-du-Terrail-Pierre_Les-Exploits-de-Rocambole_<le domestique-1225>_26896,cette dernière ville . « J' ai la promesse de
Ponson-du-Terrail-Pierre_Les-Exploits-de-Rocambole_<le domestique-1225>_26978,monde . « Vous trouverez ma lettre à la Grenadière
Ponson-du-Terrail-Pierre_Les-Exploits-de-Rocambole_<le domestique-1225>_26989,"« Aussitôt arrivée , envoyez - moi un messager à"
Ponson-du-Terrail-Pierre_Les-Exploits-de-Rocambole_<le domestique-1225>_26997,"messager à Grenade , où je retourne sur - le"
Ponson-du-Terrail-Pierre_Les-Exploits-de-Rocambole_<le domestique-1225>_27006,"le - champ , et je me hâterai de me"
Ponson-du-Terrail-Pierre_Les-Exploits-de-Rocambole_<le domestique-1225>_27023,"vous , etc . » Ma mère m' a tout"
Ponson-du-Terrail-Pierre_Les-Exploits-de-Rocambole_<le domestique-1225>_27025,etc . » Ma mère m' a tout raconté alors
Ponson-du-Terrail-Pierre_Les-Exploits-de-Rocambole_<le domestique-1225>_27031,"a tout raconté alors , mon ami . Maintenant ,"
Ponson-du-Terrail-Pierre_Les-Exploits-de-Rocambole_<le domestique-1225>_27050,arrivées depuis la veille et je venais de vous écrire
Ponson-du-Terrail-Pierre_Les-Exploits-de-Rocambole_<le domestique-1225>_27060,"tout cela lorsque Pepa , ma femme de chambre ,"
Ponson-du-Terrail-Pierre_Les-Exploits-de-Rocambole_<le domestique-1225>_27067,"de chambre , pénétrant chez moi à huit heures du"
Ponson-du-Terrail-Pierre_Les-Exploits-de-Rocambole_<le domestique-1225>_27074,"huit heures du matin , me dit : – Mademoiselle"
Ponson-du-Terrail-Pierre_Les-Exploits-de-Rocambole_<le domestique-1225>_27091,. – Pourquoi ? demandai - je . – Parce
Ponson-du-Terrail-Pierre_Les-Exploits-de-Rocambole_<le domestique-1225>_27136,en ouvrant la fenêtre . Je courus à mon balcon
Ponson-du-Terrail-Pierre_Les-Exploits-de-Rocambole_<le domestique-1225>_27139,"fenêtre . Je courus à mon balcon , et voici"
Ponson-du-Terrail-Pierre_Les-Exploits-de-Rocambole_<le domestique-1225>_27146,", et voici ce que je vis : Un ["
Ponson-du-Terrail-Pierre_Les-Exploits-de-Rocambole_<le domestique-1225>_27206,la reine ! m' écriai - je . Ma mère
Ponson-du-Terrail-Pierre_Les-Exploits-de-Rocambole_<le domestique-1225>_27209,m' écriai - je . Ma mère entra précipitamment dans
Ponson-du-Terrail-Pierre_Les-Exploits-de-Rocambole_<le domestique-1225>_27214,Ma mère entra précipitamment dans ma chambre . – La
Ponson-du-Terrail-Pierre_Les-Exploits-de-Rocambole_<le domestique-1225>_27231,"tour , la reine ! Je fus habillée en un"
Ponson-du-Terrail-Pierre_Les-Exploits-de-Rocambole_<le domestique-1225>_27241,"clin d' œil et , ma mère me prenant par"
Ponson-du-Terrail-Pierre_Les-Exploits-de-Rocambole_<le domestique-1225>_27243,"œil et , ma mère me prenant par la main"
Ponson-du-Terrail-Pierre_Les-Exploits-de-Rocambole_<le domestique-1225>_27282,sa main à baiser à ma mère et lui dit
Ponson-du-Terrail-Pierre_Les-Exploits-de-Rocambole_<le domestique-1225>_27303,près de votre habitation sans m' y arrêter pour vous
Ponson-du-Terrail-Pierre_Les-Exploits-de-Rocambole_<le domestique-1225>_27331,que le feu duc . Ma mère baisa la main
Ponson-du-Terrail-Pierre_Les-Exploits-de-Rocambole_<le domestique-1225>_27366,elle s' est entretenue avec ma mère et moi de
Ponson-du-Terrail-Pierre_Les-Exploits-de-Rocambole_<le domestique-1225>_27369,entretenue avec ma mère et moi de mon père et
Ponson-du-Terrail-Pierre_Les-Exploits-de-Rocambole_<le domestique-1225>_27371,ma mère et moi de mon père et de vous
Ponson-du-Terrail-Pierre_Les-Exploits-de-Rocambole_<le domestique-1225>_27382,"En nous quittant , elle m' a dit : –"
Ponson-du-Terrail-Pierre_Les-Exploits-de-Rocambole_<le domestique-1225>_27403,"d' honneur . Ah ! mon ami , ce mot"
Ponson-du-Terrail-Pierre_Les-Exploits-de-Rocambole_<le domestique-1225>_27413,", ce nom qu' elle m' a donné m' ont"
Ponson-du-Terrail-Pierre_Les-Exploits-de-Rocambole_<le domestique-1225>_27416,qu' elle m' a donné m' ont bouleversée et j'
Ponson-du-Terrail-Pierre_Les-Exploits-de-Rocambole_<le domestique-1225>_27420,donné m' ont bouleversée et j' ai cru que j'
Ponson-du-Terrail-Pierre_Les-Exploits-de-Rocambole_<le domestique-1225>_27424,et j' ai cru que j' allais mourir de joie
Ponson-du-Terrail-Pierre_Les-Exploits-de-Rocambole_<le domestique-1225>_27452,"y attends , duchesse . Ma mère s' est inclinée"
Ponson-du-Terrail-Pierre_Les-Exploits-de-Rocambole_<le domestique-1225>_27458,mère s' est inclinée . Mon oncle l' archevêque est
Ponson-du-Terrail-Pierre_Les-Exploits-de-Rocambole_<le domestique-1225>_27495,C' est de là que je vous écrirai dans trois
Ponson-du-Terrail-Pierre_Les-Exploits-de-Rocambole_<le domestique-1225>_27508,"qu' il en soit , mon ami , préparez -"
Ponson-du-Terrail-Pierre_Les-Exploits-de-Rocambole_<le domestique-1225>_27546,. - S . – Ma mère vous serre affectueusement
Ponson-du-Terrail-Pierre_Les-Exploits-de-Rocambole_<le domestique-1225>_27556,"les deux mains , et j' embrasse ma bonne petite"
Ponson-du-Terrail-Pierre_Les-Exploits-de-Rocambole_<le domestique-1225>_27558,"mains , et j' embrasse ma bonne petite sœur Blanche"
Ponson-du-Terrail-Pierre_Les-Exploits-de-Rocambole_<le domestique-1225>_27575,une émotion profonde . Elle lui arrivait comme un réactif
Ponson-du-Terrail-Pierre_Les-Exploits-de-Rocambole_<le domestique-1225>_27584,"réactif puissant au milieu de ses angoisses , de ses"
Ponson-du-Terrail-Pierre_Les-Exploits-de-Rocambole_<le domestique-1225>_27588,"de ses angoisses , de ses vagues terreurs . Conception"
Ponson-du-Terrail-Pierre_Les-Exploits-de-Rocambole_<le domestique-1225>_27593,"ses vagues terreurs . Conception l' aimait , la reine"
Ponson-du-Terrail-Pierre_Les-Exploits-de-Rocambole_<le domestique-1225>_27604,"Espagne s' était occupée de lui , ses ennemis étaient"
Ponson-du-Terrail-Pierre_Les-Exploits-de-Rocambole_<le domestique-1225>_27606,"était occupée de lui , ses ennemis étaient morts …"
Ponson-du-Terrail-Pierre_Les-Exploits-de-Rocambole_<le domestique-1225>_27613,étaient morts … Qu' avait - il donc à craindre
Ponson-du-Terrail-Pierre_Les-Exploits-de-Rocambole_<le domestique-1225>_27620,donc à craindre ? – Je suis un trembleur et
Ponson-du-Terrail-Pierre_Les-Exploits-de-Rocambole_<le domestique-1225>_27622,craindre ? – Je suis un trembleur et un fou
Ponson-du-Terrail-Pierre_Les-Exploits-de-Rocambole_<le domestique-1225>_27630,"un fou , se dit - il , et parce"
Ponson-du-Terrail-Pierre_Les-Exploits-de-Rocambole_<le domestique-1225>_27636,"il , et parce que j' ai tué sir Williams"
Ponson-du-Terrail-Pierre_Les-Exploits-de-Rocambole_<le domestique-1225>_27651,"avait prétendu qu' il était ma bonne étoile , j'"
Ponson-du-Terrail-Pierre_Les-Exploits-de-Rocambole_<le domestique-1225>_27655,"était ma bonne étoile , j' en ai conclu que"
Ponson-du-Terrail-Pierre_Les-Exploits-de-Rocambole_<le domestique-1225>_27667,perdu … Allons donc ! je mourrai dans la peau
Ponson-du-Terrail-Pierre_Les-Exploits-de-Rocambole_<le domestique-1225>_27677,d' un ambassadeur ! Et Rocambole se prit à rire
Ponson-du-Terrail-Pierre_Les-Exploits-de-Rocambole_<le domestique-1225>_27684,prit à rire . Puis il se mit en quête
