,text_surronding
Ponson-du-Terrail-Pierre_Les-Exploits-de-Rocambole_<le capitaine Pedro C …-2751>_60174,avait placé comme domestique chez le capitaine Pedro C …
Ponson-du-Terrail-Pierre_Les-Exploits-de-Rocambole_<le capitaine Pedro C …-2751>_60192,"à cette redoutable apparition . Le capitaine , abusé par"
Ponson-du-Terrail-Pierre_Les-Exploits-de-Rocambole_<le capitaine Pedro C …-2751>_60202,"la lettre de recommandation de son parent le général ,"
Ponson-du-Terrail-Pierre_Les-Exploits-de-Rocambole_<le capitaine Pedro C …-2751>_60234,"nocturne expédition maritime , que le Portugais était sur le"
Ponson-du-Terrail-Pierre_Les-Exploits-de-Rocambole_<le capitaine Pedro C …-2751>_60260,"baron Wenceslas étaient arrivées , il l' avait chargé de"
Ponson-du-Terrail-Pierre_Les-Exploits-de-Rocambole_<le capitaine Pedro C …-2751>_60379,– Est - ce que vous voulez me tuer une
Ponson-du-Terrail-Pierre_Les-Exploits-de-Rocambole_<le capitaine Pedro C …-2751>_60399,jusqu' à la muraille . M . le baron Wenceslas
Ponson-du-Terrail-Pierre_Les-Exploits-de-Rocambole_<le capitaine Pedro C …-2751>_60414,éclat de rire ; puis il répondit : – Quand
Ponson-du-Terrail-Pierre_Les-Exploits-de-Rocambole_<le capitaine Pedro C …-2751>_60440,"Cependant , aujourd' hui , je n' ai nulle envie"
Ponson-du-Terrail-Pierre_Les-Exploits-de-Rocambole_<le capitaine Pedro C …-2751>_60450,"de te tuer , et je suis même très satisfait"
Ponson-du-Terrail-Pierre_Les-Exploits-de-Rocambole_<le capitaine Pedro C …-2751>_60487,présence de la bonne humeur du baron Wenceslas . –
Ponson-du-Terrail-Pierre_Les-Exploits-de-Rocambole_<le capitaine Pedro C …-2751>_60496,"– Maître Zampa , dit Rocambole qui reprit sa place"
Ponson-du-Terrail-Pierre_Les-Exploits-de-Rocambole_<le capitaine Pedro C …-2751>_60497,"Maître Zampa , dit Rocambole qui reprit sa place dans"
Ponson-du-Terrail-Pierre_Les-Exploits-de-Rocambole_<le capitaine Pedro C …-2751>_60499,", dit Rocambole qui reprit sa place dans son fauteuil"
Ponson-du-Terrail-Pierre_Les-Exploits-de-Rocambole_<le capitaine Pedro C …-2751>_60502,"qui reprit sa place dans son fauteuil , se croisa"
Ponson-du-Terrail-Pierre_Les-Exploits-de-Rocambole_<le capitaine Pedro C …-2751>_60510,se croisa les jambes et continua à jouer avec le
Ponson-du-Terrail-Pierre_Les-Exploits-de-Rocambole_<le capitaine Pedro C …-2751>_60519,"le cylindre du revolver , le diable , avec qui"
Ponson-du-Terrail-Pierre_Les-Exploits-de-Rocambole_<le capitaine Pedro C …-2751>_60523,", le diable , avec qui j' ai d' assez"
Ponson-du-Terrail-Pierre_Les-Exploits-de-Rocambole_<le capitaine Pedro C …-2751>_60524,"le diable , avec qui j' ai d' assez graves"
Ponson-du-Terrail-Pierre_Les-Exploits-de-Rocambole_<le capitaine Pedro C …-2751>_60541,première fois que parce qu' il a pensé que j'
Ponson-du-Terrail-Pierre_Les-Exploits-de-Rocambole_<le capitaine Pedro C …-2751>_60545,qu' il a pensé que j' aurais encore besoin de
Ponson-du-Terrail-Pierre_Les-Exploits-de-Rocambole_<le capitaine Pedro C …-2751>_60553,"besoin de vous . – Le diable avait raison ,"
Ponson-du-Terrail-Pierre_Les-Exploits-de-Rocambole_<le capitaine Pedro C …-2751>_60576,la gueule du revolver . Rocambole poursuivit avec son cynisme
Ponson-du-Terrail-Pierre_Les-Exploits-de-Rocambole_<le capitaine Pedro C …-2751>_60579,revolver . Rocambole poursuivit avec son cynisme ordinaire : –
Ponson-du-Terrail-Pierre_Les-Exploits-de-Rocambole_<le capitaine Pedro C …-2751>_60584,son cynisme ordinaire : – Je me suis un peu
Ponson-du-Terrail-Pierre_Les-Exploits-de-Rocambole_<le capitaine Pedro C …-2751>_60595,"pressé peut - être en me débarrassant de toi ,"
Ponson-du-Terrail-Pierre_Les-Exploits-de-Rocambole_<le capitaine Pedro C …-2751>_60608,"de Clignancourt , mais à ma place tu en eusses"
Ponson-du-Terrail-Pierre_Les-Exploits-de-Rocambole_<le capitaine Pedro C …-2751>_60616,en eusses fait autant . J' ai entendu du bruit
Ponson-du-Terrail-Pierre_Les-Exploits-de-Rocambole_<le capitaine Pedro C …-2751>_60625,"bruit , on venait , je t' ai tué pour"
Ponson-du-Terrail-Pierre_Les-Exploits-de-Rocambole_<le capitaine Pedro C …-2751>_60630,je t' ai tué pour me sauver et j' ai
Ponson-du-Terrail-Pierre_Les-Exploits-de-Rocambole_<le capitaine Pedro C …-2751>_60633,tué pour me sauver et j' ai laissé retomber la
Ponson-du-Terrail-Pierre_Les-Exploits-de-Rocambole_<le capitaine Pedro C …-2751>_60651,"dit Zampa , oublie que je savais son vrai nom"
Ponson-du-Terrail-Pierre_Les-Exploits-de-Rocambole_<le capitaine Pedro C …-2751>_60653,", oublie que je savais son vrai nom depuis une"
Ponson-du-Terrail-Pierre_Les-Exploits-de-Rocambole_<le capitaine Pedro C …-2751>_60665,que c' est cela qui m' a perdu . –
Ponson-du-Terrail-Pierre_Les-Exploits-de-Rocambole_<le capitaine Pedro C …-2751>_60673,". – Ah ! dit Rocambole , qui eut un"
Ponson-du-Terrail-Pierre_Les-Exploits-de-Rocambole_<le capitaine Pedro C …-2751>_60675,"Ah ! dit Rocambole , qui eut un tressaillement nerveux"
Ponson-du-Terrail-Pierre_Les-Exploits-de-Rocambole_<le capitaine Pedro C …-2751>_60681,"eut un tressaillement nerveux , tu as su mon vrai"
Ponson-du-Terrail-Pierre_Les-Exploits-de-Rocambole_<le capitaine Pedro C …-2751>_60684,"nerveux , tu as su mon vrai nom ? –"
Ponson-du-Terrail-Pierre_Les-Exploits-de-Rocambole_<le capitaine Pedro C …-2751>_60695,"doute , la veuve Fipart vous avait appelé Rocambole ."
Ponson-du-Terrail-Pierre_Les-Exploits-de-Rocambole_<le capitaine Pedro C …-2751>_60721,. – Et tant que tu ne sauras que celui
Ponson-du-Terrail-Pierre_Les-Exploits-de-Rocambole_<le capitaine Pedro C …-2751>_60729,"que celui - là , mon drôle … – Bah"
Ponson-du-Terrail-Pierre_Les-Exploits-de-Rocambole_<le capitaine Pedro C …-2751>_60735,drôle … – Bah ! je sais l' autre .
Ponson-du-Terrail-Pierre_Les-Exploits-de-Rocambole_<le capitaine Pedro C …-2751>_60754,Seigneurie dans le monde . Rocambole pâlit légèrement . Cette
Ponson-du-Terrail-Pierre_Les-Exploits-de-Rocambole_<le capitaine Pedro C …-2751>_60764,pâleur n' échappa point à Zampa et lui donna de
Ponson-du-Terrail-Pierre_Les-Exploits-de-Rocambole_<le capitaine Pedro C …-2751>_60766,échappa point à Zampa et lui donna de l' audace
Ponson-du-Terrail-Pierre_Les-Exploits-de-Rocambole_<le capitaine Pedro C …-2751>_60776,". – Pardon , dit - il , je vois"
Ponson-du-Terrail-Pierre_Les-Exploits-de-Rocambole_<le capitaine Pedro C …-2751>_60779,", dit - il , je vois que je donne"
Ponson-du-Terrail-Pierre_Les-Exploits-de-Rocambole_<le capitaine Pedro C …-2751>_60782,"il , je vois que je donne de fières distractions"
Ponson-du-Terrail-Pierre_Les-Exploits-de-Rocambole_<le capitaine Pedro C …-2751>_60804,". – Ah ! dit Rocambole , cela t' inquiète"
Ponson-du-Terrail-Pierre_Les-Exploits-de-Rocambole_<le capitaine Pedro C …-2751>_60807,"! dit Rocambole , cela t' inquiète , drôle ?"
Ponson-du-Terrail-Pierre_Les-Exploits-de-Rocambole_<le capitaine Pedro C …-2751>_60810,", cela t' inquiète , drôle ? – Un peu"
Ponson-du-Terrail-Pierre_Les-Exploits-de-Rocambole_<le capitaine Pedro C …-2751>_60820,", en effet . – Tu as raison peut -"
Ponson-du-Terrail-Pierre_Les-Exploits-de-Rocambole_<le capitaine Pedro C …-2751>_60832,"– Oh ! … fit Zampa avec calme , ce"
Ponson-du-Terrail-Pierre_Les-Exploits-de-Rocambole_<le capitaine Pedro C …-2751>_60841,"ce n' est pas pour moi , mais pour vous"
Ponson-du-Terrail-Pierre_Les-Exploits-de-Rocambole_<le capitaine Pedro C …-2751>_60849,"pour vous . – Pour moi , hein ? –"
Ponson-du-Terrail-Pierre_Les-Exploits-de-Rocambole_<le capitaine Pedro C …-2751>_60862,"Si la balle venait à m' atteindre , on accourrait"
Ponson-du-Terrail-Pierre_Les-Exploits-de-Rocambole_<le capitaine Pedro C …-2751>_60929,club célèbre . – Tais - toi ! dit vivement
Ponson-du-Terrail-Pierre_Les-Exploits-de-Rocambole_<le capitaine Pedro C …-2751>_60934,- toi ! dit vivement Rocambole . – Bast !
Ponson-du-Terrail-Pierre_Les-Exploits-de-Rocambole_<le capitaine Pedro C …-2751>_60940,". – Bast ! répliqua Zampa , je crois que"
Ponson-du-Terrail-Pierre_Les-Exploits-de-Rocambole_<le capitaine Pedro C …-2751>_60942,"Bast ! répliqua Zampa , je crois que vous renoncez"
Ponson-du-Terrail-Pierre_Les-Exploits-de-Rocambole_<le capitaine Pedro C …-2751>_60945,"Zampa , je crois que vous renoncez à me tuer"
Ponson-du-Terrail-Pierre_Les-Exploits-de-Rocambole_<le capitaine Pedro C …-2751>_60948,crois que vous renoncez à me tuer aujourd' hui en
Ponson-du-Terrail-Pierre_Les-Exploits-de-Rocambole_<le capitaine Pedro C …-2751>_60953,"me tuer aujourd' hui en me voyant si instruit ,"
Ponson-du-Terrail-Pierre_Les-Exploits-de-Rocambole_<le capitaine Pedro C …-2751>_60958,"me voyant si instruit , monsieur le marquis de Chamery"
Ponson-du-Terrail-Pierre_Les-Exploits-de-Rocambole_<le capitaine Pedro C …-2751>_60965,marquis de Chamery . – Tu sais mon nom !
Ponson-du-Terrail-Pierre_Les-Exploits-de-Rocambole_<le capitaine Pedro C …-2751>_60967,Chamery . – Tu sais mon nom ! s' écria
Ponson-du-Terrail-Pierre_Les-Exploits-de-Rocambole_<le capitaine Pedro C …-2751>_60974,! s' écria - t - il . – Mais
Ponson-du-Terrail-Pierre_Les-Exploits-de-Rocambole_<le capitaine Pedro C …-2751>_60981,". – Mais laissez donc votre revolver tranquille , dit"
Ponson-du-Terrail-Pierre_Les-Exploits-de-Rocambole_<le capitaine Pedro C …-2751>_60986,"votre revolver tranquille , dit Zampa en ricanant . La"
Ponson-du-Terrail-Pierre_Les-Exploits-de-Rocambole_<le capitaine Pedro C …-2751>_61004,; ce n' était plus Rocambole qui la dominait et
Ponson-du-Terrail-Pierre_Les-Exploits-de-Rocambole_<le capitaine Pedro C …-2751>_61005,ce n' était plus Rocambole qui la dominait et tenait
Ponson-du-Terrail-Pierre_Les-Exploits-de-Rocambole_<le capitaine Pedro C …-2751>_61006,n' était plus Rocambole qui la dominait et tenait Zampa
Ponson-du-Terrail-Pierre_Les-Exploits-de-Rocambole_<le capitaine Pedro C …-2751>_61009,Rocambole qui la dominait et tenait Zampa en son pouvoir
Ponson-du-Terrail-Pierre_Les-Exploits-de-Rocambole_<le capitaine Pedro C …-2751>_61010,"qui la dominait et tenait Zampa en son pouvoir ,"
Ponson-du-Terrail-Pierre_Les-Exploits-de-Rocambole_<le capitaine Pedro C …-2751>_61012,"dominait et tenait Zampa en son pouvoir , c' était"
Ponson-du-Terrail-Pierre_Les-Exploits-de-Rocambole_<le capitaine Pedro C …-2751>_61015,"Zampa en son pouvoir , c' était Zampa qui imposait"
Ponson-du-Terrail-Pierre_Les-Exploits-de-Rocambole_<le capitaine Pedro C …-2751>_61017,"son pouvoir , c' était Zampa qui imposait à Rocambole"
Ponson-du-Terrail-Pierre_Les-Exploits-de-Rocambole_<le capitaine Pedro C …-2751>_61018,"pouvoir , c' était Zampa qui imposait à Rocambole en"
Ponson-du-Terrail-Pierre_Les-Exploits-de-Rocambole_<le capitaine Pedro C …-2751>_61021,était Zampa qui imposait à Rocambole en lui prouvant qu'
Ponson-du-Terrail-Pierre_Les-Exploits-de-Rocambole_<le capitaine Pedro C …-2751>_61023,qui imposait à Rocambole en lui prouvant qu' il avait
Ponson-du-Terrail-Pierre_Les-Exploits-de-Rocambole_<le capitaine Pedro C …-2751>_61026,Rocambole en lui prouvant qu' il avait son secret .
Ponson-du-Terrail-Pierre_Les-Exploits-de-Rocambole_<le capitaine Pedro C …-2751>_61028,lui prouvant qu' il avait son secret . – Ah
Ponson-du-Terrail-Pierre_Les-Exploits-de-Rocambole_<le capitaine Pedro C …-2751>_61034,secret . – Ah ! tu sais mon nom !
Ponson-du-Terrail-Pierre_Les-Exploits-de-Rocambole_<le capitaine Pedro C …-2751>_61036,– Ah ! tu sais mon nom ! répéta le
Ponson-du-Terrail-Pierre_Les-Exploits-de-Rocambole_<le capitaine Pedro C …-2751>_61040,sais mon nom ! répéta le faux marquis avec une
Ponson-du-Terrail-Pierre_Les-Exploits-de-Rocambole_<le capitaine Pedro C …-2751>_61047,marquis avec une inquiétude qu' il s' efforça vainement de
Ponson-du-Terrail-Pierre_Les-Exploits-de-Rocambole_<le capitaine Pedro C …-2751>_61058,". – Parbleu ! répondit Zampa , je sais même"
Ponson-du-Terrail-Pierre_Les-Exploits-de-Rocambole_<le capitaine Pedro C …-2751>_61060,"Parbleu ! répondit Zampa , je sais même que vous"
Ponson-du-Terrail-Pierre_Les-Exploits-de-Rocambole_<le capitaine Pedro C …-2751>_61064,", je sais même que vous deviez épouser mademoiselle Conception"
Ponson-du-Terrail-Pierre_Les-Exploits-de-Rocambole_<le capitaine Pedro C …-2751>_61077,"– Après ? … fit Rocambole , qui reprit son"
Ponson-du-Terrail-Pierre_Les-Exploits-de-Rocambole_<le capitaine Pedro C …-2751>_61079,"? … fit Rocambole , qui reprit son revolver et"
Ponson-du-Terrail-Pierre_Les-Exploits-de-Rocambole_<le capitaine Pedro C …-2751>_61081,"fit Rocambole , qui reprit son revolver et ajusta Zampa"
Ponson-du-Terrail-Pierre_Les-Exploits-de-Rocambole_<le capitaine Pedro C …-2751>_61084,qui reprit son revolver et ajusta Zampa . Mais celui
Ponson-du-Terrail-Pierre_Les-Exploits-de-Rocambole_<le capitaine Pedro C …-2751>_61085,reprit son revolver et ajusta Zampa . Mais celui -
Ponson-du-Terrail-Pierre_Les-Exploits-de-Rocambole_<le capitaine Pedro C …-2751>_61088,et ajusta Zampa . Mais celui - ci ne sourcilla
Ponson-du-Terrail-Pierre_Les-Exploits-de-Rocambole_<le capitaine Pedro C …-2751>_61096,"ne sourcilla point . – Monsieur le marquis , dit"
Ponson-du-Terrail-Pierre_Les-Exploits-de-Rocambole_<le capitaine Pedro C …-2751>_61101,"Monsieur le marquis , dit - il , vous êtes"
Ponson-du-Terrail-Pierre_Les-Exploits-de-Rocambole_<le capitaine Pedro C …-2751>_61104,", dit - il , vous êtes libre de me"
Ponson-du-Terrail-Pierre_Les-Exploits-de-Rocambole_<le capitaine Pedro C …-2751>_61108,", vous êtes libre de me tuer ; mais si"
Ponson-du-Terrail-Pierre_Les-Exploits-de-Rocambole_<le capitaine Pedro C …-2751>_61113,me tuer ; mais si vous doutiez un seul instant
Ponson-du-Terrail-Pierre_Les-Exploits-de-Rocambole_<le capitaine Pedro C …-2751>_61122,instant de tout ce que je sais et de tout
Ponson-du-Terrail-Pierre_Les-Exploits-de-Rocambole_<le capitaine Pedro C …-2751>_61129,et de tout ce que je puis faire pour vous
Ponson-du-Terrail-Pierre_Les-Exploits-de-Rocambole_<le capitaine Pedro C …-2751>_61133,"que je puis faire pour vous … – Soit ,"
Ponson-du-Terrail-Pierre_Les-Exploits-de-Rocambole_<le capitaine Pedro C …-2751>_61138,"vous … – Soit , tu vivras , dit le"
Ponson-du-Terrail-Pierre_Les-Exploits-de-Rocambole_<le capitaine Pedro C …-2751>_61142,", tu vivras , dit le marquis en replaçant le"
Ponson-du-Terrail-Pierre_Les-Exploits-de-Rocambole_<le capitaine Pedro C …-2751>_61158,sourire railleur vint aux lèvres du Portugais . – Votre
Ponson-du-Terrail-Pierre_Les-Exploits-de-Rocambole_<le capitaine Pedro C …-2751>_61162,lèvres du Portugais . – Votre Seigneurie est bien bonne
Ponson-du-Terrail-Pierre_Les-Exploits-de-Rocambole_<le capitaine Pedro C …-2751>_61169,"est bien bonne , dit - il , mais elle"
Ponson-du-Terrail-Pierre_Les-Exploits-de-Rocambole_<le capitaine Pedro C …-2751>_61188,est point au prix de ma vie qu' elle paierait
Ponson-du-Terrail-Pierre_Les-Exploits-de-Rocambole_<le capitaine Pedro C …-2751>_61191,"prix de ma vie qu' elle paierait ma science ,"
Ponson-du-Terrail-Pierre_Les-Exploits-de-Rocambole_<le capitaine Pedro C …-2751>_61193,"ma vie qu' elle paierait ma science , c' est"
Ponson-du-Terrail-Pierre_Les-Exploits-de-Rocambole_<le capitaine Pedro C …-2751>_61201,c' est au prix de sa fortune . Rocambole sentit
Ponson-du-Terrail-Pierre_Les-Exploits-de-Rocambole_<le capitaine Pedro C …-2751>_61204,prix de sa fortune . Rocambole sentit ses cheveux se
Ponson-du-Terrail-Pierre_Les-Exploits-de-Rocambole_<le capitaine Pedro C …-2751>_61206,"sa fortune . Rocambole sentit ses cheveux se hérisser ,"
Ponson-du-Terrail-Pierre_Les-Exploits-de-Rocambole_<le capitaine Pedro C …-2751>_61216,tant le calme railleur de Zampa commençait à l' épouvanter
Ponson-du-Terrail-Pierre_Les-Exploits-de-Rocambole_<le capitaine Pedro C …-2751>_61219,railleur de Zampa commençait à l' épouvanter . – Soit
Ponson-du-Terrail-Pierre_Les-Exploits-de-Rocambole_<le capitaine Pedro C …-2751>_61226,". – Soit , dit - il , je te"
Ponson-du-Terrail-Pierre_Les-Exploits-de-Rocambole_<le capitaine Pedro C …-2751>_61229,", dit - il , je te donnerai de l'"
Ponson-du-Terrail-Pierre_Les-Exploits-de-Rocambole_<le capitaine Pedro C …-2751>_61230,"dit - il , je te donnerai de l' or"
Ponson-du-Terrail-Pierre_Les-Exploits-de-Rocambole_<le capitaine Pedro C …-2751>_61238,l' or . – Il m' en faudra beaucoup .
Ponson-du-Terrail-Pierre_Les-Exploits-de-Rocambole_<le capitaine Pedro C …-2751>_61244,en faudra beaucoup . – Tu auras ce que tu
Ponson-du-Terrail-Pierre_Les-Exploits-de-Rocambole_<le capitaine Pedro C …-2751>_61248,"– Tu auras ce que tu voudras , quand je"
Ponson-du-Terrail-Pierre_Les-Exploits-de-Rocambole_<le capitaine Pedro C …-2751>_61252,"que tu voudras , quand je serai l' époux de"
Ponson-du-Terrail-Pierre_Les-Exploits-de-Rocambole_<le capitaine Pedro C …-2751>_61259,"l' époux de Conception . Zampa , à son tour"
Ponson-du-Terrail-Pierre_Les-Exploits-de-Rocambole_<le capitaine Pedro C …-2751>_61262,"Conception . Zampa , à son tour , partit d'"
Ponson-du-Terrail-Pierre_Les-Exploits-de-Rocambole_<le capitaine Pedro C …-2751>_61272,un éclat de rire et haussa les épaules d' une
Ponson-du-Terrail-Pierre_Les-Exploits-de-Rocambole_<le capitaine Pedro C …-2751>_61289,"auparavant , à Paris , il eût vu la canne"
Ponson-du-Terrail-Pierre_Les-Exploits-de-Rocambole_<le capitaine Pedro C …-2751>_61302,Chamery se briser net sur son échine . Mais Rocambole
Ponson-du-Terrail-Pierre_Les-Exploits-de-Rocambole_<le capitaine Pedro C …-2751>_61306,"sur son échine . Mais Rocambole était prudent , il"
Ponson-du-Terrail-Pierre_Les-Exploits-de-Rocambole_<le capitaine Pedro C …-2751>_61310,"Mais Rocambole était prudent , il dévora cet affront ."
Ponson-du-Terrail-Pierre_Les-Exploits-de-Rocambole_<le capitaine Pedro C …-2751>_61315,il dévora cet affront . Zampa accompagna son éclat de
Ponson-du-Terrail-Pierre_Les-Exploits-de-Rocambole_<le capitaine Pedro C …-2751>_61317,cet affront . Zampa accompagna son éclat de rire de
Ponson-du-Terrail-Pierre_Les-Exploits-de-Rocambole_<le capitaine Pedro C …-2751>_61326,de ces paroles : – Votre Seigneurie a eu quelque
Ponson-du-Terrail-Pierre_Les-Exploits-de-Rocambole_<le capitaine Pedro C …-2751>_61376,- à - dire que vous êtes Rocambole et que
Ponson-du-Terrail-Pierre_Les-Exploits-de-Rocambole_<le capitaine Pedro C …-2751>_61378,- dire que vous êtes Rocambole et que le vrai
Ponson-du-Terrail-Pierre_Les-Exploits-de-Rocambole_<le capitaine Pedro C …-2751>_61387,"vrai marquis de Chamery … Zampa s' arrêta , Rocambole"
Ponson-du-Terrail-Pierre_Les-Exploits-de-Rocambole_<le capitaine Pedro C …-2751>_61391,"… Zampa s' arrêta , Rocambole se leva et fit"
Ponson-du-Terrail-Pierre_Les-Exploits-de-Rocambole_<le capitaine Pedro C …-2751>_61395,", Rocambole se leva et fit un pas en arrière"
Ponson-du-Terrail-Pierre_Les-Exploits-de-Rocambole_<le capitaine Pedro C …-2751>_61402,"pas en arrière . – Tu sais cela , tu"
Ponson-du-Terrail-Pierre_Les-Exploits-de-Rocambole_<le capitaine Pedro C …-2751>_61406,"– Tu sais cela , tu sais cela ? fit"
Ponson-du-Terrail-Pierre_Les-Exploits-de-Rocambole_<le capitaine Pedro C …-2751>_61411,tu sais cela ? fit le faux marquis . –
Ponson-du-Terrail-Pierre_Les-Exploits-de-Rocambole_<le capitaine Pedro C …-2751>_61416,le faux marquis . – Je sais que M .
Ponson-du-Terrail-Pierre_Les-Exploits-de-Rocambole_<le capitaine Pedro C …-2751>_61431,"de Cadix , répliqua froidement le Portugais . Et comme"
Ponson-du-Terrail-Pierre_Les-Exploits-de-Rocambole_<le capitaine Pedro C …-2751>_61436,"le Portugais . Et comme Rocambole , immobile , attachait"
Ponson-du-Terrail-Pierre_Les-Exploits-de-Rocambole_<le capitaine Pedro C …-2751>_61442,", immobile , attachait sur lui un regard rempli de"
Ponson-du-Terrail-Pierre_Les-Exploits-de-Rocambole_<le capitaine Pedro C …-2751>_61453,": – Allons , continua Zampa , je vois maintenant"
Ponson-du-Terrail-Pierre_Les-Exploits-de-Rocambole_<le capitaine Pedro C …-2751>_61455,"Allons , continua Zampa , je vois maintenant que nous"
Ponson-du-Terrail-Pierre_Les-Exploits-de-Rocambole_<le capitaine Pedro C …-2751>_61469,"vieux amis , et que je suis aussi en sûreté"
Ponson-du-Terrail-Pierre_Les-Exploits-de-Rocambole_<le capitaine Pedro C …-2751>_61488,"capitaine Pedro C … , mon nouveau maître . –"
Ponson-du-Terrail-Pierre_Les-Exploits-de-Rocambole_<le capitaine Pedro C …-2751>_61496,". – Parle , dit Rocambole , que sais -"
Ponson-du-Terrail-Pierre_Les-Exploits-de-Rocambole_<le capitaine Pedro C …-2751>_61500,"dit Rocambole , que sais - tu encore ? –"
Ponson-du-Terrail-Pierre_Les-Exploits-de-Rocambole_<le capitaine Pedro C …-2751>_61510,"Asseyez - vous , répondit Zampa , et causons ;"
Ponson-du-Terrail-Pierre_Les-Exploits-de-Rocambole_<le capitaine Pedro C …-2751>_61515,"Zampa , et causons ; je suis persuadé que nous"
Ponson-du-Terrail-Pierre_Les-Exploits-de-Rocambole_<le capitaine Pedro C …-2751>_61525,allons nous entendre . – Moi aussi . – Entre
Ponson-du-Terrail-Pierre_Les-Exploits-de-Rocambole_<le capitaine Pedro C …-2751>_61535,"gens comme nous , poursuivit le Portugais , gens de"
Ponson-du-Terrail-Pierre_Les-Exploits-de-Rocambole_<le capitaine Pedro C …-2751>_61556,"s' aime bientôt . Si tu m' en crois ,"
Ponson-du-Terrail-Pierre_Les-Exploits-de-Rocambole_<le capitaine Pedro C …-2751>_61557,"aime bientôt . Si tu m' en crois , tu"
Ponson-du-Terrail-Pierre_Les-Exploits-de-Rocambole_<le capitaine Pedro C …-2751>_61561,"tu m' en crois , tu laisseras momentanément ton marquisat"
Ponson-du-Terrail-Pierre_Les-Exploits-de-Rocambole_<le capitaine Pedro C …-2751>_61564,"crois , tu laisseras momentanément ton marquisat , qui me"
Ponson-du-Terrail-Pierre_Les-Exploits-de-Rocambole_<le capitaine Pedro C …-2751>_61568,"momentanément ton marquisat , qui me gêne en ce sens"
Ponson-du-Terrail-Pierre_Les-Exploits-de-Rocambole_<le capitaine Pedro C …-2751>_61574,gêne en ce sens que je suis obligé d' employer
Ponson-du-Terrail-Pierre_Les-Exploits-de-Rocambole_<le capitaine Pedro C …-2751>_61601,"on dit à Paris , mon vieux Rocambole . Le"
Ponson-du-Terrail-Pierre_Les-Exploits-de-Rocambole_<le capitaine Pedro C …-2751>_61605,", mon vieux Rocambole . Le disciple de sir Williams"
Ponson-du-Terrail-Pierre_Les-Exploits-de-Rocambole_<le capitaine Pedro C …-2751>_61620,". – Voyons , dit - il , tutoie -"
Ponson-du-Terrail-Pierre_Les-Exploits-de-Rocambole_<le capitaine Pedro C …-2751>_61624,"dit - il , tutoie - moi si tu veux"
Ponson-du-Terrail-Pierre_Les-Exploits-de-Rocambole_<le capitaine Pedro C …-2751>_61627,", tutoie - moi si tu veux , mais parle"
Ponson-du-Terrail-Pierre_Les-Exploits-de-Rocambole_<le capitaine Pedro C …-2751>_61631,"si tu veux , mais parle ! – Ecoute donc"
Ponson-du-Terrail-Pierre_Les-Exploits-de-Rocambole_<le capitaine Pedro C …-2751>_61647,une femme qui est sur tes traces et qui m'
Ponson-du-Terrail-Pierre_Les-Exploits-de-Rocambole_<le capitaine Pedro C …-2751>_61651,sur tes traces et qui m' a employé pour te
Ponson-du-Terrail-Pierre_Les-Exploits-de-Rocambole_<le capitaine Pedro C …-2751>_61655,qui m' a employé pour te découvrir . – Son
Ponson-du-Terrail-Pierre_Les-Exploits-de-Rocambole_<le capitaine Pedro C …-2751>_61670,"Artoff . – Oh ! je le savais bien ,"
Ponson-du-Terrail-Pierre_Les-Exploits-de-Rocambole_<le capitaine Pedro C …-2751>_61676,"le savais bien , murmura le faux marquis de Chamery"
Ponson-du-Terrail-Pierre_Les-Exploits-de-Rocambole_<le capitaine Pedro C …-2751>_61689,a volé un portrait dans ton château de l' Orangerie
Ponson-du-Terrail-Pierre_Les-Exploits-de-Rocambole_<le capitaine Pedro C …-2751>_61699,. – Oui . – C' est moi . –
Ponson-du-Terrail-Pierre_Les-Exploits-de-Rocambole_<le capitaine Pedro C …-2751>_61701,Oui . – C' est moi . – Toi ?
Ponson-du-Terrail-Pierre_Les-Exploits-de-Rocambole_<le capitaine Pedro C …-2751>_61704,C' est moi . – Toi ? et qu' as
Ponson-du-Terrail-Pierre_Les-Exploits-de-Rocambole_<le capitaine Pedro C …-2751>_61709,Toi ? et qu' as - tu fait de ce
Ponson-du-Terrail-Pierre_Les-Exploits-de-Rocambole_<le capitaine Pedro C …-2751>_61717,de ce portrait ? – Je l' ai donné à
Ponson-du-Terrail-Pierre_Les-Exploits-de-Rocambole_<le capitaine Pedro C …-2751>_61735,"Dame ! … fit ingénument Zampa , elle payait bien"
Ponson-du-Terrail-Pierre_Les-Exploits-de-Rocambole_<le capitaine Pedro C …-2751>_61743,payait bien et elle savait mes petites affaires . Toi
Ponson-du-Terrail-Pierre_Les-Exploits-de-Rocambole_<le capitaine Pedro C …-2751>_61747,"savait mes petites affaires . Toi , tu m' avais"
Ponson-du-Terrail-Pierre_Les-Exploits-de-Rocambole_<le capitaine Pedro C …-2751>_61749,"petites affaires . Toi , tu m' avais tué …"
Ponson-du-Terrail-Pierre_Les-Exploits-de-Rocambole_<le capitaine Pedro C …-2751>_61750,"affaires . Toi , tu m' avais tué … –"
Ponson-du-Terrail-Pierre_Les-Exploits-de-Rocambole_<le capitaine Pedro C …-2751>_61772,– Tonnerre ! s' écria Rocambole . – Avec le
Ponson-du-Terrail-Pierre_Les-Exploits-de-Rocambole_<le capitaine Pedro C …-2751>_61784,qu' elle doit présenter à ta chère Conception avec pas
Ponson-du-Terrail-Pierre_Les-Exploits-de-Rocambole_<le capitaine Pedro C …-2751>_61801,en même temps qu' elle lui présentera M . le
Ponson-du-Terrail-Pierre_Les-Exploits-de-Rocambole_<le capitaine Pedro C …-2751>_61803,temps qu' elle lui présentera M . le marquis de
Ponson-du-Terrail-Pierre_Les-Exploits-de-Rocambole_<le capitaine Pedro C …-2751>_61811,"marquis de Chamery , pas toi , le vrai …"
