,text_surronding
Ponson-du-Terrail-Pierre_Les-Exploits-de-Rocambole_<Le vieux garde-3574>_82420,", que cinq minutes auparavant Rocambole croyait si bien mort"
Ponson-du-Terrail-Pierre_Les-Exploits-de-Rocambole_<Le vieux garde-3574>_82426,"croyait si bien mort qu' il eût parié , à"
Ponson-du-Terrail-Pierre_Les-Exploits-de-Rocambole_<Le vieux garde-3574>_82434,", à l' appui de sa conviction , l' immense"
Ponson-du-Terrail-Pierre_Les-Exploits-de-Rocambole_<Le vieux garde-3574>_82452,". Pendant dix secondes , l' élève de sir Williams"
Ponson-du-Terrail-Pierre_Les-Exploits-de-Rocambole_<Le vieux garde-3574>_82489,", tout à coup , il fit un nouveau pas"
Ponson-du-Terrail-Pierre_Les-Exploits-de-Rocambole_<Le vieux garde-3574>_82502,", détournant la tête , il chercha autour de lui"
Ponson-du-Terrail-Pierre_Les-Exploits-de-Rocambole_<Le vieux garde-3574>_82506,", il chercha autour de lui une issue par laquelle"
Ponson-du-Terrail-Pierre_Les-Exploits-de-Rocambole_<Le vieux garde-3574>_82511,lui une issue par laquelle il pût prendre la fuite
Ponson-du-Terrail-Pierre_Les-Exploits-de-Rocambole_<Le vieux garde-3574>_82551,"il , qu' en penses - tu ? est -"
Ponson-du-Terrail-Pierre_Les-Exploits-de-Rocambole_<Le vieux garde-3574>_82560,- ce bien joué ? Rocambole continuait à le regarder
Ponson-du-Terrail-Pierre_Les-Exploits-de-Rocambole_<Le vieux garde-3574>_82567,"à le regarder , et ses dents claquaient de terreur"
Ponson-du-Terrail-Pierre_Les-Exploits-de-Rocambole_<Le vieux garde-3574>_82582,", reprit le Portugais , tu m' as cru ivre"
Ponson-du-Terrail-Pierre_Les-Exploits-de-Rocambole_<Le vieux garde-3574>_82590,"cru ivre , hein ? Tu t' es figuré que"
Ponson-du-Terrail-Pierre_Les-Exploits-de-Rocambole_<Le vieux garde-3574>_82597,es figuré que je brûlais ta petite signature tout exprès
Ponson-du-Terrail-Pierre_Les-Exploits-de-Rocambole_<Le vieux garde-3574>_82603,petite signature tout exprès pour te plaire … Ah !
Ponson-du-Terrail-Pierre_Les-Exploits-de-Rocambole_<Le vieux garde-3574>_82626,frisson de l' épouvante à Rocambole . Rocambole avait repris
Ponson-du-Terrail-Pierre_Les-Exploits-de-Rocambole_<Le vieux garde-3574>_82628,l' épouvante à Rocambole . Rocambole avait repris l' immobilité
Ponson-du-Terrail-Pierre_Les-Exploits-de-Rocambole_<Le vieux garde-3574>_82651,", mon bonhomme , que tu n' as pas l'"
Ponson-du-Terrail-Pierre_Les-Exploits-de-Rocambole_<Le vieux garde-3574>_82671,d' un coquin vulgaire ! Tu n' es point un
Ponson-du-Terrail-Pierre_Les-Exploits-de-Rocambole_<Le vieux garde-3574>_82678,"es point un scélérat , tu es un filou ."
Ponson-du-Terrail-Pierre_Les-Exploits-de-Rocambole_<Le vieux garde-3574>_82680,"un scélérat , tu es un filou . Tu ne"
Ponson-du-Terrail-Pierre_Les-Exploits-de-Rocambole_<Le vieux garde-3574>_82683,tu es un filou . Tu ne sers pas ceux
Ponson-du-Terrail-Pierre_Les-Exploits-de-Rocambole_<Le vieux garde-3574>_82689,"ne sers pas ceux qui t' ont servi , tu"
Ponson-du-Terrail-Pierre_Les-Exploits-de-Rocambole_<Le vieux garde-3574>_82693,"qui t' ont servi , tu les assassines ! Une"
Ponson-du-Terrail-Pierre_Les-Exploits-de-Rocambole_<Le vieux garde-3574>_82704,"fois , à Paris , tu as voulu te débarrasser"
Ponson-du-Terrail-Pierre_Les-Exploits-de-Rocambole_<Le vieux garde-3574>_82710,"as voulu te débarrasser de moi , et tu m'"
Ponson-du-Terrail-Pierre_Les-Exploits-de-Rocambole_<Le vieux garde-3574>_82713,"débarrasser de moi , et tu m' as dagué par"
Ponson-du-Terrail-Pierre_Les-Exploits-de-Rocambole_<Le vieux garde-3574>_82714,"de moi , et tu m' as dagué par derrière"
Ponson-du-Terrail-Pierre_Les-Exploits-de-Rocambole_<Le vieux garde-3574>_82725,"comme un lâche ! et tu as cru , maître"
Ponson-du-Terrail-Pierre_Les-Exploits-de-Rocambole_<Le vieux garde-3574>_82729,"et tu as cru , maître fou , qu' un"
Ponson-du-Terrail-Pierre_Les-Exploits-de-Rocambole_<Le vieux garde-3574>_82736,", qu' un homme comme moi , un homme né"
Ponson-du-Terrail-Pierre_Les-Exploits-de-Rocambole_<Le vieux garde-3574>_82766,on nomme la Vengeance ! Zampa s' interrompit encore pour
Ponson-du-Terrail-Pierre_Les-Exploits-de-Rocambole_<Le vieux garde-3574>_82773,"interrompit encore pour rire à son aise , puis il"
Ponson-du-Terrail-Pierre_Les-Exploits-de-Rocambole_<Le vieux garde-3574>_82777,"à son aise , puis il reprit : – Quand"
Ponson-du-Terrail-Pierre_Les-Exploits-de-Rocambole_<Le vieux garde-3574>_82782,il reprit : – Quand tu t' es vu en
Ponson-du-Terrail-Pierre_Les-Exploits-de-Rocambole_<Le vieux garde-3574>_82787,"tu t' es vu en mon pouvoir , tu m'"
Ponson-du-Terrail-Pierre_Les-Exploits-de-Rocambole_<Le vieux garde-3574>_82790,"vu en mon pouvoir , tu m' as offert de"
Ponson-du-Terrail-Pierre_Les-Exploits-de-Rocambole_<Le vieux garde-3574>_82791,"en mon pouvoir , tu m' as offert de l'"
Ponson-du-Terrail-Pierre_Les-Exploits-de-Rocambole_<Le vieux garde-3574>_82800,"l' or , et comme j' acceptais , tu t'"
Ponson-du-Terrail-Pierre_Les-Exploits-de-Rocambole_<Le vieux garde-3574>_82803,"et comme j' acceptais , tu t' es dit :"
Ponson-du-Terrail-Pierre_Les-Exploits-de-Rocambole_<Le vieux garde-3574>_82813,« Voilà un niais que j' amorce deux fois avec
Ponson-du-Terrail-Pierre_Les-Exploits-de-Rocambole_<Le vieux garde-3574>_82826,"! » Eh bien , tu t' es trompé ,"
Ponson-du-Terrail-Pierre_Les-Exploits-de-Rocambole_<Le vieux garde-3574>_82831,"tu t' es trompé , cher ami . Si Zampa"
Ponson-du-Terrail-Pierre_Les-Exploits-de-Rocambole_<Le vieux garde-3574>_82835,", cher ami . Si Zampa possédait les deux Indes"
Ponson-du-Terrail-Pierre_Les-Exploits-de-Rocambole_<Le vieux garde-3574>_82846,"la couronne d' Espagne , il engagerait tout pour se"
Ponson-du-Terrail-Pierre_Les-Exploits-de-Rocambole_<Le vieux garde-3574>_82857,d' un ennemi . Comprends - tu ? Et Zampa
Ponson-du-Terrail-Pierre_Les-Exploits-de-Rocambole_<Le vieux garde-3574>_82861,Comprends - tu ? Et Zampa riait à se tordre
Ponson-du-Terrail-Pierre_Les-Exploits-de-Rocambole_<Le vieux garde-3574>_82875,de tous ses membres . Le Portugais continua : –
Ponson-du-Terrail-Pierre_Les-Exploits-de-Rocambole_<Le vieux garde-3574>_82882,continua : – Hein ! te l' ai - je
Ponson-du-Terrail-Pierre_Les-Exploits-de-Rocambole_<Le vieux garde-3574>_82885,"Hein ! te l' ai - je bien arrangée ,"
Ponson-du-Terrail-Pierre_Les-Exploits-de-Rocambole_<Le vieux garde-3574>_82902,"fond – lequel abîme , mon pauvre vieux , n'"
Ponson-du-Terrail-Pierre_Les-Exploits-de-Rocambole_<Le vieux garde-3574>_82915,pieds de profondeur ! Crois - tu que j' ai
Ponson-du-Terrail-Pierre_Les-Exploits-de-Rocambole_<Le vieux garde-3574>_82918,! Crois - tu que j' ai bien joué mon
Ponson-du-Terrail-Pierre_Les-Exploits-de-Rocambole_<Le vieux garde-3574>_82922,que j' ai bien joué mon petit rôle d' homme
Ponson-du-Terrail-Pierre_Les-Exploits-de-Rocambole_<Le vieux garde-3574>_82935,poitrine par la balle que j' avais eu soin de
Ponson-du-Terrail-Pierre_Les-Exploits-de-Rocambole_<Le vieux garde-3574>_82942,eu soin de retirer de tes pistolets ? J' ai
Ponson-du-Terrail-Pierre_Les-Exploits-de-Rocambole_<Le vieux garde-3574>_82945,"retirer de tes pistolets ? J' ai tournoyé , j'"
Ponson-du-Terrail-Pierre_Les-Exploits-de-Rocambole_<Le vieux garde-3574>_82949,"? J' ai tournoyé , j' ai crié , et"
Ponson-du-Terrail-Pierre_Les-Exploits-de-Rocambole_<Le vieux garde-3574>_82955,"ai crié , et puis je suis tombé sur un"
Ponson-du-Terrail-Pierre_Les-Exploits-de-Rocambole_<Le vieux garde-3574>_82974,pour amortir le bruit de ma chute . Zampa riait
Ponson-du-Terrail-Pierre_Les-Exploits-de-Rocambole_<Le vieux garde-3574>_82977,"bruit de ma chute . Zampa riait toujours , et"
Ponson-du-Terrail-Pierre_Les-Exploits-de-Rocambole_<Le vieux garde-3574>_82987,Rocambole était livide … Cependant l' élève de sir Williams
Ponson-du-Terrail-Pierre_Les-Exploits-de-Rocambole_<Le vieux garde-3574>_82997,"fit un effort surhumain , ouvrit la bouche , étendit"
Ponson-du-Terrail-Pierre_Les-Exploits-de-Rocambole_<Le vieux garde-3574>_83001,", ouvrit la bouche , étendit la main et murmura"
Ponson-du-Terrail-Pierre_Les-Exploits-de-Rocambole_<Le vieux garde-3574>_83005,", étendit la main et murmura : – Tais -"
Ponson-du-Terrail-Pierre_Les-Exploits-de-Rocambole_<Le vieux garde-3574>_83018,"moins haut ! Ce que tu me demanderas , tu"
Ponson-du-Terrail-Pierre_Les-Exploits-de-Rocambole_<Le vieux garde-3574>_83019,"haut ! Ce que tu me demanderas , tu l'"
Ponson-du-Terrail-Pierre_Les-Exploits-de-Rocambole_<Le vieux garde-3574>_83022,"que tu me demanderas , tu l' auras … Veux"
Ponson-du-Terrail-Pierre_Les-Exploits-de-Rocambole_<Le vieux garde-3574>_83027,tu l' auras … Veux - tu ma fortune ?
Ponson-du-Terrail-Pierre_Les-Exploits-de-Rocambole_<Le vieux garde-3574>_83029,auras … Veux - tu ma fortune ? – Plaît
Ponson-du-Terrail-Pierre_Les-Exploits-de-Rocambole_<Le vieux garde-3574>_83034,ma fortune ? – Plaît - il ? – Tais
Ponson-du-Terrail-Pierre_Les-Exploits-de-Rocambole_<Le vieux garde-3574>_83039,- il ? – Tais - toi ! tais -
Ponson-du-Terrail-Pierre_Les-Exploits-de-Rocambole_<Le vieux garde-3574>_83043,Tais - toi ! tais - toi ! – Bah
Ponson-du-Terrail-Pierre_Les-Exploits-de-Rocambole_<Le vieux garde-3574>_83049,toi ! – Bah ! tu as peur du bruit
Ponson-du-Terrail-Pierre_Les-Exploits-de-Rocambole_<Le vieux garde-3574>_83057,"du bruit ? – Tais - toi donc , misérable"
Ponson-du-Terrail-Pierre_Les-Exploits-de-Rocambole_<Le vieux garde-3574>_83061,"Tais - toi donc , misérable , elle va t'"
Ponson-du-Terrail-Pierre_Les-Exploits-de-Rocambole_<Le vieux garde-3574>_83065,", misérable , elle va t' entendre … – Qui"
Ponson-du-Terrail-Pierre_Les-Exploits-de-Rocambole_<Le vieux garde-3574>_83076,elle ! – Conception … ma fiancée … celle qui
Ponson-du-Terrail-Pierre_Les-Exploits-de-Rocambole_<Le vieux garde-3574>_83081,ma fiancée … celle qui m' attend . Zampa haussa
Ponson-du-Terrail-Pierre_Les-Exploits-de-Rocambole_<Le vieux garde-3574>_83084,celle qui m' attend . Zampa haussa les épaules .
Ponson-du-Terrail-Pierre_Les-Exploits-de-Rocambole_<Le vieux garde-3574>_83094,"– Allons donc ! fit - il , tu crois"
Ponson-du-Terrail-Pierre_Les-Exploits-de-Rocambole_<Le vieux garde-3574>_83097,"! fit - il , tu crois qu' elle t'"
Ponson-du-Terrail-Pierre_Les-Exploits-de-Rocambole_<Le vieux garde-3574>_83101,", tu crois qu' elle t' attend ? – Oui"
Ponson-du-Terrail-Pierre_Les-Exploits-de-Rocambole_<Le vieux garde-3574>_83108,"? – Oui , continua le faux marquis , dont"
Ponson-du-Terrail-Pierre_Les-Exploits-de-Rocambole_<Le vieux garde-3574>_83112,"continua le faux marquis , dont le front était inondé"
Ponson-du-Terrail-Pierre_Les-Exploits-de-Rocambole_<Le vieux garde-3574>_83149,"c' est juste , dit le Portugais avec une épouvantable"
Ponson-du-Terrail-Pierre_Les-Exploits-de-Rocambole_<Le vieux garde-3574>_83156,"avec une épouvantable bonhomie , j' oubliais que tu vas"
Ponson-du-Terrail-Pierre_Les-Exploits-de-Rocambole_<Le vieux garde-3574>_83159,"bonhomie , j' oubliais que tu vas te marier et"
Ponson-du-Terrail-Pierre_Les-Exploits-de-Rocambole_<Le vieux garde-3574>_83165,vas te marier et que tu as déjà revêtu ton
Ponson-du-Terrail-Pierre_Les-Exploits-de-Rocambole_<Le vieux garde-3574>_83169,"que tu as déjà revêtu ton vêtement nuptial , tu"
Ponson-du-Terrail-Pierre_Les-Exploits-de-Rocambole_<Le vieux garde-3574>_83173,"revêtu ton vêtement nuptial , tu sais , la chemise"
Ponson-du-Terrail-Pierre_Les-Exploits-de-Rocambole_<Le vieux garde-3574>_83190,archevêque de Grenade . Et Zampa mit la main sur
Ponson-du-Terrail-Pierre_Les-Exploits-de-Rocambole_<Le vieux garde-3574>_83198,main sur l' épaule de Rocambole et lui arracha sa
Ponson-du-Terrail-Pierre_Les-Exploits-de-Rocambole_<Le vieux garde-3574>_83200,l' épaule de Rocambole et lui arracha sa robe de
Ponson-du-Terrail-Pierre_Les-Exploits-de-Rocambole_<Le vieux garde-3574>_83201,épaule de Rocambole et lui arracha sa robe de moine
Ponson-du-Terrail-Pierre_Les-Exploits-de-Rocambole_<Le vieux garde-3574>_83202,de Rocambole et lui arracha sa robe de moine .
Ponson-du-Terrail-Pierre_Les-Exploits-de-Rocambole_<Le vieux garde-3574>_83208,robe de moine . Soudain Rocambole jeta un cri terrible
Ponson-du-Terrail-Pierre_Les-Exploits-de-Rocambole_<Le vieux garde-3574>_83219,la chemise de laine qu' il portait était rouge !
Ponson-du-Terrail-Pierre_Les-Exploits-de-Rocambole_<Le vieux garde-3574>_83236,". En même temps , Zampa s' approcha de la"
Ponson-du-Terrail-Pierre_Les-Exploits-de-Rocambole_<Le vieux garde-3574>_83252,"Cunégonde de Sallandrera , et il pressa un ressort ."
Ponson-du-Terrail-Pierre_Les-Exploits-de-Rocambole_<Le vieux garde-3574>_83302,"unir … Cet homme , Rocambole le reconnut . C'"
Ponson-du-Terrail-Pierre_Les-Exploits-de-Rocambole_<Le vieux garde-3574>_83318,"le vrai , celui que Rocambole croyait au fond des"
Ponson-du-Terrail-Pierre_Les-Exploits-de-Rocambole_<Le vieux garde-3574>_83330,la proie des poissons … Zampa tourna le bouton en
Ponson-du-Terrail-Pierre_Les-Exploits-de-Rocambole_<Le vieux garde-3574>_83352,"cérémonies du culte , dit - il . Rocambole s'"
Ponson-du-Terrail-Pierre_Les-Exploits-de-Rocambole_<Le vieux garde-3574>_83355,", dit - il . Rocambole s' appuyait au mur"
Ponson-du-Terrail-Pierre_Les-Exploits-de-Rocambole_<Le vieux garde-3574>_83365,pour ne pas tomber . Zampa reprit en ricanant :
Ponson-du-Terrail-Pierre_Les-Exploits-de-Rocambole_<Le vieux garde-3574>_83371,"reprit en ricanant : – Tu comprends , mon bonhomme"
Ponson-du-Terrail-Pierre_Les-Exploits-de-Rocambole_<Le vieux garde-3574>_83374,": – Tu comprends , mon bonhomme , qu' à"
Ponson-du-Terrail-Pierre_Les-Exploits-de-Rocambole_<Le vieux garde-3574>_83389,tout doit s' expliquer . J' ai appris cela dans
Ponson-du-Terrail-Pierre_Les-Exploits-de-Rocambole_<Le vieux garde-3574>_83415,"au dernier acte , et je vais te faire voir"
Ponson-du-Terrail-Pierre_Les-Exploits-de-Rocambole_<Le vieux garde-3574>_83417,"acte , et je vais te faire voir les trucs"
Ponson-du-Terrail-Pierre_Les-Exploits-de-Rocambole_<Le vieux garde-3574>_83433,"marquis de Chamery – pas toi , l' autre ,"
Ponson-du-Terrail-Pierre_Les-Exploits-de-Rocambole_<Le vieux garde-3574>_83462,pas plus été frappé que moi … J' avais enlevé
Ponson-du-Terrail-Pierre_Les-Exploits-de-Rocambole_<Le vieux garde-3574>_83464,été frappé que moi … J' avais enlevé les balles
Ponson-du-Terrail-Pierre_Les-Exploits-de-Rocambole_<Le vieux garde-3574>_83472,"les balles du revolver comme j' ai enlevé , quelques"
Ponson-du-Terrail-Pierre_Les-Exploits-de-Rocambole_<Le vieux garde-3574>_83493,"à la mer , comme je suis tombé dans le"
Ponson-du-Terrail-Pierre_Les-Exploits-de-Rocambole_<Le vieux garde-3574>_83507,". C' était convenu . Moi , j' ai fait"
Ponson-du-Terrail-Pierre_Les-Exploits-de-Rocambole_<Le vieux garde-3574>_83509,"était convenu . Moi , j' ai fait le mort"
Ponson-du-Terrail-Pierre_Les-Exploits-de-Rocambole_<Le vieux garde-3574>_83536,cents mètres plus loin . Tu sais que la nuit
Ponson-du-Terrail-Pierre_Les-Exploits-de-Rocambole_<Le vieux garde-3574>_83575,mademoiselle Conception . Ah ! dame ! tu sais bien
Ponson-du-Terrail-Pierre_Les-Exploits-de-Rocambole_<Le vieux garde-3574>_83577,. Ah ! dame ! tu sais bien que le
Ponson-du-Terrail-Pierre_Les-Exploits-de-Rocambole_<Le vieux garde-3574>_83619,"de vengeance ! … « Je t' assure , ajouta"
Ponson-du-Terrail-Pierre_Les-Exploits-de-Rocambole_<Le vieux garde-3574>_83620,"vengeance ! … « Je t' assure , ajouta Zampa"
Ponson-du-Terrail-Pierre_Les-Exploits-de-Rocambole_<Le vieux garde-3574>_83624,"Je t' assure , ajouta Zampa en riant , qu'"
Ponson-du-Terrail-Pierre_Les-Exploits-de-Rocambole_<Le vieux garde-3574>_83637,est pas fait prier pour t' écrire cette petite lettre
Ponson-du-Terrail-Pierre_Les-Exploits-de-Rocambole_<Le vieux garde-3574>_83643,écrire cette petite lettre qui t' a fait tomber dans
Ponson-du-Terrail-Pierre_Les-Exploits-de-Rocambole_<Le vieux garde-3574>_83657,derniers mots firent comprendre à Rocambole qu' il était perdu
Ponson-du-Terrail-Pierre_Les-Exploits-de-Rocambole_<Le vieux garde-3574>_83659,firent comprendre à Rocambole qu' il était perdu … Ce
Ponson-du-Terrail-Pierre_Les-Exploits-de-Rocambole_<Le vieux garde-3574>_83675,"l' héritage des Sallandrera qui lui échappaient , ce n'"
Ponson-du-Terrail-Pierre_Les-Exploits-de-Rocambole_<Le vieux garde-3574>_83682,", ce n' étaient plus son marquisat et son faux"
Ponson-du-Terrail-Pierre_Les-Exploits-de-Rocambole_<Le vieux garde-3574>_83685,étaient plus son marquisat et son faux nom qu' il
Ponson-du-Terrail-Pierre_Les-Exploits-de-Rocambole_<Le vieux garde-3574>_83690,son faux nom qu' il lui fallait abandonner – c'
Ponson-du-Terrail-Pierre_Les-Exploits-de-Rocambole_<Le vieux garde-3574>_83696,"fallait abandonner – c' était sa vie , sans doute"
Ponson-du-Terrail-Pierre_Les-Exploits-de-Rocambole_<Le vieux garde-3574>_83703,", sans doute , qu' il n' allait plus pouvoir"
Ponson-du-Terrail-Pierre_Les-Exploits-de-Rocambole_<Le vieux garde-3574>_83710,allait plus pouvoir soustraire à ses ennemis . Et il
Ponson-du-Terrail-Pierre_Les-Exploits-de-Rocambole_<Le vieux garde-3574>_83714,à ses ennemis . Et il eut peur comme jamais
Ponson-du-Terrail-Pierre_Les-Exploits-de-Rocambole_<Le vieux garde-3574>_83719,il eut peur comme jamais il n' avait eu peur
Ponson-du-Terrail-Pierre_Les-Exploits-de-Rocambole_<Le vieux garde-3574>_83726,"avait eu peur , et ses jambes fléchirent sous lui"
Ponson-du-Terrail-Pierre_Les-Exploits-de-Rocambole_<Le vieux garde-3574>_83730,"et ses jambes fléchirent sous lui , ses dents s'"
Ponson-du-Terrail-Pierre_Les-Exploits-de-Rocambole_<Le vieux garde-3574>_83732,"jambes fléchirent sous lui , ses dents s' entrechoquèrent ,"
Ponson-du-Terrail-Pierre_Les-Exploits-de-Rocambole_<Le vieux garde-3574>_83760,"bord de la Marne , il balbutia le mot :"
Ponson-du-Terrail-Pierre_Les-Exploits-de-Rocambole_<Le vieux garde-3574>_83769,: grâce ! … Mais Zampa haussa les épaules et
Ponson-du-Terrail-Pierre_Les-Exploits-de-Rocambole_<Le vieux garde-3574>_83774,Zampa haussa les épaules et pressa un autre ressort placé
Ponson-du-Terrail-Pierre_Les-Exploits-de-Rocambole_<Le vieux garde-3574>_83791,"représentait , à droite de Rocambole , une scène de"
Ponson-du-Terrail-Pierre_Les-Exploits-de-Rocambole_<Le vieux garde-3574>_83830,"dans ces trois hommes , Rocambole , éperdu , reconnut"
Ponson-du-Terrail-Pierre_Les-Exploits-de-Rocambole_<Le vieux garde-3574>_83847,"Puis , derrière eux , il aperçut un quatrième personnage"
Ponson-du-Terrail-Pierre_Les-Exploits-de-Rocambole_<Le vieux garde-3574>_83861,de ce personnage fut pour lui ce vers que le
Ponson-du-Terrail-Pierre_Les-Exploits-de-Rocambole_<Le vieux garde-3574>_83969,", comme ils disent . Rocambole fut pris de cet"
Ponson-du-Terrail-Pierre_Les-Exploits-de-Rocambole_<Le vieux garde-3574>_83979,"accès d' énergie vulgaire . Il redressa la tête ,"
Ponson-du-Terrail-Pierre_Les-Exploits-de-Rocambole_<Le vieux garde-3574>_83984,"Il redressa la tête , fit un pas en arrière"
Ponson-du-Terrail-Pierre_Les-Exploits-de-Rocambole_<Le vieux garde-3574>_83990,"un pas en arrière , mesura Baccarat du regard et"
Ponson-du-Terrail-Pierre_Les-Exploits-de-Rocambole_<Le vieux garde-3574>_83996,Baccarat du regard et lui dit d' un ton railleur
Ponson-du-Terrail-Pierre_Les-Exploits-de-Rocambole_<Le vieux garde-3574>_84005,railleur : – Ah ! je savais bien que vous
Ponson-du-Terrail-Pierre_Les-Exploits-de-Rocambole_<Le vieux garde-3574>_84009,! je savais bien que vous étiez derrière cet homme
Ponson-du-Terrail-Pierre_Les-Exploits-de-Rocambole_<Le vieux garde-3574>_84015,"étiez derrière cet homme , vous ! Il n' était"
Ponson-du-Terrail-Pierre_Les-Exploits-de-Rocambole_<Le vieux garde-3574>_84024,était pas de force à me rouler . – Rocambole
Ponson-du-Terrail-Pierre_Les-Exploits-de-Rocambole_<Le vieux garde-3574>_84028,"à me rouler . – Rocambole , répondit la comtesse"
Ponson-du-Terrail-Pierre_Les-Exploits-de-Rocambole_<Le vieux garde-3574>_84047,! … l' heure de votre châtiment est venue !
Ponson-du-Terrail-Pierre_Les-Exploits-de-Rocambole_<Le vieux garde-3574>_84057,– Eh bien ! dit - il en jurant et
Ponson-du-Terrail-Pierre_Les-Exploits-de-Rocambole_<Le vieux garde-3574>_84065,"jurant et en blasphémant , je me moque de vous"
Ponson-du-Terrail-Pierre_Les-Exploits-de-Rocambole_<Le vieux garde-3574>_84071,"me moque de vous , je vous brave ! …"
Ponson-du-Terrail-Pierre_Les-Exploits-de-Rocambole_<Le vieux garde-3574>_84078,"brave ! … Vous pouvez me tuer , que m'"
Ponson-du-Terrail-Pierre_Les-Exploits-de-Rocambole_<Le vieux garde-3574>_84082,"pouvez me tuer , que m' importe ! je n'"
Ponson-du-Terrail-Pierre_Les-Exploits-de-Rocambole_<Le vieux garde-3574>_84085,", que m' importe ! je n' en ai pas"
Ponson-du-Terrail-Pierre_Les-Exploits-de-Rocambole_<Le vieux garde-3574>_84101,"d' un Grand d' Espagne m' a aimé , une"
Ponson-du-Terrail-Pierre_Les-Exploits-de-Rocambole_<Le vieux garde-3574>_84107,"a aimé , une vicomtesse m' a appelé son frère"
Ponson-du-Terrail-Pierre_Les-Exploits-de-Rocambole_<Le vieux garde-3574>_84118,"et , acheva - t - il avec un rire"
Ponson-du-Terrail-Pierre_Les-Exploits-de-Rocambole_<Le vieux garde-3574>_84125,"avec un rire sinistre , je vous ai fait passer"
Ponson-du-Terrail-Pierre_Les-Exploits-de-Rocambole_<Le vieux garde-3574>_84157,"on vous appelait , et j' ai rendu votre mari"
Ponson-du-Terrail-Pierre_Les-Exploits-de-Rocambole_<Le vieux garde-3574>_84166,"mari fou ! … Tuez - moi donc , maintenant"
Ponson-du-Terrail-Pierre_Les-Exploits-de-Rocambole_<Le vieux garde-3574>_84172,"moi donc , maintenant , j' ai vengé ma mort"
Ponson-du-Terrail-Pierre_Les-Exploits-de-Rocambole_<Le vieux garde-3574>_84175,"maintenant , j' ai vengé ma mort par avance !"
Ponson-du-Terrail-Pierre_Les-Exploits-de-Rocambole_<Le vieux garde-3574>_84182,par avance ! … Et il la menaçait du regard
Ponson-du-Terrail-Pierre_Les-Exploits-de-Rocambole_<Le vieux garde-3574>_84201,Williams semblait être passée en lui … Mais la comtesse
Ponson-du-Terrail-Pierre_Les-Exploits-de-Rocambole_<Le vieux garde-3574>_84211,"répondit avec calme : – Vous vous trompez , Rocambole"
Ponson-du-Terrail-Pierre_Les-Exploits-de-Rocambole_<Le vieux garde-3574>_84215,"– Vous vous trompez , Rocambole , on ne vous"
Ponson-du-Terrail-Pierre_Les-Exploits-de-Rocambole_<Le vieux garde-3574>_84219,", Rocambole , on ne vous tuera pas ! …"
Ponson-du-Terrail-Pierre_Les-Exploits-de-Rocambole_<Le vieux garde-3574>_84224,vous tuera pas ! … Il haussa les épaules .
Ponson-du-Terrail-Pierre_Les-Exploits-de-Rocambole_<Le vieux garde-3574>_84236,- ce que vous voulez me donner le prix Montyon
Ponson-du-Terrail-Pierre_Les-Exploits-de-Rocambole_<Le vieux garde-3574>_84249,", par hasard ? dit - il en ricanant ."
Ponson-du-Terrail-Pierre_Les-Exploits-de-Rocambole_<Le vieux garde-3574>_84256,"en ricanant . – Regardez votre habit , poursuivit lentement"
Ponson-du-Terrail-Pierre_Les-Exploits-de-Rocambole_<Le vieux garde-3574>_84282,"le brasier , on va vous le river à la"
Ponson-du-Terrail-Pierre_Les-Exploits-de-Rocambole_<Le vieux garde-3574>_84292,cheville … La mort pour vous ne serait point un
Ponson-du-Terrail-Pierre_Les-Exploits-de-Rocambole_<Le vieux garde-3574>_84299,"serait point un châtiment , Rocambole ; c' est la"
Ponson-du-Terrail-Pierre_Les-Exploits-de-Rocambole_<Le vieux garde-3574>_84314,"est le fouet tombant sur vos épaules , c' est"
Ponson-du-Terrail-Pierre_Les-Exploits-de-Rocambole_<Le vieux garde-3574>_84327,"bonnet vert qui doivent être votre châtiment , à vous"
Ponson-du-Terrail-Pierre_Les-Exploits-de-Rocambole_<Le vieux garde-3574>_84331,"être votre châtiment , à vous dont on a vanté"
Ponson-du-Terrail-Pierre_Les-Exploits-de-Rocambole_<Le vieux garde-3574>_84332,"votre châtiment , à vous dont on a vanté les"
Ponson-du-Terrail-Pierre_Les-Exploits-de-Rocambole_<Le vieux garde-3574>_84343,", les maîtresses , à vous qui avez brillé dans"
Ponson-du-Terrail-Pierre_Les-Exploits-de-Rocambole_<Le vieux garde-3574>_84344,"les maîtresses , à vous qui avez brillé dans le"
Ponson-du-Terrail-Pierre_Les-Exploits-de-Rocambole_<Le vieux garde-3574>_84352,dans le monde parisien et qu' on a salué du
Ponson-du-Terrail-Pierre_Les-Exploits-de-Rocambole_<Le vieux garde-3574>_84394,"ses aides s' emparèrent de Rocambole , qui poussa des"
Ponson-du-Terrail-Pierre_Les-Exploits-de-Rocambole_<Le vieux garde-3574>_84396,"s' emparèrent de Rocambole , qui poussa des cris étouffés"
Ponson-du-Terrail-Pierre_Les-Exploits-de-Rocambole_<Le vieux garde-3574>_84402,poussa des cris étouffés et voulut se débattre . Mais
Ponson-du-Terrail-Pierre_Les-Exploits-de-Rocambole_<Le vieux garde-3574>_84410,. Mais des mains robustes le saisirent à la gorge
Ponson-du-Terrail-Pierre_Les-Exploits-de-Rocambole_<Le vieux garde-3574>_84420,", tandis que d' autres le maintenaient immobile , la"
Ponson-du-Terrail-Pierre_Les-Exploits-de-Rocambole_<Le vieux garde-3574>_84458,"encore , à la cheville du nouveau forçat . –"
Ponson-du-Terrail-Pierre_Les-Exploits-de-Rocambole_<Le vieux garde-3574>_84463,"du nouveau forçat . – Rocambole , dit alors Baccarat"
Ponson-du-Terrail-Pierre_Les-Exploits-de-Rocambole_<Le vieux garde-3574>_84469,", dit alors Baccarat , vous aviez fait envoyer au"
Ponson-du-Terrail-Pierre_Les-Exploits-de-Rocambole_<Le vieux garde-3574>_84485,", il est juste que vous alliez y prendre sa"
Ponson-du-Terrail-Pierre_Les-Exploits-de-Rocambole_<Le vieux garde-3574>_84501,dans le monde celle que vous lui avez volée …
Ponson-du-Terrail-Pierre_Les-Exploits-de-Rocambole_<Le vieux garde-3574>_84510,"… – Oh ! vociféra le condamné , j' en"
Ponson-du-Terrail-Pierre_Les-Exploits-de-Rocambole_<Le vieux garde-3574>_84513,"! vociféra le condamné , j' en appellerai à la"
Ponson-du-Terrail-Pierre_Les-Exploits-de-Rocambole_<Le vieux garde-3574>_84526,à la justice régulière … je crierai si haut qu'
