,text_surronding
Proust-Marcel_Du-cote-de-chez-Swann-A-la-recherche-du-temps-perdu_<Gilberte-8126>_201150,pas voir Gilberte — comme j' avais appris que Mme
Proust-Marcel_Du-cote-de-chez-Swann-A-la-recherche-du-temps-perdu_<Gilberte-8126>_201185,"« Reine Marguerite » , je dirigeais Françoise du côté"
Proust-Marcel_Du-cote-de-chez-Swann-A-la-recherche-du-temps-perdu_<Gilberte-8126>_201198,Boulogne . Il était pour moi comme ces jardins zoologiques
Proust-Marcel_Du-cote-de-chez-Swann-A-la-recherche-du-temps-perdu_<Odette-5878>_138735,qui avait réuni Swann et Odette devint un obstacle à
Proust-Marcel_Du-cote-de-chez-Swann-A-la-recherche-du-temps-perdu_<Odette-5878>_138745,leur rendez - vous . Elle ne lui disait plus
Proust-Marcel_Du-cote-de-chez-Swann-A-la-recherche-du-temps-perdu_<Odette-5878>_138825,lisait dans les yeux d' Odette cet effroi qu' il
Proust-Marcel_Du-cote-de-chez-Swann-A-la-recherche-du-temps-perdu_<Odette-5878>_138830,Odette cet effroi qu' il lui demandât de n' y
Proust-Marcel_Du-cote-de-chez-Swann-A-la-recherche-du-temps-perdu_<Odette-5878>_138891,en voyant l' envie qu' elle a d' aller picorer
Proust-Marcel_Du-cote-de-chez-Swann-A-la-recherche-du-temps-perdu_<Odette-5878>_138914,"pour moi , mais pour elle ; du chagrin de"
Proust-Marcel_Du-cote-de-chez-Swann-A-la-recherche-du-temps-perdu_<Odette-5878>_138934,"contact quotidien avec moi , elle n' a pas su"
Proust-Marcel_Du-cote-de-chez-Swann-A-la-recherche-du-temps-perdu_<Odette-5878>_138985,on le lui demande . Elle devrait savoir dire «
Proust-Marcel_Du-cote-de-chez-Swann-A-la-recherche-du-temps-perdu_<Odette-5878>_139008,", puisque c' est sur sa réponse qu' on classera"
Proust-Marcel_Du-cote-de-chez-Swann-A-la-recherche-du-temps-perdu_<Odette-5878>_139017,classera une fois pour toutes sa qualité d' âme .
Proust-Marcel_Du-cote-de-chez-Swann-A-la-recherche-du-temps-perdu_<Odette-5878>_139049,sur la valeur spirituelle d' Odette qu' il désirait que
Proust-Marcel_Du-cote-de-chez-Swann-A-la-recherche-du-temps-perdu_<Odette-5878>_139058,que ce soir - là elle restât avec lui au
Proust-Marcel_Du-cote-de-chez-Swann-A-la-recherche-du-temps-perdu_<Odette-5878>_139073,"Opéra - Comique , il lui tenait le même raisonnement"
Proust-Marcel_Du-cote-de-chez-Swann-A-la-recherche-du-temps-perdu_<Odette-5878>_139107,obéissait aussi au désir de la prendre par l' amour
Proust-Marcel_Du-cote-de-chez-Swann-A-la-recherche-du-temps-perdu_<Odette-5878>_139117,"- propre . — Je te jure , lui disait"
Proust-Marcel_Du-cote-de-chez-Swann-A-la-recherche-du-temps-perdu_<Odette-5878>_139120,"— Je te jure , lui disait - il ,"
Proust-Marcel_Du-cote-de-chez-Swann-A-la-recherche-du-temps-perdu_<Odette-5878>_139129,", quelques instants avant qu' elle partît pour le théâtre"
Proust-Marcel_Du-cote-de-chez-Swann-A-la-recherche-du-temps-perdu_<Odette-5878>_139137,"le théâtre , qu' en te demandant de ne pas"
Proust-Marcel_Du-cote-de-chez-Swann-A-la-recherche-du-temps-perdu_<Odette-5878>_139156,"égoïste , seraient pour que tu me refuses , car"
Proust-Marcel_Du-cote-de-chez-Swann-A-la-recherche-du-temps-perdu_<Odette-5878>_139186,ennuyé si contre toute attente tu me réponds que tu
Proust-Marcel_Du-cote-de-chez-Swann-A-la-recherche-du-temps-perdu_<Odette-5878>_139190,attente tu me réponds que tu n' iras pas .
Proust-Marcel_Du-cote-de-chez-Swann-A-la-recherche-du-temps-perdu_<Odette-5878>_139211,", je dois penser à toi . Il peut venir"
Proust-Marcel_Du-cote-de-chez-Swann-A-la-recherche-du-temps-perdu_<Odette-5878>_139225,voyant à jamais détaché de toi tu auras le droit
Proust-Marcel_Du-cote-de-chez-Swann-A-la-recherche-du-temps-perdu_<Odette-5878>_139226,à jamais détaché de toi tu auras le droit de
Proust-Marcel_Du-cote-de-chez-Swann-A-la-recherche-du-temps-perdu_<Odette-5878>_139236,me reprocher de ne pas t' avoir avertie dans les
Proust-Marcel_Du-cote-de-chez-Swann-A-la-recherche-du-temps-perdu_<Odette-5878>_139251,que j' allais porter sur toi un de ces jugements
Proust-Marcel_Du-cote-de-chez-Swann-A-la-recherche-du-temps-perdu_<Odette-5878>_139266,"résiste pas longtemps . Vois - tu , « Une"
Proust-Marcel_Du-cote-de-chez-Swann-A-la-recherche-du-temps-perdu_<Odette-5878>_139297,", c' est si vraiment tu es cet être qui"
Proust-Marcel_Du-cote-de-chez-Swann-A-la-recherche-du-temps-perdu_<Odette-5878>_139299,est si vraiment tu es cet être qui est au
Proust-Marcel_Du-cote-de-chez-Swann-A-la-recherche-du-temps-perdu_<Odette-5878>_139301,vraiment tu es cet être qui est au dernier rang
Proust-Marcel_Du-cote-de-chez-Swann-A-la-recherche-du-temps-perdu_<Odette-5878>_139315,"et même du charme , l' être méprisable qui n'"
Proust-Marcel_Du-cote-de-chez-Swann-A-la-recherche-du-temps-perdu_<Odette-5878>_139318,"charme , l' être méprisable qui n' est pas capable"
Proust-Marcel_Du-cote-de-chez-Swann-A-la-recherche-du-temps-perdu_<Odette-5878>_139332,"plaisir . Alors , si tu es cela , comment"
Proust-Marcel_Du-cote-de-chez-Swann-A-la-recherche-du-temps-perdu_<Odette-5878>_139340,", comment pourrait - on t' aimer , car tu"
Proust-Marcel_Du-cote-de-chez-Swann-A-la-recherche-du-temps-perdu_<Odette-5878>_139344,"on t' aimer , car tu n' es même pas"
Proust-Marcel_Du-cote-de-chez-Swann-A-la-recherche-du-temps-perdu_<Odette-5878>_139363,mais du moins perfectible . Tu es une eau informe
Proust-Marcel_Du-cote-de-chez-Swann-A-la-recherche-du-temps-perdu_<Odette-5878>_139413,de l' eau . Comprends - tu que ta réponse
Proust-Marcel_Du-cote-de-chez-Swann-A-la-recherche-du-temps-perdu_<Odette-5878>_139416,". Comprends - tu que ta réponse , je ne"
Proust-Marcel_Du-cote-de-chez-Swann-A-la-recherche-du-temps-perdu_<Odette-5878>_139430,"effet que je cesserai de t' aimer immédiatement , bien"
Proust-Marcel_Du-cote-de-chez-Swann-A-la-recherche-du-temps-perdu_<Odette-5878>_139438,", bien entendu , mais te rendra moins séduisante à"
Proust-Marcel_Du-cote-de-chez-Swann-A-la-recherche-du-temps-perdu_<Odette-5878>_139449,yeux quand je comprendrai que tu n' es pas une
Proust-Marcel_Du-cote-de-chez-Swann-A-la-recherche-du-temps-perdu_<Odette-5878>_139457,"pas une personne , que tu es au - dessous"
Proust-Marcel_Du-cote-de-chez-Swann-A-la-recherche-du-temps-perdu_<Odette-5878>_139468,toutes les choses et ne sais te placer au -
Proust-Marcel_Du-cote-de-chez-Swann-A-la-recherche-du-temps-perdu_<Odette-5878>_139469,les choses et ne sais te placer au - dessus
Proust-Marcel_Du-cote-de-chez-Swann-A-la-recherche-du-temps-perdu_<Odette-5878>_139482,Évidemment j' aurais mieux aimé te demander comme une chose
Proust-Marcel_Du-cote-de-chez-Swann-A-la-recherche-du-temps-perdu_<Odette-5878>_139500,de Cléopâtre » ( puisque tu m' obliges à me
Proust-Marcel_Du-cote-de-chez-Swann-A-la-recherche-du-temps-perdu_<Odette-5878>_139517,) dans l' espoir que tu irais cependant . Mais
Proust-Marcel_Du-cote-de-chez-Swann-A-la-recherche-du-temps-perdu_<Odette-5878>_139536,"tirer de telles conséquences de ta réponse , j' ai"
Proust-Marcel_Du-cote-de-chez-Swann-A-la-recherche-du-temps-perdu_<Odette-5878>_139545,ai trouvé plus loyal de t' en prévenir . Odette
Proust-Marcel_Du-cote-de-chez-Swann-A-la-recherche-du-temps-perdu_<Odette-5878>_139549,de t' en prévenir . Odette depuis un moment donnait
Proust-Marcel_Du-cote-de-chez-Swann-A-la-recherche-du-temps-perdu_<Odette-5878>_139570,"sens de ce discours , elle comprenait qu' il pouvait"
Proust-Marcel_Du-cote-de-chez-Swann-A-la-recherche-du-temps-perdu_<Odette-5878>_139595,supplications dont l' habitude qu' elle avait des hommes lui
Proust-Marcel_Du-cote-de-chez-Swann-A-la-recherche-du-temps-perdu_<Odette-5878>_139599,"qu' elle avait des hommes lui permettait , sans s'"
Proust-Marcel_Du-cote-de-chez-Swann-A-la-recherche-du-temps-perdu_<Odette-5878>_139651,plus après . Aussi aurait - elle écouté Swann avec
Proust-Marcel_Du-cote-de-chez-Swann-A-la-recherche-du-temps-perdu_<Odette-5878>_139654,Aussi aurait - elle écouté Swann avec le plus grand
Proust-Marcel_Du-cote-de-chez-Swann-A-la-recherche-du-temps-perdu_<Odette-5878>_139661,le plus grand calme si elle n' avait vu que
Proust-Marcel_Du-cote-de-chez-Swann-A-la-recherche-du-temps-perdu_<Odette-5878>_139674,et que pour peu qu' il parlât encore quelque temps
Proust-Marcel_Du-cote-de-chez-Swann-A-la-recherche-du-temps-perdu_<Odette-5878>_139680,"parlât encore quelque temps , elle allait , comme elle"
Proust-Marcel_Du-cote-de-chez-Swann-A-la-recherche-du-temps-perdu_<Odette-5878>_139684,", elle allait , comme elle le lui dit avec"
Proust-Marcel_Du-cote-de-chez-Swann-A-la-recherche-du-temps-perdu_<Odette-5878>_139686,"allait , comme elle le lui dit avec un sourire"
Proust-Marcel_Du-cote-de-chez-Swann-A-la-recherche-du-temps-perdu_<Odette-5878>_139707,Ouverture ! »D' autres fois il lui disait que ce
Proust-Marcel_Du-cote-de-chez-Swann-A-la-recherche-du-temps-perdu_<Odette-5878>_139708,! »D' autres fois il lui disait que ce qui
Proust-Marcel_Du-cote-de-chez-Swann-A-la-recherche-du-temps-perdu_<Odette-5878>_139718,plus que tout ferait qu' il cesserait de l' aimer
Proust-Marcel_Du-cote-de-chez-Swann-A-la-recherche-du-temps-perdu_<Odette-5878>_139721,"ferait qu' il cesserait de l' aimer , c' est"
Proust-Marcel_Du-cote-de-chez-Swann-A-la-recherche-du-temps-perdu_<Odette-5878>_139727,"aimer , c' est qu' elle ne voulût pas renoncer"
Proust-Marcel_Du-cote-de-chez-Swann-A-la-recherche-du-temps-perdu_<Odette-5878>_139746,"vue de la coquetterie , lui disait - il ,"
Proust-Marcel_Du-cote-de-chez-Swann-A-la-recherche-du-temps-perdu_<Odette-5878>_139748,"la coquetterie , lui disait - il , ne comprends"
Proust-Marcel_Du-cote-de-chez-Swann-A-la-recherche-du-temps-perdu_<Odette-5878>_139753,"- il , ne comprends - tu donc pas combien"
Proust-Marcel_Du-cote-de-chez-Swann-A-la-recherche-du-temps-perdu_<Odette-5878>_139758,- tu donc pas combien tu perds de ta séduction
Proust-Marcel_Du-cote-de-chez-Swann-A-la-recherche-du-temps-perdu_<Odette-5878>_139761,pas combien tu perds de ta séduction en t' abaissant
Proust-Marcel_Du-cote-de-chez-Swann-A-la-recherche-du-temps-perdu_<Odette-5878>_139764,perds de ta séduction en t' abaissant à mentir ?
Proust-Marcel_Du-cote-de-chez-Swann-A-la-recherche-du-temps-perdu_<Odette-5878>_139776,"aveu , combien de fautes tu pourrais racheter ! Vraiment"
Proust-Marcel_Du-cote-de-chez-Swann-A-la-recherche-du-temps-perdu_<Odette-5878>_139781,tu pourrais racheter ! Vraiment tu es bien moins intelligente
Proust-Marcel_Du-cote-de-chez-Swann-A-la-recherche-du-temps-perdu_<Odette-5878>_139787,es bien moins intelligente que je ne croyais ! »
Proust-Marcel_Du-cote-de-chez-Swann-A-la-recherche-du-temps-perdu_<Odette-5878>_139798,c' est en vain que Swann lui exposait ainsi toutes
Proust-Marcel_Du-cote-de-chez-Swann-A-la-recherche-du-temps-perdu_<Odette-5878>_139799,est en vain que Swann lui exposait ainsi toutes les
Proust-Marcel_Du-cote-de-chez-Swann-A-la-recherche-du-temps-perdu_<Odette-5878>_139806,ainsi toutes les raisons qu' elle avait de ne pas
Proust-Marcel_Du-cote-de-chez-Swann-A-la-recherche-du-temps-perdu_<Odette-5878>_139818,elles auraient pu ruiner chez Odette un système général du
Proust-Marcel_Du-cote-de-chez-Swann-A-la-recherche-du-temps-perdu_<Odette-5878>_139826,général du mensonge ; mais Odette n' en possédait pas
Proust-Marcel_Du-cote-de-chez-Swann-A-la-recherche-du-temps-perdu_<Odette-5878>_139832,"n' en possédait pas ; elle se contentait seulement ,"
Proust-Marcel_Du-cote-de-chez-Swann-A-la-recherche-du-temps-perdu_<Odette-5878>_139841,", dans chaque cas où elle voulait que Swann ignorât"
Proust-Marcel_Du-cote-de-chez-Swann-A-la-recherche-du-temps-perdu_<Odette-5878>_139844,cas où elle voulait que Swann ignorât quelque chose qu'
Proust-Marcel_Du-cote-de-chez-Swann-A-la-recherche-du-temps-perdu_<Odette-5878>_139849,"Swann ignorât quelque chose qu' elle avait fait , de"
Proust-Marcel_Du-cote-de-chez-Swann-A-la-recherche-du-temps-perdu_<Odette-5878>_139857,", de ne pas le lui dire . Ainsi le"
Proust-Marcel_Du-cote-de-chez-Swann-A-la-recherche-du-temps-perdu_<Odette-5878>_139865,Ainsi le mensonge était pour elle un expédient d' ordre
Proust-Marcel_Du-cote-de-chez-Swann-A-la-recherche-du-temps-perdu_<Odette-5878>_139879,qui seul pouvait décider si elle devait s' en servir
Proust-Marcel_Du-cote-de-chez-Swann-A-la-recherche-du-temps-perdu_<Odette-5878>_139910,il y avait pour que Swann pût découvrir qu' elle
Proust-Marcel_Du-cote-de-chez-Swann-A-la-recherche-du-temps-perdu_<Odette-5878>_139914,que Swann pût découvrir qu' elle n' avait pas dit
Proust-Marcel_Du-cote-de-chez-Swann-A-la-recherche-du-temps-perdu_<Odette-5878>_139924,"la vérité . Physiquement , elle traversait une mauvaise phase"
Proust-Marcel_Du-cote-de-chez-Swann-A-la-recherche-du-temps-perdu_<Odette-5878>_139930,traversait une mauvaise phase : elle épaississait ; et le
Proust-Marcel_Du-cote-de-chez-Swann-A-la-recherche-du-temps-perdu_<Odette-5878>_139946,regards étonnés et rêveurs qu' elle avait autrefois semblaient avoir
Proust-Marcel_Du-cote-de-chez-Swann-A-la-recherche-du-temps-perdu_<Odette-5878>_139953,autrefois semblaient avoir disparu avec sa première jeunesse . De
Proust-Marcel_Du-cote-de-chez-Swann-A-la-recherche-du-temps-perdu_<Odette-5878>_139960,jeunesse . De sorte qu' elle était devenue si chère
Proust-Marcel_Du-cote-de-chez-Swann-A-la-recherche-du-temps-perdu_<Odette-5878>_139966,était devenue si chère à Swann au moment pour ainsi
Proust-Marcel_Du-cote-de-chez-Swann-A-la-recherche-du-temps-perdu_<Odette-5878>_139973,moment pour ainsi dire où il la trouvait précisément bien
Proust-Marcel_Du-cote-de-chez-Swann-A-la-recherche-du-temps-perdu_<Odette-5878>_139974,pour ainsi dire où il la trouvait précisément bien moins
Proust-Marcel_Du-cote-de-chez-Swann-A-la-recherche-du-temps-perdu_<Odette-5878>_139981,précisément bien moins jolie . Il la regardait longuement pour
Proust-Marcel_Du-cote-de-chez-Swann-A-la-recherche-du-temps-perdu_<Odette-5878>_139982,bien moins jolie . Il la regardait longuement pour tâcher
Proust-Marcel_Du-cote-de-chez-Swann-A-la-recherche-du-temps-perdu_<Odette-5878>_139992,"de ressaisir le charme qu' il lui avait connu ,"
Proust-Marcel_Du-cote-de-chez-Swann-A-la-recherche-du-temps-perdu_<Odette-5878>_139993,"ressaisir le charme qu' il lui avait connu , et"
Proust-Marcel_Du-cote-de-chez-Swann-A-la-recherche-du-temps-perdu_<Odette-5878>_140014,"nouvelle , c' était toujours Odette qui vivait , toujours"
Proust-Marcel_Du-cote-de-chez-Swann-A-la-recherche-du-temps-perdu_<Odette-5878>_140030,"et sournoise , suffisait à Swann pour qu' il continuât"
Proust-Marcel_Du-cote-de-chez-Swann-A-la-recherche-du-temps-perdu_<Odette-5878>_140033,suffisait à Swann pour qu' il continuât de mettre la
Proust-Marcel_Du-cote-de-chez-Swann-A-la-recherche-du-temps-perdu_<Odette-5878>_140043,même passion à chercher à la capter . Puis il
Proust-Marcel_Du-cote-de-chez-Swann-A-la-recherche-du-temps-perdu_<Odette-5878>_140047,à la capter . Puis il regardait des photographies d'
Proust-Marcel_Du-cote-de-chez-Swann-A-la-recherche-du-temps-perdu_<Odette-5878>_140058,"y avait deux ans , il se rappelait comme elle"
Proust-Marcel_Du-cote-de-chez-Swann-A-la-recherche-du-temps-perdu_<Odette-5878>_140062,", il se rappelait comme elle avait été délicieuse ."
Proust-Marcel_Du-cote-de-chez-Swann-A-la-recherche-du-temps-perdu_<Odette-5878>_140069,été délicieuse . Et cela le consolait un peu de
Proust-Marcel_Du-cote-de-chez-Swann-A-la-recherche-du-temps-perdu_<Odette-5878>_140080,donner tant de mal pour elle . Quand les Verdurin
Proust-Marcel_Du-cote-de-chez-Swann-A-la-recherche-du-temps-perdu_<Odette-5878>_140085,elle . Quand les Verdurin l' emmenaient à Saint -
Proust-Marcel_Du-cote-de-chez-Swann-A-la-recherche-du-temps-perdu_<Odette-5878>_140133,cherchait à apaiser les scrupules du pianiste dont la tante
Proust-Marcel_Du-cote-de-chez-Swann-A-la-recherche-du-temps-perdu_<Odette-5878>_140135,apaiser les scrupules du pianiste dont la tante était restée
Proust-Marcel_Du-cote-de-chez-Swann-A-la-recherche-du-temps-perdu_<Odette-5878>_140151,enchantée d' être débarrassée de vous pour un jour .
Proust-Marcel_Du-cote-de-chez-Swann-A-la-recherche-du-temps-perdu_<Odette-5878>_140164,"inquiéterait - elle , elle vous sait avec nous ;"
Proust-Marcel_Du-cote-de-chez-Swann-A-la-recherche-du-temps-perdu_<Odette-5878>_140186,"n' y réussissait pas , M . Verdurin partait en"
Proust-Marcel_Du-cote-de-chez-Swann-A-la-recherche-du-temps-perdu_<Odette-5878>_140217,à faire prévenir . Mais Odette le remerciait et disait
Proust-Marcel_Du-cote-de-chez-Swann-A-la-recherche-du-temps-perdu_<Odette-5878>_140218,faire prévenir . Mais Odette le remerciait et disait qu'
Proust-Marcel_Du-cote-de-chez-Swann-A-la-recherche-du-temps-perdu_<Odette-5878>_140221,Mais Odette le remerciait et disait qu' elle n' avait
Proust-Marcel_Du-cote-de-chez-Swann-A-la-recherche-du-temps-perdu_<Odette-5878>_140223,le remerciait et disait qu' elle n' avait de dépêche
Proust-Marcel_Du-cote-de-chez-Swann-A-la-recherche-du-temps-perdu_<Odette-5878>_140234,"faire pour personne , car elle avait dit à Swann"
Proust-Marcel_Du-cote-de-chez-Swann-A-la-recherche-du-temps-perdu_<Odette-5878>_140255,"aux yeux de tous , elle se compromettrait . Parfois"
Proust-Marcel_Du-cote-de-chez-Swann-A-la-recherche-du-temps-perdu_<Odette-5878>_140266,"était pour plusieurs jours qu' elle s' absentait , les"
Proust-Marcel_Du-cote-de-chez-Swann-A-la-recherche-du-temps-perdu_<Odette-5878>_140309,Pierrefonds . — Penser qu' elle pourrait visiter de vrais
Proust-Marcel_Du-cote-de-chez-Swann-A-la-recherche-du-temps-perdu_<Odette-5878>_140316,visiter de vrais monuments avec moi qui ai étudié l'
Proust-Marcel_Du-cote-de-chez-Swann-A-la-recherche-du-temps-perdu_<Odette-5878>_140317,de vrais monuments avec moi qui ai étudié l' architecture
Proust-Marcel_Du-cote-de-chez-Swann-A-la-recherche-du-temps-perdu_<Odette-5878>_140326,architecture pendant dix ans et qui suis tout le temps
Proust-Marcel_Du-cote-de-chez-Swann-A-la-recherche-du-temps-perdu_<Odette-5878>_140358,"ne le ferais que pour elle , et qu' à"
Proust-Marcel_Du-cote-de-chez-Swann-A-la-recherche-du-temps-perdu_<Odette-5878>_140365,et qu' à la place elle va avec les dernières
Proust-Marcel_Du-cote-de-chez-Swann-A-la-recherche-du-temps-perdu_<Odette-5878>_140393,le - Duc ! Il me semble qu' il n'
Proust-Marcel_Du-cote-de-chez-Swann-A-la-recherche-du-temps-perdu_<Odette-5878>_140438,des excréments . Mais quand elle était partie pour Dreux
Proust-Marcel_Du-cote-de-chez-Swann-A-la-recherche-du-temps-perdu_<Odette-5878>_140450,"Pierrefonds — hélas , sans lui permettre d' y aller"
Proust-Marcel_Du-cote-de-chez-Swann-A-la-recherche-du-temps-perdu_<Odette-5878>_140461,"comme par hasard , de son côté , car «"
Proust-Marcel_Du-cote-de-chez-Swann-A-la-recherche-du-temps-perdu_<Odette-5878>_140474,"effet déplorable » , disait - elle — il se"
Proust-Marcel_Du-cote-de-chez-Swann-A-la-recherche-du-temps-perdu_<Odette-5878>_140477,", disait - elle — il se plongeait dans le"
Proust-Marcel_Du-cote-de-chez-Swann-A-la-recherche-du-temps-perdu_<Odette-5878>_140497,"chemins de fer , qui lui apprenait les moyens de"
Proust-Marcel_Du-cote-de-chez-Swann-A-la-recherche-du-temps-perdu_<Odette-5878>_140502,"lui apprenait les moyens de la rejoindre , l' après"
Proust-Marcel_Du-cote-de-chez-Swann-A-la-recherche-du-temps-perdu_<Odette-5878>_140590,pour lequel la permission d' Odette était superflue ; et
Proust-Marcel_Du-cote-de-chez-Swann-A-la-recherche-du-temps-perdu_<Odette-5878>_140612,"que le désir de rencontrer Odette , puisque des gens"
Proust-Marcel_Du-cote-de-chez-Swann-A-la-recherche-du-temps-perdu_<Odette-5878>_140619,puisque des gens qui ne la connaissaient pas l' accomplissaient
Proust-Marcel_Du-cote-de-chez-Swann-A-la-recherche-du-temps-perdu_<Odette-5878>_140645,des locomotives . En somme elle ne pouvait tout de
Proust-Marcel_Du-cote-de-chez-Swann-A-la-recherche-du-temps-perdu_<Odette-5878>_140652,pouvait tout de même pas l' empêcher d' aller à
Proust-Marcel_Du-cote-de-chez-Swann-A-la-recherche-du-temps-perdu_<Odette-5878>_140659,d' aller à Pierrefonds s' il en avait envie !
Proust-Marcel_Du-cote-de-chez-Swann-A-la-recherche-du-temps-perdu_<Odette-5878>_140668,"! Or , justement , il sentait qu' il en"
Proust-Marcel_Du-cote-de-chez-Swann-A-la-recherche-du-temps-perdu_<Odette-5878>_140671,"justement , il sentait qu' il en avait envie ,"
Proust-Marcel_Du-cote-de-chez-Swann-A-la-recherche-du-temps-perdu_<Odette-5878>_140679,"envie , et que s' il n' avait pas connu"
Proust-Marcel_Du-cote-de-chez-Swann-A-la-recherche-du-temps-perdu_<Odette-5878>_140684,"il n' avait pas connu Odette , certainement il y"
Proust-Marcel_Du-cote-de-chez-Swann-A-la-recherche-du-temps-perdu_<Odette-5878>_140687,"pas connu Odette , certainement il y serait allé ."
Proust-Marcel_Du-cote-de-chez-Swann-A-la-recherche-du-temps-perdu_<Odette-5878>_140697,Il y avait longtemps qu' il voulait se faire une
Proust-Marcel_Du-cote-de-chez-Swann-A-la-recherche-du-temps-perdu_<Odette-5878>_140721,"Et par le temps qu' il faisait , il éprouvait"
Proust-Marcel_Du-cote-de-chez-Swann-A-la-recherche-du-temps-perdu_<Odette-5878>_140724,"temps qu' il faisait , il éprouvait l' impérieux désir"
Proust-Marcel_Du-cote-de-chez-Swann-A-la-recherche-du-temps-perdu_<Odette-5878>_140746,vraiment pas de chance qu' elle lui défendît le seul
Proust-Marcel_Du-cote-de-chez-Swann-A-la-recherche-du-temps-perdu_<Odette-5878>_140747,pas de chance qu' elle lui défendît le seul endroit
Proust-Marcel_Du-cote-de-chez-Swann-A-la-recherche-du-temps-perdu_<Odette-5878>_140753,défendît le seul endroit qui le tentait aujourd' hui .
Proust-Marcel_Du-cote-de-chez-Swann-A-la-recherche-du-temps-perdu_<Odette-5878>_140762,". Aujourd' hui ! S' il y allait , malgré"
Proust-Marcel_Du-cote-de-chez-Swann-A-la-recherche-du-temps-perdu_<Odette-5878>_140767,"il y allait , malgré son interdiction , il pourrait"
Proust-Marcel_Du-cote-de-chez-Swann-A-la-recherche-du-temps-perdu_<Odette-5878>_140770,", malgré son interdiction , il pourrait la voir aujourd'"
Proust-Marcel_Du-cote-de-chez-Swann-A-la-recherche-du-temps-perdu_<Odette-5878>_140772,"son interdiction , il pourrait la voir aujourd' hui même"
Proust-Marcel_Du-cote-de-chez-Swann-A-la-recherche-du-temps-perdu_<Odette-5878>_140784,", alors que , si elle eût retrouvé à Pierrefonds"
Proust-Marcel_Du-cote-de-chez-Swann-A-la-recherche-du-temps-perdu_<Odette-5878>_140792,"à Pierrefonds quelque indifférent , elle lui eût dit joyeusement"
Proust-Marcel_Du-cote-de-chez-Swann-A-la-recherche-du-temps-perdu_<Odette-5878>_140793,"Pierrefonds quelque indifférent , elle lui eût dit joyeusement :"
Proust-Marcel_Du-cote-de-chez-Swann-A-la-recherche-du-temps-perdu_<Odette-5878>_140801,"joyeusement : « Tiens , vous ici ! » ,"
Proust-Marcel_Du-cote-de-chez-Swann-A-la-recherche-du-temps-perdu_<Odette-5878>_140807,"ici ! » , et lui aurait demandé d' aller"
Proust-Marcel_Du-cote-de-chez-Swann-A-la-recherche-du-temps-perdu_<Odette-5878>_140808,"! » , et lui aurait demandé d' aller la"
Proust-Marcel_Du-cote-de-chez-Swann-A-la-recherche-du-temps-perdu_<Odette-5878>_140812,lui aurait demandé d' aller la voir à l' hôtel
Proust-Marcel_Du-cote-de-chez-Swann-A-la-recherche-du-temps-perdu_<Odette-5878>_140818,voir à l' hôtel où elle était descendue avec les
Proust-Marcel_Du-cote-de-chez-Swann-A-la-recherche-du-temps-perdu_<Odette-5878>_140828,"Verdurin , au contraire si elle l' y rencontrait ,"
Proust-Marcel_Du-cote-de-chez-Swann-A-la-recherche-du-temps-perdu_<Odette-5878>_140829,", au contraire si elle l' y rencontrait , lui"
Proust-Marcel_Du-cote-de-chez-Swann-A-la-recherche-du-temps-perdu_<Odette-5878>_140833,"elle l' y rencontrait , lui , Swann , elle"
Proust-Marcel_Du-cote-de-chez-Swann-A-la-recherche-du-temps-perdu_<Odette-5878>_140837,", lui , Swann , elle serait froissée , elle"
Proust-Marcel_Du-cote-de-chez-Swann-A-la-recherche-du-temps-perdu_<Odette-5878>_140841,", elle serait froissée , elle se dirait qu' elle"
Proust-Marcel_Du-cote-de-chez-Swann-A-la-recherche-du-temps-perdu_<Odette-5878>_140845,", elle se dirait qu' elle était suivie , elle"
Proust-Marcel_Du-cote-de-chez-Swann-A-la-recherche-du-temps-perdu_<Odette-5878>_140849,"qu' elle était suivie , elle l' aimerait moins ,"
Proust-Marcel_Du-cote-de-chez-Swann-A-la-recherche-du-temps-perdu_<Odette-5878>_140850,"elle était suivie , elle l' aimerait moins , peut"
Proust-Marcel_Du-cote-de-chez-Swann-A-la-recherche-du-temps-perdu_<Odette-5878>_140859,peut - être se détournerait - elle avec colère en
Proust-Marcel_Du-cote-de-chez-Swann-A-la-recherche-du-temps-perdu_<Odette-5878>_140864,- elle avec colère en l' apercevant . « Alors
Proust-Marcel_Du-cote-de-chez-Swann-A-la-recherche-du-temps-perdu_<Odette-5878>_140870,"apercevant . « Alors , je n' ai plus le"
Proust-Marcel_Du-cote-de-chez-Swann-A-la-recherche-du-temps-perdu_<Odette-5878>_140881,"de voyager ! » , lui dirait - elle au"
Proust-Marcel_Du-cote-de-chez-Swann-A-la-recherche-du-temps-perdu_<Odette-5878>_140883,"! » , lui dirait - elle au retour ,"
Proust-Marcel_Du-cote-de-chez-Swann-A-la-recherche-du-temps-perdu_<Odette-5878>_140894,qu' en somme c' était lui qui n' avait plus
Proust-Marcel_Du-cote-de-chez-Swann-A-la-recherche-du-temps-perdu_<Odette-5878>_140895,en somme c' était lui qui n' avait plus le
Proust-Marcel_Du-cote-de-chez-Swann-A-la-recherche-du-temps-perdu_<Odette-5878>_140928,"que ce fût pour rencontrer Odette , de s' y"
Proust-Marcel_Du-cote-de-chez-Swann-A-la-recherche-du-temps-perdu_<Odette-5878>_140938,"faire emmener par un de ses amis , le marquis"
Proust-Marcel_Du-cote-de-chez-Swann-A-la-recherche-du-temps-perdu_<Odette-5878>_140968,part de son projet sans lui en dire le motif
Proust-Marcel_Du-cote-de-chez-Swann-A-la-recherche-du-temps-perdu_<Odette-5878>_140984,"joie et s' émerveillait que Swann , pour la première"
