,text_surronding
Proust-Marcel_Du-cote-de-chez-Swann-A-la-recherche-du-temps-perdu_<ma grand' mère-672>_15669,"l' avons pas remercié ? je crois , entre nous"
Proust-Marcel_Du-cote-de-chez-Swann-A-la-recherche-du-temps-perdu_<ma grand' mère-672>_15676,", entre nous , que je lui ai même tourné"
Proust-Marcel_Du-cote-de-chez-Swann-A-la-recherche-du-temps-perdu_<ma grand' mère-672>_15687,"assez délicatement » , répondit ma tante Flora . «"
Proust-Marcel_Du-cote-de-chez-Swann-A-la-recherche-du-temps-perdu_<ma grand' mère-672>_15694,"Flora . « Oui , tu as très bien arrangé"
Proust-Marcel_Du-cote-de-chez-Swann-A-la-recherche-du-temps-perdu_<ma grand' mère-672>_15702,"bien arrangé cela : je t' ai admirée » ,"
Proust-Marcel_Du-cote-de-chez-Swann-A-la-recherche-du-temps-perdu_<ma grand' mère-672>_15708,"ai admirée » , dit ma tante Céline . ─"
Proust-Marcel_Du-cote-de-chez-Swann-A-la-recherche-du-temps-perdu_<ma grand' mère-672>_15715,"Céline . ─ « Mais toi , tu as été"
Proust-Marcel_Du-cote-de-chez-Swann-A-la-recherche-du-temps-perdu_<ma grand' mère-672>_15717,"─ « Mais toi , tu as été très bien"
Proust-Marcel_Du-cote-de-chez-Swann-A-la-recherche-du-temps-perdu_<ma grand' mère-672>_15729,"» ─ « Oui , j' étais assez fière de"
Proust-Marcel_Du-cote-de-chez-Swann-A-la-recherche-du-temps-perdu_<ma grand' mère-672>_15734,j' étais assez fière de ma phrase sur les voisins
Proust-Marcel_Du-cote-de-chez-Swann-A-la-recherche-du-temps-perdu_<ma grand' mère-672>_15756,appelez remercier ! s' écria mon grand - père .
Proust-Marcel_Du-cote-de-chez-Swann-A-la-recherche-du-temps-perdu_<ma grand' mère-672>_15761,mon grand - père . J' ai bien entendu cela
Proust-Marcel_Du-cote-de-chez-Swann-A-la-recherche-du-temps-perdu_<ma grand' mère-672>_15771,", mais du diable si j' ai cru que c'"
Proust-Marcel_Du-cote-de-chez-Swann-A-la-recherche-du-temps-perdu_<ma grand' mère-672>_15803,"n' est pas bête , je suis certaine qu' il"
Proust-Marcel_Du-cote-de-chez-Swann-A-la-recherche-du-temps-perdu_<ma grand' mère-672>_15811,qu' il a apprécié . Je ne pouvais cependant pas
Proust-Marcel_Du-cote-de-chez-Swann-A-la-recherche-du-temps-perdu_<ma grand' mère-672>_15829,prix du vin ! » Mon père et ma mère
Proust-Marcel_Du-cote-de-chez-Swann-A-la-recherche-du-temps-perdu_<ma grand' mère-672>_15832,"! » Mon père et ma mère restèrent seuls ,"
Proust-Marcel_Du-cote-de-chez-Swann-A-la-recherche-du-temps-perdu_<ma grand' mère-672>_15844,assirent un instant ; puis mon père dit : «
Proust-Marcel_Du-cote-de-chez-Swann-A-la-recherche-du-temps-perdu_<ma grand' mère-672>_15853,"« Hé bien ! si tu veux , nous allons"
Proust-Marcel_Du-cote-de-chez-Swann-A-la-recherche-du-temps-perdu_<ma grand' mère-672>_15866,". » ─ « Si tu veux , mon ami"
Proust-Marcel_Du-cote-de-chez-Swann-A-la-recherche-du-temps-perdu_<ma grand' mère-672>_15869,"« Si tu veux , mon ami , bien que"
Proust-Marcel_Du-cote-de-chez-Swann-A-la-recherche-du-temps-perdu_<ma grand' mère-672>_15874,"mon ami , bien que je n' aie pas l'"
Proust-Marcel_Du-cote-de-chez-Swann-A-la-recherche-du-temps-perdu_<ma grand' mère-672>_15897,anodine qui a pu pourtant me tenir si éveillée ;
Proust-Marcel_Du-cote-de-chez-Swann-A-la-recherche-du-temps-perdu_<ma grand' mère-672>_15903,tenir si éveillée ; mais j' aperçois de la lumière
Proust-Marcel_Du-cote-de-chez-Swann-A-la-recherche-du-temps-perdu_<ma grand' mère-672>_15916,"et puisque la pauvre Françoise m' a attendue , je"
Proust-Marcel_Du-cote-de-chez-Swann-A-la-recherche-du-temps-perdu_<ma grand' mère-672>_15920,"Françoise m' a attendue , je vais lui demander de"
Proust-Marcel_Du-cote-de-chez-Swann-A-la-recherche-du-temps-perdu_<ma grand' mère-672>_15926,vais lui demander de dégrafer mon corsage pendant que tu
Proust-Marcel_Du-cote-de-chez-Swann-A-la-recherche-du-temps-perdu_<ma grand' mère-672>_15930,dégrafer mon corsage pendant que tu vas te déshabiller .
Proust-Marcel_Du-cote-de-chez-Swann-A-la-recherche-du-temps-perdu_<ma grand' mère-672>_15937,te déshabiller . » Et ma mère ouvrit la porte
Proust-Marcel_Du-cote-de-chez-Swann-A-la-recherche-du-temps-perdu_<ma grand' mère-672>_15953,"l' escalier . Bientôt , je l' entendis qui montait"
Proust-Marcel_Du-cote-de-chez-Swann-A-la-recherche-du-temps-perdu_<ma grand' mère-672>_15962,montait fermer sa fenêtre . J' allai sans bruit dans
Proust-Marcel_Du-cote-de-chez-Swann-A-la-recherche-du-temps-perdu_<ma grand' mère-672>_15970,bruit dans le couloir ; mon cœur battait si fort
Proust-Marcel_Du-cote-de-chez-Swann-A-la-recherche-du-temps-perdu_<ma grand' mère-672>_15976,cœur battait si fort que j' avais de la peine
Proust-Marcel_Du-cote-de-chez-Swann-A-la-recherche-du-temps-perdu_<ma grand' mère-672>_16001,épouvante et de joie . Je vis dans la cage
Proust-Marcel_Du-cote-de-chez-Swann-A-la-recherche-du-temps-perdu_<ma grand' mère-672>_16019,bougie de maman . Puis je la vis elle -
Proust-Marcel_Du-cote-de-chez-Swann-A-la-recherche-du-temps-perdu_<ma grand' mère-672>_16026,"vis elle - même , je m' élançai . À"
Proust-Marcel_Du-cote-de-chez-Swann-A-la-recherche-du-temps-perdu_<ma grand' mère-672>_16036,"la première seconde , elle me regarda avec étonnement ,"
Proust-Marcel_Du-cote-de-chez-Swann-A-la-recherche-du-temps-perdu_<ma grand' mère-672>_16060,"de colère , elle ne me disait même pas un"
Proust-Marcel_Du-cote-de-chez-Swann-A-la-recherche-du-temps-perdu_<ma grand' mère-672>_16077,moins que cela on ne m' adressait plus la parole
Proust-Marcel_Du-cote-de-chez-Swann-A-la-recherche-du-temps-perdu_<ma grand' mère-672>_16088,plusieurs jours . Si maman m' avait dit un mot
Proust-Marcel_Du-cote-de-chez-Swann-A-la-recherche-du-temps-perdu_<ma grand' mère-672>_16101,été admettre qu' on pouvait me reparler et d' ailleurs
Proust-Marcel_Du-cote-de-chez-Swann-A-la-recherche-du-temps-perdu_<ma grand' mère-672>_16110,ailleurs cela peut - être m' eût paru plus terrible
Proust-Marcel_Du-cote-de-chez-Swann-A-la-recherche-du-temps-perdu_<ma grand' mère-672>_16201,lui . Mais elle entendit mon père qui montait du
Proust-Marcel_Du-cote-de-chez-Swann-A-la-recherche-du-temps-perdu_<ma grand' mère-672>_16224,"éviter la scène qu' il me ferait , elle me"
Proust-Marcel_Du-cote-de-chez-Swann-A-la-recherche-du-temps-perdu_<ma grand' mère-672>_16228,"il me ferait , elle me dit d' une voix"
Proust-Marcel_Du-cote-de-chez-Swann-A-la-recherche-du-temps-perdu_<ma grand' mère-672>_16240,"la colère : « Sauve - toi , sauve -"
Proust-Marcel_Du-cote-de-chez-Swann-A-la-recherche-du-temps-perdu_<ma grand' mère-672>_16244,"Sauve - toi , sauve - toi , qu' au"
Proust-Marcel_Du-cote-de-chez-Swann-A-la-recherche-du-temps-perdu_<ma grand' mère-672>_16250,"toi , qu' au moins ton père ne t' ait"
Proust-Marcel_Du-cote-de-chez-Swann-A-la-recherche-du-temps-perdu_<ma grand' mère-672>_16253,au moins ton père ne t' ait vu ainsi attendant
Proust-Marcel_Du-cote-de-chez-Swann-A-la-recherche-du-temps-perdu_<ma grand' mère-672>_16264,un fou ! » Mais je lui répétais : «
Proust-Marcel_Du-cote-de-chez-Swann-A-la-recherche-du-temps-perdu_<ma grand' mère-672>_16270,"lui répétais : « Viens me dire bonsoir » ,"
Proust-Marcel_Du-cote-de-chez-Swann-A-la-recherche-du-temps-perdu_<ma grand' mère-672>_16285,reflet de la bougie de mon père s' élevait déjà
Proust-Marcel_Du-cote-de-chez-Swann-A-la-recherche-du-temps-perdu_<ma grand' mère-672>_16314,"maman , pour éviter que mon père me trouvât encore"
Proust-Marcel_Du-cote-de-chez-Swann-A-la-recherche-du-temps-perdu_<ma grand' mère-672>_16316,pour éviter que mon père me trouvât encore là si
Proust-Marcel_Du-cote-de-chez-Swann-A-la-recherche-du-temps-perdu_<ma grand' mère-672>_16327,"continuait à refuser , allait me dire : « Rentre"
Proust-Marcel_Du-cote-de-chez-Swann-A-la-recherche-du-temps-perdu_<ma grand' mère-672>_16333,"dire : « Rentre dans ta chambre , je vais"
Proust-Marcel_Du-cote-de-chez-Swann-A-la-recherche-du-temps-perdu_<ma grand' mère-672>_16346,"Il était trop tard , mon père était devant nous"
Proust-Marcel_Du-cote-de-chez-Swann-A-la-recherche-du-temps-perdu_<ma grand' mère-672>_16356,". Sans le vouloir , je murmurai ces mots que"
Proust-Marcel_Du-cote-de-chez-Swann-A-la-recherche-du-temps-perdu_<ma grand' mère-672>_16366,personne n' entendit : « Je suis perdu ! »Il
Proust-Marcel_Du-cote-de-chez-Swann-A-la-recherche-du-temps-perdu_<ma grand' mère-672>_16377,en fut pas ainsi . Mon père me refusait constamment
Proust-Marcel_Du-cote-de-chez-Swann-A-la-recherche-du-temps-perdu_<ma grand' mère-672>_16379,pas ainsi . Mon père me refusait constamment des permissions
Proust-Marcel_Du-cote-de-chez-Swann-A-la-recherche-du-temps-perdu_<ma grand' mère-672>_16385,refusait constamment des permissions qui m' avaient été consenties dans
Proust-Marcel_Du-cote-de-chez-Swann-A-la-recherche-du-temps-perdu_<ma grand' mère-672>_16396,pactes plus larges octroyés par ma mère et ma grand'
Proust-Marcel_Du-cote-de-chez-Swann-A-la-recherche-du-temps-perdu_<ma grand' mère-672>_16399,"octroyés par ma mère et ma grand' mère , parce"
Proust-Marcel_Du-cote-de-chez-Swann-A-la-recherche-du-temps-perdu_<ma grand' mère-672>_16442,"même sans raison , il me supprimait au dernier moment"
Proust-Marcel_Du-cote-de-chez-Swann-A-la-recherche-du-temps-perdu_<ma grand' mère-672>_16459,", qu' on ne pouvait m' en priver sans parjure"
Proust-Marcel_Du-cote-de-chez-Swann-A-la-recherche-du-temps-perdu_<ma grand' mère-672>_16483,"l' heure rituelle , il me disait : « Allons"
Proust-Marcel_Du-cote-de-chez-Swann-A-la-recherche-du-temps-perdu_<ma grand' mère-672>_16489,"disait : « Allons , monte te coucher , pas"
Proust-Marcel_Du-cote-de-chez-Swann-A-la-recherche-du-temps-perdu_<ma grand' mère-672>_16514,"( dans le sens de ma grand' mère ) ,"
Proust-Marcel_Du-cote-de-chez-Swann-A-la-recherche-du-temps-perdu_<ma grand' mère-672>_16530,parler d' intransigeance . Il me regarda un instant d'
Proust-Marcel_Du-cote-de-chez-Swann-A-la-recherche-du-temps-perdu_<ma grand' mère-672>_16558,"qui était arrivé , il lui dit : « Mais"
Proust-Marcel_Du-cote-de-chez-Swann-A-la-recherche-du-temps-perdu_<ma grand' mère-672>_16563,"lui dit : « Mais va donc avec lui ,"
Proust-Marcel_Du-cote-de-chez-Swann-A-la-recherche-du-temps-perdu_<ma grand' mère-672>_16569,"donc avec lui , puisque tu disais justement que tu"
Proust-Marcel_Du-cote-de-chez-Swann-A-la-recherche-du-temps-perdu_<ma grand' mère-672>_16573,puisque tu disais justement que tu n' as pas envie
Proust-Marcel_Du-cote-de-chez-Swann-A-la-recherche-du-temps-perdu_<ma grand' mère-672>_16601,"» — « Mais , mon ami , répondit timidement"
Proust-Marcel_Du-cote-de-chez-Swann-A-la-recherche-du-temps-perdu_<ma grand' mère-672>_16606,"mon ami , répondit timidement ma mère , que j'"
Proust-Marcel_Du-cote-de-chez-Swann-A-la-recherche-du-temps-perdu_<ma grand' mère-672>_16610,"timidement ma mère , que j' aie envie ou non"
Proust-Marcel_Du-cote-de-chez-Swann-A-la-recherche-du-temps-perdu_<ma grand' mère-672>_16646,"pas d' habituer , dit mon père en haussant les"
Proust-Marcel_Du-cote-de-chez-Swann-A-la-recherche-du-temps-perdu_<ma grand' mère-672>_16653,"en haussant les épaules , tu vois bien que ce"
Proust-Marcel_Du-cote-de-chez-Swann-A-la-recherche-du-temps-perdu_<ma grand' mère-672>_16682,pas des bourreaux ! Quand tu l' auras rendu malade
Proust-Marcel_Du-cote-de-chez-Swann-A-la-recherche-du-temps-perdu_<ma grand' mère-672>_16688,"l' auras rendu malade , tu seras bien avancée !"
Proust-Marcel_Du-cote-de-chez-Swann-A-la-recherche-du-temps-perdu_<ma grand' mère-672>_16708,dis donc à Françoise de te préparer le grand lit
Proust-Marcel_Du-cote-de-chez-Swann-A-la-recherche-du-temps-perdu_<ma grand' mère-672>_16714,préparer le grand lit et couche pour cette nuit auprès
Proust-Marcel_Du-cote-de-chez-Swann-A-la-recherche-du-temps-perdu_<ma grand' mère-672>_16726,". Allons , bonsoir , moi qui ne suis pas"
Proust-Marcel_Du-cote-de-chez-Swann-A-la-recherche-du-temps-perdu_<ma grand' mère-672>_16727,"Allons , bonsoir , moi qui ne suis pas si"
Proust-Marcel_Du-cote-de-chez-Swann-A-la-recherche-du-temps-perdu_<ma grand' mère-672>_16734,"suis pas si nerveux que vous , je vais me"
Proust-Marcel_Du-cote-de-chez-Swann-A-la-recherche-du-temps-perdu_<ma grand' mère-672>_16736,"si nerveux que vous , je vais me coucher ."
Proust-Marcel_Du-cote-de-chez-Swann-A-la-recherche-du-temps-perdu_<ma grand' mère-672>_16746,»On ne pouvait pas remercier mon père ; on l'
Proust-Marcel_Du-cote-de-chez-Swann-A-la-recherche-du-temps-perdu_<ma grand' mère-672>_16761,il appelait des sensibleries . Je restai sans oser faire
Proust-Marcel_Du-cote-de-chez-Swann-A-la-recherche-du-temps-perdu_<ma grand' mère-672>_16819,d' après Benozzo Gozzoli que m' avait donnée M .
Proust-Marcel_Du-cote-de-chez-Swann-A-la-recherche-du-temps-perdu_<ma grand' mère-672>_16828,". Swann , disant à Sarah qu' elle a à"
Proust-Marcel_Du-cote-de-chez-Swann-A-la-recherche-du-temps-perdu_<ma grand' mère-672>_16830,", disant à Sarah qu' elle a à se départir"
Proust-Marcel_Du-cote-de-chez-Swann-A-la-recherche-du-temps-perdu_<ma grand' mère-672>_16855,muraille de l' escalier où je vis monter le reflet
Proust-Marcel_Du-cote-de-chez-Swann-A-la-recherche-du-temps-perdu_<ma grand' mère-672>_16861,vis monter le reflet de sa bougie n' existe plus
Proust-Marcel_Du-cote-de-chez-Swann-A-la-recherche-du-temps-perdu_<ma grand' mère-672>_16870,plus depuis longtemps . En moi aussi bien des choses
Proust-Marcel_Du-cote-de-chez-Swann-A-la-recherche-du-temps-perdu_<ma grand' mère-672>_16879,choses ont été détruites que je croyais devoir durer toujours
Proust-Marcel_Du-cote-de-chez-Swann-A-la-recherche-du-temps-perdu_<ma grand' mère-672>_16903,à des joies nouvelles que je n' aurais pu prévoir
Proust-Marcel_Du-cote-de-chez-Swann-A-la-recherche-du-temps-perdu_<ma grand' mère-672>_16915,de même que les anciennes me sont devenues difficiles à
Proust-Marcel_Du-cote-de-chez-Swann-A-la-recherche-du-temps-perdu_<ma grand' mère-672>_16929,a bien longtemps aussi que mon père a cessé de
Proust-Marcel_Du-cote-de-chez-Swann-A-la-recherche-du-temps-perdu_<ma grand' mère-672>_16955,heures ne renaîtra jamais pour moi . Mais depuis peu
Proust-Marcel_Du-cote-de-chez-Swann-A-la-recherche-du-temps-perdu_<ma grand' mère-672>_16963,"depuis peu de temps , je recommence à très bien"
Proust-Marcel_Du-cote-de-chez-Swann-A-la-recherche-du-temps-perdu_<ma grand' mère-672>_16971,"très bien percevoir , si je prête l' oreille ,"
Proust-Marcel_Du-cote-de-chez-Swann-A-la-recherche-du-temps-perdu_<ma grand' mère-672>_16979,"oreille , les sanglots que j' eus la force de"
Proust-Marcel_Du-cote-de-chez-Swann-A-la-recherche-du-temps-perdu_<ma grand' mère-672>_16986,la force de contenir devant mon père et qui n'
Proust-Marcel_Du-cote-de-chez-Swann-A-la-recherche-du-temps-perdu_<ma grand' mère-672>_16994,qui n' éclatèrent que quand je me retrouvai seul avec
Proust-Marcel_Du-cote-de-chez-Swann-A-la-recherche-du-temps-perdu_<ma grand' mère-672>_17023,tait maintenant davantage autour de moi que je les entends
Proust-Marcel_Du-cote-de-chez-Swann-A-la-recherche-du-temps-perdu_<ma grand' mère-672>_17025,davantage autour de moi que je les entends de nouveau
Proust-Marcel_Du-cote-de-chez-Swann-A-la-recherche-du-temps-perdu_<ma grand' mère-672>_17072,cette nuit - là dans ma chambre ; au moment
Proust-Marcel_Du-cote-de-chez-Swann-A-la-recherche-du-temps-perdu_<ma grand' mère-672>_17078,chambre ; au moment où je venais de commettre une
Proust-Marcel_Du-cote-de-chez-Swann-A-la-recherche-du-temps-perdu_<ma grand' mère-672>_17086,commettre une faute telle que je m' attendais à être
Proust-Marcel_Du-cote-de-chez-Swann-A-la-recherche-du-temps-perdu_<ma grand' mère-672>_17097,"de quitter la maison , mes parents m' accordaient plus"
Proust-Marcel_Du-cote-de-chez-Swann-A-la-recherche-du-temps-perdu_<ma grand' mère-672>_17099,"la maison , mes parents m' accordaient plus que je"
Proust-Marcel_Du-cote-de-chez-Swann-A-la-recherche-du-temps-perdu_<ma grand' mère-672>_17103,parents m' accordaient plus que je n' eusse jamais obtenu
Proust-Marcel_Du-cote-de-chez-Swann-A-la-recherche-du-temps-perdu_<ma grand' mère-672>_17132,"grâce , la conduite de mon père à mon égard"
Proust-Marcel_Du-cote-de-chez-Swann-A-la-recherche-du-temps-perdu_<ma grand' mère-672>_17135,conduite de mon père à mon égard gardait ce quelque
Proust-Marcel_Du-cote-de-chez-Swann-A-la-recherche-du-temps-perdu_<ma grand' mère-672>_17176,"être même que ce que j' appelais sa sévérité ,"
Proust-Marcel_Du-cote-de-chez-Swann-A-la-recherche-du-temps-perdu_<ma grand' mère-672>_17183,"sa sévérité , quand il m' envoyait me coucher ,"
Proust-Marcel_Du-cote-de-chez-Swann-A-la-recherche-du-temps-perdu_<ma grand' mère-672>_17195,ce nom que celle de ma mère ou ma grand'
Proust-Marcel_Du-cote-de-chez-Swann-A-la-recherche-du-temps-perdu_<ma grand' mère-672>_17198,"celle de ma mère ou ma grand' mère , car"
Proust-Marcel_Du-cote-de-chez-Swann-A-la-recherche-du-temps-perdu_<ma grand' mère-672>_17228,pas deviné jusqu' ici combien j' étais malheureux tous les
Proust-Marcel_Du-cote-de-chez-Swann-A-la-recherche-du-temps-perdu_<ma grand' mère-672>_17237,"les soirs , ce que ma mère et ma grand'"
Proust-Marcel_Du-cote-de-chez-Swann-A-la-recherche-du-temps-perdu_<ma grand' mère-672>_17240,ce que ma mère et ma grand' mère savaient bien
Proust-Marcel_Du-cote-de-chez-Swann-A-la-recherche-du-temps-perdu_<ma grand' mère-672>_17248,savaient bien ; mais elles m' aimaient assez pour ne
Proust-Marcel_Du-cote-de-chez-Swann-A-la-recherche-du-temps-perdu_<ma grand' mère-672>_17256,pour ne pas consentir à m' épargner de la souffrance
Proust-Marcel_Du-cote-de-chez-Swann-A-la-recherche-du-temps-perdu_<ma grand' mère-672>_17264,"la souffrance , elles voulaient m' apprendre à la dominer"
Proust-Marcel_Du-cote-de-chez-Swann-A-la-recherche-du-temps-perdu_<ma grand' mère-672>_17272,la dominer afin de diminuer ma sensibilité nerveuse et fortifier
Proust-Marcel_Du-cote-de-chez-Swann-A-la-recherche-du-temps-perdu_<ma grand' mère-672>_17277,ma sensibilité nerveuse et fortifier ma volonté . Pour mon
Proust-Marcel_Du-cote-de-chez-Swann-A-la-recherche-du-temps-perdu_<ma grand' mère-672>_17281,"fortifier ma volonté . Pour mon père , dont l'"
Proust-Marcel_Du-cote-de-chez-Swann-A-la-recherche-du-temps-perdu_<ma grand' mère-672>_17288,", dont l' affection pour moi était d' une autre"
Proust-Marcel_Du-cote-de-chez-Swann-A-la-recherche-du-temps-perdu_<ma grand' mère-672>_17295,"d' une autre sorte , je ne sais pas s'"
Proust-Marcel_Du-cote-de-chez-Swann-A-la-recherche-du-temps-perdu_<ma grand' mère-672>_17315,"il venait de comprendre que j' avais du chagrin ,"
Proust-Marcel_Du-cote-de-chez-Swann-A-la-recherche-du-temps-perdu_<ma grand' mère-672>_17324,", il avait dit à ma mère: « Va donc"
Proust-Marcel_Du-cote-de-chez-Swann-A-la-recherche-du-temps-perdu_<ma grand' mère-672>_17329,ma mère: « Va donc le consoler . » Maman
Proust-Marcel_Du-cote-de-chez-Swann-A-la-recherche-du-temps-perdu_<ma grand' mère-672>_17340,"cette nuit - là dans ma chambre et , comme"
Proust-Marcel_Du-cote-de-chez-Swann-A-la-recherche-du-temps-perdu_<ma grand' mère-672>_17358,si différentes de ce que j' avais eu le droit
Proust-Marcel_Du-cote-de-chez-Swann-A-la-recherche-du-temps-perdu_<ma grand' mère-672>_17384,"voyant maman assise près de moi , qui me tenait"
Proust-Marcel_Du-cote-de-chez-Swann-A-la-recherche-du-temps-perdu_<ma grand' mère-672>_17387,"près de moi , qui me tenait la main et"
Proust-Marcel_Du-cote-de-chez-Swann-A-la-recherche-du-temps-perdu_<ma grand' mère-672>_17392,me tenait la main et me laissait pleurer sans me
Proust-Marcel_Du-cote-de-chez-Swann-A-la-recherche-du-temps-perdu_<ma grand' mère-672>_17396,"et me laissait pleurer sans me gronder , lui demanda:"
Proust-Marcel_Du-cote-de-chez-Swann-A-la-recherche-du-temps-perdu_<ma grand' mère-672>_17408,"Madame , qu' a donc Monsieur à pleurer ainsi ?"
Proust-Marcel_Du-cote-de-chez-Swann-A-la-recherche-du-temps-perdu_<ma grand' mère-672>_17415,pleurer ainsi ? » maman lui répondit: « Mais il
Proust-Marcel_Du-cote-de-chez-Swann-A-la-recherche-du-temps-perdu_<ma grand' mère-672>_17419,maman lui répondit: « Mais il ne sait pas lui
Proust-Marcel_Du-cote-de-chez-Swann-A-la-recherche-du-temps-perdu_<ma grand' mère-672>_17423,"Mais il ne sait pas lui - même , Françoise"
Proust-Marcel_Du-cote-de-chez-Swann-A-la-recherche-du-temps-perdu_<ma grand' mère-672>_17429,"- même , Françoise , il est énervé ; préparez"
Proust-Marcel_Du-cote-de-chez-Swann-A-la-recherche-du-temps-perdu_<ma grand' mère-672>_17453,"pour la première fois , ma tristesse n' était plus"
Proust-Marcel_Du-cote-de-chez-Swann-A-la-recherche-du-temps-perdu_<ma grand' mère-672>_17480,comme un état nerveux dont je n' étais pas responsable
Proust-Marcel_Du-cote-de-chez-Swann-A-la-recherche-du-temps-perdu_<ma grand' mère-672>_17486,n' étais pas responsable ; j' avais le soulagement de
Proust-Marcel_Du-cote-de-chez-Swann-A-la-recherche-du-temps-perdu_<ma grand' mère-672>_17502,"scrupules à l' amertume de mes larmes , je pouvais"
Proust-Marcel_Du-cote-de-chez-Swann-A-la-recherche-du-temps-perdu_<ma grand' mère-672>_17505,"amertume de mes larmes , je pouvais pleurer sans péché"
Proust-Marcel_Du-cote-de-chez-Swann-A-la-recherche-du-temps-perdu_<ma grand' mère-672>_17511,pouvais pleurer sans péché . Je n' étais pas non
Proust-Marcel_Du-cote-de-chez-Swann-A-la-recherche-du-temps-perdu_<ma grand' mère-672>_17545,avait refusé de monter dans ma chambre et m' avait
Proust-Marcel_Du-cote-de-chez-Swann-A-la-recherche-du-temps-perdu_<ma grand' mère-672>_17548,monter dans ma chambre et m' avait fait dédaigneusement répondre
Proust-Marcel_Du-cote-de-chez-Swann-A-la-recherche-du-temps-perdu_<ma grand' mère-672>_17554,"avait fait dédaigneusement répondre que je devrais dormir , m'"
Proust-Marcel_Du-cote-de-chez-Swann-A-la-recherche-du-temps-perdu_<ma grand' mère-672>_17558,"que je devrais dormir , m' élevait à la dignité"
Proust-Marcel_Du-cote-de-chez-Swann-A-la-recherche-du-temps-perdu_<ma grand' mère-672>_17567,dignité de grande personne et m' avait fait atteindre tout
Proust-Marcel_Du-cote-de-chez-Swann-A-la-recherche-du-temps-perdu_<ma grand' mère-672>_17588,d' émancipation des larmes . J' aurais dû être heureux
Proust-Marcel_Du-cote-de-chez-Swann-A-la-recherche-du-temps-perdu_<ma grand' mère-672>_17594,aurais dû être heureux : je ne l' étais pas
Proust-Marcel_Du-cote-de-chez-Swann-A-la-recherche-du-temps-perdu_<ma grand' mère-672>_17601,l' étais pas . Il me semblait que ma mère
Proust-Marcel_Du-cote-de-chez-Swann-A-la-recherche-du-temps-perdu_<ma grand' mère-672>_17604,. Il me semblait que ma mère venait de me
Proust-Marcel_Du-cote-de-chez-Swann-A-la-recherche-du-temps-perdu_<ma grand' mère-672>_17608,que ma mère venait de me faire une première concession
Proust-Marcel_Du-cote-de-chez-Swann-A-la-recherche-du-temps-perdu_<ma grand' mère-672>_17636,"qu' elle avait conçu pour moi , et que pour"
Proust-Marcel_Du-cote-de-chez-Swann-A-la-recherche-du-temps-perdu_<ma grand' mère-672>_17655,s' avouait vaincue . Il me semblait que si je
Proust-Marcel_Du-cote-de-chez-Swann-A-la-recherche-du-temps-perdu_<ma grand' mère-672>_17659,Il me semblait que si je venais de remporter une
Proust-Marcel_Du-cote-de-chez-Swann-A-la-recherche-du-temps-perdu_<ma grand' mère-672>_17671,"était contre elle , que j' avais réussi comme auraient"
Proust-Marcel_Du-cote-de-chez-Swann-A-la-recherche-du-temps-perdu_<ma grand' mère-672>_17714,"une triste date . Si j' avais osé maintenant ,"
Proust-Marcel_Du-cote-de-chez-Swann-A-la-recherche-du-temps-perdu_<ma grand' mère-672>_17719,"j' avais osé maintenant , j' aurais dit à maman"
Proust-Marcel_Du-cote-de-chez-Swann-A-la-recherche-du-temps-perdu_<ma grand' mère-672>_17727,"à maman : « Non je ne veux pas ,"
Proust-Marcel_Du-cote-de-chez-Swann-A-la-recherche-du-temps-perdu_<ma grand' mère-672>_17739,pas ici . » Mais je connaissais la sagesse pratique
Proust-Marcel_Du-cote-de-chez-Swann-A-la-recherche-du-temps-perdu_<ma grand' mère-672>_17761,"la nature ardemment idéaliste de ma grand' mère , et"
Proust-Marcel_Du-cote-de-chez-Swann-A-la-recherche-du-temps-perdu_<ma grand' mère-672>_17766,"ma grand' mère , et je savais que , maintenant"
Proust-Marcel_Du-cote-de-chez-Swann-A-la-recherche-du-temps-perdu_<ma grand' mère-672>_17780,"fait , elle aimerait mieux m' en laisser du moins"
Proust-Marcel_Du-cote-de-chez-Swann-A-la-recherche-du-temps-perdu_<ma grand' mère-672>_17793,"calmant et ne pas déranger mon père . Certes ,"
Proust-Marcel_Du-cote-de-chez-Swann-A-la-recherche-du-temps-perdu_<ma grand' mère-672>_17802,", le beau visage de ma mère brillait encore de"
Proust-Marcel_Du-cote-de-chez-Swann-A-la-recherche-du-temps-perdu_<ma grand' mère-672>_17814,soir - là où elle me tenait si doucement les
Proust-Marcel_Du-cote-de-chez-Swann-A-la-recherche-du-temps-perdu_<ma grand' mère-672>_17824,mains et cherchait à arrêter mes larmes ; mais justement
Proust-Marcel_Du-cote-de-chez-Swann-A-la-recherche-du-temps-perdu_<ma grand' mère-672>_17830,larmes ; mais justement il me semblait que cela n'
Proust-Marcel_Du-cote-de-chez-Swann-A-la-recherche-du-temps-perdu_<ma grand' mère-672>_17847,eût été moins triste pour moi que cette douceur nouvelle
Proust-Marcel_Du-cote-de-chez-Swann-A-la-recherche-du-temps-perdu_<ma grand' mère-672>_17857,que n' avait pas connue mon enfance ; il me
Proust-Marcel_Du-cote-de-chez-Swann-A-la-recherche-du-temps-perdu_<ma grand' mère-672>_17861,connue mon enfance ; il me semblait que je venais
Proust-Marcel_Du-cote-de-chez-Swann-A-la-recherche-du-temps-perdu_<ma grand' mère-672>_17864,; il me semblait que je venais d' une main
