,text_surronding
Sand-George_Lelia_<Marino-3353>_93786,voyez - vous pas qu' il en est incapable !
Sand-George_Lelia_<Marino-3353>_93799,"Zinzolina , en courant à Sténio qui tombait évanoui sur"
Sand-George_Lelia_<Marino-3353>_93800,", en courant à Sténio qui tombait évanoui sur le"
Sand-George_Lelia_<Marino-3353>_93808,sur le sopha . Trenmor l' aida à le secourir
Sand-George_Lelia_<Marino-3353>_93811,". Trenmor l' aida à le secourir , les autres"
Sand-George_Lelia_<Marino-3353>_93841,"des filles , éprise de ce poète phtisique et prendre"
Sand-George_Lelia_<Marino-3353>_93849,et prendre au sérieux toutes ses affectations !– Reviens à
Sand-George_Lelia_<Marino-3353>_93854,"ses affectations !– Reviens à toi , mon enfant ,"
Sand-George_Lelia_<Marino-3353>_93867,"respire ces essences , penche - toi sur la croisée"
Sand-George_Lelia_<Marino-3353>_93891,qui agite tes cheveux ?– Je sens tes mains qui
Sand-George_Lelia_<Marino-3353>_93896,Je sens tes mains qui m' échauffent et m' irritent
Sand-George_Lelia_<Marino-3353>_93899,"mains qui m' échauffent et m' irritent , répondit Sténio"
Sand-George_Lelia_<Marino-3353>_93903,"et m' irritent , répondit Sténio , ôte - les"
Sand-George_Lelia_<Marino-3353>_93909,", ôte - les de mon visage . Retire -"
Sand-George_Lelia_<Marino-3353>_93929,trop la courtisane . Fais - moi donner du rhum
Sand-George_Lelia_<Marino-3353>_93935,"moi donner du rhum , je me sens en disposition"
Sand-George_Lelia_<Marino-3353>_93945,"de m' enivrer . – Sténio , vous êtes fou"
Sand-George_Lelia_<Marino-3353>_93947,"enivrer . – Sténio , vous êtes fou et cruel"
Sand-George_Lelia_<Marino-3353>_93964,"douceur . Voici un de vos meilleurs amis , qui"
Sand-George_Lelia_<Marino-3353>_93975,"une heure est près de vous , ne le reconnaissez"
Sand-George_Lelia_<Marino-3353>_93980,"vous , ne le reconnaissez - vous pas ?– Mon"
Sand-George_Lelia_<Marino-3353>_93984,"reconnaissez - vous pas ?– Mon excellent ami , dit"
Sand-George_Lelia_<Marino-3353>_93989,"Mon excellent ami , dit Sténio , daignez donc vous"
Sand-George_Lelia_<Marino-3353>_93997,"donc vous baisser , car vous me semblez si grand"
Sand-George_Lelia_<Marino-3353>_93998,"vous baisser , car vous me semblez si grand qu'"
Sand-George_Lelia_<Marino-3353>_94006,grand qu' il faudra que je me lève pour vous
Sand-George_Lelia_<Marino-3353>_94010,que je me lève pour vous voir et il n'
Sand-George_Lelia_<Marino-3353>_94019,n' est pas sûr que votre visage en vaille la
Sand-George_Lelia_<Marino-3353>_94027,vaille la peine . – Laquelle avez - vous perdue
Sand-George_Lelia_<Marino-3353>_94029,"peine . – Laquelle avez - vous perdue , dit"
Sand-George_Lelia_<Marino-3353>_94075,", cette fois ? dit - il . Comment puis"
Sand-George_Lelia_<Marino-3353>_94080,- il . Comment puis - je distinguer la réalité
Sand-George_Lelia_<Marino-3353>_94089,réalité de l' illusion quand ma vie se passe à
Sand-George_Lelia_<Marino-3353>_94104,"Tout à l' heure , je rêvais que vous étiez"
Sand-George_Lelia_<Marino-3353>_94112,"vous étiez ici , que vous chantiez les vers les"
Sand-George_Lelia_<Marino-3353>_94127,"graveleux . . . Cela m' étonnait ; mais ,"
Sand-George_Lelia_<Marino-3353>_94137,"après tout , n' ai - je pas étonné de"
Sand-George_Lelia_<Marino-3353>_94145,étonné de même ceux qui m' ont connu jadis ?
Sand-George_Lelia_<Marino-3353>_94153,jadis ? Et puis il m' a semblé que je
Sand-George_Lelia_<Marino-3353>_94157,"il m' a semblé que je m' éveillais , que"
Sand-George_Lelia_<Marino-3353>_94162,"je m' éveillais , que je me querellais et que"
Sand-George_Lelia_<Marino-3353>_94175,"là . Du moins , je croyais voir votre ombre"
Sand-George_Lelia_<Marino-3353>_94185,flotter sur la muraille et je ne savais plus si
Sand-George_Lelia_<Marino-3353>_94190,je ne savais plus si j' étais endormi ou éveillé
Sand-George_Lelia_<Marino-3353>_94200,". À présent , dites - moi , êtes -"
Sand-George_Lelia_<Marino-3353>_94213,"ou êtes - vous comme moi une ombre vaine ,"
Sand-George_Lelia_<Marino-3353>_94258,"je n' hésite point à vous reconnaître , je ne"
Sand-George_Lelia_<Marino-3353>_94269,pas d' être méconnu de vous . »Sténio essaya de
Sand-George_Lelia_<Marino-3353>_94285,lui sourire tristement ; mais ses traits avaient perdu leur
Sand-George_Lelia_<Marino-3353>_94299,"jusque dans l' expression de sa reconnaissance , il y"
Sand-George_Lelia_<Marino-3353>_94314,"hautain et de préoccupé . Ses yeux , dépourvus de"
Sand-George_Lelia_<Marino-3353>_94335,bien à la jeunesse . Son regard vous arrivait droit
Sand-George_Lelia_<Marino-3353>_94351,"et presque arrogant . Puis le jeune homme , craignant"
Sand-George_Lelia_<Marino-3353>_94368,"jours , se leva , entraîna Trenmor vers la table"
Sand-George_Lelia_<Marino-3353>_94387,"et de vanité audacieuse , il le défia de boire"
Sand-George_Lelia_<Marino-3353>_94394,défia de boire autant que lui . « Eh quoi
Sand-George_Lelia_<Marino-3353>_94401,« Eh quoi ! dit la Zinzolina d' un ton
Sand-George_Lelia_<Marino-3353>_94409,"un ton de reproche , vous allez encore hâter le"
Sand-George_Lelia_<Marino-3353>_94416,encore hâter le terme de votre vie ? Tout à
Sand-George_Lelia_<Marino-3353>_94423,? Tout à l' heure vous étiez mourant et vous
Sand-George_Lelia_<Marino-3353>_94427,heure vous étiez mourant et vous allez dévorer ce qui
Sand-George_Lelia_<Marino-3353>_94432,vous allez dévorer ce qui vous reste de jeunesse et
Sand-George_Lelia_<Marino-3353>_94445,"ces boissons embrasées . Ô Sténio ! partez , partez"
Sand-George_Lelia_<Marino-3353>_94456,Trenmor ! Ne rendez pas votre guérison impossible . .
Sand-George_Lelia_<Marino-3353>_94468,Partir avec Trenmor ! dit Sténio ; et où irais
Sand-George_Lelia_<Marino-3353>_94473,Sténio ; et où irais - je avec lui ?
Sand-George_Lelia_<Marino-3353>_94488,mêmes lieux ? Ne suis - je pas banni de
Sand-George_Lelia_<Marino-3353>_94505,se révèle ? N' ai - je pas quarante ans
Sand-George_Lelia_<Marino-3353>_94517,dans le désert pour que mes neveux voient un jour
Sand-George_Lelia_<Marino-3353>_94528,terre de Chanaan ?Sténio serra son verre d' une main
Sand-George_Lelia_<Marino-3353>_94542,noir sembla s' abaisser sur sa figure . Puis elle
Sand-George_Lelia_<Marino-3353>_94546,sur sa figure . Puis elle s' anima soudain de
Sand-George_Lelia_<Marino-3353>_94588,"Non , non , dit - il , je ne"
Sand-George_Lelia_<Marino-3353>_94591,", dit - il , je ne partirai pas sans"
Sand-George_Lelia_<Marino-3353>_94636,"est sorti des cendres de Sténio . Zinzolina , faites"
Sand-George_Lelia_<Marino-3353>_94646,remplir toutes les coupes . Je bois aux mânes de
Sand-George_Lelia_<Marino-3353>_94654,"mânes de don Juan , mon patron ; je bois"
Sand-George_Lelia_<Marino-3353>_94657,"Juan , mon patron ; je bois à la jeunesse"
Sand-George_Lelia_<Marino-3353>_94677,"assez , qu' on remplisse ma coupe d' épices dévorantes"
Sand-George_Lelia_<Marino-3353>_94720,", page effronté , prépare - moi ce mélange détestable"
Sand-George_Lelia_<Marino-3353>_94727,ce mélange détestable pour qu' il me brûle la langue
Sand-George_Lelia_<Marino-3353>_94728,mélange détestable pour qu' il me brûle la langue et
Sand-George_Lelia_<Marino-3353>_94733,me brûle la langue et m' exalte le cerveau .
Sand-George_Lelia_<Marino-3353>_94738,"m' exalte le cerveau . J' en boirai , dût"
Sand-George_Lelia_<Marino-3353>_94745,"boirai , dût - on me tenir de force pour"
Sand-George_Lelia_<Marino-3353>_94750,"me tenir de force pour me le faire avaler ,"
Sand-George_Lelia_<Marino-3353>_94756,"le faire avaler , car je veux devenir fou et"
Sand-George_Lelia_<Marino-3353>_94783,"verrez , Trenmor , comme je suis beau dans l'"
Sand-George_Lelia_<Marino-3353>_94796,"la divine poésie descend en moi , comme le feu"
Sand-George_Lelia_<Marino-3353>_94804,"le feu du ciel embrase ma pensée , alors que"
Sand-George_Lelia_<Marino-3353>_94816,"de la fièvre circule dans mes veines . Allons ,"
Sand-George_Lelia_<Marino-3353>_94839,"buveurs , pâles débauchés , je porte ce défi !"
Sand-George_Lelia_<Marino-3353>_94845,"porte ce défi ! Vous m' avez raillé , voyons"
Sand-George_Lelia_<Marino-3353>_94855,maintenant lequel de vous osera me tenir tête ?– Qui
Sand-George_Lelia_<Marino-3353>_94917,"avalé le vin épicé , Sténio fut saisi d' atroces"
Sand-George_Lelia_<Marino-3353>_94932,rouge ardent se dessinèrent sur sa peau flétrie . La
Sand-George_Lelia_<Marino-3353>_94940,. La sueur coula de son front et ses yeux
Sand-George_Lelia_<Marino-3353>_94943,coula de son front et ses yeux prirent un éclat
Sand-George_Lelia_<Marino-3353>_94952,"éclat presque féroce . « Tu souffres , Sténio !"
Sand-George_Lelia_<Marino-3353>_94955,". « Tu souffres , Sténio ! lui cria Marino"
Sand-George_Lelia_<Marino-3353>_94957,"Tu souffres , Sténio ! lui cria Marino avec l'"
Sand-George_Lelia_<Marino-3353>_94970,". – Non , répondit Sténio . – En ce"
Sand-George_Lelia_<Marino-3353>_94984,nous quelques - unes de tes rimes avinées . –
Sand-George_Lelia_<Marino-3353>_94989,"tes rimes avinées . – Sténio , vous ne pouvez"
Sand-George_Lelia_<Marino-3353>_94991,"avinées . – Sténio , vous ne pouvez pas chanter"
Sand-George_Lelia_<Marino-3353>_95005,"n' essayez pas . – Je chanterai , dit Sténio"
Sand-George_Lelia_<Marino-3353>_95009,"– Je chanterai , dit Sténio ; ai - je"
Sand-George_Lelia_<Marino-3353>_95012,", dit Sténio ; ai - je donc perdu la"
Sand-George_Lelia_<Marino-3353>_95021,la voix ? Ne suis - je plus celui que
Sand-George_Lelia_<Marino-3353>_95024,Ne suis - je plus celui que vous applaudissiez avec
Sand-George_Lelia_<Marino-3353>_95025,suis - je plus celui que vous applaudissiez avec enthousiasme
Sand-George_Lelia_<Marino-3353>_95026,- je plus celui que vous applaudissiez avec enthousiasme et
Sand-George_Lelia_<Marino-3353>_95031,vous applaudissiez avec enthousiasme et dont les accents vous jetaient
Sand-George_Lelia_<Marino-3353>_95034,enthousiasme et dont les accents vous jetaient dans une ivresse
Sand-George_Lelia_<Marino-3353>_95056,"les buveurs ; chante , Sténio , chante ! »Et"
Sand-George_Lelia_<Marino-3353>_95078,eux ne pouvait contester à Sténio le don de l'
Sand-George_Lelia_<Marino-3353>_95092,"sentaient entraînés et dominés par lui , lorsqu' il retrouvait"
Sand-George_Lelia_<Marino-3353>_95095,"dominés par lui , lorsqu' il retrouvait une lueur de"
Sand-George_Lelia_<Marino-3353>_95107,sein de l' énervement où l' avait jeté le désordre
Sand-George_Lelia_<Marino-3353>_95113,avait jeté le désordre . Il chanta ainsi d' une
Sand-George_Lelia_<Marino-3353>_95225,"heure du soir . « Ta voix s' affaiblit ,"
Sand-George_Lelia_<Marino-3353>_95230,"Ta voix s' affaiblit , Sténio , cria Marino du"
Sand-George_Lelia_<Marino-3353>_95240,bout de la table . Tu sembles chercher tes vers
Sand-George_Lelia_<Marino-3353>_95243,table . Tu sembles chercher tes vers et les tirer
Sand-George_Lelia_<Marino-3353>_95253,avec effort du fond de ton cerveau . Je me
Sand-George_Lelia_<Marino-3353>_95262,me souviens du temps où tu improvisais douze strophes sans
Sand-George_Lelia_<Marino-3353>_95272,"nous faire languir . Mais tu baisses , Sténio ."
Sand-George_Lelia_<Marino-3353>_95275,". Mais tu baisses , Sténio . Ta maîtresse et"
Sand-George_Lelia_<Marino-3353>_95277,"tu baisses , Sténio . Ta maîtresse et ta muse"
Sand-George_Lelia_<Marino-3353>_95280,Sténio . Ta maîtresse et ta muse sont également lasses
Sand-George_Lelia_<Marino-3353>_95286,muse sont également lasses de toi . »Sténio ne lui
Sand-George_Lelia_<Marino-3353>_95304,"frappant sur la table , il reprit d' une voix"
Sand-George_Lelia_<Marino-3353>_95313,"voix plus assurée :Qu' on m' apporte un flacon ,"
Sand-George_Lelia_<Marino-3353>_95319,"apporte un flacon , que ma coupe remplieDéborde et que"
Sand-George_Lelia_<Marino-3353>_95324,"ma coupe remplieDéborde et que ma lèvre , en plongeant"
Sand-George_Lelia_<Marino-3353>_95354,vin qui dévore Et qui m' égale aux Dieux !Sur
Sand-George_Lelia_<Marino-3353>_95359,m' égale aux Dieux !Sur mes yeux éblouis qu' un
Sand-George_Lelia_<Marino-3353>_95375,"confus pâlisse ! et que j' entende , Au milieu"
Sand-George_Lelia_<Marino-3353>_95406,vent qui s' enfuit !Si mon regard se lève au
Sand-George_Lelia_<Marino-3353>_95417,"de l' orgie , Si ma lèvre tremblante et d'"
Sand-George_Lelia_<Marino-3353>_95430,"cherchant un baiser , Que mes désirs ardents sur les"
Sand-George_Lelia_<Marino-3353>_95443,"femmes d' amour , pour mes plaisirs venues , Ne"
Sand-George_Lelia_<Marino-3353>_95454,s' apaiser . Qu' en mon sang appauvri leurs caresses
Sand-George_Lelia_<Marino-3353>_95480,"de leurs fronts soient par mes mains semées , Que"
Sand-George_Lelia_<Marino-3353>_95485,"mes mains semées , Que j' enlace à mes doigts"
Sand-George_Lelia_<Marino-3353>_95488,", Que j' enlace à mes doigts les tresses parfumées"
Sand-George_Lelia_<Marino-3353>_95499,leurs cheveux flottants . Que ma dent furieuse à leur
Sand-George_Lelia_<Marino-3353>_95515,; que leur voix haletante Me demande merci . Qu'
Sand-George_Lelia_<Marino-3353>_95541,"se répondent , Et que je meure ainsi !« Sténio"
Sand-George_Lelia_<Marino-3353>_95545,"que je meure ainsi !« Sténio , tu pâlis !"
Sand-George_Lelia_<Marino-3353>_95547,"meure ainsi !« Sténio , tu pâlis ! s' écria"
Sand-George_Lelia_<Marino-3353>_95559,c' est assez chanter ou tu rendras le dernier soupir
Sand-George_Lelia_<Marino-3353>_95573,". – C' est assez m' interrompre , s' écria"
Sand-George_Lelia_<Marino-3353>_95578,"m' interrompre , s' écria Sténio avec colère , ou"
Sand-George_Lelia_<Marino-3353>_95583,"Sténio avec colère , ou je t' enfonce ton verre"
Sand-George_Lelia_<Marino-3353>_95584,"avec colère , ou je t' enfonce ton verre dans"
Sand-George_Lelia_<Marino-3353>_95586,", ou je t' enfonce ton verre dans la gorge"
Sand-George_Lelia_<Marino-3353>_95593,dans la gorge . »Puis il essuya la sueur qui
Sand-George_Lelia_<Marino-3353>_95600,"la sueur qui coulait de son front et , d'"
Sand-George_Lelia_<Marino-3353>_95613,et pleine qui contrastait avec ses traits exténués et la
Sand-George_Lelia_<Marino-3353>_95624,"bleuâtre qui se répandait sur son visage enflammé , il"
Sand-George_Lelia_<Marino-3353>_95628,"sur son visage enflammé , il reprit en se levant"
Sand-George_Lelia_<Marino-3353>_95636,se levant :Ou si Dieu me refuse une mort fortunée
Sand-George_Lelia_<Marino-3353>_95653,"la fois couronnée , Si je sens mes désirs ,"
Sand-George_Lelia_<Marino-3353>_95655,"couronnée , Si je sens mes désirs , D' une"
Sand-George_Lelia_<Marino-3353>_95676,"flamme ternie , Survivre à mes plaisirs , De mon"
Sand-George_Lelia_<Marino-3353>_95680,"à mes plaisirs , De mon maître jaloux insultant le"
Sand-George_Lelia_<Marino-3353>_95716,en un sommeil glacé tous mes désirs s' éteignent Et
Sand-George_Lelia_<Marino-3353>_95731,"En achevant cette phrase , Sténio devint livide , sa"
Sand-George_Lelia_<Marino-3353>_95735,", Sténio devint livide , sa main chancela et laissa"
Sand-George_Lelia_<Marino-3353>_95739,", sa main chancela et laissa tomber la coupe qu'"
Sand-George_Lelia_<Marino-3353>_95744,laissa tomber la coupe qu' il portait à ses lèvres
Sand-George_Lelia_<Marino-3353>_95747,coupe qu' il portait à ses lèvres . Il essaya
Sand-George_Lelia_<Marino-3353>_95750,portait à ses lèvres . Il essaya de jeter un
Sand-George_Lelia_<Marino-3353>_95759,un regard de triomphe sur ses compagnons étonnés de son
Sand-George_Lelia_<Marino-3353>_95763,sur ses compagnons étonnés de son courage et ravis des
Sand-George_Lelia_<Marino-3353>_95771,ravis des mâles accords qu' il avait su tirer encore
Sand-George_Lelia_<Marino-3353>_95777,avait su tirer encore de sa poitrine épuisée . Mais
Sand-George_Lelia_<Marino-3353>_95795,forcené avec la volonté . Il s' affaissa et Sténio
Sand-George_Lelia_<Marino-3353>_95799,". Il s' affaissa et Sténio , saisi d' une"
Sand-George_Lelia_<Marino-3353>_95813,"par terre sans connaissance , sa tête frappa contre la"
Sand-George_Lelia_<Marino-3353>_95858,"personne ne songea plus à Sténio . Pulchérie , aidée"
Sand-George_Lelia_<Marino-3353>_95871,"et de Trenmor , transporta Sténio sous les ombrages du"
Sand-George_Lelia_<Marino-3353>_95898,"Laissez - moi seul avec lui , dit Trenmor à"
Sand-George_Lelia_<Marino-3353>_95911,c' est à moi qu' il appartient désormais . »La
Sand-George_Lelia_<Marino-3353>_95931,"sur les lèvres froides de Sténio , le recommanda à"
Sand-George_Lelia_<Marino-3353>_95933,"lèvres froides de Sténio , le recommanda à Dieu et"
Sand-George_Lelia_<Marino-3353>_96007,a failli être gâtée dans sa chute . »ClaudiaLorsque Stenio
Sand-George_Lelia_<Marino-3353>_96011,"dans sa chute . »ClaudiaLorsque Stenio reprit connaissance , il"
Sand-George_Lelia_<Marino-3353>_96015,"»ClaudiaLorsque Stenio reprit connaissance , il reçut avec dédain les"
Sand-George_Lelia_<Marino-3353>_96023,dédain les soins empressés de son ami . « Pourquoi
Sand-George_Lelia_<Marino-3353>_96036,seuls ici ? lui dit - il . Pourquoi nous
Sand-George_Lelia_<Marino-3353>_96052,dehors comme des lépreux ?– Vous ne devez plus retourner
Sand-George_Lelia_<Marino-3353>_96064,"compagnons de l' orgie , lui dit Trenmor , car"
Sand-George_Lelia_<Marino-3353>_96073,car ceux - là même vous méprisent et vous rejettent
Sand-George_Lelia_<Marino-3353>_96076,là même vous méprisent et vous rejettent . Vous avez
Sand-George_Lelia_<Marino-3353>_96079,"méprisent et vous rejettent . Vous avez tout perdu ,"
Sand-George_Lelia_<Marino-3353>_96087,"perdu , tout gâté ; vous avez abandonné Dieu ,"
Sand-George_Lelia_<Marino-3353>_96092,"vous avez abandonné Dieu , vous avez usé et mené"
Sand-George_Lelia_<Marino-3353>_96106,choses humaines . Il ne vous reste plus que l'
Sand-George_Lelia_<Marino-3353>_96119,sein de laquelle un refuge vous est toujours ouvert .
Sand-George_Lelia_<Marino-3353>_96129,– Et que fera pour moi l' amitié ? dit
Sand-George_Lelia_<Marino-3353>_96134,moi l' amitié ? dit Sténio avec amertume ; n'
Sand-George_Lelia_<Marino-3353>_96153,", s' est lassée de moi et s' est déclarée"
Sand-George_Lelia_<Marino-3353>_96160,s' est déclarée impuissante pour mon bonheur ?– C' est
Sand-George_Lelia_<Marino-3353>_96165,mon bonheur ?– C' est vous qui l' avez repoussée
Sand-George_Lelia_<Marino-3353>_96173,avez repoussée ; c' est vous qui avez méconnu et
Sand-George_Lelia_<Marino-3353>_96182,et renié ses bienfaits . Malheureux enfant ! revenez à
Sand-George_Lelia_<Marino-3353>_96191,"à nous , revenez à vous - même . Lélia"
Sand-George_Lelia_<Marino-3353>_96196,vous - même . Lélia vous rappelle ; si vous
Sand-George_Lelia_<Marino-3353>_96200,"Lélia vous rappelle ; si vous abjurez vos erreurs ,"
Sand-George_Lelia_<Marino-3353>_96202,"rappelle ; si vous abjurez vos erreurs , Lélia les"
Sand-George_Lelia_<Marino-3353>_96212,"oubliera . . . – Laissez - moi , dit"
Sand-George_Lelia_<Marino-3353>_96213,". . . – Laissez - moi , dit Sténio"
Sand-George_Lelia_<Marino-3353>_96217,"Laissez - moi , dit Sténio avec colère , ne"
Sand-George_Lelia_<Marino-3353>_96225,", ne prononcez jamais devant moi le nom de cette"
Sand-George_Lelia_<Marino-3353>_96240,influence maudite qui a corrompu ma confiante jeunesse ; c'
Sand-George_Lelia_<Marino-3353>_96250,est son infernale ironie qui m' a ouvert les yeux
Sand-George_Lelia_<Marino-3353>_96256,a ouvert les yeux et m' a montré la vie
Sand-George_Lelia_<Marino-3353>_96270,dans sa laideur . Ne me parlez pas de cette
Sand-George_Lelia_<Marino-3353>_96277,pas de cette Lélia ; je ne la connais plus
Sand-George_Lelia_<Marino-3353>_96283,"ne la connais plus , j' ai oublié ses traits"
Sand-George_Lelia_<Marino-3353>_96289,ai oublié ses traits . Je sais à peine si
Sand-George_Lelia_<Marino-3353>_96294,Je sais à peine si je l' ai aimée jadis
Sand-George_Lelia_<Marino-3353>_96307,se sont écoulés depuis que je l' ai quittée .
Sand-George_Lelia_<Marino-3353>_96313,"l' ai quittée . Si je la voyais maintenant ,"
Sand-George_Lelia_<Marino-3353>_96318,"je la voyais maintenant , je rirais de pitié en"
Sand-George_Lelia_<Marino-3353>_96325,de pitié en songeant que j' ai possédé cent femmes
Sand-George_Lelia_<Marino-3353>_96343,", plus ardentes et qui m' ont rassasié de plaisir"
Sand-George_Lelia_<Marino-3353>_96351,de plaisir . Pourquoi irais - je désormais plier le
Sand-George_Lelia_<Marino-3353>_96366,flancs de marbre ? Quand j' aurais le regard embrasé
Sand-George_Lelia_<Marino-3353>_96386,"animer , qu' en ferais - je ? Que me"
Sand-George_Lelia_<Marino-3353>_96390,ferais - je ? Que me donnerait - elle de
Sand-George_Lelia_<Marino-3353>_96405,Il fut un temps où je croyais à des joies
Sand-George_Lelia_<Marino-3353>_96423,est dans ses bras que je rêvais la béatitude suprême
Sand-George_Lelia_<Marino-3353>_96444,". Mais aujourd' hui , je ne crois plus ni"
Sand-George_Lelia_<Marino-3353>_96464,", ni à Lélia . Je connais les joies humaines"
Sand-George_Lelia_<Marino-3353>_96470,connais les joies humaines ; je ne peux plus m'
Sand-George_Lelia_<Marino-3353>_96491,qui a pris soin de m' éclairer . J' en
Sand-George_Lelia_<Marino-3353>_96494,soin de m' éclairer . J' en sais assez désormais
Sand-George_Lelia_<Marino-3353>_96500,en sais assez désormais ; j' en sais plus qu'
Sand-George_Lelia_<Marino-3353>_96513,"être ! Qu' elle ne me rappelle donc pas ,"
Sand-George_Lelia_<Marino-3353>_96519,"rappelle donc pas , car je lui rendrais tout le"
Sand-George_Lelia_<Marino-3353>_96527,tout le mal qu' elle m' a fait et je
Sand-George_Lelia_<Marino-3353>_96531,elle m' a fait et je serais trop vengé !–
Sand-George_Lelia_<Marino-3353>_96541,"Ton amertume me rassure , ta colère me plaît ,"
Sand-George_Lelia_<Marino-3353>_96552,Trenmor . Je craignais de te retrouver insensible au souvenir
Sand-George_Lelia_<Marino-3353>_96564,. Je vois qu' il t' irrite profondément et que
Sand-George_Lelia_<Marino-3353>_96576,de Lélia est restée dans ta mémoire comme une incurable
Sand-George_Lelia_<Marino-3353>_96596,que la santé physique ; son âme est encore pleine
Sand-George_Lelia_<Marino-3353>_96616,"railleur stoïque , s' écria Sténio avec fureur , êtes"
Sand-George_Lelia_<Marino-3353>_96621,"Sténio avec fureur , êtes - vous venu ici pour"
Sand-George_Lelia_<Marino-3353>_96628,venu ici pour insulter à mon agonie ou prenez -
Sand-George_Lelia_<Marino-3353>_96632,à mon agonie ou prenez - vous un plaisir imbécile
Sand-George_Lelia_<Marino-3353>_96639,un plaisir imbécile à déployer votre calme impassible devant mes
Sand-George_Lelia_<Marino-3353>_96643,déployer votre calme impassible devant mes tourments ? Retournez d'
Sand-George_Lelia_<Marino-3353>_96653,où vous venez et laissez - moi mourir au sein
Sand-George_Lelia_<Marino-3353>_96698,»Trenmor baissa la tête et garda le silence . Il
Sand-George_Lelia_<Marino-3353>_96702,et garda le silence . Il cherchait des mots qui
Sand-George_Lelia_<Marino-3353>_96716,de cette fierté sauvage et son cœur était abreuvé de
Sand-George_Lelia_<Marino-3353>_96723,était abreuvé de tristesse . Son austère visage perdit sa
Sand-George_Lelia_<Marino-3353>_96735,et des larmes vinrent mouiller ses paupières . Sténio s'
Sand-George_Lelia_<Marino-3353>_96738,vinrent mouiller ses paupières . Sténio s' en aperçut et
Sand-George_Lelia_<Marino-3353>_96745,"en aperçut et , malgré lui , se sentit ému"
Sand-George_Lelia_<Marino-3353>_96748,", malgré lui , se sentit ému . Leurs regards"
Sand-George_Lelia_<Marino-3353>_96758,se rencontrèrent ; ceux de Trenmor exprimaient tant de douleur
Sand-George_Lelia_<Marino-3353>_96764,"exprimaient tant de douleur que Sténio , vaincu , s'"
Sand-George_Lelia_<Marino-3353>_96776,un sentiment de pitié envers lui - même . La
Sand-George_Lelia_<Marino-3353>_96789,"indifférence , au sein desquelles il vivait depuis longtemps ,"
Sand-George_Lelia_<Marino-3353>_96794,"il vivait depuis longtemps , l' avaient habitué à rougir"
Sand-George_Lelia_<Marino-3353>_96800,avaient habitué à rougir de ses souffrances . Quand il
Sand-George_Lelia_<Marino-3353>_96804,de ses souffrances . Quand il sentit l' amitié amollir
Sand-George_Lelia_<Marino-3353>_96809,"il sentit l' amitié amollir son cœur , il fut"
Sand-George_Lelia_<Marino-3353>_96812,"amitié amollir son cœur , il fut comme surpris et"
Sand-George_Lelia_<Marino-3353>_96822,subjugué un instant et se jeta dans les bras de
Sand-George_Lelia_<Marino-3353>_96827,jeta dans les bras de Trenmor avec effusion . Mais
Sand-George_Lelia_<Marino-3353>_96833,avec effusion . Mais bientôt il eut honte de ce
Sand-George_Lelia_<Marino-3353>_96847,"levant tout à coup , il aperçut une femme ,"
Sand-George_Lelia_<Marino-3353>_96894,". « Décidément , dit Sténio en rajustant le col"
Sand-George_Lelia_<Marino-3353>_96900,en rajustant le col de sa chemise de batiste et
Sand-George_Lelia_<Marino-3353>_96909,"et en l' attachant avec son agrafe de diamant ,"
Sand-George_Lelia_<Marino-3353>_96914,"son agrafe de diamant , je ne puis pas laisser"
Sand-George_Lelia_<Marino-3353>_96924,cette pauvre enfant languir pour moi sans prendre pitié d'
Sand-George_Lelia_<Marino-3353>_96945,. Il y va de mon honneur d' être le
Sand-George_Lelia_<Marino-3353>_96959,vous . »En même temps Sténio tourna la tête vers
Sand-George_Lelia_<Marino-3353>_96973,"Claudia . Un instant , ses narines se dilatèrent comme"
Sand-George_Lelia_<Marino-3353>_96983,"celles du muffoli , lorsqu' il saisit dans l' air"
Sand-George_Lelia_<Marino-3353>_97003,éclair de jeunesse brilla sur son front dévasté . Sa
Sand-George_Lelia_<Marino-3353>_97007,sur son front dévasté . Sa poitrine sembla se gonfler
Sand-George_Lelia_<Marino-3353>_97015,se gonfler de désirs . Il retira sa main de
Sand-George_Lelia_<Marino-3353>_97017,de désirs . Il retira sa main de la main
Sand-George_Lelia_<Marino-3353>_97023,main de la main de son ami et se mit
